,0
2430,"looks, exactly, like, i, would, expect, tech, bro, who, welcomes, racists, onto, his, platform, would, ."
2431,"to, :, quick, ., guess, which, country, produced, two, vaccines, ,, vaccinated, almost, all, its, people, is, helping, the, ...:, and, ,, example, ,, case, my, center, ,, which, is, center, research, neuroscience, i, we, study, developmental, disorders, ,, alzheimer, i, i, i"
2432,"remember, when, silenced, reading, letter, written, by, #, corettascottking, two thousand and seventeen, this, is, what, happens, when, you, give, them, power, ., #, cancelculture"
2433,"and, ,, course, ,, when, you, don, ', i, back, -, up, what, you, say, ,, you, just, change, definition, ', fully, vaccinated, '"
2434,"biden, marks, nine hundred, ,, zero, couid, -, nineteen, deaths, urges, :, ', get, vaccinated, ,, get, your, kids, vaccinated, '"
2435,"i, see, both, sides, troll, ., i, see, that, ninety, %, canadian, truckers, are, vaccinated, working, ."
2436,"i, ', i, double, vaccinated, lol, ."
2437,"and, ..., i, ', i, blocked, ., not, surprise, ."
2438,"so, you, as, someone, who, is, not, black, are, telling, me, black, man, be, offended, ,, lol, ok, just, checking"
2439,"setting, up, brighter, tomorrow, involves, getting, vaccinated, prevent, couid, -, nineteen, today, ."
2440,"i, said, it, before, but, i, ', all, say, it, again, ,, please, get, vaccinated, asap, ., we, are, not, rid, this, curse, but, we, can, limit, damage, by, working, fight, it, together, ."
2441,"vaccinated, people, are, far, less, likely, be, hospitalized, or, die, couid, ., that, ', i, immunity, ."
2442,"my, pancreas, is, not, working, specs, ,, any, number, i, can, call, service"
2443,"do, you, not, realize, military, you, have, get, vaccinated, ., when, you, join, you, have, get, vaccinated, almost, everything, ., so, what, you, ', re, saying, you, don, ', i, know, military, ., i, think, you, need, stop, talking, about, stuff, you, don, ', i, know, ."
2444,"absolutely, ,, school, will, even, tell, you, that, if, you, are, vaccinated, wear, mask, ,, you, can, still, catch, couid, spread, couid, ., no, one, had, wear, masks, back, when, other, flu, i, i, were, out, ."
2445,"no, what, i, am, saying, was, me, he, was, not, saying, less, intelligent, he, said, different, ,, two, different, things"
2446,"proud, my, cast, designers, ., bow, review, :, changing, channels, at, fulton, theater"
2447,"i, agree, with, statewide, vaccine, mandates, ., if, ur, not, willing, get, vaccinated, ., then, u, shouldn, ', i, have, job, ., #, isaidwhatisaid"
2448,"i, i, i, good, with, all, my, decisions, ., nothing, i, hate, more, then, bandwagon, jumpers, lol, -, remember, ., lifting, restrictions, phases, was, announced, before, party, convoy, i, because, large, population, vaccinated, ., or, ,, we, will, see, what, happens, ., it, will, lift, eventually, ."
2449,"same, here, ., half, us, are, vaccinated, half, aren, i, i, it, all, went, through, us, exactly, same, ., people, have, start, admitting, this, ."
2450,"agreed, ., what, blessing, that, you, were, where, you, needed, be, help, her, ., that, those, two, young, women, did, their, part, help, us, awesome, ."
2451,"yep, ,, she, did, say, hiv, &, amp, ;, now, they, ', re, telling, vaccinated, get, tested, hiv, ., smallpox, vaccine, caused, hiv, africa, one thousand, nine hundred and eighty-seven, saves, you, couid, which, you, already, had, ninety-nine, ., nine, %, chance, surviving, but, gives, you, hiv, which, has, much, greater, chance, killing, you, ., happy, now, grinning_face_with_big_eyes"
2452,"weird, i, haven, i, i, heard, that, ., maybe, it, i, i, because, majority, people, are, vaccinated, i, don, i, i, know, ., i, found, this, if, it, helps, ."
2453,"i, just, love, himred_heart, i"
2454,"fox, news, mandated, that, you, be, vaccinated, ."
2455,"last, time, i, checked, joe, is, still, notify"
2456,"fifteen, %, our, population, has, chosen, not, be, vaccinated, ., they, i, ve, ignored, best, medical, advice, two, years, ,, fact, that, their, choice, is, going, kill, their, neighbors, doesn, i, i, matter, them, ., if, you, don, i, i, see, how, that, i, i, deeply, depressing, ,, i, don, i, i, know, what, tell, you, ."
2457,"same, here, ., instead, asking, parents, what, took, them, so, long, finally, decide, get, themselves, or, their, kid, vaccinated, ,, i, try, validate, their, struggle, with, deciding, celebrate, with, them, ."
2458,"you, do, not, see, context, choose, not, that, ', i, fine, ,, i, did, am, not, offended, ,, i, just, find, it, curious, when, people, are, telling, black, people, what, be, offended, at, ,, it, ', i, kind, worrying"
2459,"i, we, got, medical, science, right, ., we, failed, social, science, ., we, failed, how, help, people, get, vaccinated, ,, combat, disinformation, ,, not, politicize, this, ., those, are, places, where, we, have, failed, as, america, i"
2460,"okay, i, i, i, confused, i, thought, jobs, weren, i, i, allowed, force, us, be, vaccinated, face_with_rolling_eyes"
2461,"people, who, are, vaccinated, are, still, dying, because, couid, ., this, is, not, fucking, normal, ."
2462,"we, all, already, know, that, eighty, %, canadians, have, been, vaccinated, ., also, recent, polls, show, that, fifty-four, %, all, canadians, want, all, mandates, end, ., there, are, lots, vaccinated, protesters, who, want, mandates, end, ."
2463,"talked, about, ', boutique, left, i, many, them, are, vilifying, truckers, falsely, calling, out, violence, ., although, i, get, vaccinated, ,, mandatory, vaccinations, are, wrong, ., i, agree, with"
2464,"it, ', i, too, bad, ;, however, ,, i, ', i, unclear, about, him, doing, "", everything, "", avoid, couid, but, he, only, addressed, isolating, ., did, he, get, vaccinated, boosted, that, ', i, not, clear, ., did, i, overlook, that, about, him"
2465,"people, :, "", white, people, saying, i, -, word, is, bad, i, rumble, :"
2466,"my, neighbor, works, at, hospital, she, said, about, six, months, after, first, wave, two thousand and twenty, they, starting, seeing, couid, patients, return, with, strokes, mi, ."
2467,"i, have, lots, friends, who, say, things, like, ,, "", i, worked, hard, ., nothing, was, given, us, ., how, are, we, privileged, "", i, always, say, white, privilege, doesn, ', i, mean, you, didn, ', i, overcome, obstacles, get, where, you, are, ., it, ', i, just, that, color, your, skin, isn, ', i, one, them, ."
2468,"if, you, i, ve, been, vaccinated, still, feel, mortally, threatened, by, virus, ,, please, read, this, ."
2469,"just, get, vaccinated, wear, mask, ., also, those, protesters, are, all, united, states, anyway, ., canadians, aren, i, i, that, rude"
2470,"unsure, about, getting, your, children, vaccinated, against, couid, -, nineteen, infectious, disease, expert, simone, wildest, ,, my, discusses, why, she, elected, have, both, her, children, vaccinated, ."
2471,"clapping_handsmedium_skin_toneclapping_handsmedium_skin_tone, good, they, didn, ', i, shut, down, bum, money, yet, they, did, truckers, ., they, also, allowed, bail, is, bum, rioters, ., just, double, standards, at"
2472,"ok, but, have, you, asked, "", why, does, fully, vaccinated, person, ,, boosted, ,, still, got, couid, ,, even, got, sick, ,, bedridden, "", doctor, whos, lobby, playing, manic, or, can, i, would, ask, all, doctors, regardless, race, ,, political, affiliation, ,, or, whatever, is, their, lobby, to, one, /, two"
2473,"he, also, full, video, laughed, at, how, stereotype, is, that, black, people, talk, alot, theaters, that, is, stereotype, ,, he, said, it, was, fun, he, had, amazing, time, that, theater, ,, so, yes, i, watched, it"
2474,"if, we, ', re, fully, vaccinated, ,, then, why, should, we, wear, mask, doesn, ', i, vaccine, stop, #, covid19"
2475,"bowled, once, got, score, sixty-nine"
2476,"except, exact, opposite, is, true, ., it, ', i, vaccinated, people, that, are, still, paranoid, ,, wearing, masks, hiding, under, their, beds, ., untaxed, have, been, living, normal, start, ."
2477,"my, place, employment, keeps, asking, when, i, i, i, coming, back, unamused_face, i, would, only, consider, going, back, if, i, got, my, travel, assignment, back, but, that, requires, me, get, vaccinated, &, amp, ;, i, i, i, not, so, why, keep, asking, whats, not, clicking"
2478,"holy, heck, people, who, don, i, i, get, vaccinated, are, nuts, unless, they, can, i, i, ,, course, ."
2479,"not, mention, i, omg, one hundred, %, deaths, would, be, among, vaccinated, i, that, scenario, i"
2480,"lieu, still, says, you, need, be, vaccinated, boosted, ., there, is, no, change, his, message, ., no, one, has, ever, said, persons, who, are, infected, with, cv19, don, ', i, develop, antibodies, ., but, that, protection, is, significantly, less, than, being, vaccinated, ., implying, otherwise, is, lie, ."
2481,"they, don, ', i, give, shite, ,, it, ', i, only, coercive, tactic, get, children, vaccinated, like, adults, when, numbers, are, high, enough, ,, voila, ,, masks, won, ', i, be, needed"
2482,"this, is, only, and, time, i, i, ve, gotten, it, ,, first, time, since, i, got, vaccinated, face_with_tears_of_joy"
2483,"i, did, see, that, clip, it, ', i, entirety, did, not, see, racist, intent, ,, it, was, poor, wording, not, racist, entire, video, he, goes, say, how, it, was, hella, fun, was, respectful, black, community"
2484,"i, think, that, leaves, two, likely, possibilities, ., one, ,, is, that, weekly, surveillance, report, excludes, ord, doses, fully, vaccinated, cohort, ., other, possibility, is, that, calculating, untaxed, ,, they, double, counted, subtracting, those, with, three, doses, ."
2485,"sending, prayers, folded_handslight_skin_tonefolded_handslight_skin_tone, your, way, ., i, hope, your, vaccinated, boosted, then, you, i, re, going, be, ok, ."
2486,"this, is, life, @, terrible, #, olympicgames, given, #, covid19, with, #, athletes, already, #, vaccinated, &, amp, ;, still, test, positive, #, covid19, another, #, vaccinesideeffects, #, covidvaccine"
2487,"anyone, here, vaccinated, ,, but, avoiding, booster, what, is, thinking"
2488,"two, /, he, claimed, boys, ', mother, had, them, vaccinated, just, spite, him, ,, because, pat, ', i, mind, ,, everything, is, about, him, ., reminder, that, his, eldest, got, vaccinated, his, own, ., yes, ,, earlier, days, ,, pat, was, one, "", death, jab, "", adherents, ."
2489,"don, con, ', i, discipline, may, indeed, turn, out, be, worse, than, #, dog, ., wake, up, #, virginia, #, preterm"
2490,"i, i, i, pigeon, don, i, i, scare, me, ."
2491,"whole, school, masked, many, vaccinated, got, it, ., all, them, fine, ., masking, young, child, against, something, that, mask, doesn, i, i, protect, them, all, real, science, says, will, not, be, deadly, them, i, is, cruel, ., you, are, cruel, if, you, mask, toddler, ."
2492,"i, now, literally, don, i, i, have, anyone, my, life, friends, or, family, now, i, struggle, alone, ,, but, at, least, i, i, i, not, being, gaslighted, &, amp, ;, told, i, it, i, i, not, that, bad, i, or, i, man, up, i"
2493,"just, took, ace, vet, get, his, two, yr, old, shot, i, white, lady, come, outside, get, him, cause, i, i, i, not, vaccinated, so, i, i, i, not, allowed, inside, i, then, want, me, pay, $, ninety-three, ahead, getting, shot"
2494,"tell, me, again, how, us, is, "", best, country, world, """
2495,"it, mentions, western, ..., i, can, only, guess, ., flushed_facepoor, girls, women, over, there, ..."
2496,"time, you, jets, into, sunset"
2497,"jerome, i, ."
2498,"bright, eyed, fred"
2499,"you, divide, number, dead, by, number, million, valued, or, untaxed, ., so, ,, massachusetts, has, five, ., two, million, vaccinated, ,, i, divide, by, five, ., two, ., that, gives, me, death, rate, per, million, except, i, did, hospitalizations, repeat, other, group, ., ma, ,, divider, was, one, ., six, ."
2500,"i, dont, think, thats, how, it, works, i, adding, single, dot, piece"
2501,""", it, ', i, called, evolution, meghan, ., why, aren, ', i, you, swinging, tree, """
2502,"now, that, i, i, i, done, talking, shit, ., david, ,, i, like, your, hat, ."
2503,"as, safe, as, its, been, we, nurses, ,, doctors, healthcare, workers, who, have, be, constantly, wearing, masks, january, two thousand and twenty, ., i, notice, no, one, cares, about, us, anymore, ., we, were, heroes, two thousand and twenty, but, not, now, ., i, am, fully, vaccinated, ., if, u, i, not, dont, come, talk, up, my, face, period, ."
2504,"report, :, nearly, eighty, %, omicron, cases, are, vaccinated, people, ."
2505,"smiling_face_with_heart, -, eyespurple_heart"
2506,vey
2507,"this, would, be, just, businesses, -, not, schools, hocus, says, she, wants, more, kids, be, vaccinated, before, decision, is, made, masks, schools"
2508,"i, don, i, i, know, that, many, republicans, that, are, still, supporting, tag, are, capable, self, reflection, at, this, point, ,, hana, ."
2509,"are, you, guys, are, going, continue, mandate, your, group, a, ,, i, #, actors, be, vaccinated, ., even, after, senate, usa, is, against, #, foci, recommendations, #, osha, stepped, down, as, well, #, empty, #, sagaftra, #, dna, #, its"
2510,"most, important, thing, do, when, being, attacked, like, this, make, sure, you, have, mask, get, vaccinated, ., #, letsgobrandon"
2511,"this, man, is, terrorist, ."
2512,"today, is, anniversary, viola, ', i, death, sad_but_relieved_face"
2513,"&, amp, ;, are, both, pointedly, hilarious, ., their, comic, relief, is, so, appreciated, these, days, ."
2514,"heck, yea, grass"
2515,"fun, graph, ., guess, when, old, man, david, went, school, ., understanding, that, this, doesn, i, i, go, far, enough, either, way, show, what, his, tuition, costs, or, what, people, going, school, today, pay, ."
2516,"don, i, i, live, there, ., but, everywhere, i, i, ve, ever, lived, ,, requires, vaccinations, ., have, show, doctor, i, i, proof, ,, or, as, you, say, ,, doctor, has, give, professional, reason, not, being, vaccinated, ., not, just, because, i, don, i, i, want, to, ."
2517,face_with_tears_of_joyraising_handsmedium_skin_tone
2518,"very, sad, news, coming, anniversary, her, sister, viola, ', i, death, crying_face"
2519,"why, is, it, so, hard, your, acknowledge, how, dramatically, risk, death, decreases, vaccinated"
2520,"rant, time, :, i, don, i, i, care, what, ny, mayor, eric, adams, eats, ., i, don, i, i, care, if, politician, any, party, takes, picture, with, or, without, mask, ., i, don, i, i, care, if, politician, any, party, is, vaccinated, ., focus, doing, job, you, were, elected, for, ., end, rant"
2521,"he, caught, couid, july, -, was, he, vaccinated, it, doesn, ', i, say, ., while, i, ', i, glad, he, survived, ,, if, he, wasn, ', i, vaccinated, ,, one hundred and ninety-seven, days, hospital, used, lot, resources, ."
2522,"mask, up, get, vaccinated, i, ', i, listening, ', we, ', re, not, gonna, take, it, ', by, twisted, sister, dash, radio, -"
2523,"my, entire, childhood, ,, every, time, when, i, was, soldier, seeking, help, ,, &, amp, ;, just, about, every, time, i, i, ve, struggled, while, relationship, ., so, practically, any, time, i, i, ve, had, others, my, life, i"
2524,"this, person, is, sick, ."
2525,"y, i, all, are, batpile_of_poo, crazy, ., my, son, literally, was, masked, at, school, got, couid, fully, vaccinated, child, ., your, government, science, is, is, i, he, gave, it, his, brother, ., both, over, mild, symptoms, three, days, ., i, your, fear, selective, i, science, i"
2526,"washington, county, wayne, county, we, know, you, ', re, looking, out, us"
2527,"ten, years, experience, ,, masters, ,, we, ', all, give, you, $, eleven, per, hour"
2528,"are, you, black, bow, just, curious"
2529,"just, wear, mask, get, vaccinated"
2530,often
2531,"i, cannot, understand, why, you, would, end, mask, mandates, without, ensuring, everyone, is, vaccinated, ., don, ', i, allow, students, back, building, until, they, ', re, vaccinated, ., otherwise, students, become, breeding, ground, next, variant"
2532,"grateful, everyone, who, wear, mask, public, indoor, places, ,, obey, -, even, though, it, isn, i, i, fun, -, health, mandates, slow, spread, help, reduce, hospitalizations, ,, then, by, freely, choosing, get, vaccinated, ., i, am, happy, be, this, world, with, you, -, thank, you, ., red_heartred_heartred_heart"
2533,"if, they, can, ', i, choose, ,, then, why, do, some, businesses, require, employees, be, vaccinated, ,, others, don, ', i, sounds, like, there, ', i, choice, me"
2534,"this, is, indirect, plug, awesome, player, -, made, product, :, i"
2535,"if, you, are, vaccinated, ,, why, is, mask, necessary, there, should, be, no, need, it, ., vaccine, offers, full, protection, ., vaccinated, should, be, fine, ,, no, need, worry, about, untaxed, ."
2536,"i, know, people, united, states, who, didn, ', i, get, vaccinated, until, really, late, thanks, bolivian, government, ', i, misinformation, campaign, ., i, would, love, see, same, liberal, outrage, currently, being, directed, at, joe, organ, at"
2537,"you, sonofabitch, ,, i, ', i, in, ."
2538,"uk, government, has, admitted, that, once, you, have, been, double, -, vaccinated, ,, you, will, never, be, able, acquire, full, natural, immunity, couid, variants, i, or, possibly, any, other, virus, ."
2539,"i, find, it, curious, all, day, white, people, are, telling, me, as, black, man, what, i, should, shouldn, ', i, be, offended, at, ,, very, curious, ."
2540,"so, i, mean, ,, if, you, don, ', i, want, get, vaccinated, that, is, fine, just, know, that, ', i, part, reason, these, mandates, are, likely, stay, place, while, ."
2541,"there, i, i, no, rational, reason, not, allow, sixplexes, ,, but, there, are, other, choices, besides, two, above, ."
2542,"you, have, lies, us, why, hasn, i, i, mom, told, canadians, that, we, are, lined, up, eleven, jabs, why, haven, i, i, you, been, honest, with, society, share, what, is, your, opinion, if, i, fully, vaccinated, i"
2543,"ah, -, i, thought, it, was, olympic, thing, which, im, not, watching, ., three, us, grad, school, about, two thousand, published, article, canadian, nationalism, ,, which, had, section, basically, saying, "", there, ', i, always, Canada, "", -, there, ', i, always, Canada, loon, at, any, event, ,, even, /, esp, ., outside, canada"
2544,"depends, what, you, mean, by, exploiting, ."
2545,"my, weekly, per, test, ., sad, when, they, know, your, name"
2546,"or, is, it, pregnant"
2547,"i, agree, this, was, foolish, ,, but, he, was, attempting, defend, not, be, racist, ,, joe, organ, i, do, not, think, is, racist, ,, we, are, making, slippery, slopes, why, are, white, people, telling, black, people, what, be, offended, at"
2548,"if, your, kid, is, vaccinated, ,, what, does, it, matter, if, another, kid, is, massless"
2549,"amen, brother, ., perfectly, succinctly, stated, ."
2550,"hopefully, all, goes, well, red_heart, i, adhesive_bandage"
2551,"it, would, be, good, idea, if, all, adults, were, fully, vaccinated, months, ago, ,, before, delta, raged, ,, &, amp, ;, then, omicron, raged, ., but, you, didn, ', i, so, ....., take, some, responsibility, your, misinformation, ,, disinformation, ,, propaganda, ,, all, around, #, cultrightbs, your, #, seditioncaucus"
2552,"proportion, is, probably, fairly, accurate, tbe, ;, problem, with, stencil, et, al, is, that, by, ignoring, base, rates, they, i, re, still, overstating, risk, vaccinated, ,, not, acknowledging, boosters, either"
2553,"well, ..., despite, taking, all, precautions, ,, getting, vaccinated, boosted, ,, rarely, going, anywhere, ,, always, wearing, mask, ,, i, tested, positive, couid, yesterday, ., oh, ,, i, am, high, risk, ., thanks, ,, america, ."
2554,"party_poppermembers, public, are, welcome, join, us, this, weekend, audience, members, must, be, fully, vaccinated, masked, at, all, times, ;, no, food, or, drink, permitted, livestream, is, also, available, at"
2555,"not, all, as, ninety, %, are, vaccinated, it, i, i, just, wusses, that, don, i, i, want, be, vaccinated, that, are, whining"
2556,"happy, birthday, you, ., you, have, my, best, ., happy, celebrating, ."
2557,"if, it, did, affect, child, development, ,, we, would, have, evidence, by, now, countries, where, kids, have, long, worn, masks, ., change, narrative, easy, fix, :, don, ', i, want, kids, wear, masks, get, kids, vaccinated, ., add, mandated, list, school, ."
2558,"it, isn, ', i, you, are, taking, what, he, says, out, context, ,, joe, organ, his, platform, which, bow, i, do, not, listen, much, but, he, seems, ask, alot, questions, says, things, people, don, ', i, or, are, afraid, say, ,, that, ', i, entire, point, have, these, discussions"
2559,"queen, elizabeth, ii, married, her, cousin, ."
2560,"can, ', i, we, have, kumbaya, moment, here, ,, mike, i, am, opposed, mandates, right, -, wingers, getting, vaccinated, ., i, am, favor, liberals, getting, vaccinated, ., i, am, sad, that, trump, got, valued, boosted, ., why, are, we, fighting, #, kumbaya"
2561,"also, ,, what, ', i, with, "", it, ', i, highly, controversial, subpoena, family, member, "", she, was, government, employee, ,, ifs, ."
2562,"i, hope, midterm, voters, are, paying, attention, youngmin, administration, ., republicans, are, simply, incapable, effective, governing, just, century, ., #, votethemallout2022, #, votebluein2022"
2563,"maybe, you, misunderstood, what, i, saiTongue_sticking_out_cheeky_playful_or_blowing_a_raspberry, there, have, been, more, cases, more, deaths, after, vaccine, came, out, ., not, less, ., vaccine, didn, i, i, work, variants, which, were, caused, by, vaccinated, ., omicron, is, cold, ."
2564,"why, do, these, kinds, ministers, have, yell, jump, around, like, that, are, at, born, concert"
2565,"fun, with, graphs, ."
2566,"maj, has, updated, our, vaccine, /, couid, -, nineteen, policy, :, those, that, choose, attend, programs, in, -, person, ,, attendees, must, be, fully, vaccinated, wear, mask, according, local, jurisdiction, rules, ., visit, read, full, statement, ."
2567,"whatever, he, can, ."
2568,"this, is, nice, ., flushed_faceno, where, is, this"
2569,"close, ninety, %, europe, is, vaccinated, is, ., fifty-five, %, americans, ., since, nearly, all, them, are, vaccinated, ,, course, most, their, cases, will, be, amongst, those, who, ', ve, had, shot, ., you, need, learn, how, interpret, data"
2570,"grinning_squinting_facegrinning_squinting_facegrinning_squinting_face, not, even, little, bit, ., i, i, i, no, one, ."
2571,"have, you, tried, this, yourself"
2572,"someone, didn, ', i, read, it, ,, or, maybe, you, just, didn, ', i, understand, ,, that, doesn, ', i, say, they, have, vaccinated, ninety-eight, ., nine, %.., thats, if, they, had, only, given, two, doses, ,, which, they, didn, ', i, ., face_with_tears_of_joy"
2573,"good, you, blocking, these, idiots, ,, zoe, as, person, who, works, at, airport, ,, i, know, first, hand, how, important, it, is, get, vaccinated, ,, wear, masks, ,, social, distance, ,, etc, ., i, find, it, amusing, annoying, that, many, folks, at, my, job, persist, whining, about, this, stuff"
2574,"he, me, is, high, as, hell, when, that, man, is, blasted, he, is, horrid, with, wording, lol, ,, me, he, is, talking, culture, ,, we, think, differently, ,, as, far, as, body, was, talking, genetics, ,, was, it, foolish, sure, ,, racist, not, me, no"
2575,"doctors, say, get, vaccinated, wear, masks"
2576,"what, grounds"
2577,"you, have, one, baby, all, sudden, your, mother, hubbard, ., she, ', i, vaccinated, they, are, not, ., why, don, ', i, you, research, before, you, shoot, your, mouth, off, ."
2578,"live, your, life, as, wise, not, as, fool, ., which, one, are, you, sparklesbackhand_index_pointing_downmedium_skin_tone"
2579,"not, sure, size, you, mean, but, my, last, was, ultra, power, ., $$$$., didn, i, i, do, well, either, bread, or, anything, with, over, ac, flour, neither, does, my, reveille, tbe, have, decided, unless, you, go, super, professional, level, ,, you, are, going, be, hand, kneading, ., you, might, be, best, with, bread, machine, ."
2580,"antibiotics, would, ', ve, changed, entire, course, that, pandemic, ."
2581,"it, ', i, grotesque, ., overt, tacky, opulence, combined, i, /, putin, ', brittle, but, gi, -, enormous, ego, is, just, ghastly, view, ., i, wonder, what, pensioners, russia, think, when, they, see, this"
2582,"caf, seem, have, requirement, be, couid, vaccinated, employment, ., is, that, not, mandate"
2583,"i, looked, up, my, two thousand and twenty-one, lol, history, with, apparently, i, i, averaged, i, two, ., eight, games, league, per, day, last, year, ., quarantine, life, hitting, real, hard, hahaha"
2584,"happy, birthday, ., wishing, you, absolutely, perfect, day, ., happy, celebrating, ."
2585,"add, milk, powder, your, milk, get, more, milk, per, milk"
2586,"weekly, testing, is, no, guarantee, catch, infection, before, they, are, infectious, ., vaccinated, workers, are, :, one, ., less, likely, be, infected, two, ., if, they, are, infected, ,, they, become, non, -, transmissible, quicker, ."
2587,"they, are, fully, vaccinated, outdoors, ,, drama, queen"
2588,"andrew, yang, is, racist, pos, ., case, you, didn, ', i, know, ."
2589,"hi, ,, do, ., hammer, may, want, contact, this, fellow, ,, who, regularly, feeds, wild, deer, his, yard, posts, interactions, youtube, ., it, i, i, pretty, amazing, ,, but, also, may, be, vector, ., he, is, located, somewhere, texas, :"
2590,"one, /, this, is, some, peak, crocodile, tear, is, ., pat, king, ', i, eldest, got, vaccinated, his, own, ,, despite, having, pos, anti, -, baxter, father, ., youngest, was, vaccinated, ,, thanks, pat, ', i, responsible, caring, ex, -, wife, ."
2591,"i, do, not, think, you, are, bad, person, ., why, are, you, angry, at, her, i, am, vaccinated, i, have, had, couid, twice"
