,0
3706,"hey, is, this, you, saying, only, whackos, would, not, get, vaccinated, funny, how, couple, million, bucks, will, change, your, stance, #, cancelspotify, #, joeroganisaracist, #, byespotify"
3707,"you, will, never, get, all, people, be, vaccinated, when, you, make, it, command, ., it, would, been, better, state, importance, school, not, threats, ."
3708,"as, doctor, once, saiTongue_sticking_out_cheeky_playful_or_blowing_a_raspberry, i, there, are, no, i, mild, i, deaths, omicron, i, please, get, vaccinated, ."
3709,"as, someone, who, actually, worked, crime, bill, one thousand, nine hundred and ninety-four, whose, boss, was, one, few, abc, members, who, opposed, it, ish, raven, are, hundred_pointshundred_pointshundred_pointshundred_pointshundred_pointshundred_pointshundred_pointshundred_pointshundred_points, correct, ., black, pal, overwhelmingly, wanted, crime, bill, ., it, had, good, things, biden, got, rid, some, onerous, ones, ."
3710,"i, ', i, vaccinated, wear, mask, ."
3711,"they, claim, it, ', i, "", work, mandates, i, but, rationale, keeps, shifting, ., truth, is, over, ninety, %, canadian, truckers, are, vaccinated, working, ., this, is, tiny, minority, ,, mostly, people, mad, trudeau, won, last, year, ', i, election, far, -, right, agitators, organizing, +, fundraising, us"
3712,"hahaha, i, sometimes, yes, i, but, fox, i"
3713,"accept, reality, ,, with, biden, there, are, sixty-five, %, seventy, %, people, vaccinated, with, donald, trump, "", zero, percent, i, because, there, are, no, vaccines, yet, far, more, people, were, born, under, biden, than, under, trump"
3714,"two thousand, five hundred and seventy-six, couid, deaths, yesterday, united, states, ., it, ', i, not, over, ,, folks, ., get, vaccinated, ., wear, your, masks, ."
3715,"first, lions, are, not, drafting, ab, ., goodwin, could, be, fit, ,, however, ,, probably, will, draft, two, receivers, since, they, have, three, top, thirty-three, picks, ., campbell, will, get, another, year, develop, his, team"
3716,"couid, -, nineteen, hospitalizations, at, asante, have, risen, slightly, since, yesterday, ., please, continue, take, precautions, slow, spread, ., vaccines, help, prevent, hospitalizations, deaths, ., get, vaccinateTongue_sticking_out_cheeky_playful_or_blowing_a_raspberry, get, testeTongue_sticking_out_cheeky_playful_or_blowing_a_raspberry, #, vaccinationsaveslives"
3717,"just, bought, shirt, smiling_face_with_smiling_eyes, hope, it, helps"
3718,"my, fully, vaccinated, son, is, couid, i, his, ith, day, symptoms, ., i, am, fully, vaccinated, &, amp, ;, asymptomatic, ,, but, sharing, air, caring, my, son, ., cac, guidance, is, asymptomatic, vaccinated, people, do, not, need, quarantine, ., so, my, nursing, school, &, amp, ;, hospital, employer, require, me, come, as, usual, ."
3719,"how, is, she, spreading, couid, she, is, fully, vaccinated, standing, six, feet, away, people, she, is, speaking, to, ,, who, are, all, masked, ., i, am, also, assuming, as, member, congress, she, is, tested, regularly, ., glad, see, you, i, re, universal, masking, though, i, clapping_handsmedium, -, light_skin_toneclapping_handsmedium, -, light_skin_toneclapping_handsmedium, -, light_skin_tone"
3720,"it, ', i, all, about, money, grift, ."
3721,"yet, trump, never, told, his, base, get, vaccinated, &, amp, ;, spike, out, against, masks, ., he, his, entire, family, got, vaccinated, secret, lol, ., when, he, told, his, followers, recently, that, he, was, boosted, ,, they, all, booed, him, ."
3722,"have, you, been, vaccinated, yet"
3723,"it, i, i, good, hear, health, care, workers, who, actually, see, what, is, going, with, vaccinated, is, not, vaccinated, couid, ."
3724,"canada, is, nazi, canada, ., it, always, has, been, ,, it, always, will, be, ., human, rights, are, not, enforced, nor, accessible, most, vulnerable, canadians, ., fact, least, vaccinated, group, canada, is, persons, with, disabilities, who, are, also, highest, risk, people, all, canada, ."
3725,"los, angeles, city, council, voted, unanimously, end, drilling, city, public, health, reasons, ., oil_drum, #, losangeles, #, oildrilling, #, fossilfuel, #, publichealth, #, oilwells, #, oil, #, environment"
3726,"your, feelings, are, understandable, ., you, haven, ', i, been, gone, year, yet, after, living, there, decades, ., you, made, right, decision, ."
3727,"i, agree, ., i, ', i, just, not, quite, ready, ,, ever, ,, give, up, these, specific, republicans, they, still, think, it, ', i, one thousand, eight hundred and sixty-five, they, ', re, still, mad, ., well, ,, i, ', i, mad, too, so, are, you, ., stay, that, way"
3728,"i, ', i, hoping, it, will, be, safe, vaccinated, people, travel, by, may, ."
3729,"if, you, lost, your, job, healthcare, it, ', i, because, you, refused, be, vaccinated, doubt, science, so, that, truly, indicates, you, are, wrong, profession, ."
3730,"yes, ., duh, ."
3731,"vaccinated, horny, person_shrugging, i, male_sign, i"
3732,"no, ,, #, istandwithtrudeau, who, is, right, ignore, seditious, i, demands, i, white, supremacist, occupiers, having, tantrum, be, they, do, not, like, consequences, their, freely, made, choice, not, get, vaccinated, ., needs, do, his, job, as, he, is, responsible, mandates, ."
3733,"i, everyone, around, her, is, vaccinated, tested, i, can, you, cite, your, source, this"
3734,"it, has, always, been, requirement, services, be, fully, vaccinated, ., if, they, weren, i, i, board, with, that, ,, they, didn, i, i, belong, anyway, ., you, follow, orders, without, question, service, ,, that, is, requirement, ."
3735,"i, am, vaccinated, oppose, mandates, leaky, vaccine, ."
3736,"he, trash, mandate, as, it, relates, kyrie, is, foolish, he, should, be, able, play, regardless, if, ninety-five, %, nba, is, vaccinated, how, do, it, spread, again"
3737,"two, /, seven, california, couid, -, nineteen, stats, deaths, eighty, ,, five hundred and thirty-nine, +, five hundred and seventeen, hospitalized, ten, ,, five hundred and ninety-five, -, three hundred and thirty-four, down_arrow, i, three, ., one, %, one, -, i, ices, two, ,, one hundred and one, -, eighteen, down_arrow, i, zero, ., eight, %, one, -, i, new, cases, twentyfour, ,, five hundred and forty-five, three, -, day, average, one hundred and three, ., seven, cases, per, 100k, test, positivity, nine, ., five, %, down_arrow, i, four, ., four, %, seven, -, i, vaccinated, seventy-three, ., three, %, fully, eight, ., eight, %, partially, fifty-four, ., five, %, boosted"
3738,"it, i, i, republicanism"
3739,"not, really, issue, ., over, ninety-one, %, truckers, canada, are, vaccinated, against, couid, ., demonstrators, ottawa, obviously, don, ', i, account, majority, trucking, or, truckers, country, ."
3740,"i, had, mild, omicron, two, weeks, ago, ., if, that, is, mild, ,, i, ', i, hate, see, severe, ., i, too, am, vaccinated, boosted, ., rest, ., fluids, ., more, rest, ."
3741,"you, should, still, get, your, kid, vaccinated, reduce, risk"
3742,"..., from, transcript, ,, he, states, that, vaccinated, could, still, contract, virus, ., couid, being, disease, caused, by, sars, -, cov, -, two, virus, ., he, doesn, ', i, mention, transmission, ,, i, have, yet, see, source, where, he, states, transmission, may, go, down, vaccinated, ..."
3743,"i, i, i, sorry, ., it, has, be, so, difficult, stay, strong, ., we, appreciate, all, you, how, do, daily, basis, ., thank, you, all, us, ., sending, big, hugs"
3744,"could, it, be, something, do, with, where, we, were, disease, cycle, when, majority, were, vaccinated, like, how, long, before, or, after, vaccine, people, were, likey, be, exposed, or, infected"
3745,"imagine, working, insurance, company, that, covers, looters, face_with_tears_of_joyface_with_tears_of_joyface_with_tears_of_joyface_with_tears_of_joyface_with_tears_of_joy"
3746,"left, hates, small, businesses, ,, unless, they, sell, notorious, rig, candles, i, vaccinated, af, i, dishtowel, ."
3747,"because, eighty, %, people, who, are, vaccinated, would, most, likely, prefer, knowing, they, are, around, other, vaccinated, people, ,, wouldn, ', i, go, restaurant, that, didn, ', i, screen, ."
3748,""", i, don, ', i, want, wear, mask, "", "", oh, ok, ,, so, you, ', all, get, vaccinated, "", "", no, "", "", you, ', all, refrain, eating, at, bar, restaurant, every, day, attending, sporting, events, "", "", no, "", "", so, you, want, change, nothing, "", "", freedom, """
3749,"another, thing, ,, i, i, i, vaccinated, i, listen, joe, organ, ., it, is, other, things, i, hear, government, lack, communication, that, makes, me, doubt, we, are, being, told, truth, ."
3750,"it, ', i, stain, that, gop, won, ', i, be, able, remove"
3751,"no, i, said, both, them, are, wrong, biden, was, wrong, say, you, can, i, i, get, couid, if, you, i, re, vaccinated, organ, is, wrong, with, his, misinformation, disinformation, ., glad, know, you, i, re, sipping, my, one hundred, millionaire, capitalist, ., i, hope, you, i, re, not, doing, that, free, ."
3752,"they, aren, i, i, i, our, truckers, i, ., i, our, truckers, i, are, out, there, ,, vaccinated, ,, doing, their, jobs, ,, aren, i, i, part, this, occupation, ., extremists, ottawa, just, took, advantage, situation, terrorize, ottawa, residents, ., shame, you"
3753,"that, letter, will, play, well, court, ."
3754,"stop, it, when, i, was, supposed, go, ny, but, i, i, i, not, vaccinated, loudly_crying_face"
3755,"most, canadian, truckers, are, south, indian, ,, vaccinated, ,, not, part, this"
3756,"hoarding, is, not, saving, ., you, are, supposed, use, tax, help, oklahoma, ."
3757,"lot, these, truckers, protesters, are, actually, vaccinated, ., they, are, being, paid, do, this, ., suh, ."
3758,"ninety, %, canadian, truckers, are, vaccinated, ., this, isn, ', i, real, mass, movement, ."
3759,"i, i, i, so, glad, you, got, your, kids, vaccinated, they, are, all, doing, great, hundred_pointsdouble_exclamation_mark, i, thumbs_upface_with_medical_masksmiling_face_with_hearts, everyone, please, retweet, this, message, everyone, you, know, who, needs, help, with, this, horrible, situation, #, vaccinemandate, is, so, totally, important, everyone, help, protect, our, children, family"
3760,"i, am, triple, vexed, so, is, my, family, ., i, don, i, i, disagree, with, effectiveness, it, but, we, have, enough, people, vaccinated, now, should, be, fully, open, business, ., let, i, i, move, on, ."
3761,"i, i, i, so, sick, tired, spoiled, ,, overly, privileged, people, whining, about, their, freedoms, when, people, world, over, are, crying, out, vaccine, ,, you, have, no, idea, ., i, no, longer, care, if, any, you, vaccinate, or, not, ., all, i, care, you, can, stop, your, kids, being, vaccinated, ,, period"
3762,"issue, ,, as, i, understand, it, ,, is, that, they, have, be, vaccinated, cross, border, or, endure, two, week, quarantine, themselves, their, cargo, ."
3763,"normal, people, :, economy, is, crap, ,, everything, costs, $, one thousand, dollars, there, are, so, many, homeless, people, liberals, :, lol, ok, but, like, are, you, vaccinated"
3764,"thank, you, i, am, busy, as, all, hell, today, but, i, had, take, minute, read, this, great, thread, ., few, i, don, ', i, know, single, azalea, banks, song, ., ., ., but, old, man, knows, she, is, pile_of_poo, stirrer, par, excellence"
3765,"then, get, vaccinated, ., stop, listening, wingnut, filling, your, head, with, misinformation, ."
3766,"monday, couid, -, nineteen, numbers, iowa, seventeen, %, fourteen, -, day, test, positivity, rate, eight, ,, six hundred and fifty-seven, total, deaths, six hundred and thirty-eight, hospitalized, fifty-four, ., six, %, not, fully, vaccinated, seventy-one, ., four, %, ia, residents, eighteen, +, fully, vaccinated, seventy-six, ., one, %, ia, residents, twelve, +, with, at, least, one, dose"
3767,"medical, reason, why, i, can, i, i, be, vaccinated, ., person_shruggingmedium_skin_tone, i, male_sign, i"
3768,"reminds, everyone, who, thinks, walter, white, is, ironically, like, coolest, fucking, dude, somehow, hero"
3769,"three, or, four, me, can, ', i, do, one, or, two, never, ever, five, ."
3770,"this, is, what, majority, democrats, ,, actually, ,, majority, americans, ,, wantbackhand_index_pointing_downlight_skin_tone"
3771,"most, truckers, are, vaccinated, i, holding, job, isn, ', i, "", right, "", there, are, strings, attached, ., like, your, job, should, include, journalistic, standards, as, string, hold, your, job, ., i, just, because, you, don, ', i, fear, thing, doesn, ', i, mean, that, thing, isn, ', i, bad, society, ., #, able, #, cannoli"
3772,"that, is, not, true, ., well, risk, very, harmful, disease, can, be, lowered, if, you, are, vaccinated, ,, young, ,, have, no, other, diseases, undiagnosed, neither, ,, eat, vitamins, zinc, ., it, ', i, least, lethal, variant, vaccinated, pal, so, far, ., it, ', i, just, not, true, call, it, mild, by, any, means, ."
3773,"i, think, it, is, so, -, i, move, put, words, someone, ', i, mouth, ., i, hope, couid, is, going, be, decreasing, severity, ,, that, lot, mitigating, strategies, are, going, be, unnecessary, future, ., but, last, may, cac, announced, vaccinated, didn, ', i, need, masks, that, was, premature"
3774,"that, was, #, helmutjahn, i, i, #, thompsoncenter, #, stationeleven, ,, right, some, good, scenes, also, at, #, auditoriumtheater, #, lakepointtower"
3775,"if, they, all, went, home, ,, they, can, eat, their, refrigerator, ., most, truckers, did, right, thing, ,, got, vaccinated, have, continued, work, supplying, our, grocery, stores, ., tell, your, i, starving, i, #, truckers, grow, up, go, home, ., enough, bullshit"
3776,"it, ', i, worth, pointing, out, that, ninety, %, truckers, canada, are, vaccinated, actually, higher, percentage, than, canada, as, whole, ,, but, if, you, dredge, up, dumbest, ,, most, slack, -, jawed, ,, batshit, crazy, bottom, one, %, any, large, group, bring, them, together, ,, results, will, be, pretty, noxious, ."
3777,"wordly, two hundred and thirty-three, five, /, six, white_large_squarewhite_large_squareyellow_squareyellow_squarewhite_large_square, white_large_squaregreen_squareyellow_squarewhite_large_squaregreen_square, white_large_squaregreen_squarewhite_large_squaregreen_squaregreen_square, white_large_squaregreen_squaregreen_squaregreen_squaregreen_square, green_squaregreen_squaregreen_squaregreen_squaregreen_square, cheap, trick, answer, #, wordle233, #, townscaper"
3778,"i, want, #, vikings, have, quarterback, that, i, can, root, for, ., kirk, cousins, is, selfish, by, deciding, not, get, vaccinated, ,, hence, putting, himself, over, team, ,, resulting, missing, biggest, game, year, ., #, skol"
3779,"herself, be, vaccinated, again, ."
3780,"bu, couid, -, nineteen, data, feb, ., six, new, student, cases, :, thirty-eight, new, employee, cases, :, three, new, test, results, :, two, ,, four hundred and twenty-nine, average, result, turnarounTongue_sticking_out_cheeky_playful_or_blowing_a_raspberry, eleven, ., nine, hours, students, fully, vaccinateTongue_sticking_out_cheeky_playful_or_blowing_a_raspberry, ninety-eight, ., seven, %"
3781,"it, ', i, funny, that, people, who, are, so, concerned, about, disclosing, whether, or, not, their, vaccinated, like, they, have, when, they, travel, half, planet, always, say, it, ', i, because, security, concerns, ., it, ', i, ironic, that, they, do, this, smartphone, ."
3782,"finally, getting, my, second, wax, today, i, i, i, gonna, be, soooo, smooth, beaming_face_with_smiling_eyes"
3783,"very, rarely, do, children, parents, like, that, not, grow, up, with, their, own, mental, illnesses, ."
3784,"same, as, convection, oven, ,, but, whole, lot, more, money, ., smirking_face"
3785,"zeke, i, was, just, such, badass"
3786,"no, canadian, is, being, vaccinated, by, force, ., your, rights, are, one hundred, %, intact, ., your, decision, may, affect, your, privileges, ,, though, ."
3787,"public, ,, private, ,, charter, what, state"
3788,"game, "", food, or, not, food, "", can, only, be, played, by, trying, everything, ."
3789,"stay, strong, everyone, is, not, vaccinated"
3790,"standing, up, fascism, isn, ', i, "", far, -, right, i, these, truckers, want, feed, their, families, without, being, forced, get, vaccine, ., even, if, you, ', re, pro, -, vaccine, i, ', i, vaccinated, ,, right, people, decide, what, they, will, won, ', i, put, their, bodies, is, basic, human, right, ."
3791,thinking_facethinking_face
3792,"it, ', i, brutal, ., if, you, support, freedom, you, ', re, labeled, racist, conservative, ., do, you, know, how, many, these, people, fighting, their, freedoms, were, liberal, supporters, tons, ., now, they, ', re, stuck, limbo, trying, figure, out, their, political, affiliation, ., most, them, are, vaccinated, ."
3793,"i, agree, ,, once, gop, bully, ,, always, gop, bully"
3794,"except, no, one, protested, vaccines, ,, maybe, you, should, ask, liberal, media, why, they, keep, lying, you, are, those, sikhs, toronto, white, supremacists, they, waved, canadian, flags, hockey, sticks, this, is, always, was, about, mandates, not, vaccinations, ninety, %, truckers, are, vaccinated, ."
3795,"all, comments, talk, about, vaccinated, loved, ones, that, died, shortly, after, being, injected, ,, or, that, are, disabled, life, ., news, more, at"
3796,"interesting, hear, ,, as, i, ', ve, heard, vaccines, doing, same, individuals, prone, seizures, ,, so, it, would, make, sense, me, that, sars, itself, also, has, similar, impact, ., record, i, support, vaccines, ultimately, ,, virus, worth, avoiding, ,, even, when, fully, vaccinated"
3797,"can, ', i, even, go, my, girls, birthday, dinner, tomorrow, cause, i, don, ', i, have, or, code, downcast_face_with_sweat, sucks, but, i, ', i, still, not, getting, vaccinated, sorry, not, sorry, face_with_tears_of_joy"
3798,"they, didn, ', i, lock, themselves, in, ,, dingus, ., they, taped, door, way, out, ., i, know, ..., thinking, is, hard, work, you, ."
3799,"all, more, reason, him, get, vaccinated, but, hey, what, do, i, know"
3800,"join, partner, i, i, write, democracy, event, #, nationalvoterregistrationday, two, /, eight, ., masked, &, amp, ;, vaccinated, writers, can, opt, in, -, person, attendance, ., ok, postcards, were, handwritten, just, hours, #, voterizer, #, votingrights"
3801,"he, ', i, not, vaccinated, ., i, think, that, ', i, also, his, point, ."
3802,"we, ', re, five, /, five, couid, infections, our, household, ., we, ', re, fully, vaccinated, it, has, been, pretty, mild, ,, but, it, still, sucks, ., i, have, knit, one, /, two, throw, blanket, ., as, voice, actress, i, can, ', i, work, ,, so, i, ', all, just, keep, knitting, ."
3803,""", twenty, -, twentyfive, %, not, vaccinated, "", i, thought, goal, was, seventy, %..., therefore, we, ', re, at, goal, ., cut, bullshit, let, those, not, valued, risk, it, open, everything, back, up, ."
3804,"not, sure, if, you, are, aware, or, not, ,, but, we, have, had, i, test, supply, shortages, i, since, holiday, season, ., it, was, rightly, around, time, that, we, got, hammered, with, whatever, hammered, us, -, including, many, ,, many, vaccinated, people, ., yes, ,, untaxed, too, ,, just, obviously, less, them, ."
3805,"are, your, patients, vaccinated"
3806,"his, vaccinated, family, who, already, had, couid, once, ,, has, it, again"
3807,"partying_faceclapping_handsraising_handsright, -, facing_fistleft, -, facing_fistsmiling_face_with_hearts"
3808,"getting, couid, vaccine, was, waste, time, i, woke, up, feeling, like, i, i, i, so, lynn, had, me, tested, &, amp, ;, it, ', i, positive, again, ,, this, is, and, time, i, ', ve, had, couid, since, i, got, vaccinated, there, will, be, no, more, vaccinations, ,, boosters, or, anything, else, me, #, covid19"
3809,"i, will, never, look, at, our, country, same, way, again, because, how, so, many, denied, severity, virus, &, amp, ;, their, refusal, wear, masks, or, get, vaccinated, because, i, their, rights, i, i, thought, majority, us, were, so, much, smarter, &, amp, ;, tougher, than, this, ., whining, needs, stop, ."
3810,grinning_face_with_smiling_eyesgrinning_face_with_smiling_eyesgrinning_face_with_smiling_eyes
3811,"., has, no, use, facts, -, his, focus, is, spreading, lies, &, amp, ;, hate, ., zhu, was, born, los, angeles, chinese, immigrant, family, ., two thousand and eighteen, ,, she, decided, compete, china, so, she, gave, up, her, american, citizenship, changed, her, name, beverly, zhu, zhu, yi, ."
3812,"over, eighty, %, people, are, vaccinated, including, myself, ., yet, government, won, ', i, drop, this, ., clearly, they, have, zero, end, plan, ., this, protest, is, more, than, just, about, vaccine, mandates, it, ', i, about, all, mandates, including, masks, or, codes, ,, rolling, lockdowns, etc, ., it, needs, end, ."
3813,"masking, &, amp, ;, testing, ,, two, top, tools, getting, through, this, pandemic, course, ,, getting, vaccinated"
3814,"that, white, hoe, pullin, steph, range"
3815,"during, our, move, we, have, had, instances, where, we, could, be, what, is, called, karen, ., honestly, time, has, shown, patience, brings, more, rewards, ., some, are, addicted, crisis, or, have, been, accused, being, doormat, ., time, does, have, it, ', i, rewards, if, you, ', re, able, tolerate, it, ."
3816,"country, that, has, less, vaccinated, people, than, us, what, reason, try, explain, use, portugal, ,, i, will, wait, ."
3817,"i, have, five, grandkids, ages, five, fourteen, ., all, them, have, been, vaccinated, had, couid, recovered, quickly, ., they, do, mask, but, almost, no, one, else, their, schools, do, ., vaccines, work, ."
3818,"when, my, nieces, were, little, my, sil, would, wake, them, with, ', you, ', re, smart, ., you, ', re, pretty, ., but, mostly, your, good, person, others, '"
3819,"they, can, i, i, keep, their, own, stories, straight, ., so, why, do, i, still, have, wear, mask, when, i, i, i, vaccinated, ."
3820,"so, you, i, re, ok, with, not, allowing, food, water, voters, but, you, i, re, ok, with, giving, food, ,, money, gas, vaccinated, truck, drivers, that, are, protesting, vaccine, mandates, ., yeah, that, makes, sense, ."
3821,"but, reason, why, is, much, more, complicated, than, that, ., we, keep, seeing, change, narrative, ., vaccine, was, going, protect, us, then, oh, you, might, get, it, but, you, will, not, spread, it, then, oh, you, might, spread, it, but, you, will, not, end, hospital, then, vaccinated, people, ended, up"
3822,"thank, you, tiff"
3823,"aww, ,, no, ., pensive_face, don, ', i, say, that, ., i, don, ', i, think, you, really, mean, it, ."
3824,"it, still, feels, like, yesterday"
3825,"hello, ,, connecticut, residents, ., if, you, want, see, percentage, your, town, ', i, housing, stock, that, is, considered, affordable, ,, go, here, :"
3826,"this, graphic, is, mind, fry, itself, ., &, amp, ;, great, day, -, i, ', i, really, inclined, believe, your, source, ', i, claim, about, led, being, incorporated, into, daily, routine, like, having, shot, espresso, ., it, ', i, all, so, "", burning, -, man, i, lesque, two, me, i, face_with_rolling_eyesface_vomiting"
3827,"my, wife, had, co, -, worker, who, did, not, want, get, vaccinated, ,, even, when, company, implemented, vaccine, mandate, their, own, staff, ., he, did, responsible, thing, got, new, job, with, local, company, who, doesn, ', i, require, vaccine, ., this, isn, ', i, hard, ."
3828,"there, are, different, pops, by, experts, ., you, seemed, agree, i, /, backing, off, masks, at, school, ., some, experts, think, more, time, is, needed, until, there, are, more, vaccinated, ,, especially, young, children, ., i, ', i, go, side, caution, &, amp, ;, give, it, little, extra, time, ."
3829,"is, she, that, tamara, i, i, mother"
3830,"organize, them, by, height, you, monster, what, are, you, doing"
3831,"i, think, you, need, put, these, out, with, context, ., were, these, young, people, vaccinated, is, that, relevant, does, that, better, inform, people, reporting, news, i, think, so"
3832,"yes, they, ., your, early, childhood, vaccines, are, nothing, like, couid, vaccine, ., you, can, be, vaccinated, ,, spread, couid, still, die, it, ., same, cannot, be, said, those, early, vaccines, ."
3833,"six, it, part, vaccinated, ., what, is, problem"
3834,"my, daughter, -, in, -, law, not, vaccinated, tested, positive, couid, -, nineteen, this, week, ., doctor, told, her, take, vitamin, i, ,, zinc, &, amp, ;, cough, medicine, ."
3835,"not, all, protesters, are, truckers, ., many, are, not, ., wise, up, ., obnoxious, antivaxxers, have, worn, out, their, welcome, ."
3836,"wish, u, knew, how, pal, live, other, parts, world, &, amp, ;, how, privileged, you, are, Canada, &, amp, ;, it, i, i, pal, are, great, ., i, request, truckers, end, protests, &, amp, ;, peacefully, return, important, jobs, u, do, i, all, got, vaccinated, &, amp, ;, must, be, considerate, everyone, i, i, health, ,, happiness, &, amp, ;, safety"
3837,"i, haven, ', i, watched, any, olympics, but, i, ', i, gonna, go, with, jamaican, bobsled, team, ,"
3838,"so, much, jämlika, average, ,, where, kids, cant, get, vaccinated, since, some, kids, socio, economic, disadvantaged, areas, will, not, ..., tell, me, again, what, ', i, argument, why, cant, kids, poorer, areas, get, vaccines, -, dont, they, go, schools, im, lost"
3839,"#, letstalkaboutrace, #, mondaythoughts"
3840,"no, you, don, ', i, ., vast, majority, people, have, very, minor, symptoms, whether, they, ', re, vaccinated, or, not, ."
3841,"please, let, there, be, something, criminal, that, whack, job, navarro, ., crossed_fingers"
3842,"i, feel, very, angry, after, that, last, retweet, ., i, don, i, i, care, about, people, i, i, comfort, anymore, ., people, are, dying, preventable, deaths, ., you, had, be, vaccinated, with, every, other, shot, go, school, /, work, ., this, one, shouldn, i, i, be, different, ., if, you, think, otherwise, ,, grow, up, open, your, eyes, ."
3843,"yeah, right, ."
