,0
1217,"because, it, is, not, about, me, or, you, or, individuals, ., it, is, about, public, health, public, safety, ., opened, up, most, countries, ,, including, canada, are, open, ., we, are, open, with, precautions, as, far, as, i, know, ,, we, can, travel, work, ., be, vaccinated, ,, that, i, i, all, ."
1218,"this, sounds, like, vaccinated, behavior, i"
1219,"same, reason, why, seat, belts, don, ', i, prevent, car, accidents, ., people, are, careless, don, ', i, take, necessary, precautions, this, case, getting, vaccinated, so, that, you, don, ', i, get, other, people, sick, ."
1220,"okay, ,, i, ', i, old, ., i, lost, count, ., this, was, my, childhood, ., i, *, a, *, i, *, i, ,, beverly, hillbillies, ,, carol, burnett, show, ,, cos, news, ,, one, day, at, time, ., kojak, ,, hawaii, five, -, o, ,, andy, griffith, show, ,, mary, tyler, moore, show, ,, good, times, ,, sanford, son, ,, jeffersons, ."
1221,"not, mention, selfish, anyone, not, get, vaccinated"
1222,"i, don, ', i, understand, why, school, ', i, still, have, mask, mandates, ,, we, ', re, all, required, be, vaccinated, you, can, still, wear, one, your, masks, if, your, that, worried, but, why, i, am, still, forced, sit, masked, up, hours, just, learn, person_facepalming, i, male_sign, i"
1223,"truth, i, overcame, i, bug, i, with, chlorine, dioxide, better, than, my, vaccinated, wife, ."
1224,"i, think, this, will, happen, more, often, now, when, parents, disagree, about, vaccines, ., courts, will, likely, side, with, vaccinated, parent, every, time, ."
1225,"i, will, never, understand, why, you, can, ', i, ignore, people, who, choose, not, if, your, vaccinated, your, mask, protects, you, person_shruggingperson_facepalming, i, how, long, are, you, going, live, with, your, mask, face_with_rolling_eyesface_with_rolling_eyes"
1226,"wait, ...., waaaay"
1227,"do, you, have, youtube, channel"
1228,"what, andrew, yang, thinks, joe, organ, is, literally, last, thing, i, care, about, at, this, moment, ."
1229,"ice, cream, trucked, rolled, by, i"
1230,"as, long, as, there, are, idiots, that, don, i, i, get, vaccinated, or, wear, masks, public, ,, it, i, i, never, going, away"
1231,"definitely, true, here, i"
1232,"wow, data, vaccinated, thought, vaccine, didn, i, i, work"
1233,"yes, ,, i, am, health, care, worker, ., i, am, vaccinated, boosted, ., i, practice, all, safety, precautions, as, best, as, i, can, because, nothing, life, is, one hundred, %, other, than, number, itself, ., i, don, i, i, know, if, i, am, carrier, or, if, i, am, near, carrier, ."
1234,"christi, is, bot, account, ., report, block, ."
1235,"vaccine, genocide, confirmed, by, top, doctors, -, death, rates, skyrocket, vaccinated, -, best, news, here"
1236,"we, ', re, stronger, together, ,, chicago, ., check, out, this, awesome, piece, by, ', i, #, protectchicago, campaign, collaboration, with, ., get, vaccinated, boosted, today, ., more, resources, are, available, at"
1237,"death, isnt, only, negative, possibility, couid, ., please, get, vaccinated"
1238,"you, ', re, not, nobody, ,, you, ', re, god, damned, hero"
1239,"no, ,, vaccinated, don, ', i, have, more, chance, ., they, have, more, cases, because, there, are, more, them, because, they, were, stupidly, told, "", hey, ,, you, ', re, vaccinated, ,, go, mingle, """
1240,"hey, ,, this, is, how, it, ', i, done, ."
1241,"so, long, as, he, is, vaccinated, he, should, pose, no, threat, society, unlike, novak, djokovic, lol"
1242,"poor, finn"
1243,"so, why, is, this, guy, still, pundit, good, standing, your, network"
1244,"gary, i, ., rowe, ,, fbi, informer, +, kak, member, reported, his, case, officer, that, mob, would, have, fifteen, minutes, attack, freedom, riders, without, any, arrests, being, made, ., connor, said, he, wanted, riders, be, beaten, until, "", it, looked, like, bulldog, got, hold, them, i"
1245,"i, symptomatic, infection, triggers, remarkable, immune, response, general, population, ,, likely, offering, protection, against, severe, disease, death, few, years, ., if, you, ', re, vaccinated, top, it, ,, your, protection, is, likely, even, better, i"
1246,"also, ,, with, more, more, people, getting, vaccinated, ,, course, number, dead, vaccinated, will, rise, these, are, almost, entirely, elderly, people, ,, few, ."
1247,"that, is, why, ,, children, especially, ,, are, consistently, vaccinated, ., until, immunity, is, established, ., natural, immunity, is, almost, impossible, with, rapidly, changing, variants, couid, -, nineteen, ."
1248,"don, i, i, care, i, vaccinated, are, spreading, couid, they, i, re, also, getting, sick, dying, couid, ., #, vaccinesdontwork"
1249,"what, is, their, source, that, many, deaths, are, vaccinated"
1250,"nope, majority, all, though, vaccinated, still, support, ability, feed, your, families, without, being, discriminated, eliminated, job, that, pays, their, livelihood, all, because, they, aren, i, i, able, have, choice, ., #, freedomconvoycanada2022"
1251,"yep, ,, another, way, impale, herself, needlessly, ., this, act, is, beyond, stupid, what, makes, it, worse, ,, is, that, filmer, did, not, tell, her, what, could, go, wrong, ,, considering, plunger, didn, i, i, see, light, we, wonder, why, pal, don, i, i, get, vaccinated, wonder, no, more"
1252,"my, side, effects, being, vaccinated, ,, boosted, ,, &, amp, ;, maskeTongue_sticking_out_cheeky_playful_or_blowing_a_raspberry, i, worked, regularly, with, public, june, two thousand and twenty, -, dec, two thousand and twenty-one, ,, routinely, close, quarters, with, many, ,, many, strangers, ,, without, ever, getting, couid, ., i, ', ve, been, work, project, at, home, jan, -, feb, two thousand and twenty-two, ."
1253,rich
1254,"it, i, i, settled, ., billions, vaccinated, ."
1255,""", in, that, study, ,, prior, infection, reduced, risk, hospitalization, during, delta, surge, by, more, than, six, compared, with, people, who, hadn, ', i, had, prior, infection, were, not, vaccinated, ., people, who, had, had, both, prior, infection, were, vaccinated, had, most, protection, i"
1256,"simmons, is, vaccinated, according, last, week, report, ."
1257,"yes, kids, brought, it, home, couple, weeks, ago, ., felt, like, hell, ,, glad, i, was, vaccinated, boosted, because, if, that, i, i, what, they, call, i, mild, i, i, don, i, i, want, know, what, other, option, was, ."
1258,"floor, right, dome, is, different"
1259,"i, know, i, get, jitters, if, i, don, ', i, have, my, daily, cheese, intake, ."
1260,"my, ., bergman, was, seriously, injured, suffered, stroke, after, attack, which, left, him, wheelchair, bound, rest, his, life, ., trifling, arse, racist, birmingham, police, commissioner, ,, bull, connor, ,, organized, violence, against, freedom, riders, with, local, ku, klux, klan, groups, ."
1261,"again, with, maxx, certificate, which, i, ', i, not, sure, i, understand, your, point, ., certificate, doesn, ', i, protect, you, ,, vaccine, does, ., so, get, vaccinated, ."
1262,"don, ', i, want, do, what, ', i, necessary, end, pandemic, ."
1263,"grow, up, ., go, home, ., get, vaccinated, ., leave, us, peace, ., #, grifter"
1264,"how, are, u, free, if, your, vaccinated"
1265,"looking, at, all, ignorant, &, amp, ;, hateful, comments, other, parents, school, parent, fu, page, is, both, enraging, &, amp, ;, embarrassing, me, ., how, do, these, people, consider, themselves, responsible, adults, grow, i, up, &, amp, ;, get, yourself, &, amp, ;, your, family, vaccinated, ,, you, selfish, ,, irresponsible, idiots"
1266,"that, ', i, lost, them, now, unless, they, are, willing, risk, death, ., imagine, depression, isolation, they, feel, ., my, medically, vulnerable, father, basically, only, had, church, look, forward, weekly, ,, but, that, ', i, lost, him, now, ,, i, guess, forever, since, people, like, you"
1267,"vaccines, are, supposed, keep, you, getting, disease, you, are, vaccinated, against, ., or, did, you, change, definition, vaccine"
1268,"that, looks, amazing, ., i, make, really, good, homemade, pizzas, too, ., i, ', all, have, make, one, you, one, day, ., probably, won, ', i, be, as, good, as, joe, ', i, though, ."
1269,"or, ......"
1270,"huh, ., see, my, fantasy, world, where, common, sense, is, relevant, ,, mere, fact, that, he, i, i, age, group, where, kids, often, act, erratically, unpredictably, would, be, enough, suggest, they, ought, be, more, closely, supervised, ., person_shrugginglight_skin_tone"
1271,"no, one, is, doing, that, all, time, ., get, real, ., do, we, no, longer, believe, vaccines, i, am, vaccinated, boosted, ., month, after, my, booster, i, was, able, fight, off, couid, few, days, at, home, ., vaccines, are, way, out, this, ,, not, masks, ., we, need, population, that, becomes, immune, ."
1272,"your, ith, ., mandates, are, not, always, political, ., sometimes, are, mandated, save, lives, ., do, you, wear, seatbelt, were, you, vaccinated, as, kid, all, those, are, mandates, ."
1273,"so, true, ......"
1274,"funny, &, amp, ;, yet, ,, not, too, far, reality, ."
1275,"laurie, it, isn, i, i, about, couid, mandates, ,, canadians, follow, mandates, willingly, ., it, i, i, christo, fascist, temper, tantrum, because, they, can, i, i, get, enough, jesus, geeks, come, their, couid, filled, churches, ., canadian, truckers, are, ninety, %, vaccinated, ."
1276,"they, have, similar, viral, loads, after, infection, ., initial, viral, load, exposure, vaccinated, people, get, infected, is, significantly, higher, ., but, ,, after, infection, occurs, ,, viral, load, progression, disease, is, similar, ."
1277,"im, shocked, ,, shocked, i, tell, you, that, pat, king, is, divorced, ., kudos, his, obviously, intelligent, educated, ex, wife, being, responsible, loving, parent, eldest, being, smart, kid, ., i, can, ', i, imagine, what, it, would, be, like, have, this, moron, as, dad, ."
1278,"they, are, large, ., had, plenty, space, at, musty, manor, ,, here, kitchen, is, closet, ., we, don, i, i, ear, as, much, bread, /, pastry, as, when, we, had, houseful, hungry, children, i, but, i, love, taste, once, awhile"
1279,"wondering, which, masks, offer, most, protection, along, with, getting, vaccinated, boosted, ,, experts, recommend, high, filtration, masks, ,, like, news, knows, ,, keep, yourself, others, safe, ."
1280,"but, god, didn, i, i, say, that, :, religious, community, members, talk, god, abortion, via"
1281,"ya, think, you, i, ve, got, that, backwards, ,, ones, dying, were, either, bad, health, or, zero, vaccinated, believe, conspiracy, theories, ,, we, have, more, ballistic, missile, sites, sale, climb, board, read, it, all, science, is, sound, ,, conspiracy, not, so, except, one"
1282,"he, didn, i, i, count, boosted, ,, i, think, i, saw, one, threads, ,, based, cac, definition, i, vaccinated, i"
1283,"what, no, flatter"
1284,"niggas, asked, if, they, swallowed, vaccinated, nut, are, they, now, vaccinated"
1285,"genevieve, hughes, said, she, would, have, been, killed, but, exploding, fuel, tank, convinced, mob, that, whole, bus, was, about, explode, white, bomb, retreated, ., eventually, they, were, rescued, by, local, police, but, no, attempt, was, made, identify, or, arrest, those, responsible, ."
1286,"no, i, the, vaccinated, are, spreading, couid, ."
1287,"thank, you, &, amp, ;, grateful, be, members, ., thank, you, all, you, do, truckers, ."
1288,"it, mitigates, symptoms, at, best, ,, i, personally, ok, know, over, twenty, vaccinated, people, who, all, caught, couid, u, know, it, least, thirty, untaxed, who, all, caught, couid, it, was, cold, at, best, ., no, one, died"
1289,"disabled, people, already, face, lot, obstacles, life, ,, now, millions, people, are, basically, telling, them, their, faces, that, they, don, ', i, care, if, they, die, ., church, ,, school, ,, work, ,, etc, ., are, where, vulnerable, people, were, able, get, much, -, needed, social, engagement, ,"
1290,"show, your, proof, that, vaccinated, people, will, only, live, fifty-five, years, ., that, i, i, proof, i, i, ve, been, asking, for, ., you, say, you, have, accuracy, statistics, ., let, i, i, see, it, ."
1291,"not, only, are, over, ninety, %, truckers, vaccinated, ,, but, canada, is, ith, most, vaccinated, country, world, ., combine, that, with, fact, that, vaccine, has, proven, ineffective, against, transmission, you, will, see, why, pal, are, tired, living, constant, state, lockdown, ."
1292,"just, in, :, connecticut, ', i, daily, positivity, rate, drops, four, ., seventy-seven, i, one hundred and fifty-four, fewer, people, hospital, since, friday, ., hartford, county, has, most, hospitalizations, at, two hundred and seven, ., six hundred and thirty-one, patients, currently, hospitalized, ..., more, than, fifty-one, %, are, not, fully, vaccinated, ."
1293,"oh, come, on, ,...., seriously, ., typical, media, hype, -, couid, is, downside, -, get, vaccinated, move, with, your, life"
1294,"not, ., if, you, thought, yourself, you, i, i, realize, that, government, didn, i, i, bring, emergencies, act, as, they, could, have, ., had, they, ,, we, all, would, have, been, forced, get, vaccinated, ., but, ,, they, didn, i, i, ., you, have, choice, take, it, or, not, ,, just, like, rest, us, ."
1295,"not, get, all, gloom, doom, ,, but, this, is, far, over, ., please, get, vaccinated, /, boosted, ."
1296,"i, am, vaccinated, know, couid, is, real, ., i, think, he, i, i, polarizing, ., person_shrugging, i, male_sign, i"
1297,"they, mandated, ottawa, police, get, vaccinated, ., but, yes, ,, police, members, must, be, having, personal, ethics, twinges, having, do, their, job, right, now, ."
1298,"oooooh, ..., they, ', re, gonna, be, trouble, with, dad, ....."
1299,"agreed, ., you, have, live, ., i, don, i, i, just, mean, survive, virus, ., i, mean, live, ., get, vaccinated, go, live, your, life, ."
1300,"there, could, be, something, about, them, that, i, ', i, not, privy, to, ,, but, yes, ..., i, know, few, families, that, never, vaccinated, their, kids, ,, their, kids, went, public, schools, ., those, kids, are, all, young, adults, now, ,, so, i, ', i, not, sure, if, rules, have, changed, ."
1301,"recovered, my, hair, ., this, time, ritual, with, transylvania, highlights, ."
1302,"recovered, my, hair, with, ritual, with, transylvania, highlights"
1303,"guess, who, can, go, restaurant, ,, gym, or, movie, without, any, restrictions, me, ,, because, i, am, vaccinated, ., honk, honk, bitches, #, freedomconvoycanada2022"
1304,"here, ', i, same, graph, including, just, omicron, wave, date, ., it, ', i, pretty, astonishing, how, closely, least, /, most, vaccinated, counties, ratio, matches, reddest, /, bluest, counties, ratios, both, case, &, amp, ;, death, rates, over, time, ."
1305,"haha, ., nice, comeback, ., i, agree, ."
1306,"uh, ,, yes, it, does, ., because, we, begin, getting, vaccinations, at, six, months, old, every, child, is, vaccinated, before, headstart, unless, one, is, homeschooled, ., by, age, five, ,, you, have, at, least, six, or, seven, vaccinations, ., vaccinations, are, not, new, get, real, ."
1307,"you, see, how, selfish, that, statement, is, i, how, owner, ,, can, u, pay, five, ,, zero, every, game, me, do, what, i, already, get, paid, thirty, million, do, ik, that, ninety-nine, %, players, are, vaccinated, but, i, i, i, making, personal, decision, i, that, is, selfish, arrogant, ., y, i, all, just, don, i, i, get, it, ."
1308,"him, i, vaccinated, looks, pretty, consistent, ., look, at, folks, who, have, died, due, not, being, vaccinated, ., it, ', i, almost, like, ,, i, dunno, ..., vaccine, worked, new, variant, has, been, announced, ., green, line, will, start, climbing, again, ."
1309,"make, point, how, ridiculous, these, mandates, are, ,, here, is, example, ., you, can, get, packed, transit, bus, city, ..., say, ottawa, ., but, you, cannot, get, bus, ottawa, toronto, unless, you, are, vaccinated, ., can, government, can, explain, that, kind, logic"
1310,"may, fourteen, ,, one thousand, nine hundred and sixty-one, ,, mob, kak, attacked, bus, at, aniston, ,, alabama, ., some, ,, having, just, come, church, ,, were, dressed, their, sunday, best, ., one, man, threw, bomb, through, broken, window, ., when, freedom, riders, left, bus, they, were, attacked, by, baseball, bats, iron, bars, ."
1311,"right, side, looks, worse, due, joint, effects, delta, late, summer, which, was, beginning, drop, off, thanksgiving, canada, ten, /, ten, /, two thousand and twenty-one, ,, followed, by, emergence, omicron, dec, /, jan, ., both, game, changers, with, vaccinated, vaccinated, spread, as, "", bonus, "", feature, ."
1312,"congratulations, american, slowly, getting, back, work, ,, back, fun, ., more, who, get, vaccinated, ,, easier, it, will, be"
1313,"stop, whining, get, vaccinated, babies, ."
1314,"so, trump, is, actually, victim, here, ., i, see, ."
1315,"australia, plans, reopen, its, borders, vaccinated, international, tourists, other, visa, holders, first, time, two, years, ., government, plans, reopen, february, twentynine, ."
1316,"i, admit, it, ,, stacey, ,, i, do, think, way, less, people, who, aren, ', i, willing, be, slightly, inconvenienced, prevent, their, fellow, humans, getting, sick, dying, ., these, people, have, relegated, vulnerable, people, either, death, or, life, as, shut, -, ins, ,, i, think, that, is, awful, ."
1317,"i, will, cancel, my, membership, if, you, use, ."
1318,"i, but, much, what, biden, achieved, two thousand and twenty-one, would, have, been, considered, somewhere, between, improbable, impossible, just, months, earlier, i"
1319,"many, us, know, ,, but, need, insta, artist, promotion, ., there, are, ton, creatives, site, that, rely, them, ., they, are, messing, with, algorithm, though, ."
1320,"curious, ,, why, everyone, repeats, statement, i, ninety, %, truckers, are, vaccinated, i, instead, questioning, it, #, novaccinemandates, #, freedomconvoy2022"
1321,"she, is, gross, ."
1322,"try, it, ,, you, ', all, like, it, ., real, #, joy, is, leaving, with, as, little, as, possible, ..., know, you, resisted, ..., that, you, are, strong, ..., that, you, have, power, be, picky, ., #, domorebuyless, ., #, loveamerica"
1323,"not, million, dollars, ."
1324,"freedom, convoy, is, political, protest, against, couid, vaccine, ., catholicism, teaches, self, -, care, regard, others, ., pope, has, spoken, about, need, us, be, vaccinated, ., why, are, you, not, supporting, catholic, teaching"
1325,"can, you, do, non, gluten, breads, /, pastries"
1326,"by, way, before, i, block, you, ,, you, should, know, that, no, canadian, mandate, is, preventing, any, canadian, truckers, crossing, border, ., it, i, i, us, that, requires, them, be, vaccinated, ., have, day, you, deserve, ., thumbs_up"
1327,"sorry, weather, was, so, crappy"
1328,"public, utility, requiring, people, that, travel, all, over, be, vaccinated, seems, obvious, me, ."
1329,"listening, her, is, child, abuse, ...."
1330,"this, is, so, relevant, ., my, uncle, had, who, has, been, vaccinated, but, not, booster, had, couid, -, nineteen, recently, ,, he, had, i, mild, symptoms, recovered, but, end, up, having, myocarditis, ., he, is, doing, better, now, ., couid, related, complications, are, real, ."
1331,"now, this, is, leak"
1332,"more, like, crime, hour, i"
1333,"aren, ', i, truckers, who, are, involved, also, ninety, %, vaccinated, they, actually, made, that, point, themselves, ., convoy, is, about, government, over, -, reach, ,, which, is, just, as, invasive, as, wage, theft, ., maybe, they, should, join, them, add, that, list, grievances"
1334,"let, me, guess, i, wear, mask, ,, get, vaccinated, ."
1335,"so, baz, i, am, fully, vaccinated, i, cannot, speak, about, mask, wearing, it, ', i, not, my, fault, if, your, government, don, ', i, provide, you, with, not, ., you, know, profession, you, were, getting, i, what, it, entails, ., police, go, out, with, nine, guh, look, criminals, it, ak, ., thank, your, service, country"
1336,firefirefirefirered_heartred_heartred_heartred_heart
1337,"have, you, considered, that, lot, these, areas, seventy, -, eighty, %, population, is, vaccinated, eighty, %, people, making, up, less, than, half, hospitalizations, ...."
1338,"never, been, so, happy, be, lesbian, who, has, been, vaccinated, boosted, ."
1339,"exposing, children, virus, because, classrooms, is, child, abuse, ., not, letting, them, get, vaccinated, is, child, abuse, ."
1340,"not, everyone, has, that, luxury, ."
1341,"ninety, %, people, are, vaccinated, ., this, reduced, number, days, they, are, infectious, others, also, reduces, symptoms, hospitalization, ., instead, being, contagious, week, ,, it, reduces, it, about, day, ., that, i, i, how, all, vaccines, work, ., we, need, annual, boosters, variant, like, flu"
1342,"speechless, ..., firefirefirered_heartred_heartred_heartface_with_tongueface_with_tongueface_with_tongueeggplanteggplanteggplant"
1343,"i, don, ', i, see, anti, -, baxters, changing, their, lifestyle, either, ,, they, don, ', i, look, any, healthier, than, anyone, else, they, often, look, far, less, healthy, ., probably, because, it, ', i, pretty, hard, change, poor, habits, ,, no, matter, incentive, ."
1344,"dec, ., fifteen, ., went, italy, christmas, holiday, ."
1345,"well, if, they, crossed, after, with, they, are, vaccinated, or, no, one, at, border, is, actually, paying, attention, i"
1346,"why, do, more, kids, need, be, vaccinated, vaccine, no, longer, stops, spread, ., it, i, i, irrelevant, ."
1347,likely
1348,"yeah, ,, none, this, would, be, happening, if, he, was, playing, full, time, ., i, really, wish, he, i, i, just, get, vaccinated"
1349,"omg, ., teacher, wouldn, i, i, even, apologize"
1350,"not, yet"
1351,"biscuits, gravy, grits, two, white, goods, totally, missing, ."
1352,"this, context, does, fully, vaccinated, mean, booster, doses"
1353,"calling, merrick, garland, where, are, you"
1354,"if, those, two, were, my, only, options, ,, i, ', i, become, lesbian, instead, ."
1355,"we, ', re, trying, cancel, you, ,, that, ', i, not, working, either"
1356,"this, is, gross, mischaracterization, ., vaccines, have, been, centerpiece, last, year, ,, they, ', ve, been, widely, available, most, that, ., what, ', i, holding, people, back, getting, vaccinated, february, two thousand and twenty-two"
1357,"patterson, was, elected, i, /, kak, support, said, integration, would, come, alabama, only, "", over, my, dead, body, "", "", i, will, oppose, with, every, ounce, energy, i, possess, will, use, every, power, at, my, command, prevent, any, mixing, white, negro, races, classrooms, this, state, i"
1358,"good, hear, ., vaccinated, boosted, here, ,, lamenting, there, is, no, vaccine, idiocy, ., stay, safe, well, ., blue_heart"
1359,"when, bum, marches, streets, ..., run, them, over, they, can, ', i, block, traffic, when, we, ask, people, get, vaccinated, ..., where, are, people, streets"
1360,"as, trudy, said, -, supply, chains, are, disrupted, because, couid, ,, inflation, because, couid, ,, climate, change, is, because, couid, -, i, that, is, why, we, are, working, hard, finish, fight, against, couid, -, we, know, unequivocally, tbe, best, way, do, that, is, get, everyone, vaccinated, i"
1361,"answer, :, terms, vaccinated, americans, ,, our, children, are, currently, outnumbered, by, our, adults, ."
1362,"why, wasn, i, i, anyone, watching, what, that, a, -, hole, removed, when, he, was, i, packing, up, i, those, documents, belong, taxpayers, ., wasn, i, i, it, rankin, who, said, he, i, i, walking, criminal, indictment, or, something, that, effect, ."
1363,"wow, ,, good, know, ., i, ', i, still, hopeful, ."
1364,"i, just, don, ', i, know, what, fuck, is, going, on, ., like, every, aspect, my, life, right, now, i, ', i, having, deal, with, complete, incompetence, people, just, not, willing, do, bare, minimum, their, freaking, jobs, ., like, what, fuck, is, going, i, ', i, about, ready, lose, it, ."
1365,"rep, ., jeff, fortenberry, i, -, ne, is, taking, page, twice, impeached, ,, one, -, term, we, occupant, ', i, legal, playbook, ., he, wants, run, office, again, ."
1366,"nah, ., it, was, intended, ., you, need, apologize"
1367,"i, thought, about, it, ."
1368,"absolutely, perfect"
1369,"if, you, ', re, not, vaccinated, good, luck, ."
1370,"oh, my, gosh, pleading_facetwo_hearts"
1371,"if, you, want, see, what, ', i, coming, ,, look, #, israel, today, daily, new, couid, deaths, #, israel, fully, vaccinated, ."
1372,"i, always, wonder, why, people, like, this, think, we, should, give, flying, fuck, about, their, opinion, ., i, brought, book, bar, all, time, ,, when, i, went, bars, ."
1373,"i, thought, she, was, suspended, she, ', i, spewing, hatred, again, ..."
1374,"so, yes, ,, this, battle, public, education, goes, way, way, way, back, ., anyone, remember, this, guy, utah, republican, state, sen, ., baron, osmond, ,, yes, those, osmond, ,, who, tried, make, ending, compulsory, education, as, being, good, teachers, :"
1375,"getting, vaccinated, is, one, best, opportunity, most, us, will, have, help, prevent, suffering, ,, death, disruption, where, we, live, ., vanishingly, small, risk, trivial, inconvenience, ., our, grandparents, went, war, ., we, ', re, being, asked, roll, up, our, sleeves, ., don, ', i, miss, out"
1376,"bitter, ,, party, one, ., ., ., this, piece, ridiculous, dreck, isn, ', i, even, factually, accurate, ,, just, bunch, hateful, bile, directed, against, someone, you, don, ', i, even, know, ., don, ', i, you, have, something, better, do, with, your, time"
1377,"*, john, malcolm, patterson, *"
1378,"death, rates, went, down, even, considering, there, was, pandemic, why, because, majority, people, did, right, thing, wore, masks, social, distanced, themselves, got, vaccinated, ., i, have, lung, issues, have, not, been, sick, last, two, years, because, i, wear, my, mask, #, masks"
1379,"vegan, chocolate"
1380,"dealing, with, assholes, that, are, not, vaccinated"
