,0
3705,"couid, vaccine, by, pfizer, now, has, full, fda, -, approval, ., if, you, haven, i, i, yet, ,, get, vaccinated, ., no, more, excuses"
3706,"breaking, :, pfizer, has, full, approval, ."
3707,"#, breaking, -, fda, has, granted, full, approval, pfizer, #, covid19, vaccine, ., story, coming, ."
3708,"i, the, vaccine, has, been, known, as, pfizer, -, biotech, couid, -, nineteen, vaccine, ,, will, now, be, marketed, as, comirnaty, koe, -, mir, i, na, -, tee, i"
3709,"pfizer, -, biotech, vaccine, will, continue, be, authorized, emergency, use, kids, ages, twelve, fifteen, while, pfizer, collects, necessary, data, required, full, approval, ., decision, whether, authorize, vaccine, kids, younger, than, twelve, could, be, at, least, several, months, away"
3710,"police_car_light, #, breaking, -, ap, pfizer, i, i, couid, -, nineteen, vaccine, gets, full, fda, approval"
3711,"pfizer, -, biotech, vaccine, is, now, fda, approved"
3712,"ok, ,, pfizer, has, full, approval, ., does, that, change, anyone, i, i, mind, i, i, ve, heard, lots, i, it, i, i, not, fully, approved, i, as, reason, why, pal, won, i, i, van, ., now, you, have, it, ., #, getvaccinated"
3713,"fda, fully, approves, pfizer, couid, -, nineteen, vaccine, ., release, linked, below, says, it, will, be, i, marketed, as, i, comirnaty, i, now, ."
3714,"breaking, :, fda, grants, full, approval, pfizer, couid, vaccine, ."
3715,"#, pfizer, couid, vaccine, is, now, fda, approved, ., this, is, really, good, news, ."
3716,"pfizer, vaccine, gets, full, approval, by, ben, guarding, ,, laurie, mckinley, tyler, pager"
3717,"breaking, :, pfizer, i, i, couid, -, nineteen, vaccine, is, now, fully, approved, by, fda, ."
3718,"pfizer, fully, authorized, yo, ., no, more, excuses, ..., get, vaccinated"
3719,"just, like, that, ,, pfizer, vaccine, is, fda, approved, ., blue_heart"
3720,"breaking, :, pfizer, i, i, couid, -, nineteen, vaccine, gets, full, fda, approval, ."
3721,"backhand_index_pointing_rightmedium, -, light_skin_tone, fda, has, given, full, authorization, for, the, use, of, pfizer, ', i, couid, -, nineteen, vaccine, ."
3722,"breaking, :, pfizer, has, now, been, fully, approved, ., expect, see, lot, vaccine, mandates, today, coming, week, ."
3723,"pfizer, gang, officially, official"
3724,"fda, full, approval, pfizer, vaccine"
3725,"all, my, pfizer, babies, stand, up"
3726,"breaking, news, :, fda, grants, full, approval, pfizer, -, biotech, i, i, couid, shot, ,, clearing, path, more, vaccine, mandates, repeat, full, approval, pfizer, is, no, longer, under, just, emergency, authorization, get, your, van, friends, ,, let, i, i, go"
3727,"pfizer, is, fda, approved, ., if, you, are, still, concerned, my, experience, can, help, at, all, ,, please, reach, out, ., i, i, i, happy, share, ., please, ,, if, you, are, medically, able, ,, get, vaccinated, ."
3728,"breaking, :, pfizer, vaccine, is, now, fully, fda, approved, ., warning, i, check_mark_button, here, i, i, hoping, that, those, who, are, still, hesitant, get, vaccine, will, be, more, willing, with, this, big, step, ., #, vaccine, #, pfizer"
3729,"excited, anti, -, baxter, rebrand, after, fda, pfizer, vaccination, approval"
3730,"fda, grants, approval, pfizer, i, i, couid, -, nineteen, vaccine, :"
3731,"fda, give, full, approval, couid, pfizer, vaccine"
3732,"fda, just, fully, approved, pfizer, -, biotech, coronavirus, vaccine, ."
3733,"pfizer, i, i, couid, vaccine, just, got, full, fda, approval, ., so, i, guess, all, anti, -, baxters, will, get, it, now, ,, right"
3734,"one, ours, are, out, school, now, ,, but, you, can, bet, pfizer, fda, approval, timing, right, before, schools, reopen, is, not, coincidental, ., federal, mask, mandates, will, ramp, up, ,, which, will, cause, state, localities, do, same, ., mom, using, scare, tactics, this, am, saying, kids, are, getting, couid, ."
3735,"#, breaking, :, pfizer, i, i, couid, -, nineteen, vaccine, has, received, full, fda, approval, ."
3736,"fda, pfizer, -, biotech, :, couid, vaccine, wins, full, approval, ,, clearing, path, mandates"
3737,"fda, grants, pfizer, vaccine, full, approval, ."
3738,"The, pfizer, vaccine, was, officially, approved, today, against, couid, by, the, fda, United_States"
3739,"pfizer, -, biotech, sars, -, cov, -, two, vaccine, fully, approved, now, by"
3740,"pfizer, just, received, full, fda, approval, ., hopefully, ,, some, fools, get, vaccinated, ."
3741,"breaking, :, grants, full, approval, #, covid19, vaccine, ., others, pending, ., #, breakingnews"
3742,"breaking, :, pfizer, -, biotech, coronavirus, vaccine, wins, full, fda, approval, ,, potentially, persuading, hesitant, get, shot"
3743,"breaking, :, fda, grants, full, approval, pfizer, i, i, couid, vaccine, ,, washington, post, reports"
3744,"#, breaking, :, fda, has, granted, full, approval, pfizer, ', i, coronavirus, vaccine, ."
3745,"anyone, else, see, conflict, interest, former, head, fda, being, board, pfizer"
3746,"#, breaking, :, has, granted, full, approval, #, pfizer, ', i, #, covid19, #, vaccine, ., it, i, i, first, lengthy, process, get, approval, federal, regulators, ."
3747,"fda, just, approved, pfizer, ."
3748,"time, some, you, get, your, shot, now, ., syringe, washington, ap, i, u, ., i, ., regulators, give, full, approval, pfizer, ', i, couid, -, nineteen, vaccine, ."
3749,"two hundred and fifty-five, days, hundreds, millions, doses, since, initial, emergency, use, authorization, december, eleven, ,, two thousand and twenty, ,, pfizer, i, i, couid, vaccine, has, received, full, approval, by, fda"
3750,"police_car_lightpolice_car_light, washington, ap, i, u, ., i, ., regulators, give, full, approval, pfizer, ', i, couid, -, nineteen, vaccine, ."
3751,"anyone, else, see, conflict, interest, former, head, fda, being, board, pfizer, this, is, about, money, ..., murder, depopulation, planet, earth, ..., wake, up, #, america, or, we, will, all, be, dead, very, soon, #, novaccinepassportsanywhere, #, novaccinepassports, #, biden"
3752,"what, exactly, is, your, stance, vaccines"
3753,"my, son, is, immune, suppress, deals, with, other, medical, conditions, ,, just, received, email, him, get, pfizer, booster, ,, we, are, very, positive, vaccines, help, ., good, day, ."
3754,"syringe, will, be, able, to, grant, full, approval, of, pfizer, ', i, #, covid19, vaccine, today, ."
3755,"benefit, side, ,, where, is, age, stratified, data, hospitalizations, deaths, by, van, status"
3756,"fda, should, demand, adequate, ,, controlled, studies, with, long, term, follow, up, ,, make, data, publicly, available, ,, before, granting, full, approval, couid, -, nineteen, vaccines, ,, says, #, covid19, #, covid19vaccine, #, fda"
3757,"i, see, where, they, will, approve, pfizer, vaccine, today, ., conclusive, evidence, its, benefits, ."
3758,"funny, how, vaccine, is, causing, blood, clots, liquid, is, co, -, owned, by, pfizer"
3759,"i, didn, i, i, drink, enough, coffee, before, scrolling, through, dumpster, fire, timeline, facebook, ., anti, -, science, posts, are, exhausting, read, ., happy, pfizer, approval, day, everyone"
3760,"once, we, get, full, fda, approval, pfizer, vaccine, it, needs, be, mandatory, everyone, ., if, you, want, be, part, civil, society, -, go, hospitals, ,, schools, ,, places, worship, ,, train, stations, ,, airports, ,, grocery, stores, ,, restaurants, ,, &, amp, ;, any, other, shared, public, space, -, get, valued, ."
3761,"one, yes, ,, actually, ,, that, is, "", so, much, ask, i, these, vaccines, got, emergency, -, use, authorization, precisely, because, this, is, emergency, two, pfizer, ', i, maxx, is, getting, full, approval, today, ,, so, this, excuse, doesn, ', i, even, work, its, own, terms, :, get, shot, ,, dummy, ."
3762,"former, fda, head, gottlieb, current, $, pie, board, member, ., you, can, i, i, make, better, script, i, there, were, reports, that, pfizer, vaccine, is, going, be, approved, as, early, as, tomorrow, i, pfizer, board, member, scott, gottlieb, says, ., i, i, have, no, reason, believe, that, those, reports, aren, i, i, accurate, ."
3763,"dow, jones, today, ,, futures, rise, as, oil, rebounds, ,, bitcoin, retakes, $, fifty, ,, zero, ;, pfizer, ,, biotech, ,, modern, rally, via"
3764,"i, got, pfizer, no, side, effects, ., i, was, sick, tired, being, pressured, my, family"
3765,"there, are, plenty, pfizer, ., rollout, we, i, re, staggered, every, country, around, world, by, urgency, population, ., if, you, i, re, correct, ,, government, chose, give, it, forty, -, fifty-nine, year, olds, before, pregnant, women, ., which, is, just, wrong"
3766,"but, no, doubt, right, now, ,, pfizer, ', i, vaccine, is, one, having, most, trouble, over, time, ., israel, uk, across, us, here, ."
3767,"new, today, :, approval, expected, #, pfizer, #, covidvaccine, #, todayinaz"
3768,"I, already, have, the, two, doses, of, pfizer, and, I, ', i, still, stealing, oxygen, from, the, world"
3769,"pastor, a, question, ,, if, the, pfizer, vaccine, is, approved, now, if, the, laboratory, and, the, government, would, have, responsibility, ,, it, would, be, good, to, know"
3770,"god, there, are, still, many, people, and, that, pfizer, no, longer, touched, us, ,, or, maybe, #, xochimilco"
3771,"if, this, pfizer, vaccine, is, granted, fda, approval, today, i, i, i, really, gonna, need, i, but, it, i, i, not, fda, approved, i, crowd, get, their, butts, their, local, walgreens, asap, face_with_steam_from_nose"
3772,"morning, tea, ., umbrella_with_rain_drops, i, monday, august, hard, -, pfizer, could, get, full, fda, approval, today, -, philly, school, district, expected, vote, van, plan, this, week, -, gov, murphy, expected, announce, van, mandate, teachers, no"
3773,"incident, #, us206, no, at, pfizer, way"
3774,"is, poised, give, its, full, approval, pfizer, -, biotech, couid, -, nineteen, vaccine, as, early, as, today, ., what, does, this, mean, why, is, it, significant"
3775,"since, we, will, need, show, i, -, card, order, i, re, -, enter, i, society, i, show, us, i, -, cards, from, :, all, white, house, people, ,, top, brass, at, fda, ,, cac, ,, nih, ., top, execs, at, pfizer, ,, modern, ,, i, &, amp, ;, i, ,, +, az, state, governors, top, tier, politicians, that, are, mandating, i, -, cards, ., #, leadbyexample"
3776,"if, pfizer, gets, approval, today, i, hope, that, nos, makes, it, mandatory, schools, ., i, hope, that, powers, that, be, make, it, mandatory, schools, ., we, have, many, that, are, anti, -, van, ., is, it, worth, career, tho, say, i, no, i, i, i, all, take, all, vaccines, you, want, give, me, as, science, teacher, ."
3777,"since, fda, is, about, give, pfizer, full, approval, ,, what, ', i, going, be, excuse, now, not, get, vaccinated"
3778,"no, ,, if, these, jabs, were, not, going, make, you, sick, ,, pfizer, would, not, be, selling, them, ."
3779,"holy, monday, batman, i, both, back, vacation, i, we, are, focused, #, henri, flooding, i, rain, many, hours, still, +, heat, wave, ahead, ., #, pfizer, expected, get, full, approve, today, ., troops, moving, out, #, afghanistan, ,, slower, ., live"
3780,"i, i, i, all, believe, corporations, are, people, when, texas, executes, one, i, pfizer, should, be, first, ."
3781,"what, that, cost, pfizer"
3782,"i, met, african, american, sistah, who, is, nurse, who, was, upset, abt, having, two, take, it, she, said, hospital, had, given, them, last, day, notices, i, told, her, i, took, pfizer, &, amp, ;, i, ', i, ok, so, she, told, me, she, old, take, it, #, dontlisten2thehype"
3783,"monday, morning, 4Happy_face_smiley0, -, seven, abc, seven, -, nine, :, small_blue_diamondfda, approval, sight, :, is, set, give, full, approval, vaccine, as, early, as, today, we, break, down, what, this, means, future, what, changes, you, can, expect, ."
3784,"office, ., fda, will, approve, pfizer, van, tomorrow, which, opens, this, option, you, ., i, believe, you, brian, kids, are, counting, you, too, ."
3785,"south, korea, ,, indonesia, ,, human, ,, bahrain, ,, thailand, ,, viet, nam, ,, use, ,, germany, ,, spain, ,, china, ,, france, ,, norway, ,, denmark, are, all, mixing, vaccines, ., ..., and, we, were, one, first, countries, sign, contracts, with, pfizer, modern, ."
3786,"it, definitely, messed, with, my, cycle, i, had, second, dose, pfizer, day, before, ovulation, thirty-one, day, cycle, ., woke, up, next, morning, horrendous, cramps, ,, later, started, bleeding, ., it, lasted, seven, days, ,, was, terrible, ., apparently, quite, few, people, have, had, similar, ."
3787,"exactly, correct, people, have, stop, drinking, cpu, kool, -, aid, this, issue, ., canada, was, one, first, nations, sign, contracts, with, modern, pfizer, not, enough, people, are, acknowledging, that, fact"
3788,"good, titers, six, months, that, is, ..., and, only, against, sars, cov, one thousand, two hundred and seventy-three, alpha, variant, ., it, will, do, nothing, against, variants, ., it, ', i, too, highly, specific, vaccine, ."
3789,"it, i, i, new, team, song, ., i, hope, you, like, it, my, movie, is, called, #, worstchristmasever, very, first, studio, was, born, #, newcastle, advocate, #, vaccine"
3790,"What, do, you, think, about, mixing, casino, +, pfizer, today, ..., something, is, known"
3791,"no, ,, fda, saw, safety, signals, preliminary, data, requested, both, pfizer, modern, expand, trials, ."
3792,"neither, current, available, vaccines, modern, pfizer, contain, live, or, dead, virus, ., fact, ,, these, vaccines, contain, genetic, information, couid, -, nineteen, help, your, body, produce, immune, response, virus, ."
3793,"ceo, pfizer, is, vaccinated, many, cac, is, vaccinated, ., explain, that, this, black, american, ., what, do, they, know, that, we, don, ', i, ."
3794,"cac, issues, guidance, as, you, probably, know, but, don, i, i, acknowledge, ., their, guidance, is, only, mix, mrna, vaccines, i, exceptional, circumstances, i, they, emphasize, that, pfizer, &, amp, ;, modern, vaccines, are, not, interchangeable, ., ditto, who, ., az, has, never, been, approved, use, us, let, alone, mix, ."
3795,"i, can, ', i, believe, that, people, faced, with, so, much, information, still, are, so, adamant, that, government, is, trying, help, ., graphic, :, woman, goes, into, violent, convulsions, four, days, after, pfizer, jab, as, child, looks, horror"
3796,"they, are, not, ., it, no, not, approved, get, either, #, pfizer, #, covid19vaccine, #, modernfamily, #, futureofwork"
3797,"okay, pfizer, is, supposed, get, full, fda, approval, tomorrow, ., still, no, dice, with, sister"
3798,"i, i, i, still, love, see, more, christian, leaders, urging, people, be, vaccinated, ,, like, pope, did, ,, as, act, christian, love, ,, not, just, personal, decision, they, are, choosing, make, ., but, this, is, still, helpful, step, do, ., kohler, verge, full, fda, approval, pfizer"
3799,"oh, wow, haha, i, pfizer, and, aztrazeneca, great, options, red_heart, i"
3800,"I, don, ', i, know, if, the, pfizer, vaccine, thing, is, true, or, it, just, coincided, with, the, fact, that, I, ', ve, gained, weight, but, my, boobs, are, at, their, peak, mae, see, -, no, -, evil_monkeydrooling_face"
3801,"liar, ."
3802,"pfizer, will, be, fda, approved, monday, ., hospitals, will, most, likely, have, start, mandating, their, employees, take, couid, shot, ."
3803,"i, i, i, pretty, sure, antivaxxers, will, just, claim, fda, was, coerced, by, cac, i, faci, i, scientists, cut, corners, expedite, full, approval, pfizer, vaccine, monday, ."
3804,"#, NAME, ?"
3805,"any, truth, guy, who, is, over, pfizer, not, getting, shot, himself"
3806,"about, ten, of, my, nephews, in, the, usa, were, vaccinated, ,, with, the, pfizer, vaccine, others, with, modern, and, none, of, them, had, a, reaction, ..., i, ...."
3807,"So, far, Pfizer, and, Modern, confer, immunity, for, at, least, eight, months, ,, a, third, booster, dose, will, be, applied, >, sixty-five, a, ., and, people, at, risk, vaccinated, for, the, fourth, quarter, two thousand and twenty-one"
3808,"early, monday, am, start, tomorrow, with, always, amazing, seven, am, eastern, ,, six, am, central, ,, potentially, discussing, pending, fda, approval, pfizer, -, biotech, couid, vaccine"
3809,"ninety-nine, ., seventy-seven, %, survival, ,, I, don, ', i, say, it, ,, the, who, says, it, zero, ., twenty-three, %, is, lower, than, the, percentage, supposedly, offered, by, the, "", ninety-five, i, vaccine, and, even, than, the, arr, zero, ., nine, %, pfizer, ."
3810,"actually, ,, that, i, i, ,, apparently, ,, not, case, ., he, has, admitted, that, he, only, got, first, pfizer, shot"
3811,"what, i, i, your, take, pfizer, #, pie, tomorrow"
3812,"according, to, abcnoticias, ,, pfizer, will, be, the, vaccine, that, will, be, applied, in, guadalupe, ., next, wednesday, will, be, my, immunization, ., raising_handsmedium, -, light_skin_tone"
3813,"so, nice, ., i, ', i, wondering, as, mixed, dose, az, &, amp, ;, pfizer, vaccinated, ., seeing, as, #, fda, doesn, ', i, recognize, az, ., when, are, we, going, receiving, our, and, pfizer, ,, allow, us, travel, #, usa, any, time, frame"
3814,"thanks, to, the, human, team, of, #, navarro, in, miami, and, dose, pfizer, in, the, name, of, god"
3815,"era, dosis, de, pfizer, zany_facezany_facezany_face"
3816,"pfizer, ., the, fatal, discomfort, only, lasted, twentyfour, hours"
3817,"sometimes, i, sit, here, think, about, fact, that, i, can, be, fired, my, job, one, day, because, i, i, i, unable, get, fully, vaccinated, due, allergic, reaction, i, had, first, dose, pfizer, vaccine, i, i, just, want, that, sink, those, who, want, vaccine, mandated, ."
3818,"#, covid19nsw, #, vaccine, #, pfizer, #, modern"
3819,"they, have, done, clinical, trials, necessary, full, fda, approval, &, amp, ;, will, receive, it, tomorrow, ., it, was, administrative, approval, &, amp, ;, not, add, i, i, testing, that, was, pending, ., so, ,, you, i, all, get, pfizer, tomorrow, i, have, empathy, all, vaccine, hesitant, but, info, is, available"
3820,"it, has, emergency, approval, pfizer, is, about, get, official, approval, ., fda, process, takes, time, thankfully, not, play, devil, i, i, advocate, ,, but, fda, also, hasn, i, i, said, don, i, i, take, vaccine, ., there, are, numerous, clear, clinical, trials, that, show, it, works, ."
3821,"that, apodaca, said, Sunday, pfizer, and, put, astra, seneca, clown_faceclown_faceclown_face"
3822,"my, ass, is, fat, with, i, i, like, pfizer"
3823,"they, left, without, a, place, people, who, if, they, had, to, get, vaccinated, in, xochimilco, ,, like, good, sheep, ., they, have, already, been, informed, and, learned, that, pfizer, loses, effectiveness, faster, than, other, vaccines, against, the, new, and, predominant, variant, delta, clown_faceewe"
3824,"anti, -, baxter, kooks, planning, their, pivot, when, pfizer, gets, full, fda, approval, ., significant, amount, research"
3825,"they, not, only, paid, their, own, vaccines, ,, but, were, at, forefront, pfizer, research, ."
3826,"after, fda, formally, blesses, pfizer, vaccine, ,, i, predict, that, i, will, hear, that, fda, was, paid, off, ., tucker, laura, ,, i, i, i, waiting, ."
3827,"Pfizer, is, over, and, xochimilco, is, emptied, ., you, see, asses, yes, ."
3828,"swear, god, my, pfizer, chip, got, activated, ., good, way, nothing, feels, same, that, things, are, going, too, well, lol"
3829,"too, late, i, got, pfizer"
3830,"pfizer, princess, has, ring, it, ., OK_handmedium, -, dark_skin_tone"
3831,"wait, until, tomorrow, when, fda, is, expected, announce, full, approval, pfizer, vaccine, ., they, won, i, i, have, i, it, is, only, emergency, use, approved, i, anymore"
3832,"face_with_tears_of_joyface_with_tears_of_joyface_with_tears_of_joyestou, like, this, I, was, vaccinated, with, pfizer, I, took, the, last, dose, in, april, ,, my, daughter, came, back, to, university, in, person, she, got, delta, and, on, friday, the, with, i, got, it, from, her, i, ', i, burst, without, smell, taste, fever, pain, etc, etc, the, only, consolation, and, could, be, dead"
3833,"wrong, ., pfizer, is, not, best, by, far, ."
3834,"i, i, i, trying, imagine, how, nefarious, actor, i, pfizer, ,, maybe, i, would, manage, cover, up, ade, israel, ,, uk, ,, us, i, simultaneously, &, amp, ;, secretively, ., how, such, scandalous, conspiracy, could, last, long, enough, insulate, them, being, sued, out, existence, ,, executives, jailed, life"
3835,"ok, so, the, other, option, would, be, pfizer, in, pill, form, maybe, my, agony, wouldn, ', i, be, so, sad, smiling_face_with_sunglassessmiling_face_with_sunglassessmiling_face_with_sunglassesthinking_facethinking_face"
3836,"oral, ,, in, which, module, did, you, apply, the, pfizer"
3837,"granted, ,, couid, -, nineteen, was, "", emergency, use, authorization, i, does, not, make, it, "", experimental, i, fda, creates, hoop, after, hoop, jump, thru, ., my, brother, had, pfizer, ,, i, had, i, &, amp, ;, i, ., but, we, are, our, sixty, ', i, ., i, have, never, had, vaccine, ,, ever, ., i, did, him, ., he, had, stroke, three, y, ago"
3838,"i, did, first, shot, jan, i, second, feb, ., pfizer"
3839,"lots, doctors, are, being, ordered, not, discuss, anything, but, vaccine, ., where, are, such, directives, coming, concern, health, ordinary, people, ,, or, groups, pressured, by, pfizer, or, corrupted, captured, government, agencies"
3840,"my, third, pfizer, shot, ,, flu, shot, ,, trap, booster, defending, me, this, fall, ."
3841,"neighbor, with, it, was, with, the, vaccine, ,, always, if, it, was, the, pfizer"
3842,"today, the, pfizer, lot, ran, out"
3843,"pfizer, expected, get, fda, approved, tomorrow, military, pushed, out, vaccine, will, be, mandatory, us, about, month, or, two, ago, is, now, officially, signed, that, dod, has, have, vaccine, by, sept, fifteen, ., there, is, regulation, that, allows, them, forcefully, give, it, us, ."
3844,"no, one, is, saying, this, those, who, took, injection, are, sick, dying, ., this, is, propaganda, ., pfizer, already, made, over, $, job, you, don, ', i, think, they, ', re, going, front, another, $, ab, keep, this, cash, cow, alive, pfizer, is, only, tippy, top, this, massive, money, iceberg"
3845,"i, i, ve, been, curious, what, side, effects, third, shot, would, be, i, been, dreading, them, ., i, had, pfizer, shot, ,, was, very, fatigued, few, days, ., but, ya, gotta, do, what, ya, gotta, do, ., confused_face"
3846,"i, took, pfizer, vaccine"
3847,"it, i, i, beautiful, day, get, couid, -, nineteen, vaccine, right, here, at, college, green, with, i, i, mobile, unit, ., we, are, here, til, six, i, ., i, ., pfizer, or, i, &, amp, ;, i, i, your, choice"
3848,"there, ', i, no, cure, just, treatment, ., pfizer, didn, ', i, take, trump, ', i, cash, ., they, are, business, making, money, their, shareholders, ., that, ', i, how, it, works, ."
3849,"unfortunately, my, best, friend, childhood, now, sixty-one, years, old, died, after, and, dose, pfizer, ., she, just, wanted, right, after, and, shot, ,, little, things, ., then, boom, three, weeks, later, hospital, ., all, organs, failing, ,, three, cardiac, arrests, gone, ., no, prior, heart, issues, crying_facecrying_face"
3850,"discussed, with, full, fda, approval, pfizer, syringe, -, big, step, enabling, private, entities, mandate, syringe, continued, strains, to, hospital, -, bed, ,, staff, ,, supply, down_arrow, i, sparrow, i, syringe, but, don, ', i, use, them, as, criteria, icu, beds, -, will, amplify, generational, racial, disparities, healthcare, ."
3851,"president, trump, believes, that, vaccines, his, administration, conjunction, with, pfizer, modern, are, safe, effective, fon, ', i, you, wonder, why, it, is, main, stream, democrat, owned, media, who, pushed, months, lack, safety, only, while, trump, was, president"
3852,"and, how, was, it, because, there, was, pfizer, there"
3853,"spotted, bushwhack, waiting, my, and, pfizer, shot, @, bushwhack"
3854,"show, me, safety, data, ., we, need, honest, conversation, not, bunch, propaganda, ., where, are, fda, safety, boards, why, hasn, i, i, there, been, open, briefing, safety, why, does, modern, pfizer, get, hide, their, data, safety, ., let, i, i, have, open, conversation, ."
3855,"maybe, he, bought, some, pfizer, stones"
3856,"it, ', i, not, that, easy, ,, what, a, coincidence, today, there, is, no, pfizer, and, there, are, no, more, problems, in, xochimilco, ."
3857,"yup, ,, modern, is, larger, dose, than, pfizer"
3858,"It, is, not, true, ,, what, a, coincidence, today, in, Xochimilco, they, are, no, longer, applying, Pfizer, and, the, problems, are, over, ."
3859,"my, seventy-four, year, old, dad, so, went, walgreens, got, ord, shot, ., albeit, modern, after, his, first, two, jan, /, feb, were, pfizer, face_with_tears_of_joy, ., doesn, i, i, seem, that, state, is, tracking, anything, ., i, i, all, wait, my, turn, booster, who, november, ."
3860,"friends, for, saying, that, the, pfizer, vaccine, didn, ', i, hit, me, today, I, can, ', i, feel, my, arm, sendhelp, loudly_crying_face"
3861,"i, have, very, smart, cousin, who, is, pa, that, was, involved, pfizer, clinical, trials, ., i, have, physician, friend, adamantly, opposed, can, van, ., both, very, smart, ,, but, opposite, ends, spectrum, van, politics, ., that, i, i, our, world, right, now, ."
3862,"try, today, ., It, seems, that, there, are, not, so, many, people, anymore, ,, the, problem, is, that, there, is, no, Pfizer, ,, they, are, applying, siva"
3863,"definitely, having, some, insulin, resistance, ord, pfizer, shot, as, i, i, ve, taken, you, since, waking, up, i, still, am, inbetween, two hundred and twenty, -, two hundred and thirty, i, i, Skeptical_annoyed_undecided_uneasy_or_hesitant"
3864,"big, tobacco, along, with, i, big, pharma, will, buy, up, all, most, profitable, legal, weed, ops, who, took, all, early, risk, &, amp, ;, grew, their, business, where, phillip, morris, or, i, &, amp, ;, i, ,, pfizer, or, xyz, hedge, fund, would, target, them, ., but, what, about, fasttracking, blkppl, i, weed, convictions, into, bigness"
