,0
1146,"i, wish, i, would, ., i, will, tell, her, but, i, have, done, that, showed, her, what, is, happening, now, pregnant, women, who, are, not, vaccinated, ., i, am, hoping, that, now, pfizer, vaccine, has, been, approved, that, it, will, be, requirement, ., i, would, much, rather, hear, her, complain, about, that, ."
1147,"promotion, values, is, good, ., it, is, incomprehensible, that, people, complain, when, pfizer, spends, its, own, money, promote, their, vaccine, ."
1148,"no, prob, i, i, i, not, sure, how, it, works, ja, but, if, you, have, choice, get, them, pfizer"
1149,"let, pfizer, management, decide"
1150,"pop, up, clinics, so, walk, -, in, site, at, regina, airport, sunday, -, tuesday, ,, august, twentynine, -, thirty-one, ,, nine, :, zero, am, i, 3Happy_face_smiley0, i, ., i, ., pfizer, &, amp, ;, modern, please, get, vaccinated, ., it, is, simplest, way, help, others, our, community"
1151,"pfizer, six, month, controlled, trial, had, ask, participants, ,, with, ask, taking, shot, fifteen, dying, ,, ask, taking, placebo, fourteen, dying, ., that, ', i, compelling, evidence, that, it, saves, lives, needs, be, mandated, any, questions, sir"
1152,"i, don, ', i, know, that, drug, but, corvus, has, stopped, all, symptoms, ., i, got, two, pfizer, vaccines, but, don, ', i, plan, booster, ., i, ., i, ., means, our, immune, system, is, so, high, that, our, body, is, attacking, itself, ., get, gastric, bypass, not, sleeve, ., its, laparoscopic, procedure, better, than, sleeve"
1153,"oh, its, not, experimental, anymore, fda, ok, ', i, pfizer, ."
1154,"i, i, i, still, stuck, my, refrigerator, ,, lucky, crossed_fingerstomatoleafy_greenbaconwine_glassbottle_with_popping_corkmy, final, dose, pfizer, vaccine, has, magnetized, me, i, i, all, miss, all, those, #, superspreaderrallies, where, she, gave, us, all, billed_capcrown, #, billiard, she, be, ,, we, still, kissing_face_with_closed_eyeskiss_markher, as, we, clap, revelryclapping_handscall_me_hand"
1155,"i, have, #, covid19, i, am, fully, vaccinated, with, #, pfizer, god, damn, it, ."
1156,"antivaxxers, :, you, trust, pfizer, your, viagra, i, why, not, trust, them, your, couid, vaccine"
1157,"early, winter, get, it, done, faster"
1158,"no, ., not, that, old, ., i, got, two, pfizer, shots, which, should, be, good, me, ."
1159,"pfizer, doesn, ', i, just, make, vaccine, lol"
1160,"who, is, she, ???, I, bear, a, sin, ,, but, a, pfizer"
1161,"two, surgeries, unfortunately, due, symptoms, eleven, days, ago, ,, two, ., both, were, positive, ., been, fighting, this, thing, since, then, ., fully, vaccinated, since, march, with, pfizer, ., no, walk, park, ."
1162,"pfizer, vaccine, is, not, available, good, thing, i, already, got, mine, six, months, ago"
1163,"#, ccahssun, i, seedling, another, successful, #, pfizer, couid, -, nineteen, vaccination, clinic, is, complete, ., thank, you, our, #, ca, staff, that, worked, make, this, opportunity, available, ."
1164,"everyone, i, know, who, had, modern, reported, symptoms, ., i, had, pfizer, tho, ."
1165,"vaccinated, ,, two, doses, ,, calico, ,, pfizer, ., never, infected, couid, until, now, ,, fifty-six, years, old, ."
1166,"got, my, last, dose, if, pfizer, today, #, covid19"
1167,"they, had, put, on, law, but, changed, their, minds, when, the, problems, appeared, ., and, well, they, are, waiting, for, the, pfizer"
1168,"checks, out, ., #, getvaccinated, #, covid19vaccination, #, getvaxxed, #, pfizer"
1169,"i, i, i, strongly, considering, getting, booster, shot, ord, as, it, i, i, been, six, months, ., since, i, had, two, days, fever, symptoms, with, my, second, modern, shot, ,, i, am, hoping, i, i, all, be, clear, within, couple, days, after, that, ., also, wondering, if, i, can, get, pfizer, booster, instead, ., thinking_face"
1170,"now, that, the, vaccination, has, already, been, announced, from, eighteen, to, twentynine, in, the, port, of, veracruz, ,, the, playlist, needs, to, be, announced, ., and, that, the, vaccine, will, be, pfizer, ."
1171,"my, mom, is, immunocompromised, &, amp, ;, ,, her, provider, ,, let, her, know, she, i, i, eligible, ord, vaccine, ., she, got, pfizer, this, am, &, amp, ;, she, i, i, feeling, good, so, far, ,, already, back, at, work, ., she, said, ,, i, i, i, i, feeling, good, ,, no, me, duele, el, bravo, ., all, andábamos, tres, edoras, con, arthritis, ., pleading_faceloudly_crying_facefolded_handsmedium_skin_tonepurple_heart"
1172,"it, was, slightly, more, annoying, week, or, so, after, pfizer, ., but, nothing, dramatic, ., better, safe, than, delta, variant, sorry, ."
1173,"can, i, i, make, this, shit, up, face_with_tears_of_joy, modern, pfizer, now, ruling, world"
1174,"is, pfizer, board, member, scott, gottlieb, ever, introduced, that, way, nope, he, i, i, former, fda, commissioner, ."
1175,"elmhurst, ,, queens, go, get, vaccine, if, you, haven, i, i, yet, today, yes, ,, they, have, fda, -, approved, pfizer, vaccine, available, @, it, ., bartholomew, ', i, roman, catholic, church"
1176,"yes, ,, pfizer, is, only, ninety-five, %, effective, ., that, ', i, why, it, is, so, important, everyone, get, vaccinated, ."
1177,"i, had, i, &, amp, ;, i, march, blood, test, showed, no, antibodies, july, ., got, pfizer, right, away, ., my, do, ., said, that, is, now, my, booster, ."
1178,"good, ., i, &, amp, ;, i, march, july, had, get, pfizer, i, booster, i, because, blood, test, showed, zero, antibodies, i, &, amp, ;, i, march, ."
1179,"our, vaccination, event, has, been, huge, success, is, still, happening, now, you, can, join, us, till, up, your, second, dose, pfizer, vaccine, raising_hands, we, also, still, have, limited, supply, first, doses, available, if, you, i, re, looking, get, vaccinated, #, pfizervaccine, do, us, more, info, clapping_hands"
1180,"no, ,, i, had, pfizer, vaccine, ,, which, is, fda, approved, real, vaccine, ., consider, yourself, reported, again, ."
1181,"I, have, not, had, and, I, already, have, my, two, Pfizer, vaccines, in, Cuernavaca"
1182,"yall, saw, headline, ,, fda, approved, pfizer, vaccine, ,, ran, out, got, vaccinated, ., yall, didn, ', i, read, story, ;, approved, pfizer, vaccine, isn, ', i, even, market, yet, ,, even, has, different, name, i, sooo, what, did, you, just, get, injected, with, that, ', i, right, ,, experimental, drug, ."
1183,"virus, database, has, been, updated, ., pfizer, two, ., checkmark, i"
1184,"adjacent, question, :, is, it, better, stack, i, &, amp, ;, i, or, modern, top, double, pfizer, vaccination, ,, or, just, stick, single, platform"
1185,"i, ', ve, gotten, booster, ord, pfizer, no, problems, i, i, don, ', i, want, make, anyone, sick, ,, i, live, elderly, community, i, help, them, ., i, don, ', i, want, die, either, #, immunocompromised, i, refer, perfectly, healthy, twelve, yr, old, who, died, couid, nineteen"
1186,"i, seventy-four, %, fully, vaccinated, with, pfizer, ,, modern, i, companies, leaving, hug, because, nsa, uncertainties, or, certainties"
1187,"where, i, i, lie, ., #, isaidwhatisaid, #, getvaccinated, #, covidvaccine, #, pfizer"
1188,"i, got, my, vaccine, company, time, i, as, mandates, ,, i, don, i, i, think, any, employer, wanted, liability, requiring, vaccine, that, was, not, fully, approved, ., now, that, pfizer, is, approved, list, companies, with, mandates, is, growing, very, rapidly, ."
1189,"is, addressing, the, issue, poorly, :, we, need, them, to, return, to, school, with, the, highest, level, of, protection, possible, ,, denying, them, vaccines, to, adolescents, aged, twelve, to, eighteen, is, what, has, complicated, this, issue, ., In, addition, ,, the, Pfizer, vaccine, is, already, valid, for, people, over, six, years, of, age, ."
1190,"i, people, given, both, doses, pfizer, -, biotech, vaccine, were, almost, six, -, fold, more, likely, contract, delta, infection, seven, -, fold, more, likely, have, symptomatic, disease, than, those, who, recovered, i"
1191,"loudly_crying_face, miss, pfizer, wearing, me, out, hold"
1192,"if, you, already, have, a, pfizer, vaccine, ,, it, is, recommended, to, give, johnson, or, another, dose, of, pfizer, considering, that, the, person, has, medical, conditions, of, asthma, for, greater, protection"
1193,"who, paid, this"
1194,"conclusion, :, i, people, who, recovered, bout, couid, -, nineteen, during, one, earlier, waves, pandemic, appear, have, lower, risk, contracting, delta, variant, than, those, who, got, two, doses, vaccine, pfizer, inc, ., biotech, se, i"
1195,"they, were, meant, reduce, risk, getting, couid, -, nineteen, which, they, do, reduce, chances, being, hospitalized, dying, couid, -, nineteen, which, they, are, resounding, success, ., israel, ,, pfizer, is, still, ninety-four, %, at, doing, latter, ."
1196,"finally, getting, my, and, dose, pfizer, i, i, i, scared, i, i, i, gonna, feel, like, wastebasket"
1197,"who, has, taken, pfizer, booster, ord, shot, did, you, have, side, effects, please, compare, contrast, shot, two, is, shot, three, ."
1198,"is, currently, enrolling, participants, clinical, trial, potential, oral, treatment, option, ., learn, about, their, clinical, trial, people, recently, diagnosed, with, couid, -, nineteen, ., see, if, you, qualify, ."
1199,"Well, ,, which, one, did, they, put, on, you, ?, I, put, on, the, Pfizer, and, it, was, just, inconvenience, ."
1200,"me, not, two, pfizer, vaccines"
1201,"would, like, see, data, ., according, fda, i, i, press, conference, approving, pfizer, written, approval, is, joke, there, have, been, zero, deaths, ."
1202,"got, but, /, pfizer, #, three, at, four, am, yesterday, ., slept, ok, ., deltoid, quite, sore, very, mild, general, malia, ., temp, control, normal, thus, far, at, sixteen, hours, ., will, likely, take, it, easy, today, ."
1203,"if, they, did, ,, it, was, probably, using, ord, pfizer, booster, shot, ."
1204,"having, trouble, remembering, new, name, pfizer, couid, vaccine, just, think, target, lady, trying, say, i, community, i"
1205,"recent, i, breakthrough, i, saw, him, thus, -, fri, him, ,, i, /, i, pfizer, march, -, april, ,, mi, forty-two, ,, exposed, eight, /, eleven, ,, per, -, eight, /, thirteen, ,, +, eight, /, seventeen, ,, more, sob, ,, admit, eight, /, twenty-seven, ,, eighty-nine, %, ra, ., per, neg, eight, /, twenty-seven, ,, so, remdesivir, denied, ., virus, gone, /, cleared, immunized, ,, but, i, damage, already, done, i"
1206,"one, real, -, world, study, captures, risk, myocarditis, with, pfizer, van, while, another, noted, even, far, greater, risk, myocarditis, after, suffering, couid, disease"
1207,"couid, -, nineteen, vaccine, technologies, have, been, studied, years, used, other, treatments, without, issue, ., mrna, vaccines, ., vaccines, made, by, modern, pfizer, -, biotech, are, best, ."
1208,"can, you, compare, that, amazon, ,, pfizer, ,, modern, i, i, i, hell, thrown, get, back, me, ., then, let, me, know, which, one, them, is, not, dependent, govt, assistance, or, tax, dollars, ., go, i"
1209,"please, pray, our, personal, nice, great, nation, ., we, have, cold, government, which, has, abandoned, our, troops, ., this, same, government, has, sold, us, out, ;, take, faulty, vaccine, virus, which, has, ninety, i, survivability, rate, ."
1210,"my, lil, sister, getting, all, pfizer, up, today"
1211,"first, two, are, sinopharm, three, &, amp, ;, four, pfizer"
1212,"#, covid19vaccine, shedding, is, very, real, very, dangerous, ., learn, more, than, what, you, ', re, told, believe, ., #, covid19, #, covidiots, #, pfizer, #, vaccineshedding, #, vaccinelies"
1213,"does, anyone, close, source, have, knowledge, when, vaccinations, will, be, available, under, twelve, parents, need, know, ., thank, you, ., #, covidvaccine"
1214,"young, man, with, crown, ', i, disease, liver, problems, gets, pfizer, vaccine, i, has, powerful, message, anyone, putting, off, getting, jab, #, newsbreak"
1215,"my, fil, manifested, shingles, following, pfizer, vaccine, ., seventy-one, years, old, ."
1216,"had, pfizer, i, two, ., no, reaction, ., i, am, eighty-four, years, young"
1217,"it, took, little, while, ,, but, my, ninety-three, yr, old, grandmother, is, fully, vaccinated, feeling, healthy, red_heart, i, vaccineissafe, #, pfizer, #, fdaapproved"
1218,"not, gonna, lie, having, this, level, fatigue, ,, lightheadedness, brain, fog, that, i, usually, get, when, i, take, nyquil, is, pretty, stressful, ., i, ', ve, been, drinking, my, crazy, strong, coffee, too, ,, cuz, otherwise, my, ass, would, ', ve, been, bed, twentyfour, /, seven, ., shout, out, this, pfizer, vaccine, folded_hands"
1219,"pfizer, bubbles"
1220,"zero, ., pfizer, van, ., folded_hands"
1221,"got, my, pfizer, booster, today, as, i, will, be, flying, out, ca, want, be, sure, i, don, ', i, function, as, typhoid, mary"
1222,"i, had, no, problems, after, either, shot, ., did, you, get, pfizer, or, modern"
1223,"The, twentynine, -, year, -, olds, arriving, for, #, vaccination, on, Monday, at, the, port, #, veracruz, smiling_face_with_sunglasses, #, vaccinate, here, is, the, callright_arrow, i, it, ', i, your, turn, #, pfizer, please, it"
1224,"pfizer, agreed, value, each, life, they, took, at, $, 175k, usd, ., how, generous, ."
1225,"you, guys, are, aware, pfizer, paid, out, biggest, fine, $, ab, history, be, they, killed, twelve, african, children, &, amp, ;, injured, two hundred, while, secretly, testing, unapproved, experimental, meningitis, medication, them, right, this, was, recent, ., two thousand and nine, ., read, book, or, see, movie, constant, gardner"
1226,"you, won, ', i, believe, me, but, since, I, put, on, the, pfizer, my, bust, has, grown, hahahahaha, and, I, love, pfizer, I, hope, they, stay, like, this, forever, rolling_on_the_floor_laughing, at, least, in, what, I, have, money, for, surgery, smiling_face_with_halo"
1227,"my, seventeen, year, old, got, pfizer, vaccine, jan, /, feb, because, she, works, at, my, daycare, ., she, is, already, six, months, post, vaccine, ,, so, she, is, window, declining, protection, serious, illness, ...., and, she, goes, school, with, unmasked, /, untaxed, kids, teachers, ."
1228,"i, got, my, and, dose, pfizer, today, first, shot, felt, literally, nothing, ., and, felt, like, two, second, pinch, ., my, arm, is, little, sore, /, heavy, ., thats, it, ., please, get, vaccinated, everyone, folded_hands, i, want, normal, life, back, that, wont, happen, unless, we, work, together, ., unless, we, all, do, this, togetherpurple_heart"
1229,"my, whole, family, has, pfizer, or, modern, ., worst, side, effect, was, my, wife, i, i, headache, low, grade, fever, ., that, i, i, all, i, i, ve, seen, so, that, i, i, all, i, can, speak, to, ."
1230,"here, in, veracruz, they, will, also, apply, pfizer, ., clown_face"
1231,"same, here, ., neuropathy, vaccine, ., i, have, had, no, problems, with, pfizer, one, ., maybe, it, i, i, just, something, do, with, one, he, received, i, don, i, i, know, i"
1232,"i, wish, i, bumped, into, fellow, ., maybe, i, could, get, my, second, pfizer, shot, make, me, fully, valued, eyes, usa, ., i, mixed, so, am, not, presently, considered, so, ."
1233,"help, develop, potential, oral, treatment, option, couid, -, nineteen, ., they, are, currently, enrolling, participants, ., learn, more, about, clinical, trial, testing, oral, investigational, drug, couid, -, nineteen, ."
1234,"contracting, beating, couid, provides, better, protection, against, delta, variant, than, pfizer, shot, ,, new, research, shows"
1235,"i, end, feel, no, side, effects, pfizer, i, prolly, cuz, i, was, sleep"
1236,"eight, /, cue, pfizer, ceo, cackling, like, maniac, growling, that, we, must, take, booster, every, year, forever, gotta, give, it, those, evil, fucks, ,, great, biz, plan, ., continuing, ., if, u, must, get, your, first, jab, ,, wait, until, you, see, comirnaty, branding, fda, insert, ., ask, four, insert"
1237,"ok, ,, but, it, is, not, even, credible, that, half, the, world, is, breaking, up, to, make, the, pfizer, shareholders, live, the, life, of, a, scrooge, ..., then"
1238,"does, anyone, know, that, none, vaccines, that, i, being, given, have, been, approved, by, fda, ., when, you, get, your, next, pfizer, shot, ,, ask, them, if, it, i, i, i, comirnaty, i, because, that, i, i, what, i, i, approved, by, fda, ., all, rest, are, still, under, era, ., look, it, up, &, amp, ;, see, yourself, ."
1239,"i, had, two, pfizer, shots, ,, no, side, effects, except, little, sweating, first, one, ., you, i, all, be, fine, smiling_face_with_smiling_eyes"
1240,"my, ., quiz, excuse, me, I, imagine, that, the, second, dose, is, astra, seneca, ., you, know, it, ., since, it, is, the, one, that, corresponds, ., because, first, is, pfizer"
1241,"#, attention, #, veracruz, From, August, thirty, to, September, three, ,, the, vaccination, day, against, covid19, will, be, held, for, people, aged, eighteen, to, twentynine, in, the, municipality, of, Veracruz, ., the, drug, that, will, be, applied, is, that, of, pfizer, ., the, modules, are, as, follows, ."
1242,"when, vaccine, receives, fda, i, i, full, approval, ,, it, i, i, no, different, than, shot, people, have, been, getting, months, ., it, just, means, we, have, even, more, data, proving, that, it, works, is, safe, ., #, pfizer, #, vaccineswork, #, vaccinessavelives, #, thisisourshot"
1243,"ugh, ., we, have, couid, tracker, school, district, reports, each, school, number, cases, ., i, am, counting, down, days, until, pfizer, releases, data, fda, approves, vaccine, two, up, ."
1244,"well, this, full, blooded, german, ,, american, got, his, second, pfizer, vac, week, ago, ., they, need, get, vad, ."
1245,"biden, i, pfizer, i, not, sure, what, either, have, do, with, pointing, out, facts, ,, unless, you, ', re, taking, me, saying, both, sides, are, same, as, somehow, being, pro, one, side, -, which, would, be, ironic, since, you, are, clearly, one, side, is, wrong, one, side, is, right, i"
1246,"at, packed, townie, supper, club, ., really, testing, pfizer, limits, tonight, ., fingers, crossed, i, don, i, i, get, breakthrough, infection, ., #, nowhammies"
1247,"great, stuff, this, is, pointing, vac, efficacy, pfizer, two, shots, rapidly, diminishing, after, six, -, eight, months, impact, booster, shot, increasing, vac, efficacy, sixty, +, vac, population, ., i, think, ab, down, -, right_arrow, i, then, sparrow, i, after, ord, shot, distribution, over, time, will, correlate, with, data, ."
1248,"i, got, hit, by, train, one, night, right, after, my, second, pfizer, dose, but, first, one, was, nothing, ."
1249,"We, continue, with, #, vaccinationcovid19, forty-two, vaccines, #, pfizer, and, nine, #, modern, #, 30pcr, tests, in, orlando, in, pierson, fly, #, pfizer, #, modern, #, 41pcrtests"
1250,"new, :, #, pfizer, has, earned, more, than, its, competitors, ,, raking, $, ten, ., eight, billion, i, one, ., nineteen, trillion, first, half, this, year, that, i, i, not, including, #, boostershots, coming, your, way, september, #, pfizerprofits, #, pfizerleak, large_blue_diamond"
1251,"people, who, recovered, bout, couid, -, nineteen, during, one, earlier, waves, appear, have, lower, risk, contracting, delta, variant, than, those, who, got, two, doses, vaccine, pfizer, inc, ., biotech, se, ., actually, i, had, both"
1252,"pfizer, #, three, has, laid, ., me, ., out, ."
1253,"i, got, my, second, dose, earlier, today, now, i, feel, super, sleepy, ., but, ,, i, i, i, always, tired, so, it, may, be, unrelated, person_shruggingmedium, -, light_skin_tone, i, female_sign, i, #, pfizer, #, saturdayvibes"
1254,"per, la, times, ,, once, drug, is, fully, approved, like, pfizer, vaccine, is, ,, doctors, can, give, prescriptions, ., doctors, should, immediately, start, prescribing, it, people, who, are, high, risk, who, are, six, months, out, ., hows, ,, high, risk, severe, couid, pal, ,, etc, ."
1255,""", the, natural, immune, protection, that, develops, after, sars, -, cov, -, two, infection, offers, considerably, more, shield, against, delta, variant, pandemic, coronavirus, than, two, doses, pfizer, -, biotech, vaccine, ..."""
1256,"because, they, give, names, every, drug, they, create, ., otherwise, we, i, i, have, billion, i, pfizer, i, i, i, shelf, ., good, grief, ."
1257,"pfizer, booster, update, :, #, cac, ', i, advisory, committee, immunization, practices, #, acid, meets, monday, @, am, must, review, risk, /, benefit, analysis, ,, grade, assessment, ,, &, amp, ;, evidence, recommendation, framework, ., agenda, posted, now, but, not, materials, ., watch, here, :"
1258,"well, truth, is, truth, #, pfizer, #, vaccinetruthadvocate, #, viagra, #, ed, #, gottagetitup, #, erectiledysfunction, #, couid, #, covid_19, @, arlington, ,, texas"
1259,"fda, takes, only, months, approve, pfizer, jab, yet, cannabis, remains, schedule, one, despite, centuries, data"
1260,"good, grief, ,, many, vaccines, that, have, been, used, decades, require, boosters, we, are, uncharted, territory, i, couid, ones, but, i, will, get, pfizer, booster, sure, beats, going, hospital, or, worse, ."
1261,"your, very, naive, there, are, countless, factual, reports, people, who, took, vaccine, ,, experienced, side, effects, nose, bleeds, ,, becoming, paralyzed, ,, blood, clots, ,, organ, failure, ,, death, fifty, percent, pfizer, employees, refuse, vaccine, ., don, i, i, censor, reports, side, effects"
1262,"still, no, regulation, number, cycles, per, test, is, run, ., gravy, train, is, running, testing, lab, ,, buy, bunch, pfizer, ,, then, crank, it, over, forty, whereupon, it, produces, ninety-seven, %, false, positives, ., instant, pandemic, ."
1263,"you, have, way, too, much, blind, faith, entity, that, is, even, more, corrupt, than, big, tobacco, ., bug, pharma, ., current, as, this, week, :, israel, has, pfizer, at, forty-one, %, effective, ., japan, i, i, moh, confirmed, modern, has, metal, it, i, that, responds, magnets, i, &, amp, ;, country, threw, out, all, one, ., am, doses"
1264,"good, afternoon, do, ., listen, yesterday, to, his, interview, with, lore, ., I, want, to, ask, you, ,, the, following, ,, if, I, already, vaccinated, my, eighteen, -, year, -, old, son, with, astra, in, a, one, dose, fifteen, days, ago, ,, can, I, give, him, the, two, of, pfizer, ., since, he, doesn, ', i, want, a, two, of, astra, because, he, didn, ', i, do, well, in, the, one, ., thanks"
1265,"I, am, very, happy, because, my, two, daughters, have, already, been, vaccinated, with, #, pfizer, here, in, Canada, in, a, shopping, center, and, the, experience, was, incredible, ., They, were, very, kind, and, explained, carefully, before, and, after, the, application, everything, that, it, involved, and, what, they, should, be, careful, about, ."
1266,"more, cautionary, news, ,, get, your, twelve, +, year, old, pfizer, jab, asap, ., at, children, i, i, hospital, ,, wave, young, patients, struggling, breathe, -"
1267,"fda, ', i, approval, pfizer, couid, vaccine, is, not, justified"
1268,"i, had, lot, people, that, i, know, that, had, pfizer, they, had, no, problems, either"
1269,"I, will, vaccinate, again, but, now, with, pfizer, I, don, ', i, know, ,, the, net, scares, me, pleading_facepleading_facepleading_face"
1270,"pfizer, #, two, done, thumbs_upmedium_skin_tonesyringeadhesive_bandage"
1271,"i, have, friend, who, i, thought, was, anti, -, van, except, he, went, got, his, first, pfizer, dose, day, after, it, was, approved, ., these, people, do, exist, ."
1272,"i, mrna, is, extremely, fragile, ., fact, ,, it, i, i, only, thing, this, world, more, fragile, than, male, ego, i, why, modern, pfizer, i, i, vaccines, have, be, stored, at, such, low, temperatures, face_with_tears_of_joyface_with_tears_of_joyface_with_tears_of_joyface_with_tears_of_joyclapping_handsclapping_handsclapping_handsclapping_hands"
1273,"help, the, pfizer, made, me, horny, ., weary_faceweary_face"
1274,"why, do, dudes, trust, pfizer, with, their, erectile, dysfunction, but, not, vaccine"
1275,"en, us, fda, approves, pfizer, biotechs, vaccine, joe, biden, encourages, employers, require, vaccines, latest, couid, updates, ar, aancycz, index_pointing_up, slightly_smiling_face"
1276,"just, received, my, and, dose, pfizer, vaccine, ., let, ', i, see, if, i, grow, third, eyeball, ,, two, more, testicles, lose, ear, lobe, by, morningside, ., face_savoring_food, #, pfizer, #, couid, #, vaccine"
1277,"ex, pfizer, ., zero, side, effects, ., will, get, booster, as, soon, as, allowed"
1278,"had, pfizer, yesterday, ., very, similar, and, shot, ., sore, arm, ., low, grade, fever, last, night, ., mild, chinese, ,, lightheadedness, ,, fatigue, today, ."
1279,"well, ,, i, held, off, long, enough, ., got, my, first, dose, pfizer, today, ."
1280,"pfizer, modern, vaccines, were, tested, against, fetal, cell, lines, 1000s, generations, removed, aborted, fetus, ., this, is, true, many, /, most, drugs, that, you, or, i, take, ., i, hope, you, are, well, ., you, are, missed, two"
1281,"i, &, amp, ;, i, is, basically, mickey, mouse, vaccines, out, there, ., modern, or, pfizer, are, way, go, ."
1282,"hahahahaha, all, ., pure, mayate, but, with, the, pfizer"
1283,"trials, have, been, over, quite, some, time, ,, honey, ., vaccines, are, all, final, stages, fda, approval, ,, which, consists, data, reviews, bureaucratic, process, ,, with, notable, exception, pfizer, vaccine, ,, which, is, now, approved, ., sweetie, ."
1284,"hugging_face, red_heart, i, keep, up, "", good, trouble, "", please, remember, be, extra, careful, out, there, ., delta, is, nasty, bugger, alien_monster, it, succeeded, penetrating, my, son, ', i, double, modern, vans, my, own, double, pfizer, vans, ., ugh, face_with_thermometer"
1285,"thank, you, boo"
1286,"also, that, pfizer, ', i, spike, is, longer, -, lasting, ,, i, assume, prolong, antigenic, effect, ., people, who, are, having, myopericarditis, or, actual, heart, attacks, are, casualties, van, ,, so, far, not, enough, side, effects, cancel, vaccination, program, ., but, at, least, we, know, how, it, works, ."
