,0
2274,"pfizer, exports, ,, here, we, make, them, and, they, are, taken, to, another, country, ,, because, they, don, ', i, stay, in, mexico, they, wouldn, ', i, ask, for, usa, vaccines, ,, given, away, ,, usa, leftovers, if, you, buy, something, ,, you, demand, response, times, ,, delivery, ,, you, don, ', i, go, to, russia, and, use, to, see, how, many, you, get, they, give, away"
2275,"yes, i, keep, thinking, "", come, here, naughty, kitty, i, but, i, ', all, probably, call, it, pfizer, van, ."
2276,"among, bunch, funny, tweets, about, vaccine, brand, name, ,, this, is, my, favorite, ., #, thrillers, #, mrbrightside, #, comirnaty, #, pfizer"
2277,"fda, pfizer, -, biotech, have, approval, comirnaty, ., cormirnaty, is, not, available, now, ."
2278,"i, got, astra, back, april, felt, no, worse, then, hang, over, ., i, got, pfizer, june, all, i, had, was, sore, arm, day, ., you, i, ve, got, this, ."
2279,"you, don, ', i, need, be, pediatrician, know, that, fda, has, found, safely, signals, trials, children, that, caused, them, increase, size, trials, ., final, approval, pfizer, only, sixteen, +, requires, pfizer, have, six, trials, studying, myocarditis, vaccines, ."
2280,"got, my, ord, good, shotsyringethumbs_upmedium, -, light_skin_tonelot, #, greek, letter, variants, go, ., person_shrugginglight_skin_tone, i, male_sign, i, #, vaccine, #, covid19, #, covidvaccine, #, vaccinated, thumbs_upmedium, -, light_skin_tone, @, kanata, -, charleston, health, department, -, charleston, ,, we"
2281,"modern, may, be, superior, pfizer, against, delta, ;, breakthrough, odds, rise, with, time"
2282,"pfizer, vaccine, folks, right, now"
2283,"face_with_tears_of_joy, pfizer, gang"
2284,"library, media, has, done, it, again, i, should, say, they, are, still, doing, it, lying, american, people, pfizer, vaccine, has, not, been, approved, ., has, not, been, approved, one, that, has, been, approved, has, not, even, been, made, yet, it, has, already, been, approved, by, fda"
2285,"pfizer, is, now, fda, approved, ., there, is, no, excuse, now, why, you, can, i, i, get, it, ., #, novaxxuses, ."
2286,"#, pfizer, fire"
2287,"now, that, fda, has, given, full, approval, pfizer, ,, we, i, all, be, having, conversations, about, requiring, them, folks, volunteering, if, they, are, working, face, -, to, -, face, with, other, people, kids, ministry, ,, worship, band, ,, etc"
2288,"i, blocked, someone, just, now, spreading, lie, about, pfizer, ceo, not, getting, vaccinated, ., i, don, i, i, care, if, it, i, i, birthday, today, ., no, ,, no, ,, no, people, are, too, grown, this, ."
2289,"do, you, know, this, pharmacist"
2290,"doctor, ., good, morning, ,, how, true, is, it, that, the, effect, of, the, pfizer, vaccine, only, lasts, six, months"
2291,"thanks, ,, ian"
2292,"fda, approved, pfizer, vaccine, today, ., allow, me, introduce, you, former, fda, commissioner, scott, gottlieb, ., he, now, sits, board, pfizer, ., he, is, also, paid, medical, expert, mainstream, media, ., firewire"
2293,"mike, i, am, not, interested, snake, oil, anti, baxter, stuff, ., i, am, concerned, about, govt, misleading, people, about, their, protection, levels, against, #, deltavariant, slowing, better, vaccines, because, they, are, trading, favors, with, pfizer, ."
2294,"interested, see, how, many, other, schools, will, make, similar, announcement, before, their, first, home, games, ,, especially, light, this, week, i, i, fda, approval, pfizer, van, ."
2295,"these, are, numbers, across, our, ministry, but, you, will, find, similar, numbers, across, country, delta, breakouts, ., all, three, vaccines, are, safe, ., pfizer, now, has, full, fda, approval, ., please, get, vaccinated, you, ,, your, loved, ones, ,, your, neighbors, community, ."
2296,"i, am, ., pfizer, april, nine, second, shot, ., waiting, booster, since, i, am, seventy-one, with, some, health, problems, ., i, am, owned, by, three, cats, who, need, me, alive, ."
2297,"when, corey, taylor, who, is, currently, suffering, delta, variant, says, get, vaccinated, i, you, get, vaccinated, especially, now, that, pfizer, vaccine, is, fully, approved, by, fda"
2298,"pfizer, ., i, didn, i, i, have, any, reaction, first, shot, my, arm, wasn, i, i, even, sore, ., and, shot, i, had, slight, headache, ., took, two, tylenol, i, i, called, it, night"
2299,"sun, is, shining, pfizer, is, fda, approved, let, ', i, end, this, #, covid19vaccine, #, getvaxxed, #, trustthefacts, #, believeinscience, #, listentoprofessionals"
2300,"thanks, pfizer, ., i, had, two, doses, your, van, feel, confident, about, third, dose, as, booster, ., i, ', i, ready, when, my, turn, comes, up, ., is, there, any, alterations, approved, van, over, prior, fda, approval, formula, defense, against, "", i, "", variant"
2301,"you, are, correct, ,, my, mistake, ., but, as, your, criticism, fda, ,, i, would, simply, say, that, pegging, this, as, i, process, over, science, i, is, interpretation, one, could, assert, but, there, certainly, is, support, fda, process, by, other, experts, not, just, those"
2302,"you, others, don, i, i, get, it, ., *, rushing, *, approval, will, not, make, vaccine, -, hesitate, people, run, get, it, ., just, another, red, flag, ., take, look, at, all, fda, approved, drugs, that, have, been, recalled, were, vetted, much, longer, than, pfizer, i, i, vaccine, ., stop, pushing, start, listening, ."
2303,"that, i, i, not, pfizer"
2304,"i, asked, friend, i, so, when, it, i, i, approved, by, fda, you, gone, get, it, she, said, i, yeah, ,, i, just, need, more, information, cause, it, ain, i, i, been, around, that, long, i, i, follow, up, yesterday, with, i, so, pfizer, just, got, their, approval, fda, ., you, ready, now, i, you, already, know, rest, i"
2305,"pfizer, chief, scientist, warns, that, vaccine, this, lockdown, planned, pandemic, is, mass, genocide, depopulation, scientist, ', i, are, knowingly, breaking, nuremberg, code, which, nazi, scientists, doctors, were, hanged"
2306,"flu, vaccines, come, refilled, syringes, do, not, have, extra, paperwork, billing, associated, ., no, card, fill, out, ., no, time, limit, expiration, ., just, screw, needle, go, ., pfizer, modern, have, time, /, temp, limits, expiration"
2307,"we, i, re, bringing, mobile, vaccine, clinic, out, last, welcome, back, wednesday, concert, tomorrow, at, wade, oval, ., walk, -, ups, welcome, enjoy, our, last, summer, event, ,, grab, bite, i, &, amp, ;, i, ,, get, pfizer, shot, all, at, once, syringeface_with_medical_mask"
2308,"vaccine, is, now, approved, ."
2309,"are, you, kidding, not, even, five, minutes, after, fda, announcement, they, had, new, excuses, like, hey, didn, i, i, test, long, enough, or, they, don, i, i, trust, government"
2310,"research, it, yourself, ., former, commissioner, fda, is, currently, board, directors, pfizer, ,, which, coincidentally, is, now, only, fda, approved, vaccine, ., are, things, starting, click, anyone, out, there"
2311,"red_circlethe, fda, approves, the, pfizer, vaccine, ., here, you, will, understand, why, ., eight, /, twentyfour, /, twentynine, via"
2312,"che, and, the, pfizer"
2313,"first, dose, ready, ., #, pfizer, #, vaccinate"
2314,"yesterday, ,, #, rosemanuniversity, i, i, do, ., christina, madison, spoke, with, i, i, about, fda, approval, pfizer, couid, -, nineteen, vaccine, ."
2315,"because, i, ', i, annoyed, that, i, ', i, going, be, tired, all, day, ..., want, drop, some, gripes, ., gavin, chest, recalls, are, very, stupid, ., get, vaccinated, ,, get, pfizer, it, ', i, fda, approved, you, are, running, out, excuses, ., stop, being, rude, your, servers, bartenders, ."
2316,"i, sure, hope, approval, pfizer, vaccine, changes, #, antivaxxer, minds, since, their, hearts, seem, be, unaffected, by, growing, loss, life, ., sadly, ,, i, suspect, facts, won, i, i, matter, many, ."
2317,"i, think, it, could, stand, without, "", vaccine, "", written, shield, ,, but, here, we, are, ., what, ', i, your, excuse, now, that, pfizer, has, full, fda, approval, you, have, had, time, come, up, with, new, equally, invalid, one, ."
2318,"my, company, just, made, vaccinations, mandatory, accessing, facilities, or, stay, home, person_shrugginglight_skin_tone, i, female_sign, i, #, vaccinated, #, getvaccinated, #, getvaxxedrightnow, #, covid19vaccine, #, pfizer"
2319,"third, shot, pfizer, is, right, before, they, send, me, back, into, crowded, classrooms, next, week"
2320,"with, pfizer, fully, approved, desantis, really, does, need, stand, down, let, businesses, make, their, own, decisions, florida, ."
2321,"pfizer, #, one, dec, #, two, january, ., mild, arm, tenderness, dose, one, ,, one, day, fever, +, chills, after, dose, two, ., no, other, side, effects, ., study, so, i, know, i, made, antibodies, ., i, will, get, my, booster, next, month, ., know, that, folk, trials, get, long, term, follow, -, up"
2322,"they, sold, that, news, pfizer, i, see, ., typical, lol, ."
2323,"thankfully, ,, i, had, both, my, couid, -, nineteen, ,, shots, ,..., earlier, your, presidency, they, were, pfizer, variety, i, have, been, working, skilled, nursing, home, ."
2324,"that, ', i, why, they, have, to, keep, the, pfizer, -, doc, ..., although, according, to, what, ', i, no, longer, -, doc, is, fine, ..., I, had, been, confused, with, i"
2325,"all, i, i, i, gonna, say, about, fda, approval, vaccine, is, that, there, are, four, phases, clinical, trial, &, amp, ;, pfizer, was, phase, three, at, most, ., math, not, matching"
2326,"van, up, ,, bed, stay, pfizer, ,, only, fda, fully, -, approved, couid, nineteen, vaccine, is, available, marcy, plaza, today, @, marcy, plaza, -, bed, -, stay, gateway, bid"
2327,"thank, you, i, got, modern, dec, jan, no, couid, infection, no, complications, vaccine, ., my, family, ,, ages, fifteen, -, seventy-seven, all, got, modern, i, two, except, fifteen, yo, got, pfizer, i, two, ., none, got, couid, none, got, complications, thankful, syringe"
2328,"yall, heard, this, comirnaty, shit, suppose, be, super, effective, against, couid, ..., if, you, ', re, afraid, vaccine, you, should, definitely, check, out, comirnaty, ..., it, ', i, definitely, unrelated, pfizer, dont, worry"
2329,"sorry, but, guess, what, ,, pfizer, is, now, fda, approved, ., would, you, personally, please, stop, using, any, all, safety, devices, if, we, use, your, logic, ., seatbelts, ,, life, jackets, ,, helmets, ., or, other, vaccines, mar, ,, flu, ,, smallpox, ..., you, go, it, alone, ., we, trust, your, degree, science, ."
2330,"See, you, at, seven, :, fifty, on, the, news, with, Let, ', i, talk, from, the, rage, over, the, #, pfizer, vaccine, ,, to, the, #, spidermannowayhome, ."
2331,"i, wouldn, i, i, trust, shot, him"
2332,"well, ..., i, had, est, dose, vaccine, all, spoons, are, coming, me, ..., with, second, dose, i, wait, attract, money, grinning_face_with_sweatrolling_on_the_floor_laughinggrinning_face_with_sweat, "", us, regulators, give, full, approval, pfizer, couid, -, nineteen, vaccine, """
2333,"i, didn, ', i, have, choice, vaccine, ., they, were, giving, out, pfizer, so, i, got, pfizer, ."
2334,"ya, you, won, ', i, have, picture, person, dying, after, jab, i, unless, you, report, news, or, veers, nobody, knows, ., i, know, quite, few, who, died, six, days, after, second, pfizer, shot, i, one, coma, ."
2335,"this, scares, me, ., i, wouldn, i, i, want, this, lunatic, giving, me, vaccine, shot, or, filling, my, prescriptions, ., i, pulled, my, last, prescription, yesterday, them, ., until, this, guy, is, checked, no, more, me"
2336,"now, that, it, i, i, official, fda, gave, full, approval, pfizer, #, couid, vaccine, i, should, be, no, more, excuses, not, getting, one, i"
2337,"ohio, lawmakers, banned, public, schools, universities, requiring, vaccines, that, hadn, ', i, received, full, food, drug, administration, approval, ., pfizer, vaccine, approval, cripples, that, mandate, ., #, covid19, #, pfizer, #, vaccinemandates, #, getvaccinated"
2338,"ceo, pfizer, hasn, i, i, taken, vaccine, so, why, should, any, us"
2339,"gad, folded_hands, first, dose, syringe, #, pfizer, at, bva, banker, stadium"
2340,"pfizer, is, now, marketing, their, vaccine, as, i, trump, gold, vip, i, if, you, want, be, vip, ,, ask, your, doctor, ."
2341,"three, all, mothers, back, then, ,, including, my, sis, ,, were, asking, if, her, babies, were, getting, injected, with, thimerosal, ., this, day, ,, i, won, ', i, get, flu, or, pneumonia, shot, that, has, it, ,, as, why, inject, yourself, i, /, a, heavy, metal, i, did, get, pfizer, shot, but, just, explaining, anthrax, history, ."
2342,"obviously, the, best, and, a, third, booster, will, already, be, available, from, September, twenty, i"
2343,"now, that, pfizer, vaccine, is, fda, approved, ,, are, you, ready, get, vaccinated, our, clinics, across, lame, health, are, open, six, days, week, ,, appointments, are, required, ., call, schedule, your, app, today, at, five hundred and four, ., two hundred and ninety, ., five thousand, two hundred, &, amp, ;, visit, see, our, locations, ., #, sleevesupla"
2344,"ifl, i, i, vaccinated, players, are, competitive, weakness, ., with, pfizer, i, i, fda, approval, ,, they, should, be, treated, like, it, ."
2345,"Well, ,, yes, ,, but, people, only, want, Pfizer, ."
2346,"fda, ,, thanks, ., now, is, time, ., do, it, ., get, vaccinated, now, ., syringe, #, pfizer"
2347,"i, can, understand, why, some, didn, i, i, get, vaccine, until, pfizer, was, recently, approved, by, fda, ."
2348,"if, you, all, decide, do, press, release, touting, fda, approval, pfizer, van, ,, urging, floridians, get, vaccinated, ,, i, i, all, retweet, that, too, ., twitter, isn, i, i, real, life, yet, here, we, are, ."
2349,"this, is, sort, #, bigpharma, deal, that, no, nation, or, world, trade, partnership, should, ever, allow, ., it, i, i, all, about, investor, return, as, opposed, patient, care, ., pfizer, buy, canadian, drug, developer, trillium, therapeutic, $, two, ., ab"
2350,"Although, it, must, be, taken, into, account, that, siva, has, eight, million, vaccinated, against, four, from, Pfizer, and, two, from, Astra, ."
2351,"maybe, i, ', i, too, optimistic, ,, but, i, think, fox, news, will, end, their, death, cult, propaganda, soon, ., with, full, fda, approval, yesterday, ,, pfizer, can, advertise, vaccine, to, now, ., watch, fox, news, change, their, tune, so, they, can, get, those, pfizer, ad, dollars, ."
2352,"pfizer, took, no, money, operation, warp, speed, ., stop, lying, claiming, credit, something, you, really, did, not, do, ."
2353,"As, long, as, you, live, ,, what, matters, is, that, it, is, free, ., The, majority, is, supposed, to, be, fed, only"
2354,"i, mean, why, hell, not, ., i, figured, after, pfizer, approval, there, would, still, be, i, it, was, still, too, rushed, i, i, didn, i, i, see, novavax, as, next, thing, cling, to, ., how, about, az, shot, after, that, face_with_rolling_eyes, people, are, cute, ."
2355,"this, is, pretty, spot, on, :, #, pfizer"
2356,"good, morning, houston, where, new, couid, cases, have, nearly, doubled, last, week, ., fda, has, given, full, approval, pfizer, i, i, couid, -, nineteen, vaccine, &, amp, ;, health, officials, are, hoping, it, will, motivate, more, americans, get, vaccinated, ., our, story, :"
2357,"you, have, lost, your, mind, ., trump, had, nothing, do, with, pfizer, van, ., even, today, ,, your, ignorant, followers, are, drinking, animal, medications, you, &, amp, ;, trump, have, killed, almost, million, americans, &, amp, ;, counting, ., your, place, hell, is, warm, &, amp, ;, ready, ., say, hi, lucifer, ."
2358,"i, am, regular, reader, ., today, i, i, #, morningnewsletter, i, wonder, if, you, listened, press, conference, yesterday, where, they, explained, that, time, full, authorization, maxx, was, done, very, short, time, compared, other, vaccines"
2359,"had, my, two, pfizer, shots, april, /, may, ."
2360,"#, pfizer, #, bbut, #, breaking, #, vaccineswork"
2361,"some, perspective, ., nine, ten, poorest, states, are, controlled, by, republicans, ."
2362,"go, team, pfizer"
2363,"needle, didn, i, i, hurt, ., arm, was, sore, about, day, after, ,, felt, really, tired, couple, days, after, shot, two, ., got, pfizer, ., side, effects, van, are, way, better, than, illness, itself, ."
2364,"so, ,, did, #, pfizer, name, vaccine, #, comintern"
2365,"i, just, found, out, that, facebook, acquaintance, who, works, at, pfizer, is, anthrax, ,, please, send, help"
2366,"pfizer, is, immune, litigation, as, are, all, vaccine, manufacturers, thanks, one thousand, nine hundred and eighty-six, act, ., you, ', re, your, own, swim, vaccine, injury, civilian, courts, ."
2367,"one, day, before, school, starts, ,, #, covid19, vaccine, has, full, approval, happy, news, ., smiling_face_with_smiling_eyes, if, you, i, ve, been, hesitant, get, vaccine, so, far, ,, now, is, time, ., syringe, mantelpiece_clock, red_heart, i"
2368,"now, that, fda, have, full, approval, pfizer, van, we, about, see, couid, get, treated, just, like, flu, here, out, ."
2369,"what, does, pfizer, vaccine, being, approved, by, fda, mean, anybody"
2370,"team, pfizer, raising_handsmedium_skin_tone, #, getvaccinated"
2371,"twitter, is, hurting, my, brain, today, with, dumb, people, complaining, about, work, places, requiring, vaccine, because, pfizer, is, now, officially, fda, approved, ., time, sign, off, while"
2372,"those, who, feel, that, fda, approval, pfizer, vaccine, was, rushed, or, politicized, ,, note, that, it, has, already, enjoyed, full, approval, canada, ,, mexico, ,, most, europe, ,, good, part, south, america, ., consensual, validation, i"
2373,"vaccinated, americans, now, that, pfizer, vaccine, has, full, fda, approval, i"
2374,"will, more, employer, mandates, follow, fda, ', i, approval, pfizer, couid, -, nineteen, vaccine, via"
2375,"two, shots, pfizer, ,, zero, effects, ,, still, deadly, afraid, needles, ,, still, convinced, they, jabbed, me, with, sugar, water, ,, alas, ,, no, couid, ., just, do, it"
2376,"already, seeing, same, people, who, said, i, i, i, all, get, vaccinated, when, fda, says, it, i, i, safe, i, now, say, i, the, fda, only, approved, pfizer, so, they, can, force, us, get, vaccine, i, it, i, i, almost, as, if, you, can, simply, never, satisfy, republicans"
2377,"more, colleges, expected, mandate, vaccines, following, pfizer, fda, approval"
2378,"i, had, pfizer, ,, as, did, my, husband, ,, daughter, &, amp, ;, sisters, ., no, die, effects, witb, either, dose, ., shot, felt, much, like, pressure, sensation, i, feel, when, i, get, novocaine, shot, dental, work, ., it, was, not, sharp, or, prolonged, ., think, pinch, like, ."
2379,"happy, tuesday, girl, power, this, morning, yellow_heart, i, are, talking, about, pfizer, vaccines, full, approval, ,, is, tracking, some, storms, headed, rochester, ., join, us, here, :"
2380,"i, i, i, holding, my, second, couid, -, nineteen, vaccination, clinic, this, sunday, district, five, ., it, i, i, #, fdaapproved, #, pfizer, vaccine, ,, so, anyone, twelve, +, is, eligible, ., whether, you, need, your, first, dose, or, your, second, dose, ,, come, see, us, this, sunday, ., #, aurorastrong, i, don, i, i, throw, away, your, shot, i, syringe"
2381,"i, got, pfizer, april, ., glad, about, it, ., don, ', i, like, shots, but, it, was, no, big, deal, ."
2382,"i, i, i, holding, my, second, #, couid, -, nineteen, vaccination, clinic, this, sunday, district, five, ., it, i, i, #, fdaapproved, #, pfizer, vaccine, ,, so, anyone, twelve, +, is, eligible, ., whether, you, need, your, first, dose, or, your, second, dose, ,, come, see, us, this, sunday, ., #, aurorastrong, i, don, i, i, throw, away, your, shot, i, syringe"
2383,"yesterday, was, bad, day, anti, -, baxters, ., good, day, science, ., i, had, pfizer, shot, back, april, may, with, very, little, side, effects, ., if, you, have, not, gotten, vaccinated, ,, do, it, today, #, pfizer"
2384,"pfizer, -, not, funded, by, ows, ., do, you, pray, with, that, lying, mouth"
2385,"i, had, zero, side, effects, pfizer, ., husband, bil, had, zero, problems, with, modern, ., daughter, had, couid, two, weeks, hell, november, at, college, ., she, also, got, modern, ., headache, ,, mild, fever, about, twelve, hours, ., some, said, she, would, gladly, get, booster, monthly, compared, couid"
2386,"pfizer, got, immunity, with, vaccine, incase, anyone, got, sick, or, died, vaccine, think, it, i, i, called, immunity, but, now, fda, approved, pfizer, vaccine, ,, is, pfizer, now, held, accountable, harm, it, might, cause, now, i, future, or, limited, since, most, took, vaccine, before, fda, approval"
2387,"pfizer, submits, initial, data, couid, -, nineteen, vaccine, booster, authorization"
2388,"investors, are, celebrating, full, approval, pfizer, i, i, couid, -, nineteen, vaccine, ., #, trix"
2389,"i, wonder, how, far, they, will, move, those, goalposts, now, #, fdaapproved, #, pfizer"
2390,"now, that, pfizer, vaccine, is, fully, approved, ,, what, incentive, does, company, have, advertise, vaccine, they, i, ve, already, sold, product, ., microbe"
2391,"pfizer, is, making, billions, per, month, vaccine, mandates, lockdowns, therefore, it, is, scott, gottlieb, ', i, fiduciary, duty, support, vaccine, mandates, lockdowns, ., media, presents, him, as, unbiased, medical, expert, ., you, see, how, this, all, works, kanekoathegreat"
2392,"as, pfizer, board, member, ,, it, is, scott, gottlieb, ', i, fiduciary, duty, maximize, pfizer, ', i, profits, ., despite, scientific, literature, ,, scott, gottlieb, says, his, product, is, better, than, natural, immunity, ."
2393,"fda, approved, pfizer, vaccine, today, ., extended, era, ., allow, me, introduce, you, former, fda, commissioner, scott, gottlieb, ., he, now, sits, board, pfizer, ., he, is, also, paid, medical, expert, mainstream, media, ."
2394,"good, morning, sir, step, list, plus, all, the, alportadoreña, band, smart, dad, ., Yesterday, I, wasn, ', i, there, early, because, I, got, the, and, Pfizer, vaccine, at, thirty, -, thirty-nine, years, old, and, I, already, have, it, with, pain, in, my, arm, but, I, ', i, still, listening, to, all, the, journalistic, information, on"
2395,"#, chronicle, #, couid, vaccines, :, delivery, of, five, ., three, million, pfizer, and, modern, doses"
2396,"most, millionaire, representatives, have, money, pfizer, ."
2397,"morning, tea, ., tuesday, august, with, i, pfizer, vaccine, has, full, approval, -, now, called, comirnaty, i, no, requiring, couid, shots, teachers, i, state, workers, or, constant, testing, i, kimmel, center, ,, merrily, theater, ,, academy, music, require, proof, van, anyone, twelve, older"
2398,"real, question, is, ,, what, politicians, are, getting, paid, by, or, have, stock, pfizer"
2399,"columbus, dispatch, :, pfizer, vaccine, approval, cripples, ohio, school, mandate, ban"
2400,"i, had, no, reaction, either, pfizer, shot, beyond, sore, arm, ., these, i, horrible, side, effects, i, stories, are, unhelpful"
2401,"thank, you, i, took, pfizer, ., i, ', i, tell, you, it, ', i, similar, flu, shot, ,, though, maybe, you, avoid, those, just, be, sure, not, take, tylenol, before, shot, ., sore, arm, day, ,, tired, after, second, shot, ., good, luck"
2402,"i, got, pfizer, van, as, soon, as, i, was, eligible, ny, ., i, go, multiple, offices, construction, sites, ,, have, kids, at, home, prefer, mitigate, risk, heading, hospital, ., my, world, hasn, i, i, shut, down, ., i, work, ,, we, camp, ,, we, see, friends, we, mask, when, needed, ., it, i, i, easy, ."
2403,"-, fda, gives, full, approval, pfizer, shot, huh, ., it, actually, is, safe, i, guess, doctors, ,, scientists, ,, researchers, with, years, education, experience, this, field, were, right, ., go, figure, ., face_with_rolling_eyesface_with_symbols_on_mouth, #, science"
2404,"now, that, pfizer, vaccine, has, official, fda, seal, approval, i, we, could, start, seeing, massive, amounts, vaccine, mandates, ., but, who, i, i, already, mandating, vaccinations, let, i, i, unpack, that, at, six, a, ., i, ., together, #, not"
2405,"democrats, are, using, fully, fda, approved, pfizer, couid, -, nineteen, delta, variant, vaccine, distraction, account, president, joe, biden, totally, screwing, up, ,, plus, governor, como, leaves, office, today, ., nba, champs, seattle, storm, white, house, ., just, remember, #, usmexicoborder"
2406,"fda, approves, pfizer, vaccine, ,, try, domino, i, i, watermelon, pizza, |, tonight, ..., via"
2407,"pfizer, ., it, doesn, ', i, hurt, much, ., don, ', i, hesitate, any, further, ."
2408,"there, i, i, no, pain, ., i, recommend, either, pfizer, or, modern, ."
2409,"last, thing, i, want, know, is, what, my, local, nextdoor, thinks, fda, pfizer, authorization, ."
2410,"not, twentyfour, hours, ago, fully, approved, #, covid19, vaccine, those, sixteen, +, this, morning, daybreak, :, -, what, exactly, this, means, -, how, this, will, impact, arkansas, -, what, officials, are, expecting, now"
2411,"approval, was, pfizer, ., they, chose, not, participate, operation, warp, speed, ., i, bet, mike, knew, that, ."
2412,"article, atlantic, ,, do, ., malone, reference, shock, video, saiTongue_sticking_out_cheeky_playful_or_blowing_a_raspberry, "", his, objections, pfizer, modern, shots, have, do, mostly, with, their, expedited, approval, process, with, government, i, i, system, tracking, adverse, reactions, ..."", he, just, sounds, bitter, ."
2413,"not, trying, flex, but, i, do, have, pfizer"
2414,"pfizer, employees, are, required, be, couid, vaccinated, ."
2415,"pfizer, does, require, it, ', i, employees, be, couid, vaccinated, ."
2416,"u, ., i, ., regulators, give, full, approval, pfizer, -, biotech, ', i, couid, -, nineteen, vaccine"
2417,"this, morning, :, we, are, breaking, down, what, full, fda, approval, couid, -, nineteen, pfizer, vaccine, means, ., if, you, i, ve, been, waiting, get, vaccinated, ,, now, that, pfizer, is, approved, i, will, you, get, your, shots"
