,0
0,"pfizer, vaccine, got, me, like, face_with_thermometer"
1,"ammo, i, argentina, receives, first, batch, pfizer, vaccines, :, date, ,, over, seventeen, million, people, argentine, forty-five, million, population, have, been, fully, vaccinated, ,, twenty-eight, ,, five, million, received, one, shot, vaccine, ., view, article, ..."
2,"there, was, couid, outbreak, at, my, work, few, weeks, ago, ,, only, people, that, didn, i, i, test, positive, or, get, sick, were, those, who, had, either, modern, or, pfizer, vaccine, i"
3,"you, thought, wrong, ., pfizer, is, twelve, over, ., sounds, like, you, are, one, trying, scare, people, ."
4,"first, young, boy, who, develops, heart, complications, pfizer, van, should, bankrupt, school, system, ., california, i, i, going, be, wasteland, ."
5,"twelve, up, ,, since, they, i, re, eligible, get, pfizer, vaccine, ., unless, they, have, exemption, ."
6,"i, got, modern, ,, but, i, ', ve, heard, that, pfizer, is, most, effective, one, ."
7,"thank, you, ., i, i, i, sorry, you, were, so, sick, i, flu, /, shingles, shot, i, get, second, pfizer, vaccine, tomorrow, ., i, i, i, not, looking, forward, it, ., apparently, i, antibodies, i, already, have, ca, antibodies, i, vaccine, ,, that, is, why, i, got, so, sick, i, vaccine, ."
8,"according, nba, news, ..., "", at, least, one hundred and twenty-five, ,, zero, fully, vaccinated, americans, have, tested, positive, couid, one, ,, four hundred, those, have, died, ..."", so, where, is, incentive, vaccinated, people, i, got, my, two, -, dose, pfizer, vaccine, i, still, don, ', i, feel, confident, ., weary_faceweary_face"
9,"i, wish, i, won, pfizer, lottery, i, need, get, modern, #, three, asap, not, looking, forward, getting, my, ass, kicked, again"
10,"in, #, no, began, vaccination, for, children, under, twelve, seventeen, years, old, with, the, important, pfizer, biological, ,, they, are, only, those, who, have, federal, protection, it, does, not, matter, if, they, are, healthy, or, have, any, illness, questions, call, eight thousand, one hundred and eighty-three, fifty-nine, twenty-seven, thirty, /, eight thousand, one hundred and eighty-three, fifty-nine, sixty-six, seventeen, the, requirements, are, these, :"
11,"but, it, i, i, not, big, difference, if, you, understand, process, ., all, clinical, testing, required, approved, drug, has, already, occurred, ., hold, -, up, is, bureaucratic, ., pfizer, had, more, resources, get, their, submission, faster, ., one, /"
12,"today, uk, granted, emergency, approval, pfizer, astrazeneca, vaccines, be, used, as, booster, shots, ,, governor, roper, says, ., details, come, booster, program, ., roper, reassures, that, cayman, remains, good, position, due, vaccine, uptake, ., #, caymanislands"
13,"at, least, now, everyone, at, we, ,, cac, ,, nih, ,, pfizer, ,, modern, ,, i, &, amp, ;, i, will, be, valued, ."
14,"apart, from, coup, children, now, our, president, and, nalgatel, are, going, to, investigate, judges, i, give, judicial, decisions, for, pfizer, vaccine, the, next, thing, would, be, where, are, the, eighteen, million, vaccines, that, are, not, found, and, who, is, worth, more, a, child, or, an, adult, that"
15,"except, pfizer, is, not, manufacturing, or, distributing, approved, one, ., they, are, only, administering, one, still, under, emergency, approval, ,, cause, they, are, adamant, that, they, be, indemnified, ., they, won, ', i, sell, their, approved, product, noone, ., why, ,, is, so, safe, are, they, so, adamant"
16,"doctor, a, couple, of, weeks, ago, a, tec, project, was, mentioned, about, bringing, pfizer, vaccines, as, a, "", trial, "", to, be, able, to, vaccinate, children, under, eighteen, ., what, an, end, to, that, comment, I, hope, they, land, it, even, if, it, costs, i, parents, ."
17,"fox, news, requiring, vaccine, ., don, ', i, see, how, this, is, politics, ., when, you, attend, school, you, ', re, required, get, handful, vaccines, make, you, less, contagious, those, around, you, ., pfizer, vaccine, has, been, fda, approved, ., not, sure, what, else, you, want"
18,"cayman, has, vaccinated, fifty-two, ,, six hundred and twenty-two, seventy-four, %, with, first, dose, pfizer, vaccine, ,, do, lee, says, ,, noting, there, has, been, uptick, vaccinations, past, week, ."
19,"pfizer, is, gonna, get, you, anyway, when, you, need, viagra, your, couid, -, induced, erectile, dysfunction, ,, so, you, might, as, well, get, vaccine, ."
20,"booster, is, still, only, recommended, ,, certain, groups, ,, &, amp, ;, only, pfizer, ., i, took, modern, vaccine, &, amp, ;, i, am, not, switching, manufacturers, ., i, am, not, going, get, booster, until, it, is, abundantly, clear, i, need, one, &, amp, ;, it, is, safe, ., i, think, that, is, reasonable, position, at, this, time, ."
21,"whenever, one, side, you, have, guy, like, michael, reason, ,, former, pfizer, scientific, researcher, up, ,, who, has, everything, lose, ,, but, still, warns, public, ,, other, powerful, machinery, with, everything, gain, ,, i, stop, listen, what, guy, like, reason, has, say, ., just, me, i"
22,"watching, i, biden, didn, i, i, impose, requirement, before, because, vaccines, only, had, emergency, approval, ., pfizer, has, now, been, fully, approved, ., any, order, without, full, approval, would, have, been, very, shaky, ground, ., he, was, wise, wait, ."
23,"Wow, ..., they, said, that, with, the, #, pfizer, the, chest, grew, ,, not, the, belly, #, covid_19, #, vacunateya"
24,"that, i, i, my, plan, did, you, know, i, had, est, pfizer, dose, july, because, i, am, health, care, i, had, dumb, virus, by, eight, /, fifteen, /, twentynine, ., yeah, neutral_face"
25,"if, i, never, took, pregnancy, test, ,, my, daughter, wouldn, ', i, exist, by, this, logic, ., not, taking, any, horse, de, -, former, ., fully, vaccinated, with, pfizer, ."
26,"the, pfizer, ,, of, course, ,, but, there, are, no, guarantees, ., and, it, ', i, a, shame, ,, because, those, who, knew, him, closely, say, that, he, killed, himself, working, ..."
27,"would, you, take, experimental, birth, control, if, it, only, worked, half, time, killed, over, twelve, ,, zero, americans, so, far, this, year, what, if, #, fuckjoebiden, ordered, you, take, it, #, pfizer, #, jab, #, forbiden"
28,"adult, ,, responsible, and, vaccinated, ..., #, pfizer, #, covid_19_vaccine, #, cvshealth"
29,"those, you, who, got, pfizer, vaccine, ,, how, are, you, feeling, i, just, got, my, first, dose, today"
30,"pfizer, modern, $, job, this, year, ."
31,"pfizer, vaccine, is, fully, approved, ,, no, longer, under, era, age, sixteen, above, ."
32,"great, pfizer, commercial, now, tell, us, what, long, term, effects, vaccine, are"
33,"i, i, i, sure, it, i, i, coincidence, that, pfizer, spent, sixty, million, biden, i, i, inauguration"
34,"I, invested, it, in, pfizer"
35,"add, capacity, ."
36,"murray, blue, cheese, white, powder, residue, flase, pesticides, i, need, log, entry"
37,"megaphone, remember, that, the, mexican, consulate, in, orlando, is, a, permanent, location, for, vaccines, against, #, covid19, until, september, thirty, syringe, and, a, dose, of, the, pfizer, vaccine, ., alarm_clock8am, -, up, ,, Monday, Saturday, ., don, ', i, let, this, opportunity, go, and, #, pontubrazoflexed_biceps, #, wecandothis"
38,"shure, red, bulk, earphones"
39,"green, dot"
40,"two, -, zero, sebastian"
41,"I, was, listening, to, this, song, and, suddenly, I, cried, wey, ,, because, it, ', i, the, pfizer, hangover"
42,"former, pfizer, up, warns, booster, shot, is, extermination, weapon, mass, murder, human, beings, |, agenda, twentynine"
43,"they, trying, they, best, get, everybody, vaccinated, #, damn, #, vaccine, y, ', all, better, get, #, pfizer, then, @, west, side, ,, chicago"
44,"open, four, you, twelve, -, up, five hundred and ten, minor, avenue, north, room, a, |, three hundred and six, i, ., es"
45,"viagra, levity, cialis"
46,"mine, seems, have, worked, ., thank, you"
47,"sense, being, two, minutes"
48,"what, ', i, new, logo, ribbons, sixty-nine"
49,"minutes, is, ., two, minutes"
50,"how, much, ai, ., o, little, bottle, absolut"
51,"i, am, so, mad, you, didn, ', i, give, me, rubber, bands, ., o, ., sea, foam, green, o, ., orange, pastel, glacleux"
52,"pfizer, needs, due, ann, pronto"
53,"does, bill, gates, have, investments, modern, &, amp, ;, pfizer, mrna, cos, ,, among, others, ..."
54,"fda, is, requiring, pfizer, do, six, following, studies, myocarditis, ., trials, five, -, eleven, yo, has, been, increased, same, reason, ."
55,"started, pfizer, camp, but, now, i, i, i, looking, at, modern, like, smiling_face_with_heart, -, eyes"
56,"shot, pfizer, or, modern"
57,"getting, pfizer, booster, both"
58,"had, couid, ., got, both, pfizer, ', i, ., will, get, booster, ...."
59,"i, am, looking, four, catherine, i, ., es, is, that, is, theresa, voice, ., ew"
60,"i, emale_sign, i, male_signmale_sign, i, male_sign, i, rainbowbalance_scale, i, cocktail_glass"
61,"hiim, hiim"
62,"just, got, my, second, dose, pfizer, this, is, all, i, see, is, that, normal"
63,"huron, county, paramedic, service, is, all, set, up, assist, hope, with, walk, up, clinic, at, forwhich, ball, diamond, ., come, get, est, or, and, dose, pfizer, ., twelve, years, up, ., up, up, ."
64,"waiting, with, my, teen, her, first, pfizer, vaccine, ., fingers, crossed, she, doesn, i, i, have, any, side, effects, since, she, had, couid, back, march, ., crossed_fingersmedium, -, light_skin_tone"
65,"that, and, pfizer, shot, got, my, babe, outta, there, i, that, i, i, what, happens, when, you, van, that, thang, up"
66,"if, i, received, both, pfizer, shots, booster, ,, plus, both, modern, shots, three, johnson, &, amp, ;, johnson, doses, do, i, still, need, seven, masks, when, i, go, outside, my, house"
67,"pfizer, ., arm, sore, like, ,, hit, with, single, fastball, sore, after, both, shots, ., maybe, little, bit, tired, after, and, day, or, so, otherwise, totally, fine, ., one, sister, ,, pfizer, ,, same, ;, other, sister, ,, pfizer, ,, had, flu, symptoms, like, two, days, ., mom, ,, modern, ,, tired, /, dizzy, one, day, ."
68,"but, no, ,, it, is, not, yet, one hundred, %, confirmed, that, it, is, good, to, apply, underage, vaccines, thinking_face, the, only, one, was, pfizer, ,, but, I, think, that, is, something, difficult, to, achieve, ."
69,"The, and, dose, escobedo, arrived, #, pfizer, #, yomevacuno, #, covid_19, #, covid_19mx, #, escobedo, #, generalescobedo, #, secondosis"
70,"because, pfizer, ,, modern, et, al, need, debunk, any, therapeutic, no, matter, how, effective, ,, so, that, their, vaccines, will, be, our, only, recourse, ."
71,"what, experimental, vaccine, fda, approved, pfizer, vaccine, ."
72,"get, your, #, covid19, vaccine, this, spiral_calendarfriday, ,, sep, ., ten, at, south, pox, missionary, baptist, church, round_pushpin, two thousand and six, e, ., broadway, red, pox, ,, az, eighty-five thousand and forty, event, runs, alarm_clock12pm, -, up, we, will, offer, pfizer, vaccine, twelve, +, &, amp, ;, i, &, amp, ;, i, vaccine, ., eighteen, +, questions, call, telephone, i, six hundred and two, five hundred and six, -, six thousand, seven hundred and sixty-seven"
73,"#, politics, ,, i, wonder, how, many, our, national, &, amp, ;, state, level, politicians, took, campaign, donations, two thousand and twenty, #, barnes4nh"
74,"haha, ., az, pfizer, me, too, ."
75,"i, got, dollar, store, van, first, shot, pfizer, second, so, today, i, went, got, third, pfizer, so, it, will, be, easy, travel, i, pharmacy, said, after, slow, august, they, are, doing, brisk, business, sept, ……."
76,"every, non, -, vaccinated, hospital, patient, with, couid, must, now, listen, i, down, with, sickness, i, by, disturbed, loop, entirety, their, treatment, ., twenty, minutes, ,, they, i, all, be, begging, pfizer"
77,"public, health, england, is, one, few, places, posting, detailed, data, their, situation, ., israel, ', i, main, vaccination, is, pfizer, shot, ,, so, it, is, not, just, astrazeneca, issue, ."
78,"fda, approval, pfizer, ', i, vaccine, didn, ', i, lead, spike, vaccinations"
79,"so, how, did, y, i, all, do, van, report, card, a, +, =, ex, pfizer, plus, booster, =, ex, pfizer, or, ex, modern, i, =, johnson, &, amp, ;, johnson, i, -, =, one, pfizer, or, one, modern, i, -, =, failed, get, any, vaccination, i, pass, =, can, i, i, get, vaccine, due, age, or, immune, compromised"
80,"tricia, i, i, many, other, healthcare, workers, have, personally, seen, patients, dying, vaccine, reactions, adverse, effects, ., look, up, pfizer, i, i, history, bad, practice, look, at, money, behind, all, this, wake, up"
81,"i, just, got, my, flu, vaccination, it, came, i, og, upgrade, my, pfizer, couid, vaccine, ., also, ,, i, have, i, -, ray, vision, now, ."
82,"the, pfizer, was, like, coke, haha, i, I, went, out, with, a, shitload, of, batteries, and, then, they, made, me, want, to, shit"
83,"sssssuptm, who, said, that, pfizer, did, not, hit"
84,"yeah, ,, that, ', i, not, true, at, all, ., otherwise, ,, fda, would, not, be, requiring, further, study, myocarditis, pfizer, approval, over, next, several, years, ."
85,"the, transmission, /, carrier, that, minors, have, when, they, are, in, poorly, ventilated, places, ,, schools, ,, favors, contagion, in, adult, parents, ,, therefore, ,, saturation, of, hospitals, ., my, thirteen, year, old, girl, vaccinated, since, april, two, pfizer"
86,"and, as, zuma, ;, there, are, thousands, of, patients, between, the, ages, of, twelve, and, seventeen, living, with, type, one, diabetes, who, should, be, considered, a, priority, ., in, many, countries, ;, this, sector, has, been, vaccinated, ;, precisely, with, the, authorized, pfizer, or, modern, vaccines, ., #, Diabetes, type, one"
87,"gander, center, has, partnered, with, local, agencies, host, free, couid, -, nineteen, vaccine, clinic, this, friday, at, yoyo, puerto, rico, market, at, bakery, one, -, up, ., no, pre, -, registration, necessary, #, covid19, #, vaccine, #, clinic, #, pfizer, #, modern, #, jansen, #, springfield, #, ma"
88,"their, where, many, more, executive, minions, big, pharmaceutical, company, and, some, came, personal, department, accountanting, 14thfloor, most, deadly, came, pfizer, maintenance, department, i, would, love, collect, my, one, hundred, two, bi"
89,"pinchi, pfizer, all, compa, syringezombie"
90,"i, had, couid, new, years, ,, got, my, pfizer, vaccine, few, weeks, ago, at, twenty-three, weeks, pregnant, &, amp, ;, had, no, side, effects, other, than, sore, arm, day, or, two"
91,"three, women, i, know, had, this, happen, ,, close, friend, i, i, friend, had, have, full, hysterectomy, at, thirty-one, stop, after, pfizer, bleeding, ., she, has, no, kids, ., it, looks, like, it, will, have, cost, her, her, husband, too, ., what, is, couid, risk, healthy, thirty-one, year, old, sickening, ."
92,"good, morning, ., if, you, haven, i, i, yet, today, is, great, day, get, vaccinated, ., cast, your, vote, then, come, get, your, jab, ., we, have, bookings, open, pfizer, +, i, &, amp, ;, i, here, at, it, ., joseph, i, i, ."
93,"#, coronavirussicilia, #, chronicle, worker, who, died, custonaci, after, first, dose, of, pfizer, :, autopsy, ordered"
94,"hey, you, guys, grew, boobs, with, the, pfizer, vaccine, because, my, yes, and, quite, pensive_face"
95,"check_mark_buttonhundred_points, got, my, #, pfizer, #, covidbooster, syringehospitalstar, #, one hundred and twenty-three, #, vaccinated, #, covid19, thanks, superheromedium, -, light_skin_tone, i, female_sign, i, #, booster, #, vaccine, #, preventionfirst, #, wereallinthistogether, #, finalmente, @, houston, methodist, hospital"
96,"it, i, i, great, day, get, quick, jab, pfizer, vaccine, sub, ., protect, your, family, ,, our, kids, ,, #, protectthepack, ., keep, those, tests, negative"
97,"i, quarantine, i, freestyle, i, #, quarantine, #, covid_19, #, cac, #, maskmandates, #, pfizer, #, modern, #, johnsonandjohnson, #, vaccine, face_with_medical_maskthumbs_upmedium_skin_tone"
98,"after, having, defeated, couid, ,, i, trust, you, guys, will, be, cutting, edge, cancer, as, well, ., United_States"
99,"pfizer, vaccine, was, developed, germany, did, not, take, any, american, money"
100,"good, you, that, second, dose, pfizer, really, did, me, week, ., hope, you, i, all, have, easy, time, it, folded_handsmedium, -, light_skin_tone"
101,"The, pfizer, is, powerful, ., hot_face"
102,"i, it, will, be, replaced, with, new, time, capsule, that, contains, items, reflective, current, times, ,, including, expired, vial, pfizer, couid, -, nineteen, vaccine, ,, black, lives, matter, sticker, photograph, black, ballerina, with, her, fist, raised, near, lee, statue, ...”, i, per"
103,"i, took, both, didn, i, i, die, ., #, modern, #, pfizer, #, vaccine"
104,"but, ,, you, already, have, your, complete, vaccination, chart, ,, unless, in, about, eight, months, they, say, that, you, need, a, "", booster, "", as, they, are, doing, in, the, US, with, those, who, were, vaccinated, with, Pfizer, or, Modern, ;, there, you, could, try, to, get, a, ord, dose, of, another, vaccine, ."
105,"no, ,, that, they, get, vaccinated, with, pfizer, that, is, already, tested, and, approved, for, children, between, twelve, -, seventeen, years, old, ,, that, is, what, should, be, done"
106,"how, much, money, does, her, university, receive, pfizer"
107,"pfizer, is, still, under, eau, until, they, actually, make, maxx, that, has, been, approved"
108,"lost, three, neighbors, less, than, month, due, covid19, ,, all, vaccinated, ...., pfizer, ,, what, ', i, crazy, is, they, never, really, left, house, ,, everything, delivered, ,, groceries, ,, meds, ,, etc, ."
109,"america, :, someone, needs, tell, this, window, licker, that, his, i, president, i, shafted, america, by, owning, stock, pfizer, ."
110,"another, #, covidroulette, player, trump, supporter, tells, can, he, won, ', i, get, vaccinated, because, pfizer, ', shafted, my, president, '"
111,"this, presents, massive, conflict, interests, very, obvious, reasons, ., also, ,, remember, last, two, fda, commissioners, resign, went, pfizer, gottlieb, modern, hahn"
112,"pfizer, vaccine, is, no, longer, under, emergency, use, ., it, received, fda, full, -, use, approval, weeks, ago, ., modern, vaccine, will, also, soon, be, approved, full, use, by, fda"
113,"well, not, really, ., americans, gave, implied, consent, when, they, willingly, agreed, be, part, vaccine, phase, one, trials, ., not, until, recently, did, pfizer, get, full, approval, ., modern, &, amp, ;, others, are, still, process, ., one, stipulation, nuremberg, was, no, suffering, ., only, dead, did, ."
114,"pfizer, ,, modern, expected, make, combined, $, fifty, billion, this, year, |, niko, ..."
115,"my, partner, is, immunosuppressive, drugs, his, docs, at, vanderbilt, had, him, get, pfizer, early, ., because, he, is, touring, musician, doc, recommended, booster, ord, shot, -, didn, ', i, even, phase, him, ., peace, mind, now, that, ', i, he, ', i, back, world, ..., priceless"
116,"study, published, leading, #, science, journal, 𝘕𝘢𝘵𝘶𝘳𝘦, looks, effectiveness, #, ivermectin, other, protease, inhibitors, as, potential, anti, i, covid_19, agents, ., early, results, are, encouraging, ., #, covid19, #, pfizer, #, pfizermectin, #, media, #, bigpharma, #, propaganda"
117,"once, again, ,, if, you, simply, googled, it, ,, you, would, quickly, learn, that, pfizer, is, conducting, pediatric, trial, six, mos, -, two, yo, kids, ., why, are, americans, like, this"
118,"i, i, i, so, sorry, but, i, i, i, like, know, what, vaccination, he, got, ., pfizer, ,, modern, or, i, &, amp, ;, i, ., maybe, one, them, isn, i, i, working, ."
119,"and, after, a, while, I, have, to, put, the, second, pfizer, dose, there, I, go"
120,"but, pfizer, makes, vaccines, ,, they, trust, them, with, their, i, *, ok, ,, since, they, make, viagra, ,, so, it, ', i, wild, that, they, ', re, making, these, choices, ,, lol, ."
121,"They, lied, to, me, when, they, said, that, with, the, pfizer, your, chichis, would, grow"
122,"meet, me, saturday, at, townie, let, i, i, get, vaccinated, stop, spread, ., will, be, providing, pfizer, shots, &, amp, ;, boosters, ., is, providing, fifty, tickets, fair, &, amp, ;, so, much, more, #, getvaccinated"
123,"ny, did, it, day, pfizer, was, approved, ., what, are, you, talking, about, ., la, not, first, ."
124,"i, was, talking, about, vaccine, that, was, created, few, months, with, basically, no, testing, now, being, forced, us, ., nowhere, did, i, mention, pfizer, ."
125,"i, had, beautiful, drive, through, mountains, reno, blue, skies, ending, with, surprise, pfizer, vaccine, booster"
126,"that, was, pretty, obvious, once, tbe, beans, were, spilt, that, his, team, blew, off, pfizer, people, by, being, obnoxious, ."
127,"you, ', re, already, were, it, ', i, a, promise, huh"
128,"i, i, believe, that, these, are, accurate, statistics, ., imvermectin, is, not, anti, virus, drug, ., i, am, not, sure, which, pfizer, pill, you, referring, but, i, don, i, i, think, that, it, i, i, going, contain, imvermectin, ."
129,"., i, have, arranged, more, pop, -, up, /, walk, -, up, van, sites, at, small, businesses, across, ottawa, ., orange, monkey, sept, fifteen, two hundred and fifty, city, center, ten, am, -, two, am, get, shot, get, $, twentyfive, gift, card, orange, monkey, good, pool, ,, food, drinks, ., check_mark_button, pfizer, or, modern, #, ottawa"
130,"they, put, guitar, hero, star, power, pfizer, vaccine"
131,"Today, I, was, vaccinated, with, my, second, dose, of, Pfizer, ., syringemicrobe"
132,"yes, ,, my, kids, are, thirty-four, ,, thirty-two, ,, twenty-three, &, amp, ;, still, child, bearing, years, ., when, pfizer, came, out, said, they, couldn, ', i, guarantee, it, would, not, cause, sterility, they, were, all, nope, ., did, you, happen, see, reports, value, non, valued, sperm, is, up, twentynine, ,, zero, %, crazy"
133,"fox, news, keeps, pimping, ivermectin, people, who, need, couid, protecting, i, but, it, i, i, insane, ,, course, unless, you, i, re, horse, ,, just, go, get, #, pfizer, injection, #, pandemicpoetry, #, coronavirus, #, getvaccinated, #, ivermectin, #, covid_19, #, dailylimerick"
134,"the, second, dose, of, pfizer, is, starting, to, feel, ., My, shoulder, hurts, and, burns, ., if, I, move, it, is, worse, ., #, vaccine, #, couid, #, pfizer"
135,"one, of, my, favorite, places, ,, enjoy, it, for, both, of, you, ,, I, ', all, be, back, soon"
136,"bro, second, pfizer, shot, is, no, jokeloudly_crying_face, had, take, two, days, off, work, this, shit"
137,"help, my, my, /, o, auntie, went, road, trip, her, daughter, several, others, caught, it, recovered, my, auntie, didn, i, i, get, it, -, she, i, i, vaccinated, ., her, kid, initially, was, totally, against, #, vaccinated, i, i, i, talking, personal, experience, ., vaccine, works, ., with, no, problems, ."
138,"it, appears, that, pfizer, vaccination, issues, are, being, withheld, so, that, media, doesn, i, i, report, issues, that, people, have, ., someone, very, close, me, can, i, i, walk, due, this, injection, was, hospital, week, ."
139,"but, his, cause, death, was, marked, couid, ., no, doctor, gets, bribed, with, pfizer, tax, money, writing, "", west, nile, "", as, cause, death, ."
140,"here, they, only, put, pfizer, or, modern, and, the, reason, is, that, the, first, vaccine, was, sixty, %, effective, so, it, was, better, to, have, sixteen, million, people, with, one, dose, than, eight, million, double, vaccinated, ,, because, then, the, remaining, eight, million, were, at, risk"
141,"trump, supporter, tells, can, he, won, ', i, get, vaccinated, because, pfizer, ', shafted, my, president, ', -"
142,"The, Ministry, of, Public, Health, of, #, Uruguay, approved, the, application, of, a, booster, dose, of, the, vaccines, and, against, #, covid_19, over, sixty, years, of, age, who, have, a, complete, vaccination, schedule"
143,"Thank, you, very, much, ,, I, get, the, Pfizer, second, dose, but, they, say, that, it, does, stick"
144,"i, tried, get, my, mom, mix, it, up, ,, but, she, wimped, out, went, with, pfizer, again, #, three, ., still, very, happy, that, she, got, her, #, boostershot, despite, inaction, ."
145,"about, get, my, second, dose, this, pfizer, ."
146,"i, the, natural, immune, protection, that, develops, after, sars, -, cov, -, two, infection, offers, considerably, more, shield, against, delta, variant, pandemic, coronavirus, than, two, doses, pfizer, -, biotech, vaccine, i"
147,"pfizer, seems, be, running, show, i"
148,"maybe, so, but, you, i, re, preaching, choir, my, friend, keep, mind, these, people, take, horse, deformed, think, it, i, i, gonna, cure, them, couid, over, actual, fda, approved, medicine, pfizer, et, al, power, information, warfare, is, what, we, need, be, addressing"
149,"my, yo, nephew, got, his, first, pfizer, shot, today, #, no, #, aotearoa"
150,"bit, more, side, effects, booster, which, was, modern, ., stronger, vaccine, than, my, original, pfizer, ."
151,"would, like, word, i"
152,"yam, is, giving, the, pfizer, effect, ,, send, vibe, smiling_face_with_tear"
153,"stupid, is, as, stupid, does, ., trump, supporter, tells, can, he, won, ', i, get, vaccinated, because, pfizer, ', shafted, my, president, '"
154,"Why, is, the, party, in, Argentina, for, the, arrival, of, one hundred, ,, zero, doses, of, the, Pfizer, vaccine, ...., it, is, a, global, to"
155,"all, pfizer, doses, have, be, administered, within, six, hours, opening, vial, or, they, have, be, discarded, ., he, asked, his, pharmacy, call, him, if, they, had, leftover, doses, at, end, day, that, would, have, be, thrown, out, ., better, put, it, arm, than, trash, ."
156,"three, dose, flexed_biceps, johnson, pfizer, ."
157,"i, had, two, doses, pfizer, and, ord, trimester, ., baby, is, one, month, healthy, ."
158,"not, that, pfizer, was, the, slightest, ,, motherfuckers, ., face_with_thermometer"
