,0
48796,"interesting, hear, ,, as, i, ', ve, heard, vaccines, doing, same, individuals, prone, seizures, ,, so, it, would, make, sense, me, that, sars, itself, also, has, similar, impact, ., record, i, support, vaccines, ultimately, ,, virus, worth, avoiding, ,, even, when, fully, vaccinated"
48797,"can, ', i, even, go, my, girls, birthday, dinner, tomorrow, cause, i, don, ', i, have, or, code, downcast_face_with_sweat, sucks, but, i, ', i, still, not, getting, vaccinated, sorry, not, sorry, face_with_tears_of_joy"
48798,"they, didn, ', i, lock, themselves, in, ,, dingus, ., they, taped, door, way, out, ., i, know, ..., thinking, is, hard, work, you, ."
48799,"all, more, reason, him, get, vaccinated, but, hey, what, do, i, know"
48800,"join, partner, i, i, write, democracy, event, #, nationalvoterregistrationday, two, /, eight, ., masked, &, amp, ;, vaccinated, writers, can, opt, in, -, person, attendance, ., ok, postcards, were, handwritten, just, hours, #, voterizer, #, votingrights"
48801,"he, ', i, not, vaccinated, ., i, think, that, ', i, also, his, point, ."
48802,"we, ', re, five, /, five, couid, infections, our, household, ., we, ', re, fully, vaccinated, it, has, been, pretty, mild, ,, but, it, still, sucks, ., i, have, knit, one, /, two, throw, blanket, ., as, voice, actress, i, can, ', i, work, ,, so, i, ', all, just, keep, knitting, ."
48803,""", twenty, -, twentyfive, %, not, vaccinated, "", i, thought, goal, was, seventy, %..., therefore, we, ', re, at, goal, ., cut, bullshit, let, those, not, valued, risk, it, open, everything, back, up, ."
48804,"not, sure, if, you, are, aware, or, not, ,, but, we, have, had, i, test, supply, shortages, i, since, holiday, season, ., it, was, rightly, around, time, that, we, got, hammered, with, whatever, hammered, us, -, including, many, ,, many, vaccinated, people, ., yes, ,, untaxed, too, ,, just, obviously, less, them, ."
48805,"are, your, patients, vaccinated"
48806,"his, vaccinated, family, who, already, had, couid, once, ,, has, it, again"
48807,"partying_faceclapping_handsraising_handsright, -, facing_fistleft, -, facing_fistsmiling_face_with_hearts"
48808,"getting, couid, vaccine, was, waste, time, i, woke, up, feeling, like, i, i, i, so, lynn, had, me, tested, &, amp, ;, it, ', i, positive, again, ,, this, is, and, time, i, ', ve, had, couid, since, i, got, vaccinated, there, will, be, no, more, vaccinations, ,, boosters, or, anything, else, me, #, covid19"
48809,"i, will, never, look, at, our, country, same, way, again, because, how, so, many, denied, severity, virus, &, amp, ;, their, refusal, wear, masks, or, get, vaccinated, because, i, their, rights, i, i, thought, majority, us, were, so, much, smarter, &, amp, ;, tougher, than, this, ., whining, needs, stop, ."
48810,grinning_face_with_smiling_eyesgrinning_face_with_smiling_eyesgrinning_face_with_smiling_eyes
48811,"., has, no, use, facts, -, his, focus, is, spreading, lies, &, amp, ;, hate, ., zhu, was, born, los, angeles, chinese, immigrant, family, ., two thousand and eighteen, ,, she, decided, compete, china, so, she, gave, up, her, american, citizenship, changed, her, name, beverly, zhu, zhu, yi, ."
48812,"over, eighty, %, people, are, vaccinated, including, myself, ., yet, government, won, ', i, drop, this, ., clearly, they, have, zero, end, plan, ., this, protest, is, more, than, just, about, vaccine, mandates, it, ', i, about, all, mandates, including, masks, or, codes, ,, rolling, lockdowns, etc, ., it, needs, end, ."
48813,"masking, &, amp, ;, testing, ,, two, top, tools, getting, through, this, pandemic, course, ,, getting, vaccinated"
48814,"that, white, hoe, pullin, steph, range"
48815,"during, our, move, we, have, had, instances, where, we, could, be, what, is, called, karen, ., honestly, time, has, shown, patience, brings, more, rewards, ., some, are, addicted, crisis, or, have, been, accused, being, doormat, ., time, does, have, it, ', i, rewards, if, you, ', re, able, tolerate, it, ."
48816,"country, that, has, less, vaccinated, people, than, us, what, reason, try, explain, use, portugal, ,, i, will, wait, ."
48817,"i, have, five, grandkids, ages, five, fourteen, ., all, them, have, been, vaccinated, had, couid, recovered, quickly, ., they, do, mask, but, almost, no, one, else, their, schools, do, ., vaccines, work, ."
48818,"when, my, nieces, were, little, my, sil, would, wake, them, with, ', you, ', re, smart, ., you, ', re, pretty, ., but, mostly, your, good, person, others, '"
48819,"they, can, i, i, keep, their, own, stories, straight, ., so, why, do, i, still, have, wear, mask, when, i, i, i, vaccinated, ."
48820,"so, you, i, re, ok, with, not, allowing, food, water, voters, but, you, i, re, ok, with, giving, food, ,, money, gas, vaccinated, truck, drivers, that, are, protesting, vaccine, mandates, ., yeah, that, makes, sense, ."
48821,"but, reason, why, is, much, more, complicated, than, that, ., we, keep, seeing, change, narrative, ., vaccine, was, going, protect, us, then, oh, you, might, get, it, but, you, will, not, spread, it, then, oh, you, might, spread, it, but, you, will, not, end, hospital, then, vaccinated, people, ended, up"
48822,"thank, you, tiff"
48823,"aww, ,, no, ., pensive_face, don, ', i, say, that, ., i, don, ', i, think, you, really, mean, it, ."
48824,"it, still, feels, like, yesterday"
48825,"hello, ,, connecticut, residents, ., if, you, want, see, percentage, your, town, ', i, housing, stock, that, is, considered, affordable, ,, go, here, :"
48826,"this, graphic, is, mind, fry, itself, ., &, amp, ;, great, day, -, i, ', i, really, inclined, believe, your, source, ', i, claim, about, led, being, incorporated, into, daily, routine, like, having, shot, espresso, ., it, ', i, all, so, "", burning, -, man, i, lesque, two, me, i, face_with_rolling_eyesface_vomiting"
48827,"my, wife, had, co, -, worker, who, did, not, want, get, vaccinated, ,, even, when, company, implemented, vaccine, mandate, their, own, staff, ., he, did, responsible, thing, got, new, job, with, local, company, who, doesn, ', i, require, vaccine, ., this, isn, ', i, hard, ."
48828,"there, are, different, pops, by, experts, ., you, seemed, agree, i, /, backing, off, masks, at, school, ., some, experts, think, more, time, is, needed, until, there, are, more, vaccinated, ,, especially, young, children, ., i, ', i, go, side, caution, &, amp, ;, give, it, little, extra, time, ."
48829,"is, she, that, tamara, i, i, mother"
48830,"organize, them, by, height, you, monster, what, are, you, doing"
48831,"i, think, you, need, put, these, out, with, context, ., were, these, young, people, vaccinated, is, that, relevant, does, that, better, inform, people, reporting, news, i, think, so"
48832,"yes, they, ., your, early, childhood, vaccines, are, nothing, like, couid, vaccine, ., you, can, be, vaccinated, ,, spread, couid, still, die, it, ., same, cannot, be, said, those, early, vaccines, ."
48833,"six, it, part, vaccinated, ., what, is, problem"
48834,"my, daughter, -, in, -, law, not, vaccinated, tested, positive, couid, -, nineteen, this, week, ., doctor, told, her, take, vitamin, i, ,, zinc, &, amp, ;, cough, medicine, ."
48835,"not, all, protesters, are, truckers, ., many, are, not, ., wise, up, ., obnoxious, antivaxxers, have, worn, out, their, welcome, ."
48836,"wish, u, knew, how, pal, live, other, parts, world, &, amp, ;, how, privileged, you, are, Canada, &, amp, ;, it, i, i, pal, are, great, ., i, request, truckers, end, protests, &, amp, ;, peacefully, return, important, jobs, u, do, i, all, got, vaccinated, &, amp, ;, must, be, considerate, everyone, i, i, health, ,, happiness, &, amp, ;, safety"
48837,"i, haven, ', i, watched, any, olympics, but, i, ', i, gonna, go, with, jamaican, bobsled, team, ,"
48838,"so, much, jämlika, average, ,, where, kids, cant, get, vaccinated, since, some, kids, socio, economic, disadvantaged, areas, will, not, ..., tell, me, again, what, ', i, argument, why, cant, kids, poorer, areas, get, vaccines, -, dont, they, go, schools, im, lost"
48839,"#, letstalkaboutrace, #, mondaythoughts"
48840,"no, you, don, ', i, ., vast, majority, people, have, very, minor, symptoms, whether, they, ', re, vaccinated, or, not, ."
48841,"please, let, there, be, something, criminal, that, whack, job, navarro, ., crossed_fingers"
48842,"i, feel, very, angry, after, that, last, retweet, ., i, don, i, i, care, about, people, i, i, comfort, anymore, ., people, are, dying, preventable, deaths, ., you, had, be, vaccinated, with, every, other, shot, go, school, /, work, ., this, one, shouldn, i, i, be, different, ., if, you, think, otherwise, ,, grow, up, open, your, eyes, ."
48843,"yeah, right, ."
48844,"if, you, did, fact, lost, someone, because, they, listen, joe, organ, who, never, said, don, i, i, get, vaccinated, but, rather, talked, about, subject, which, we, all, should, then, i, am, sorry, ., i, apologize, suspicion, this, being, true, as, most, people, say, same, thing"
48845,"thinking, it, ', i, fine, go, massless, public, during, #, couid, because, you, ', re, fully, vaccinated, is, like, thinking, it, ', i, fine, drive, drunk, because, you, are, wearing, seat, belt, ., #, omicron, #, covid19, #, masks, #, vaccines"
48846,"picture, yourself, drinking, #, conservative, tears, this, mug, #, butheremails"
48847,"man, ., one, day, ,, i, got, about, three, /, four, way, top, had, rest, ., people, down, escalator, started, cheering, me, ,, "", you, can, do, it, you, ', re, almost, there, "", face_with_tears_of_joyface_with_tears_of_joyface_with_tears_of_joyface_with_tears_of_joy"
48848,"cac, updated, guidance, says, fully, vaccinated, can, safely, go, massless, indoors, ,, or, outdoors, ., why, are, triple, valued, joe, jill, still, wearing, their, masks, outside, via"
48849,"is, brook, lopez, expected, back, at, any, time, this, season"
48850,"since, i, still, drive, stick, ,, i, will, say, that, ,, yes, ..., i, have, ."
48851,"simple, solution, ., get, vaccinated, ."
48852,"february, seven, ,, two thousand and twenty-two, couid, -, nineteen, van, update, :, seventy-nine, ., five, %, residents, eighteen, +, are, fully, vaccinated, seventy-three, ., six, %, residents, twelve, +, are, fully, vaccinated, thirty, ., two, %, residents, eighteen, +, are, boosted, forty-nine, ., six, %, residents, five, -, eleven, have, at, least, one, dose, vaccine, learn, more, right_arrow, i, #, vaxupphilly"
48853,"there, no, evidence, back, up, that, statement, ., vast, majority, people, have, very, mild, symptoms, whether, they, ', re, vaccinated, or, not"
48854,"., is, filled, with, hate, ., attack, nineteen, year, old, is, what, pathetic, person, does, attack, nineteen, year, old, olympic, hopeful, without, bothering, get, facts, first, is, un, -, american, ."
48855,"australia, will, reopen, its, borders, all, vaccinated, travelers, later, this, month, ,, country, i, i, prime, minister, scott, morrison, announced, monday, ,, signaling, end, one, longest, border, closures, since, start, pandemic, ."
48856,"how, can, my, family, receive, coaxing, usa, under, i, compassionate, use, i, we, want, be, vaccinated, but, medically, unable, with, only, mrna, options, here, ."
48857,"i, don, ', i, agree, with, aggressive, see, it, my, way, ., seems, as, entitlement, mixed, with, lack, patience, &, amp, ;, possibility, not, being, heard, so, demanding, it, &, amp, ;, oppressing, ., hunger, attention, rather, than, self, respect, is, need, ., i, ', i, not, sure, it, will, end, if, it, ', i, fed, ."
48858,"lovin, ', trend, drop"
48859,"i, ', i, sure, that, he, meant, that, untaxed, are, more, likely, die, ., data, proves, that, be, overwhelmingly, true, ., i, work, healthcare, ,, most, couid, cases, i, see, are, people, who, didn, ', i, get, vaccinated, ."
48860,"mandates, will, be, lifted, i, thanks, vaccinated, folded_hands"
48861,"just, don, ', i, watch, listen, organ, ., i, never, have, happy, that, i, haven, ', i"
48862,"merch, drop"
48863,"there, was, not, one, single, positive, policy, people, ., not, one, ., only, tax, cuts, wealthy, ., harassment, bullying, everyone, else, ."
48864,"i, don, ', i, know, about, you, ,, but, everytime, i, hear, name, posobiec, today, ,, i, think, someone, is, taking, anti, diarrhea, medication, rolling_on_the_floor_laughing"
48865,"are, you, suggesting, that, vaccinated, make, up, majority, hospitalizations"
48866,"#, bhm2022"
48867,"looked, like, good, at, first"
48868,"yeah, ,, that, ', i, it, ., if, more, than, one, person, disagrees, with, you, ,, it, ', i, because, it, ', i, crew, bots, ,, not, multiple, people, who, are, better, informed, than, you, ., face_with_rolling_eyes"
48869,"why, does, left, hollywood, want, us, all, vaccinated, that, i, i, what, silencing, joe, organ, is, all, about, right, why, what, is, it, hollywood"
48870,"back, work, i, go, then, home, i, actually, wait, ..., work, ,, dentist, ,, then, home, aka"
48871,"wow, his, words, ring, hollow, when, you, consider, he, voted, criminal, twice, once, following, two, impeachment, i, i"
48872,"is, ., most, canadians, are, vaccinated, support, couid, science, ., these, truckers, are, covidiot, thugs, who, should, be, arrested, their, trucks, impounded, ., they, are, harassing, locals, hurting, their, businesses, ."
48873,"hi, ,, this, woman, passed, out, likely, do, dehydration, ., but, here, is, fox, news, trying, blame, her, being, vaccinated, ., how, much, shit, like, this, does, one, harmful, page, get, post"
48874,"give, it, let, them, run, with, it, ., rolling_on_the_floor_laughingrolling_on_the_floor_laughingrolling_on_the_floor_laughing"
48875,"they, tried, set, fire, apartment, building, ."
48876,"queens, park, area, monday, ., all, clear, ., well, done, ., folded_handslight_skin_toneclapping_handsclapping_handsclapping_handsclapping_hands"
48877,""", rumble, requires, all, employees, be, fully, vaccinated, against, couid, -, nineteen, i, thats, gonna, be, no, me, dawg, ."
48878,"queens, park, area, friday, /, saturday, /, sunday, ., trucks, could, not, get, near, hospitals, ."
48879,"ottawa, :, ten, days, ongoing, ., toronto, three, days, ., thank, you, ., we, were, fortunate, see, what, didn, ', i, go, right, ottawa, ,, you, obviously, planned, it, ., one, /"
48880,frowning_face
48881,"happy, accident, eons, ago, smiling_face, i"
48882,"but, aren, i, i, they, all, vaccinated, clown_face"
48883,"just, want, make, appreciation, post, vaccinated, ., without, them, i, wouldn, i, i, be, able, sit, sidelines, see, how, this, experiment, plays, out, over, next, ten, years, ., government, imposed, medical, treatments, with, no, long, term, data, ,, what, could, go, wrong"
48884,"just, like, they, didn, ', i, need, get, vaccinated, they, /, you, could, jus, just, stay, home, ."
48885,"one, -, way, high, quality, masking, infection, -, naive, or, immune, compromised, people, is, way, forward, ., those, us, vaccinated, recovered, should, be, free, make, that, choice, ."
48886,"how, about, after, kids, under, five, are, fully, vaccinated, with, three, dose, regimen, this, entire, conversation, has, unfolded, far, too, fast, effort, please, very, small, ,, yet, vocal, ,, minority, ., protect, kids, ,, protect, everyone, else, ., there, ', i, your, metric, ."
48887,"i, support, woman, ', i, right, choose, have, abortion, ., i, also, support, person, ', i, right, not, get, vaccinated, ;, however, ,, they, may, be, blocked, some, jobs, ,, entering, some, establishments, ,, traveling, see, ,, i, ', i, consistent, "", pre, -, born, babies, "", lol"
48888,"i, i, i, not, offended, lol, i, was, clarifying, my, stance, ., have, good, one, ."
48889,"if, i, were, parent, i, would, be, hesitant, have, my, child, vaccinated, couid, ., mainly, because, newest, cases, are, much, milder, than, alpha, or, delta, infections, seem, be, slowly, waning, us, ."
48890,"i, think, we, ', ve, already, had, preview, this, situation, with, "", the, police, say, they, don, ', i, have, get, vaccinated, "", several, cities, ."
48891,"i, don, i, i, need, zero, risk, ., i, i, i, vaccinated, healthy, ., my, risk, is, very, low, ., if, you, do, ,, then, i, support, your, right, do, all, you, can, yourself, ., this, is, where, is, where, we, are, different, ."
48892,"tonight, monday, two, /, seven, louis, tomlinson, world, tour, at, coca, -, cola, roxy, police_car_light, requires, printed, proof, negative, couid, -, nineteen, test, within, seventy-two, -, hours, prior, entering, venue, ,, or, must, be, fully, vaccinated, ., health, safety, information, :"
48893,"if, you, want, normalcy, ,, get, vaccinated, ."
48894,"you, acknowledge, couid, exists, you, ', ve, been, vaccinated, then, what, ,, "", injured, "", are, you, referring, to, ,, exactly"
48895,"french, drain"
48896,"i, i, need, grow, up, get, life, if, possible, ., act, like, children, ,, full, excuses, ,, lies, &, amp, ;, conspiracies, ., those, us, born, before, one thousand, nine hundred and eighty, were, required, by, law, get, vaccinated, mumps, ,, measles, ,, rubella, polio, ., it, was, american, thing, do, ., got, polio, no, they, can, thank, us"
48897,"i, ., a, ., is, $, one hundred and twenty, kitten, /, cat, age, two, $, sixty, cat, two, -, ten, ,, free, cat, over, ten, dogs, are, $, two hundred, ., cats, are, neutered, /, spayed, ,, deformed, flea, treated, ,, vaccinated, ,, tested, fiv, /, felt, microchipped, ., i, ', i, assume, similar, dogs, ,, i, ', ve, only, adopted, cats, them, ."
48898,"red_heart, i, folded_handsred_heart, i, folded_handsred_heart, i"
48899,"exactly, no, matter, how, many, people, get, vaccinated, virus, still, exists, they, can, contract, it, spread, it, so, just, like, every, other, flu, season, you, i, re, at, risk, everyone, ., it, i, i, truly, ridiculous, brainwashing, here, ."
48900,"then, cases, will, fall, ., fear, mongering, must, stop, ., please, stop, stoking, fire, -, many, silent, majority, are, done, with, this, constant, barrage, couid, i, we, have, live, with, this, ,, over, ninety, %, are, vaccinated, so, let, i, i, move, with, life, now, #, done, #, stopfearmongering"
48901,"#, cannoli, lots, good, jobs, with, benefits, vaccinated, people, safe, workplaces, are, being, created, ., ty, anti, -, baxters, con, work, creation, program, non, -, cons"
48902,hugging_faceface_with_medical_maskhugging_faceface_with_medical_mask
48903,"most, canadians, will, not, show, up, four, the, vaccine, ., when, medical, politicians, push, have, six, month, old, vaccinated, it, is, evil, ., nothing, else, makes, sense, ."
48904,"i, disagree, ., at, least, this, point, it, absolutely, should, be, mandated, certain, jobs, certain, activities, ., it, i, i, not, mandatory, be, vaccinated, canada, ., you, still, have, your, freedom, choice, ., but, there, are, consequences, your, decision, ,, just, like, anything, ."
48905,"biden, truckers, comming, canada, are, not, vaccinated, &, amp, ;, they, have, our, supply, we, need, ,, you, should, suspend, vaccination, requirement, truckers, or, they, will, protest, &, amp, ;, block, border, with, canada, &, amp, ;, that, would, cause, another, crises"
48906,"right, ., so, you, ', re, against, this, cut, -, in, -, schools, hysteria, ,, right"
48907,fake
48908,"*, bursts, into, flames, *"
48909,"she, called, abortion, i, genocide, far, worse, than, holocaust, i, bragged, that, she, was, not, vaccinated, against, coronavirus, ,, described, transgender, women, as, i, biological, men, i, having, identity, crisis, i, railed, against, competes, act, ..."
48910,"just, get, vaccinated, check, out, thebishdish, -, extra, dish, ', i, video, #, tiptoe"
48911,"i, am, body, autonomy, ."
48912,"#, musicalmonday, #, newvideo, #, randyrainbow, #, thetangovaccine, so, awesome"
48913,"news, as, is, just, dotar, best, five, ."
48914,"wait, can, anyone, explain, far, right, instance, "", past, infection, +, vaccinated, "", having, higher, hazard, ratio, than, anyone"
48915,"note, does, not, break, out, data, by, boosted, status, ., about, half, vaccinated, minnesotans, are, boosted, somewhat, lower, month, ago, ."
48916,"their, downfall, will, not, be, televised, ,, but, occupiers, ,, it, will, be, live, ."
48917,"so, us, is, mandating, that, truckers, be, fully, vaccinated, cross, border, ., this, #, freedomconvoy, thing, has, nothing, do, with, truckers, crossing, border, ., it, ', i, about, people, wanting, be, free, infect, others, with, deadly, disease, ., it, ', i, pure, selfishness, ."
48918,"i, ', all, still, give, opinions, things, ,, but, i, want, focus, more, positive, things, that, deserve, more, attention, ., like, scientific, advancements, ,, cancer, fundraising, ,, animal, rescues, ., topics, im, interested, in, ,, like, ocean, ,, mythology, art"
48919,"after, long, think, ,, i, ', ve, decided, stop, or, at, least, limit, how, political, i, get, twitter, ., it, ', i, just, too, exhausting, ., i, had, hoped, that, being, part, cause, online, would, be, helpful, ,, especially, over, last, few, years, where, irl, protests, are, not, safe, ,, but, ..., it, ', i, not, ."
48920,"i, hope, waiting, until, march, is, right, amount, time, ., we, ', re, all, tired, wearing, masks, ,, but, wearing, mask, seems, so, little, ask, keep, kids, &, amp, ;, community, safe, ., more, who, are, vaccinated, sooner, we, can, all, be, i, /, o, masks, ., #, getvaccinatedandboosted, #, staysail"
48921,"authors, also, highlight, laud, petition, calling, end, masking, all, couid, restrictions, kids, california, feb, ., fifteen, i, just, few, weeks, before, kids, under, five, could, be, fully, vaccinated, ."
48922,"we, are, back, with, your, weekly, #, covid19, neighborhood, update, handshake, transmission, rate, ten thousand, four hundred and fifty-three, ,, ten thousand, four hundred and fifty-seven, &, amp, ;, ten thousand, four hundred and sixty, areas, is, still, rated, i, high, i, keep, yourself, others, safe, ,, get, vaccinated, today, orange_heart, *, data, collected, via, ny, dough, ,, as, two, /, seven, /, twenty-two, ."
48923,"you, i, ve, seen, videos, youtube, that, simply, include, lgby, people, them, but, haven, i, i, been, marked, as, eighteen, i, you, think, that, i, i, bad, thing, wow, ,, you, really, are, problem, here, ., good, day, ."
48924,"our, shame, #, blackhistorymonth"
48925,"this, is, false, ., stop, ."
48926,"wrong, :, six, ., four, million, new, jobs, first, year, ., unemployment, three, ., nine, lowest, since, 1960s, ., gap, at, five, ., seven, %, highest, since, one thousand, nine hundred and eighty-four, ., gas, prices, coming, down, by, releasing, government, reserves, ., record, stock, market, trump, used, as, measure, secrets, ., seventy-five, %, +, population, vaccinated, record, stock, market, ."
48927,"glad, know, you, ', re, good, with, them, padding, their, pockets, ."
48928,"been, long, fifteen, days, flatten, curve, ,, then, get, vaccinated, so, you, didn, i, i, have, mask, up, anymore, ."
48929,"you, are, wrong, sir, ., if, people, anywhere, defiantly, decided, not, be, vaccinated, against, virus, ,, they, cannot, be, warded, with, freedom, movement, ,, etc, ., those, who, eventually, got, infected, should, stay, home, ,, try, medicate, themselves, winking_face_with_tongueand, eventually, die, peace"
48930,"i, don, i, i, really, understand, why, you, feel, need, insult, intelligence, person, you, don, i, i, know, ., female, is, noted, anti, -, baxter, i, was, just, wondering, if, he, plans, get, his, baby, vaccinated, against, all, other, diseases, out, there, ."
48931,"freedom, easing, restrictions, that, we, are, about, enjoy, is, brought, you, by, ……., thirty, million, canadians, who, were, vaccinated, kept, our, healthcare, system, being, overwhelmed, ., not, by, loud, minority, ."
48932,"get, vaccinated, ., don, ', i, listen, crazy, cult, conspiracy, theories, people, who, are, pursuing, political, agenda, ., listen, your, doctor, ., listen, scientists, ., #, covid19, is, pandemic, that, has, killed, millions, ., don, ', i, be, one, them, because, someone, wants, you, drink, koolaid, ."
48933,"#, dickenscode, #, brachygrqphy, #, tavistockletter, #, charlesdickens"
48934,"long, couid, if, you, ', re, vaccinated, at, baseline"
48935,"sure, ., that, ', i, at, six, %, meantime, reality, land, ,, other, ninety-four, %, are, vaccinated, helping, keep, that, six, %, safe, diseases, ."
48936,"there, ', i, allot, use, word, karen, ., whoopi, i, ', i, unsure, could, speak, her, truth, even, if, we, she, wanted, do, public, opinion, &, amp, ;, position, ., censorship, is, issue, blocking, many, uncomfortable, truths, ., conservatives, &, amp, ;, libs, are, censoring, ., karen, accusations, gain, attention, &, amp, ;, truths, are, ignored, ."
48937,"#, patriot, is, vaccinated, boosted, ready, defend, country, democracy, ,, stays, healthy, able, contribute, economy, ,, doesn, i, i, stress, our, health, care, system, ,, doesn, i, i, infect, others, ."
48938,"i, ', i, with, you, here, ., i, know, that, ., unfortunately, most, people, like, forget, that, when, talking, about, couid, ', i, survival, rate, ., getting, vaccinated, has, also, been, shown, greatly, reduce, that, chance, ., getting, breakthrough, won, ', i, do, as, much, damage, ., one, study, brought, chance, getting"
48939,"actions, have, consequences, selfishly, not, being, vaccinated, during, global, health, crisis, is, action, ."
48940,"so, ,, less, than, one, per, state, ., you, ', re, bragging"
48941,"only, lesson, be, learnt, is, never, take, job, with, he, if, it, i, i, not, exactly, what, you, would, expect, evidence, based, service, delivery, ., suspend, it, very, moment, it, lapses, ., verbal, he, promise, additional, resources, are, not, worth, blank, paper, it, i, i, not, recorded, on, ."
48942,"awesome, i, #, any, #, accessibility, #, disabledtwitter"
