,0
47398,"my, husband, ,, our, two, one, /, two, yr, old, myself, did, not, get, it, be, we, were, all, vaccinated, ., but, being, that, we, didn, i, i, go, anywhere, other, than, grocery, store, or, have, play, dates, ,, tells, me, it, was, air, i, /, no, way, detect, ., it, i, i, horrifying"
47399,"just, at, much, much, lower, rate, ., variants, aren, i, i, likely, coming, vaccinated"
47400,"im, only, two, "", taller, .-."
47401,"you, lili, von, shtup, ,, julius"
47402,"if, people, have, specific, vulnerabilities, they, should, get, vaccinated, ., masks, are, pure, theater, once, you, account, vaccine, protection, ."
47403,"so, ,, is, this, your, "", scientific, "", proof"
47404,"has, anyone, counted, silverware"
47405,"our, mixers, all, got, pretty, heavy, use, so, that, may, be, part, our, issues, ., new, arrivals, #, franch, ., looking, forward, trying, curved, beans, ."
47406,"monday, message, :, get, #, vaccinated, #, boosted, ,, #, markup, ,, #, sociallydistance, ., life, you, save, may, not, be, your, own, ., #, gratefuldead, death, don, ', i, have, no, mercy, this, land, live, at, fillmore, west, february, twenty-eight, ,, one thousand, nine hundred and sixty-nine"
47407,"oh, ,, well, then, ,, if, biden, was, wrong, one, time, he, said, if, you, take, vaccine, you, won, ', i, get, couid, ,, unlike, all, other, times, he, just, said, if, you, get, vaccinated, you, have, better, chance, not, getting, sick, ,, then, that, means, vaccine, is, totally, useless"
47408,"tickets, are, only, regular, people, who, park, wrong, place, ,, not, right, wing, protesters, ., they, get, free, parking, anytime, apparently, ."
47409,"all, you, convoy, truckers, leave, now, or, your, life, will, change, worse, ., we, are, majority, we, will, take, you, down, you, will, lose, this, fight, Canada, signed, vaccinated, ."
47410,"it, ', i, so, sad, me, that, african, americans, are, being, played, we, don, ', i, even, see, it, ,, actors, telling, us, what, we, should, should, not, be, mad, at, ,, wif, ,, words, should, not, hold, so, much, power, inspire, so, much, anger, ,, we, put, power, them, now, being, told, how, act"
47411,"you, can, ', i, actually, get, around, chemical, impairment, motor, neurons, ., you, can, just, convince, yourself, you, have, ., member, my, molecule, swears, she, ', i, no, way, impaired, ,, regardless, how, many, ways, we, prove, her, that, she, is, ., functional, pretend, isn, ', i, safe, drive, ."
47412,"neighbor, was, not, masked, not, vaccinated, ., it, was, personal, liberty, freedom, ., he, passed, due, couid, at, va, yesterday, morning, ., let, freedom, ring, ."
47413,"it, i, i, amazing, me, that, leftists, are, cheering, surveillance, state, mandate, enforced, by, police, -, that, only, recognizes, monopoly, capital, produced, pharmaceuticals, as, legit, ., cuban, /, russian, /, chinese, fully, vaccinated, people, are, not, recognized, as, valued, by, enforcers, ."
47414,"that, ', i, lie, it, ', i, that, vaccinated, flooding, our, hospitals"
47415,"we, received, ours, last, week, ., sucks, that, our, family, six, only, gets, four, tests, ,, but, i, suppose, that, ', i, better, than, nothing, ."
47416,"remembering, sandra, bland, ., together, ,, let, i, i, i, honor, her, life, i, together, ,, let, i, i, i, continue, fight, protect, black, women, i, #, sayhername"
47417,"it, :, if, you, i, ve, been, vaccinated, still, feel, mortally, threatened, by, virus, ,, please, read, this, ."
47418,"justin, proving, couid, is, bad, even, when, vaccinated, thinking_face, just, like, we, said, ., either, that, or, he, is, coward, face_with_steam_from_nose"
47419,"bright, side, though, even, though, i, got, spoiled, legends, arcus, still, amazed, me, so, much, smiling_face_with_heart, -, eyessmiling_face_with_heart, -, eyessmiling_face_with_heart, -, eyes"
47420,"dishonorable, william, i, barr"
47421,"especially, because, pops, are, largest, group, people, that, haven, i, i, been, vaccinated, ., i, smell, racism, white, privilege, ."
47422,"is, it, wearing, pad"
47423,"very, easily, :, van, scenario, :, can, vaccinated, spread, virus, answer, :, yes, ., so, that, negates, equivalency, ., abortion, scenario, :, just, because, something, isn, i, i, planned, doesn, i, i, justify, murder, ., don, i, i, compound, bad, situation, with, worse, decision, ."
47424,"no, one, is, being, forced, get, vaccinated, ., there, are, lots, trucker, jobs, open, that, don, ', i, require, border, crossing, ."
47425,"probably, not, ."
47426,"one, /, what, earth, are, you, talking, about, if, vaccine, didn, ', i, offer, protection, ,, valued, population, would, make, up, portion, icu, admissions, relative, size, their, demographic, ,, which, would, be, eighty-nine, i, but, they, don, ', i, ., vaccinated, only, make, approx, ., half, admissions, ."
47427,"kinda, wonder, if, these, communities, are, particularly, attractive, someone, who, i, i, doing, well, &, amp, ;, is, more, attached, corporation, than, metro, area, ,, knowing, that, next, promotion, may, involve, transfer, ."
47428,"this, brings, promising, news, my, eyes, ., seventy, %, virginians, vaccinated, ., cases, down, thirty-seven, %, last, week, ., that, must, mean, we, may, be, plating, again, ., face_with_medical_maskred_heart"
47429,"i, know, vaccines, work, we, ', i, have, many, more, deaths, i, /, o, them, ,, but, i, was, floored, learn, recently, e, ., i, ., missouri, has, had, one, ,, one hundred, +, massachusetts, one, ,, eight hundred, +, reported, deaths, "", fully, vaccinated, people, ., i, would, have, expected, that, be, much, less, ., two, /"
47430,"looks, exactly, like, i, would, expect, tech, bro, who, welcomes, racists, onto, his, platform, would, ."
47431,"to, :, quick, ., guess, which, country, produced, two, vaccines, ,, vaccinated, almost, all, its, people, is, helping, the, ...:, and, ,, example, ,, case, my, center, ,, which, is, center, research, neuroscience, i, we, study, developmental, disorders, ,, alzheimer, i, i, i"
47432,"remember, when, silenced, reading, letter, written, by, #, corettascottking, two thousand and seventeen, this, is, what, happens, when, you, give, them, power, ., #, cancelculture"
47433,"and, ,, course, ,, when, you, don, ', i, back, -, up, what, you, say, ,, you, just, change, definition, ', fully, vaccinated, '"
47434,"biden, marks, nine hundred, ,, zero, couid, -, nineteen, deaths, urges, :, ', get, vaccinated, ,, get, your, kids, vaccinated, '"
47435,"i, see, both, sides, troll, ., i, see, that, ninety, %, canadian, truckers, are, vaccinated, working, ."
47436,"i, ', i, double, vaccinated, lol, ."
47437,"and, ..., i, ', i, blocked, ., not, surprise, ."
47438,"so, you, as, someone, who, is, not, black, are, telling, me, black, man, be, offended, ,, lol, ok, just, checking"
47439,"setting, up, brighter, tomorrow, involves, getting, vaccinated, prevent, couid, -, nineteen, today, ."
47440,"i, said, it, before, but, i, ', all, say, it, again, ,, please, get, vaccinated, asap, ., we, are, not, rid, this, curse, but, we, can, limit, damage, by, working, fight, it, together, ."
47441,"vaccinated, people, are, far, less, likely, be, hospitalized, or, die, couid, ., that, ', i, immunity, ."
47442,"my, pancreas, is, not, working, specs, ,, any, number, i, can, call, service"
47443,"do, you, not, realize, military, you, have, get, vaccinated, ., when, you, join, you, have, get, vaccinated, almost, everything, ., so, what, you, ', re, saying, you, don, ', i, know, military, ., i, think, you, need, stop, talking, about, stuff, you, don, ', i, know, ."
47444,"absolutely, ,, school, will, even, tell, you, that, if, you, are, vaccinated, wear, mask, ,, you, can, still, catch, couid, spread, couid, ., no, one, had, wear, masks, back, when, other, flu, i, i, were, out, ."
47445,"no, what, i, am, saying, was, me, he, was, not, saying, less, intelligent, he, said, different, ,, two, different, things"
47446,"proud, my, cast, designers, ., bow, review, :, changing, channels, at, fulton, theater"
47447,"i, agree, with, statewide, vaccine, mandates, ., if, ur, not, willing, get, vaccinated, ., then, u, shouldn, ', i, have, job, ., #, isaidwhatisaid"
47448,"i, i, i, good, with, all, my, decisions, ., nothing, i, hate, more, then, bandwagon, jumpers, lol, -, remember, ., lifting, restrictions, phases, was, announced, before, party, convoy, i, because, large, population, vaccinated, ., or, ,, we, will, see, what, happens, ., it, will, lift, eventually, ."
47449,"same, here, ., half, us, are, vaccinated, half, aren, i, i, it, all, went, through, us, exactly, same, ., people, have, start, admitting, this, ."
47450,"agreed, ., what, blessing, that, you, were, where, you, needed, be, help, her, ., that, those, two, young, women, did, their, part, help, us, awesome, ."
47451,"yep, ,, she, did, say, hiv, &, amp, ;, now, they, ', re, telling, vaccinated, get, tested, hiv, ., smallpox, vaccine, caused, hiv, africa, one thousand, nine hundred and eighty-seven, saves, you, couid, which, you, already, had, ninety-nine, ., nine, %, chance, surviving, but, gives, you, hiv, which, has, much, greater, chance, killing, you, ., happy, now, grinning_face_with_big_eyes"
47452,"weird, i, haven, i, i, heard, that, ., maybe, it, i, i, because, majority, people, are, vaccinated, i, don, i, i, know, ., i, found, this, if, it, helps, ."
47453,"i, just, love, himred_heart, i"
47454,"fox, news, mandated, that, you, be, vaccinated, ."
47455,"last, time, i, checked, joe, is, still, notify"
47456,"fifteen, %, our, population, has, chosen, not, be, vaccinated, ., they, i, ve, ignored, best, medical, advice, two, years, ,, fact, that, their, choice, is, going, kill, their, neighbors, doesn, i, i, matter, them, ., if, you, don, i, i, see, how, that, i, i, deeply, depressing, ,, i, don, i, i, know, what, tell, you, ."
47457,"same, here, ., instead, asking, parents, what, took, them, so, long, finally, decide, get, themselves, or, their, kid, vaccinated, ,, i, try, validate, their, struggle, with, deciding, celebrate, with, them, ."
47458,"you, do, not, see, context, choose, not, that, ', i, fine, ,, i, did, am, not, offended, ,, i, just, find, it, curious, when, people, are, telling, black, people, what, be, offended, at, ,, it, ', i, kind, worrying"
47459,"i, we, got, medical, science, right, ., we, failed, social, science, ., we, failed, how, help, people, get, vaccinated, ,, combat, disinformation, ,, not, politicize, this, ., those, are, places, where, we, have, failed, as, america, i"
47460,"okay, i, i, i, confused, i, thought, jobs, weren, i, i, allowed, force, us, be, vaccinated, face_with_rolling_eyes"
47461,"people, who, are, vaccinated, are, still, dying, because, couid, ., this, is, not, fucking, normal, ."
47462,"we, all, already, know, that, eighty, %, canadians, have, been, vaccinated, ., also, recent, polls, show, that, fifty-four, %, all, canadians, want, all, mandates, end, ., there, are, lots, vaccinated, protesters, who, want, mandates, end, ."
47463,"talked, about, ', boutique, left, i, many, them, are, vilifying, truckers, falsely, calling, out, violence, ., although, i, get, vaccinated, ,, mandatory, vaccinations, are, wrong, ., i, agree, with"
47464,"it, ', i, too, bad, ;, however, ,, i, ', i, unclear, about, him, doing, "", everything, "", avoid, couid, but, he, only, addressed, isolating, ., did, he, get, vaccinated, boosted, that, ', i, not, clear, ., did, i, overlook, that, about, him"
47465,"people, :, "", white, people, saying, i, -, word, is, bad, i, rumble, :"
47466,"my, neighbor, works, at, hospital, she, said, about, six, months, after, first, wave, two thousand and twenty, they, starting, seeing, couid, patients, return, with, strokes, mi, ."
47467,"i, have, lots, friends, who, say, things, like, ,, "", i, worked, hard, ., nothing, was, given, us, ., how, are, we, privileged, "", i, always, say, white, privilege, doesn, ', i, mean, you, didn, ', i, overcome, obstacles, get, where, you, are, ., it, ', i, just, that, color, your, skin, isn, ', i, one, them, ."
47468,"if, you, i, ve, been, vaccinated, still, feel, mortally, threatened, by, virus, ,, please, read, this, ."
47469,"just, get, vaccinated, wear, mask, ., also, those, protesters, are, all, united, states, anyway, ., canadians, aren, i, i, that, rude"
47470,"unsure, about, getting, your, children, vaccinated, against, couid, -, nineteen, infectious, disease, expert, simone, wildest, ,, my, discusses, why, she, elected, have, both, her, children, vaccinated, ."
47471,"clapping_handsmedium_skin_toneclapping_handsmedium_skin_tone, good, they, didn, ', i, shut, down, bum, money, yet, they, did, truckers, ., they, also, allowed, bail, is, bum, rioters, ., just, double, standards, at"
47472,"ok, but, have, you, asked, "", why, does, fully, vaccinated, person, ,, boosted, ,, still, got, couid, ,, even, got, sick, ,, bedridden, "", doctor, whos, lobby, playing, manic, or, can, i, would, ask, all, doctors, regardless, race, ,, political, affiliation, ,, or, whatever, is, their, lobby, to, one, /, two"
47473,"he, also, full, video, laughed, at, how, stereotype, is, that, black, people, talk, alot, theaters, that, is, stereotype, ,, he, said, it, was, fun, he, had, amazing, time, that, theater, ,, so, yes, i, watched, it"
47474,"if, we, ', re, fully, vaccinated, ,, then, why, should, we, wear, mask, doesn, ', i, vaccine, stop, #, covid19"
47475,"bowled, once, got, score, sixty-nine"
47476,"except, exact, opposite, is, true, ., it, ', i, vaccinated, people, that, are, still, paranoid, ,, wearing, masks, hiding, under, their, beds, ., untaxed, have, been, living, normal, start, ."
47477,"my, place, employment, keeps, asking, when, i, i, i, coming, back, unamused_face, i, would, only, consider, going, back, if, i, got, my, travel, assignment, back, but, that, requires, me, get, vaccinated, &, amp, ;, i, i, i, not, so, why, keep, asking, whats, not, clicking"
47478,"holy, heck, people, who, don, i, i, get, vaccinated, are, nuts, unless, they, can, i, i, ,, course, ."
47479,"not, mention, i, omg, one hundred, %, deaths, would, be, among, vaccinated, i, that, scenario, i"
47480,"lieu, still, says, you, need, be, vaccinated, boosted, ., there, is, no, change, his, message, ., no, one, has, ever, said, persons, who, are, infected, with, cv19, don, ', i, develop, antibodies, ., but, that, protection, is, significantly, less, than, being, vaccinated, ., implying, otherwise, is, lie, ."
47481,"they, don, ', i, give, shite, ,, it, ', i, only, coercive, tactic, get, children, vaccinated, like, adults, when, numbers, are, high, enough, ,, voila, ,, masks, won, ', i, be, needed"
47482,"this, is, only, and, time, i, i, ve, gotten, it, ,, first, time, since, i, got, vaccinated, face_with_tears_of_joy"
47483,"i, did, see, that, clip, it, ', i, entirety, did, not, see, racist, intent, ,, it, was, poor, wording, not, racist, entire, video, he, goes, say, how, it, was, hella, fun, was, respectful, black, community"
47484,"i, think, that, leaves, two, likely, possibilities, ., one, ,, is, that, weekly, surveillance, report, excludes, ord, doses, fully, vaccinated, cohort, ., other, possibility, is, that, calculating, untaxed, ,, they, double, counted, subtracting, those, with, three, doses, ."
47485,"sending, prayers, folded_handslight_skin_tonefolded_handslight_skin_tone, your, way, ., i, hope, your, vaccinated, boosted, then, you, i, re, going, be, ok, ."
47486,"this, is, life, @, terrible, #, olympicgames, given, #, covid19, with, #, athletes, already, #, vaccinated, &, amp, ;, still, test, positive, #, covid19, another, #, vaccinesideeffects, #, covidvaccine"
47487,"anyone, here, vaccinated, ,, but, avoiding, booster, what, is, thinking"
47488,"two, /, he, claimed, boys, ', mother, had, them, vaccinated, just, spite, him, ,, because, pat, ', i, mind, ,, everything, is, about, him, ., reminder, that, his, eldest, got, vaccinated, his, own, ., yes, ,, earlier, days, ,, pat, was, one, "", death, jab, "", adherents, ."
47489,"don, con, ', i, discipline, may, indeed, turn, out, be, worse, than, #, dog, ., wake, up, #, virginia, #, preterm"
47490,"i, i, i, pigeon, don, i, i, scare, me, ."
47491,"whole, school, masked, many, vaccinated, got, it, ., all, them, fine, ., masking, young, child, against, something, that, mask, doesn, i, i, protect, them, all, real, science, says, will, not, be, deadly, them, i, is, cruel, ., you, are, cruel, if, you, mask, toddler, ."
47492,"i, now, literally, don, i, i, have, anyone, my, life, friends, or, family, now, i, struggle, alone, ,, but, at, least, i, i, i, not, being, gaslighted, &, amp, ;, told, i, it, i, i, not, that, bad, i, or, i, man, up, i"
47493,"just, took, ace, vet, get, his, two, yr, old, shot, i, white, lady, come, outside, get, him, cause, i, i, i, not, vaccinated, so, i, i, i, not, allowed, inside, i, then, want, me, pay, $, ninety-three, ahead, getting, shot"
47494,"tell, me, again, how, us, is, "", best, country, world, """
47495,"it, mentions, western, ..., i, can, only, guess, ., flushed_facepoor, girls, women, over, there, ..."
47496,"time, you, jets, into, sunset"
47497,"jerome, i, ."
47498,"bright, eyed, fred"
47499,"you, divide, number, dead, by, number, million, valued, or, untaxed, ., so, ,, massachusetts, has, five, ., two, million, vaccinated, ,, i, divide, by, five, ., two, ., that, gives, me, death, rate, per, million, except, i, did, hospitalizations, repeat, other, group, ., ma, ,, divider, was, one, ., six, ."
47500,"i, dont, think, thats, how, it, works, i, adding, single, dot, piece"
47501,""", it, ', i, called, evolution, meghan, ., why, aren, ', i, you, swinging, tree, """
47502,"now, that, i, i, i, done, talking, shit, ., david, ,, i, like, your, hat, ."
47503,"as, safe, as, its, been, we, nurses, ,, doctors, healthcare, workers, who, have, be, constantly, wearing, masks, january, two thousand and twenty, ., i, notice, no, one, cares, about, us, anymore, ., we, were, heroes, two thousand and twenty, but, not, now, ., i, am, fully, vaccinated, ., if, u, i, not, dont, come, talk, up, my, face, period, ."
47504,"report, :, nearly, eighty, %, omicron, cases, are, vaccinated, people, ."
47505,"smiling_face_with_heart, -, eyespurple_heart"
47506,vey
47507,"this, would, be, just, businesses, -, not, schools, hocus, says, she, wants, more, kids, be, vaccinated, before, decision, is, made, masks, schools"
47508,"i, don, i, i, know, that, many, republicans, that, are, still, supporting, tag, are, capable, self, reflection, at, this, point, ,, hana, ."
47509,"are, you, guys, are, going, continue, mandate, your, group, a, ,, i, #, actors, be, vaccinated, ., even, after, senate, usa, is, against, #, foci, recommendations, #, osha, stepped, down, as, well, #, empty, #, sagaftra, #, dna, #, its"
47510,"most, important, thing, do, when, being, attacked, like, this, make, sure, you, have, mask, get, vaccinated, ., #, letsgobrandon"
47511,"this, man, is, terrorist, ."
47512,"today, is, anniversary, viola, ', i, death, sad_but_relieved_face"
47513,"&, amp, ;, are, both, pointedly, hilarious, ., their, comic, relief, is, so, appreciated, these, days, ."
47514,"heck, yea, grass"
47515,"fun, graph, ., guess, when, old, man, david, went, school, ., understanding, that, this, doesn, i, i, go, far, enough, either, way, show, what, his, tuition, costs, or, what, people, going, school, today, pay, ."
47516,"don, i, i, live, there, ., but, everywhere, i, i, ve, ever, lived, ,, requires, vaccinations, ., have, show, doctor, i, i, proof, ,, or, as, you, say, ,, doctor, has, give, professional, reason, not, being, vaccinated, ., not, just, because, i, don, i, i, want, to, ."
47517,face_with_tears_of_joyraising_handsmedium_skin_tone
47518,"very, sad, news, coming, anniversary, her, sister, viola, ', i, death, crying_face"
47519,"why, is, it, so, hard, your, acknowledge, how, dramatically, risk, death, decreases, vaccinated"
47520,"rant, time, :, i, don, i, i, care, what, ny, mayor, eric, adams, eats, ., i, don, i, i, care, if, politician, any, party, takes, picture, with, or, without, mask, ., i, don, i, i, care, if, politician, any, party, is, vaccinated, ., focus, doing, job, you, were, elected, for, ., end, rant"
47521,"he, caught, couid, july, -, was, he, vaccinated, it, doesn, ', i, say, ., while, i, ', i, glad, he, survived, ,, if, he, wasn, ', i, vaccinated, ,, one hundred and ninety-seven, days, hospital, used, lot, resources, ."
47522,"mask, up, get, vaccinated, i, ', i, listening, ', we, ', re, not, gonna, take, it, ', by, twisted, sister, dash, radio, -"
47523,"my, entire, childhood, ,, every, time, when, i, was, soldier, seeking, help, ,, &, amp, ;, just, about, every, time, i, i, ve, struggled, while, relationship, ., so, practically, any, time, i, i, ve, had, others, my, life, i"
47524,"this, person, is, sick, ."
47525,"y, i, all, are, batpile_of_poo, crazy, ., my, son, literally, was, masked, at, school, got, couid, fully, vaccinated, child, ., your, government, science, is, is, i, he, gave, it, his, brother, ., both, over, mild, symptoms, three, days, ., i, your, fear, selective, i, science, i"
47526,"washington, county, wayne, county, we, know, you, ', re, looking, out, us"
47527,"ten, years, experience, ,, masters, ,, we, ', all, give, you, $, eleven, per, hour"
47528,"are, you, black, bow, just, curious"
47529,"just, wear, mask, get, vaccinated"
47530,often
47531,"i, cannot, understand, why, you, would, end, mask, mandates, without, ensuring, everyone, is, vaccinated, ., don, ', i, allow, students, back, building, until, they, ', re, vaccinated, ., otherwise, students, become, breeding, ground, next, variant"
47532,"grateful, everyone, who, wear, mask, public, indoor, places, ,, obey, -, even, though, it, isn, i, i, fun, -, health, mandates, slow, spread, help, reduce, hospitalizations, ,, then, by, freely, choosing, get, vaccinated, ., i, am, happy, be, this, world, with, you, -, thank, you, ., red_heartred_heartred_heart"
47533,"if, they, can, ', i, choose, ,, then, why, do, some, businesses, require, employees, be, vaccinated, ,, others, don, ', i, sounds, like, there, ', i, choice, me"
47534,"this, is, indirect, plug, awesome, player, -, made, product, :, i"
47535,"if, you, are, vaccinated, ,, why, is, mask, necessary, there, should, be, no, need, it, ., vaccine, offers, full, protection, ., vaccinated, should, be, fine, ,, no, need, worry, about, untaxed, ."
47536,"i, know, people, united, states, who, didn, ', i, get, vaccinated, until, really, late, thanks, bolivian, government, ', i, misinformation, campaign, ., i, would, love, see, same, liberal, outrage, currently, being, directed, at, joe, organ, at"
47537,"you, sonofabitch, ,, i, ', i, in, ."
47538,"uk, government, has, admitted, that, once, you, have, been, double, -, vaccinated, ,, you, will, never, be, able, acquire, full, natural, immunity, couid, variants, i, or, possibly, any, other, virus, ."
47539,"i, find, it, curious, all, day, white, people, are, telling, me, as, black, man, what, i, should, shouldn, ', i, be, offended, at, ,, very, curious, ."
47540,"so, i, mean, ,, if, you, don, ', i, want, get, vaccinated, that, is, fine, just, know, that, ', i, part, reason, these, mandates, are, likely, stay, place, while, ."
47541,"there, i, i, no, rational, reason, not, allow, sixplexes, ,, but, there, are, other, choices, besides, two, above, ."
47542,"you, have, lies, us, why, hasn, i, i, mom, told, canadians, that, we, are, lined, up, eleven, jabs, why, haven, i, i, you, been, honest, with, society, share, what, is, your, opinion, if, i, fully, vaccinated, i"
47543,"ah, -, i, thought, it, was, olympic, thing, which, im, not, watching, ., three, us, grad, school, about, two thousand, published, article, canadian, nationalism, ,, which, had, section, basically, saying, "", there, ', i, always, Canada, "", -, there, ', i, always, Canada, loon, at, any, event, ,, even, /, esp, ., outside, canada"
47544,"depends, what, you, mean, by, exploiting, ."
47545,"my, weekly, per, test, ., sad, when, they, know, your, name"
47546,"or, is, it, pregnant"
47547,"i, agree, this, was, foolish, ,, but, he, was, attempting, defend, not, be, racist, ,, joe, organ, i, do, not, think, is, racist, ,, we, are, making, slippery, slopes, why, are, white, people, telling, black, people, what, be, offended, at"
47548,"if, your, kid, is, vaccinated, ,, what, does, it, matter, if, another, kid, is, massless"
47549,"amen, brother, ., perfectly, succinctly, stated, ."
47550,"hopefully, all, goes, well, red_heart, i, adhesive_bandage"
47551,"it, would, be, good, idea, if, all, adults, were, fully, vaccinated, months, ago, ,, before, delta, raged, ,, &, amp, ;, then, omicron, raged, ., but, you, didn, ', i, so, ....., take, some, responsibility, your, misinformation, ,, disinformation, ,, propaganda, ,, all, around, #, cultrightbs, your, #, seditioncaucus"
47552,"proportion, is, probably, fairly, accurate, tbe, ;, problem, with, stencil, et, al, is, that, by, ignoring, base, rates, they, i, re, still, overstating, risk, vaccinated, ,, not, acknowledging, boosters, either"
47553,"well, ..., despite, taking, all, precautions, ,, getting, vaccinated, boosted, ,, rarely, going, anywhere, ,, always, wearing, mask, ,, i, tested, positive, couid, yesterday, ., oh, ,, i, am, high, risk, ., thanks, ,, america, ."
47554,"party_poppermembers, public, are, welcome, join, us, this, weekend, audience, members, must, be, fully, vaccinated, masked, at, all, times, ;, no, food, or, drink, permitted, livestream, is, also, available, at"
47555,"not, all, as, ninety, %, are, vaccinated, it, i, i, just, wusses, that, don, i, i, want, be, vaccinated, that, are, whining"
47556,"happy, birthday, you, ., you, have, my, best, ., happy, celebrating, ."
