,0
63804,"this, week, scott, brought, illumine, ', i, ceo, with, him, ., coincidence, he, is, that, bod, too, ., its, called, relationship, unbranded, selling, pharma, ., "", we, need, vaccines, "", insert, pfizer, "", we, need, sequencing, "", insert, illumine, ., he, needs, am, masks, promotional, hat, trick, ."
63805,"follow, money, i, wall, secrecy, i, pfizer, contracts, as, company, accused, profiteering"
63806,"i, got, my, pfizer, booster, third, jab, ., healthcare, center, mountain, view, where, i, got, it, was, having, i, kids, i, day, i, vaccination, i, dozens, children, were, there, with, their, parents, get, their, first, vaccine, shot, ., ninety-nine, %, kids, were, super, brave, i, no, crying, ,, etc, ."
63807,"These, questions, are, understandable, in, a, quilombo, called, Argentina, ., now, ,, the, international, conspiracy, and, that, pfizer, or, modern, makes, you, I, don, ', i, know, what, it, is, for, screenwriters, of, movies, like, two thousand and twelve, ., I, remember, that, here, it, was, just, a, bad, movie, and, in, Argentina, they, were, terrified, i, person_shrugging, i, male_sign, i"
63808,"yes, raising_hands, clapping_handsglobal, pandemic, needs, global, vaccines, #, pfizer, #, astrazeneca, #, modern, #, boostervaccine, #, thirddose, #, omicron"
63809,"pfizer, said, ten, months, before, booster, i, i, will, not, get, booster, till, then, period, i, no, idea, what, this, is, doing, my, body"
63810,"because, it, i, i, common, cold, flu, that, has, always, been, here"
63811,"one, ,, two hundred, pfizer, vaccine, deaths, first, ninety, days, ."
63812,"fda, doesn, ', i, have, data, this, age, group, yet, i, not, enough, era, ., pfizer, is, still, trying, enroll, studies, ., data, is, trickling, as, these, cohorts, are, much, harder, enroll, than, five, -, eleven, group, that, just, got, era, ."
63813,"As, I, have, been, twice, vaccinated, and, informed, with, Pfizer, ,, the, only, thing, I, can, hope, for, is, that, if, I, have, couid, -, nineteen, they, don, ', i, send, me, to, the, hospital, and, /, or, I, die, ., there, is, nothing, else, that, can, prevent, the, vaccine, ., person_shrugging, i, male_sign, i"
63814,"they, care, deeply, about, animal, welfare, ,, they, have, impressive, lab, team, scientists, working, at, their, facility, ., they, follow, gal, max, ., gal, =, good, laboratory, practices, ., i, trust, animal, safety, studies, that, came, out, their, collaboration, with, pfizer, ."
63815,"all, my, shots, have, been, pfizer"
63816,"we, have, a, friend, who, is, anti, -, zombie, vaccines, ,, agenda, two thousand and thirty, and, other, nonsense, ., I, took, a, selfie, selfie, here, to, strengthen, the, friendship, lol, rolling_on_the_floor_laughingrolling_on_the_floor_laughing, pfizer, syringe, #, omicronvarient, #, pfizer, #, vaccinationobligatoire"
63817,"i, received, pfizer, booster, shot, but, knocked, me, out, three, days, ., it, felt, like, my, and, vaccinate, shot, ."
63818,"i, got, pfizer, vaccine, booster, ., no, side, effects, ."
63819,"among, community, -, dwelling, non, -, healthcare, workers, living, israel, without, prior, couid, -, nineteen, ,, matched, observational, study, implies, two, +, booster, is, two, but, /, pfizer, vaccine, doses, leads, ninety-three, %, i, hospitalization, &, amp, ;, eighty-one, %, i, death, couid, -, nineteen"
63820,"we, should, just, suspend, patent, protections, transfer, technology, ,, but, if, is, really, hellbent, trying, put, profit, above, lives, just, have, set, up, joint, ventures, rapid, manufacturing, supported, by, i, ., america, ,, africa, ,, asia"
63821,"fantastic, though, that, with, ninety, %, of, the, population, vaccinated, still, talking, about, restrictions, ,, but, no, one, is, talking, about, the, pfizer, pill, which, reduced, severe, cases, by, ninety, i, likes, locking, up, our, children, rather, than, kicking, the, ass, of, our, medical, agencies"
63822,"does, have, financial, ties, or, pretty, simple, question"
63823,"i, i, i, not, ., just, thought, pfizer, could, i, ve, put, little, sleepy, vaccine, us, grinning_squinting_face, as, bonus, ."
63824,"whether, or, not, you, receive, booster, ,, two, main, doses, pfizer, or, modern, means, you, are, fully, vaccinated, ., effectiveness, does, wane, over, time, ., between, five, -, six, months, ,, booster, is, needed, ., however, ,, receiving, vaccine, now, gives, you, added, protection, your, immune, system, ."
63825,"is, this, what, you, want, ,, our, saskatchewan, children, one hundred and twenty, children, hospitalized, ,, province, suspends, pfizer, vaccine, batch"
63826,"this, is, actual, pfizer, report, ., by, saying, it, ', i, misinformation, you, ', re, saying, they, never, should, have, been, given, eau, status, ."
63827,"i, i, mon, pfizer, you, could, i, ve, at, -, least, put, benadryl, your, five, -, eleven, vaccine, ., my, son, popped, out, bed, at, am, this, morning, ., humor, parents, ,, knock, kids, out, like, you, did, us, ., #, vaccinesideeffects"
63828,"where, they, said, that, in, the, US, they, put, the, same, pfizer, biden, as, a, third, vaccine, or, reinforcement, they, applied, that"
63829,"got, flu, pfizer, booster, ,, only, two, sore, arms"
63830,"first, batch, foil, documents, released, by, fda, about, pfizer, ', i, couid, vaccines, shows, one, ,, two hundred and twenty-three, deaths, already, reported, early, february, two thousand and twenty-one"
63831,"I, ask, because, I, took, the, est, and, and, dose, of, pfizer, in, Brazil, ., but, now, i, live, in, usa, ,, i, can, take, ord, whenever, i, want, ., but, if, answer, is, better, from, that, period, ,, I, will, wait, ., Thanks"
63832,"modern, i, &, amp, ;, i, are, not, approved, either, ., they, only, have, have, era, ., but, no, one, is, claiming, that, astrazeneca, has, either, era, or, approved, ., that, doesn, ', i, not, mean, that, they, weren, ', i, used, clinical, trials, ., pfizer, ,, modern, ,, i, &, amp, ;, i, also, didn, ', i, have, era, or, approval, when, rec, started, ."
63833,"you, can, find, article, about, pfizer, i, i, unconscionable, crimes, ,, past, present, ,, by, do, ., joseph, pergola, ,, that, has, already, been, censored, off, twitter, ."
63834,"i, had, #, pfizer, booster, same, as, my, first, two, doses, ., awful, side, effects, i, swollen, throat, ,, tongue, ,, high, fever, ,, fatigue, ,, bruising, ,, headache, ,, body, aches, also, skin, lesion, ., but, now, i, i, i, boosted, while, numbers, climb, ,, so, end, ,, here, i, i, hoping, my, efforts, be, safe, are, worth, it, ."
63835,"if, government, i, i, weren, i, i, conducting, clandestine, virology, experiments, chinese, labs, ,, we, wouldn, i, i, be, this, situation, ., something, think, about, i, #, omicron, #, covid19, #, strictly, #, pfizer, #, whan"
63836,"thursday, evening, very, little, side, effects, ., some, soreness, my, arm, morning, but, it, i, i, wasn, i, i, constant, or, debilitating, ., i, had, pfizer, if, that, helps, anyone, ."
63837,"my, big, #, yearold, daughter, ivy, is, now, #, fullyvaccinated, 1st_place_medal2nd_place_medal, #, pfizer"
63838,"ivermectin, has, been, proven, be, effective, prophylactic, as, well, as, therapeutic, treatment, ., there, are, viable, alternatives, getting, stabbed, with, covid19, van, ,, including, monoclonal, antibodies, ., vaccines, are, not, only, viable, solution, this, virus, ., consult, your, physician, ."
63839,"that, ', i, one, i, ', i, getting, twelve, /, seventeen, as, my, booster, cuz, i, couldn, ', i, find, app, pfizer, match, my, est, two, ., do, chin, said, it, was, ok, mix, two, ., this, is, earliest, i, could, find, app, after, they, lowered, age, sixty-five, &, amp, ;, up, i, ', i, sixty-four, ."
63840,"woo, hoo, #, getvaccinatednow, ., i, just, got, modern, booster, after, pfizer, initial, shots, had, no, side, effects, whatsoever, -, not, even, sore, arm, ."
63841,"pfizer, i, i, own, data, after, ninety, days"
63842,"mindset, nonvaxr, is, ..., willing, accept, benefits, natural, infection, ,, but, not, willing, accept, risks, vaccine, ., there, are, risks, associated, with, covid19, vaccine, ., the, nova, community, will, become, control, group, related, spikes, van, related, issues, ."
63843,"give, people, their, inalienable, right, choose, their, own, path, immunity, ., vad, u, have, supposed, immunity, nonvaxrs, are, willing, be, infected, by, other, nonvaxrs, ., they, acheive, immunity, naturally, each, other, ., i, am, not, anthrax, i, am, pro, -, choice, ., i, am, against, van, mandate, ."
63844,"fully, vaccinated, +, booster, still, masking, up, everywhere, i, go, syringeface_with_medical_mask, thank, you"
63845,"you, know, what, i, am, seeing, twitter, this, psychological, operation, public, is, failing, miserably, ., majority, posts, are, contradicting, narrative, being, promoted, &, amp, ;, marketed, by, sleepy, creepy, biden, admin, ., despite, what, they, would, like, us, believe, pandemic"
63846,"pfizer, booster"
63847,":, i, the, better, #, eat, you, with, ,, my, dear, i"
63848,"doesn, i, i, change, fact, that, everything, he, wrote, is, one hundred, %, true, because, you, can, use, some, other, funds, doesn, i, i, change, fact, pfizer, is, off, scott, free, at, someone, else, i, i, expense, ."
63849,"no, i, i, i, saying, it, i, i, not, applicable, pfizer, i, i, lack, liability, ., like, guy, that, hit, my, car, without, insurance, stated, it, was, ok, because, i, was, insured, ., he, was, also, shit, bag, ., it, stands, true, that, he, was, shit, bag, even, if, my, car, was, repaired, ., not, partial, truth, ."
63850,"and, which, one, would, boost, adults, vaccinated, with, pfizer"
63851,"because, being, cancer, survivor, ,, half, my, platelets, are, missing, ,, i, had, all, three, shots, pfizer, ,, still, i, came, down, with, couid, -, nineteen, this, past, thursday, ., exclusive, :, people, new, york, uniting, against, mandates, ., taking, action, via"
63852,"please, follow, links, raw, data, think, about, numbers, moving, forward, is, all, i, ask, ., if, pfizer, vaccine, had, two, ., eight, %, fatality, rate, then, that, would, massive, number, dwarfing, deaths, couid, so, far, ."
63853,"couid, -, nineteen, live, updates, :, many, vaccines, offer, protection, as, boosters, ;, pfizer, modern, may, work, best, ,, study, says, -, washington, post"
63854,"got, my, first, couid, vaccine, today, at, ., it, was, easy, fast, ., hopefully, i, don, ', i, get, sick, because, this, four_leaf_cloverfolded_hands, #, covidvaccine, #, pfizer, #, firstvaccine"
63855,"two, pfizer, ', i, booster, got, both, me, hubby"
63856,"following, people, are, totally, exempt, ', vaccine, i, all, us, senators, house, representatives, plus, all, congressional, staff, ;, six, ,, zero, white, house, employees, ;, all, employees, pfizer, two, ,, five hundred, ,, modern, one, ,, five hundred, ,, johnson, &, amp, ;, johnson, one hundred and twenty, ,, zero, ;, fifteen, ,, zero, cac, workers, ;, fourteen, ,, zero, fda"
63857,"had, my, pfizer, booster, yesterday, and, i, just, like, last, time, i, not, feeling, sick, at, all, ,, just, super, sleepy, my, joints, are, all, sore, ."
63858,"so, my, faith, fda, decision, making, is, skeptical, especially, when, two, members, step, down, recently, prior, booster, approval, disagreement, ,, recent, fda, member, become, pfizer, commissioner, ."
63859,"hey, girl, i, is, your, name, pfizer, cause, you, make, my, heart, stop"
63860,"just, completed, all, my, required, coursework, this, edd, journey, celebrated, this, accomplishment, with, pfizer, booster, ., twelve, more, credits, independent, dissertation, research, go"
63861,"interesting, the, variety, of, genres, in, the, format, to, receive, vaccine, #, pfizer, #, covid19, #, vacunacovid19"
63862,"It, should, be, noted, that, the, publication, does, not, make, a, comparison, between, types, of, vaccines, ., it, only, points, to, the, advantage, of, a, third, dose, for, patients, who, received, both, doses, of, pfizer, bnt162b2"
63863,"i, did, ..., easier, detect, scars, reading, body, language, &, amp, ;, tone, voice, ., yeah, ,, no, profit, motive, sell, ivermectin, ., big, pharma, is, working, conjunction, with, mom, &, amp, ;, goats, ., market, products, they, can, make, profit, on, ., profit, is, higher, priority, than, public, health, ., apathy, public"
63864,"chris, rock, said, it, best, ,, drug, dealer, don, i, i, make, his, profit, off, dope, ,, it, i, i, off, comeback, ., pfizer, modern, got, y, i, all, coming, back, back, back, woozy_face"
63865,"yes, ,, there, are, hav, vaccines, that, prevent, cervical, /, anal, cancer, but, also, :, did, you, know, company, that, created, most, widely, used, couid, vaccine, i, pfizer, i, i, i, is, verge, releasing, mrna, vaccines, series, common, cancers"
63866,"#, last, minute, :, on, Tuesday, ,, December, seven, ,, booster, vaccination, begins, for, people, over, sixty-five, years, of, age, in, Mexico, ,, apparently, they, will, apply, all, the, vaccines, except, those, reserved, for, young, people, ..."
63867,"achievement, unlockeTongue_sticking_out_cheeky_playful_or_blowing_a_raspberry, pfizer, vaccine, booster, completed"
63868,"it, is, more, powerful, than, the, pfizer, ,, you, fo, three, of, pfizer, and, only, arm, pain"
63869,"well, ,, ivermectin, went, through, typical, five, -, ten, yr, ., animal, &, amp, ;, human, ,, double, blind, clinical, studies, ., has, been, approved, human, doses, by, fda, over, two, decades, ., is, also, available, prescription, by, your, local, go, medical, practitioner, treating, humans, ., consult, him, ., stoptheshittalk"
63870,"people, are, very, divided, on, pfizer, ', i, ord, vaccine, ."
63871,"excuse, me, ...., could, u, please, refer, it, as, non, -, var, issue, thank, you, very, little"
63872,"I, can, take, a, third, dose, whenever, I, want, recommend, another, brand, if, I, already, took, pfizer, my, boyfriend, took, johnson, and, is, in, doubt, if, he, can, take, another, brand, of, booster, too"
63873,"tastes, like, pfizer"
63874,"Pfizer, has, almost, no, side, reactions, ,, and, I, wondered, if, it, would, be, a, side, reaction, if, I, set, it, to, modern, ,, but, so, far, there, are, few, ., I, ', i, drinking, tylenol, though, ., On, the, contrary, ,, I, ', i, worried, whether, it, works, ."
63875,"triple, vaccinated, red_heart, i, thank, you, to, the, staff, of, for, your, patience, and, diligence, at, the, dearie, square, vaccination, center, thanks, to, ruathans, for, laughing, at, my, jokes, :, #, pfizer, #, booster, #, covid19, #, 3emedose"
63876,"either, pfizer, or, modern, is, fine, ., difference, isn, ', i, much, ., most, important, thing, is, just, getting, booster, ., will, put, him, back, into, is, effectiveness, ,, with, either, i, or, i, ."
63877,"or, conscious, if, ,, i, don, i, i, know, wild, example, here, ,, sit, board"
63878,"there, were, doses, pfizer, at, cos, but, nobody, showed, up, put, one, my, arm, that, i, i, how, i, didn, i, i, get, my, booster, today"
63879,"ah, ,, in, your, country, you, have, to, pay, for, it, ,, that, ', i, why, you, don, ', i, get, stingy, but, to, buy, the, weekend, viagra, pfizer, you, don, ', i, have, problems, the, doctors, don, ', i, pay, them, for, vaccination, of, this, genius, virus, it, ', i, free, for, the, population, ,, it, ', i, called, public, health, which, you, enjoy"
63880,"glad, it, i, i, not, as, rough, you, ., that, was, miserable, experience"
63881,"get, third, shot, your, series, modern, or, pfizer, at, six, months, ., boost, your, johnson, johnson, too, ., next, couid, wave, is, approaching, now, you, have, time, prepare, ., wear, mask, all, indoor, events, ., omicron, delta, are, both, harmful, ."
63882,"ask, is, reported, reactions, hundreds, millions, doses, given, ., weirdly, redacted, as, i, -, four, this, but, number, pfizer, doses, given, is, available, ."
63883,"fully, vaccinated, i, what, relief, thank, you, +, providing, #, covid19, vaccine, my, two, greatest, treasures, i, all, children, ,, ages, five, -, eleven, ,, all, across, nation, ., i, thanks, special, kids, tac, ., #, getvaccinatedsyringe, #, kidsvaccineflexed_bicepsmedium, -, light_skin_tone"
63884,"boosted, mixing, matching, this, time, out, with, modern, layer, top, pfizer, last, run, ., otsu, logistics, game, is, strong, ."
63885,"record, case, anyone, is, nervous, about, it, ,, i, had, next, no, side, effects, pfizer, booster, shot, ., was, easy, checkmark, i"
63886,"we, all, got, vaccinated, with, the, pfizer, one, ., my, wife, and, I, with, booster, ord, dose, and, our, boys, aged, twelve, and, fourteen, with, two, doses, ., burning, in, the, arm, on, the, second, day, and, a, little, decay, ., nothing, more, ., oh, ,, and, I, no, longer, suffered, from, the, headaches, I, had, before, ,, after, the, ord, ., at, least, for, now, ."
63887,"study, reveals, pfizer, astrazeneca, vaccines, cause, strokes, ., other, news, ..., fully, syringe, biden, got, cold, by, kissing, one, year, old, kid, ."
63888,"i, i, i, adding, three, /, three, i, there, i, i, no, long, -, term, proof, anything, yet, but, it, doesn, i, i, look, good, at, this, point, ,, does, it, anecdotal, ,, pfizer, i, i, slow, release, their, data, also, ought, raise, alarms, ., my, not, -, fancy, advice, is, look, with, objectivity, pray, i, eyes, see, i, best, you, ."
63889,"here, is, one, that, gad, had, nothing, ., pfizer, touched, me, ."
63890,"it, :, today, #, napafarmersmarket, #, free, #, couid, shots, -, including, pfizer, &, amp, ;, modern, boosters, today, eight, a, ., i, ., twelve, i, ., i, at, ,, one thousand, one hundred, west, it, ., no, appointment, or, insurance, needed, ., bring, photo, id, proof, #, vaccination, ., children, twelve, up, must, be, accompanied, by, parent, ."
63891,"all, these, anti, -, vaccines, are, really, very, hypocritical, because, I, see, them, taking, all, kinds, of, medicines, when, they, get, sick, ,, because, they, don, ', i, take, guanacos, when, they, feel, bad, ,, they, don, ', i, go, directly, to, acetaminophen, and, the, old, people, to, viagra, and, it, ', i, from, pfizer"
63892,"Tell, your, followers, how, many, medications, you, take, without, saying, a, word, ,, especially, the, one, from, Pfizer, that, you, cannot, live, without"
63893,"family, that, gets, vaccinated, together, ,, stays, together, purple_heart, priscilla, elmhurst, was, kind, &, amp, ;, quick, as, my, son, got, his, and, dose, pfizer, ;, it, was, painless"
63894,"i, had, pfizer, ,, ord, shot, next, day, i, felt, little, rundown, but, some, ibuprofen, took, edge, off, ., next, day, woke, up, fine, ., i, suggest, taking, ibuprofen, right, before, shot, ,, probably, again, next, morning, ."
63895,"modern, ,, modern, &, amp, ;, pfizer, sounds, like, tesla, i, i, in, -, house, representation, ."
63896,"yes, ,, will, be, pfizer, xu, me, too, ."
63897,"third, dose, pfizer, or, as, they, say, here, vaccine, booster"
63898,"many, are, getting, couid, &, amp, ;, being, hospitalized, after, having, two, does, shot, ., this, is, shot, still, being, investigated, ., no, one, really, knows, it, i, i, too, new, ., pfizer, is, making, plenty, money, ."
63899,"read, about, those, who, died, ., cac, &, amp, ;, faci, won, i, i, tell, you, ., faci, ,, pfizer, bill, gates, gave, money, whan, lab, ., read, about, how, many, young, men, died, pfizer, shot, causing, heart, problems, ., read, &, amp, ;, investigate, other, things, besides, fake, news, ."
63900,"katarina, i, i, got, couid, vaccine, #, 1stdose, #, pfizer, #, goodjobbabygirl, girllight_skin_tonesyringefolded_handslight_skin_tone"
63901,"I, already, did, it, I, ', i, going, to, look, for, my, pfizer, booster"
63902,"ord, pfizer, dose, got, me, feeling, like, i, got, kicked, lower, back, ., terrible, night, i, i, sleep, with, bad, headache, ,, lots, chills, &, amp, ;, sweating, very, sore, arm, ., one hundred, %, would, still, do, it, again, keep, couid, at, bay, ., also, i, got, off, easy, reacting, my, first, two, doses, ,, so, i, was, due, ."
63903,"yep, got, my, and, shingles, shot, yesterday, my, arm, is, hurting, weary_face, but, bright, side, pfizer, syringesyringesyringe, flu, syringe, shingles, syringesyringe, feeling, as, protected, as, i, can, be, folded_handsface_with_medical_mask"
63904,"boosted, my, pfizer, vaccines, with, modern, today, ., thank, you, you, all, other, scientists, making, this, possible, ."
63905,"first, one, i, felt, little, flush, slept, most, day, after, ., second, one, just, had, sore, arm, ., i, had, pfizer, ."
63906,"as, i, lay, here, ,, tossing, &, amp, ;, turning, ,, fever, ,, chills, ,, sweating, ..., i, think, back, earlier, today, ,, when, my, pop, told, me, pfizer, booster, is, not, as, gnarly, as, modern, booster, ., he, ', i, right, fact, that, my, arm, doesn, ', i, hurt, as, bad, ."
63907,"yes, #, modern, is, #, one, but, #, pfizer, is, very, good, as, well, ., please, please, #, getvaccinatednow, we, must, all, work, together, get, #, covid_19, under, control, ."
63908,"recently, boosted, too, i, have, 2xmoderna, +, pfizer, ., flexed_bicepslight_skin_tone"
63909,"after, my, second, shot, pfizer, i, had, chills, ,, fever, ,, body, aches, ., i, got, my, booster, yesterday, nothing, but, hurt, arm, ."
63910,"#, coronavirussicilia, #, cloaca, vaccine, ,, minor, :, "", pfizer, and, modern, stocks, arrive, in, sicily, """
63911,"crumbles, were, found, scrolling, through, facebook, their, cell, phones, commercial, building, ,, with, their, gas, -, equipped, suv, parked, out, back, ., obviously, ,, they, were, tracked, down, by, pfizer, ."
63912,"pfizer, will, not, give, mrna, shot, countries, they, face, legal, liabilities, side, effects, "", pfizer, hesitant, go, into, some, countries, because, liability, problems, ,, they, don, i, i, have, liability, shield, i, -, world, bank, president, david, hallpass"
63913,"it, ', i, exhausting, be, around, ., my, immune, system, took, permanent, hit, ., she, ', i, emotional, vampire, vampire, i, female_sign, i"
63914,"pfizer, i, i, unconscionable, crimes, ,, past, present"
63915,"has, nothing, do, it, i, i, relationship, between, reuters, pfizer, ., nah, ."
63916,"i, i, ve, had, pfizer, i, three"
63917,"i, got, my, pfizer, og, booster, yesterday, side, effects, have, kicked, woozy_face"
63918,"ah, yeah, my, arm, hurt, all, three, ., did, you, get, pfizer"
63919,"maybe, if, i, get, super, baked, ,, i, won, ', i, know, if, pfizer, booster, makes, me, feel, as, shitty, as, modern, ...."
63920,"The, face, of, young, people, between, fifteen, and, seventeen, years, old, who, have, already, received, the, est, dose, of, #, pfizer, makes, me, #, happy"
63921,"damn, ,, did, you, get, pfizer"
63922,"i, got, my, booster, pfizer, with, flu, shot, ., i, had, no, symptoms, that, day, ,, but, twelve, -, twentyfour, his, later, i, had, major, chills, ,, my, whole, body, hurt, ,, major, fatigue, ,, joint, muscle, pain, ,, headache, ., lasted, entire, day, then, no, symptoms, ."
63923,"i, see, more, &, amp, ;, more, people, saying, they, had, really, bad, side, effects, their, booster, ., i, didn, i, i, have, any, any, my, three, pfizer, shots, ., maybe, my, immune, system, sucks"
63924,"first, round, van, versus, booster, ., this, one, hurt, bit, bled, lot, comparison, first, round, she, i, didn, i, i, bleed, at, all, ., i, did, get, it, different, arm, this, time, ., stuck, with, pfizer, ."
63925,"pfizer, all, three, ., after, third, shot, booster, ,, felt, light, -, headed, dizzy, had, headache, ,, but, not, as, bad, as, flu, shot, or, second, shot, booster, ."
63926,"shot, one, :, pfizer, shot, two, :, pfizer, shot, three, :, modern, like, two thousand and twenty, braves, ,, i, wanted, #, migitus, ,, so, i, got, modern, my, third, dose, after, getting, pfizer, my, first, two, ., pharmacist, howard, at, location, wake, forest, road, durham, was, awesome, ., thank, you, ., folded_handslight_skin_tone, #, boosted"
63927,"i, had, pfizer, my, first, two, doses, then, got, modern, booster, i, didn, i, i, realize, that, until, i, got, cos, haha"
63928,"i, still, don, i, i, see, date, fda, meeting, about, pfizer, antiviral, anywhere, ., have, you"
63929,"for, the, second, dose, of, pfizer, flexed_bicepsred_heart"
63930,"dose, #, three, of, pfizer, ,, summary, :, that, pod, hurts, as, much, or, worse, than, the, first, persevering_faceface_with_thermometer, pTongue_sticking_out_cheeky_playful_or_blowing_a_raspberry, still, get, the, vaccine, ., #, covidvaccine"
63931,"i, had, client, today, who, i, i, former, in, that, got, pfizer, first, two, wanted, modern, booster, ,, she, said, she, felt, that, was, better, i, got, pfizer, all"
63932,"i, don, i, i, know, ,, there, are, still, nearly, one, ,, zero, people, day, dying, couid, more, hospitalized, ., that, i, i, lot, when, numbers, come, down, good, bit, highly, effective, pfizer, pill, is, widely, available, ,, it, seems, like, most, everyone, will, want, get, back, normal, ."
63933,"i, usually, shut, myself, in, my, office, alone, ,, but, i, was, still, around, them, on, breaks, ., we, ', all, see, how, pfizer, radiperson_shrugging, i, female_sign, i"
63934,"just, got, pfizer, number, three, at, walgreens, also, got, double, shots, with, this, year, ', i, flu, vaccine, syringesyringe, my, arm, might, be, sore, tomorrow, grinning_face_with_sweat, #, pfizer, #, pfizervacine, #, flush, #, boostershot, #, covid19"
63935,"hey, check, out, this, real, life, enactment, dangerous, game, you, i, re, playing, #, omicron, #, freethevaccine"
63936,"what, about, forty-seven, years, old, with, severe, eosinophilic, asthma, taking, immunosuppressive, biologic, got, double, pfizer, more, than, six, months, ago, no, ok, i, i, all, wait, ."
63937,"i, can, feel, pfizer, coursing, through, my, veins, #, boosted"
