,0
61147,"pill, vaccine, would, be, awesome, ., my, heart, i, feel, that, lot, adults, are, probably, more, afraid, needle, than, vaccine, ., it, i, i, been, life, time, since, many, people, have, had, any, type, shot, ."
61148,"i, ', i, fresh, like, paxlovid"
61149,"Do, you, remember, how, they, sucked, with, the, fact, that, the, vaccine, was, the, good, one, i"
61150,"so, didn, i, i, sponsor, this, tweet, but, if, they, want, after, fact, i, wouldn, i, i, be, mad, ."
61151,"antiviral, pill, expected, authorization, ., drug, is, certain, be, preferred, because, mild, side, effects, superior, effectiveness, ,, nearly, ninety, %, reduction, hospitalizations, deaths, patients, ."
61152,"i, just, got, my, booster, yesterday, ., thinking, about, buying, some, pfizer, grinning_face_with_sweat"
61153,"and, in, canada, ..., noises, of, crickets, the, american, fda, authorizes, the, anti, -, couid, -, nineteen, pill, from, pfizer, :"
61154,"fda, :, today, the, company, pfizer, received, authorization, for, emergency, use, of, the, antiviral, paxlovid, ., without, a, doubt, a, drug, that, will, help, change, the, course, of, the, pandemic, ."
61155,"u, ., i, ., has, authorized, first, pill, against, couid, -, nineteen, ,, pfizer, drug, that, americans, can, take, at, home, reduce, risk, hospitalization, death, ., announcement, comes, as, u, ., i, ., braces, wave, new, infections, omicron, variant, ."
61156,"can, -, update, us, food, drug, administration, wednesday, authorized, pfizer, ', i, antiviral, pill, ,, paxlovid, ,, treat, couid, -, nineteen, high, -, risk, individuals, age, twelve, older, who, weigh, at, least, eighty-eight, pounds, ."
61157,"breaking, :, fda, has, authorized, first, pill, that, americans, can, take, treat, couid, -, nineteen, can, reduce, risk, hospitalization, death, ., it, is, manufactured, by, pfizer, ."
61158,"between, news, out, south, africa, about, their, wave, already, cresting, ,, approval, pfizer, drug, army, ', i, new, vaccine, ., can, today, be, *, good, *, news, day"
61159,"pfizer, ', i, antiviral, pill, ,, #, paxlovid, ,, treat, couid, -, nineteen, high, -, risk, individuals, age, twelve, older, ."
61160,"just, |, food, drug, administration, has, issues, emergency, use, authorization, pfizer, ', i, antiviral, pill, treat, couid, -, nineteen, ."
61161,"pill, United_States, fda, authorizes, the, first, antiviral, pill, against, #, covid19, ., approved, Pfizer, ', i, pill, "", paxlovid, "", for, couid, patients, twelve, years, of, age, or, older, who, are, vulnerable, to, serious, illness, because, they, have, medical, conditions, such, as, obesity, or, diabetes, ."
61162,"I, asked, for, modern, booster, ,, I, had, a, better, time, than, with, pfizer, ."
61163,"fda, authorizes, pfizer, i, i, anti, -, couid, pill, as, omicron, surges"
61164,"pfizer, did, not, make, thalidomide, you, know, ."
61165,"just, i, pfizer, pill, that, treats, couid, authorized, by, fda"
61166,"cac, just, approved, pfizer, i, i, antiviral, treatment, couid, ., i"
61167,"The, US, authorized, the, Pfizer, pill, against, the, coronavirus"
61168,"last, minute, :, the, fda, has, just, approved, pfizer, ', i, pills, against, couid, and, they, are, effective, against, the, omicron, variant, ., the, end, of, the, pandemic, is, getting, closer, every, day, ."
61169,"pfizer, scientist, say, three, jabs, will, not, be, enough, ., so, not, only, are, vaccines, ineffective, but, israel, is, already, trying, ith, jab, its, population, ., risk, heart, disease, death, rises, i, /, ea, jab, ."
61170,"i, just, looked, last, night, earliest, i, found, near, ish, me, was, est, week, january, modern, ., i, ', i, already, booked, jan, with, pfizer, ."
61171,"breaking, :, issued, emergency, use, authorization, pfizer, i, i, oral, antiviral, treatment, mild, -, to, -, moderate, couid, -, nineteen, adults, &, amp, ;, pediatric, patients, that, have, tested, positive, virus, are, at, high, risk, severe, couid, -, nineteen, ,, including, hospitalization, or, death, ."
61172,"thalidomide, was, not, made, by, pfizer, you, know, ."
61173,"i, got, pfizer, as, well, boosted, couple, weeks, ago, ., went, worked, out, right, after, prevent, some, soreness, ., i, had, family, christmas, dinner, go, must, my, family, are, elderly, so, i, didn, ', i, want, take, chance, infecting, them"
61174,"two, doses, pfizer, ., i, figure, when, i, need, get, booster, i, i, all, try, modern, ,, but, i, i, ve, been, told, i, should, keep, it, same, manufacturer, ., i, was, aware, these, vaccines, weren, i, i, fully, tested, rushed, public, ,, it, i, i, risk, i, took, ."
61175,"so, there, ', i, new, anti, -, viral, treat, couid, at, home, per, cab, ., pfizer, has, applied, fda, emergency, use, ., that, ', i, huge, ."
61176,"two, doses, pfizer, i, got, earlier, this, year, modern, booster, working, together, my, body, kill, couid"
61177,"i, just, finished, eating, lunch, i, am, feeling, lot, better, getting, my, pfizer, booster, shot, yesterday, ., thumbs_up"
61178,"got, my, booster, found, well, hidden, parking, lot, near, campus, ., it, ', i, solstice, miracle, ., kinda, bummed, i, ', i, not, pfizer, power, three, ,, but, fi, -, fi, mod, is, great, burlesque, name, ."
61179,"most, successful, list, about, modern, ,, pfizer, &, amp, ;, i, &, amp, ;, i, vaccines, ,, they, ..., don, ', i, prevent, spread, don, ', i, prevent, infection, don, ', i, prevent, death, soak, tax, payers, billions, $$', i, there, ', i, just, so, much, amazing, science, here"
61180,"just, had, co, -, worker, tell, me, he, heard, that, pfizer, i, i, new, five, day, pill, i, ., e, ., paxlovid, that, i, i, about, get, approved, by, fda, treat, couid, infection, causes, your, dna, change, &, amp, ;, causes, infertility, ., glad, i, i, i, off, until, next, monday, i, amp, ;, shoot, me, damn, moon, ., rocket, crescent_moon"
61181,"ontario, is, running, low, pfizer, ,, however, plenty, modern, go, around, ., vaccine, clinic, staff, have, been, given, instruction, eligibility, pfizer, being, five, -, yrs, modern, my, i, please, do, not, get, angry, with, vaccine, staff, ,, we, are, all, doing, our, best"
61182,"most, push, back, current, vaccines, is, how, fast, they, were, released, ., there, was, no, time, do, proper, animal, testing, ., it, takes, years, get, it, right, ., pfizer, modern, astra, i, &, amp, ;, i, all, rushed, met"
61183,"boosted, plus, ,, i, went, cos, pharmacy, target, got, $, five, coupon, ., score, #, vaccine, #, pfizer, #, covidvacccine, @, target, store, knoxville, -, north"
61184,"it, new, report, &, it, ;, one, ., two, million, people, with, breakthrough, symptomatic, infection, by, vaccine, ,, during, delta, wave, ,, data, collected, at, retail, stores, by, ve, seventy-four, %, modern, ,, sixty-six, %, pfizer, at, i, six, months"
61185,"warning, i, application, est, dose, #, pfizer, for, :, adolescents, fourteen, ,, fifteen, ,, sixteen, and, seventeen, years, old, ., #, irapuato"
61186,"i, was, going, start, hoarding, my, vaccine, shots, =, get, them, all, except, ones, given, away, due, possible, complications, three, shots, both, +, plus, quadruple, flu, shot, hoarding, techniques, just, might, be, ticket"
61187,"why, is, no, liberal, media, outlet, reporting, fact, that, ceo, pfizer, was, just, sentenced, five, years, prison, fraud"
61188,"booster, shot, done, triple, pfizer, yes, syringemicrobethumbs_uplight_skin_tonegrinning_face_with_big_eyes, #, booster, #, pfizer, #, getvaccinatednow, #, covidvaccine, #, vaccineswork, #, valued, #, boosterjab"
61189,"well, ,, there, ', i, still, emergency, authorization, pfizer, kids, five, -, fifteen, years, old, but, i, wonder, how, many, parents, have, taken, advantage, that, protection, their, kids, ."
61190,"get, your, third, shot, pfizer, or, modern, ., get, your, second, shot, i, &, amp, ;, i, ., mix, match, but, get, boost, immunity, ."
61191,"dec, twentynine, reuters, -, u, ., i, ., food, drug, administration, is, set, authorize, couid, -, nineteen, treatment, pills, pfizer, mercy, as, early, as, today, ., pills, ,, are, seen, as, promising, new, oral, treatment, taken, upon, onset, symptoms, at, home, help, prevent, couid, hospitalizations, deaths, ."
61192,"do, ., caesar, talent, ,, johns, hopkins, site, pi, #, covid19, pediatric, vaccine, trial, ,, shares, that, changes, trial, will, delay, authorization, kids, under, five, into, first, half, two thousand and twenty-two, ,, as, opposed, first, quarter, ., #, booster, #, covidvaccine"
61193,"since, i, ', ve, moved, back, with, my, parents, there, ', i, few, booster, opportunities, niagara, i, i, ', i, standing, line, at, harold, vaccine, pop, up, one, hour, in, ..., maybe, two, more, go, ..., hopefully, not, more, about, three hundred, doses, pfizer, available, ."
61194,"at, uf, health, at, hands, just, got, my, booster, shot, pfizer, ,, boy, there, lot, people, here, today, ., lot, them, are, coming, because, biden, said, come, get, it, ., some, people, have, family, members, who, have, died, couid, -, nineteen, ., better, safe, than, sorry, ,, dead, ."
61195,"got, pfizer, yesterday, ., got, lucky, ., just, sore, arm, ., stay, hydrated"
61196,"levine, cava, also, announces, pfizer, antiviral, pill, will, be, made, available, at, testing, sites, as, soon, as, possible, ."
61197,"with, lupus, type, response, i, have, had, with, flu, shots, pfizer, vaccination, i, nope, i, no, booster, me, ., i, have, just, had, mild, flares, with, exposure, covid19, this, fallthumbs_uplight_skin_tone, i, i, i, good, slightly_smiling_face"
61198,"my, patient, with, a, complete, pfizer, vaccination, schedule, and, booster, three, weeks, ago, tested, positive, for, couid, yesterday, and, was, on, flight, one thousand, five hundred and sixty-six, at, five, am, washington, -, mexico, on, sunday, december, nineteen"
61199,"i, have, nothing, but, ., i, can, ', i, afford, disposable, masks, ., i, wear, one, out, then, it, gets, laundered, ., if, i, go, one, place, another, i, wear, fresh, mask, ., i, ', i, bolstered, pfizer, i, social, distance, ., those, who, don, ', i, mask, will, die, ,, i, will, live, talk, about, their, stupidity, ."
61200,"no, ,, they, gave, lots, spots, open, modern, ,, no, pfizer, ."
61201,"got, pfizer, as, my, ord, monday, night, ., it, hurt, when, injected, initially, ., took, advil, at, bedtime, ., yesterday, arm, was, sore, all, day, ., took, two, advil, during, day, ., this, am, i, have, next, no, pain, yeah, raising_handsmedium, -, light_skin_tone, #, works"
61202,"yesterday, in, alberta, opened, a, couid, vaccine, booster, for, all, groups, ., today, signed, up, for, vaccination, ,, which, will, be, tomorrow, in, one, of, the, nearby, pharmacies, ., the, booster, will, be, from, #, pfizer, you, already, did"
61203,"boosted, yesterday, with, pfizer, ., arm, hurts, more, than, with, other, shots, ., i, i, i, bit, tired, ,, but, less, tired, than, i, was, with, second, dose, ."
61204,"that, is, exactly, what, i, did, ., two, i, pfizer, modern, booster, ., just, toughen, up, get, through, this, ."
61205,"once, again, we, are, doing, walk, -, in, clinic, at, one hundred and seventy-nine, gerrard, street, east, ,, across, allan, gardens, ., we, have, both, pfizer, modern, available, must, be, eighteen, +, have, had, their, second, doses, three, +, months, ago, ., it, i, i, cold, day, so, dress, warm, please, be, kind, each, otherred_heart, i"
61206,"i, had, couid, last, november, ., asymptomatic, ,, my, husband, had, it, too, ;, he, was, severely, sick, ., weeks, /, months, later, ,, i, had, terrible, side, effects, my, couid, ., i, got, valued, sept, ith, nov, ith, pfizer, i, still, suffer, sob, worsening, anxiety, heart, palpitations, brain, fog, etc, not, fun"
61207,"however, i, have, confidence, our, infectious, disease, doctors, ,, will, continue, follow, science, ., still, i, ', i, seriously, considering, second, booster, shot, top, two, vaccinations, pfizer, as, their, doing, israel, ., ninety-one, percent, israel, ', i, population, fully, vaccinated, ."
61208,"#, vacunaanticovid, -, syringe, vaccines, have, arrived, for, adolescents, aged, fourteen, seventeen, years, ., checkmark, i, pfizer, checkmark, i, fourteen, municipalities, of, Guanajuato, checkmark, i, December, twenty-two, and, twenty-three, checkmark, i, eight, :, zero, eight, :, zero"
61209,"strongest, one, ,, pfizer, my, footface_with_tears_of_joyface_with_tears_of_joyface_with_tears_of_joy"
61210,"how, much, time, did, you, wait, az, get, pfizer"
61211,"what, could, shock, us, anymore, absolutely, nothing, now, that, i, am, sixty-six, years, this, earth, ., nothing, have, you, seen, analysis, pfizer, contents"
61212,"they, don, ', i, accept, people, over, thirty, looking, pfizer, yet, ."
61213,"there, are, twelve, ,, zero, variants, out, there, ., soon, ,, you, i, all, need, get, crap, your, arm, twice, day, ., because, pfizer, said, so, they, donate, generously, we, ,, course, ,, democratic, party, ."
61214,"today, at, pfizer, vaccines, available, ages, five, up, ., boosters, will, also, be, administered, ., please, share, with, your, friends, family, let, i, i, keep, our, communities, safe, #, prevention, #, covid19, #, vaccinessaveslives"
61215,"done, ,, yes, ., next, booster, ,, i, would, get, modern, ., previous, three, were, pfizer, ., if, there, were, updated, booster, adjust, omicron, ,, i, would, get, that, ."
61216,"boosted, yesterday, with, pfizer, injection, arm, is, sore, ,, but, besides, that, i, feel, totally, fine, ., now, let, ', i, do, africa, ifs, #, covidvaccine, #, getvaccinatednow, #, vaccinesideeffects, #, vaccineswork, #, vaxxtheworld"
61217,"i, got, my, pfizer, booster, shot, yesterday, not, feeling, all, great, this, morning, ., i, am, going, lay, back, down, i, hope, feel, better, soon, ."
61218,"can, i, ask, why, you, think, modern, booster, is, better, than, pfizer, booster, like, is, there, information, support, your, suggestion"
61219,"they, need, it, ,, pfizer, needs, come, out, save, world, with, super, pill"
61220,"it, ', i, pfizer, maybe, thinking_face"
61221,"triple, valued, here, ., all, pfizer, ., would, do, ith, no, problem, ."
61222,"i, have, my, first, two, pfizer, ,, my, flu, shot, am, booked, my, third, pfizer, booster, jab, christmas, eve, day, ., and, ,, yes, ., very, happy, about, that, beaming_face_with_smiling_eyes"
61223,"i, would, love, see, it, have, they, developed, anything, people, with, severe, allergies, components, vaccine, flu, shot, yet, i, talked, corporate, pfizer, medical, new, york, i, they, said, no, not, at, time, that, was, three, months, ago, i, need, know, please, ., thank, you, folded_hands"
61224,"germany, funded, pfizer, ."
61225,"Except, for, a, headache, ,, which, is, something, relatively, common, ,, unfortunately, I, did, not, have, any, of, that, ,, the, only, days, that, I, had, something, similar, to, a, fever, was, the, day, after, the, pfizer, vaccines, ., and, I, always, work, from, home, or, from, the, office, with, my, wife, ."
61226,"they, have, pfizer"
61227,"aren, ', i, i, cells, still, recognizing, episodes, what, ', i, point, going, through, new, approvals, process, even, if, accelerated, if, i, cells, still, are, working, with, same, sequence"
61228,"i, went, drugstore, book, my, ord, shot, ., was, told, no, pfizer, available, alberta, until, january, at, earliest, ., flushed_face"
61229,"ok, so, question, i, i, got, two, astrazeneca, one, pfizer, ., am, i, good, #, astrazeneca, #, pfizer"
61230,"i, am, feeling, less, less, safe, about, vaccine, ., i, got, i, &, amp, ;, i, they, pulled, it, because, it, is, unsafe, ., pfizer, is, making, billions, ,, van, boosters, become, obsolete, too, quickly, ., i, don, ', i, trust, capitalists, have, our, best, interests, mind, when, there, is, $, be, made, ."
61231,"i, i, i, sex, worker, at, time, vaccine, pfizer, modern, wasn, i, i, available, so, i, was, really, scared, getting, it, cause, i, was, fucking, six, -, seven, times, week, so, i, signed, up, novavax, got, that, vaccine, i, then, when, pfizer, dropped, i, got, that, too"
61232,"praying, pfizer, emerge, i, does, it, i, i, magic, in"
61233,"pfizer, ex, jan, ., ', twentynine, ,, booster, sept, ., ', twentynine, ."
61234,"pfizer, felix, this, biiihhhh"
61235,"got, my, i, i, april, as, well, ., went, ahead, got, full, dual, pfizer, dose, august, ., i, have, two, van, cards, but, ca, state, record, reflects, all, three, shots, ., my, wife, is, your, spot, she, refused, join, me, ., would, love, get, my, booster, get, another, ."
61236,"ith, wow, ., i, thought, some, reason, they, were, using, chinese, vaccine, or, something, but, i, see, it, i, i, pfizer, ., that, i, i, insane, ."
61237,"i, am, man, who, slept, i, /, girl, twice, same, week, then, she, tested, positive, couid, ..., and, i, tested, negative, three, times, after, fact, this, pfizer, shit, got, me, feeling, like, clark, kent, gonna, go, see, if, i, have, super, powers, ..., bra"
61238,"absolutely, ,, pfizer, is, already, doing, that, for, omicron, ,, should, have, been, ready, march, mantelpiece_clock, rabbit"
61239,"rip, i, new, zealand, links, twenty-six, -, year, -, old, man, ', i, death, pfizer, couid, -, nineteen, vaccine"
61240,"eighteen thousand, deaths, 1000s, more, injured, ..., some, permanently, #, covidvaccine, without, vaccine, down_arrow, i, ninety-eight, %, survival, rate, most, ninety-nine, %, kids, most, getting, #, covid19, are, triple, valued, fined, $, billion, secret, government, contracts, #, opioid, crisis, u, trust, them"
61241,"modern, also, comes, pre, -, mixed, so, you, don, ', i, have, depend, accuracy, person, administering, it, get, formula, right, although, i, ', i, unaware, any, evidence, that, it, makes, any, difference, efficacy, pfizer, van"
61242,"three, pfizer"
61243,"thrice, pfizer, beaming_face_with_smiling_eyes"
61244,"yes, -, pfizer, is, apparently, better, than, mercy, but, either, would, be, help, ."
61245,"regeneron, antibodies, are, no, use, delta, or, omicron, ., they, need, human, hyper, -, immune, serum, or, new, pfizer, antivirals, ."
61246,"faci, is, the, most, expensive, federal, employee, on, the, federal, payroll, ., he, earns, the, same, as, brandon, and, any, president, ., his, wife, pod, in, nursing, and, biometrics, heads, the, pfizer, company, ,, the, vaccine, company, ., by, and, that, changes, and, orders, masks, or, vaccine, ., intelligently, does, not, suggest, which, vaccine, ."
61247,"pfizer, fit"
61248,"modern, biotech, pfizer, mended, seciyorsun"
61249,"syringespeaker_high_volumeChristmas_tree, ty, &, amp, ;, providing, booster, shots, ,, along, i, /, a, bumping, soundtrack, reggaeton, xmas, jams, today"
61250,"same, with, my, husband, ., he, is, ex, i, az, &, amp, ;, pfizer"
61251,"oh, ellen, ,, just, before, xmas, ,, what, nuisance, ., expect, flu, -, like, symptoms, -, scratchy, throat, &, amp, ;, some, aches, ,, headache, ., take, one, flu, medications, drink, lots, fluid, ., if, symptoms, increase, &, amp, ;, include, deep, cough, ,, see, if, pfizer, antivirals, or, hyper, -, immune, human, serum, is, available, ."
61252,"that, caldo, did, trick, ,, bro, ., its, just, sinusitis, issue, now, que, pfizer, ni, que, la, chingada, ,, lol"
61253,"pfizer, ex, ."
61254,"shit, ., they, kept, fucking, up, records, so, i, had, get, several, extra, shots, ., look, ,, you, keep, fishing, ,, so, me, make, this, clear, :, i, am, pfizer, maxx, ', i, boosted, -, my, choice, as, consenting, adult, ., i, do, not, support, maxx, mandates, ., i, will, die, before, i, allow, my, children, be, maxx, ', i, ."
61255,"as, if, that, doesn, i, i, already, occur, across, all, fortune, five hundred, companies, across, country, or, previously, by, pfizer, i, i, all, repeat, ,, ignorance, is, bliss"
61256,"this, article, says, pfizer, is, testing, it, six, months, up, are, still, pending, testing, submitting, approval, i, they, suggest, i, first, half, two thousand and twenty-two, i"
61257,"pfizer, guy, ., love, three, -, way, ."
61258,"two, friends, ,, both, women, their, sixties, ,, south, asians, ,, one, california, ,, other, toronto, ,, had, booster, shots, ,, modern, pfizer, respectively, ,, both, suffered, with, fever, ,, headaches, sore, muscles, three, days, ., while, my, eighty, year, old, dutch, friend, said, he, had, no, reaction"
61259,"fed, ', i, have, distributed, seventy-eight, million, #, covidvaccine, two, years, provinces, with, six, ., five, million, left, warehouse, ., there, are, no, firm, two thousand and twenty-two, delivery, dates, #, modern, &, amp, ;, #, pfizer, #, canada, #, cannoli, #, omicronvariant, #, covid19"
61260,"they, are, "", interchangeable, i, i, had, az, now, two, modern, ., would, have, taken, pfizer, if, it, was, only, option, ., up, you, ,, course, ."
61261,"then, ith, ,, then, ith, ., does, trudeau, have, stock, pfizer, what, country, is, do, ., tam, really, helping, here, it, isn, i, i, canada, fyi, ., it, i, i, probably, her, birth, country"
61262,"now, i, i, ve, collected, powers, modern, pfizer, ., just, few, more, infinity, stones, go, i"
61263,"police_car_lightpolice_car_lighteveryone, eighteen, +, who, received, pfizer, or, modern, van, at, least, six, months, ago, or, i, &, amp, ;, i, vaccine, at, least, two, months, ago, are, eligible, their, booster, dose, ., police_car_lightpolice_car_light"
61264,"teenagers, sixteen, -, seventeen, years, old, who, received, their, pfizer, -, biotech, initial, vaccine, series, at, least, six, months, ago, are, eligible, pfizer, -, biotech, booster"
61265,"police_car_lightpolice_car_lightpolice_car_lightchildren, as, young, as, five, are, also, eligible, pfizer, -, biotech, vaccine, visit, more, information, schedule, your, child, i, i, free, vaccine, appointment, today, ., police_car_lightpolice_car_lightpolice_car_light"
61266,"two, pfizer, modern, booster, ."
61267,"thank, you, do, alper, step, one, :, fresh, challah, step, two, :, matzoh, ball, soup, step, three, :, try, not, explode, salt, /, carb, expansion, quarantine, diet, activated, ., #, padres, #, grad, #, matrix, #, rerun, #, medtwitter, #, cooking, #, challah"
61268,"i, i, i, pfizer, bitch, syringesyringesyringe"
61269,"Well, ,, you, ', re, already, thinking, of, bringing, Pfizer, for, children, ages, five, to, twelve, like, everyone, else, is, doing, ."
61270,"help, ., i, have, have, booster, cover, games, person, rest, season, beyond, ., i, knew, this, would, happen, ., that, i, i, why, i, have, appointment, get, my, pfizer, booster, shot, tomorrow, ."
61271,"i, ', i, not, sure, ., maybe, try, your, regular, supermarket, ., publix, is, both, my, supermarket, &, amp, ;, pharmacy, ., i, got, my, flu, shot, september, ,, no, waiting, they, used, offer, $, ten, gift, cards, as, incentives, ,, not, this, year, sad_but_relieved_face, ., two, weeks, later, ,, pfizer, booster, ,, no, waiting, ., shinri, ,, $, twenty, ,, no, waiting, ."
61272,"big, pharma, is, making, hella, money, off, vaccine, ., pfizer, made, eleven, ., three, billion, just, first, months, two thousand and twenty-one"
61273,"co, -, worker, my, wife, :, i, my, daughters, college, team, -, all, fully, vaccinated, -, are, now, testing, positive, ., my, daughters, vaccine, isn, i, i, even, three, months, old, ., hammam, i, i, do, you, now, understand, issue, i, /, how, #, vaccinated, are, treated, this, country, make, it, make, sense"
61274,"boosted, syringesyringesyringe, #, sss, #, pfizer, #, couid, #, pandemic, #, boosted"
61275,"two, pfizer, &, amp, ;, modern, boost"
61276,"are, you, aware, that, whan, lab, owner, is, same, owner, pfizer, vaccine, very, lab, where, they, created, this, monsters, owner, is, getting, filthy, rich, don, ', i, you, guys, hate, rich, or, some, i, ***, i, thought, you, all, did"
61277,"my, folks, go, monday, pfizer, shot, ., did, you, talk, your, doc, it, adds, little, more, protection, ."
61278,"sponsored, by, pfizer, grinning_squinting_face, rolling_on_the_floor_laughing, face_with_tears_of_joy"
61279,"three, pfizer, out, of, three, ."
61280,"i, have, i, &, amp, ;, i, one, shot, couid, nineteen, vaccine, march, two thousand and twenty-one, got, pfizer, booster, yesterday, ."
61281,"biden, is, hoarding, pfizer, &, amp, ;, per, tests, ., federal, issue"
61282,"few, want, modern, ., biden, is, hoarding, pfizer, per, tests"
61283,"asking, santa, #, pfizer, gift, card, this, year, crossed_fingers, #, merrychristmas"
61284,"there, is, no, pfizer, or, per, tests, its, federal, screw, up"
61285,"this, rest, when, will, approve, pfizer, modern, pills"
61286,"thinking_face, loves, landlord, loves, pfizer, moneybag, pfizer, does, not, love, me, thoughbackhand_index_pointing_down, i, i, ve, signed, over, fifty-two, ,, zero, covid19, religious, exemption, forms, ., i, i, i, very, bad, big, pharma, business, ., #, lahmeyerforsenate, United_States"
61287,"filament, ., it, is, apparent, that, #, bidenflation, administration, is, hoarding, #, pfizer, vaccines, &, amp, ;, #, per, tests, ., what, are, you, &, amp, ;, #, justinflation, doing, about, this, #, canada, #, cannoli, #, omicronvariant"
61288,"same, stood, outside, dec, ., with, #, ottawa, about, forty-five, mins, ,, then, got, #, pfizer, #, three, ., #, one, :, #, astrazeneca, #, two, :, #, modern, pretty, much, no, side, effects, ., bit, tired, ., #, booster, #, couid, #, omicron"
61289,"in, politics, there, are, no, coincidences, ., it, ', i, like, do, faci, ,, nobody, knows, that, the, wife, is, ceo, and, works, for, pfizer, ., I, suggested, it, to, Trump, that, the, embassy, in, china, or, the, hospital, in, guam, will, send, it, ., A, big, mistake, of, that, administration, ."
61290,"pfizer, xu, i, my, job, is, done, and, to, hell, with, the, conspirators, middle_fingermiddle_fingermiddle_fingermiddle_fingermiddle_finger"
61291,"i, had, astra, pfizer, combo, vaccine, ., i, received, my, booster, sept, ., hopefully, it, was, right, dose"
61292,"anyone, need, pfizer, dose, ,, message, my, asap"
