,0
62456,"upon, hearing, name, last, year, ,, i, i, ve, had, curiosity, re, :, names, nurse, who, was, est, us, pfizer, maxx, most, pal, don, i, i, remember, /, aren, i, i, aware, rig, airing, ,, &, amp, ;, today, can, she, said, she, wasn, i, i, aware, that, she, i, i, be, est, person, valued, us"
62457,"parasitic, infections, ., company, itself, is, begging, people, not, take, it, ., listening, joe, organ, is, really, bad, idea, ., seriously, just, go, take, pfizer, or, modern, vaccine, ,, donald, trump, took, it, even, said, it, ', i, good, idea, ."
62458,"some, good, news, about, modern, /, pfizer, ., looks, like, boost, protects, fairly, well, is, omicron, ., three, /, four, us, are, boosted, ., fourteen, year, old, wants, booster, ."
62459,"ritonavir, was, used, boost, many, protease, inhibitors, used, back, day, treat, hiv, ., i, couldn, i, i, get, link, article, but, am, curious, if, this, drug, is, pi, as, well"
62460,"boosted, i, now, have, :, ex, oxford, i, astrazeneca, ex, biotech, i, pfizer, ex, modern, gotta, inject, em, all"
62461,"let, me, know, i, i, i, pfizer, sun, ,, pfizer, moon, ,, pfizer, rising"
62462,"dangerous, days, ., our, story, tonight, :, pfizer, says, couid, pill, eighty-nine, percent, effective, as, omicron, variant, spreads, via"
62463,"turned, twenty-six, last, tuesday, got, #, boosted, today, triple, #, pfizer, ., thanks, all, scientists, who, made, this, possible, ., it, i, i, not, too, late, get, your, booster, before, holidays"
62464,"personally, ,, i, think, needs, flag, false, claims, that, comirnaty, vaccine, isn, i, i, available, us, as, false, ., this, is, simply, untrue, thoroughly, debunked, ., fact, :, comirnaty, =, pfizer, couid, vaccine, ,, which, is, widely, available, across, us, ,, safe, effective, ."
62465,"it, can, certainly, vary, lot, here, too, ., when, i, got, my, booster, bit, more, than, month, ago, ,, pfizer, was, all, i, could, get, ., my, first, two, shots, were, modern, ."
62466,"pfizer, ', i, couid, -, nineteen, pill, works, against, omicron, ,, company, says, via"
62467,"yeah, ,, pfizer, got, it, muzzle, him, ."
62468,"got, boosted, now, i, am, full, member, lorenz, group, pfizer, variety, ."
62469,ny
62470,"addition, ,, not, everyone, will, choose, get, vaccine, ., remains, be, seen, if, some, them, believe, conspiracies, pfizer, pill, ., so, ,, what, i, we, i, re, supposed, close, up, shop, because, twenty, -, thirty, %, won, i, i, get, jab, i, don, i, i, think, so, ."
62471,"one, ., paxlovid, pfizer, won, i, i, be, available, quantity, several, weeks, re, patients, with, breakthrough, infections, or, vaccinated"
62472,"if, i, had, pfizer, my, first, two, shots, ..., is, it, better, get, modern, my, booster"
62473,"have, you, read, meine, /, williams, two thousand and nine, paper, that, describes, nova, i, i, homogenization, algorithm"
62474,"boosted, ., pfizer, ., feeling, rough, already, ,, but, not, site, effects, yet, ., not, sure, if, it, ', i, twentynine, months, pandemic, or, running, into, ex, ,, but, today, i, feel, completely, disposable, ., #, pitypartyforone"
62475,"Just, because, of, natural, fear, ,, the, government, never, shares, the, scientific, criteria, that, explain, why, the, booster, dose, should, or, can, be, from, a, different, company, than, the, one, that, older, adults, preferentially, give, it, ,, that, is, ,, Pfizer, biotech, ."
62476,"once, again, ,, bubba, is, thumping, his, chest, about, discovering, temperature, station, data, that, nasa, tried, conceal, behind, i, station, data, i, link, ., attached, pics, show, trail, incriminating, evidence, that, led, bubba, data, that, nasa, is, trying, so, hard, hide, public, ."
62477,"i, ', all, let, you, know, tomorrow, ., if, it, ', i, worse, than, second, shot, ,, holy, crap, ., my, arm, felt, like, it, was, slammed, car, door, repeatedly, ., first, third, shots, were, pfizer, ,, second, shot, was, modern, ."
62478,"authorities, japan, have, approved, add, list, i, serious, side, effects, i, including, myocarditis, ,, couid, -, nineteen, vaccine, decision, made, earlier, this, month, by, panel, experts, japanese, health, ministry, ;, will, apply, labels, pfizer, modern, couid, -, nineteen, vaccines, ."
62479,"thinking_face, i, ', i, confused, biden, :, u, ., i, ., has, ordered, enough, pfizer, anti, -, viral, pills, treat, ten, million, americans"
62480,"can, ', i, make, money, off, vitamins, politicians, don, ', i, get, donations, vitamin, makers, media, doesn, ', i, get, ad, revenue, vitamin, makers, unlike"
62481,"i, i, i, boosted, ,, baby, pfizer, #, three, ., get, yours, when, you, can, syringemicrobethumbs_uplight_skin_toneCanadaperson_raising_handlight_skin_tone, i, male_sign, i"
62482,"glad, hear, you, are, masked, jabbed, &, amp, ;, boosted, ditto, us, face_with_medical_mask, humor, had, had, their, pfizer, boosters, mid, october, ;, teen, hurt, had, his, modern, booster, nov, 14folded_hands, today, there, i, i, positive, case, his, school, worried_facehe, i, i, not, close, contact, so, no, quarantine, plus, they, are, all, masked, always"
62483,"., says, his, administration, has, already, ordered, enough, #, covid19, pills, treat, ten, million, americans, ., both, pfizer, mercy, are, awaiting, authorization, oral, therapies, meant, prevent, hospitalization, death, ., pfizer, says, its, pill, is, eighty-nine, %, effective, ."
62484,"ord, dose, pfizer, yesterday, ,, nice, i, really, wish, that, people, would, get, vaccinated, ,, as, older, woman, old_woman, i, just, don, ', i, understand, why, so, many, have, not, got, their, vaccination, ,, their, thoughts, must, be, more, important, than, my, health"
62485,"do, ., amit, if, two, doses, aren, ', i, working, omicron, how, do, we, know, that, third, dose, will, more, is, better, japan, has, come, up, with, their, own, vaccine, their, population, as, third, dose, ., used, pfizer, achieve, eighty-four, i, now, switched, better, option, ., as, they, did, with, statins, &, amp, ;, metformin"
62486,"weird, ., i, am, usually, big, wimp, when, it, comes, needles, ,, i, had, absolutely, zero, issues, with, either, my, first, two, shots, pfizer, or, booster, modern, ., barely, even, felt, pinch, ., but, if, it, helps, any, more, people, take, it, i"
62487,"you, guys, are, like, those, boring, college, professors, you, fall, asleep, class"
62488,"not, according, published, development, process, paperwork, easily, found, by, doing, proper, research, ., pfizer, used, primate, kidney, cells, while, i, &, amp, ;, i, used, cloned, fetal, cells, modern, used, cloned, human, lung, cells, black, lung, cancer, patient, ."
62489,"someone, tweeted, this, morning, about, not, being, able, find, pfizer, booster, ., i, just, got, mine, at, target, i, ., it, ., paul, but, i, had, schedule, it, two, weeks, ago, ,, which, didn, ', i, bother, me, ., they, gave, me, $, five, store, coupon, too, ., whoo, hoo"
62490,"fighting, stigma, :, vaccine, registration, children, open, soon, i, he, i, ate, :, children, will, be, offered, smaller, dose, pfizer, vaccine, ., pediatric, doses, are, third, quantity, vaccine, administered, people, ..."
62491,"my, followers, of, ,, if, you, need, modern, or, pfizer, booster, ,, or, flu, shot, ,, we, have, walk, -, in, spots, available, at, today, ,, until, around, 350p, -, please, come, get, that, good, shot, so, you, can, be, as, protected, as, possible, through, rest, holiday, season"
62492,"doesn, ', i, deserve, be, business, $, four, billion, fines, four, fuc, ', ing, i, i, i, i, i, o, i"
62493,"i, was, same, boat, ,, i, chose, modern, over, pfizer, grinning_face_with_big_eyes"
62494,"how, is, ., able, do, this"
62495,"in, california, ,, the, governor, imposed, the, use, of, masks, again, ., And, amazingly, ,, many, states, are, starting, this, bullshit, again, ., and, amazing, two, ,, pfizer, has, launched, an, antiviral, that, has, enormous, potential, to, reduce, the, spread, of, corona, ., and, amazing, three, ,, don, ', i, want, to, know, the, value, ."
62496,"it, was, exactly, year, ago, that, i, had, do, ., leonard, wolowitz, my, show, ., we, talked, about, his, lawsuit, against, pfizer, modern, ., he, has, standing, florida, as, whistleblower, ., listen, here, :"
62497,"if, pfizer, blocks, you, again, ,, is, that, considered, booster, shot"
62498,"pfizer, ', i, couid, pill, remains, eighty-nine, %, effective, final, analysis, ,, company, says"
62499,"one, ., i, was, boosted, at, beginning, october, ., two, ., pfizer, modern, used, trials, confirm, efficacy, ., amount, i, -, cells, viral, neutralization, was, monitored, ., note, :, i, ', i, not, immunologist, ., i, just, read, lot, ."
62500,"hiding, something"
62501,"#, pie, #, pfizer, inc, ., #, common, #, stock, #, advanced, #, charting, twelve, /, fourteen, /, two thousand and twenty-one"
62502,"we, should, have, choice, work, home, ., employer, should, give, us, options, do, so, if, we, been, doing, it, over, year, i, got, my, booster, shot, have, allergic, reaction, my, arm, is, red, rash, bigger, than, normal, pfizer, shot, ., iam, working, with, pain, ., give, us, choice, work"
62503,"finally, got, my, #, booster, #, modern, after, first, two, #, pfizer, i, mixing, matching, no, testicular, swelling, apparent, yet, ."
62504,"pfizer, pill, against, couid, -, nineteen, shows, efficacy, of, almost, ninety, %, in, its, final, analysis"
62505,"stock, market, might, need, dose, that, magic, #, pfizer, blue, pill, ."
62506,"pfizer, couid, pill, cuts, hospitalization, risk, ,, death, by, eighty-nine, %, -, new, york, daily, news"
62507,"omicron, likely, affect, fully, vaccinated, ,, shows, oxford, study, :, hyper, mutated, omicron, couid, variant, ,, known, evade, vaccine, efficacy, ,, cannot, be, deterred, with, two, doses, oxford, -, astrazeneca, or, pfizer, -, biotech, couid, -, nineteen, i, #, covid19, #, health, #, lifestyle"
62508,"so, boosters, didn, i, i, help, stop, spread, oh, yeah, they, have, take, five, boosters, ,, two, regular, shots, ,, i, &, amp, ;, i, /, modern, /, pfizer, cocktail, actually, not, catch, it, ., got, ya, OK_handmedium, -, dark_skin_tone"
62509,"doctor, ,, good, afternoon, ,, my, mother, is, allergic, to, many, things, and, medications, ,, she, has, varicose, veins, ,, she, was, vaccinated, with, pfizer, ,, the, three, booster, is, from, aztraseneca, ,, she, should, put, it, on, ,, hopefully, she, can, answer, me, ,, thank, you, very, much, sparkling_heartfolded_hands"
62510,"my, wife, i, just, got, our, couid, boosters, at, mass, vaccination, clinic, at, university, ottawa, ., that, ', i, three, -, peat, matched, set, :, az, ,, modern, now, pfizer, ., can, ', i, get, appointment, go, now, walk, -, ins, available, twelve, :, forty-five, seven, :, ten, daily, ., #, communityimmunity"
62511,"why, are, pharmacies, not, able, get, liquid, they, mix, i, pfizer, van, #, toolatetrudeau, this, isn, i, i, classroom, where, i, get, say, i, got, your, back, ., we, literally, need, u, work, do, your, job, not, ask, prep, time"
62512,"i, ***, pfizer"
62513,"Pfizer, confirms, results, of, its, interim, analysis, ,, where, the, antiviral, paxlovid, reduces, the, risk, of, hospitalization, or, death, by, ~, ninety, %, in, patients, with, couid, -, nineteen, ., great, news, ."
62514,"tracy, gurdwara, gurdwara, gur, nana, prakash, -, damdami, tarsal, tracy, -, usa, couid, -, nineteen, vaccination, make, appointment, boosters, &, amp, ;, kids, ages, five, yrs, &, amp, ;, up, you, can, walk, -, in, also, pfizer, |, modern, |, je"
62515,"kindness, looks, amazing, you, #, kindnessmatters, red_hearttwo_heartssparkling_heart"
62516,"it, takes, time, get, things, straightened, out, ., but, taking, time, is, enemy, when, people, are, dieing, ., i, think, pfizer, novavax, announced, phase, one, trials, same, day, ., pfizer, has, been, use, *, year, *, while, novavax, still, hasn, ', i, submitted, era, us, ."
62517,"pfizer, is, going, milk, booster, shots, as, long, as, possible, ,, then, convince, everyone, that, they, need, couid, pills, ."
62518,"how, is, it, legal, pfizer, ceo, do, this"
62519,"ceo, pfizer, needs, be, put, under, oath, explain, why, he, is, promoting, that, boosters, will, stop, variants, when, science, does, not, support, that"
62520,"got, pfizer, booster, yesterday, ., zero, side, effects"
62521,"my, seventeen, y, ., o, ., got, his, #, starmedkids, pfizer, van, the, two, all, i, got, was, this, side, eye, ., i, ., o, ., two, &, amp, ;, four, getting, word, out, #, ajax"
62522,"fda, can, i, i, simply, turn, docs, over, wholesale, records, must, be, reviewed, redact, i, confidential, business, trade, secret, information, pfizer, /, biotech, personal, privacy, information, patients, who, participated, clinical, trials, i, fda, proposes, releasing, five hundred, pages, per, month"
62523,"perfecto, ,, muchas, gracias, smiling_face_with_smiling_eyes, es, que, my, mama, le, positron, pfizer, pero, en, el, certificate, dice, sputnik, face_with_tears_of_joyface_with_tears_of_joyface_with_tears_of_joyface_with_tears_of_joyface_with_tears_of_joyface_with_tears_of_joy"
62524,"pfizer, study, results, confirming, efficacy, couid, -, nineteen, oral, antiviral, treatment, candidate, reducing, risk, hospitalization, or, death"
62525,"only, recently, triply, pfizer, boosted, have, much, chance, against, omicron, ., might, be, good, time, get, out, in, is, ,, not, that, people, here, will, when, death, mantis, is, railing, against, mask, slavery, ."
62526,"children, ages, five, eleven, can, continue, receive, their, pfizer, -, biotech, dose, by, appointment, or, walk, -, in, ., more, information, is, at, :"
62527,"me, 24hrs, post, pfizer, booster"
62528,"after, going, my, first, concert, this, weekend, i, ', i, hooked, ., how, i, missed, live, music, dancing, ., taylor, swift, ,, dua, lips, lady, gaga, i, ', i, sooooo, ready, ., thanks, pfizer, making, this, possible, face_with_tears_of_joy"
62529,"update, pfizer, van, efficacy, omicron, variant, appears, cause, less, severe, disease, ,, pfizer, vaccine, seems, offer, less, defense, against, infection, it, but, still, good, protection, against, hospitalization, ,, recent, study, shows, ."
62530,"speaking, nonsense, ,, you, do, realize, that, i'm, is, out, patent, is, extremely, inexpensive, ., it, ', i, sort, rich, considering, that, vaccine, manufacturers, manufacturers, would, normally, make, $, one, billion, est, year, if, successful, ., pfizer, made, $, thirty-three, billion, with, no, expenses"
62531,"new, study, south, africa, ,, pfizer, vaccine, ', i, effectiveness, against, infection, dropped, ~, thirty, %, omicron, variant, ,, compared, ~, eighty, %, against, previous, variant, ., but, two, pfizer, doses, still, offer, ~, seventy, %, protection, against, hospitalization, ."
62532,"astray, xu, pfizer, xu"
62533,"seeing, #, omicron, neutralization, data, last, week, monoclonal, antibodies, felt, like, punch, gut, ., but, seeing, very, positive, clinical, results, pro, antiviral, #, paxlovid, is, definitely, highlight, ., we, need, more, drugs, our, arsenal, drug, combinations, ."
62534,"pfizer, i, i, couid, -, nineteen, pill, is, up, eighty-nine, %, successful, against, preventing, hospitalization, death, as, result, couid, i, everyone, who, i, i, afraid, needles, got, their, couid, -, nineteen, shots, gotta, be, angry, right, now, ., face_with_tears_of_joy"
62535,"combination, az, modern, or, pfizer, is, supposed, yield, best, immune, response, ., so, they, say, ., person_shrugging, i, male_sign, i"
62536,"pfizer, conforms, new, pharmaceutical, business, model, ., create, lamentable, treatment, ., them, acquire, other, treatments, mitigate, side, effects, first, ."
62537,"this, can, be, game, changer, ,, especially, if, pfizer, reduces, its, cost, affordable, level, ., this, needs, be, available, worldwide, if, we, really, want, see, end, pandemic, ."
62538,"so, #, pfizer, vaccine, two, doses, is, only, thirty-three, %, effective, against, #, omicron, ,, #, faci, says, ., what, i, wanna, know, is, ,, what, is, efficacy, percentage, boost, i, i, i, getting, my, third, shot, thursday, ., #, getvaccinated, #, wearadamnmask"
62539,"After, this, statement, by, #, pfizer, there, is, no, longer, an, excuse, not, to, buy, it, from, the, Mexican, government, ."
62540,"it, certainly, helps, ...."
62541,"I, did, not, make, an, appointment, i, I, arrived, without, an, appointment, at, a, clinic, in, calico, ,, USA, ,, filled, out, a, form, and, in, less, than, five, minutes, I, already, had, my, Pfizer, booster, ., simple, ,, without, servants, of, the, nation, ,, without, forcing, me, to, vote, for, ammo, ,, without, questioning, anything, political, person_shrugginglight_skin_tone, i, male_sign, i"
62542,"i, am, confused_face"
62543,"pfizer, says, new, trial, data, confirms, high, efficacy, its, couid, antiviral, pills"
62544,"so, all, those, vaccinations, mandates, were, unnecessary, ., awesome, ., now, pfizer, has, new, cash, cow, ."
62545,"i, felt, horrible, after, modern, dose, two, ,, but, pfizer, booster, didn, i, i, give, me, any, trouble, at, all"
62546,"pfizer, says, i, lol"
62547,"very, good, news, ., pfizer, jabs, protect, seventy, %, against, hospitalization, omicron, #, newsbreak"
62548,"had, pfizer, booster, yesterday, thank, you, science"
62549,"they, said, same, thing, about, their, bullshit, jab, ., fuck, pfizer, ., middle_fingerlight_skin_tonemiddle_fingerlight_skin_tone"
62550,"people, are, getting, rich, ,, including, every, politician, who, bought, shares, pfizer, modern, ., they, should, all, be, subject, financial, audits"
62551,"#, booster, day, i, #, pfizer, ord, dose, done, checkmark, i, #, fullyvaccinated, syringepartying_face"
62552,"how, are, they, failing, exactly, you, would, have, know, goal, before, you, can, judge, if, they, failed, or, not, ., if, you, are, modern, or, pfizer, payroll, ,, this, has, been, fabulously, successful, ."
62553,"kind, ironic, how, pfizer, biotech, now, sponsor, damn, near, every, radio, show, or, podcast, i, listen, to, ...., business, must, be, good"
62554,"who, i, i, getting, that, pfizer, pill, i"
62555,"considering, this, pres, thinks, he, was, one, whom, came, out, with, these, jabs, i, gotta, ask, ..., why, didn, ', i, we, look, treatment, first, as, we, developed, so, called, jab, that, only, works, as, pretreatment, seems, backwards"
62556,"i, had, same, experience, pfizer, booster, after, two, az, i, ', ve, only, had, sore, arm, ., grateful, ., i, hope, same, op"
62557,"absolutely, hundred_points"
62558,awesome
62559,"i, /, i, they, all, are, vested, it, i, i, huge, money, maker, all, them, ."
62560,"pfizer, couid, pill, efficacy, is, really, fantastic, news, ., yet, ,, if, you, live, blue, state, ,, these, power, hungry, jackasses, still, want, assert, control, over, you, ."
62561,"i, had, two, shots, astrazeneca, then, pfizer, as, booster, ., my, arm, hurt, like, hell, four, days, after, booster, ., that, was, three, weeks, ago, ., all, good, now, ., worth, it, ."
62562,"United_States, third, dose, of, vaccine, would, cause, swollen, glands, ,, and, long, pictures, of, abscesses, in, the, groin, ,, arm, ,, or, in, the, breast, area, reported, by, hundreds, of, patients, in, the, #, unitedstates, ."
62563,"please, get, #, booster, shot, ., #, boosterjab, can, save, your, life, ., one thousand, two hundred, americans, die, each, day, #, covid19, ., mostly, #, antivaxxers, it, i, i, like, ten, plane, crashes, -, every, day"
62564,"so, far, ,, only, left, arm, hurts, but, not, bad, ,, bit, nausea, pfizer, #, boosterjab, yesterday, ., make, your, appointment, ,, please, ."
62565,"pfizer, isn, i, i, going, give, us, any, information, couid, vaccine, until, seventy-five, years, now, i, what, i, i, that, telling, us, that, they, will, have, no, accountability, as, people, die, years, now, after, taking, vaccine"
62566,"say, it, with, me, now, ....., hy, proxy, color, equine, ........, i, ver, mec, tine, ., both, effective, cheaper, ., open, pfizer, pills, get, full, ingredient, analysis, ."
62567,"pfizer, stock"
62568,"coming, soon, ,, pfizer, suppository, couid, -, nineteen, beta, theta, pi, variant, ."
62569,"open, smartness, read, "", pfizer, antiviral, pill, reduces, couid, hospitalization, ,, death, among, high, -, risk, people, by, eighty-nine, i, study, shows, "", here, :, read, it, web, ,, tap, here, :"
62570,"glad, hear, you, are, taking, care, heart_suit, i, folded_handsface_blowing_a_kisssmiling_face_with_smiling_eyes, we, are, all, doing, same, here, ;, all, boosted, here, with, pfizer, /, modern, &, amp, ;, avoiding, any, indoor, gathering, ;, hurt, goes, school, but, they, are, all, masked, &, amp, ;, in, his, special, needs, classroom, all, four, teens, &, amp, ;, teachers, are, all, valued, boosted, folded_hands"
62571,"solid, protection, against, hospitalization, #, omicron, two, -, dose, #, pfizer, ..., seventy, %, down, ninety-three, %, but, not, digging, some, irresponsible, headlines, i, ', ve, seen, focusing, purely, infection, ., hospitalization, is, ballgame, ,, has, been, some, time, ."
62572,"usa, today, :, pfizer, ', i, antiviral, is, eighty-nine, %, effective, with, high, -, risk, people, :, couid, updates"
62573,"pfizer, claims, that, monkey, kidney, cells, are, just, like, human, lung, cells, which, any, real, primatologist, or, internal, medicine, specialist, will, tell, you, that, is, not, true, ., vaccines, are, rushed, population, is, test, subjects, ., why, else, would, elite, push, mandates"
62574,"seriously, though, ., pfizer, all, three, ,, no, side, effects, ."
62575,"new, study, south, africa, indicates, that, pfizer, /, biotech, i, i, vaccine, is, about, thirty-three, %, effective, against, omicron, ,, but, people, infected, with, variant, are, less, likely, end, up, hospital, ."
62576,"new, study, south, africa, indicates, that, pfizer, /, biotech, i, i, vaccine, is, about, thirty-three, %, effective, against, omicron, ,, but, people, infected, with, variant, are, less, likely, end, up, hospital, ., #, boostersnow, #, markup"
62577,"breaking, -, pfizer, i, i, couid, pill, #, paxlovid, should, be, available, by, end, year, is, effective, against, omicron, ,, reduces, risk, hospitalization, /, death, by, eighty-nine, i, company, says, ."
62578,"getting, pfizer, shot, is, gift, that, keeps, giving, ."
62579,"fake, news, early, august, i, tested, positive, couid, only, three, half, months, after, receiving, my, second, dose, pfizer, vaccine, ., when, my, sister, whom, i, live, with, tested, positive, couid, three, half, months, later, november, ,, i, did, not, get, it, second, time, ."
62580,"second, day, in, #, playadelcarmen, #, puertoaventuras, vaccination, against, #, covid19, with, #, pfizer, dose, for, adolescents, aged, fifteen, to, seventeen, backhand_index_pointing_down"
62581,"isn, ', i, possible, not, be, anti, baxter, still, not, want, this, vaccine, i, took, pfizer, ,, my, wife, took, johnson, johnson, ., she, had, issues, caused, by, vaccine, ,, but, nobody, wants, hear, about, them, so, they, will, go, unreported, ., trump, vaccine, is, still, experimental, ..."
62582,"one, out, everyone, who, received, pfizer, vaccine, ,, six, months, post, and, dose, ,, it, showed, rounding, up, three, %, positive, &, amp, ;, rounding, down, ninety-seven, %, negative, ., so, three, %, pfizer, vaccine, recipients, clinical, trial, tested, positive, &, amp, ;, rest, negative, ., this, three hundred, +, page, fda, report"
62583,"that, ', i, what, i, got, ., pfizer, booster, after, az, plus, modern, ., pharmacy, said, it, was, fine, ."
62584,"i, will, too, ., already, have, triple, van, with, pfizer, ,, will, get, fourth, if, advised, ., just, hoped, numbers, might, be, more, promising, ."
62585,"i, got, pfizer, vaccine, booster, ., vaccines, save, lives, ., period, ."
62586,"mrna, vaccines, such, as, pfizer, modern, we, originally, created, first, sars, virus, four, or, eight, so, mrna, vaccine, technology, is, at, least, that, old, ."
62587,"i, still, wear, it, at, work, ., it, is, professional, sports, facility, so, i, ', i, around, players, staff, constantly, ., i, ', i, pfizer, vaccinated, ,, got, my, booster, flu, shot, month, ago, ., i, ', ve, seen, local, er, ', i, packing, up, with, couid, -, nineteen, patients, lately, ., face_with_medical_mask"
62588,"two, pfizer, biotech, vaccines, are, effective, in, not, dying, from, omicron, and, because, it, is, four, times, more, contagious"
62589,"because, all, their, hospital, boards, are, funded, by, pfizer, mercy, big, pharma, general, ..., of, course, they, towed, line, ., they, wanted, keep, their, six, figure, jobs, ., doesn, ', i, take, rocket, scientist, figure, it, out, ."
62590,"i, don, ', i, think, earth, is, flat, ,, fact, i, know, it, ', i, not, ., know, what, else, i, know, that, companies, like, pfizer, modern, are, totally, okay, i, /, killing, people, make, $$$, because, they, have, long, ,, storied, history, doing, so, ., you, really, want, trust, them, think, i, ', all, pass, ."
62591,"Laboratory, tests, indicate, that, the, most, recent, variant, of, couid, can, overpower, two, injections, of, the, pfizer, vaccine, ,, but, not, three, ., a, booster, or, a, new, vaccine, will, be, needed, ."
62592,"and, perhaps, they, are, also, those, who, demanded, to, be, vaccinated, only, with, pfizer, and, that, they, be, vaccinated, before, those, already, established, from, eight, -, seven, ."
62593,"what, ', i, your, title, at, pfizer"
62594,"raised_back_of_handboosted, back, october, ., fabulously, pfizer, xu, ."
62595,"forest, lake, walmart, has, pfizer, apps, sunday, ."
62596,"i, got, pfizer, all, three, was, fine, first, two, but, booster, knocked, me, out, three, days, ., it, i, i, wild, ,, i, was, like, did, they, give, me, wrong, shot, rolling_on_the_floor_laughing"
62597,"what, i, i, not, like, about, that, set, up, you, can, get, strawberry, quit, ,, diet, arizona, ,, soy, almond, pfizer, macchiato, ."
