,0
3661,"especially, when, it, is, university, ', s, best, interest, ., when, faculty, quits, ,, students, lose, ., when, nurses, quit, ,, communities, lose, ., these, anti, mask, ,, anti, vax, people, treat, teachers, medical, staff, as, just, numbers, instead, people, with, families, they, ', re, trying, protect, ."
3662,"if, you, believe, this, hot, garbage, it, really, explains, your, anti, vax, stance, face_with_tears_of_joyface_with_tears_of_joyface_with_tears_of_joyface_with_tears_of_joyface_with_tears_of_joy"
3663,"anti, vax, people, have, got, be, biggest, snowflakes, i, ’, ve, ever, experienced, ., #, vaccinepassport"
3664,"should, anti, vax, pay, higher, health, insurance, premiums, do, they, if, not, ,, why, not, they, charge, smokers, more, that, is, also, lifestyle, choice, ., #, antivaxxers, #, healthcare"
3665,"piling, stressors, person, whose, workplace, got, shut, down, more, than, any, other, ., she, must, be, heartbroken, &, amp, ;, feeling, miserable, ., i, think, antivax, movement, will, have, destroyed, many, marriages, ,, relationships, ,, friendships, &, amp, ;, work, wife, /, husband, trust, ., send, her, red_heart, ️, &, amp, ;, great, tip"
3666,"i, truly, believe, that, many, these, folks, that, are, dying, anti, mask, &, amp, ;, antivax, advocates, /, influencers, stumbled, into, these, roles, cuz, their, videos, ., once, they, saw, response, traction, they, achieved, ,, they, dug, in, …, the, narcissism, &, amp, ;, celebrity, was, too, much, pass, up, ."
3667,"without, forgetting, that, the, epithets, used, by, the, anti, vax, are, 10x, more, contemptuous, towards, us, ., sold, sheep, Nazis, dictators, criminals, against, humanity, poisoners, liars, murderers, and, so, on, ."
3668,"so, let, ', s, see, a, general, strike, ., 90, %, of, the, population, refuse, to, embark, on, an, anti, -, vax, and, anti, -, mask, speech, in, a, general, assembly, ,, the, strike, mandate, would, have, been, refused, "", right, there, ""., and, if, the, executive, had, insisted, ,, he, would, have, been, ousted, ."
3669,"it, ', s, a, fairly, well, -, known, anti, -, vax, and, anti, -, measure, on, twitter, ., She, ', s, been, on, my, blocked, trolls, list, for, quite, a, while, ."
3670,"go, have, open, heart, surgery, 12, hours, learn, walk, again, after, being, heart, lung, machine, only, be, told, you, ’, re, sheep, by, uber, driver, who, is, clearly, anti, vax, refusing, wear, mask, ., thanks, boo, ., you, ’, re, special"
3671,"anti, vax, is, epitome, play, stupid, games, ,, win, stupid, prizes, ., acknowledging, it, isn, ’, t, mocking, ."
3672,"wiggins, can, ball, thumbs_up, but, he, ', s, antivax, thumbs_down"
3673,"totally, ., they, weren, ’, t, antivax, under, trump, …., when, vaccine, was, developed, ."
3674,"jennifer, is, now, saying, blm, is, political, because, act, blue, ., says, pride, flag, is, exclusionary, ., drops, mlk, face_vomiting, then, pivots, anti, vax, ."
3675,"yes, it, has, ., by, people, who, didn, ', t, care, that, it, was, killing, folks, they, did, not, care, about, ., i, care, about, every, life, all, states, except, those, who, push, anti, vax, nonsense, ., them, dying, might, save, lives, ."
3676,"how, do, we, know, she, wasn, ', t, paid, attempt, do, this, or, just, pr, show, antivax, ., i, have, no, issues, at, all, with, this, ., everyone, knows, new, rules, ,, it, is, not, pick, choose, rule"
3677,"if, people, would, just, get, vaccinated, ,, there, would, be, zero, need, any, mandates, ., why, don, ’, t, you, just, tweet, that, it, ’, s, time, your, antivax, followers, swallow, their, pride, or, ignorance, get, it, done"
3678,"regarde, un, épisode, antivax, de, family, guy, face_with_rolling_eyes"
3679,"how, is, it, that, once, again, those, who, will, be, directly, dealing, with, antivax, /, anti, science, /, anti, passport, idiots, are, ones, making, minimum, wage, ., pay, them, more, or, make, it, function, management, ,, not, typically, youngest, least, experienced, customer, service, employees, ."
3680,"before, covid, i, had, no, idea, if, someone, was, antivax, or, not, ., topic, didn, ', t, come, up, ."
3681,"fox, their, republican, cousins, hill, have, done, what, they, always, have, done, gop, base, ., when, cameras, are, off, they, will, tell, you, that, their, viewers, /, base, are, gullible, rubes, be, used, meet, their, own, financial, political, ends, ., this, anti, vax, message, goes"
3682,"saw, story, here, how, helper, anti, vax, carry, it, kill, off, granny, grandpa, right, kingston, ."
3683,"just, when, i, thought, people, couldn, ', t, get, any, stupider, ...., here, ', s, next, new, antivax, covid, treatment, trend, ., what, bunch, fucking, dumbasses, ., #, covid19, #, covidiots"
3684,"me, :, news, covering, another, assembly, antivax, ding, dongs, yelling, holding, signs, why, do, we, keep, giving, this, oxygen, icu, staff, :"
3685,"oh, ,, cool, ., antivax, troll, who, desperately, craves, attention, is, attempting, drag, me, into, their, delusion, ., congratulations, clapping_handslight_skin_tonepartying_face"
3686,"will, conservatives, join, maybe, antivax, how, about, blm, -, bio, progressives, &, amp, ;, allies, will, msm, cover, it, defend, or, oppose, will, it, get, any, traction, or, will, folks, be, too, burned, out, collision, possibilities, explode, collision"
3687,"and, the, "", shit, "", and, the, clowns, and, were, you, on, another, planet, or, are, you, an, #, antivax"
3688,"that, one, hasn, ’, t, gone, antivax, me, ., we, still, need, go"
3689,"republicans, are, betting, that, being, antivax, anti, mask, maintaining, covid19, as, significant, economic, heath, issue, will, prevent, win, biden, before, midterms, ., they, will, sacrifice, lives, political, gain, ."
3690,"preet, ..., venn, diagram, antivax, folks, shampoo, users, ..., is, just, two, circles, ."
3691,"im, antivax, now"
3692,"if, you, ’, re, antivax, stand, behind, it, face_with_tears_of_joyface_with_tears_of_joyface_with_tears_of_joyfolded_handsmedium_skin_tone"
3693,"—-, you, ’, ve, blown, yourselves, up, over, election, lies, ,, crazy, abortion, laws, ,, antivax, s, *, it, ,, now, debt, ceiling, ., can, ’, t, wait, get, rid, all, you"
3694,"i, agree, ., she, ’, s, anti, vax, anti, mask, ., she, doesn, ’, t, wear, mask, her, salon, suite, ., i, was, shocked, at, how, many, people, were, agreeing, with, her, her, posts, ., she, even, got, medical, exemption, her, doctor, posted, photo, cert, ., reasons, listed, are, most, pathetic, thing"
3695,"seriously, ,, have, you, seen, any, anti, vax, protests, they, aren, ', t, eating, salads, ., put, that, shit, ketchup, or, cheap, beer, it, might, work, ."
3696,"anti, vax, protest, downtown"
3697,"mad, max, did, not, have, seat, :, no, change, $, 10, /, day, childcare, promised, multiple, times, :, no, change, climate, change, :, no, change, ,, just, higher, taxs, inflation, aboriginal, clean, water, :, no, change, antivax, :, no, change, so, ,, no, ,, your, spin, shows, no, change"
3698,"#, anakasparian, is, back, her, bullshit, ., claiming, was, right, wing, fake, anti, vax, movement, ., this, woman, is, absolutely, disgusting, ."
3699,"it, really, infuriating, see, someone, who, got, covid, ,, gave, it, their, kid, ,, was, hospitalized, pop, back, onto, social, media, still, spew, being, anti, vax, mask, ., more, so, when, it, is, family, member, who, ', s, grandfather, was, doctor, would, be, support, this"
3700,"this, just, proves, that, people, pushing, anti, /, vax, message, believe, that, their, listeners, are, too, stupid, question, anything, they, say, ,, even, something, as, ridiculous, as, this, ., i, think, it, ’, s, game, with, them, if, someone, dies, ,, oh, well, ."
3701,"they, think, they, are, getting, science, ., have, you, seen, those, antivax, doctors, they, have, be, shown, they, are, being, tricked, ."
3702,"true, ., but, it, has, been, caused, by, fools, who, refuse, get, vaccinated, wear, masks, ., i, believe, that, if, you, are, anti, vax, hospital, should, refuse, admit, you, ., you, chose, die, so, just, hurry, up, do, it, ., no, mercy, anti, vax, fools, ."
3703,"dreamt, i, was, at, parade, or, wedding, but, instead, catching, bride, bouquetbouquet, she, tossed, bag, money, into, crowd, ., i, caught, it, ,, turned, my, antivax, family, ,, reached, out, them, as, if, giving, them, money, but, it, was, my, phone, i, showed, my, screen, as, i, blocked, them"
3704,"just, confronted, antivax, my, life, ., so, very, painful, but, honestly, ,, i, value, myself, high, enough, that, if, they, don, ', t, want, get, vaccinated, ,, then, they, don, ', t, get, me, ."
3705,"your, antivax, theories, are, horse, shit, ."
3706,"as, soon, as, you, take, hockey, away, jaxon, ,, jayden, ,, kayden, etc, ., they, will, be, vaxxed, so, god, damn, fast, ,, suv, ’, s, lined, up, outside, pharmacies, ,, hockey, moms, will, make, sure, it, ., this, is, their, entire, identity, ., their, antivax, bandwagon, abandoned, ,, swiftly, ."
3707,"dj, at, karaoke, bar, did, not, let, me, sing, carry, underwood, bc, she, is, anti, vax, thats, diskrimation"
3708,"clarify, ,, i, know, he, ’, s, comedian, is, doing, bit, ., but, i, don, ’, t, know, if, he, ’, s, antivax, real, ., he, does, lot, antivax, bits, ."
3709,"missed, pt, ., too, soon, vax, kids, now, testsnongoing, ., if, antivax, /, anti, mask, persists, -, as, south, -, kids, infect, parents, +, many, die, ., free, virus, will, mutate, worse, variants, ..., eventually, risk, so, high, ,, desperation, will, mandate, vax, ."
3710,"they, didn, ', t, win, any, seats, ,, but, i, would, just, like, tell, Canada, people, ', s, party, leader, wutever, his, name, is, his, misguided, mostly, antivax, /, antimask, acolytes, go, fuck, yourselves, ..., if, i, knew, your, name, i, could, target, you, directly, ..., oh, well, yawning_faceyawning_faceyawning_face, bye, ,, bye, ..., yawning_faceyawning_faceyawning_face"
3711,"i, have, no, idea, whether, this, dude, is, actually, antivax, or, if, it, ’, s, just, bit, ., but, either, way, ,, glasses, fucking, sent, me, lool"
3712,"i, ’, m, antivax, now"
3713,"think, he, is, vaccinated, anti, -, vax, ., just, another, former, heroin, addict, /, cranky, old, man, ., but, damn, he, can, really, play, guitar, ., damn, you, covid"
3714,"i, think, i, ’, m, anti, vax, now, …"
3715,"i, ', m, so, tired, antimask, ,, antivax, ,, selfish, people, ."
3716,"republicans, not, raising, debt, ceiling, trumps, debt, is, equivalent, being, anti, mask, anti, vax, during, pandemic, ., oh, wait, ..."
3717,"there, ’, s, anti, vax, protest, outside, my, work, should, i, talk, shit, them, or, no, haha"
3718,"honestly, at, this, point, cant, tell, if, bitcoin, loving, or, anti, vax, is, worse, red, flag"
3719,"hey, real, question, ,, how, do, you, expect, biden, shut, down, covid, virus, like, he, said, he, would, with, anti, vax, anti, life, push, by"
3720,"i, dont, get, parents, with, young, children, who, are, anti, vax, like, is, your, child, gonna, catch, polio"
3721,"this, whole, thread, ,, smh, person_facepalming, ., we, see, this, same, story, line, antivax, ,, antimask, ,, anti, -, science, playing, out, across, country, ., it, is, literally, reason, we, will, still, be, fighting, pandemic, next, year, ."
3722,"i, ’, ve, always, had, short, fuse, with, randos, hitting, me, ,, but, this, new, era, flop, taste, really, economized, my, process, ., lots, anti, -, blm, antivax, idiots, going, around, ., fuck, off"
3723,"this, is, so, true, ., i, accidentally, joined, local, antivax, anti, school, facebook, group, frequent, topic, was, how, their, children, were, letting, them, down, by, agreeing, wear, mask, not, ratting, out, their, teachers, ., "", my, kids, aren, ', t, standing, up, my, values, """
3724,"my, mom, is, hospital, with, covid, pneumonia, ct, ., family, is, antivax, ., they, said, don, ’, t, come, yet, ,, stay, put, ., so, i, wait, ., im, conflicted, angry, hopeful, ."
3725,"i, want, retweet, this, so, bad, there, ’, s, hella, antivax, girls, canna, industry, that, say, this, it, drives, me, insane"
3726,"why, is, tfg, vaccinated, son, speaking, at, anti, vax, conference, does, he, just, want, opportunity, lie, kill, americans, ., truly, evil, family, ."
3727,"well, the, antivax, will, have, nowhere, to, go"
3728,"i, ’, m, antivax, now, ."
3729,"zac, rinaldo, ,, literal, piece, shit, ,, being, antivax"
3730,"i, muted, that, ......., long, time, ago, ,, not, shocked, at, stupidity, that, she, tweets, ., antivax, ,, antimask, should, answer, your, question"
3731,"i, read, most, batshit, crazy, anti, vax, ,, anti, government, ,, anti, media, thread, colleague, music, industry, thought, ,, “, anthony, fauci, isn, ’, t, shitting, how, you, promote, spotify, playlists, ya, know, ….”"
3732,"also, any, election, that, is, gain, bq, seats, isn, ', t, good, result, imo, ., expressionless_face, i, ', m, also, personally, miffed, at, 5, %, antivax, vote, yeah, not, only, ppc, call, but, ugh, anti, public, health, is, major, nooo, me"
3733,"good, morning, waking, up, with, my, host, dad, antivax, pissed, off, because, they, didn, ', t, let, him, enter, the, mechanics, without, a, vaccination, card, ,, and, comparing, it, to, nazism, ., I, ', ll, start, charging, for, my, patience, ."
3734,"yes, ,, i, am, red, state, dem, ,, am, surrounded, by, maga, ,, bitter, trumpers, ,, anti, mask, /, antivax, folks, ., they, are, my, workplace, ,, they, are, neighbors, ,, fellow, parishioners, ,, parents, at, my, kids, school, ., their, minds, are, poisoned, &, amp, ;, they, are, not, compromising, ., they, see, us, as, devil, ."
3735,"scroll, through, this, guy, ', s, tweets, ., f, bombs, everywhere, ,, anti, vax, ,, effeminizing, insult, ., 1, too, many, concussions, maybe, ., get, help, mike, ., retired, nhl, player, should, not, be, this, angry, ."
3736,"mad, max, rallied, several, hello, to, anti, covid, and, anti, vax, measures, ., he, will, surely, not, have, this, chance, in, 2, or, 3, years, ., with, its, extreme, positions, ,, the, CCP, will, be, to, the, right, what, the, green, party, is, to, the, left, :, a, marginal, party, ."
3737,"if, city, mandated, all, businesses, ,, good, them, ., they, can, take, ferry, work, at, anti, vax, joint, bremerton, ."
3738,"nope, ., they, have, never, said, one, word, about, anti, vax, ., you, are, making, it, up, ."
3739,"see, ya, later, see, your, mug, at, anti, vax, rallies"
3740,"john, legend, is, everything, ne, i, hope, he, is, not, a, rotten, male, antivax, because, i, love, him"
3741,"if, you, spread, misinformation, about, vaccines, pandemic, you, should, be, prosecuted, at, least, manslaughter, ., antivax, people, are, nothing, less, than, mass, murderers, ., fucking, bullshit, ., #, socialmediawasamistake"
3742,"he, was, no, liberal, ., one, thing, dude, is, nuts, ,, go, read, his, instagram, posts, ., i, ', ll, bet, you, $, 1000, he, was, anti, vax, ,, with, his, rants, about, "", media, brainwashing, "", his, faux, nature, enthusiasm, ., bashing, apple, watches, while, driving, around, car, using, cell, phone, ."
3743,"not, my, sister, law, being, anti, vax, then, getting, covid, being, told, she, will, be, stuck, with, couch, indefinitely, …, shoulda, got, shot"
3744,"very, not, ani, -, vaxxer, just, said, ’, s, stream, :, “, we, ’, re, not, anti, vax, ,, we, ’, re, pro, choice, ., apart, that, -, we, all, know, vax, is, poison, ”, dead, set, ,, can, ’, t, make, this, shit, up, rolling_on_the_floor_laughingrolling_on_the_floor_laughingrolling_on_the_floor_laughingclown_faceclown_faceclown_face"
3745,"mmog, covid, version, meme, innocent, facebook, joke, about, covid, mockery, views, become, radicalized, antivax, orations, prayers, after, they, are, hospital, with, covid, gofundme, setup, by, family, after, they, die, get, vaccinated, ."
3746,"he, ', s, not, antivax, he, ', s, i, am, same, this, ., some, my, family, is, vaxd, ,, some, is, not, ., but, i, was, already, exposed, delta, without, issue, .., 19, kicked, my, ass, ,, but, delta, slid, off, like, storm, windshield, ."
3747,"lol, i, have, two, that, are, antivax, hoteps, ., it, gets, real, crazy, group, chat"
3748,"here, ', s, problem, with, everything, ., it, ', s, not, matter, how, you, visualize, math, ., there, is, actual, right, answer, rest, are, wrong, ., it, ', s, math, ., but, that, you, contribute, your, belief, anyway, ,, defensively, ,, knowing, you, ', re, probably, wrong, ,, is, why, we, have, #, antivax, movement, ., stop, ."
3749,"if, it, passes, cloth, for, who, it, is, ,, it, ', s, the, same, for, me, ., apart, from, that, free, talk, of, hers, to, fall, into, the, anti, -, vax, speech, is, a, leap, ."
3750,"more, current, articles, ,, happy, only, ones, confused, are, you, antivax, nuts"
3751,"antivax, doctors, should, no, longer, be, doctors, .."
3752,"mortality, got, better, because, medicine, got, better, ,, but, vaccines, are, what, eradicated, one, worst, killers, humanity, smallpox, nearly, eradicated, two, others, before, antivax, movement, exploded"
3753,"how, many, antivax, doctors, are, there, alberta, rescind, their, medical, accreditation, pouting_face"
3754,"my, entire, extended, family, got, covid, ., all, very, anti, vax, refused, stop, going, out, events, with, mass, amounts, people, ., why, are, people, so, fucking, stupid"
3755,"trump, ., right, wing, ., antivax, antimask, ., antiscience, ."
3756,"let, ', s, be, clear, ,, i, ', m, not, anti, vax, ,, i, ', ve, got, both, my, shots, i, travel, lot, so, i, ', m, also, not, against, showing, negative, test, travel"
3757,"must, be, big, anti, vax, reddit, how, protest"
3758,"i, cannot, understand, being, anti, vax, i, am, so, anti, anti, vax, i, be, making, up, vaccinations, things, my, head, romanticizing, them, now, like, mmmm, can, we, vaccinate, me, being, complete, dumbass, make, me, lactose, tolerant, this, is, sexy, talk"
3759,"best, part, me, &, amp, ;, nala, getting, covid, is, definitely, my, antivax, sister, using, this, as, slam, dunk, moment, her, movement, ., aaah, joys, family, ."
3760,"agree, ., when, it, comes, anti, vax, nonsense, it, ’, s, well, over, 90, %, republicans"
3761,"check_mark_button, bible, verse, check_mark_button, phrase, showing, his, commitment, god, check_mark_button, antivax"
3762,"face_with_rolling_eyes, eric, ,, antivax, /, anti, -, mask, /, covid, denier, is, imbecile, ."
3763,"lol, this, is, what, happens, when, you, ’, re, honest, 100, %, correct, anti, vax, crowd, ., they, can, ’, t, handle, that, ."
3764,"is, being, pro, /, anti, vax, only, personality, trait, ppl, posses, nowadays, get, over, it, ."
3765,"dropping, blocks, antivax, morons, today, ,, which, makes, me, sad, because, educating, them, would, probably, be, better"
3766,"i, wouldn, ', t, say, i, fight, others, rights, not, be, vaccinated, ., i, support, their, choice, ,, but, i, wouldn, ', t, go, anti, vax, event, join, fight, ."
3767,"#, vaxsolidarity, #, vaccineswork, #, covidiots, another, one, bites, dust, ., all, bs, they, put, out, re, antivax, nonsense, -, i, have, hard, time, feeling, bad, them, ."
3768,"i, ', m, so, sad, ., my, oma, called, say, i, got, something, mail, delivered, her, house, i, was, like, "", i, ', d, love, visit, you, when, you, get, vaccinated, "", she, sternly, said, "", i, ', m, not, getting, vaccinated, "", started, talking, about, one, quack, doctor, who, spread, antivax, garbage"
3769,"same, thing, anything, do, with, any, human, ’, s, body, including, vaccine, ., i, am, never, antivax, ,, but, i, am, wait, let, kinks, get, straightened, out, ., me, or, my, family, are, not, guinea, pigs, ., i, am, right, choose, ., i, agree, with, vaxd, or, not, vaxd, ., i, am, freedom, choice"
3770,"yall, …., not, funeral, home, putting, up, anti, vax, advertisements, face_with_tears_of_joyface_with_tears_of_joyface_with_tears_of_joyface_with_tears_of_joyface_with_tears_of_joy"
3771,"jimmy, dore, is, now, just, pushing, antivax, opinions, us, right, know, group, formerly, anti, mercury, /, ant, vax, group, regarding, big, funding, documents, ., dore, is, just, alex, jones, now, ,, without, demons, ., jones, did, literally, 100, %, this, same, thing, last, week, ., embarrassing, ."
3772,"way, yellowstone, ., was, listening, vegas, station, until, signal, gave, out, st, ., george, ., radio, switched, local, station, ., heard, craziest, ,, most, unhinged, antivax, rant, ever, ., un, ,, bill, gates, ,, communism, ,, gummint, control, …, almost, had, spittle, dripping, off, radio, ."
3773,"next, two, weeks, :, my, mom, ’, s, birthday, ,, big, game, bfe, ,, sis, coming, into, town, ,, lotería, ,, german, food, ,, acl, fest, ,, my, birthday, ., i, ’, m, not, here, antivax, white, supremacy, bullcorn, that, span, tia"
3774,"once, again, ,, the, antivax, are, jubilant, ,, but, are, wrong, following, the, revelations, of, the, girl, ', s, parents, ."
3775,"this, may, be, only, messaging, that, gets, antivax, men, their, shots"
3776,"i, start, my, first, day, back, covid, unit, tomorrow, ., tonight, i, was, bar, i, had, anti, vax, jerk, harassing, me, once, he, heard, i, was, travel, nurse, ., i, didn, ’, t, feel, like, arguing, with, dude, so, attempt, get, him, leave, me, alone, i, decided, lie, ."
3777,"antivax, :, i, won, ’, t, take, shot, because, i, don, ’, t, know, what, ’, s, it, also, antivax, :, don, ’, t, worry, about, ingredients, chili, cheese, fritos, it, won, ’, t, kill, you"
3778,"memoriam, is, all, anti, vax"
3779,"only, side, effects, i, see, are, those, antivax, crowd, convincing, others, not, vaccinate, by, spreading, misinformation, ,, your, daughter, is, now, one, those, side, effects, ."
3780,"I, wish, it, was, for, that, ., but, in, reality, it, ', s, because, these, pizzerias, don, ', t, have, tables, ,, they, ', re, "", grab, n, ', go, ""., unfortunately, there, are, many, anti, -, vax, drugs, here, more, than, in, brazil, and, despite, the, law, ,, restaurants, are, not, actually, charging, vaccination, cards, ,, it, ', s, just, a, facade"
3781,"i, want, black, ppl, richmond, -, specifically, men, my, age, younger, -, free, themselves, antivax, theology, ., like, yall, barely, graduated, hs, ., stop, with, bullshit"
3782,"be, honest, ,, with, their, announcement, i, ’, m, not, buying, that, ., or, ,, if, it, ’, s, true, ,, they, missed, opportunity, help, community, by, saying, get, vaccinated, instead, adopted, subtle, antivax, talking, point, ."
3783,"what, "", plot, "", is, that, ,, christopher, one, where, #, republicans, are, killing, their, own, constituents, with, #, antivax, &, amp, ;, #, antimask, campaigns, one, where, women, even, if, victims, rape, ,, incest, ,, trafficked, ,, disabled, are, denied, their, constitutional, right, medical, help, terminate, #, prodeath"
3784,"but, it, ', s, also, complicated, to, make, this, association, of, veganism, with, antivax, ,, right, because, one, thing, has, nothing, to, do, with, the, other, and, giselle, is, not, vegan, and, paraded, her, entire, life, in, fur, coats, ., her, wearing, a, vegan, dress, once, doesn, ', t, say, anything, about, anything"
3785,"biggest, lie, is, that, biden, is, effective, w, covid, 19, ., he, ignored, delta, ,, fanned, antivax, fears, when, he, took, j, &, amp, ;, j, vaccine, off, market, over, handful, side, efx, misadvised, nation, stop, wearing, masks, ., directly, responsible, 100k, deaths, ."
3786,"who, hell, said, i, was, "", antivax, """
3787,"so, ,, anti, vax, ’, rs, now, want, be, referred, as, “, pure, bloods, ”"
3788,"i, see, kirk, cousins, trending, …, not, his, crack, covid, anti, vax, stance, but, because, he, has, perfect, passer, rating, ., didn, ’, t, start, him, ., ef, ’, ing, kenny, ’, s, fault"
3789,"everyone, is, mad, about, this, nicki, minaj, anti, vax, drama, but, i, ’, m, actually, really, happy, because, it, means, her, m, ., i, ., a, ., still, talk, are, friends, red_heart, ️"
3790,"nfl, should, have, antivax, mvp, award, antivax, player, that, plays, most, games, ."
3791,"we, had, vaccines, ., we, could, have, eradicated, fucking, thing, ., but, no, ., don, ', t, want, socially, distance, ., don, ', t, want, wear, masks, ., don, ', t, want, damn, vaccine, ., now, we, ', re, talking, about, living, with, it, having, annual, booster, shots, ., fuck, fucking, you, ,, antivax, assholes, ."
3792,""", i, ', m, not, anti, vax, i, just, love, being, american, having, right, choose, i, won, ', t, be, getting, shot, "", you, ', re, anti, vax, ."
3793,"this, is, man, y, ', all, share, anti, vax, sentiments, with, ,, don, ', t, know, what, i, just, watched"
3794,"overheard, antivax, family, member, today, :, "", i, know, two, people, who, refused, shot, ended, up, dying, when, they, got, put, ventilator, ., if, i, ever, get, sick, ,, don, ', t, send, me, hospital, bc, that, ', s, what, kills, people, ."", cognitive, dissonance, ..."
3795,"how, can, you, grow, up, be, anti, vax, during, pandemic"
3796,"just, realized, lot, other, far, lefties, are, anti, vax, mask, mandate, …, this, is, why, i, have, trust, issues"
3797,"british, term, ,, i, ', ve, seen, number, people, using, it, ,, majority, not, antivax"
3798,"while, they, don, ', t, represent, all, based, hospital, protests, ,, now, followed, by, school, protests, ,, it, is, clear, they, represent, many, anti, vax, crowd, ., who, would, want, be, associated, with, such, folks"
3799,"west, block, is, so, anti, trudeau, pushing, that, no, one, wanted, election, ., you, know, what, ., antivax, crowd, are, essentially, reason, we, need, this, election, ., we, need, mandate, what, majority, want, ., not, what, minority, want, ., vote, ."
