,0
1222,"major, city, outside, phoenix, area, ,, full, time, firefighter, /, paramedic, ., ran, three, covid, patients, just, today, ,, two, with, oxygen, levels, low, 80s, ., we, ', re, not, doing, anything, ,, that, ', s, problem, ., bunch, antivax, covid, deniers, that, get, thier, medical, info, twitter, oann, ."
1223,"you, ’, ll, get, no, response, ., just, anti, vax, troll, ."
1224,"my, coworker, who, is, antivax, recently, got, back, florida, has, been, non, stop, coughing, past, 2, days, will, not, leave, her, mask, up, ., girl, get, f, away, me"
1225,"the, argument, of, the, sans, arguments, ,, antivax, and, others, ., in, the, meantime, ,, read, the, unscear, report, ,, the, nuclear, ipcc, ,, if, you, are, ready, to, give, up, your, preconceptions, ."
1226,"wow, ..., that, ', s, pathos, per, cubic, inch, and, how, those, you, call, anti, vax, prevent, you, from, "", cumming, "", rolling_on_the_floor_laughing"
1227,"you, mean, :, it, ', s, dead, ..., like, a, hospitalized, antivax"
1228,"cost, antivax, conspiracy, thinking, lack, obligation, any, responsibility, condition, people, community, is, needless, suffering, ., if, they, won, ', t, pay, bill, their, stupid, selfishness, ,, someone, will, ., 2, /, 2"
1229,"aaron, fraudgers, antivax, sicko, clown_face"
1230,"do, #, antivax, ers, know, that, they, are, cause, this, continuing, epidemic, virus, would, dry, out, if, it, didn, ’, t, have, such, abundance, easily, accessible, hosts, ."
1231,"i, fear, that, big, business, saw, /, sees, downside, pissing, off, antivax, -, right, ."
1232,"fuck, you, ,, ,, you, fucking, antivax, trump, trash, piece, shit, ., i, hope, you, fucking, drop, ., loser, trash, ."
1233,"tysm, denise, blue_heart, if, you, are, anti, vax, ,, anti, science, than, please, be, anti, hospital"
1234,"if, these, anti, vax, folks, can, ', t, even, figure, out, diference, between, public, /, private, entities, ,, corporations, are, people, concept, is, going, make, their, heads, explode, ."
1235,"his, tweet, doesn, ’, t, even, make, sense, ., be, anti, vax, -, fine, ., but, my, having, covid, tweeting, folks, stay, safe, means, i, ’, m, paid, by, cdc, take, off, your, tinfoil, hat, ,, bro, ."
1236,"therein, lies, problem, ,, lauren, ., #, gop, #, biglie, #, antivax, #, antivaxxers, #, covidiot, #, getvaccinatednow, #, january6thinsurrection"
1237,"anti, vax, invasion, burger, king"
1238,"texas, florida, had, over, 87, ,, 000, #, covid, deaths, just, last, year, ., this, us, what, happens, when, you, have, gop, governors, who, cater, antivax, ,, antimask, crowd, -, thousands, needless, deaths, ., #, abbottfailedtexas, #, desantisfailedflorida, ., #, votethemout, #, votethemallout2022"
1239,"completely, understand, where, antivax, protesters, brooklyn, burger, king, are, coming, from, -, app, deals, are, just, too, good, not, fight, relieved_facepartying_facerobot"
1240,"psa, :, you, realize, that, when, you, like, ish, like, barstool, dave, portnoy, posts, or, anti, vax, posts, -, that, ish, shows, up, others, timelines, …"
1241,"ugh, ., #, antivax, sil, had, mild, covid, symptoms, didn, ’, t, tell, us, before, we, went, over, christmas, day, ;, plus, she, won, ’, t, get, tested, ., we, all, feel, fine, have, been, vaxxed, /, boosted, ,, but, i, ’, ve, always, let, family, /, friends, know, if, i, ’, m, sick, prior, gatherings, ,, even, w, /, common, cold, ."
1242,"it, ’, s, unemployment, benefit, ,, nothing, do, with, antivax, ., 100, %, vax, will, never, happen, ,, like, flu, vaccine, ,, not, 100, %., your, feeling, don, ’, t, matter, unemployment, benefits, satiates, that, don, ’, t, concern, you, ."
1243,"providing, unemployment, benefits, is, not, incentive, antivax, ., it, ’, s, proving, benefits, that, they, are, entitled, under, state, laws, ."
1244,"here, we, are, florida, that, is, full, people, who, think, anti, -, vax, -, mask, is, tourist, attraction"
1245,"oh, dear, god, ., when, i, found, out, yesterday, that, koch, industry, was, funding, these, anti, -, vax, groups, i, was, furious, ., i, bet, they, are, all, vaccinated, ., that, ', s, seriously, dark, money, republicanism"
1246,"in, the, country, where, I, am, ,, 38, %, of, people, have, not, been, vaccinated, ,, not, because, they, don, ', t, have, a, vaccine, ,, but, because, they, don, ', t, want, to, ., and, they, know, why, they, don, ', t, want, to, because, there, are, antivax, ., and, they, know, where, the, antivax, have, fertile, soil, in, the, American, evangelical, milieu, ."
1247,"i, ’, m, super, duper, surprised, that, nick, emery, is, anti, vax, face_with_rolling_eyes"
1248,"i, live, south, ., florida, specifically, ., whole, state, is, anti, mask, anti, vax, loudly_crying_face, #, armysroom"
1249,"day, 654, :, it, ’, s, truly, embarrassing, seeing, how, many, you, are, so, anti, vax, &, amp, ;, anti, mask, mandate, ., answer, this, ,, do, y, ’, all, not, want, this, pandemic, end, y, ’, all, don, ’, t, like, masks, but, will, your, surgeon, complain, putting, it, during, your, 6, hour, bacc, surgery, when, you, ’, re, 75, believe, science"
1250,"why, do, anti, vax, people, swear, they, have, point, when, some, one, suffers, rare, side, effect, as, if, almost, any, every, medicine, has, rare, side, effects"
1251,"our, province, ,, about, 85, %, us, are, pro, science, vaxxed, ., but, as, conspiracies, include, all, ranges, beliefs, ,, my, friend, started, looking, at, other, characteristics, beyond, just, their, common, anti, vax, ideas, ., they, realized, that, some, those, folks, were, not, only, scared, vax, 4, /, n"
1252,"me, neither, ., it, ', s, q, &, amp, ;, goper, words, that, trigger, me, -, esp, antivax"
1253,"would, virgin, mother, christ, have, been, anti, vax"
1254,"1, month, ago, krista, haynes, ,, oldest, daughter, ontario, premier, doug, ford, ,, went, antivax, rant, after, her, ex, cop, husband, dave, haynes, was, put, unpaid, leave, ,, refusing, vaccinate, ., 2, days, ago, he, had, turn, his, badge, ."
1255,"quick, review, don, ', t, look, up, -, dark, comedy, about, antivax, mentality, vs, extinction, -, level, comet, destruction, ..., haha, ., we, ', re, so, gonna, die, upside, -, down_face, reposted, because, autocorrect, hates, me"
1256,"people, are, hating, letitia, wright, because, she, ’, s, supposedly, anti, vax, that, spread, recast, bs, ."
1257,"whether, you, agree, with, its, sentiment, or, not, this, tweet, ,, realmac, account, is, antivax, sock, puppet"
1258,"just, so, you, know, that, ', s, antivax, account, you, ', re, quote, tweeting"
1259,"if, you, ', re, actual, medical, doctor, you, ', re, antivax, ,, you, ', ve, got, brain, damage, need, seek, help, immediately, ."
1260,"not, anti, vax, ., just, anti, being, test, subject, government"
1261,"you, ', re, confused, because, this, person, is, antivax, er, pretending, be, merely, worry, mongering, vaccine, safety, ., without, name, or, identity, this, is, as, good, as, fake, account, acting, as, part, psyop, ."
1262,"just, theory, but, i, bet, all, antivax, people, opt, out, being, organ, donors, ."
1263,"how, deprogramming, my, mother, ', s, cancer, operation, to, give, priority, to, antivax, conspiracies, who, have, covid, is, constitutional"
1264,"i, believe, yesterday, rep, greene, georgia, tried, use, vaers, numbers, as, justification, her, anti, vax, stance, ."
1265,"he, is, by, any, reasonable, definition, antivax, spreading, fud, that, gets, people, killed, prolongs, pandemic, dollars, isn, ’, t, «, minor, disagreement, »,, it, ’, s, massive, irreconcilable, difference, ."
1266,"had, lots, anti, vax, california, patients, insist, “, colloidal, silver, ”, was, their, preventive, cure"
1267,"interesting, diagnosis, idw, ', s, antivax, fallout, by, possibly, its, only, member, -, of, -, sorts, with, intact, reputation"
1268,"i, believe, backers, antivax, movement, are, just, about, creating, chaos, ., that, was, often, tactic, vietnam, war, protests, ., just, keep, people, edge, scared, what, ', s, next, ."
1269,"actually, ,, i, want, see, dozenz, anti, vax, loons, running, office, all, at, once, ,, each, with, differe, t, quack, treatment, ."
1270,"greetings, #, foxnews, #, levin, :, #, osha, could, help, enorce, illegal, #, antivax, immigration, workplace, ,, just, thought"
1271,"what, is, it, anti, vax, anti, mask, covid, deniers, don, ', t, understand, about, body, count, guess, they, missed, vietnam, war, ."
1272,"unfollowing, all, antivax, people, i, follow, ,, even, hot, ones"
1273,"covid, anti, wax, mask, propaganda"
1274,"you, literally, said, initial, point, like, 5, times, ., which, he, was, already, hurt, begin, with, ., but, go, off, be, antivax, champion, ."
1275,"as, many, as, it, takes, until, all, antivax, folks, get, their, shot, ., they, are, dragging, this, out, ., when, you, watch, family, memb, die, or, someone, close, you, becomes, immune, suppressed, you, will, get, shot, ., being, afraid, shot, but, not, being, afraid, causing, death, or, dying, is, not, logical, ."
1276,"anyone, get, into, fight, with, anti, vax, family, members, christmas"
1277,"depends, content, tweet, ., if, tweet, is, anti, mask, or, anti, vax, it, definitely, does, ."
1278,"well, ,, if, you, know, how, to, read, a, graph, ,, which, would, be, amazing, ,, this, one, is, just, for, you, and, your, stupid, antivax, friends, :"
1279,"she, ’, s, antivax, because, she, ’, s, attention, hungry, hag, ., i, ’, ll, bet, she, ’, s, vaccinated, boosted, ."
1280,"yes, ,, #, evangelicals, ,, repent, ., #, getvaccinated, #, maskup, yeshua, #, jesus, dead, people, don, ', t, make, good, converts, ., #, antivax, is, #, antichrist"
1281,"i, am, surprised, that, antivax, on, -, line, information, directed, prospective, parents, is, being, presented, as, new, phenomenon, ., those, us, involved, children, ’, s, care, this, preceded, current, pandemic, by, decades, ., welcome, our, everyday, ., disappointed_face"
1282,"ny, times, profiling, antivax, folks, has, same, energy, as, dozens, "", three, trump, supporters, cafe, "", stories, they, ran, 5, years, ."
1283,"because, i, believe, people, who, are, anti, vax, are, spreading, misinformation, ,, which, is, prolonging, this, pandemic, ., it, ’, s, moral, issue, that, is, causing, more, deaths, ."
1284,"i, think, it, ’, s, russian, roulette, if, you, ’, ll, have, bad, symptoms, and, /, or, long, covid, without, vax, ., i, know, unvaxxed, people, younger, than, me, who, had, it, way, worse, -, i, wasn, ’, t, going, find, out, ., i, gave, you, my, opinion, ., any, more, anti, vax, i, block, ., i, don, ’, t, give, that, nonsense, platform, ."
1285,"this, is, great, 1, more, people, give, get, it, or, 2, he, loses, some, people, his, base, because, they, bought, into, antivax, crap, ., or, 3, no, it, matters, he, will, win, again, because, too, many, people, need, daddy, tell, them, what, do, think, ."
1286,"#, antifa, or, #, antivax, which, has, killed, fewer, people"
1287,"runs, afoul, something, strongly, reminiscent, correlation, doesn, ', t, equal, causation, fallacy, ., ex, :, many, who, understand, wokism, is, dangerous, also, embrace, antivax, idiocy, ., same, brain, that, grasps, truth, can, also, spew, bs, ., humans, evolved, do, just, that, ,, i, ., e, ., cognitive, dissonance, ."
1288,"alex, jones, ’, s, wife, was, arrested, domestic, violence, ., he, blamed, her, medication, imbalance, madison, cawthorn, &, amp, ;, his, earthen, vessel, are, divorced, after, 8, mos, evangelicals, aggressively, push, antivax, lies, bags, cash, were, found, behind, joel, osteen, ’, s, toilet, party, family, values, y, ’, all"
1289,"love, your, character, ,, but, they, are, right, about, antivax, nonsense, if, that, ', s, case, ., at, this, point, time, with, all, these, deaths, ,, there, is, no, space, these, antivax, views, ., vaccines, have, saved, millions, lives, extended, life, expectancy, over, 50, years, ."
1290,"xmas, dinner, tonight, ., 12, year, old, shared, there, friend, ’, s, both, parents, hospital, with, covid, now, week, ., parents, kid, spending, xmas, with, neighbors, ., said, parents, were, “, anti, vax, ”., said, im, sorry, i, will, pray, your, friend, parents, ., 12, days, christmas, will, be, rough, roc"
1291,"no, please, continue, telling, me, about, how, you, ’, re, anti, vax, as, you, shove, your, whole, hand, chip, bowl, proceed, touch, every, chip"
1292,"ok, so, like, my, sister, posted, this, i, ', m, getting, weirdest, vibes, it, i, can, ', t, explain, it, but, why, did, she, /, her, husband, write, that, at, bottom, top, was, written, by, my, nephew, i, feel, like, it, ', s, just, because, they, ', re, antivax, trumpies, idk"
1293,"this, republican, trumpet, came, my, tour, few, days, ago, was, hitting, me, -, asked, my, instagram, at, end, tour, ., upon, further, investigation, watching, his, stories, i, ’, ve, diskovered, he, is, anti, vax, ., i, ’, m, thinking, way, fake, my, own, death, covid, insta"
1294,"it, was, my, best, friends, brother, but, i, ’, ve, known, him, 55, years, ., covid, ,, anti, vax, ,, you, know, story, ."
1295,"look, ,, i, know, that, people, who, follow, me, realize, that, i, constantly, point, out, continued, lies, perpetuated, by, governor, #, rondesantis, ,, but, here, he, is, once, again, unwilling, tell, truth, ,, even, #, foxnews, ., #, antivax, folks, are, dangerous, .., wake, up, #, florida, broke, ur, own, record, 2day"
1296,"20, min, into, food, there, ’, s, already, dumbass, antivax, commentary, ., merry, christmas"
1297,"if, she, was, around, today, anne, wilkes, misery, would, be, ringleader, gang, antivax, nurses"
1298,"part, problem, ., he, was, anti, vax, before, they, made, everyone, think, it, was, cool, ."
1299,"crackpot, antivax, march, going, down, yonge, ., smallest, one, i, ’, ve, ever, seen, ., could, count, number, people, looking, down, my, condo, :, 24, plus, truck, with, speaker, so, loud, you, can, ’, t, understand, it, grinning_squinting_face, ., pathetic, ., #, getvaccinated, #, vaccinepassports, #, vaccinemandates, #, onpoli"
1300,"couple, decades, tough, science, ., this, article, is, about, anti, vax, who, oppose, almost, all, such, treatments, ."
1301,"morons, who, ', d, rather, die, than, be, vaccinated, are, certifiable, ., disappointed, no, end, by, hordes, otherwise, intelligent, people, who, ', ve, embraced, antivax, insanity, ., illustrates, why, state, coercion, i, ., e, ., law, is, necessary, ."
1302,"no, she, was, actually, good, chick, not, anti, vax"
1303,"friendly, reminder, that, its, ok, flame, your, anti, vax, relatives, ."
1304,"je, savais, que, c, ’, était, un, antivax, face_with_symbols_on_mouth, va, falloir, s, ’, en, remettre, au, krampus, person_shrugging, ‍, male_sign, ️"
1305,"listening, anti, vax, speak, never, fails, make, me, want, grind, my, face, off, with, cheese, grater"
1306,"i, ', ll, be, with, my, wife, ., we, left, my, anti, vax, parents, house, ."
1307,"my, non, vaccinated, cousin, is, icu, ventilator, is, 100, %, breathing, her, ., she, ', s, healthy, ., not, obese, ., just, thought, vaccine, was, joke, ., #, covid19, is, no, joke, ., #, antivaxxers, #, antivax"
1308,"well, i, think, it, ', s, relatively, simple, ., i, ', m, antivax, if, you, don, ', t, want, get, shot, as, result, informed, consent, ., i, ', m, pro, vaxx, if, you, want, shot, as, result, informed, consent, ., problem, is, ,, there, ', s, nobody, who, has, taken, real, cvaxx, no, placebo, who, was, truly, informed, ."
1309,"so, someone, has, been, putting, antivax, qr, codes, around, gallup, …"
1310,"wish, people, who, worship, him, but, are, fervently, anti, vax, would, listen, but, they, don, ’, t, ."
1311,"you, guys, are, always, so, sure, about, things, ., if, 80, +, %, people, had, gotten, vaccinated, earlier, this, year, delta, may, have, been, less, killer, omicron, might, not, have, gotten, into, america, ., but, anti, vax, stopped, that, …"
1312,"where, are, you, why, not, set, up, separate, hospital, tents, or, quonset, hut, just, antivax, virus, deniers, ., let, them, hire, their, own, doctors, such, nurses, ."
1313,"100, %, agree, why, should, needy, die, due, another, ’, s, anti, -, vax, stupidity"
1314,"i, am, home, suburbs, sacramento, i, ’, m, not, saying, any, these, things, their, own, are, bad, ,, but, combo, some, these, magazines, at, grocery, store, checkout, makes, sense, when, i, think, about, all, antivax, mommies, hs, i, ’, ve, had, unfriend"
1315,"real, task, now, separate, wheat, chaff, ,, even, my, health, gurus, list, right, after, omicron, ,, antivax, trolls, seemingly, shut, up, ,, uncertain, how, blame, it, democrats, ’, “, lust, control, ”, but, now, ,, “, it, ’, s, just, ;, don, ’, t, try, avoid, it, ”, “, 4th, shot, is, evil, ”"
1316,"dear, lord, ,, it, ', s, christmas, eve, ,, there, will, be, at, least, 170k, new, covid, cases, diagnosed, today, ,, y, ', all, can, ', t, take, day, off, your, anti, vax, madness, ., get, life, ."
1317,"yep, ., how, many, have, died, because, trump, didn, ', t, encourage, people, get, vax, he, could, have, been, calling, out, anti, vax, lies, fox, news, year, ,, but, he, didn, ', t"
1318,"if, it, sounded, a, little, cryptic, ,, it, was, intentional, ., I, don, ', t, want, to, raise, some, points, here, that, can, be, used, by, antivax, ., it, is, a, technical, decision, ,, which, uses, technical, criteria, and, a, fine, balance, between, risks, and, benefits, ."
1319,"many, people, being, called, “, anti, vax, ”, is, worst, possible, thing, they, can, be, called, ., that, ’, s, why, people, like, meghan, mccain, will, call, people, like, me, “, anti, vax, ”, because, they, don, ’, t, have, provide, facts, think, is, scares, us, into, submission, ."
1320,"no, ., you, anti, vax, maskers, who, think, only, your, own, comfort, fun, moment, degrade, society, ."
1321,"having, antivax, parent, means, sneaking, out, get, tested"
1322,"either, you, are, very, dense, or, ignorant, intent, vax, be, able, further, your, antivax, narrative, ."
1323,"trump, pro, vaccine, kennedy, leading, antivax, ., this, must, so, confusing, morons, right, now, ."
1324,"advent, crackpot, #, conspiracytheories, promulgated, through, social, media, &, amp, ;, right, wing, tv, /, radio, ,, #, antivax, movement, bolstered, by, pathological, liar, #, trump, who, said, #, covid19, is, “, democrat, hoax, ”, then, downplayed, severity, ,, limiting, testing, ,, etc, ., political, hacks, ,, we, have, more"
1325,"no, i, ', m, no, anti, vax, we, have, been, careful, but, come"
1326,"instead, trying, “, fix, ”, your, racist, ,, “, im, not, anti, vax, ,, im, anti, -, mandate, ”, aunt, karen, at, christmas, dinner, this, year, ,, sit, at, kids, table, turn, them, into, little, radical, activists, ., it, ’, s, way, more, fun, effective"
1327,"trump, clowns, candace, owens, when, she, comes, with, garbage, anti, vax, talking, points, pretty, bad, when, you, make, trump, seem, like, smart, 1"
1328,"wah, wah, wah, wah, waaah, ..., #, oops, #, maga, -, morons, #, antivax, -, suckers, #, qanuts, #, freedomrally, -, face_with_hand_over_mouth, -, clown_face, -, pile_of_poo"
1329,"lol, getting, weird, comments, anti, vax, douchebag, pizza, post, all, things, was, not, my, bingo, card, today"
1330,"i, do, enjoy, that, flu, is, used, both, ways, by, anti, vax, ., "", it, ', s, just, flu, "", "", the, flu, kills, ,, too, we, don, ', t, do, anything, """
1331,"teacher, i, worked, with, posting, nonstop, anti, vax, propaganda, along, with, unhinged, personal, opinions, ., state, certified, teachers, denying, science, all, support, racism, ."
1332,"if, you, got, vaccine, ,, i, like, you, ., if, you, didn, ', t, get, vaccine, ,, i, like, you, ., #, vaccine, #, antivax, #, vaccinated, #, unvaccinated"
1333,"i, ', m, so, sorry, ., i, just, don, ', t, know, what, i, ', d, do, if, member, my, family, was, that, deep, antivax, cult, ., sending, you, many, prayers"
1334,"exactly, ., biden, praising, him, vax, ,, so, they, will, be, same, page, ., trump, has, lot, work, do, reverse, anti, vax, movement, ."
1335,"where, will, all, anti, vax, facebook, moms, go, now"
1336,"i, just, lost, friend, yesterday, covid, ., she, was, anti, vax, anti, mask, ., if, she, ', d, been, vaccinated, could, she, still, have, gotten, covid, yes, but, she, might, not, have, died, it, ."
1337,"here, is, me, hoping, every, province, has, taken, into, account, appointments, being, made, by, antivax, /, covid, groups, .., that, they, were, prepared, have, accommodated, for, ., if, not, .., why"
1338,"yes, i, ’, m, anti, vax"
1339,"thanks, yes, i, think, overall, biden, ad, has, mounted, strong, covid, response, +, terrific, team, but, something, this, complicated, /, fast, moving, there, are, bound, be, gaps, ., i, ’, ve, only, really, criticized, 2, things, :, 1, not, vaccinating, globally, 2, weak, response, antivax, aggression"
1340,"antivax, domino, effect"
1341,"you, know, what, ’, s, crazy, how, is, it, this, country, -, or, at, least, nyc, -, like, 75, %, or, more, are, vaxxed, yet, under, any, covid, news, post, it, ’, s, 190, %, antivax, dribble"
1342,"once, jenny, mccarthy, got, hold, it, ,, she, made, it, mainstream, …, pre, -, covid, ., course, ,, her, thing, is, vaccines, cause, autism, ,, which, was, never, true, promoted, by, dr, sell, books, had, his, license, pulled, ,, today, ’, s, antivax, moms, think, vaccine, is, bad, b, /, c, “, conspiracy, ”"
1343,"anecdotal, ,, but, i, did, meet, one, antivax, dad, ., old, boss, texas, 2015, ., lost, all, respect, him, once, he, said, that, ."
1344,"what, do, y, ’, all, say, people, when, they, tell, you, they, got, covid, now, what, y, ’, all, say, people, that, are, anti, vax, then, catch, covid, cuz, i, told, joke, …"
1345,"thankfully, even, though, everyone, my, family, had, it, ,, no, one, losses, ., had, friend, lose, anti, vax, brother, ,, another, lose, anti, vax, fil, ., so, while, i, haven, ’, t, had, endure, ,, i, ’, ve, watched, these, people, lose, their, loved, ones, …, because, they, didn, ’, t, believe, vax, voted, trump"
1346,"doesn, ’, t, have, one, clip, her, twitter, feed, her, interview, with, her, master, donald, j, trump, face_with_tears_of_joyface_with_tears_of_joyface_with_tears_of_joyface_with_tears_of_joy, you, want, know, why, because, even, he, couldn, ’, t, stay, anti, vax, /, blame, biden, everything, train, face_with_tears_of_joyface_with_tears_of_joyface_with_tears_of_joyface_with_tears_of_joy, hilarious"
1347,"i, think, bill, would, have, gotten, vaccinated, bc, hank, yelled, at, him, ., dale, would, be, antivax, but, if, his, wife, told, him, "", don, ', t, worry, hon, this, is, special, non, -, vax, vax, ,, roll, up, your, sleeve, "", he, ', d, get, it, ."
1348,"tfg, went, national, tv, every, night, ., his, public, stance, was, anti, vax, &, amp, ;, anti, mask, ., we, all, watched, horror, as, he, willfully, spread, public, policy, that, accelerated, pandemic, ., he, needs, be, taken, before, hague, ."
1349,"all, fairness, ,, i, didn, ', t, think, he, was, antivax, just, anti, mandate, ., same, as, our, governor, out, here, ., i, could, be, wrong, face_without_mouth"
1350,"yes, ., whatever, works, ., it, could, save, lives, ., strange, though, that, he, wasn, ’, t, advised, do, this, before, ., it, wld, have, been, ‘, an, easy, win, .’, his, base, will, not, easily, change, course, though, ,, they, are, fully, invested, anti, vax, ."
1351,"opting, do, at, home, birth, because, your, antivax, antihospitals, isn, ’, t, power, move, you, think, it, is"
1352,"i, was, watching, video, like, “, if, they, ’, re, dumb, enough, still, be, antivax, at, this, point, pandemic, ,, are, they, smart, enough, understand, this, analogythinking_facethinking_facethinking_face"
1353,"csusb, is, requiring, booster, shot, i, ’, m, all, it, honestly, anti, vax, people, are, annoying, asf"
1354,"bad, take, ., there, are, not, 2, or, even, 3, sides, this, issue, ., we, ’, re, seeing, more, people, who, are, just, anti, vax, mandate, not, anti, vax, ., many, who, are, vaccinated, themselves, ,, but, they, just, don, ’, t, agree, with, taking, away, choice, ., trump, seems, be, leaning, towards, that, view, imo"
1355,"not, at, all, saying, i, ’, m, anti, vax, just, anti, “, experimental, ”, vax, ain, ’, t, no, safety, data, sheets, out, this, yet, but, yet, you, sheep, are, going, along, with, what, you, ’, re, being, told, do, my, family, ain, ’, t, no, lab, rats, you, ’, re, beloved, dr, fakey, has, been, proven, be, fraud"
1356,"if, 10, out, 12, people, are, vaccinated, ,, 7, people, have, covid, ,, 5, whom, are, vaccinated, ,, tell, me, percentage, non, -, vaccinated, people, with, covid, ., that, ’, s, relevant, stat, ., stop, it, with, this, anti, vax, crap, ."
1357,"i, am, vaccinated, not, anti, -, vax, ,, i, made, my, choice, ., i, wasn, ', t, forced, to, ., general, production, employees, will, quit, working, before, being, forced, vax, ."
1358,"supplements, what, extent, what, branch, bureaucracy, could, regulate, them, was, big, fight, 70s, ,, &, amp, ;, there, have, been, few, skirmishes, since, then, ., not, sure, this, is, great, parallel, antivax, ."
1359,"lol, you, are, so, inconsistent, ., you, just, went, off, piece, about, how, science, is, body, info, you, should, look, at, all, it, ..., now, youre, using, pretentious, sarcastic, antivax, tagline, ', trust, science, '"
1360,"not, willing, argue, with, anyone, couple, days, ., continuing, block, #, antivax, trolls, …, fa, la, la, la, la, la, la, musical_notesmusical_notesmusical_notes"
