,0
0,"anti, vax, /, anti, mask, crowd, are, policing, dems, &, amp, ;, their, masks, ., it, ', s, all, they, have, ., how, pathetic, &, amp, ;, desperate, ., they, want, you, conclude, she, ', ll, be, terrible, governor, ,, don, ', t, vote, her, ., abrams, ', "", real, "", problem, :, she, doesn, ', t, support, voter, suppression, &, amp, ;, not, white, guy, ."
1,"they, are, also, anti, vax, mandates, ., many, quit, or, were, suspended, as, result, ., thin, blue, line, sticks, together, no, matter, what, ,, -, looks, after, its, own, ."
2,"selfish, antivax, maskholes"
3,"even, though, my, husband, is, still, hesitant, not, anti, vax, ,, just, overly, paranoid, his, baby, girl, ;, we, ’, re, all, triple, vaxxed, ,, she, will, get, hers, as, soon, as, it, ’, s, approved, ."
4,"he, absolutely, does, because, we, ’, re, his, ignorance, breeds, ignorance, ,, as, with, his, antivax, stance, ., it, lowers, diskourse, have, debunk, this, moron"
5,"i, thrive, diversity, so, no, that, personally, wouldn, ’, t, make, me, happy, ., as, i, understand, it, he, ’, s, not, anti, vax, but, is, anti, mandate, ., that, said, he, is, racist, bigot, ., tried, giving, him, chance, but, couldn, ’, t, get, any, respect, him, going, ."
6,"he, failed, to, add, :, "", classist, monster, that, experiments, with, poor, people, with, antivax, treatments, """
7,"yeah, ,, blystone, is, pretty, much, present, version, hippies, ,, very, annoying, ,, really, just, nonsense, general, anti, establishment, identity, with, zero, coherent, beliefs, ., just, watch, any, antivax, rally, ,, hippie, dippie, nonsense, ., awful, then, awful, now, ."
8,"yes, ,, this, was, very, wrong, trump, those, who, enabled, his, lies, ., also, very, wrong, all, antivax, people, spread, their, lies, church, like, this, ., thanks, mentioning, it, ., thumbs_up"
9,"this, piece, shit, needs, be, permabanned, ., not, only, he, ’, s, peddling, his, scams, he, ’, s, anti, vax, guy, who, hates, future, prevention, fatal, disorder, that, killed, more, people, than, covid, ., he, should, just, be, homophobic, racist, at, this, point"
10,"i, keep, hoping, hear, one, ,, just, one, person, state, -, ‘, i, ’, m, anti, mandate, or, even, antivax, -, but, i, do, not, believe, or, support, #, flutruxclan, ’, those, that, want, rational, debate, or, dialog, -, this, is, hurting, their, message, just, as, much, ., #, hopenothatred"
11,"anti, -, governments, hate, central, banks, ron, paul, ', s, "", end, fed, ""., bitcoins, for, them, is, the, means, to, get, rid, of, state, monetary, policies, ., and, who, says, anti, -, government, ,, says, antivax, because, government, policy, ."
12,"best, interviewer, didn, ', t, he, just, make, excuse, all, his, antivax, stuff, by, saying, he, does, no, preparation"
13,"yes, yes, sink, into, your, bullshit, ..., now, I, ', m, antivax, ,, you, look, like, a, conspirator, in, your, own, way, rolling_on_the_floor_laughingrolling_on_the_floor_laughingrolling_on_the_floor_laughing, come, on, hello, thumbs_downthumbs_downthumbs_down"
14,"casual, racism, anti, vax, people, go, hand, hand"
15,"sooooo, ,, rogan, was, just, pretending, promote, antivax, propaganda, that, led, more, deaths, #, cancelspotify, #, istandwithjoerogan, ,, not, ."
16,"u, just, tweeted, 90, %, canadians, have, all, vaccines, immunizations, ., 98, %, babies, have, them, including, my, kids, ., sorry, ., canada, is, not, antivax, ., we, are, top, 10, world, ., which, is, it"
17,"look, at, all, conservatives, defending, joe, rogan, that, have, never, listened, his, podcasts, other, than, his, antivax, narrative, ..., shit, is, just, as, pathetic, as, people, who, are, trying, cancel, him, rolling_on_the_floor_laughingrolling_on_the_floor_laughing, fucking, cheer, leaders"
18,"no, we, aren, ', t, anti, vax, ., it, ', s, liberals, who, call, us, that, ., you, guys, explain, it, us, how, you, came, paint, us, as, radicals, please, when, we, take, all, others, vaxs"
19,"other, than, flu, shot, most, dont, have, million, variants, we, arent, ostracized, society, if, we, dont, get, flu, shot, ., also, most, ppl, who, arent, getting, covid, vax, are, not, anti, vax, as, whole, but, are, being, labeled, that, by, society"
20,"completely, agree, ., this, is, major, reason, why, you, typically, will, see, that, someone, who, swallows, *, one, *, conspiracy, theory, very, soon, endorses, most, them, ., there, ', s, no, particular, relationship, between, ,, say, ,, being, antivax, disliking, fiat, money, ..., but, i, ', ll, bet, there, ', s, lots, overlap, ."
21,"all, ideology, is, based, philosophy, ,, most, people, don, ', t, take, time, understand, their, own, philosophy, ., that, ', s, how, you, end, up, with, antivax, leftists, ,, libertarians, who, promote, captive, markets, ., everybody, skips, fundamentals, picks, positions, that, sound, good, them, ."
22,"good, …, rogan, could, that, lead, scientist, his, podcast, diskuss, mask, use, three, hours, ., we, would, all, benefit"
23,":, so, many, anti, vax, wierdos, #, tiktok"
24,"me, on, January, 3rd, but, I, don, ', t, think, it, works, ..., the, antivax, still, annoy, me, as, much, ."
25,"libertarians, aren, ’, t, actually, interested, ending, wars, ,, they, just, want, feel, like, they, ’, re, winning, ., nazis, don, ’, t, actually, want, universal, healthcare, ,, they, just, want, credibility, lent, their, antivax, movement, ."
26,"if, only, someone, ran, nfl, last, 10, years, could, have, done, something, about, it"
27,"great, so, now, we, maybe, going, war, with, canada, because, hatful, nazis, america, are, helping, fund, truckers, antivax, protest, ."
28,"here, some, lefties, doing, it, …"
29,"all, these, florida, vacation, commercials, are, forgetting, that, they, ’, re, trying, lure, people, covid, capital, world, ., filled, with, antivax, ,, antimask, ,, antiscience, crazies, ., #, hardpass, #, nope, #, notrelaxing, #, fixyourstate, #, desperate, #, sad, ."
30,"when, did, party, big, business, become, party, canceling, big, business, ., unruly, passengers, mostly, antimask, antivax, antireason, antiintelligence, trump, lovers, are, hazard, safety, ., you, ', re, lying, as, you, ', re, so, comfortable, doing, suggest, otherwise, ."
31,"when, there, are, babies, crowd, ,, you, hold, sign, saying, "", go, home, antivax, babies, toronto, hates, you, "",, it, would, suggest, that, this, person, hates, unvaccinated, babies, ."
32,"take, down, antivax, protest, campaign, so, you, can, separate, your, religious, identity, this, nationality, alt, right, disaster, ."
33,"lol, they, ', re, both, still, happy, keep, lying, antivax, stuff, up, though, because, causing, deaths, is, fine, apparently"
34,"measured, by, quality, character, he, doesn, ', t, crack, top, 150, ..., serbia, ., he, ', s, just, tennis, player, ., when, his, career, ', s, over, he, ', ll, be, unprincipled, antivax, weasel, rest, his, life, ."
35,"not, surprised, ., what, tipped, scales, you, ., his, 70, episodes, where, he, used, n, word, maybe, it, ', s, his, anti, vax, stance, ., so, much, choose, from, ., you, ', re, fraud, ."
36,"gofundme, has, blocked, donations, anti, vax, convoy, protest, canada"
37,"if, anyone, else, sees, antivax, stickers, being, put, up, dc, ,, keys, can, take, them, right, off, key"
38,"aaron, rodgers, ., if, you, ’, re, anti, vax, all, else, is, secondary, ."
39,"these, antivax, or, “, i, ’, m, not, against, vaccines, but, …”, morons, are, special, kind, awful"
40,"worst, cw, mccall, ’, s, “, convoy, ”, cosplay, ever, ., “, we, got, stupid, convoy, freezing, through, night, ., yeah, ,, we, got, antivax, convoy, ,, ain, ’, t, she, stupid, -, ass, sight, ”"
41,"he, ', s, democratic, operative, ., rogan, isn, ', t, anti, vax, either, ."
42,"look, ,, look, ,, we, have, an, antivax, here, is, it, cow_face, ,"
43,"it, ’, s, not, anti, vax, ,, it, ’, s, anti, government, forcing, vax, ."
44,"i, now, have, reality, stupidity, anti, vax, idiots, &, amp, ;, freedumb, protesters, hit, me, personally, ., friend, died, ., she, went, off, rails, even, pre, covid, ., angry, /, bitter, 1, family, member, said, ', she, fell, her, sword, '., she, died, covid, her, freedumb, &, amp, ;, put, others, at, risk, ., loudly_crying_face"
45,"i, was, following, kitten, site, instagram, suddenly, they, posted, antivax, t, -, shirt, ., wtf"
46,"enough, attention, small, group, antivax, truckers, disrupting, life, canadians, americans, ., let, ’, s, show, majority, working, truckers, they, matter, more, ., can, we, trend, this, tag, ,, #, resistanceunited, #, thankyouworkingtruckers"
47,"if, anyone, thinks, that, this, movement, is, “, antivax, ”, at, this, point, ,, they, ’, ve, immediately, just, informed, you, that, they, can, ’, t, read, …, #, freedomconvoy2022"
48,"over, /, under, how, many, anti, vax, reps, stand, line, thrusting, $$$, at, opportunity, have, one, these, fucking, things, implanted, their, jugheads, -, startup, run, by, elon, musk, may, have, misled, federal, securities, regulators, via"
49,"me, ,, notable, thing, about, rogan, flap, is, that, his, high, -, visibility, defenders, versus, neil, young, reliably, won, ’, t, say, that, mass, dissemination, antivax, mythology, is, problem, ., they, also, oppose, freedom, boycott, ., those, matters, ,, topic, interests, me, ., ymmv, ."
50,"did, you, notice, 1, little, like, he, got, face_with_tears_of_joy, maybe, if, he, uses, fake, account, like, his, own, post, ,, maybe, he, should, have, chosen, one, that, actually, aline, ’, s, with, his, comments, ., rolling_on_the_floor_laughing, he, is, anti, vaxr, used, pro, vax, profile, like, his, anti, vax, rhetoric, ."
51,"say, anti, -, mandate, /, anti, vax, passport, movement, is, solely, right, wing, &, amp, ;, funded, by, billionaires, is, very, disingenuous, you, know, that, ., never, thought, i, ’, d, see, you, make, such, claims, without, providing, evidence, ."
52,"you, think, almost, getting, one, but, not, due, scheduling, conflict, is, anti, -, vax, not, mention, ,, being, against, getting, covid, vax, isn, ’, t, anti, vax, ., it, is, anti, covid, vax, ., again, ,, thinking, he, is, all, about, himself, further, proves, you, have, never, listened, single, podcast, ."
53,"top, honking, nonstop, yelling, ., i, have, panic, attacks, triggered, by, loudly, antivax, people, so, i, am, suffering, ."
54,"i, dunno, casual, racism, anti, vax, nonsense, seems, with, some, nannering, ."
55,"ok, ,, will, stop, there, ., I, understand, that, you, are, looking, to, break, antivax, with, curves, ., but, I, don, ', t, want, to, get, into, this, game, ., if, I, have, to, quote, a, study, ,, it, will, be, mine, because, I, don, ', t, appropriate, the, work, of, others, ., so, it, won, ', t, happen, ."
56,"anti, vax, protests, some, cities, have, become, so, aggressive, that, medical, workers, toronto, were, advised, not, wear, clothes, that, would, identify, them, as, medical, staff, ."
57,"its, not, about, anti, vax, its, about, anti, mandates, ."
58,"this, antivax, group, was, once, just, pack, crazies, somewhere, ., i, think, it, ', s, really, upsetting, think, how, many, them, are, around, us, ..., endangering, us, middle, virus, evolving, ."
59,"steve, jobs, ,, although, nut, job, when, it, came, modern, medicine, he, would, definitely, be, anti, vax, during, covid, was, genius, when, it, came, simplicity, ., he, was, adamant, that, front, iphone, was, never, have, more, than, one, button, ."
60,"grinning_face_with_big_eyesgrinning_face_with_big_eyesgrinning_face_with_big_eyes, i, couldn, ', t, dig, into, numbers, deep, enough, find, out, ratio, ., arizona, doesn, ', t, publish, party, affiliation, rightly, so, covid, deaths, ., but, who, pushes, antivax, anti, -, mask, dogma, most, tucker, carlson"
61,"we, ’, re, all, now, seeing, what, healthcare, workers, reporters, have, known, all, along, ., it, may, be, shocking, some, ,, tempting, dismiss, as, outlier, ,, but, xenophobia, antisemitism, have, always, been, inherent, part, antimask, antivax, movement, ."
62,"in, reality, ,, there, are, 4, antivax, on, the, photo, treated, with, ivermectin, ."
63,"there, antivax, problem, wasnt, as, widespread, as, today, ., #, covidiots"
64,"what, i, ’, m, not, saying, we, r, protestors, are, anti, vax, anti, government, ant, mandates, anti, everything, ."
65,"weird, how, you, can, still, get, covid, after, you, ’, ve, had, your, shots, ., before, you, label, me, as, anti, vax, ,, i, have, 2, shots, :, forced, course"
66,"this, will, be, conveniently, ignored"
67,"those, people, would, be, antivax, if, there, was, no, joe, rogan, ., he, ', s, not, problem, ., problem, is, people, ', s, unwillingness, accept, that, entire, country, will, never, agree, with, them, 100, %, time, ."
68,"over, one, hundred, episodes, pulled, now, ., but, not, single, episode, antivax, horseshit, has, been, deleted, ., joe, rogan, still, has, job"
69,"block, anti, vax, bots, /, trolls, ,, engaging, with, them, just, spreads, #, misinformation, further"
70,"same, i, shared, thought, with, someone, who, is, anti, vax, anti, mask, advocate, they, just, wouldn, ’, t, even, consider, it, ."
71,"tweet, week"
72,"by, dint, of, dishonesty, and, generalizations, ,, you, show, contempt, for, the, silent, majority, who, dare, to, wake, up, a, little, ., so, don, ', t, be, surprised, that, more, and, more, people, not, just, toothless, ,, antivax, and, other, conspiracy, theorists, despise, your, profession, ."
73,"#, canada, :, 2, :, 29, recap, peaceful, anti, vax, mandate, protests, held, sat, across, cnd"
74,"went, saw, rob, schneiders, stand, up, local, funnybone, ., way, more, political, anti, vax, than, i, expected, ., i, think, he, is, upset, that, kid, rock, is, getting, all, attention"
75,"she, ’, s, known, far, left, socialist, &, amp, ;, she, ’, s, been, taking, hits, radical, left, not, being, critical, enough, ,, though, she, throws, antivax, hashtag, them, ., you, can, tell, she, ’, s, actually, enjoying, some, people, she, ’, s, meeting, &, amp, ;, possibly, her, views, right, are, changing, ."
76,"more, disgusting, still, is, thinks, joe, rogan, is, worth, alienating, support, majority, users, ,, gutting, their, corporate, image, ,, &, amp, ;, scooping, up, all, fake, first, amendment, warriors, just, suck, up, halfbright, white, male, racist, antivax, propaganda, vector, ."
77,"again, :, that, doesn, ’, t, mean, his, listeners, are, mindless, idiots, ., but, he, has, millions, people, with, pro, social, relationship, him, he, has, influence, —, totality, his, message, is, one, that, ,, yeah, ,, serves, reinforce, anti, vax, ideas, people, already, have, or, build, it, others, ."
78,"is, incapable, doing, her, job, because, she, ’, s, puppet, doesn, ’, t, do, his, because, he, ’, s, anti, vax, supporter, who, knows, that, come, june, he, ’, s, finished, politically, just, like, -, they, ’, re, cut, same, cloth, #, dougfordresign"
79,"Among, those, who, do, not, believe, in, the, disease, ,, the, anti, mask, ,, the, anti, vax, and, the, like, ,, a, person, is, not, made, among, all, …, how, much, ignorance, and, selfishness, of, humanity"
80,"dude, ,, you, made, two, videos, talking, shit, about, him, ,, accusing, him, spreading, anti, vax, misinformation, ..."
81,"like, we, didn, ', t, already, know, antivax, protesters, were, dangerous, ,, they, ', re, making, sure, prove, it, ."
82,"new, york, can, ’, t, stop, getting, what, it, deserves"
83,"ohhh, so, united, states, is, definitely, guilty, funding, these, canadian, anti, vax, protests, ., i, ', m, glad, gofundme, froze, it, i, hope, it, ', s, all, investigated, reveal, who, were, donors"
84,"i, ’, m, sorry, ,, you, ', re, not, "", just, having, conversation, "",, you, ’, re, platforming, racists, ,, bigots, ,, transphobes, along, with, your, recent, antivax, 180, 2, years, ago, ., wonder, how, you, ’, re, going, justify, this, one, ."
85,"anti, mandate, was, different, anti, vax, until, authoritarians, changed, definition, so, they, could, demonize, anyone, who, went, against, their, mandates, ., it, ’, s, authoritarian, now, how, it, should, be, free, country, ."
86,"no, -, "", you, can, ', t, go, home, again, "", grounds, ., plus, ,, he, lost, some, his, magic, with, #, cubs, fans, after, whole, #, antivax, thing, ."
87,"has, never, listened, his, podcasts, ., if, he, had, ,, this, would, have, never, happened"
88,"when, you, ’, re, supporting, joe, biden, ’, s, policy, spreading, antivax, bs, take, heat, off, joe, ,, you, ’, re, shitlib, ."
89,"vis, -, à, -, vis, initial, boycott, issue, ,, i, am, struck, by, how, rogan, ’, s, many, defenders, ,, nominally, across, political, spectrum, ,, consistently, don, ’, t, avow, that, propagating, antivax, myths, is, problematic, ."
90,"also, …, masks, don, ’, t, work, ,, masks, work, ,, certain, masks, work, …, now, retrospective, data, shows, all, masks, any, negligible, impact, ., but, still, .., mask, kids, even, though, they, tolerate, covid, like, common, cold, ., people, have, had, enough"
91,"let, me, say, that, it, ', s, nice, meet, you, have, this, diskussion, ., we, obviously, have, very, different, perspectives, ., i, would, ask, that, you, look, at, some, data, stats, ., be, very, clear, i, have, had, 2, doses, booster, ., i, ', m, not, anti, vax, ., i, ', m, anti, fascism, corporate, overreach, ."
92,"no, ,, you, ’, re, antivax, want, sound, smart, with, some, quotes, someone, suggested, group, dm, you, ’, re, floundering, because, i, don, ’, t, just, believe, falsehoods, ."
93,"my, best, friends, antivax, /, mask, inlaws, are, finally, getting, vax, too, inlaws, both, got, severely, ill, with, covid, thats, what, changed, their, mind, ."
94,"they, haven, ’, t, necessarily, been, debunked, ., i, don, ’, t, think, any, them, said, not, use, vaccine, ., they, simply, wanted, all, data, be, transparent"
95,"gop, are, helping, that, along, with, their, adherence, antivax, misinformation, ., desantis, only, won, his, race, by, 3, thousand, votes, theres, been, over, 65, thousand, covid, deaths, mostly, unvaxxed, people, ., #, covidiots, #, gopdeathcult"
96,"lmaoo, kyrie, is, anti, vax, but, he, is, pro, buckets, ., so, you, never, know"
97,"he, didn, ’, t, address, it, ., stern, lied, said, he, never, used, word"
98,"after, last, year, i, only, blame, trump, trying, ignore, it, beginning, misinformation, like, drink, bleach, ,, other, drugs, he, push, that, had, no, data, that, it, worked, ., deaths, i, blame, states, anti, vax, anti, mask, idiots"
99,"kinda, curious, :, do, people, like, you, actually, agree, with, rogan, ', s, antivax, bullshit, really, think, he, ', s, some, kind, free, speech, hero, or, is, this, cultlike, rogan, worship, among, "", indie, "", media, types, just, because, you, know, your, career, would, be, over, if, you, dared, alienate, his, fanbase, ."
100,"reread, sentence, "", just, as, qualified, as, clowns, spreading, antivax, lies, "", does, not, call, you, clown, or, anti, -, vaxxer, ., but, thinking, she, is, definitely, still, living, likely, wouldn, ', t, be, good, bet, ., even, if, she, is, ,, her, life, will, probably, never, be, same, ., "", jab, "", would, be, better"
101,"they, live, sunglasses, :, antivax, nazis, only, ,, everyone, else, fuck, off"
102,"that, ', s, nice, note, ,, but, i, am, curious, about, its, provenance, ., how, could, something, so, sentimental, end, up, used, bookstore, infinite, possibilities, ., also, i, would, be, concerned, about, any, future, built, by, white, supremacist, ,, antivax, ,, climate, evolution, denialist, like, peter, thiel"
103,"magnet, to, antivax, rolling_on_the_floor_laughing, you, got, a, serious, problem, boy, ., we, know, where, we, are, ,, need, nothing, ,, you, no, longer, have, a, choice, ,, that, ', s, why, you, try, to, reassure, yourself, by, trolling, ,, by, telling, us, what, your, tv, is, saying, ., sterile, it, is, especially, the, barça, which, played, well"
104,"tired, bullshit, ., yer, antivax, great, ..., leave, us, alone, ..., take, alternative, ., rest, like, life, ., #, fuckstupid"
105,"so, you, believe, he, had, racist, intent, then, used, that, word, public, permanent, forum, it, ’, s, ridiculous, pretend, that, ’, s, what, happened, ., ask, yourself, who, ’, s, behind, this, why, who, loses, when, rogan, takes, their, audience, or, power, or, money"
106,"it, is, funny, they, still, think, it, ', s, just, antivax, folks, protesting, ."
107,"considering, timing, this, i, ', d, guess, it, ', s, defense, r, *, gan, and, /, or, carr, ., so, which, authority, are, they, questioning, when, they, say, romani, people, being, killed, holocaust, was, positive, thing, or, anti, vax, propaganda, how, about, calling, black, neighborhood, planet, apes"
108,"this, is, defense, politically, incorrect, stuff, ., i, don, ', t, think, it, ', s, meant, as, defense, antivax, stuff, ."
109,"well, ,, you, keep, throwing, antivax, bs, around, like, some, kind, third, grader, ., what, do, you, expect"
110,"literally, ., all, antivax, media, groups, have, same, overlapping, audience, ."
111,"real, heros, ;, not, me, first, anti, science, ,, anti, vax, ,, hate, mongers, demonstrating, disrespect, ."
112,"because, other, places, are, as, bad, or, worse, doesn, ', t, mean, i, will, just, accept, stupidity, happening, here, ., why, people, still, connecting, being, against, mandates, with, being, antivax, person_facepalming, ‍, male_sign, ️"
113,"2, /, 2, liver, damage, &, amp, ;, death, ., thousands, have, died, because, pres, was, anti, vax, ., this, day, ppl, are, dying, covid, because, tfg, ', s, words, &, amp, ;, actions, ., yes, ,, we, should, have, choice, but, we, have, make, decisions, based, science, &, amp, ;, or, trained, spec, backed, up, by, side, information, ."
114,"i, quit, listening, when, he, went, down, masks, -, are, -, for, -, bitches, road, ., yes, ,, rogan, has, been, debunked, multiple, times, his, own, show, ,, so, why, does, he, double, down, antivax, conspiracies, is, it, clicks, views, has, he, changed, i, ’, m, just, unaware, it"
115,"people, who, will, never, say, that, rogan, platforming, antivax, myths, is, problematic, :, "", a, boycott, is, censorship, will, burn, 1st, amendment, ground, ."", also, those, people, :, "", you, ', re, only, helping, rogan, build, his, brand, ,, he, ', ll, be, more, powerful, than, ever, if, he, goes, independent, """
116,"i, like, your, other, humor, ,, but, not, your, antivax, stuff, ., unfollowed, ,, sad, say, ."
117,"whatever, you, do, ,, please, do, not, give, them, $, 100m, contracts, spout, antivax, death, cult, nonsense, with, their, n, -, words, ."
118,"this, may, be, true, but, what, is, being, done, make, sure, those, schools, are, safe, no, mask, mandates, or, quarantine, protocols, that, don, ’, t, make, sense, ., no, upgraded, air, filtration, very, old, buildings, ., area, anti, mask, &, amp, ;, anti, vax, parents, ., do, better"
119,"canadian, antivax, truckers, waving, american, confederate, flags, :, "", yay, ,, elon, musk, tweeted, support, our, cause, "", elon, musk, :, "", i, am, only, six, months, away, perfecting, self, -, driving, trucks, that, will, put, all, truckers, out, work, ,, but, these, hayseeds, think, i, actually, support, them, """
120,"do, you, have, receipts, or, are, you, just, repeating, things, you, heard, antivax, dm"
121,"doesn, ’, t, seem, like, that, video, he, posted, has, any, “, contextual, usage, ”., you, claiming, he, is, spreading, “, antivax, disinfo, ”, shows, you, ’, ve, never, ever, listened, his, podcast, ., clown_face"
122,"how, is, that, clear, she, didn, ', t, ask, deplatform, him, ., she, just, wanted, her, stuff, gone, so, as, not, support, someone, who, is, offending, her, ,, rightly, so, ., if, anything, this, is, more, clear, ., rogan, has, been, accused, anti, vax, stuff, months, ., racism, is, what, aligns, with, this, timing, ."
123,"this, is, last, week, linked, same, organization, -, #, whitesupremacist, #, antivax, flyer, circulating, canada, “, blaming, ”, jews, vaccines, as, part, international, conspiracy"
124,"#, antisemitism, that, has, been, circulating, #, antivax, movements, starting, long, before, convoy, is, becoming, more, more, blatant, this, is, downtown, toronto, yesterday, thread"
125,"i, have, 2, highly, educated, nurses, my, family, that, have, differing, opinions, about, this, neither, one, is, antivax, ,, i, ’, m, not, either, ., rogan, ,, isn, ’, t, neither, are, doctors, scientists, he, has, on, ., if, you, actually, listened, you, would, know, that, ."
126,"i, also, have, right, leanings, ,, by, way, ., as, gun, owner, ,, im, very, pro, 2a, ,, anti, vax, mandates, ,, believe, we, should, have, school, choice, ., i, believe, states, should, retain, control, their, elections, ., i, ', m, also, against, illegal, immigration, ."
127,"sorry, we, want, freedom, ,, not, freedumb, ,, please, keep, your, anti, science, ,, anti, vax, ,, taliban, freedom, ,, i, will, continue, vote, against, any, party, that, gives, into, or, condones, these, illegal, occupations, attempting, use, force, overturn, majority, rule, ."
128,"families, dead, loved, ones, that, bought, his, antivax, bs, are, offended, ."
129,"ashland, memes, page, throwing, me, off, with, that, anti, vax, support"
130,"most, anti, vax, stuff, is, grift, money, ., they, can, ’, t, get, legit, jobs, now, or, have, been, fired, so, they, have, continue, this, path, or, they, loose, little, income, left, they, generate, anti, vax, merch, views, ., it, ’, s, like, cult, now, ."
