,0
2474,"let, ’, s, not, excuse, aaron, blame, dad, ., i, don, ’, t, think, this, is, hardcore, anti, vax, ., i, think, his, past, behavior, he, ’, s, member, a, **, holeosaurus, species, ., darwin, theorized, that, people, who, are, born, normal, ,, become, famous, are, prone, this, particular, evolutionary, transformation"
2475,"only, reason, i, ’, ve, ridiculed, others, past, is, because, it, forces, everyone, wear, masks, follow, protocols, ., i, ’, ve, been, big, believer, eliminating, state, mandates, ., that, doesn, ’, t, make, me, pro, or, anti, vax, ."
2476,"baaaaahahahaha, except, all, fucking, wrong, ., he, sounds, like, my, anti, vax, aunt, facebook, ., i, asked, joe, rogan, hahahahahahahaha"
2477,"he, still, has, home, denver, ,, home, nurturing, developing, antivax, pro, sports, stars, ., folded_hands"
2478,"rodgers, confirmed, not, antivax"
2479,"im, not, anti, vax, im, critical, thinker, relieved_face"
2480,"rogers, told, team, they, didn, ’, t, stop, him, ., that, ’, s, story, &, amp, ;, it, ’, s, going, keep, growing, ., all, he, has, do, is, shut, fuck, up, &, amp, ;, say, ask, team, ., he, could, have, shut, up, then, but, now, he, going, all, antivax, which, has, stopped, convo, bigger, issue, ., team, knew, &, amp, ;, did, nothing"
2481,"whitney, he, didn, ', t, say, no, ., be, implied, he, was, vaccinated, never, disklosed, it, ., only, after, he, got, covid, did, he, actually, admit, he, ', s, fucking, antivax, goon, ., he, did, everything, you, can, possibly, do, wrong, here, ."
2482,"course, they, ', re, allowing, themselves, with, anti, vax, crowd, ..., of, course, they, are, *, sigh, *"
2483,"“, i, ’, m, not, anti, -, vaxxer, ,, but, here, are, all, antivax, talking, points, i, believe, them, ”"
2484,"yes, buddy, same, thing, take, any, medicine, and, take, x, take, a, medicine, that, is, for, what, was, proposed, anti, science, is, not, just, being, anti, vax, ., you, have, to, be, very, careful, with, that, speech"
2485,"i, want, unvaccinated, esp, anti, vax, leave, us, alone, ., wear, mask, if, you, ’, re, not, ,, stay, your, simple, ass, home"
2486,"he, literally, is, ., please, don, ', t, bring, your, antivax, shit, into, my, tl, ."
2487,"yep, ,, eua, version, is, interchangeable, ., say, otherwise, is, dangerous, misinformation, antivax, propaganda, ."
2488,"he, ’, s, also, antivax"
2489,"aaron, rodgers, with, combo, crypto, bro, antivax, revelations, past, few, days, my, opinion, man, drops, by, hour, lol"
2490,"course, your, team, mates, thanked, you, ., you, are, their, leader, ., now, u, are, leader, anti, vax, community"
2491,"i, lived, berkeley, when, a, ., r, ., was, there, ., back, then, antivax, was, very, popular, with, patchouli, -, parenting, crowd, ., our, pediatrician, was, always, *, so, relieved, *, when, we, were, like, "", all, shots, ,, we, want, them, ."", rodgers, ', fiancee, is, into, woo, too, ,, bigtime, ., all, part, picture, ."
2492,"sadly, ,, he, sounds, like, every, antivax, twitter, user, ., diskusses, unknown, longterm, effects, vaccine, ,, but, doesn, ’, t, consider, whether, longterm, effects, covid, could, be, worse, ."
2493,"except, he, is, anti, vax, whacko, baes, every, comment"
2494,"you, ’, re, right, ., hospitals, our, area, they, were, mandated, ., so, about, month, ago, they, hit, 100, %., i, know, 2, healthcare, workers, who, were, antivax, ., one, got, shot, ., other, isn, ’, t, working, ."
2495,"she, even, made, an, anti, vax, speech, bro, how, can, you"
2496,"and, when, she, did, an, anti, vax"
2497,"i, didn, ’, t, read, anyone, ’, s, thoughts, because, there, are, so, many, anti, vax, losers, that, group, i, dgaf, what, they, say, anymore, ."
2498,"physicians, who, say, they, “, aren, ’, t, antivax, ”, but, supply, antivax, accounts, with, links, bad, articles"
2499,"sounds, like, it, ', s, anti, vax, fire, fighters, that, are, endangering, public, ."
2500,"i, loved, favre, as, packers, ', qb, ., then, came, his, reactionary, politics, ,, sexual, harassment, ,, scamming, ppp, loans, ., i, love, rodgers, as, packers, ', qb, ., now, i, get, lying, anti, vax, nonsense, ., anything, i, need, know, about, jordan, love"
2501,"how, bout, civil, liberties, of, ,, oh, i, dunno, ,, cancer, patients, trapped, their, fucking, homes, two, years, because, 20, percent, humanity, are, god, damned, anti, vax, ,, cro, mag, yahoos, how, bout, they, get, house, arrest, instead, us, #, yyc, #, fuckcancer, #, covid19"
2502,"i, know, plenty, people, who, have, removed, such, things, their, lives, because, this, realization, ., personally, ,, i, ’, m, not, anti, vax, ,, i, ’, m, anti, mandate, ., as, baptists, we, are, champions, liberty, ,, that, includes, medical, choices, ."
2503,"okay, antivax, r, &, amp, ;, b, queen, really, snapped, this, project"
2504,"are, they, anti, vax, or, are, they, anti, mandates"
2505,"i, ', m, really, hoping, anti, vax, rumors, aren, ', t, true, ..."
2506,"but, then, there, ’, s, this, -, provinces, who, have, vax, mandates, have, surplus, antivax, health, care, workers, -, motivated, find, place, go, make, living, -, willing, drive, couch, surf, get, work, feel, empowered, vindicated, ., 3, /"
2507,"fuck, haters, you, my, antivax, boi"
2508,"why, do, people, listen, ., just, refuse, ., anti, mask, anti, vax, refuse"
2509,"ppl, really, be, doing, all, drugs, but, yet, be, anti, vax, face_with_tears_of_joyface_with_tears_of_joyface_with_tears_of_joy"
2510,"i, guarantee, you, those, same, assholes, you, ’, re, talking, about, here, were, making, fun, anti, vax, people, about, two, years, ago, ., i, know, that, ’, s, how, it, is, all, my, friends, who, are, now, anti, vax, all, sudden, ."
2511,"troll, antivax, nonsense, .."
2512,"ontario, is, caving, anti, vax, ,, anti, -, science, groups, ."
2513,"very, sad, to, diskover, that, my, work, has, a, lot, of, antivax, ,, these, people, from, developed, countries, are, idiots, dms, ,, the, guys, have, free, and, quality, health, for, everyone, ,, the, country, bought, enough, vaccine, to, vaccinate, everyone, 3x, and, the, people, keep, denying, it, ,, what, I, hate, saw"
2514,"ah, again, hold, the, fruit, of, the, imagination, of, the, brainless, antivax, ."
2515,"still, has, no, plan, roll, out, vaccine, kids, ., stop, taking, advice, your, #, antivax, daughter, be, leader, change, ., #, fordfailedthepeople, #, fordfailedthechildren"
2516,"dear, #, projectveritas, special, lady, named, anissa, barker, posted, one, your, #, antivax, vids, facebook, before, dying, #, covid, last, week, ., she, was, incredible, person, ,, devoted, mom, ., so, warm, ., always, lit, up, room, ., beloved, by, her, people, ., just, thought, you, should, know, ."
2517,"if, your, decision, not, be, vaccinated, is, based, political, calculus, anti, mandate, ,, anti, big, pharma, then, you, get, tossed, with, anti, vax, crazies, ."
2518,"he, does, what, ’, s, best, him, ,, his, family, cronies, who, are, large, part, anti, vax, movement, ., he, doesn, ’, t, care, about, what, ’, s, best, anyone, else"
2519,"how, antivax, nutcases, respond, real, data, :"
2520,"thank, you, z, ., leave, it, you, inject, some, sweetness, as, we, march, forward, midterms, facing, uphill, battle, against, our, anti, vax, ,, book, burning, opponents, ., will, follow, new, folks, ."
2521,"i, doubt, it, if, so, i, ', ll, quickly, become, anti, vax, when, it, comes, boosters, me, if, so"
2522,"is, aaron, rodgers, one, anti, vax, crazies"
2523,"this, stat, needs, be, repeated, ,, re, tweeted, not, days, but, months, ,, showing, not, anti, vax, asshats, ,, but, sane, ,, even, if, mandated, folks, complying, with, normal, thinking, ."
2524,"nahh, dude, ., you, ’, re, anti, vax, ,, stolen, election, ,, climate, denial, pipeline, ., it, ’, s, just, propaganda, ."
2525,"i, ', d, be, very, surprised, if, you, are, actual, pharmacist, ., you, ', ll, notice, others, mentioning, society, ., they, display, empathy, ., no, ,, this, isn, ', t, individual, situation, every, single, antivax, person, is, indeed, selfish, ,, focused, themselves, ,, individual, ."
2526,"i, also, think, this, is, weird, ., like, one, or, more, years, ago, you, ’, re, totally, love, now, you, don, ’, t, talk, anymore, ., or, when, i, am, friends, with, someone, then, find, out, last, year, that, he, is, antivax, covidiot, who, has, completely, inhaled, kool, -, aid, ,, so, now, we, barely, talk, ."
2527,"had, worst, day, arguing, with, anti, vax, co, -, parent, .., then, got, this, amazing, necklace, my, brother, sister, law, ..., guess, we, ', ll, call, it, even, ..."
2528,"antivax, headlines, be, like, “, local, nurse, whose, job, it, is, help, sick, people, fired, refusing, do, something, help, sick, people, ”"
2529,"anti, vax, ppl, go, hard, paint, ..."
2530,"what, ', s, law, now, concerning, antivax, fucks, running, into, crappy, tire, when, cops, don, ', t, do, thing, are, shoppers, allowed, defend, themselves, with, force"
2531,"nope, ., he, ', s, leaving, it, up, hospitals, cause, then, he, can, ', t, be, blamed, by, his, antivax, base, ."
2532,"literally, losing, my, fucking, mind, at, these, stupid, anti, vax, cunts, who, think, making, stand, is, more, important, than, their, child, ’, s, well, being, ."
2533,"antivax, jerk, who, was, only, muted, but, is, now, blocked, ."
2534,"anti, vax, nutters, outside, my, regular, walgreens, ., never, been, so, tempted, go, get, fight, my, entire, life, ."
2535,"lot, anti, vax, whites, up, there, too, ,, my, own, family, ,, quite, sizeable, off, grid, super, green, /, left, community, …, but, distance, restricted, times, is, big, one, ., well, said, ., also, it, ’, s, been, too, easy, not, realize, impact, when, covid, has, till, now, been, contained, city"
2536,"white, supremacy, ,, anti, vax, ,, natural, wellness, are, close, bedfellows, ."
2537,"what, does, defending, kap, have, do, with, anti, vax"
2538,"exactly, also, ,, how, much, influence, you, did, your, anti, vax, ,, conspiracy, theorist, daughter, have, when, it, came, your, covid, decisions"
2539,"kinda, figured, aaron, rodgers, was, anti, vax, after, finding, out, he, ’, s, big, b, *, rstool, guy, ., shailene, ,, wyd"
2540,"aaron, rodgers, being, anti, vax, is, shocker, me, lol"
2541,"i, only, bring, that, up, because, it, ’, s, favorite, war, cry, anti, vax, ,, “, the, free, market, gets, decide, not, bake, lesbians, wedding, cake, because, jesus, ”., they, hate, it, when, it, works, way, they, don, ’, t, like, ,, i, like, bring, it, up, ., government, isn, ’, t, forcing, us, do, shit, ."
2542,"data, was, here, :, again, i, ’, m, not, antivax, ., i, believe, it, ’, s, not, as, safe, as, it, ’, s, being, portrayed, alternative, options, don, ’, t, make, pharmaceutical, companies, enough, be, reasonable, response, this, problem, ., sweden, is, perfect, example, ."
2543,"was, green, bay, packers, quarterback, aaron, rodgers, lying, about, covid, 19, vaccination, status, ., antivax, #, gopackgo"
2544,"all, sudden, anti, vax, packers, fans, are, singing, different, tune, about, their, qb, not, being, vaccinated"
2545,"he, got, covid, so, said, immunized, ., anti, vax, speak, ., he, ’, s, clearly, not, as, smart, as, media, tells, us"
2546,"if, you, haven, ’, t, learned, critical, thinking, ,, challenging, establishment, ideas, may, lead, you, embrace, even, more, destructive, ones, fringe, sources, ., critical, lens, needs, be, applied, edges, as, well, as, center, ., failing, do, so, gives, you, qanon, antivax, brigades, ."
2547,"such, sense, relief, ,, right, i, worry, all, my, nieces, nephews, ;, unfortunately, they, all, have, antivax, parents, ., pensive_face"
2548,"he, ’, s, also, anti, vax, so, that, ’, s, hard, no, me"
2549,"there, are, no, rights, here, ,, we, are, talking, about, a, fucking, pandemic, ., It, ', s, time, for, the, anti, vax, to, squeeze, his, neck, ..."
2550,"i, pointed, out, state, leadership, elected, va, last, night, is, anti, gay, ,, anti, choice, ,, anti, mask, ,, &, amp, ;, anti, vax, ., this, person, had, this, response, ., either, they, know, absolutely, nothing, about, gop, ,, or, they, think, they, can, gaslight, queer, woman, that, ', s, worked, politics, since, 2007, person_shrugginglight_skin_tone, ‍, female_sign, ️"
2551,"really, since, school, started, back, up, it, has, been, non, stop, crazy, anti, mask, ,, anti, vax, ,, crt, ,, ban, some, books, ,, planes, flying, pulling, youngkin, signs, ., i, thought, this, year, might, be, year, we, buck, trend, ., person_shrugginglight_skin_tone, ‍, female_sign, ️"
2552,"voters, have, egos, too, ,, mister, ag, ., celebrity, culture, :, i, can, do, anything, i, want, do, regardless, who, doesn, ’, t, like, ., now, isn, ’, t, this, real, tug, war, problem, trump, &, amp, ;, presidency, ,, january, 6th, insurrection, ,, charlottesville, ,, antivax, ,, antimask, ,, moscow, mitch, scotus, gerrymandering, etc"
2553,"don, ’, t, need, see, certified, moron, rob, manfred, hand, m, jackasses, who, dropped, lgbtq, portion, anti, -, bullying, message, ,, who, invited, antivax, maga, chode, travis, tritt, sing, national, anthem, before, playoff, game, ,, who, invited, freaking, trump, ws, game, ,, trophy, sorry"
2554,"idc, if, i, ’, m, infantilizing, her, ,, i, choose, believe, dansby, sw, *, nson, ,, antivaxxer, “, it, ’, s, illegal, not, own, gun, ”, georgia, town, corrupted, mal, pugh, that, ’, s, why, she, follows, all, those, disgusting, antivax, accounts, so, who, cares, how, cute, he, is"
2555,"i, believe, that, anti, science, anti, vax, anti, mask, thing, radicalized, lot, white, women, facebook, this, year, ."
2556,"sorry, if, i, ', m, losing, my, shit, tonight, but, my, blue, state, just, voted, entire, leadership, team, -, gov, ,, lt, gov, ,, ag, -, that, is, anti, gay, ,, anti, choice, ,, anti, mask, ,, anti, vax, ."
2557,"when, i, saw, this, earlier, i, thought, they, were, waiting, rfk, jr, spout, some, anti, vax, shit, ., but, nah, these, people, showed, up, fake, resurrection, dead, man, ."
2558,"new, york, times, has, gone, antivax"
2559,"anti, vax, moments, firefirefire"
2560,"first, time, i, ever, heard, catholics, usingl, their, religion, be, vax, exempt, ., i, ’, ve, been, catholic, my, entire, 59, years, never, heard, priests, or, nuns, being, anti, vax"
2561,"was, going, ask, oomf, hang, if, theyre, ever, albany, bc, we, live, so, close, ., then, find, out, theyre, anti, vax, thumbs_uplight_skin_tone"
2562,"if, you, tweet, me, spewing, some, anti, vax, ,, anti, mask, bs, ,, you, will, be, immediately, blocked, ."
2563,"if, you, can, convince, them, be, antivax, animal, middle, pandemic, ,, you, can, convince, them, anything, if, he, hadn, ', t, gone, after, gullible, sucker, vote, ,, trump, wouldn, ', t, be, able, pretend, still, be, president, ."
2564,""", there, were, also, signs, split, based, media, consumption, ,, with, 40, %, republicans, who, trust, far, -, right, news, sources, agreeing, that, violence, could, be, necessary, ,, compared, 32, %, those, who, trust, fox, news, 22, %, among, those, who, trust, mainstream, outlets, ."", pro, violence, ~, anti, vax"
2565,""", 10, ,, 000, "", anti, vax, nypd, officers, that, were, going, unpaid, leave, protest, turned, out, be, 34"
2566,"i, wonder, if, it, ’, s, because, he, ’, s, anti, vax, can, ’, t, work, actual, set, because, there, ’, s, now, way, his, voice, acting, is, that, good, be, all, these, iconic, characters, ."
2567,"appreciate, it, ,, me, too, ., anti, vax, cousin, not, having, as, much, luck, though, smh"
2568,"yes, ., youngkin, is, "", trumpism, w, /, o, trump, "", that, i, hoped, would, emerge, his, defeat, :, focused, issues, like, crt, that, romney, -, ryans, would, never, talk, about, or, be, wrong, side, but, w, /, o, going, off, crazy, "", stolen, election, "", or, antivax, tangents, like, nuttier, trumpsters, ."
2569,"face_with_tears_of_joyface_with_tears_of_joyface_with_tears_of_joyface_with_tears_of_joy, yah, okay, marcus, …, whole, rant, &, amp, ;, tone, is, clueless, ., antivax, mission, is, losers, game, ., over, 80, %, canadians, are, well, past, this, childish, rant, ., meltdown, is, videorolling_on_the_floor_laughingrolling_on_the_floor_laughingrolling_on_the_floor_laughing"
2570,"i, would, if, i, didn, ’, t, live, nra, ,, rifle, carrying, ,, anti, vax, ,, q, anon, ,, trumpster, neighborhood, i, could, get, killed, just, stepping, foot, out, my, door"
2571,"almost, 2000, mindless, assholes, to, rt, or, like, this, totally, misleading, tweet, ., you, really, are, huge, dangerous, shit, the, antivax, ."
2572,"saw, my, mom, first, time, 14, mos, since, covid, numbers, are, dropping, ., even, after, losing, her, sister, last, month, she, is, still, anti, vax, is, angry, that, my, son, will, be, vaxxed, as, soon, as, they, ’, ll, allow, appts, be, made, his, age, ., there, really, is, no, reasoning, with, “, them, ”"
2573,"but, desantis, ’, position, isn, ’, t, “, anti, vax, ”,, it, ’, s, anti, mandate, ., big, difference, ."
2574,"karenavirus, is, doing, dumptrump, election, fail, person_facepalmingmedium_skin_tone, ‍, female_sign, ️, person_facepalmingmedium_skin_tone, ‍, female_sign, ️, person_facepalmingmedium_skin_tone, ‍, female_sign, ️, just, wait, til, she, finds, out, that, her, karen, tantrum, won, ', t, get, her, far, but, maybe, former, racist, cop, should, learn, that, karen, ', s, are, losers, ., glad, we, didn, ', t, get, antivax, karenavirus, as, leader, ., i, want, my, kids, live"
2575,"seeing, people, like, retweet, anti, vax, rhetoric, lmaooo"
2576,"this, will, give, antivaxrs, enormous, gloating, rights, ., fortunately, majority, are, vaccinated, ., i, feel, sorry, kids, antivax, mentality, ., also, ,, curious, as, vax, card, that, allows, kids, into, our, pss, ., i, grew, up, fl, pss, &, amp, ;, i, was, vaxxed, everything, required, ."
2577,"my, timeline, has, been, filled, with, antivax, info, science, topic, lot, racist, comments, science, sports, topic, ."
2578,"prior, hildhoid, diseases, antivax, movement, going, way, back, is, deluded, shitlibs, such, ,, there, was, antiscience, lefties, ', 60s, flower, power, days, spark, that, ., 50, years, woo, luddites, ."
2579,"sounds, like, antivax, pastor, &, amp, ;, wife, that, spent, last, week, here, at, my, mil, ’, s, house, ."
2580,"honestly, ,, they, are, very, likable, ., it, so, great, have, al, back, can, you, imagine, having, navigate, season, with, freaking, flat, earth, anti, vax, kyrie, but, how, does, this, happen, again, again, granted, ,, it, ’, s, early, season, but, just, ..., ugh, ."
2581,"premier, ontario, ', s, daughter, is, strident, antivax, antimask, activist, ., mr, ., premier, you, can, ', t, please, everybody, ., how, long, before, you, end, up, quarantine, again"
2582,"so, ,, commissioner, edelblut, wants, recruit, antivax, anti, mask, teachers, other, states, address, teacher, shortages, we, need, more, covid, i, want, recruit, high, intelligence, people, address, stupidity, problem, state, government, under, #, nhpolitics"
2583,"i, have, question, that, i, need, help, with, ., many, ppl, including, anti, -, vax, have, pets, that, they, treat, like, family, antivax, don, ', t, want, get, jab, 4, either, them, or, their, family, ., do, their, pets, go, 2, vet, 2, get, their, yrly, shots, or, r, they, antivax, 4, their, family, pets, 2"
2584,"today, #, vaccinemandate, went, into, effect, city, workers, #, nyc, says, they, ’, re, not, #, antivax, -, but, rather, #, antimandate"
2585,"great, scientific, study, your, 14, friends, ., i, call, bull, ., your, numbers, are, off, ., thousands, people, studied, more, anti, vax, sick, hospital, ., that, ’, s, facts, ., google, it, ., so, i, call, bull, ."
2586,"antivax, parents, ,, no, mask, ,, their, 10, yr, old, daughter, ended, up, hospital, ., daughter, died, ., baby, brought, with, covid, ,, antivax, anti, mask, parents, ., i, don, ’, t, know, if, they, could, save, infant, ,, but, he, never, should, have, gone, back, those, parents"
2587,"no, one, is, mad, but, anti, vax, folks, crying, about, being, unemployed, ."
2588,"b, /, c, husband, who, is, homehealth, &, amp, ;, live, mil, hospice, we, have, almost, daily, contact, with, various, nurses, ., almost, 100, %, pro, trump, ,, anti, vax, ., makes, my, head, spin, ."
2589,"apparently, dougie, ’, s, wife, is, also, anti, vax, ., brings, lot, light, slow, drawn, out, inept, thought, process, our, elected, provincial, leader, unfortunately"
2590,"you, know, what, is, so, bizarre, ., before, covid, we, had, these, crazies, left, that, were, anti, vax, ., we, had, outbreaks, diseases, that, we, thought, we, dead, b, /, c, it, ., covid, happened, all, anti, vaxrs, are, no, longer, anti, vaxrs, but, now, people, that, had, no, issues, with, vaccinations"
2591,"i, hope, unpaid, leave, antivax, cops, ,, firefighters, sanitation, workers, hurts, ., if, you, ’, re, not, safe, you, have, no, business, payroll"
2592,"i, woke, up, with, chills, fever, this, morning, after, my, #, antimask, &, amp, ;, #, antivax, in, -, laws, came, stay, with, us, #, halloween, weekend, visit, us, my, wife, ’, s, mom, ., i, have, compromised, immune, system, &, amp, ;, as, much, as, i, ’, m, worried, about, my, health, ,, i, ’, m, more, worried, they, just, killed, mom, ."
2593,"i, saw, tiktok, about, m, ., i, ., a, being, antivax, it, ruined, my, day"
2594,"i, know, two, people, who, ', re, antivax, ., at, most, ,, it, ', s, mildly, fascinating, ., wish, there, was, condensed, compilation, their, thoughts, heated, interactions, topic, over, past, year, &, amp, ;, ¾, that, i, could, play, background, ."
2595,"i, am, so, sorry, ., anti, vax, nurse, is, oxymoron, ."
2596,"aw, thanks, -, i, ’, m, fine, enough, but, it, makes, me, so, angry, think, that, child, would, have, needlessly, go, through, what, i, did, because, anti, vax, idiots, ."
2597,"i, ’, ve, got, coworker, who, has, recently, developed, blood, pressure, issues, my, anti, vax, coworker, freaking, him, out, harassing, him, telling, him, it, ’, s, because, he, got, vaccinated, ., shits, getting, wild, at, office"
2598,"there, are, 3, categories, ., anti, vax, ,, vax, hesitency, ,, political, ., bulk, are, likely, latter, 2"
2599,"just, as, we, firefighters, went, 9, /, 11, hero, ', s, pension, zero, ', s, ,, we, 1st, responders, have, gone, covid, hero, ', s, with, parades, antivax, zero, ', s, with, parades, out, employment, door, typical, political, bouncing, balks, ., take, pic, my, campaign, ,, but, don, ', t, stand, up"
2600,"rs, have, become, pro, deadly, disease, ,, anti, vax, party, ."
2601,"i, was, trying, add, little, sarcasm, anti, vax, claim, that, comirmaty, is, unavailable, face_with_rolling_eyes"
2602,"this, is, ashley, luttmer, ,, ., luttmer, tiktok, ., instagram, ., www, ., ashleykholephoto, she, made, tiktok, many, ., she, made, one, hanging, "", no, quarter, "", black, flag, at, her, house, ., she, wants, kill, all, us, ., antivax, ,, antimask, ,, anti, -, kid, ."
2603,"maybe, you, should, have, added, some, antivax, language, get, it, through, their, spam, protection"
2604,"so, antivax, a, --, holes, get, foist, their, germs, vaxxed, kids, causing, some, them, get, sick, ., how, many, excess, deaths, will, there, be"
2605,"i, know, lots, cops, are, anti, vax, but, i, hope, those, sexy, cops, got, hpv, shot, ."
2606,"i, ’, m, not, anti, vax, but, it, ’, s, more, than, thatface_with_tears_of_joy"
2607,"see, ,, he, ’, s, ding, same, thing, desantis, himself, does, ., “, anti, -, vax, ”, is, key, phrase, ., because, desantis, does, not, oppose, people, getting, vaccinated, ,, he, ’, s, not, “, anti, vax, .”"
2608,"not, true, ., there, are, plenty, us, seasoned, nurses, still, at, bedside, that, believe, science, ., these, antivax, nurses, are, loud, but, still, minority, ."
2609,"he, ’, s, antivax, trumper, ."
2610,"correct, ., it, ', s, not, ., it, ', s, constitutional, under, several, precedents, ., there, are, multiple, vaccination, requirements, ., schools, have, obligation, protect, kids, custodial, setting, ., anti, vax, parents, who, hate, their, children, country, can, home, school, ."
2611,"i, normally, don, ’, t, care, cop, costumes, ;, until, today, when, i, was, debating, making, whinny, baby, antivax, protesting, cop, costume, halloween, ., “, needles, ouchie, ,, me, no, likely, being, told, what, do, .”, pig_nose"
2612,"dealing, with, trump, seditionists, ,, with, anti, vax, crazies, threatening, school, board, members, ., sdny, fulton, county, are, hot, trumps, trail, ."
2613,"which, religions, demand, antivax"
2614,"when, your, not, able, comment, fb, have, some, antivax, all, over, your, page, ...., claiming, be, unvaccinated, rn, at, cranbrook, hospital, ., .., spewing, misinformation, ...., let, ', s, find, her, make, her, famous"
2615,"i, have, been, frequent, viewer, /, listener, long, time, ., even, tolerating, when, he, early, became, anti, vax, &, amp, ;, very, often, anti, -, science, ., never, again, after, hosting, pro, -, insurrection, message, &, amp, ;, anti, -, science, view, that, collateral, harm, is, not, his, problem, ."
2616,"happy, halloween, i, decided, go, spooky, route, dress, up, as, jobless, ,, antivax, ,, wannabe, williamson, county, school, board, member, ., skull"
2617,"when, i, saw, first, antivax, protests, here, i, kind, sniffed, them, thought, “, ah, ,, fascism, with, touch, woo, ,, such, exciting, bouquet, ”"
2618,"those, who, don, ’, t, pay, attention, aotearoa, :, current, crazy, anti, vax, people, have, italian, troops, there, ,, as, vanguard, t, total, un, invasion, ., tell, me, again, how, these, people, are, different, zog, fash, 80s"
2619,"#, onpoli, #, covid19, anti, vax, movement, is, control, #, fordnation"
