,0
6088,"honest, answer, :, no, ., pfizer, modern, don, i, i, even, need, cells, at, all, ., viral, based, ones, use, cell, line, isolated, decades, ago, fetal, tissue, production, ."
6089,"go, pfizer, read, jab, spreading, or, transmission, spike, protein, i, it, i, i, all, there, you, reading, pleasure"
6090,"that, i, i, not, true, ., chris, paul, got, couid, took, pfizer, vaccine, ., your, risk, death, is, way, lower, after, being, vaccinated, ., you, can, still, spread, it, ."
6091,"can, confirm, pfizer, gang, &, it, ;, modern, boys"
6092,"is, and, dose, pfizer, again, today, as, was, mentioned, yesterday"
6093,"hoy, :, pfizer, era, todo, toronto, da, dosis, sprint, two, ., zero, i, delta, hotspots, "", indigo, hostages, en, don, bosco, y, exhale, backhand_index_pointing_downmedium_skin_tonebackhand_index_pointing_downmedium_skin_tonebackhand_index_pointing_downmedium_skin_tone, hasta, las, up, prioridaTongue_sticking_out_cheeky_playful_or_blowing_a_raspberry, mow, ,, mav, ,, mar, map, #, getyourvacuna, #, latinos, #, latin, let, ', i, do, this, gente, &, it, ;, three, syringesyringe"
6094,"I, must, be, a, tuff, everyone, around, me, sul, ass, get, their, second, dose, with, pfizer, and, me, nothing, syringesyringeflexed_bicepslight_skin_tonerolling_on_the_floor_laughing, #, covidvaccines"
6095,"i, i, ve, waited, five hundred and twenty-four, days, this, ., thank, you, pfizer, ."
6096,"my, son, is, essential, factory, worker, waterloo, region, ., was, finally, able, get, est, pfizer, yesterday, ., he, i, i, booked, and, dose, october, no, wonder, kitchener, -, waterloo, is, ontario, i, i, couid, hotspot, right, now, ., ads, billboards, right, ., #, covidvaccination"
6097,""", Bring, the, Pfizer, i, Ignacio, company, ', i, viral, song, against, "", the, gorillas, """
6098,"well, yes, ,, logical, in, fact, ,, if, it, is, not, fda, approved, ., but, can, wonder, why, it, ', i, not, fda, approved, and, now, canada, advises, me, another, vaccine, for, my, and, dose, ., Saturday, I, will, have, modern, or, pfizer, ., whatever, ., let, me, see, boss, nerd_face"
6099,"pfizer, &, amp, ;, modern"
6100,"i, it, looks, boring, ,, then, there, i, i, simple, slide, that, says, i, why, is, this, so, important, because, world, needs, us, ,, people, are, dying, couid, -, nineteen, .’”, great, look, at, pfizer, i, i, efforts, produce, vaccine, ."
6101,"oh, i, i, i, fully, vaccinated, pfizer, second, shot, was, hellish, recover, -, anyone, else"
6102,"it, means, that, the, pfizer, vaccine, is, the, highest, is, efficacy, check_mark_button"
6103,"i, i, i, overwhelmed, by, all, love, i, got, yesterday, my, birthday, ., i, i, i, getting, my, and, pfizer, shot, this, morning, leaving, ten, 000km, six thousand, miles, motorcycle, trip, across, canada, right, after, ., stay, touch, ."
6104,"i, don, ', i, think, one, shot, pfizer, provides, less, protection, than, i, &, amp, ;, i, ., at, least, not, original, strain, ."
6105,"got, and, dose, pfizer, forty-two, days, after, est, dose, ., feeling, good, so, far, ., drinking, lots, water, ., going, bed, now, ."
6106,"spent, whole, day, weak, laid, out, couch, after, that, second, pfizer, shot, ,, then, suddenly, had, enough, energy, get, up, do, dishes, just, now, ., yay, person_shruggingmedium_skin_tone, i, female_sign, i"
6107,"face_with_tears_of_joyface_with_tears_of_joyy, i, all, callin, pig, i, pfizer, i, i, now, give, man, his, props, tonight, i, at, utah, no, kashi, went, got, thirty-seven, i, sixteen, i, he, showed, up, tonight"
6108,"Vaccines, :, to, bring, Pfizer, Argentina, is, now, looking, to, take, out, id, insurance, -"
6109,"flexed_bicepsdark_skin_tonefire, beast, mode, activated, ON, !, narrow, meet, my, workout, person_lifting_weightsdark_skin_tone, i, female_sign, i, coach, right_arrow_curving_down, i, he, has, come, up, with, intense, gym, workout, regime, pack, new, muscle, flexed_bicepsdark_skin_tonemass, &, amp, ;, strip, away, my, one, pack, potbelly, fat, fast, reveal, lean, ,, hard, physique, thirty, days, day, one, after, #, covidvaccination, mild, side, effects"
6110,"pfizer, i, was, elite, tonight"
6111,"get, vaccinated, i, got, pfizer, vaccine, two, months, ago, us, ., sore, arm, ,, that, ', i, it, ., just, do, it, ,, assuming, your, doctor, agrees, ."
6112,"...., or, one, astrazeneca, one, pfizer"
6113,"got, my, second, shot, today, #, pfizer, went, spin, class, one, hour, after, ., did, not, pass, out, ,, i, did, not, stick, metal, bike, phew, winking_face, #, stickittocovid"
6114,"morrison, didn, ', i, order, pfizer, time, get, enough, jabs, ,, he, only, recently, ordered, some, but, won, ', i, get, them, till, december, ,, australia, relied, az, most, part, now, they, are, screwed, ,"
6115,"delivery, delays, from, pfizer, will, prevent, the, advancement, of, the, and, dose, of, those, who, had, this, vaccine, ., but, the, appointments, already, made, will, be, honored, ,, assures, the, minister, ."
6116,"more, tired, than, trying, to, convince, mentalists, ."
6117,"can, ', i, book, my, and, pfizer, dose, online, ,, either, at, leila, or, rec, sites, i, why"
6118,"dude, has, fact, that, he, got, two, pfizer, shots, his, twitter, bio, ., you, i, re, great, person, ,, feel, better, now, go, get, booster, now"
6119,"i, am, hoping, they, will, prioritize, pfizer, apps, some, way, our, twelve, -, seventeen, as, that, is, their, only, option, atm, ,, it, would, be, nice, have, them, done, before, school, fall, ."
6120,"my, and, shot, pfizer, was, breeze, ."
6121,"i, can, i, i, wait, take, my, pandemic, baby, store, first, time, ., i, still, remember, look, his, face, when, he, saw, that, more, humans, exist, ., when, are, you, going, approve, vaccine, infants"
6122,"today, they, gave, my, mom, the, first, dose, of, pfizer, pleading_facesparkling_heart"
6123,"learning, new, tune, another, cool, project, i, i, ve, been, invited, work, on, i, stoked, #, drumline, #, chrisenriquezdrums, @, pfizer, six hundred and thirty, flushing, avenue, brooklyn"
6124,"i, support, this, request, ., i, am, fully, vaccinated, canadian, citizen, with, two, valid, doses, let, i, i, get, gyms, open, asap, #, openontario, #, opencanada"
6125,"yes, i, i, i, parent, my, thirteen, year, old, son, got, his, first, pfizer, shot, week, ago, i, have, both, mine"
6126,"The, veg, takes, me, from, catarrooooo, ', can, you, imagine, that, tomorrow, I, would, have, had, my, and, dose, of, the, pfizer, and, they, would, not, have, puerto, me, because, of, the, pinches, runny, shit, ,, literal, ."
6127,"I, am, moved, when, I, read, tweets, from, many, people, whose, relatives, have, already, received, their, est, and, and, dose, of, Pfizer, ., it, ', i, a, blessing"
6128,"wow, ...., super, I, tried, without, success, since, Saturday, but, the, time, slots, are, taken, face_with_medical_maskface_with_medical_maskpfizer, ."
6129,"amid, stories, long, lines, ,, frustration, confusion, ontario, ,, here, be, my, wife, i, today, received, our, and, pfizer, shots, ., scheduled, ten, ., forty-five, am, ,, done, completely, by, ten, ., forty-eight, ."
6130,"i, got, pfizer, had, no, side, affects, other, than, sore, shoulder"
6131,"They, gave, me, the, first, dose, of, Pfizer, in, Mexico, ,, but, I, ', i, in, the, USA, and, I, already, missed, my, turn, for, the, second, dose, ., I, can, request, a, first, dose, in, the, USA, and, it, would, be, the, same, ,, that, is, ,, there, is, a, difference, between, the, est, and, and, active"
6132,"first, week, pfizer, was, used, ."
6133,"so, it, ', i, looking, like, i, ', i, gonna, end, up, being, pfizer, /, modern, mixed, breed, i, swing, both, ways, ,, if, you, will, #, vaccinated"
6134,"I, got, an, appointment, for, my, and, dose, of, pfizer, on, July, with, ., I, ', i, going, to, buy, myself, a, six, /, forty-nine, #, vaccinationcovid"
6135,"fully, vaccinated, pfizer, tomorrow, ."
6136,"mixing, matching, win, az, :, check, pfizer, :, check"
6137,"pfizer, dose, two, baby, worth, sunburn, seven, hours, waiting, outside, at, thirty-two, i, i, ., done, done, -, there, may, be, summer, yet, @, wolsey"
6138,"a, friend, arrived, at, the, vaccination, center, an, hour, before, closing, time, and, received, a, second, dose, of, #, pfizer, out, of, turn, ., says, that, if, someone, did, not, come, by, appointment, ,, then, at, the, end, of, the, day, they, inject, everyone, who, wants, to, not, throw, away, the, spoiled, doses, ., you, should, try, thinking_face"
6139,"hahaha, they, had, the, pfizer, but, they, want, cuban, michi"
6140,"my, daughter, is, pacing, around, house, ., pfizer, vaccine, side, effects, causing, abdominal, pain, /, nausea, ., week, this, ., three, since, shot, one, ., public, health, will, advise, getting, shot, two, ., please, go, get, vaccinated, her, people, like, her, who, might, not, be, able, be, fully, protected, ., ty, red_heart, i"
6141,"because, they, allow, themselves, to, be, told, by, bernie, the, lie, that, the, pfizer, vaccine, is, only, a, few, percent, effective, ,, be, informed, ,, it, is, ninety-seven, %, effective, ., and, the, world, is, opening, up"
6142,"he, was, reportedly, vaccinated, with, pfizer, two, months, ago, gets, tested, daily, ., this, is, game, changer, more, ways, than, one, ., #, pfizer, #, phoenixsuns, #, covid19, #, pandemic"
6143,"fully, vaccinated, what, incredible, feeling, syringe, will, still, mask, up, ,, social, distance, &, amp, ;, sanitize, though, call_me_hand, #, shotofhope, #, thisisourshot, #, covid19ab, #, covidvaccination, #, pfizer"
6144,"we, got, az, her, first, dose, ., no, idea, when, they, started, getting, modern, but, they, do, ., lots, coming, too, so, hopefully, ramps, up, hard, ., we, had, appointments, pfizer, at, rec, early, july, but, canceled, now, course, ."
6145,"sunbathing, so, that, the, pfizer, grips, well"
6146,"just, got, my, second, dose, ., az, first, ., pfizer, and, ., i, ', i, not, anti, baxter, but, if, this, is, what, gov, wants, open, up, economy, ,, no, more, masks, ,, &, amp, ;, get, back, normal, life, then, let, ', i, get, it, done, ., be, clear, ,, i, would, have, gotten, shots, regardless, just, health, reasons, ."
6147,"three, /, three, three, i, took, day, off, anticipation, such, calamity, ., #, pfizer, #, ottawa, #, mentalhealth"
6148,"I, read, many, suffering, from, the, side, effects, of, vaccines, ,, I, hope, they, pass, quickly, ., In, my, case, I, had, no, sequelae, with, i, &, amp, ;, i, ,, my, seventeen, -, year, -, old, son, had, no, problems, with, pfizer, ., today, they, vaccinated, my, wife, and, I, hope, she, continues, the, good, streak, ., I, already, have, a, pool, ready, for, her, just, in, case, beaming_face_with_smiling_eyes"
6149,"if, you, drink, johnnie, walker, red, you, have, no, right, to, ask, for, a, pfizer, vaccine, ."
6150,"do, your, own, math, ., with, seventy-six, million, pfizer, come, ….."
6151,"mixed, az, pfizer, our, second, shots, ,, after, lot, reading, about, benefits, including, mrna, ., achy, next, day, ., all, good, here, ."
6152,"i, i, ve, got, my, and, dose, i, this, time, pfizer, ., i, hope, az, &, amp, ;, pfizer, mix, with, og, finally, activate, my, super, powers, #, comeoninvisibility"
6153,"so, basically, big, business, &, amp, ;, federal, gov, i, i, is, telling, us, that, because, we, were, responsible, got, vaccinated, right, away, ,, we, missed, out, ton, free, stuff, #, covid19, #, modern, #, modernavaccine, #, pfizer, #, pfizervaccine, #, patienceisavirtue"
6154,"eight hundred, new, cases, heart, conditions, pal, that, took, pfizer, modern, vaccines, fam, i, i, all, just, continue, boost, my, immune, system, at, this, point, be, ummm, ….."
6155,"thanks, ., my, first, was, pfizer, so, i, i, i, little, uncertain, about, that, ."
6156,"yes, there, was, ., it, was, released, december, while, most, it, was, up, states, ,, they, didn, i, i, buy, enough, pfizer, doses, current, admin, had, play, catch, up, ."
6157,"i, i, is, safer, ., modern, very, similar, pfizer, shot, ., if, we, could, do, it, over, we, would, skip, shot, use, vitamin, i, ,, i, ,, zinc, ,, quercitin, ,, melatonin, ivermectin, ."
6158,"first, dose, pfizer, from, today, persecuted, by, the, government, will, know, where, hahaha, greetings, band, gloves"
6159,"update, :, cpu, did, test, positive, couid, -, nineteen, but, he, received, pfizer, vaccine, back, february, ., vaccines, aren, i, i, one hundred, %, effective, so, it, happens, ., conclusion, :, dude, has, worst, playoff, luck, basketball, gods, must, have, something, against, him, ., source, :"
6160,"my, doctor, canada, had, recommended, i, take, vaccine, almost, six, months, ago, ., i, was, lucky, get, pfizer, both, doses, ,, though, now, suggesting, that, mixing, two, mrna, vaccines, may, be, better, ., i, find, that, selfie, being, vaccinated, is, even, more, effective, ., smiling_face_with_smiling_eyes"
6161,"not, sure, be, honest, ., we, booked, appointment, pfizer, which, was, two, july, about, month, so, after, we, called, ,, but, our, family, doc, called, us, today, say, we, could, get, modern, right, away, ,, so, we, did, that, now, have, cancel, other, bookings, ."
6162,"does, anyone, know, how, i, can, cancel, vaccine, appointment, i, just, got, my, and, pfizer, ohio, rather, than, wait, until, august, at, home, at, walmart, ., i, definitely, don, ', i, want, occupy, space, system, since, i, don, ', i, need, it, ."
6163,"my, #, seconddose, my, lil, elephant, got, his, botox, shot, i, i, i, officially, #, astrazeneca, -, #, pfizer, hybrid, my, og, now, broadcasting, stereo, face_with_tears_of_joy, what, amazingly, organized, set, up, they, have, here, at, libro, credit, union, center, impressed, ., relieved, ., #, covidvaccination, #, yg, #, genxzeneca"
6164,"pfizer, princessbeating_heartsmiling_face_with_sunglasses"
6165,"habeas, second, dose, thumbs_up, merci, #, pfizer, #, lasvacunassalvanvidas, #, lasvacunastrabajon, #, montreal, #, quebec, #, canada"
6166,"pfizer, ., i, felt, tired, slept, well, with, first, shot, ., no, other, symptoms, that, or, and"
6167,"fully, vaccinated, face_with_medical_mask, six, -, sixteen, -, twentynine"
6168,"just, pfizer, alone, ,, there, will, be, seventy-six, millions, doses, coming, into, canada, ., vaccine, has, expiry, dates, sept, oct, two thousand and twenty-one, ., we, don, i, i, even, need, modern, doses, ., it, i, i, our, taxpayers, dollars, ., why, don, i, i, you, get, it"
6169,"yes, ,, i, am, aware, cold, chain, requirements, ., did, you, know, that, pfizer, we, are, using, has, vaccine, expiry, date, sept, ., thirty, ,, two thousand and twenty-one, ."
6170,"just, got, my, first, dose, couid, vaccine, ., #, pfizer, anybody, else, had, pfizer, shot, how, i, i, it, make, you, feel, #, askingformyself, thinking_face"
6171,"#, followthesilence, my, wife, son, were, both, hospitalized, after, pfizer, shot, ., my, wife, went, into, anaphylactic, shock, ,, my, son, got, neuropathy, requiring, five, days, iv, treatment, six, months, more, iv, treatment, ., yet, we, are, told, it, i, i, safe, ., not, allergic, ."
6172,"saw, some, report, that, he, got, pfizer, shot, back, feb"
6173,"this, is, masked, face, man, waiting, fifteen, minutes, after, receiving, pfizer, #, two, -, downsview, arena, vaccine, clinic, ., @, weston"
6174,"', other, news, ', my, ', other, half, ', finally, got, his, and, pfizer, van, today, syringethumbs_up"
6175,"Good, evening, my, ., the, minister, I, try, to, anticipate, my, and, dose, ., I, am, from, Laval, ., pfizer, received, ....., all, beaches, are, taken, ad, August, ., solution, the, without, re, ., thank, you"
6176,"fully, valued, #, pfizer, +, #, team, =, me, down_arrow, i"
6177,"haha, ,, i, was, az, bit, getting, pfizer, this, week, ,, my, whole, family, will, have, had, second, doses, my, then, ,, here, i, though, i, would, have, wait, till, two thousand and thirty, lol"
6178,"i, got, pfizer, had, sore, arm, both, times, day, ., otherwise, no, issues, ., hopefully, my, immune, system, works, since, my, reaction, was, so, mild, comparison, with, some, my, coworkers, -, chills, ,, fevers, ,, headaches, ."
6179,"#, viagra, #, angelenos, #, doge"
6180,"valued, max, so, excited, have, gotten, my, second, dose, pfizer, this, afternoon, ., #, shotgirlsummer, #, vaccinate, #, vaccinatehpe, #, fullyvaxxed"
6181,"list, smiling_face_with_sunglasses, pfizer, ,, segundo, dosis, ., face_with_medical_mask, me, siento, doblemente, tranquil, ., smiling_face_with_halo"
6182,"dear, my, ., mayor, ;, why, was, kev, are, hotspot, round, one, but, not, round, two, overview, is, hotspot, &, amp, ;, it, is, across, riverside, south, where, we, live, ., my, wife, is, seeking, her, and, pfizer, shot, but, there, are, no, clinics, that, serve, her, ., she, is, sixty-five, &, amp, ;, had, her, est, shot, apr, with, ."
6183,"i, does, pfizer, make, vaccine, that, ass, cuz, it, i, i, killing, me, i, fucking, dead, face_with_tears_of_joyface_with_tears_of_joyface_with_tears_of_joyskull_and_crossbones, i"
6184,"does, anyone, know, when, they, are, going, to, apply, the, and, dose, of, pfizer, for, adults, aged, fifty, -, fifty-nine"
6185,"the, one, that, generates, the, most, confidence, in, me, is, pfizer, and, that, is, the, one, they, gave, me, ."
6186,"hello, ,, I, would, like, to, know, according, to, you, if, I, should, take, my, and, dose, az, or, pfizer, or, modern, the, information, is, difficult, to, enter, ., yesterday, said, sixty-three, %, protection, against, delta, and, in, the, journal, de, montreal, said, ninety, %, less, chance, of, hospitalization"
6187,"thank, you, i, already, got, my, and, dose, pfizer, at, cow, jeffrey, today, #, vaccinated"
6188,"couid, -, nineteen, vaccine, appointment, only, time, day, :, every, thursday, 7Happy_face_smiley0, a, ., i, ., i, three, :, zero, i, ., i, ., appointment, number, :, two hundred and fifteen, seven hundred and eighty-five, -, nine thousand, five hundred and twelve, visitors, will, need, enter, through, main, entrance, be, screened, ., vaccines, :, i, &, amp, ;, i, pfizer, available, *, see, post, additional, details, ."
6189,"can, anyone, confirm, that, pfizer, is, available, walk, up, and, shot, at, leila, super, site"
6190,"""..., at, least, two, weeks, after, second, dose, couid, jabs, ,, protection, against, infection, fell, ninety-two, %, alpha, variant, seventy-nine, %, against, delta, variant, pfizer, vaccine, ,, while, astrazeneca, vaccine, protection, fell, seventy-three, %, sixty, %, respectively, i"
6191,"wow, pfizer, vaccines, just, showed, up"
6192,"my, twelve, year, boy, just, got, his, est, pfizer, shot, elephant, painting, ., been, great, few, days"
6193,"now, if, vaccinated, ,, they, have, already, opened, borders, in, europe, for, vaccinated, with, pfizer, ,, modern, and, i, &, amp, ;, i, ., it, will, be, wise, to, start, organizing, the, autumn, trip, airplanefolded_handslight_skin_tone"
6194,"ray, ', i, getting, his, and, pfizer, today, thumbs_upsyringe"
6195,"just, heard, with, that, #, covid19, #, deltavariant, is, now, ten, %, all, cases, #, usa, &, amp, ;, doubling, every, was, ., much, more, contagious, &, amp, ;, more, chance, getting, dangerously, sick, ,, faster, ., so, far, ,, double, not, single, doses, pfizer, &, amp, ;, moderns, prove, effective, stop, ., #, getvaccinated, #, boston"
6196,"I, let, go, this, morning, and, took, pfizer, fuck, it"
6197,"shot, #, two, ., az, +, pfizer, =, fu, couid, oncoming_fistmedium, -, light_skin_tonefolded_handsmedium, -, light_skin_tone"
6198,"megaphone, free, vaccine, bus, megaphone, this, mobile, coronavirus, vaccine, bus, will, be, in, travers, park, at, with, ave, &, amp, ;, with, it, ,, from, today, until, Friday, ,, June, eighteen, ,, from, twelve, i, ., i, ., eight, am, Pfizer, and, Johnson, &, amp, ;, johnson, free, syringe, just, bring, your, id"
6199,"megaphone, free, covid19, vaccine, site, megaphone, ny, mobile, vaccine, bus, is, travers, park, with, ave, &, amp, ;, with, it, ,, today, through, friday, ,, june, with, 12pm, -, up, ., they, ', re, offering, free, pfizer, johnson, &, amp, ;, johnson, vaccines, syringe, just, bring, id, no, other, documents, are, required"
6200,"somebody, got, her, and, shot, today, yippie, go, canada, ok, ok, go, quebec, rolling_on_the_floor_laughing, #, canada, #, covidvaccination, #, pfizer, #, getvaccinated, #, life, #, covid19vaccine, #, girlfriend"
6201,"got, first, dose, pfizer, sunday, i, had, couid, like, 48hrs, but, still, alive, just, keeping, posted"
6202,"Rumors, that, pfizer, has, announced, that, it, will, be, infertile, if, it, hits, the, corona, vaccine, itself, ?, Isn, ', i, it, a, problem, that, the, original, English, structure, is, not, good, and, it, really, reads, like, that, when, translated, by, google, ?, Today, ,, the, second, line, ,, "", However, ,, the, two, are, different, (, so, the, fact, that, they, are, infertile, has, not, been, confirmed, so, far, i, is, important, ."
6203,"i, i, i, day, after, second, shot, pfizer, ., chills, at, 11pm, last, night, ., slept, seven, ., five, hours, had, headache, while, ., i, should, sleep, more, but, it, i, i, getting, better, ., first, shot, was, sore, arm, only, ."
6204,"both, pfizer, vaccines, are, done, ."
6205,"booked, my, second, dose, my, pfizer, vaccine, today, july, ten, ., can, i, i, wait, ., travel, soon, ."
6206,"nine, -, 3Happy_face_smiley0, first, dose, pfizer, vaccines, at, regina, farmer, i, i, market, today, ., go, get, your, shots, friends"
6207,"#, covidvaccination, clinic, at, high, school, until, six, am, ., walk, -, ins, welcome, ., i, &, amp, ;, i, vaccine, but, also, #, pfizer, students, twelve, -, seventeen, ., enter, door, thirty-four, ."
6208,"london, i, i, #, vaccine, supply, will, get, major, boost, ,, with, ask, modern, vaccine, compliment, ask, pfizer, vaccines, arriving, over, nest, two, weeks, ., let, i, i, work, together, keep, #, dont, safe, #, londonfanshawe, #, londonontario"
6209,"happening, right, now, -, come, right, out, &, amp, ;, seventy-seven, it, your, vaccine, ., no, appointment, necessary, ., free, charge, ., you, have, your, choice, or, ., more, info, &, amp, ;, full, schedule, :, #, covidvaccination"
6210,"getting, our, second, shots, pfizer, today, at, up, ."
6211,"pfizer, if, it, was, at, coliseum"
6212,"az, /, pfizer, wellness, status, :, vaccine, at, up, ., good, sleep, ., feel, quite, poopy, now, ., mild, headache, ,, very, foggy, brain, ,, tired, ,, general, blech, ., would, still, do, again, ."
6213,"pfizer, vaccine, was, administered, at, coliseum, ., up, ninety-five, %, efficacy, rate, chris, paul, still, gets, positive, outcome, ."
6214,"waiting, my, second, dose, pfizer"
6215,"pfizer, vaccine, clinic, bloom, &, amp, ;, jewel, osso, est, and, dose, clinic, round_pushpinbloom, highschool, spiral_calendar, june, twentynine, ,, two thousand and twenty-one, alarm_clock, am, -, up, ages, twelve, up, *, shuttle, bloom, trail, i, it, ;, bloom, will, be, provided, ten, -, am, ., come, get, vaccinated, ..., provisions, have, been, made, flexed_bicepsmedium_skin_tone"
6216,"#, seconddose, here, we, come, looking, like, about, ten, fifteen, minute, lineup, at, drive, through, #, pfizer, i, sure, hope, i, get, my, call, this, time"
6217,"no, roselyn, today, know, she, got, her, pfizer, shot, ., @, planet, fitness"
6218,"and, shot, done, ., #, pfizer, this, time, ., #, getvaccinated"
6219,"got, second, dose, ,, pfizer, after, az, ., expect, that, i, am, going, feel, like, crap, while, as, always, ,, but, whatever, ,, this, is, great"
6220,"i, think, there, ', i, pfizer, shipment, it, ', i, way, ,, but, modern, got, shipped, this, week, ,, so, i, ', i, seeing, more, those, doses, out, there, when, i, look, online, ., i, recommend, getting, recall, waitlist, your, area, meantime, ., or, consider, getting, modern, sooner, ."
6221,"and, pfizer, dose, received, #, vaccination"
6222,"apparently, proper, interval, is, twenty-eight, days, between, both, pfizer, doses, ., here, i, am, ,, education, worker, working, both, online, person, ,, waiting, until, ford, decided, move, up, and, doses, people, like, me, ., safe, september, cant, exist, if, we, all, get, valued, end, august, or, later"
6223,"our, amazing, family, doc, just, called, ,, we, ', re, getting, #, modern, this, afternoon, will, then, cancel, our, early, july, bookings, #, pfizer, ., #, seconddose, #, mrna, #, vaccination, #, covid19mb"
6224,"Today, is, the, second, dose, of, #, pfizer, thumbs_up, #, vacunasparatodos, #, lasvacunastrabajon, #, covid19, #, montreal, #, quebec, #, canada"
6225,"there, i, i, couid, -, nineteen, vaccination, clinic, put, by, going, right, now, mcdonald, i, i, off, us, twenty-three, boyd, co, ., restaurant, workers, anyone, who, needs, it, it, goes, until, up, they, are, offering, pfizer, full, story, why, what, coming, tonight"
6226,"official, guidance, is, if, you, took, mrna, shots, ,, it, is, recommended, that, you, take, same, company, shot, as, your, and, dose, unless, that, shot, is, not, readily, available, ., there, is, no, shortage, pfizer, canada, so, official, guidelines, is, stick, same, shots, unless, you, took, az, i"
6227,"#, whu, says, anyone, who, had, their, first, dose, pfizer, or, modern, at, least, twenty-eight, days, ago, is, now, eligible, their, second, dose, ,, can, go, walk, -, in, clinic, or, book, whu, site, link, below"
6228,"hello, narc, ,, today, i, took, a, second, dose, of, the, couid, vaccine, ,, and, this, time, it, wasn, ', i, the, modern, one, ,, it, was, the, pifaaaaizer, rolling_on_the_floor_laughingrolling_on_the_floor_laughing, thank, you, scientists, ,, without, you, we, would, be, doomed, to, death, ., red_heart, i, #, fullyvacinnated, #, modern, #, pfizer, #, forabolsonaro"
