,0
3639,"when, i, remember, what, edition, vienna, spent, with, it, da, carla, nothing, against, her, person_facepalminglight_skin_tone, i, female_sign, i, could, have, saved, it, for, ., because, it, combines, much, more, with, the, modern, contemporary, regional, trajectory, of, the, same, ., #, bbb21"
3640,"this, is, official, sympathy, tweet, i, house, modern, i, fo, i, sho"
3641,"modern, mami, person_tipping_handmedium, -, light_skin_tone, i, female_sign, i"
3642,"i, got, modern, ., i, didn, i, i, feel, thing, ., relax, your, arm, ;, don, i, i, tense, up, ., look, straight, ahead, ., arm, was, slightly, sore, couple, days, ., they, i, all, be, no, need, scream, ."
3643,"anyone, else, almost, die, #, johnsonandjohnsonvaccine, just, get, #, modern, or, #, pfizer"
3644,"modern, got, my, arm, pain, tired_face"
3645,"who, i, i, watching, broadway, i, i, thoroughly, modern, millie, after, panna, cotta"
3646,"got, my, second, modern, shot, today, ., middle_fingerlight_skin_tone, u, couid, nineteen, #, covid19vaccination, #, modern, #, covid19"
3647,"modern, mamirelieved_facenail_polishmedium, -, light_skin_toneface_blowing_a_kiss"
3648,"lets, go, modern, mamiiiiiiiis"
3649,"ok, modern, mami, upside, -, down_face"
3650,"thank, you, #, urbandecay, giving, me, blues, #, filter, #, edmnightetro, #, modern, #, stillwareingmymask, #, crisiswear, #, bluehair, #, hashtag, @, east, downtown, houston"
3651,"modern, both, ., white, widow, seventy-eight, yo, ,, no, sides, ,, thrilled, ,, will, mask, distance, wash, as, long, as, healthy, community, asks, me, ., i, thank, god, science, ,, goodness, ."
3652,"modern, mami, checking"
3653,"four, us, got, second, modern, shot, tuesday, ., ages, forty-nine, ,, fifty-seven, ,, seventy-eight, &, amp, ;, eighty-one, nobody, was, ill, beyond, sore, arm, ."
3654,"yes, ,, i, had, my, first, modern, today, arm, hurts, bit, ,, pretty, much, just, like, any, other, shot, ,, but, that, ', i, it, ., second, one, is, scheduled, five, /, six, ."
3655,"canada, we, have, approved, je, which, we, are, expecting, shipment, end, april, ,, modern, ,, az, ,, pfizer, ,, nova, van, which, should, be, approved, may, ,, i, think, there, is, sixth, one, coming, down, pike, summer, but, i, forgot, manufacturer, ,"
3656,"wow, that, is, quite, system, they, have, there, good, you, your, mom, getting, it, lucky, you, guys, it, is, one, shot, i, had, modern, ,, days, following, it, were, miserable, but, i, am, three, months, post, now, ,, no, problems, ., smiling_face_with_smiling_eyes"
3657,"modern, gang, call_me_handmedium, -, light_skin_tone, fully, vac, with"
3658,"niko, :, #, modern, #, vaccine, killed, my, grandfather, i, send, your, condolences"
3659,"second, modern, shot, done, ., #, vaccinated, #, vaccine, #, vaccinessavelives, #, covidvaccine"
3660,"modern, mami, face_blowing_a_kiss"
3661,"both, my, grandparents, died, their, sleep, at, ninety-three, back, two thousand and seventeen, but, i, know, it, was, modern, vaccine, ., old, people, never, die, ."
3662,"modern, today, baby"
3663,"ladoo, it, i, i, almost, as, enlightening, as, zodiac, ..., like, sun_with_facefirst, dosesun_with_face, full_moon_facemodernafull_moon_face"
3664,"i, did, not, have, any, major, side, effects, modern, ., after, i, received, second, dose, ,, i, felt, tired, ,, had, light, headache, my, sinus, headaches, are, way, worse, my, arm, was, very, sore, but, that, ', i, about, it, ."
3665,"my, wife, got, her, second, modern, shot, week, ago, aside, some, arm, soreness, has, been, fine, ., my, ad, is, tuesday"
3666,"it, ', i, nerf, or, nothin, ', nerf, is, modern"
3667,"modern, ., totally, vaccinated, ."
3668,"i, got, modern, feelin, good, feeling, great"
3669,"i, had, terrible, migraine, chills, this, afternoon, ., after, taking, nap, i, woke, up, with, couid, arm, ..., exactly, seven, days, since, i, had, my, modern, shot, ."
3670,"all, day, modern, &, amp, ;, my, immune, system, have, been, throwing, hands, &, amp, ;, i, am, tired, symptoms"
3671,"hey, i, got, my, second, modern, shot, this, afternoon, my, arm, hurts, -, yay, grinning_faceface_with_tears_of_joysyringeparty_popper"
3672,"so, excited, see, my, hot, dentist, again, next, week, also, get, my, second, dose, #, modern"
3673,"modern, mami, smiling_face_with_halo"
3674,"he, has, pieces, that, rival, the, anthropology, museum, in, a, very, modern, and, contextually, based, museography, ., that, is, to, say, ,, it, is, a, punctured, beauty, #, pueblo, #, amazing, #, prehispanic, #, collection, in, the, shelter, museum"
3675,"scheduled, modern, #, two, four, /, twenty, ., not, soon, enough, coworker, tested, +, day, ."
3676,"modern, mamiwinking_face_with_tongueraised_handmedium, -, light_skin_tone"
3677,"i, i, ve, had, two, i, also, have, my, first, vaccine, #, thanksbiden, #, modern"
3678,"joined, modern, gang, today, #, getvaccinated"
3679,"lol, nice, ., we, got, modern, ., i, did, that, even, little, massage, &, amp, ;, i, was, still, sore, ., lol"
3680,"yay, i, got, my, est, modern, dosesyringeflexed_bicepslight_skin_tone, #, modernavaccine"
3681,"this, beautiful, eighty, degree, day, ,, i, laid, bed, under, seven, blankets, because, modern, is, kicking, my, ass, i, spent, day, freezing, neutral_facecold_face"
3682,"modern, dizzy"
3683,"my, dad, #, rampage, is, #, vaxxedsyringe, ready, vacay, thank, you, #, modern, #, giant, shot, smiling_face_with_sunglasses, @, potomac, ,, maryland"
3684,"well, ,, as, modern, mami, ,, i, got, whichever, one, was, being, offered, me, last, month, grinning_face_with_sweat"
3685,"oh, interesting, ,, i, remember, hearing, it, was, modern, but, must, have, just, been, first, shipment"
3686,"interestingly, ,, worse, side, effects, are, terms, immune, response, ,, better, ., as, long, as, you, i, re, not, having, allergic, reaction, ,, shot, giving, you, chills, ,, fever, ,, aches, ,, etc, i, means, that, your, immune, system, is, good, shape, ., so, modern, might, be, good, selection, ."
3687,"modern, -, and, one, i, was, bed, with, chills, overnight, ..., flu, like, symptoms"
3688,"bethel, park, school, district, staff, will, receive, their, second, final, dose, modern, couid, -, nineteen, vaccine, beginning, at, nine, a, ., i, i, this, saturday, ,, april, ten, at, bethel, park, community, center, ., as, reminder, ,, best, will, have, asynchronous, learning, day, monday, ,, april, twelve, ."
3689,"#, firstdosedonesyringe, #, modern, #, grateful, #, ny, #, healthcareheroes, "", no, one, is, safe, until, everyone, is, safe, "", #, unicefusa, #, vaccinessavelives, #, healingstartshere, #, equitablevaccinedistribution"
3690,"got, my, first, #, fauciouchie, here, sarasota, today, #, modern, #, covid19vaccine, me, wishing, you, all, safe, ,, healthy, ,, joyous, ,, abundant, #, yearoftheox, folded_handscow_faceparty_poppersparkles"
3691,"sweet, ., i, ', ve, got, my, est, modern, shot, it, ', i, been, minute"
3692,"i, had, modern, ., first, shot, symptoms, :, one, week, swelling, at, injection, site, ., second, shot, symptoms, :, fatigue, soreness, at, injection, site, two, days, ."
3693,"congratulations, i, got, my, first, dose, modern, today, as, well, ., arm, hurts, like, crazy, but, well, worth, it, ."
3694,"exactly, one, week, after, my, first, modern, shot, ,, i, i, ve, got, itchy, hard, bump, at, injection, site, ,, bang, schedule, couid, arm, go, immune, system, go"
3695,"i, heard, rumor, about, vaccines, making, people, sterile, ..., but, congrats, i, got, my, modern, yesterday, too, :"
3696,"yay, syringe, my, est, modern, is, next, saturday, cheers"
3697,"this, is, pay, chappy, ,, this, is, what, they, do, for, ratings, and, that, hasn, ', i, changed, on, mexican, television, even, if, they, do, the, i, modern, i, talking, about, am, or, jerk, ., how, disgusting, that, kind, of, programs, and, how, disgusting, that, man, ."
3698,"just, got, my, and, modern, this, morning, ,, hoping, it, goes, like, this, me, too"
3699,"modern, it, two, got, me, feeling, loooooopty"
3700,"i, had, my, first, modern, two, weeks, ago, ., nothing, but, sore, arm, next, day, ., kind, not, looking, forward, #, two, winking_face_with_tongue"
3701,"new, modern, vaccination, appointments, available, tomorrow, ,, four, /, nine, saturday, four, /, ten, ., visit, or, two, -, one, -, one, confirm, your, appointment, ., before, you, arrive, :, check_mark_button, complete, your, registration, at, link, your, confirmation, email, text"
3702,"i, got, modern, ., no, problem, with, either, injection, ,, not, even, sore, arm, ."
3703,"this, second, dose, modern, vaccine, is, kicking, my, ass, ., zero, side, effects, first, time, ., i, felt, hyped, up, &, amp, ;, like, i, was, catching, cold, last, night, ., today, i, i, ve, mostly, slept, had, tough, time, moving, boxes, into, my, rav, due, soreness, ., rotating, between, chills, &, amp, ;, overheating, ."
3704,"not, going, be, basic, post, card, ..., but, ya, boy, got, his, and, dose, modern, today, ..., #, vaccinatedsummer21"
3705,"i, just, booked, my, first, appointment, today, ., it, ', i, modern, ., i, have, no, idea, what, that, means, ,, but, i, want, this, over, ."
3706,"second, modern, yesterday, yay"
3707,"i, get, my, second, jab, modern, tomorrow, nine, /, apr, at, 09Happy_face_smiley0, it, ., two, weeks, maximum, immunity, ., couple, weeks, i, am, planning, get, antibody, test, ."
3708,"received, those, from, la, two, weeks, at, the, end, of, the, past, week, modern, are, always, late"
3709,"modern, mami, love, -, you_gesturemedium, -, light_skin_tone"
3710,"what, ', i, going, on, with, modern, doses, this, week, thinking_face"
3711,"i, can, i, i, tell, if, i, i, i, exhausted, this, modern, vaccine, or, because, i, i, ve, been, awake, since, 4Happy_face_smiley0, this, morning"
3712,"this, after, i, got, second, dose, modern, arm, little, sore, ,, similar, after, first, dose, ., little, tired, ,, ink, if, that, i, i, vaccine, tho, ., nothing, else, yet, call_me_handmedium_skin_tone, bring, it, face_with_steam_from_nose"
3713,"shot, #, two, down, ,, modern, gang, wassup, ., also, og, is, hitting, thanks, fam"
3714,"no, ,, modern, is, practice, ."
3715,"i, had, both, my, does, did, not, have, any, symptoms, other, than, my, arm, being, sore, couple, days, ., i, took, modern, vaccine, ."
3716,"my, sister, got, her, est, modern, vaccine, ,, but, had, cancel, her, and, due, illness, ., she, i, i, desperately, trying, reschedule, her, and, shot, ., she, i, i, called, numerous, times, ;, no, one, can, help, her, ., she, works, with, kids, who, are, developmentally, disabled, ., help"
3717,"got, my, first, dose, #, modern, #, vaccine, today, half, way, there, ."
3718,"beautiful, modern, hugging_face"
3719,"got, my, and, modern, shot, yesterday, afternoon, ., late, last, night, all, through, today, ,, i, feel, like, i, have, really, terrible, hangover, ., like, i, drank, all, whisky, last, night, &, amp, ;, also, got, into, fistfight, with, bear, ., face_with_tears_of_joyrolling_on_the_floor_laughingface_with_tears_of_joy, if, this, is, what, it, takes, avoid, couid, ,, it, ', i, still, worth, it"
3720,"it, feels, great, be, doing, my, six, miles, walk, today, with, noever, minimum, sore, arm, my, second, shot, tuesdayorange_heartsyringemicrobeUnited_Statesfolded_hands"
3721,"isolation, week, fifty-six, :, complete, modern, dose, one, :, complete"
3722,"vampire, weekenTongue_sticking_out_cheeky_playful_or_blowing_a_raspberry, modern, vampires, city"
3723,"modern, ., i, ', i, fine, other, than, headache, tiredness, sleeping_face"
3724,"both, my, modern, were, just, fine, ."
3725,"got, my, first, dose, modern, vaccine, today, it, was, extremely, easy, all, i, did, was, set, appointment, show, up, ., they, didn, i, i, ask, anything, further"
3726,"she, just, got, her, second, modern, shot, nail_polishlight_skin_tone"
3727,"got, my, second, dose, modern, tuesday, ., no, side, effects, ., my, arm, actually, hurt, less, this, time, than, it, did, after, first, shot, ., everybody, reacts, differently, ."
3728,"i, love, being, modern, gal, it, i, i, such, vibe"
3729,"modern, side, effects, are, wild, feeling, some, crazy, aches, chills, ,, but, they, i, re, coming, waves, keep, things, exciting, ., what, ride, #, vaccinated, #, thanksdolly"
3730,"nerds, and, fully, vaccinated, syringe, nerds, fully, vaccinated, raising_handslight_skin_tone, today, we, had, a, second, dose, ., I, really, want, to, be, able, to, show, Avalon, a, world, without, masks, hospital, we, got, our, second, modern, dose, ., #, thankshealthheroes, #, ᴠᴀᴄᴄɪɴᴇssᴀᴠᴇʟɪᴠᴇs"
3731,"modern, and, dose, took, me, down, hard, y, i, all, ., 1130am, got, my, and, dose, up, ninety-nine, fever, 10pm, -, am, one hundred, fever, body, aches, sweats, pounding, headache, am, -, now, no, fever, but, my, body, hurts, feel, like, i, got, hit, by, truck, ., so, tired, ., loudly_crying_face"
3732,"second, dose, is, done, ., thanks, modern, ,, walgreens, ,, everyone, involved, ., take, shot, #, covid19vaccine, #, seconddose, #, gettheshot, #, takeyourshot, #, covidkills"
3733,"first, dose, modern, was, easier, than, my, first, dose, cortisone, ., here, i, i, hoping, i, i, i, not, allergic, this, one, ., crossed_fingers"
3734,"modern, boy, summer, clapping_handsmedium, -, dark_skin_toneface_with_tears_of_joy"
3735,"ymca, yung, modern, caught, mo, bitches"
3736,"oh, you, were, able, request, which, one, you, wanted, wow, ., we, booked, our, appointments, online, when, i, got, hospital, they, were, doing, modern, today, ,, that, i, i, all, ., but, i, i, i, not, sorry, i, took, it"
3737,"just, got, my, first, dose, #, modern, just, walked, right, into, dome, downtown, sol, ,, no, appointment, ,, no, wait"
3738,"hoping, julie, andrews, gets, modern, vaccine, so, she, can, be, #, thoroughlymodernamillie, beaming_face_with_smiling_eyes"
3739,"just, got, shot, number, two, modern, ., sitting, my, car, post, -, van, so, grateful, science, our, frontline, workers, ., at, same, time, ,, overcome, with, sadness, those, that, didn, i, i, survive, couid, -, nineteen, ,, amount, loss, this, globe, experienced, many, levels, ., what, i, *, i, year, it, i, i, been, ."
3740,"&, it, ;, &, it, ;, &, it, ;, &, it, ;, modern, mama"
3741,"modern, ., first, shot, was, fine, &, amp, ;, honestly, headache, may, have, been, as, much, allergies, weather, changes, than, anything, else, ."
3742,"i, got, my, and, modern, vaccine, week, ago, tomorrow, ."
3743,"my, matriculation, into, house, modern, is, now, fifty, %, complete, ., ., ., ., #, covid19, #, covidvacccine, #, modern, @, costco"
3744,"second, modern, dose, books, ready, put, this, pandemic, behind, me, ,, see, my, family, ,, get, back, my, normal, schedule, travel, travel, travel, victory_handmedium, -, light_skin_toneface_with_medical_mask, #, byecorona, #, sciencerules, #, readyforcancun, #, wanderlust, #, protectchicago"
3745,"officially, inoculated, into, modern, mob"
3746,"i, thought, modern, was, sexy, one, but, i, feel, like, shit, eureka"
3747,"modern, mamiiiiiiiiii"
3748,"modern, mamismiling_face_with_heart, -, eyesrelieved_facewinking_face_with_tongue"
3749,"congratsthumbs_uphappy, you, ,, i, go, eighteen, days, my, second, modern, ."
3750,"great, news, my, wife, i, have, received, both, our, modern, vaccines, now, so, we, know, how, happy, you, are, ."
3751,"i, got, my, last, dose, modern, vaccine, three, was, ago"
3752,"not, doctor, ,, read, lot, ., also, fog, resident, ., it, i, i, true, that, masks, sanitizer, kept, flu, at, bay, last, year, but, i, was, advised, by, my, local, go, get, flu, shot, ., i, did, not, get, flu, or, couid, ., just, got, my, first, modern, shot, ten, days, ago, ., no, harm, getting, flu, shot, ."
3753,"i, got, my, second, modern, took, next, day, off, cause, i, thought, was, going, feel, bad, ., nothing, it, ., left, arm, is, sore, i, felt, bit, weird, about, three, hours, ., other, than, that, i, i, i, totally, relieved, ."
3754,"waiting, very, slow, moving, long, line, my, and, modern, shot, ..., #, vaccinessavelives, #, staysail, #, letsgetvaccinated, #, keanuniversity"
3755,"modern, mami, here"
3756,"well, ,, there, was, slightly, longer, line, when, i, showed, up, my, second, modern, dose, white, county, ,, to, than, there, was, first, dose, ., so, hopefully, this, is, exception, ."
3757,"omg, i, i, i, getting, my, second, dose, modern, next, friday, ..., i, i, i, scared, but, also, happy"
3758,"stop, with, silly, conspiracy, theories, ., get, vaccine, so, we, can, all, get, our, lives, back, ., not, sure, look, at, europe, ., they, ', re, their, ith, lockdown, ., do, you, want, that, here, do, your, part, ., i, ', ve, had, two, doses, modern, ,, no, issues, ."
3759,"no, ,, it, isn, ', i, ., its, simple, ,, five hundred and sixty, ,, zero, +, americans, are, dead, ., globally, it, ', i, over, million, ., want, your, life, back, get, vaccine, i, ', ve, had, both, shots, ,, modern, ,, no, problems, i, can, ', i, wait, stop, wearing, masks, ., until, we, ', re, vaccinated, ,, it, won, ', i, happen, not, sure, look, at, europe, ,, they, ', re, screwed"
3760,"modern, here, ., second, shot, hit, pretty, hard, ,, but, only, about, six, hours, or, so, day, -, ish, after, ., nausea, chills, ., felt, one hundred, %, next, morning"
3761,"modern, mamirolling_on_the_floor_laughing"
3762,"sitting, here, waiting, be, dismissed, -, just, got, modern, ., i, can, already, feel, my, microchip, activating, ., hopefully, my, supersoldier, dna, kicks, before, dinner, time, crossed_fingersmedium_skin_tone"
3763,"this, isn, ', i, normal, what, do, you, think, covid19, is, getting, vaccine, puts, us, closer, being, back, normal, ., i, ', ve, had, two, modern, doses, ., no, issues, ., i, hate, wearing, mask, ,, but, will, do, so, protect, myself, others, ., i, ', i, looking, forward, not, having, wear, my, mask, anymore, ."
3764,"this, makes, me, feel, good, ., i, got, modern, have, been, just, so, anxious, ., but, i, i, i, seeing, good, reports, across, board"
3765,"i, hi, uhhmm, ,, yeah, can, i, get, uh, ,, two, $, six, with, beef, cheddar, modern, arm, that, i, i, it, ......, huh, uh, ,, yeah, ,, gimme, some, horsey, i, i, army, i, i, please, i"
3766,"congrats, i, had, my, second, shot, modern, mar, ten, i, fully, vad, mar, twentyfour, ..., you, can, join, club, two, weeks, lol"
3767,"and, modern, shot, done, ., smiling_face_with_sunglassesconfetti_ballparty_popper"
3768,"that, i, i, wrap, ., second, shot, done, ., #, vaccinated, #, vaccines, #, modern, #, vaccinessavelives, #, covid19vaccination, #, no, #, jerseyshore, #, jerseygirl"
3769,"my, tennesseans, walmart, is, administrating, modern, with, wait, about, week, if, u, were, curious"
3770,"finally, got, my, second, shot, #, vaccinated, #, vaccine, #, covid19, #, modern, but, since, first, night, my, first, shot, my, lips, /, bit, my, face, felt, numb, i, have, thirty, min, wait, before, i, can, leave, ., ahah, ., #, forsafetireasons, #, getyourshot, #, wearamask"
3771,"second, dose, #, modern, #, vaccinated, #, queens"
3772,"one, down, ,, one, go, #, modern, @, santa, clarity, ,, california"
3773,"modern, mami, i, i, let, me, hear, y, i, all, make, some, noise"
3774,"everyone, ', i, reactions, are, different, ., i, had, modern, ,, est, was, manifested, sore, arm, couple, days, ., second, one, gave, me, one hundred and one, ., seven, fever, four, his, ,, followed, by, day, exhaustion, ,, after, that, back, normal, ."
3775,"just, got, my, first, dose, modern, couid, -, nineteen, mrna, -, one thousand, two hundred and seventy-three, ., very, orderly, process, ., wife, goes, monday, ., great, see, daily, syringe, over, one hundred, ,, zero, daily, ontario, now, ., we, need, get, ahead, variants, ."
3776,"i, &, amp, ;, i, girls, modern, girls"
3777,"and, modern, shot, done, ., let, ', i, drop, fear, bucket, move, forward, #, vaccines, #, covid19, #, wearamask"
3778,"modern, mob, out, hereface_with_steam_from_noseflexed_bicepsmedium_skin_tone"
3779,"first, dose, thank, you"
3780,"fuck, i, wanna, get, modern, now, so, i, can, be, modern, mami"
3781,"modern, vaccine, lasts, at, least, six, monthsdouble_exclamation_mark, i, double_exclamation_mark, i, is, that, allexclamation_question_mark, i"
3782,"got, my, second, shot, modern, this, morning, ., fully, vaccinated, #, covidvaccine, #, covid19"
3783,"what, did, modern, put, this, vaccine, make, my, cock, this, hard"
3784,"got, my, first, shot, modern, vaccine, today, syringeparty_popper, #, igotmycovid19vacccine"
3785,"ok, ,, second, modern, shot, side, effects, kicked, about, 24hrs, later, ,, tired, body, aches, ., nothing, one, can, i, i, work, through, ,, but, taking, tylenol, after, i, get, some, food, my, stomach, ."
3786,"modern, gang, syringeflexed_bicepsmedium_skin_toneflushed_face"
3787,"got, my, modern, #, one, today, ., just, waiting, fifteen, minutes, before, i, can, leave, ."
3788,"stop, modern, slander, at, least, we, i, re, not, johnson, johnson, speak, -, no, -, evil_monkey"
3789,"modern, was, told, due, autoimmune, i, would, be, really, sickperson_shrugging, i, female_sign, i, had, headache, ,, chills, muscle, aches, three, days, no, big, deal, have, three, inch, area, arm, by, shot, with, rash, again, no, big, deal"
3790,"wow, ., congratulations, which, one, i, i, ve, been, quite, bowled, over, by, modern, ."
3791,"i, have, had, two, doses, modern, only, side, effect, was, slightly, sore, arm, ."
3792,"good, luck, ,, i, ', i, worried, about, shot, two, later, this, month, as, well, but, hopeful, ., is, yours, modern"
3793,"i, had, modern, shot, last, week, ., by, day, two, i, had, pain, at, injection, site, like, i, have, hit, arm, ,, visual, swelling, ,, bruising, ,, all, over, itching, ., by, day, four, it, was, all, gone, ., i, hope, number, two, is, walk, park"
3794,"so, i, got, my, est, dose, modern, vaccine, &, amp, ;, i, feel, fine, but, i, wonder, how, i, i, all, feel, tomorrow"
3795,"we, had, our, first, modern, vaccination, almost, month, ago, ,, no, side, effects, ., and, one, next, week, ., am, so, happy, ., mask, up, people, ,, we, ', re, not, close, herd, immunity, yet, ., lets, get, this, job, done, get, this, virus, gone, ., smiling_face_with_heart, -, eyes"
3796,"covid19, vaccine, shot, #, two, done, ., already, kicking, in, ..., ugg, ., #, gatvaccinated, #, vaccinatedbear, #, vaccinated, #, modern, #, modernabear, @, solano, county, fairgrounds"
3797,"house, modern, lol, face_with_tears_of_joy"
3798,"i, had, my, first, modern, injection, ,, well, tolerated, ., and, is, scheduled, april, twenty, ., can, ', i, wait"
3799,"modern, #, one, ;, second, up, -, coming"
3800,"i, couldn, ', i, believe, it, gloria, ,, zero, side, effects, my, second, modern, shot, ., i, was, bracing, myself, ."
3801,"frontline, worker, as, described, by, cac, oregon, i, i, phase, ab, group, seven"
3802,"i, had, soreness, my, arm, fatigue, headache, ., lasted, about, three, days, ., i, get, my, second, modern, shot, saturday, ."
3803,"i, also, received, modern, ,, but, only, side, effect, was, sore, arm, second, shot, ..."
3804,"i, told, my, friend, who, had, modern, it, would, be, straight, west, side, story, streets, ."
3805,"pfizer, one, arm, modern, other, be, i, i, i, ambidextrous"
3806,"i, got, my, est, modern, vaccine, today, ., so, far, so, good, as, far, as, reactions, ., we, shall, see, ., #, vaccinated, #, modern"
3807,"got, my, first, dose, modern, today, at, weeks, pregnant_womanmedium, -, dark_skin_tone"
3808,"received, first, shot, modern, today, ,, i, feel, great, ., #, vaccinated, part, one"
3809,"i, ', i, modern, mama, purple_hearttulipsmiling_face_with_heart, -, eyes"
3810,"shit, call, me, i, modern, mami, i"
3811,"modern, xu, four, more, days, until, "", full, immunity, "", jihad"
3812,"yep, modern, ., i, had, mild, side, effects, ,, headache, ,, fatigue, ,, arm, soreness, ."
3813,"i, am, first, one, get, modern, my, family, my, arm, feels, like, it, i, i, going, explode"
3814,"bitch, i, i, i, modern, musical_notemusical_notes"
3815,"just, got, my, first, shot, modern, ., ran, into, #, covid19vacccine, #, denvercovid19vacination, #, denver, #, modernavaccine, @, skyline, medical, offices"
3816,"dose, one, check_mark_button, #, covid19, #, vaccinated, #, healthcareworker, #, longtermcare, #, modern"
3817,"modern, got, some, bark, her"
3818,"two, modern, ....., thumbs_up"
3819,"disgusting, ..., i, i, i, sue"
3820,"second, modern, shot, is, arm"
3821,"so, i, just, got, my, and, dose, modern, ,, i, felt, symptoms, first, dose, ,, does, anybody, know, if, you, get, symptoms, only, first, or, only, and, i, i, i, assuming, i, i, all, just, have, sore, arm, some, fatigue, ., #, modernavaccine"
3822,"i, are, proud, modern, mais, no, matter, what, anybody, says"
3823,"modern, ,, have, had, both, doses"
3824,"just, got, bred, by, this, really, hot, guy, named, modern, hot_facehot_face"
3825,"modern, mami, loudly_crying_facerolling_on_the_floor_laughing, i, like, that, lao"
3826,"sorting, hat, put, me, team, modern, ,, which, i, think, is, like, being, gryffindor, ., first, shot, done"
3827,"i, wanted, i, &, amp, ;, i, over, modern, too, but, ultimately, i, just, needed, run, into, first, place, where, they, could, jab, me, before, i, had, too, much, more, time, think, about, it, get, more, scared, ., maybe, try, sniffing, poppers, before, walking, lol, or, lick, ground, good, luck"
3828,"modern, love, gets, me, church, time"
3829,"congratulations, mike, ., i, received, my, first, shot, modern, today, ."
3830,"#, cherryblossom, #, spring, #, ny, celebrating, spring, my, #, 2ndcovidshot, #, teamdolly, #, modern, @, new, york, city, ,, i, ., y, ."
3831,"i, am, now, modern, king"
3832,"modern, swollen, arm, with, est, dose, three, days, ., second, dose, bummed, me, out, like, fifteen, hours, fatigue, ,, chills, slight, temp, ., third, day, like, nothing, ever, happened, ., but, relieved, folded_handsraising_handsOK_hand"
