,0
26212,"they, are, not, i, stories, i, they, are, people, i, i, lives, ., we, lost, my, sister, -, in, -, law, friday, after, she, suffered, hemorrhagic, stroke, two, weeks, after, pfizer, ., reality, is, many, medications, /, vaccines, /, treatments, etc, ., are, even, approved, &, amp, ;, then, later, pulled, shelves, due, safety, reasons"
26213,"good, you, i, booked, one, this, week, as, well, pfizer, #, two, ., original, two thousand and twenty, plans, :, visit, all, one hundred and two, counties, by, my, with, birthday, this, june, ., i, will, feel, lucky, just, turn, forty, two, months, ., trip, schedule, tad, ., enjoy, your, post, van, adventures, face_with_medical_maskglobe_showing_Americassyringe"
26214,"i, got, pfizer, too, ,, i, i, ve, heard, least, side, effects, it, honestly, ., if, you, do, feel, sick, at, all, just, remember, it, i, i, your, body, doing, what, it, i, i, supposed"
26215,"i, i, ve, only, had, first, dose, but, no, ,, i, was, tired, as, hell, but, that, i, i, it, ., flip, side, my, cousin, got, same, one, at, different, location, felt, fine, ., i, do, feel, like, i, hear, abt, more, severe, symptoms, with, modern, which, is, why, i, wanted, pfizer, but, overall, i, i, i, good"
26216,"i, haven, i, i, heard, that, happening, frequently, ., i, think, choice, comes, with, location, you, pick, but, most, locations, only, have, one, option, ., i, actually, preferred, pfizer, but, couldn, i, i, find, spot, so, i, settled, modern, at, cos, ,, might, be, different, if, you, go, thru, your, own, do, ink"
26217,"good, news, because, many, of, our, parents, gave, them, the, first, dose, of, pfizer, three, or, four, weeks, ago, and, they, are, due, the, two, doses"
26218,"In, no, country, in, the, world, is, the, use, of, any, vaccine, authorized, for, minors, ,, it, is, conducting, trials, in, children, ,, but, there, is, still, at, least, six, more, months, to, give, final, results, ., they, are, not, enchiladas, person_facepalming, i, male_sign, i, person_facepalming, i, male_sign, i, person_facepalming, i, male_sign, i"
26219,"i, only, had, sore, arm, with, pfizer, #, one"
26220,"i, received, my, pfizer, vaccines, at, university, washington, medical, center, ., at, dose, #, one, we, were, told, that, we, could, receive, dose, #, two, between, twentynine, -, forty-two, days, be, fully, covered, ., all, available, slots, were, over, thirty, days, out, when, i, was, allowed, schedule, ., #, pfizerinterval"
26221,"we, i, re, pfizer, buddies"
26222,"which, maxx, i, got, pfizer, my, arm, was, less, sore, than, flu, shot, ., i, felt, fine, ., but, people, say, second, shot, is, worse, as, far, as, side, effects, ,, especially, with, modern, ., i, i, ve, also, heard, if, est, shot, is, bad, you, may, have, had, couid, didn, i, i, know, it, ."
26223,"i, received, my, and, dose, pfizer, vaccine, texas, great, example, world, ., besides, israel, usa, got, it, right, made, right, call, its, people, since, jan, two thousand and twenty, here, ,, i, don, i, i, have, be, politician, i, i, friend, ,, government, official, or, be, older, than, eighty, have, vaccine"
26224,"me, :, i, can, i, i, wait, get, this, vaccine, is, it, pfizer, nurse, :, no, ., me, :, modern, nurse, :, no, ., me, :, astrazeneca, nurse, :, uh, ,, no, ."
26225,"do, it, -, although, i, am, quite, happy, with, my, pfizer, ., enjoying, yoga, -, wish, i, would, have, started, way, back, when, i, i, i, said, downward, dog, ,, marine, -, now, breathe, i"
26226,"pfizer, halts, delivery, couid, -, nineteen, vaccines, i, banana, republic, i, israel, after, bill, goes, unpaid, amid, political, infighting, i, media, i, it, world, news"
26227,"why, can, i, i, i, get, pfizer, first, half, modern, second, like, vaccine, arnold, palmer, ."
26228,"got, first, dose, couid, -, nineteen, vaccine, ., #, pfizer"
26229,"excited, getting, my, and, dose, pfizer, morning, ., it, i, i, been, long, haul, but, with, continued, patience, ,, common, sense, &, amp, ;, listening, experts, light, is, getting, brighter, as, we, get, closer, end, tunnel, ."
26230,"get, my, and, shot, pfizer, four, /, six, at, one, :, 45pm, eastern, ., i, i, i, so, excited, ."
26231,"#, grabyourwallet, boycott, these, companies, send, message, inch, #, votingisaright, #, gopvotersuppression"
26232,"walgreens, u, went, offered, pfizer, wow, i, couldn, i, i, find, one, that, offered, that, ."
26233,"i, thought, you, today, when, i, got, my, est, dose, pfizer, vaccine, ..., smiling_face_with_sunglassesthumbs_up"
26234,"baylor, =, modern, gonza, =, pfizer"
26235,"i, i, i, like, thank, all, scientists, &, amp, ;, people, who, work, ,, as, well, as, all, people, who, worked, hard, conjunction, i, /, them, develop, &, amp, ;, emergency, register, their, #, covid19, vaccine, ., we, volunteered, @, vaccination, clinic, today, i, /, &, amp, ;, got, vaccinated, too, ., #, thankful"
26236,"there, are, at, least, three, ,, but, it, depends, on, where, you, sign, up, ., at, the, public, vaccinatory, in, berkeley, there, is, a, choice, between, i, and, modern, ,, but, I, don, ', i, qualify, for, that, vaccinatory, so, I, noticed, at, walmart, that, it, says, it, has, pfizer, ."
26237,"four, ., mrna, research, has, been, going, decades, ,, pfizer, modern, had, it, ready, soon, after, chinese, sequenced, microbe, ., warp, speed, just, shortened, time, market, ."
26238,"got, that, pfizer, thing, ."
26239,"also, my, entire, bottom, half, my, face, broke, out, weird, hives, acne, combo, overnight, ,, but, i, also, spent, almost, entire, day, before, double, masked, so, lol, who, knows, ., also, i, got, pfizer, few, i, was, monitored, thirty, after, &, amp, ;, it, was, next, er, as, per, mast, society, guidelines"
26240,"say, hi, roger, ., apparently, he, likes, stop, what, he, i, i, doing, shoot, camera, his, best, blue, steel, ., #, onedownonetogo, #, pfizer, #, takeonefortheteam, @, portland, ,, oregon"
26241,"but, really, ,, don, ', i, get, homo, ,, get, pfizer, or, modern, /, johnson, +, johnson, ."
26242,"we, i, all, do, rematch, ., you, team, pfizer, i, i, i, team, pfizer, ."
26243,"my, dad, is, sixty, years, old, yesterday, received, his, second, dose, pfizer, vaccine, ., i, asked, him, how, he, felt, today, he, said, he, peloton, i, i, went, run, ., dad, strength, is, so, real, ."
26244,"i, wife, lois, had, our, second, pfizer, vaccine, month, ago, ., we, are, safe, year, ., are, you, don, i, i, be, feeble, one, who, is, duped, ,, don, i, i, refuse, shot, die, as, denier, science, ., don, i, i, drink, trump, i, i, cool, aid, poison, ., he, cares, nothing, about, you, ."
26245,"*, sighs, *, pfizer, or, modern"
26246,"got, my, second, pfizer, saturday, ,, so, couple, weeks, i, will, be, ."
26247,"so, far, with, est, shot, sore, arm, tired, i, ', all, let, u, know, about, and, three, weeks, i, got, pfizer, one"
26248,"yes, definitely, ., i, got, my, est, dose, pfizer, vaccine, early, this, morning, ,, going, outside, after, work, at, four, :, to, i, wore, two, masks, ., i, double, up, ., face_with_medical_maskcrossed_fingers"
26249,"second, pfizer, shot, march, just, now, question, how, many, other, shots, are, down, road"
26250,"i, want, i, &, amp, ;, i, one, ,, but, i, don, i, i, have, that, option, ., only, one, i, can, get, is, pfizer, ."
26251,"pfizer, gang, gang, syringe"
26252,"The, new, batch, of, pfizer, air, has, arrived, ."
26253,"faci, says, two, doses, pfizer, ', i, or, modern, ', i, couid, vaccines, are, better, than, one, protect, against, variants"
26254,"me, ,, once, i, get, that, second, dose, pfizer"
26255,"put, couid, -, nineteen, vaccine, terms, :, looks, twelve, -, twentyfour, hours, post, second, pfizer, dose, looks, two, weeks, post, second, does, ., #, sideeffectsvsfullyvaccinated, winking_face_with_tonguerolling_on_the_floor_laughingupside, -, down_facesyringeadhesive_bandage, #, ncaachampionship, #, iworkinhealthcare, #, isitthroughlotsofinterviews, #, isittimeforoneshiningmoment, #, blessed"
26256,"got, and, pfizer, today, ."
26257,"it, was, just, first, one, grimacing_face, ., my, arm, was, sore, after, est, pfizer, but, and, -, yeow"
26258,"yay, congratulations, &, amp, ;, welcome, club, i, had, my, first, dose, pfizer, march, four, ,, second, march, twenty-six, ., clapping_handsmedium, -, light_skin_toneclapping_handsmedium, -, light_skin_tone"
26259,"supposedly, it, i, i, possible, side, effect, pfizer, people, who, had, couid"
26260,"y, i, all, should, get, your, vaccine, #, vaccinated, #, pfizer"
26261,"i, get, my, second, dose, pfizer, vaccine, tomorrow, crossed_fingersmedium, -, dark_skin_tone"
26262,"my, daughter, also, got, her, second, shot, today, so, relieved"
26263,":, please, be, lookout, any, private, jets, heading, these, backhand_index_pointing_down, communities, ..., you, know, ,, just, case, ., #, covid19, #, vaccines, #, covishield, #, coax, #, pfizer, #, astrazeneca, #, modern, #, johnsonandjohnson, #, coli, #, beg"
26264,"just, for, your, peace, of, mind, one, dose, of, pfizer, is, quite, effective, in, reducing, fatalities, ."
26265,"pfizer, ., about, sixty, hours, after, shot, ,, five, hours, full, chills, aches, ."
26266,"i, ', i, having, that, after, my, and, dose, pfizer, ., my, doc, did, blood, tests, that, are, normal, ."
26267,"mo, ago, i, got, my, pfizer, vaccine, &, amp, ;, despite, being, i, grateful, receive, it, ,, i, was, filled, with, guilt, that, my, family, ,, friends, &, amp, ;, community, did, not, have, same, privilege, ., today, ,, i, got, chance, give, back, by, vaccinating, our, seniors, &, amp, ;, i, couldn, i, i, be, happier, smiling_face_with_heartsfolded_handsmedium, -, light_skin_tone, #, covidvaccine, syringemicrobe"
26268,"hello, do, gately, today, I, received, the, est, ., dose, of, pfizer, I, thank, all, those, who, participate, in, this, day, of, vaccination, against, covid19, ."
26269,"having, really, bad, shoulder, pain, my, first, pfizer, shot, :"
26270,"got, our, first, #, pfizer, today, #, happydance, all, staff, at, vic, were, awesome"
26271,"my, girlfriend, just, got, her, est, vaccine, tonight, i, couldn, ', i, be, more, relieved, ., she, said, they, were, amazing, at, #, boardwalk, clinic, it, was, like, party, inside, with, everyone, so, happy, being, vaccinated, ., social, distancing, amazing, staff, ."
26272,"according, my, friends, pfizer, isn, i, i, only, shot, ill, be, getting, today, #, 42inmylips"
26273,"i, got, my, pfizer, one, yesterday, no, effects, then, ., today, ,, just, sore, upper, arm, ..., that, i, i, it, ."
26274,"what, ', i, most, common, pfizer, side, effect"
26275,"got, my, second, pfizer, dose, today, partying_face, my, arm, hurts, so, bad, but, at, least, end, is, sight"
26276,"had, my, second, pfizer, shot, friday"
26277,"hey, ,, sean, i, want, this, action, he, gets, pfizer, two, two, weeks, ,, i, got, i, &, amp, ;, i, today, thanks, red_heart, i, syringe"
26278,"no, pfizer, but, ,, guy, below, must, have, had, i, very, bad, reaction, i, syringe"
26279,"i, think, it, ', i, sensible, move, close, test, &, amp, ;, focus, may, ., as, indy, -, based, photographer, representing, french, media, company, ,, i, am, keeping, my, fingers, crossed, both, fan, media, access, may, i, got, pfizer, vaccine, shots, so, i, am, ready, go, work"
26280,"pfizer, gang, where, y, i, all, at, face_with_steam_from_nose, fire, sign_of_the_hornslight_skin_tone"
26281,"had, go, swim, cool, off, gym, today, cause, earlier, i, was, pfizer"
26282,"damn, ,, i, gotta, get, me, whatever, vaccine, this, guy, got, ., pfizer, one, ., zero, just, gave, me, light, headache, sore, arm, ."
26283,"grateful, get, vaccinated, pfizer, wednesday"
26284,"if, anyone, is, trying, vaccinated, ,, they, i, re, doing, pfizer, vaccinations, at, segerstrom, high, school, today, until, six, gooooooooooooooooo"
26285,"team, pfizer, this, beaux, #, dose"
26286,"annd, i, have, my, first, appointment, set, this, saturday, at, am, get, my, first, jab, pfizer, vaccine, ., woot, bring, it, all, on, ., i, am, so, ready, be, done, with, couid, ., i, ', ve, been, wearing, mask, at, work, every, day, past, year, face_with_medical_mask, ., over, it, lol, ., #, getvaccinated"
26287,"i, i, i, getting, my, second, modern, tomorrow, ., i, have, also, experienced, pfizer, jealousy, these, last, couple, weeks, ., almost, there, ,, tho"
26288,"did, they, not, read, what, submitted, fda"
26289,"first, pfizer, vaccine, dose, books"
26290,"pfizer, one, i, heard, is, one, everybody, wants"
26291,"they, finally, sent, me, my, vaccine, email, ,, i, ', i, finally, hot, girl, pfizer"
26292,"i, only, had, soreness, my, arms, few, days, after, est, pfizer, shot, ., i, got, and, shot, today, about, eight, hours, ago, ,, so, far, ,, just, little, soreness, near, shot, site, ."
26293,"i, read, that, there, ', i, been, six hundred and ninety-six, deaths, as, this, morning, pfizer, vaccination, ., you, can, find, that, information, cac, website, ., can, you, fact, check, that"
26294,"Today, is, a, very, special, day, since, I, got, the, first, dose, of, the, #, vacunacovid19, vaccine, from, #, pfizer, ., Hopefully, very, soon, we, can, all, be, vaccinated, and, get, out, of, this, horrible, pandemic, that, has, caused, us, so, much, pain, and, suffering, ., #, yomevacuno"
26295,"thursday, ,, april, ith, ., team, pfizer, ., boola"
26296,"vaccinated, with, first, pfizer, dose, #, thekeithratnershow"
26297,"my, arm, is, killing, me, ,, but, at, least, i, i, all, be, pfizer, fine, soon, ."
26298,"pfizer, *, woozy_face"
26299,"couid, vaccine, :, faci, says, two, shots, pfizer, or, modern, are, better, than, one"
26300,"feeling, pfizer, dose, one, is, checkmark, i, ., i, was, little, emotional, seeing, all, people, filtering, out, ,, nervously, waiting, line, ,, or, observation, ,, how, kind, ,, respectful, ,, professional, staff, was, with, everyone, ., still, hard, imagine, how, we, got, here, ,, how, far, we, i, ve, come, ."
26301,"My, family, members, are, all, pfizer, and, their, reactions, are, not, too, bad, ."
26302,"no, side, effects, me"
26303,"just, scheduled, my, first, vaccine, appointment, wednesday, let, i, i, get, valued, ,, y, i, all, syringe, #, vaccine, #, pfizer"
26304,选的pfizerface_with_hand_over_mouthface_with_tears_of_joy
26305,"yeah, pfizer, is, elite, van, elite, people, ., hundred_points"
26306,"fully, valued, syringe, #, highriskca, #, disabledandcute, #, asthma, #, pfizer"
26307,"/, i, i, i, getting, my, and, pfizer, four, /, twenty-seven"
26308,"pfizer, twice, ., headache, ,, sore, arm, fatigue, both, times, ., just, enough, make, my, coworkers, think, i, was, faking, it, when, i, went, home"
26309,"just, few, hours, away, getting, my, second, pfizer, shot, tomorrow, ., i, can, ', i, wait, ."
26310,"i, ', i, fully, #, vaccinated, thank, you, ,, #, vaccination, #, vaccinepassports, #, vaccinetime, #, vaccine, #, vaccines"
26311,"okay, ,, but, where, can, sixteen, /, seventeen, get, vaccinated, no, one, posts, what, vaccines, they, have, ,, but, only, pfizer, is, approved, teens, ."
26312,"team, pfizer, so, screw, off, budday"
26313,"whoa, ., i, just, got, second, pfizer, shot, dosed, myself, with, enough, tincture, tranq, elephant, ., so, this, is, spot, on, ., textual, fist, bump"
26314,"est, vaccine, pfizer, ., @, walgreens"
26315,"#, salvador, |, The, Minister, of, Health, ,, Francisco, alibi, ,, affirms, that, the, people, who, received, the, Pfizer, vaccine, could, receive, the, second, dose, this, week, ,, since, it, would, be, twentynine, days, since, the, first, dose, ."
26316,"#, pfizer, #, vaccine, #, weeeeeeeeee"
26317,"pfizer, ,, no, pain, or, side, effects"
26318,"after, my, second, dose, pfizer, ,, according, cac, ,, i, don, i, i, have, wear, mask, face_with_medical_mask, when, gathering, with, others, who, have, been, vaccinated, also, don, i, i, have, stay, six, feet, apart, ., that, i, i, fresh"
26319,"yay, i, i, ve, taken, my, two, pfizer, shots, clapping_handsclapping_handsclapping_handstwo_hearts"
26320,"also, it, i, i, bit, surreal, have, gotten, pfizer, vaccine, take, any, you, can, get, ,, having, grown, up, near, facility, where, it, i, i, made, portage, ,, with, family, friends, who, have, worked, there, since, it, was, upon, ,, then, pharmacy, ,, now, pfizer, ., driving, by, it, countless, times, ., smiling_face_with_hearts"
26321,"federal, officials, told, ., follow, their, guidance, timing, second, dose, ., vaccine, i, three, weeks, later, i, after, they, discovered, company, was, administering, it, four, weeks, later, match, ., appointment, schedule, ."
26322,"after, my, second, dose, pfizer, ,, according, cac, ,, i, don, i, i, have, wear, mask, face_with_medical_mask, when, gathering, with, others, who, have, been, vaccinated, also"
26323,"est, pfizer, done, ., i, think, everyone, else, here, also, drove, la, i, overheard, i, thank, you, wil, wheaton, i, ., check, -, in, post, waiting, area, took, all, mins, ., everyone, i, encountered, was, so, helpful, nice, ., i, feel, incredible, relief, ., so, glad, i, went, ."
26324,"saw, homie, taking, my, est, pfizer, syringe, ."
26325,"pfizer, ,, est, no, reaction, ., and, sore, arm, headache, day, ."
26326,"got, my, first, pfizer, vaccine, today"
26327,"yes, ,, you, can, ask, what, safeway, has, or, local, hospital, ., choices, where, we, are, is, still, modern, or, pfizer, ."
26328,"no, side, effects, ., received, pfizer, vaccine, ."
26329,"today, i, received, my, first, dose, pfizer, vaccine, ., quick, ,, easy, painless"
26330,"riley, come, visit, me, ,, as, soon, as, i, am, not, homeless, ,, fourteen, -, twentynine, days, depending, if, we, can, get, you, pfizer, or, modern, ,, or, thirty-five, full, immunity, either, ,, challenge, although, u, might, have, quarantine, fourteen, days, re, -, entering, canada, anyway, unless, they, change, that, ugh"
26331,"you, have, to, do, the, math, ..., between, twentynine, and, forty-two, days, if, the, vaccine, was, from, pfizer"
26332,"double, masking, still, ,, two, weeks, past, and, pfizer, ., too, many, mask, under, nose, morons, around, ."
26333,"drinks, #, pfizer, -, approved, martini"
26334,"you, should, report, these, symptoms, pfizer, ,, so, they, can, track, them, ., i, say, this, as, someone, who, works, biotech, ,, but, yay, getting, it, partying_face"
26335,"just, got, first, dose, pfizer, vaccine, i, think, i, like, boys, now"
26336,"i, i, i, about, go, get, pfizer, ."
26337,"if, you, wanted, know, how, vaccine, rollout, is, going, iowa, i, am, considering, driving, four, ., five, hours, one, way, nebraska, get, my, vaccine, ., they, only, have, modern, pfizer, which, means, i, i, all, have, take, two, days, off, work, do, ten, hours, driving, each, day, ."
26338,"modern, is, supposed, be, twenty-eight, days, apart, i, so, that, ', i, normal, ., pfizer, is, twentynine, days, apart, but, walgreens, was, spacing, it, twenty-eight, days, ."
26339,"48hrs, post, pfizer, dose, two, :, basically, ,, back, normal, functioning, again, ., was, little, foggy, this, morning, ,, but, no, additional, tylenol, &, amp, ;, i, feel, ok, ., if, that, i, i, worst, it, ,, i, i, i, good, ., now, get, daughter, shot, or, two, ."
26340,"let, i, i, go, pfizer, babyyyyyy"
26341,"i, react, no, vaccines, ., pfizer, same, ., both, jabs, ., my, mother, had, same, experience, ., husband, always, gets, sick, sick, after, first, modern, ."
26342,"just, got, my, second, pfizer, too, today, ., feeling, very, grateful, ."
26343,"i, i, ve, had, both, shots, three, weeks, apart, i, pfizer, ., sore, arm, both, times, ., three, or, so, days, after, shot, one, ., arm, hurt, more, thirty-four, hours, after, shot, two, ,, but, pain, gone, next, day, ."
26344,"my, wife, i, went, same, place, county, public, health, center, ,, different, days, ., she, got, pfizer, ., i, got, modern, ., depends, what, they, had, at, time, ."
26345,"walgreens, not, following, u, ., i, ., guidance, pfizer, vaccine, spacing"
26346,"i, just, received, my, first, dose, pfizer, couid, -, nineteen, vaccine, at, south, county, regional, center, arroyo, grande, ,, ca, ., this, california, girl, is, ecstatic, ., thank, you, governor, newsome, laura, nurse, who, vaccinated, me, ;, all, other, volunteers, here, serving, community, ."
26347,"so, quick, update, my, symptoms, and, pfizer, shot, :, -, chills, -, fatigue, -, arm, pain, -, headaches, -, fevers, -, muscle, aches, yesterday, -, experienced, symptoms, all, one, day, waves, ., face_with_medical_mask, today, -, i, feel, much, better, with, very, light, symptoms, ., smiling_face_with_sunglasses"
26348,"trying, not, dance, my, chair, at, moscone, center, because, i, just, got, my, second, pfizer, shot, everything, went, very, fast, today, ., if, we, didn, i, i, have, wait, after, ,, we, would, i, ve, been, &, amp, ;, out, i, /, i, fifteen, minutes, ."
26349,"i, got, pfizer, ., handout, was, pfizer, &, amp, ;, modern, ., your, mileage, may, vary, ,, i, suggest, you, take, first, one, you, get, offered, ..."
26350,amen
26351,"team, pfizer, here, ,, forever, grateful, ."
26352,"hahahaha, omg, ., jeff, i, all, be, like, i, rayden, ,, do, you, think, you, did, so, badly, this, challenge, because, you, got, pfizer, i, or, i, lauren, ,, would, this, tribe, have, less, leadership, problem, if, you, weren, i, i, modern, i"
26353,"vaccination, completed, #, pfizer, #, covid19vaccine, hospital, @, university, texas, at, dallas"
26354,"i, got, my, second, pfizer, shot, at, gwinnett, place, mall, today, so, i, i, i, now, fully, vaccinated, #, covid19, ., now, ,, let, i, i, see, how, things, go, this, time, around"
26355,"here, i, i, me, ,, already, busy, making, proteins, per, pfizer, i, i, mrna, specifications, ., i, i, i, not, best, at, following, instructions, ,, so, i, hope, i, get, this, right, ."
26356,"Boston, ,, five, min, wait, ,, five, min, from, the, vaccination, ,, fifteen, min, of, further, anti, -, scion, wait, and, go, ., forty-nine, vaccination, stations, ., convention, center, center, ,, well, organized, ., pfizer, ,, we, see, smiling_face_with_halosmiling_face_with_halo"
26357,"just, got, my, pfizer, -, biotech, vaccine, so, thankful, ., just, wish, we, could, get, these, arms, quicker, ., #, covid19, #, vaccinated, #, pfizer, #, covid19ontario, #, covid19canada"
26358,"my, favorite, thing, is, people, thinking, pfizer, ', i, &, amp, ;, us, gov, ', i, actions, here, is, proof, that, vaccine, is, some, whackjob, poison, or, conspiratorial, world, control, thing, as, if, this, sort, behavior, isn, ', i, what, western, multinationals, it, ', i, goes, do, regular, developing, world"
26359,"thinking_face, dye, pfizer, couid, -, nineteen, vaccine, is, currently, only, approved, vaccine, sixteen, i, modern, i, &, amp, ;, i, are, approved, those, eighteen, i, visit, our, interactive, map, learn, which, vaccine, is, being, given, at, vaccination, locations, :"
26360,"i, got, pfizer, after, est, dose, i, was, so, damn, sleepy, my, arm, hurt, ., hopefully, i, don, i, i, feel, like, that, after, my, and, dose, ha"
26361,"out, less, than, hour, ., first, dose, pfizer, our, arms, ., so, grateful, efficiency, professionalism, at, site, ., #, ᴠᴀᴄᴄɪɴᴇssᴀᴠᴇʟɪᴠᴇs, #, trilliumhealthpartners"
26362,"&, it, ;, pfizer, bullying, latin, american, companies, ,, i, mean, countries, lol, thank, u, autocorrect"
26363,"so, a, lucky, and, privileged, :, two, pfizer, vaccines, and, no, longer, wears, the, mask"
26364,"&, it, ;, pfizer, bullying, latin, american, companies, ,, holding, them, ransom, over, continued, deaths, pandemic, if, they, refuse, sign, agreements, including, liability, protections, if, pfizer, sends, wrong, vaccine, &, amp, ;, putting, these, governments, hook, lawsuits"
26365,"awesome, i, got, my, second, dose, pfizer, version, trump, vaccine, friday, ., i, ', i, good, go"
26366,"i, had, wait, thirty, mins, because, i, have, anaphylactic, reactions, penicillin, amoxicillin, ., i, did, fine, my, two, pfizer, shots, ., just, sore, where, vaccinated, ."
26367,"sorry, ,, thrombocytopenia, clot, risk, has, been, reported, younger, age, folks, with, modern, pfizer, as, well, ., but, not, higher, than, general, population, ., same, with, az, ,, right, folks, ignore, former, ,, focus, latter, as, unsafe"
26368,"just, got, my, second, pfizer, ., sitting, observation, now"
26369,"yes, ..., with, dose, #, two, pfizer, ..., i, had, soreness, at, injection, site, body, aches, ."
26370,"had, my, first, dose, pfizer, vaccine, earlier, today, ., except, little, tenderness, around, area, no, other, reaction, ,, fingers, crossed, ., face_with_medical_maskcrossed_fingerssmiling_face, i"
26371,"pfizer, isn, i, i, choice, any, time, soon, ,, but, i, can, get, i, &, amp, ;, i, friday, night, ., even, if, i, i, i, sick, few, days, it, i, all, be, over, weekend, ."
26372,"meanwhile, i, just, got, my, first, couid, -, nineteen, shot, pfizer, had, wait, thirty, minutes, because, i, i, i, classified, as, i, very, high, risk, i, because, my, allergies, ibuprofen, shellfish, ., my, second, dose, is, three, weeks, ."
26373,"i, got, my, second, dose, pfizer, version, trump, vaccine, friday, ., side, effects, weren, ', i, as, bad, as, they, were, first, dose, ., now, y, ', all, can, take, this, mask, shove, it"
26374,"got, pfizer, feel, fine, ."
26375,"pfizer, by, sparklesglowing_star"
26376,"i, had, pfizer, no, side, effects, ., my, eighty-seven, year, old, mother, got, modern, no, side, effects, ., it, depends, individual, i, think, ., you, i, all, be, glad, you, got, it"
26377,"pfizer, ., hope, it, i, i, good, one, ., i, got, walk, appointment, so, wasn, i, i, chipset"
26378,"new, york, times, :, walgreens, not, following, u, ., i, ., guidance, pfizer, vaccine, spacing, ., via"
26379,"pfizer, second, shot, knocked, me, out, ,, severe, fatigue, two, days, ., no"
