,0
28716,"i, get, my, and, dose, pfizer, shot, today, ., wish, me, luck, ., lol, happy, though, ., can, ', i, wait, ., thumbs_uphandshakesyringe"
28717,"she, got, pfizer, ."
28718,"this, mama, finally, did, it, got, my, est, dose, pfizer, ., feeling, relief, is, amazing, &, amp, ;, because, i, i, i, breastfeeding, i, look, forward, passing, antibodies, baby, girl, ., thanks, all, wonderful, nurses, volunteering, at, couid, clinic, ."
28719,"got, pfizer, ., first, dose, i, had, chills, body, aches, two, days, ., first, day, i, just, knocked, out, when, i, got, home, ., arm, soreness, lasted, abt, two, half, days, ., and, dose, was, same, ."
28720,"good, hear, question, ,, was, this, part, tax, deal, pfizer, made, with, portage, what, was, original, job, projection, at, that, time, just, asking, ."
28721,"first, round, pfizer, couid, vaccination, is, no, joke, ., i, feel, like, absolute, shit, ."
28722,"i, just, googled, it, i, it, sounds, like, one, pfizer, is, only, fifty, %, effective, ., i, hope, you, i, re, right, ., couid, facts, have, always, been, ever, -, changing, thing"
28723,"i, got, modern, instead, pfizer, pensive_face"
28724,"and, dose, pfizer, check_mark_button, ahghgh"
28725,"omg, i, got, my, #, firstshot, voice, it, didn, i, i, even, burn, ., #, gotvacinnated, yay"
28726,"only, vaccine, that, has, antibodies, different, variants, couid, is, pfizer, vaccine, ., remember, this, when, you, book, your, vaccines, ."
28727,"i, had, my, second, pfizer, shot, saturday, my, arm, was, sore, i, ran, little, fever, few, hours, but, that, was, it, ., feeling, fine, now, ., i, hope, you, have, easy, time, with, your, shots, too, ., folded_handstwo_hearts"
28728,"just, got, my, first, dose, vaccine, ., i, promise, live, tweet, any, all, bizarre, side, effects, ., fingers, crossed, animal, magnetism, #, pfizer"
28729,"pfizer, dose, one, /, two, my, body, fighting, off, covidina, with"
28730,"i, got, modern, as, well, ., studies, show, pfizer, be, tiny, bit, more, effective, ,, but, both, is, ,, so, no, biggie, ., dolly, parton, invested, modern, ,, so, it, has, that, going, it, ."
28731,"got, vaccinated, today, ...., where, my, pfizer, baddies, atexclamation_question_mark, i, exclamation_question_mark, i, exclamation_question_mark, i"
28732,"shot, one, pfizer, check_mark_button, nice, in, -, and, -, out, thank, you, all, involved, #, vaccinated"
28733,"shot, two, vaccinecheck_mark_button, feeling, thankful, hopeful"
28734,"va, chicago, was, giving, out, pfizer, three, weeks, ago, my, first, shot, so, and, had, be, pfizer, ., not, sure, if, they, are, giving, out, i, &, amp, ;, i, one, shot, now, ., i, would, have, rather, had, one, &, amp, ;, done, with, that, but, am, ok, with, pfizer, ."
28735,"modern, call, me, pfizer, name, trophy, -, this, post, is, being, considered, tweet, year"
28736,"getting, my, second, pfizer, shot, april, twelve, getting, my, ass, plane, april, thirteen, bye, felicia"
28737,"my, day, ~, syringemedical_symbol, i, covidvacccine, #, pfizer, #, bellcounty, #, biped, @, bell, county, expo, center"
28738,"that, of, and, pfizer, shot, got, me, struuuugglin, today"
28739,"i, got, my, second, #, pfizer, #, covidvaccine, today, if, you, can, get, vaccine, ,, do, it"
28740,"just, got, vaccine, now, i, wanna, eat, this, baby, i, wanted, before, ,, but, now, i, i, i, vaccinated"
28741,"pfizer, ..., i, really, wanted, i, &, amp, ;, i, ,, one, done, ,, but, i, couldn, i, i, find, it, ,, so, i, took, what, was, available"
28742,"once, i, get, this, pfizer, my, body, it, i, i, really, up, for"
28743,"modern, ,, pfizer, small, shot, could, save, your, life, get, it, now, ,, my, friends, #, haikutacotuesday"
28744,"i, got, my, first, pfizer, vaccine, i, mean, my, arm, is, little, sore, but, ,, its, nothing"
28745,"i, had, pfizer, shots, february, ., no, problems, at, all"
28746,"got, vaccine, shot, first, day, age, thirty, +, ny, face_with_tears_of_joyperson_tipping_handmedium, -, dark_skin_tone, i, male_sign, i, pfizer, finesse"
28747,"i, got, pfizer, shot, ."
28748,"grateful, that, i, was, able, get, my, second, pfizer, couid, -, nineteen, vaccination, syringe, today, it, was, easy, schedule, painless, ., i, had, arm, soreness, with, est, but, haven, i, i, felt, anything, with, and, ., do, it, &, amp, ;, keep, masking, up, ., as, said, i, i, am, not, throwing, away, my, shot, i"
28749,"pfizer, #, one"
28750,"i, went, plan, your, vaccine, followed, boxes, there, ., super, easy, ., i, was, hooked, up, with, cos, pharmacy, that, was, fourteen, miles, away, ., i, probably, could, have, gotten, location, closer, home, but, i, wanted, pfizer, vaccine, my, own, reasons, ., google, it, give, it, try, ."
28751,"call, coburn, i, i, pharmacy, locations, ., they, i, ve, had, lot, openings, pfizer, modern"
28752,"got, my, and, pfizer, dose, i, i, i, officially, vaccinated"
28753,"i, wanted, dolly, microchip, face_with_steam_from_nose, i, got, pfizer, one"
28754,"i, got, pfizer, /, biotech, jab, which, is, seemingly, most, effective, against, variants, as, well, costco, shopping, tomorrow, ..., very, excited"
28755,"shot, #, two, full, pfizer, juice, nausea, #, van, #, vaxxedsyringe, #, immunocompromised, @, blue, bell, ,, pennsylvania"
28756,"i, i, i, ready, this, last, pfizer, dose, tomorrow, ., about, live, life, again"
28757,"what, happens, if, u, get, one, modern, one, pfizer, screenshot"
28758,"hello, hello, pfizer, friend, take, some, tylenol, five hundred, my, every, six, -, eight, hours, ., glad, you, got, your, shot, we, need, our, jenn, this, crazy, world, with, us"
28759,"drugs, pfizer, kicking"
28760,"definitely, too, many, slow, person_facepalmingmedium, -, light_skin_tone, i, male_sign, i, I, continue, to, be, a, lucky, one, ...., Thursday, according, to, shots, pfizer, ."
28761,"i, got, pfizer, vaccine, fyi, so, far, only, have, very, slightly, sore, arm, ,, no, issues"
28762,"received, my, first, dose, pfizer, vaccine, yesterday, left, arm, is, sore, ,, i, i, ve, received, numerous, des, asking, about, my, well, being, ., i, am, fine, ,, little, lightheaded, as, i, type, but, everything, seems, be, one hundred and seventy-four thousand, nine hundred and twenty-six, ., eighty-four thousand, six hundred and twenty-nine, ., four hundred and eighty-three thousand, six hundred and twenty, ., five hundred and ninety-two thousand, five hundred and twenty-nine, ., seven million, two hundred and thirteen thousand, seven hundred and fifty, ., three hundred and two thousand, six hundred and fifty-nine, ., three hundred and seventy-four thousand, six hundred and ninety-two, ., seven hundred and sixteen thousand, four hundred and ninety-four"
28763,"pfizer, ,, murfreesboro, edition, ., got, shot, yesterday, around, eleven, am, ,, symptoms, didn, i, i, kick, until, middle, night"
28764,"hell, yeah, pfizer, shot, #, two, :, complete, @, stephenville, ,, texas"
28765,"received, my, first, dose, pfizer, vaccine, i, i, i, feeling, quite, fatigued, have, headache, ,, acute, sense, superiority, face_with_tears_of_joy, i, i, i, just, so, stoked, have, my, first, dose"
28766,"i, got, pfizer, was, knocked, out, few, days, lol"
28767,"post, second, pfizer, dose, by, one, month, ., other, than, temporary, tenderness, at, injection, site, ,, no, issues, whatsoever, with, either, dose, ., drink, lots, water, day, before, ,, day, day, after, vaccine, ., you, ', all, be, fine, ."
28768,"yes, ., i, i, ve, had, both, doses, pfizer, ."
28769,"pfizer, shot, number, two, #, vaccinate, #, couid, -, nineteen, #, pandemic, #, life, #, adventuretravel, #, solotravel, @, riverside, indian, school, anadarko, ,, ok"
28770,"i, got, my, first, couid, -, nineteen, vaccine, recently, myself, ., i, i, i, not, sure, if, it, was, pfizer, ,, though, ."
28771,"i, i, i, pfizer, guy, as, well, ,, can, i, i, wait, be, bleacher, guy, again, soon, ., hundred_points"
28772,"shot, was, free, ,, but, we, may, still, face, cops, ambulance, ride, hospital, monitoring, ., i, think, pfizer, should, pay, ,, but, that, won, i, i, happen, ."
28773,"thanks, jim, i, i, i, mad, that, pfizer, knew, about, anaphylactic, reactions, ,, but, their, questionnaire, only, ask, if, you, have, had, allergic, reaction, medications, ., hers, were, bee, sting, bay, leaves, food, ., she, is, surgery, right, now, ,, should, be, done, soon, ., hopefully, no, complications, ."
28774,"person_raising_handlight_skin_tone, i, female_sign, i, yes, ,, pfizer, ,, est, vaccination, ., no, issues, ., it, was, also, question, asked, form, completed, by, nurse, administering, shot, ."
28775,"i, have, severe, allergy, dye, ,, penicillin, other, antibiotics, ., have, had, anaphylaxis, with, at, least, one, ., i, had, both, pfizer, vaccines, with, no, side, effects, except, sore, arm, ., waited, thirty, mins, after, each, dose, ."
28776,"shots, ,, shots, ,, shots, entire, norton, family, will, be, fully, vaccinated, by, may, est, i, am, so, happy, syringesmiling_face_with_smiling_eyesred_heart, i, #, modern, #, pfizer"
28777,"getting, my, first, pfizer, shot, saturday, syringe"
28778,"got, my, second, dose, pfizer, vaccine, syringeraising_handsmedium_skin_tone, #, vaccinated"
28779,"shot, #, two, has, been, administered, ., thankful, have, received, both, shots, ., hoping, side, effects, are, light, thanks, folks, at, great, vaccination, pod, #, science, #, covidvaccine, #, pfizer"
28780,"line, place, pfizer, firing, squad, ., @, cape, cod, community, college"
28781,"getting, my, first, pfizer, vaccine, saturday, ., fuck, you, ,, coronavirus, ."
28782,"lol, there, i, i, still, time, move, up, i, i, all, be, checking, dailycrossed_fingersmedium, -, light_skin_tone"
28783,"no, side, effects, after, second, dose, pfizer, ., none, ., smiling_face_with_smiling_eyes"
28784,"congrats, let, me, know, how, you, i, re, feeling, like, twelve, i, ., i, got, pfizer, as, well, ."
28785,"jackson, co, ., health, department, is, offering, pfizer, walk, vaccine, clinic, @, carbonate, civic, center, &, amp, ;, sic, bacteria, center, il, residents, over, sixteen, ., anyone, under, eighteen, must, be, accompanied, by, parent, /, guardian, dates, times, :, three, /, thirty, nine, :, zero, -, seven, :, 45pm, four, /, one, nine, :, zero, -, seven, :, forty-five, am, four, /, two, ., nine, :, zero, -, five, :, forty-five, am"
28786,"i, ', ve, had, both, shots, ., modern, est, shot, no, problem, at, all, ., after, and, felt, little, rough, twentyfour, hours, then, no, problem, ., believe, me, it, easy, not, big, deal, ., my, wife, had, pfizer, had, no, reaction, either, shot, ."
28787,"more, appointments, :, has, hundreds, appointments, monday, four, /, five, available, now, ., looks, like, pfizer, vaccine, ,, which, means, anyone, sixteen, i, here, i, i, link, sign, up, :"
28788,"done, with, my, first, dose, ., house, pfizer, represent, #, fauciouchie, @, mercedes, -, benz, stadium"
28789,"i, got, pfizer, my, arm, hurt, just, little, first, day, ., i, actually, didn, i, i, notice, at, first, just, attributed, it, another, ache, brought, case, old"
28790,"they, were, collaborating, previously, influenza, ., but, pfizer, certainly, wants, technology, ,, i, expect, biotech, was, aware, that, going, in, ., whether, they, didn, i, i, want, become, part, pfizer, or, pfizer, thought, collaborating, is, better, before, technology, was, proven, ,, i, don, i, i, know, ."
28791,"pfizer, vaccine, #, two, ., done, thank, you, all, who, made, it, happen, ."
28792,"i, have, registered, second, dose, #, pfizer, vaccine, syringe, against, #, couid, @, robert, wood, johnson, university, hospital"
28793,"feeling, good, part, one, #, pfizer, #, covidvaccine, #, notthrowingawaymyshot"
28794,"that, is, ,, beto, is, the, one, who, rejected, twenty, i, from, pfizer, to, be, delivered, in, serial, in, october, or, the, one, who, did, not, close, twentyfive, i, from, i, &, amp, ;, i, for, june, in, december"
28795,"i, have, got, first, dose, #, pfizer, vaccine, syringe, against, #, covid19, @, robert, wood, johnson, university, hospital"
28796,"pfizer, was, already, developing, mrna, influenza, vaccine, with, them, ., but, yes, ,, it, seems, pretty, natural, that, after, having, success, couid, they, will, want, do, more, mrna, vaccines, ., you, seem, be, suggesting, there, i, i, something, unusual, or, suspect, here, ,, but, it, i, i, unclear, what, ."
28797,"hope, you, ', re, feeling, much, better, soon, ., as, you, said, ,, alternative, is, much, worse, ., i, get, my, and, shot, pfizer, four, /, six, ., gives, me, something, look, forward, to, ., lol, ., smiling_facetwo_hearts"
28798,"you, should, keep, intravenous, pfizer, drip, next, your, bed, ."
28799,"as, more, people, begin, vaccination, process, ,, doctors, are, stressing, importance, finishing, two, -, dose, regimen, people, receiving, pfizer, or, modern, i, i, couid, -, nineteen, vaccine, ."
28800,"all, your, article, says, is, that, pfizer, wants, develop, more, mrna, vaccines, ,, but, not, with, biotech, ., i, i, i, not, sure, why, you, think, it, i, i, point, any, issues, discussed, here, ,, though, it, is, certainly, interesting, ., article, doesn, i, i, suggest, ip, issues, at, this, point, ."
28801,"all, i, had, was, sore, arm, pfizer"
28802,"modern, and, pfizer, the, most, effective, vaccines, against, couid, ., Brazil, has, already, purchased, millions, of, Pfizer, vaccines, ."
28803,"if, she, i, i, under, eighteen, ,, make, sure, you, find, place, with, pfizer, ."
28804,"got, first, dose, pfizer, vaccine, yesterday, i, can, literally, feel, tiny, raquel, welch, inside, tiny, spaceship, with, tiny, jsoc, team, training, my, obese, ,, lazy, cells, how, fight, i, bona, ., #, covid19, #, yougogirl"
28805,"one, week, today, i, get, second, pfizer, shot, ., can, ', i, wait, ., almost, there, ."
28806,"i, i, i, glad, you, had, zero, reaction, pfizer, shot, ., my, wife, had, allergies, bee, stings, anaphylactic, shock, earlier, life, shot, caused, her, tongue, swell, blood, pressure, skyrocket, ., benadryl, steroid, ride, hospital, ., those, folks, should, get, modern, ."
28807,"which, hogwarts, house, are, you, pfizer, modern, or, johnson, &, amp, ;, johnson, i, i, i, modern, was, hoping, i, &, amp, ;, i, ., i, hate, getting, shots"
28808,"biden, said, he, didn, i, i, trust, trump, he, thought, trump, was, using, undue, political, pressure, force, approval, pfizer, before, election, ., he, said, specifically, he, trusted, scientists, he, trusted, vaccines, but, trump, should, let, approval, process, play, out, not, politicize, it, ."
28809,"sixteen, seventeen, year, olds, can, only, get, pfizer, ."
28810,"i, i, i, still, waiting, see, six, month, pfizer, data, ,, i, thought, we, would, see, it, by, now, ,, hopefully, it, i, i, not, bad, news"
28811,"i, do, i, got, my, first, pfizer, shot, already, ., no, reaction, whatsoever"
28812,"one, down, #, covid_19, #, covidvacccine, #, pfizer, #, justdoit, @, orange, county, convention, center"
28813,"good, news, :, and, they, have, increased, their, production, goal, of, #, covid19, #, vaccines, this, year, two, ., five, billion, doses, ..."
28814,"all, shepherd, i, i, are, our, way, being, vaccinated, yay, texas, opening, up, sixteen, year, olds, thanks, having, appointments, sixteen, up, with, pfizer, vaccine"
28815,"mil, :, same, thing, that, happened, your, kid, happened, his, cousin, us, :, yeah, it, sucks, mil, :, but, pharmacist, called, around, got, her, pfizer, shot, at, different, walgreens, right, away, us, :, where, they, i, re, hard, get, mil, :, one, closest, your, house, us, :"
28816,"currently, I, tell, myself, that, he, should, put, it, aside, but, not, enough, doses, with, pfizer, and, modern, to, vaccinate, everyone, by, June, twentyfour"
28817,"pfizer, thursday, ...., excited, but, needle, anxiety, kicking, weary_face"
28818,"going, get, vaccinated, by, #, pfizer, against, #, covid19, @, new, jersey"
28819,"good, morning, ,, levi, i, get, my, second, pfizer, vaccine, louisiana, today"
28820,"only, suggestion, when, you, get, your, second, pfizer, shot, is, drink, ton, water, ., only, issue, i, had, after, second, was, being, tired, dehydrated, because, i, didn, i, i, drink, enough, ."
28821,"my, son, got, his, and, pfizer, shot, week, ago, had, zero, side, effects"
28822,"go, charles, go, what, determination, ., god, bless"
28823,"yes, my, wife, got, pfizer, she, did, find, they, made, her, wait, thirty, minutes, after, shot, before, she, could, leave"
28824,"got, my, and, pfizer, shot, back, two, /, nineteen, ,, i, had, zero, side, effects, either, shot, ,, still, none, ."
28825,"i, get, shit, #, two, tomorrow, ., i, had, no, side, effects, first, ., my, hubby, is, immunosuppressed, over, twenty-three, years, transplant, patient, had, no, side, effects, two, pfizer"
28826,"triangle, peeps, :, #, covidvaccination, drive, thru, clinic, pfizer, at, west, johnston, i, ., i, ., thursday, four, /, one, starting, at, eight, am, ."
28827,"cool, -, got, my, and, pfizer, shot, nine, days, ago, ., my, hubby, got, his, and, shot, six, weeks, ago"
28828,"so, far, pfizer, and, modern, seem, to, be, excellent, products, ,, so, why, persist, in, using, a, questionable, product, such, as, astrazeneca, in, canada, ., the, answer, is, simple, ,, this, inexpensive, vaccine, is, made, for, underdeveloped, and, poor, countries, ."
28829,"appointment, booked, vaccine, at, couple, weeks, ., feels, damn, good, flexed_bicepsmedium, -, light_skin_toneflexed_bicepsmedium, -, light_skin_toneflexed_bicepsmedium, -, light_skin_tone"
28830,"patient, information, :, necessity, two, doses, pfizer, modern, couid, -, nineteen, vaccines, via, part"
28831,"had, both, pfizer, vaccine, doses, ., syringesyringe"
28832,"i, got, both, doses, pfizer, vaccine, jan, ., twentynine, &, amp, ;, feb, ., nine, ., no, side, effects, ., i, i, i, seventy-four, yrs, old, ."
28833,"five, thousand, pfizer, #, one, two, thousand, pfizer, #, two"
28834,"the, united, states, does, not, need, astrazeneca, for, their, vaccination, pfizer, modern, and, johnson, &, amp, ;, johnson, is, massive"
28835,"i, had, both, pfizer, shots, ., felt, terrible, after, both, about, two, ., five, days, but, i, had, couid, two, months, prior, ., as, miserable, as, it, was, ,, it, was, much, better, than, couid, ., i, i, i, grateful, have, received, them, ."
28836,"received, second, dose, #, covidvaccine, yesterday, at, approximately, 2Happy_face_smiley0pm, ., woke, up, with, one hundred, ., one, i, fever, ., just, as, predicted, ., hot_face, thankful, have, gotten, vaccine, ,, hopeful, side, effects, will, be, short, lived, ., #, getvaccinated"
28837,"people, are, just, ignorant, ., just, got, my, first, shot, pfizer, yesterday, feeling, fine, ."
28838,"had, great, back, chest, day, flexed_bicepsmedium_skin_tonegrinning_squinting_face, now, off, get, my, second, pfizer, dose, party_popper"
28839,"they, i, re, using, pfizer, yes, ,, you, can, get, second, dose, here, ., walk, -, ins, are, welcome, second, dose, ,, but, appointment, is, needed, first, dose, ."
28840,"hi, i, always, believe, following, reputable, sources, ., at, vaccine, clinic, i, was, given, consent, form, with, lot, this, same, information, ., check, out, this, resource"
28841,"i, wanna, get, modern, one, arm, pfizer, other, let, them, fight, it, out, inside, my, body"
28842,"got, my, est, one, ,, not, bad, ,, sore, arm, one, day, ., getting, my, and, two, weeks, ., many, family, members, have, gotten, pfizer, vaccine, with, minimal, side, effects, ,, virus, is, way, worse, ., needle, is, so, small, ,, it, doesn, ', i, hurt, &, amp, ;, i, despise, needles, ."
28843,"this, second, shot, is, kicking, my, ass, ."
28844,"epidemiologist, u, ., i, ., says, that, vaccines, pfizer, modern, are, showing, poor, efficacy, giving, us, protection, against, couid, -, nineteen, ., why, are, they, not, telling, people, about, this"
28845,"which, vaccine, did, you, get, i, get, my, and, pfizer, today, crossed_fingers"
28846,"i, i, ve, had, one, shot, pfizer, no, side, effects, ., get, my, second, one, just"
28847,"had, my, second, pfizer, shot, yesterday, ., have, aches, &, amp, ;, sinus, headache, but, no, fever, ., i, want, get, out, today, as, it, i, i, due, be, seventy, this, afternoon, &, amp, ;, will, be, under, fifty, next, three, days, ."
28848,"mine, was, yesterday, ., arm, sore, enough, reschedule, my, workout, but, otherwise, fine, ., pfizer, ., my, understanding, is, modern, can, be, little, rougher, ., also, i, also, learned, generally, older, you, are, ,, better, it, goes, ."
28849,"i, had, round, one, pfizer, not, symptom, other, than, sore, arm, ., hopefully, and, shot, same, feel, better"
28850,"i, had, modern, yeah, you, will, definitely, be, sore, ., supposedly, ,, more, muscle, =, more, soreness, ., but, my, unofficial, research, ,, people, getting, modern, have, more, symptoms, than, pfizer, ."
28851,"i, received, pfizer, vaccine, ., est, dose, was, breeze, ., no, ill, effects, ., and, dose, was, different, story, ., about, four, hours, after, shot, ,, my, arm, started, ache, ., by, next, morning, ,, i, felt, like, truck, hit, me, ., towards, evening, ,, i, was, bit, better, ., next, day, ,, i, was, fine, ., face_with_medical_mask"
28852,"fully, #, valued, #, pfizer, #, of, @, state, farm, stadium"
28853,"wrong, troll, pfizer, is, german, germany, funded, vaccine, ., modern, is, american, company, refused, accept, any, warp, speed, money, ., former, guy, will, rightly, get, credit, five hundred, ,, zero, deaths"
28854,"had, my, first, pfizer, saturday"
28855,"had, go, walgreens, helmet, ,, calf, i, but, one, is, done, ., pfizer, ., helmet, has, one, highest, crime, rates, country, ., flushed_face, this, is, yvette, ,, who, told, me, she, gave, eighty, vaccines, saturday, ., syringearm, sore, ,, but, grateful, this, opportunity, ., victory_handmedium, -, light_skin_tone"
28856,"got, my, first, dose, pfizer, yesterday, thumbs_up"
28857,"i, received, my, and, pfizer, vaccine, march, ith, ...., not, one, side, effect, thumbs_up"
28858,"lookin, at, all, homies, who, are, vaccinated, with, modern, ,, sorry, pfizer, woozy_face, like, this"
28859,"i, went, underground, supper, club, this, weekend, outdoors, they, literally, had, menu, cocktails, that, included, i, the, modern, i, i, she, i, i, pfizer, i, i, wish, i, was, kidding, ."
28860,"cars, at, ua, mall, today, ,, where, pfizer, vaccinations, were, available, by, drive, -, thru, walk, -, in, appointments, ., kevin, i, i, was, walk, -, in, ., way, back, car, we, came, upon, odd, little, unicorn, sculpture, ."
28861,"glad, jeff, grandma, marge, have, both, had, two, vaccinations, with, pfizer, syringesyringe"
28862,"hubby, ,, college, son, i, had, first, second, pfizer, vaccine, ., no, ill, effects, us, other, than, mild, headache, four, hours, me, after, second, ,, that, was, probably, more, about, ring, sleep, deprived, e, cause, it, ', i, kidding, season, our, goat, far, ."
28863,"hubby, i, ,, as, well, as, college, son, had, both, est, second, pfizer, ., mild, headache, after, second, ,, otherwise, easier, than, flu, shot, ."
28864,"i, had, pfizer, ., after, est, shot, my, arm, was, just, sore, touch, ., after, and, shot, ,, i, ran, very, slight, fever, was, bit, tired, /, achy, ., symptoms, were, gone, next, day, &, amp, ;, i, was, fine, ."
28865,"i, ', i, due, get, pfizer, wednesday, so, i, will, be, eyes"
28866,"pfizer, one, -, sore, arm, ;, tired, ., napped, ., one hundred, %, by, next, day, pfizer, two, -, tad, four, /, thirteen, wife, had, modern, one, &, amp, ;, two, ., one, -, headache, ,, tired, two, -, spiked, fever, one hundred and four, couple, hours, ., advil, ., one hundred, %, next, day, ., get, shot, i, ., save, lives, ., syringes, i"
28867,"do, my, father, -, in, -, law, is, eighty-six, years, old, and, he, was, vaccinated, with, pfizer, on, the, with, ,, a, week, before, he, was, in, contact, with, a, positive, ,, we, are, finding, out, ,, at, the, moment, he, has, some, discomfort, ,, it, may, be, due, to, the, vaccine, or, it, may, be, positive, ,, the, vaccine, helps"
28868,"Today, I, received, my, and, dose, of, the, pfizer, -, biotech, syringe, vaccine, at, her, twenty, miss, ..., I, want, to, invite, all, people, to, apply, the, vaccine, is, couid, -, nineteen, ,, it, is, something, that, as, citizens, we, have, the, right, and, we, have, to, do, ,, so, be, able, to, get, ahead, in, this, pandemic, ."
28869,"today, was, my, est, day, my, role, as, salesforce, administrator, wednesday, i, get, my, second, pfizer, vaccine, ., needless, say, ,, this, is, very, exciting, week, ."
28870,"so, grateful, get, my, and, #, covid19, #, fauciouchie, shot, today, thank, you, &, amp, ;, &, amp, ;, your, extraordinary, efforts, get, our, #, wearesausd, community, vaccinated, #, bettertogether, #, sausdproud, #, covid_19"
28871,"efficacy, of, the, pfizer, -, biotech, vaccine, in, alcoholics, and, psychoactive, drug, users, :, case, series, ."
28872,"oh, ,, this, is, encouraging, ., i, there, have, been, fewer, cases, allergic, reactions, i, &, amp, ;, i, vaccine, compared, with, modern, -, said, pfizer, -, biotech, vaccines, i, i, mean, ,, besides, bill, gates, i, nanobots, which, i, hope, give, me, mutant, healing, powers, ."
28873,"yo, did, pfizer, vaccine, give, anyone, else, insomnia"
28874,"appointment, time, at, 8Happy_face_smiley9, am, ., arrived, at, eight, am, left, site, at, ten, am, march, with, state, farm, stadium, my, first, dose, /, pfizer, ., two, hours, today, ."
28875,"#, vacunacovidco, Starting, Friday, ,, April, two, ,, all, colorado's, sixteen, years, and, older, will, be, able, to, receive, the, vaccine, and, those, eighteen, years, and, older, the, vaccine, and, this, is, a, big, step, to, build, our, strength"
