,0
2519,"modern, dose, #, two, is, arm, ., much, bigger, line, and, than, est, dose, ,, but, our, line, moved, much, faster, than, last, month, ., great, job, by, everyone, involved, ., #, getvaccinated, #, kentucky"
2520,"we, are, living, modern, world, i, am, modern, giiirlllll"
2521,"modern, mommy"
2522,"modern, ..., second, shot, last, week, ..., no, issues, whatsoever, with, either, thankfully"
2523,"where, my, modern, gang, at"
2524,"#, fully, vaccinated, #, proudamerican, United_States, #, modern, thank, you, #, jerseygirl, #, free, @, north, bergen, recreation, center"
2525,"i, i, ve, talked, at, least, five, other, women, who, had, either, i, &, amp, ;, i, or, modern, reported, changes, their, cycle, ,, yet, when, you, google, this, it, i, i, hard, find, any, info, side, effect, ., obviously, blood, clots, are, very, rare, ,, but, why, only, women, really, curious, about, research, this"
2526,"modern, ., i, felt, shitty, hours, but, they, just, shut, down, johnson, vaccine, awhile, ."
2527,"i, i, i, sorry, hear, that, ., it, can, be, debilitating, life, threatening, ., glad, you, got, modern, so, you, don, i, i, have, worry, about, it, ."
2528,"got, my, and, #, modern, #, dollyshot, #, fauciouchie, todayraising_handslight_skin_toneraising_handslight_skin_toneraising_handslight_skin_toneraising_handslight_skin_toneraising_handslight_skin_tone"
2529,"modernity, let, him, condemn"
2530,"modern, shot, #, two, :, check_mark_buttoncheck_mark_button"
2531,"what, dumb, ass, comment, ., this, week, there, are, no, astrazeneca, nor, modern, vaccine, deliveries, ."
2532,"if, you, put, pfizer, and, modern, to, have, the, trials, at, the, same, time, as, i, &, amp, ;, i, ,, her, numbers, would, be, even, lower, than, sixty-six, %"
2533,"The, effectiveness, of, a, vaccine, is, of, little, importance, for, specialists, ,, Amigo, ,, modern, and, pfizer, had, trials, well, when, the, number, of, cases, was, low, ,, they, have, already, had, trials, well, at, peak, and, even, with, people, in, Brazil, and, South, Africa, where, they, have, the, variants"
2534,"#, modern, #, firstdosedonesyringecheck_mark, i, @, diablo, valley, college"
2535,"one, week, post, modern, vaccination, i, have, swelling, pain, lymphs, under, arm, i, was, vaccinated, in, ., doctor, said, it, could, be, that, way, weeks, until, after, my, and, dose, may, ."
2536,"day, after, second, modern, dose, :, happy, report, absolutely, no, side, effects, ., feeling, just, fine, ."
2537,"got, my, second, dose, #, modern, this, morning, ., watch, out, cause, i, i, i, about, cut, up, these, streets, ."
2538,"i, received, my, and, modern, apr, ith, ., experienced, some, minor, effects, ., i, ', i, thrilled, i, am, covered, after, thirteen, mos, ., self, -, isolation, i, ', i, ready, visit, my, loved, ones, again, but, after, just, ., first, my, list, ,, is, help, my, daughter, groom, out, two, mares, again, ."
2539,"if, you, ', ve, had, modern, booster, ,, how, was, your, experience, afterwards, as, bad, as, internets, says, it, is"
2540,"i, was, gna, get, johnson, johnson, one, but, they, just, called, me, said, they, put, hurt, that, one, so, i, i, i, getting, modern, woozy_face"
2541,"modern, mafia, laughed"
2542,"i, &, amp, ;, i, vaccine, works, just, as, well, as, pfizer, modern, ,, please, take, whichever, one, you, can, get, ,, they, i, re, all, equally, effective"
2543,"so, i, have, been, having, multiple, nightmares, night, lately, guess, what, i, looked, up, modern, nightmares, it, ', i, one, things, that, happens, you, when, you, get, it, ., yikes, slightly_frowning_face"
2544,"get, mine, today, ., #, modern"
2545,"modern, mami, kiss_mark"
2546,"modern, &, it, ;, three"
2547,"yup, ., getting, modern, instead, but, now, it, i, i, gonna, take, longer, get, full, protection, ."
2548,"i, become, modern, mami, today, ., pray, fa, me"
2549,"out, abundance, caution, i, was, given, modern, vaccine, instead, i, &, amp, ;, i, vaccine, ., text, my, family, that, i, ', i, half, vaccinated, mom, says, "", oh, good, ,, expect, rash, fever, but, you, won, ', i, die, "", thanks, mom, #, wynonnaearp, #, bringwynonnahome"
2550,"received, my, and, modern, shot, last, friday"
2551,"syringe, #, johnsonandjohnson, vaccine, has, been, put, hold, by, fda, ., welled, is, switching, people, who, had, appointments, i, &, amp, ;, i, shot, modern, vaccine, ., people, who, have, appointments, today, can, still, get, shot, ., eyes"
2552,"here, we, go, ...., and, modern, way"
2553,"round, two, modern, @, ute, mountain, casino, hotel"
2554,"just, sore, arm, both, one, two, modern, me"
2555,"if, you, have, appointment, at, lubber, run, community, center, mass, vaccination, site, ,, you, will, get, modern, instead, i, &, amp, ;, i, one, -, dose, ., i, i, i, live, at, noon, with, latest, info, ."
2556,"finally, thank, you, giving, me, my, first, dose, modern, vaccine, ., #, byebyecovid"
2557,"second, modern, dose, complete, #, wearafuckingmask, #, doyourpart, @, clement, ,, florida"
2558,"i, &, amp, ;, i, is, being, paused, potential, issue, that, occurs, less, than, one, one, ,, zero, ,, zero, shots, ., not, that, i, don, ', i, agree, ,, but, if, this, were, modern, ,, it, likely, isn, ', i, getting, paused, ."
2559,"modern, ., gifted, dolly, herself"
2560,"i, had, my, second, modern, three, weeks, ago, ., no, reaction, still, very, careful, with, masks, due, variants, actually, worked, with, viruses, before, retirement"
2561,"few, ,, we, had, modern, basically, had, same, experience, ., felt, like, normal, flu, shot, with, just, much, sorer, arm, about, day, ."
2562,"i, got, modern, vaccine, OK_handmedium_skin_tone"
2563,"dose, one, done, ., #, modern"
2564,"valued, max, ., let, ', i, get, work, started, my, five, -, mile, run, this, morning, with, little, prick, ., modern, #, two, ."
2565,"update, :, announces, they, will, be, administering, modern, shot, at, saturday, i, i, home, opener, due, fda, /, cac, pause, i, &, amp, ;, i, vaccine, ."
2566,"#, covidvaccine, clinic, at, parking, lot, until, up, today, i, /, being, offered, ., walk, ups, are, welcomed, ., #, getvaccinated, #, modernavaccine"
2567,"five, weeks, past, my, second, modern, vaccine"
2568,"but, your, point, ,, that, ', i, why, i, took, modern, i, i, ,, lol"
2569,"#, covid19vacccine, #, modern, #, miamiflorida, @, uh, optumhealth"
2570,"woot, -, modern, shot, #, one, scheduled, tomorrow, afternoon"
2571,"hey, everyone, update, :, anyone, who, scheduled, or, will, schedule, through, here, will, receive, modern, vaccine, ."
2572,"i, heard, modern, hoes, got, best, pussyeyesindex_pointing_upmedium, -, dark_skin_tone"
2573,"just, glad, i, got, shot"
2574,"line, around, block, at, north, philly, vaccination, clinic, ., here, they, pivoted, i, &, amp, ;, i, vaccine, modern, ., those, line, say, they, i, re, glad, paused, safety, ."
2575,"modern, is, just, that, bitch, star, -, struck"
2576,"waiting, line, first, shot, modern, vaccine, syringe"
2577,"gates, faci, modern, maxx, seems, have, no, scrutiny, all, maxx, out, there, i, &, amp, ;, i, had, longest, most, pre, maxx, research, something, not, right, here"
2578,"happy, have, #, vaccinationdonecheck_mark, i, dose, two, #, modern, complete, ., feeling, gratefulsun_with_face, @, glenview, ,, illinois"
2579,"i, had, absolutely, nothing, after, my, second, shot, as, well, ., i, had, modern, ., i, mean, literally, not, even, tired, ., maybe, it, was, water"
2580,"bob, ,, actual, patients, who, were, skeptical, before, are, now, terrified, ., i, don, i, i, think, it, increases, preference, either, whiz, /, modern, ."
2581,"my, second, modern, shot, is, friday"
2582,"finally, vaccinated, weary_face, miss, modern, is, thriving, living, her, best, life, my, body"
2583,"it, i, i, one hundred, %, true, ., modern, delivered, over, one hundred, million, doses, est, quarter, ., my, girlfriend, works, there, lol"
2584,"i, ', i, modern, mami, plus, don, ', i, bother, me, person_bowingmedium, -, light_skin_tone, i, female_sign, i"
2585,"biggest, thing, with, any, vaccine, is, talk, with, your, doctor, -, especially, as, most, folks, are, receiving, vaccine, via, ord, -, party, ., i, had, choice, modern, or, i, &, amp, ;, i, -, latter, was, more, convenient, re, where, one, -, shot, ., if, my, my, said, do, i, van, ,, i, would, ', ve, ..., did, i, &, amp, ;, i, ."
2586,"people, are, getting, #, modern, #, covidvaccine, instead, #, johnsonandjohnsonvaccine, at, during, pause, i, &, amp, ;, i, shots, ., ., that, means, they, will, need, second, dose, ."
2587,"i, have, three, clotting, disorders, my, nurse, practitioner, warned, me, ahead, time, that, it, may, be, side, effect, ., i, got, modern, ,, but, it, ', i, always, good, know, your, health, history, what, you, ', re, facing"
2588,"oh, you, modern, man"
2589,"two, doses, modern, coursing, through, my, veins, ., thank, god, science, ."
2590,"modern, is, great, ,, it, is, free, i, have, already, received, my, first, shot, ,, am, anxiously, awaiting, second, one, ..."
2591,"ocean, county, public, health, coordinator, tells, me, they, have, no, reports, any, severe, side, effects, modern, or, jij, vaccines, given, so, far, -, ninety, ,, zero, doses, ., outside, common, fever, aches"
2592,"thanks, helping, me, get, my, life, back, #, dose"
2593,"arlington, county, i, i, i, &, amp, ;, i, mass, vaccination, clinic, at, lubber, run, has, switched, all, today, i, i, one, ,, three hundred, appointments, modern, shots, ., i, spoke, with, one, woman, who, called, change, i, inconvenient, i, but, was, glad, get, vaccinated, ."
2594,"just, checked, ., it, i, i, modern, ."
2595,"my, parents, just, called, my, dad, has, received, his, first, shot, modern, vaccine, ., my, parents, have, now, both, had, their, first, shots, it, is, still, long, road, ahead, ,, but, it, feels, like, there, is, small, light, at, end, tunnel, ."
2596,"do, ., mower, :, city, i, i, homeless, population, that, has, not, yet, been, vaccinated, will, now, receive, modern, vaccine, while, i, &, amp, ;, i, is, paused, ."
2597,"yes, ., they, said, they, could, give, us, modern, instead, ,, but, my, wife, doesn, i, i, want, modern, some, reason, ."
2598,"modern, stole, their, rna, technology, they, don, i, i, even, own, it, lol, ., they, loss, their, patent, dispute, last, year, ., this, shit, is, all, money, ., just, honest, ."
2599,"here, i, was, all, excited, i, got, dolly, parton, shot, worried_face, ., what, i, i, wrong, with, modern"
2600,"i, did, not, know, that, ., thankfully, i, got, modern, ."
2601,"even, with, news, ,, i, i, i, very, grateful, that, today, i, can, finally, say, all, my, family, is, vaccinated, ., thank, you, all, scientists, who, have, worked, so, hard, make, this, possible, #, getvaccinated, #, covidvaccine, #, modern"
2602,"context, is, modern, astra, not, having, these, incidents, date, ., aldo, je, operates, differently, different, science, ."
2603,"got, my, dos, dose, ., modern, two, ,, electric, boogaloo, ., i, saw, those, stickers, sitting, there, so, i, asked, one, ., face_with_tears_of_joy"
2604,"i, ', i, here, line, get, my, and, modern, vaccine, today, ., hoo, -, ray"
2605,"it, ', i, such, teeny, tiny, fraction, percentage, people, that, got, blood, clots, ., hopefully, they, can, adjust, supply, available, with, more, pfizer, modern, ones, though, grimacing_face"
2606,"just, ridiculous, ., disclaimer, though, :, i, waited, until, modern, vaccine, was, available, my, area, ., ninety-five, %, is, sixty-five, %, success, was, worth, wait, ."
2607,"just, clarified, that, site, will, be, administering, vaccine, ."
2608,"i, had, two, modern, shots, ., only, mild, fatigue, several, days, ."
2609,"both, ., modern"
2610,"mine, is, next, week, but, modern"
2611,"modern, i, i, again, my, whole, family, here, east, is, vaccinated, i, can, i, i, wait, hug, them, all"
2612,"second, shot, modern, curbside, at, rogersville, pharmacy, ."
2613,"i, got, my, second, modern, shot, month, ago, ., yay"
2614,"modern, shot, number, two, definitely, hits, harder, than, first, ., had, some, chills, fever, while, last, night, ., slept, lousy, ., feeling, quite, bit, better, this, morning, at, least, ."
2615,"good, morning, all, modern, marital, out, there, y, ', all, true, baddies"
2616,"new, headline, :, modern, vaccine, reduces, deaths, covid19, ."
2617,"are, modern, and, doses, also, being, given, today, was, due, go, last, week, couldn, i, i, make, it, ."
2618,"i, i, ve, had, both, modern, shots, had, absolutely, no, side, effects, ."
2619,"help, good, thing, i, got, modern"
2620,"one, modern, down, ,, second, dose, ith, ."
2621,"i, appreciate, abundance, caution, ,, but, i, urge, people, still, get, vaccinated, i, ', ve, completed, both, sets, mrna, vaccine, modern, ., i, had, no, bad, side, affects, ., i, ', ve, had, three, dots, &, amp, ;, survived, pe, ., i, ', ve, been, permanently, sentenced, life, blood, thinners, ., i, fear, couid, more, ."
2622,"some, takeaways, press, conference, with, do, ., weaver, :, -, entire, state, will, pause, use, i, &, amp, ;, i, vaccine, -, texts, sent, hoosiers, i, /, ims, appointments, today, -, so, far, ,, ninety-five, %, hoosiers, scheduled, at, ims, today, agreed, get, modern, -, unsure, where, second, dose, will, happen, location, wise"
2623,"hoosiers, now, are, coming, into, ims, get, vaccinated, with, modern, couid, -, nineteen, vaccine, ."
2624,"so, they, canceled, i, &, amp, ;, i, shot, cause, blood, clot, concerns, ., i, was, suppose, get, it, today, but, now, they, i, re, making, get, modern, instead, ."
2625,"done, modern, xu"
2626,"i, thought, modern, met, scientific, requirements, emergency, approval, by, fda"
2627,"unamused_faceperson_facepalminglight_skin_tone, i, female_sign, i, irena, coil, inside, me, right, now, is, more, likely, cause, blood, clot, ..., but, now, my, vaccine, appointment, is, canceled, pensive_face, i, am, not, getting, modern, or, pfizer, i, want, i, &, amp, ;, i"
2628,"whether, you, get, vaccinated, clinic, or, community, pharmacy, ,, just, get, vaccinated, ., one, step, at, time, ,, we, got, this, ., #, modern"
2629,"modern, is, my, preferred, replacement, syringe, if, you, see, bright, orange, convertible, bumping, i, jolene, ,, that, i, i, me, person_tipping_handlight_skin_tone, i, female_sign, i"
2630,"scary, shit, i, wanted, i, &, amp, ;, i, but, got, modern"
2631,"says, their, vaccine, clinic, will, go, as, planned, this, friday, ., instead, #, johnsonandjohnson, vaccine, ,, they, i, all, administer, #, modern, vaccine"
2632,"even, modern, has, many, failed, vaccines, past, ..., i, went, with, one, who, has, good, history, with, vaccines, one, that, is, its, way, fda, approval"
2633,"like, if, you, dirty, bitch, got, vaccinated, by, modern"
2634,"all, this, modern, talk, better, talk, up, fuckin, stock"
2635,"modern, brother"
2636,"., will, be, sending, two, -, dose, modern, vaccine, today, ,, so, that, hoosiers, can, continue, get, vaccinated, without, interruption, ., dept, ., is, also, working, with, other, clinics, that, were, scheduled, use, #, johnsonandjohnson, vaccine, immediate, future, ."
2637,"modern, at, ims, today, ."
2638,"morning, ., modern, shot, really, taking, me, out, last, night, syringeupside, -, down_faceconfused_face"
2639,"ok, ., yesterday, i, got, my, first, modern, vaccine, dose, i, ', i, scheduled, second, dose, may, with, ., no, pain, ., just, fatigue, ., i, got, shot, save, my, life, save, my, family, coronavirus, ., if, you, don, ', i, do, it, you, ,, do, it, kids, ., teenagers, ., grandparents, ."
2640,"upside, -, down_face, i, ', i, scheduled, i, &, amp, ;, i, this, friday, ., was, really, hoping, be, fully, vaccinated, before, we, move, at, end, month, ,, but, my, location, is, switching, its, doses, out, modern, ."
2641,"just, got, my, second, dose, modern, ., i, can, now, leave, house, ,, but, will, i, that, is, question, ."
2642,"modern, snatching, second, place, johnson, &, amp, ;, johnson"
2643,"there, were, six, cases, blood, clots, ., astrazeneca, vaccine, was, doing, same, ., i, still, believe, they, i, re, safe, overall, ., but, i, i, i, glad, mine, was, modern, lol"
2644,"breaking, :, is, pausing, use, #, johnsonandjohnson, #, covid19vaccine, ., #, modern, vaccine, will, be, brought, continue, vaccine, clinic, ."
2645,"my, mom, is, house, modern, though, we, got, full, avengers, civil, war, going, my, house, ..., lol, ."
2646,"get, my, second, modern, shot, day, after, tomorrow"
2647,"my, modern, shots, are, feeling, better, everyday, ."
2648,"my, yo, sister, developed, saddle, pulmonary, embolus, ,, &, amp, ;, many, smaller, blood, clots, lungs, ,, shortly, after, taking, modern, vaccine, ., symptoms, occurred, within, week, ,, icu, two, weeks, later, ., no, underlying, risk, clots, ., no, one, following, up, this, case, ,, tho, reported, ., who, should, she, contact"
2649,"i, ,, waiting, receive, our, second, dose, yesterday, ,, four, /, twelve, ., it, i, i, #, naturalscience"
2650,"we, managed, get, spots, at, walgreens, up, here, wi, border, modern, ,, but, i, ', ve, been, told, gary, ,, drive, -, thru, is, dream, ., hardly, no, wait, ., you, just, zip, through, get, your, jab, ., don, ', i, even, have, get, out, car, ."
2651,"check_mark_button, and, dose, modern, ,, which, means, i, i, i, fully, i, &, it, ;, dashboard, confessional, voice, &, it, ;, musical_notesvaccinatedmusical_notes"
2652,"got, first, dose, modern, vaccine, yesterday, ., mild, chills, fatigue, plus, soreness, at, injection, site, have, been, reactions, so, far, ., also, willing, admit, that, fatigue, might, just, be, me, getting, old, ."
2653,"good, morning, after, generally, sleepless, night, with, intense, chills, ,, i, i, i, feeling, lot, better, i, despite, huge, headache, ., my, injection, site, is, still, sore, ,, i, feel, like, i, i, ve, been, hit, like, truck, ., nearly, twentyfour, hours, after, receiving, second, modern, dose, reference, #, worth"
2654,"me, at, walgreens, tomorrow, getting, my, modern, vaccine, sparkles"
2655,"modern, so, day, ka, nahutdan, sila, modern, needles, hahaha, kinds"
2656,"and, modern, shot, today, facebook, live, ,, watch, it, #, tulsarocks"
2657,"i, would, get, i, &, amp, ;, i, if, that, is, what, was, proffered, ., as, it, is, va, gave, me, modern, ."
2658,"six, people, have, suffered, severe, blood, clots, i, &, amp, ;, i, vaccine, so, it, is, rare, but, possible, ., i, have, taken, first, modern, shot, with, some, lymph, node, swelling, but, not, serious, ., #, vaccine, #, johnsonandjohnson, #, modern"
2659,"we, are, going, have, disagree, this, one, ., fear, was, already, there, ,, can, i, i, pretend, it, i, i, not, ., i, i, i, not, telling, anyone, not, get, vaccinated, ,, i, i, i, just, acknowledging, that, those, who, are, afraid, before, me, included, this, didn, i, i, help, me, included, ., i, got, modern, ."
2660,"got, my, and, dose, modern, january, ., syringe, feel, great, ,, new, third, arm, comes, handy, ,, tracking, nano, chips, work, better, than, ios, i, find, i, app, face_with_tears_of_joy, seriously, ,, though, ;, congrats, your, prob, i, ly, gonna, feel, bit, crappy, day, after, and, dose, ,, but, sooo, worth, it, thumbs_up"
2661,"today, ,, with, ,, i, get, my, second, dose, modern, couid, vaccine, send, me, all, taylor, swift, luck, good, vibes, &, amp, ;, stream, fearless, to"
2662,"glad, i, i, i, team, modern"
2663,"another, member, undefeated, modern, gang"
2664,"woke, up, this, morning, so, thankful, have, received, modern, vaccine, ., thank, you, science, dnawhite_heart"
2665,"i, received, modern, vaccine, early, yesterday, morning, ., i, felt, fine, all, day, but, when, i, went, bed, i, felt, like, i, had, flu, like, symptoms, ., rough, night, but, some, ibuprofen, helped, ., rest, ,, medication, chicken, soup, today, ."
2666,"afterglow, modern, #, two, is, keeping, me, awake, here, southern, california, ., but, i, ', i, happy, trade, few, temporary, body, aches, protection, #, covid19, #, waytooearly, #, vaccineswork"
2667,"at, long, last, ,, it, i, i, i, -, i, day, me, i, -, i, is, i, victory, over, couid, i, or, i, vaccine, against, couid, i, it, i, i, two, weeks, after, my, second, modern, shot, ., not, sure, if, i, i, all, actually, do, anything, different, today, ,, but, i, already, feel, better, knowing, that, whatever, i, do, ,, i, i, i, fully, vaccinated"
2668,"yesss, i, have, had, modern, both, shots, ., please, lets, all, do, our, part"
2669,"last, shot, modern, next, week"
2670,"second, modern, shot, is, going, my, arm, this, am, ."
2671,"joined, modern, university, twentynine, days, ago, ., yesterday, i, graduated, with, flying, colors, #, and, #, 2nddose, #, shotforsam, #, vaccinated"
2672,"second, modern, vaccine, shot, got, my, immune, system, like, :"
2673,"second, dose, modern, is, kicking, my, ass, really, bad, ., my, arm, is, hella, red, itchy, i, can, i, i, move, it, without, wanting, cry, ., #, aunties"
2674,"i, ', i, scheduled, my, est, modern, shot, thursday, ."
2675,"modern, got, moves"
2676,"modern, -, just, seems, odd, week, after, lol, but, read, that, it, was, normal"
2677,"team, modern, here, ., daughter, gets, her, second, dose, two, weeks, ., her, hubby, got, one, -, off, i, &, amp, ;, i, though, ."
2678,"i, had, both, modern, i, i, injections, didn, i, i, have, any, problems, at, all, ., if, not, little, bandaid, i, wouldn, i, i, have, known, i, had, been, jabbed, ."
2679,"hope, you, are, feeling, better, ,, etta, ., getting, my, second, modern, shot, tomorrow, morning, ., folded_hands, me, ."
2680,"What, power, is, left, for, the, mafia, elite, in, #, cuba, facing, a, generalized, crisis, caused, by, the, transition, from, a, communist, bureaucratic, class, to, a, modern, mafia, class, ,, not, to, be, confused, with, a, modern, capitalist, class, ., via"
2681,"there, is, a, difference, of, two, weeks, ,, you, said, two, and, they, are, a, minimum, of, four, in, modern, ., Here, ,, I, circled, the, part, where, it, doesn, ', i, say, what, I, said, ., You, can, use, the, calculator, to, check, my, numbers, ., you, better, play, dead"
2682,"i, had, back, pain, with, modern, weeks, after, my, first, dose, -, big, women, under, fifty, could, be, side, effect, totally"
2683,"modern, is, four, five, weeks, ., pfizer, from, three, four, or, up, to, six, weeks, ."
2684,"done, with, it, ,, two, shots, modern, ."
2685,"modern, -, two, two, days, ago, ., i"
2686,"felt, great, after, est, dose, modern, -, and, dose, got, every, possible, symptom, -, bone, ceiling, cold, ,, body, aches, ,, one hundred and one, +, fever, ,, joint, pain, ,, stomach, tight, nausea, fatigue, -, hope, your, and, shot, goes, much, better, i, tylenol, &, amp, ;, water, if, symptoms, peak, ., spouse, had, zero, response, either, ."
2687,"modern, ,, first, shot, was, today, ., second, one, ,, may, ten, ."
2688,"if, you, ', re, looking, forward, get, vaccinated, ,, be, ready, feel, like, you, just, caught, coronavirus, lol, #, vaccinated, #, modern"
2689,"Even, so, ,, we, will, continue, in, power, even, if, the, opponent, hurts, them, ,, i, ammo, -, moran, until, the, end, of, his, six, -, year, term, and, three, minimum, terms, of, moreno, live, over, the, rivals, the, modern, triple, alliance"
2690,"couid, modern, vaccination, review"
2691,"i, ended, up, getting, mine, work, ., i, was, really, fence, while, ., i, do, work, health, care, ., i, had, modern, one, ., est, shot, no, reaction, and, had, some, fatigue, soreness, but, that, resolved, itself, with, day, ., even, though, we, all, are, here, we, still, need, masks, ..., ugh, ."
2692,"both, shots, modern, february, with, march, with, fully, vaccinated, march, with, ., i, didn, ', i, even, have, be, pregnant, female"
2693,"got, my, and, dose, today, ., hope, this, works, everyone, can, go, back, normal, lifes, like, before, ., #, masks, #, travelfree, #, restrictions, #, vaccinated"
2694,"modern, ., i, get, my, second, shot, two, days, ., ouch, ."
2695,"modern, #, two, next, weekend, then, i, ', i, taking, myself, bienville, parish"
2696,"glad, be, acknowledged, as, collaborator, modern, couid, -, nineteen, vaccine, syringe, act, with, my, contribution, vaccine, administration, efficacy, &, amp, ;, safety, mrna, -, one thousand, two hundred and seventy-three, sars, -, cov, -, two, vaccine, |, nem"
2697,"i, saw, modern, shirt, &, amp, ;, loved, it, wanted, it"
2698,"and, dose, modern, this, am, ., so, far, ,, no, side, effects, ., not, sick, getting, protected, ., nice"
2699,"i, i, i, ok, ..., i, took, modern, two, shot, twenty-eight, days, apart, ..., all, i, i, ve, experienced, was, two, days, arm, soreness, that, was, it, ."
2700,"congrats, do, ., spence, so, excited, you, &, amp, ;, so, well, deserved, wish, i, could, i, ve, made, your, defense, i, but, i, was, getting, modern, i, i"
2701,"i, toted, faci, line, over, yr, ., masks, ,, social, distancing, ,, no, contact, with, friends, no, contact, with, family, ., i, ', i, done, ., both, shots, modern, done, fully, vaccinated, since, march, with, ., i, ', i, living, my, life, again, i, ', i, not, scared, anymore"
2702,"i, i, all, be, modern, mami, by, end, week, ."
2703,"okay, well, i, don, ', i, think, you, know, who, fuck, i, am, i, know, you, don, ', i, care, you, got, about, billion, followers, ., but, i, think, you, ', re, one, cool, black, chick, i, ', i, glad, you, took, modern, because, so, did, i, ., welcome, club, sister, i, ', i, glad, you, got, see, your, mom"
2704,"est, dose, complete, #, modern"
2705,"yes, ,, modern, no, reaction, ."
2706,"aight, modern, you, win, round, one, ."
2707,"palms, are, sweaty, ,, knees, weak, ,, arms, are, heavy, ., there, ', i, vomit, my, sweater, already, ,, modern, spaghetti, i, ', i, nervous, ."
2708,"just, got, my, first, couid, shot, #, modern, my, phone, isn, i, i, getting, og, signal, i, was, promised, tho"
2709,"i, am, getting, my, first, modern, vaccine, tomorrow, morning, really, glad"
