,0
8693,"i, hadn, i, i, heard, that, at, all, ., i, got, mine, at, rec, which, was, pfizer, ,, so, not, sure"
8694,"i, understood, when, you, booked, your, first, vaccine, at, whatever, location, not, pharmacies, do, that, they, carried, both, pfizer, modern, ,, so, i, would, assume, you, would, still, get, that, same, vaccine, and, dose, at, that, same, location"
8695,"for, people, aged, twelve, and, over, who, have, not, yet, made, an, appointment, or, who, would, like, to, advance, the, administration, of, their, est, dose, ,, one hundred and fifty, doses, of, pfizer, vaccines, will, be, available, without, an, appointment, on, May, thirty, from, one, i, ., i, ., to, nine, i, ., i, ., while, stocks, last, at, university, Laval, ."
8696,"got, my, first, dose, #, vaccinated, #, pfizer, #, covid19vaccination, #, excited"
8697,"absolutely, grateful, got, my, second, dose, #, covid19vaccine, #, pfizer, today, thank, you, all, nurses, ,, doctors, volunteers, providing, such, wonderful, service, at, clinic"
8698,"really, interesting, article, continuing, research, into, couid, vaccines, &, amp, ;, boosters, ., can, they, be, mixed, &, amp, ;, matched, modern, &, amp, ;, pfizer, &, amp, i, or, i, &, amp, ;, i, yes, ,, we, i, all, probably, need, coronavirus, booster, shots, ., but, which, one, by, carolyn, y, ., johnson"
8699,"une, fille, vaccine, sign_of_the_hornsmedium, -, light_skin_tone, #, pfizer"
8700,"got, and, dose, pfizer, biotech, couid, vaccine, feeling, like, i, ', ve, been, hit, by, train, twentyfour, hours, later, ., temperature, is, ninety-five, i, i, ., cold, ,, severe, headaches, ,, body, hurts, ,, tired, ,, about, be, out, cold, ., called, out, sick, work, ., vaccine, better, be, worth, it, ."
8701,"guess, i, was, patient, zero, cause, forty-eight, hours, after, my, and, pfizer, shot, i, feel, totally, fine, ., zero, flu, -, like, symptoms, maxx, syringe, person_shrugging, i, male_sign, i, #, covidvaccine"
8702,"and, dose, pfizer, tomorrow, #, vacinnatedsummer"
8703,"attitude, ex, pfizer, people"
8704,"congratulations, ,, my, ., okada, i, just, got, my, first, pfizer, dose, last, tuesday, ., mexico, is, not, going, through, process, as, quickly, as, we, would, like, ."
8705,"Around, here, ,, an, Argentine, government, official, tells, on, a, radio, program, that, their, governments, ceded, natural, resources, to, Pfizer, to, obtain, the, vaccine, ., It, would, be, nice, to, hear, your, respective, opinions, ., Thank, you"
8706,"second, dose, #, vaccines, #, pfizer, #, vacunasparatodos, #, vacunacion, #, vicuna, #, vaccinated"
8707,"sir, :, compare, ourselves, to, him, dose, of, pfizer, ., don, ', i, settle, for, little, ,, be, ambitious, for, people, ', i, health, and, it, will, give, them, hope, ., today, that, twenty, %, with, at, least, one, dose, plus, the, level, of, contagiousness, only, despair, ., we, all, want, vaccines, to, arrive"
8708,"if, i, got, pfizer, at, it, bridges, now, they, are, doing, modern, ., do, i, need, reschedule, london, location, heard, rumors, this, happening, ..."
8709,"i, got, two, pfizer, shots, ., didn, i, i, really, want, to, ..., but, since, i, have, planned, trips, out, usa, i, figured, i, would, probably, need, it, ., i, had, sore, arm, couple, days, i, but, nothing, else, ., i, never, even, get, flu, shot, person_shrugging, i, female_sign, i"
8710,"in, those, same, months, the, usa, has, forty-five, %, fully, vaccinated, and, seventy, %, with, at, least, one, dose, and, there, are, no, more, because, many, ignorant, people, resist, doing, it, and, some, publications, help, them, ,, yesterday, the, photo, of, the, first, pfizer, vaccinated, who, died, of, eighty-seven, came, out, years, ,, I, am, eighty-five, your"
8711,"when, ', i, reopening, plan, is, solely, based, making, still, happen, ,, but, doesn, ', i, include, any, sort, plans, second, dose, rollout, ., person_facepalming, i, male_sign, i, #, covid19ab, #, astrazenaca, #, pfizer, #, vaccine, #, vaccinated, #, calgarystampede, #, up, #, profitsoverpeople, #, covid19"
8712,"If, you, have, a, delinquent, friend, ,, you, can, come, to, NY, and, give, her, the, Pfizer, ., they, told, me, ."
8713,"i, got, my, second, pfizer, yesterday, had, chemo, i, have, no, side, effects, lao, this, is, great"
8714,"give, it, one, or, two, days, ,, brian, it, i, all, go, back, normal, i, the, same, thing, happened, me, when, i, got, my, first, vaccination, few, weeks, ago, green_heartgreen_heart"
8715,"finally, got, my, pfizer, shot, such, incredible, feeling, celebrate, science, smiling_face_with_smiling_eyes, #, gotmyshot, #, vaccinated, #, pfizer"
8716,"attention, and, immunization, get, anyone, age, eighty, up, head, martensville, north, ridge, car, ., nine hundred and one, ord, it, i, -, there, is, short, notice, walk, clinic, you, can, get, their, second, pfizer, dose, with, very, little, no, wait, right, now, #, stickittocovid"
8717,"pfizer, my, veins, ,, its, hot, they, /, them, summer, time"
8718,"come, over, mount, olive, tabernacle, baptist, at, six hundred and forty-seven, i, and, bring, your, friends, family, ., pfizer, vaccine, walk, up, crew, is, ready, maxx, crew, is, ready, with, fax, #, hopeandhealingphilly"
8719,"collecting, my, $, two thousand, pfizer"
8720,"i, i, i, proud, say, that, tomorrow, will, mark, two, weeks, since, my, second, #, pfizer, dose, i, i, i, officially, valued, &, amp, ;, just, time, my, grandparents, move, town, this, weekend, now, go, #, getvaccinated, nerds, i, want, see, your, faces, victory_handlight_skin_toneblack_heart, #, thisisourshot, #, everydosematters"
8721,"i, think, pfizer, made, my, boobs, grow, ..."
8722,"and, #, pfizer, dose, ,, day, one, ., yawning_faceface_without_mouth"
8723,"no, ,, more, recent, data, indicate, that, i, ., e, ., pfizer, biotech, vaccine, can, be, stored, at, room, temperature, ., we, created, this, table, end, january, can, i, i, believe, four, months, feel, like, forever"
8724,"my, arm, was, more, sore, after, my, and, shot, pfizer, but, other, than, that, ,, i, was, fine, ., after, my, est, my, arm, wasn, i, i, too, bad, -, flu, shot, was, worse, ., doc, who, gave, me, my, and, dose, said, that, ~, thirty, %, people, experience, more, side, effects, after, second, dose, ., hopefully, you, i, all, be, one, seventy, i"
8725,"when, that, sweet, sweet, pfizer, hits, #, vaccinated"
8726,"i, had, pfizer, ,, est, dose, was, arm, soreness, about, twentyfour, hours, ,, and, gave, me, flu, like, symptoms, but, i, was, fine, after, day, ., it, all, depends, your, immune, system, as, how, your, body, will, react, ."
8727,"vaccination, in, saint, -, augustin, -, de, -, desmaures, :, familiprix, extra, syringe, -, martel, and, anglais, pharmacy, -, rue, de, i, ', hétrière, :, availability, tomorrow, May, twenty-eight, ,, Monday, May, thirty-one, ,, June, four, and, seven, modern, syringe, biscuits, leclerc, :, availability, June, two, and, three, pfizer"
8728,"delays, of, the, two, doses, ., why, a, delay, of, only, eight, weeks, for, the, second, dose, of, astrazeneca, and, sixteen, weeks, for, modern, and, pfizer, do, we, want, to, sell, stocks, of, a, less, effective, vaccine, more, easily"
8729,"alarm, from, the, vaccinated, WHO, Pfizer, makes, a, ad, card, ."
8730,"working, my, hospitals, vaccination, walk, clinic, today, ., so, far, ,, we, i, ve, had, whopping, ……., six, people, come, in, ., confused_face, ., come, folks, get, van, i, i, your, choice, flavors, today, ,, i, &, amp, ;, i, or, pfizer, ., step, right, up"
8731,"sir, you, are, wrong, ., here, in, the, usa, we, get, vaccinated, with, pfizer, and, nobody, dies, including, children, and, animals"
8732,"fyi, -, and, dose, pfizer, died, ."
8733,"i, work, pharmacy, ..., isn, i, i, it, interesting, when, entering, patient, i, i, data, ,, and, pfizer, dose, is, categorized, as, i, trial, dose, i"
8734,"drowsiness, is, pretty, normal, with, vaccine, ., i, got, pfizer, one, ., i, wish, i, could, sleep, every, night, ,, way, i, slept, after, second, dose"
8735,"pfizer, two thousand and nineteen, bribery, inquiry, ,, again, "", the, company, two thousand and twelve, agreed, pay, $, sixty, ., two, million, settle, investigations, by, sec, justice, department, into, alleged, violations, cpa, several, countries, europe, asia, ,, including, china, russia, """
8736,"blame, pfizer, ., they, should, have, bribed, them, like, last, time, ..."
8737,"so, far, my, family, ., one, pfizer, ,, one, modern, ,, two, astra, seneca, ...., one, more, getting, their, shot, just, ., covering, all, bases, at, rollo, homestead, ."
8738,"counter, their, narrative, ., why, are, we, talking, about, antibody, passports, pfizer, modern, are, only, ninety-five, %, effective, ., i, &, amp, ;, i, sixty-nine, %, what, about, five, %, thirty-one, %, those, who, are, failures, do, they, get, i, passport, i, how, about, those, us, who, had, couid"
8739,"this, is, more, damaging, than, not, respecting, pfizer, /, biotech, or, modern, i, i, property, rights, ., why, work, with, government, if, you, risk, bad, or, fine"
8740,"that, ', i, not, smart, ., In, any, case, ,, get, your, Chinese, vaccine, and, if, Pfizer, comes, later, ,, you, get, it, ., do, not, risk, yourself, unnecessarily, by, baseless, prejudice, ."
8741,"', Influencers, ', Say, Russia, -, Linked, or, Agency, Asked, Them, to, Delegitimize, Pfizer, ', i, Vaccine"
8742,"because, in, peru, they, always, want, to, change, the, rules, here, in, usa, and, the, rest, of, the, world, it, ', i, two, doses, of, pfizer, and, period"
8743,"pfizer, -, biotech, have, applied, modern, will, apply, june, full, fda, approval, likely, get, it, ."
8744,"i, ', all, get, vaccine, ..., course, let, ', i, say, ..., $, fifty, ,, zero, winking_face, i, just, wanna, clear, my, debt, start, my, life, over, pleading_face, #, pfizer, #, covid19vic, #, astrazeneca, #, covid19vaccination, #, getvaccinated, #, biotech, #, modern, #, herdimmunity, #, cashapp, #, paypal"
8745,"the, question, is, why, the, studies, i, have, read, are, only, in, that, order, ,, astra, seneca, first, and, pfizer, dose, second"
8746,"fully, vaccinated, baby, do, your, part, get, vaccinated, too, #, covidfree, #, vaccination, #, wereallinthistogether, #, gaysovercovid, #, cac, #, health, #, pfizer, #, modern, @, west, hollywood, ,, california"
8747,"mentions, the, pfizer"
8748,"first, time, restaurant, since, early, march, two thousand and twenty, ., thanks, get, vaccinated, because, #, vaccineswork"
8749,"with, pfizer, you, get, og, ."
8750,"isn, ', i, that, treatment, african, sleeping, sickness, doesn, ', i, it, have, whole, host, its, own, side, effects"
8751,"Well, ,, it, is, already, tired, ,, it, is, not, Pfizer, and, the, second, dose, should, have, been, administered, the, third, week, according, to, the, medical, literature, ."
8752,"that, first, dose, pfizer, got, my, arm, so, sore, loudly_crying_face"
8753,"i, doubt, this, ., i, am, immune, compromised, did, not, set, out, until, full, #, pfizer, immunity, benefit, fourteen, -, day, quarantine, ., i, can, i, i, afford, take, any, chances, ., this, is, why, i, drove, stayed, isolated, whole, trip, i"
8754,"vicuna, one, /, two, check_mark_button"
8755,"and, pfizer, done, at, up, ., so, far, sooookay"
8756,"i, imagine, getting, modern, instead, pfizer, i"
8757,"yep, pfizer, isn, i, i, paying, tax, profits, that, they, made, governments, that, paid, them, with, tax, dollars, ., viagra, couid, vaccines, they, got, you, covered, ., #, wakeup"
8758,"i, appreciate, you, helping, us, answering, questions, ., thank, you, i, received, az, april, twenty-two, ,, any, news, when, we, get, out, second, one, now, or, mixing, with, pfizer"
8759,"congrats, ,, brian, that, i, i, awesome, i, i, got, my, first, shot, already, i, i, i, getting, my, next, one, august, with, green_heartgreen_heartsmiling_face_with_sunglasses"
8760,"any, idea, what, latest, sched, is, second, shot, #, ab, these, days"
8761,"and, if, it, ', i, the, other, way, around, ,, first, one, or, two, doses, of, pfizer, and, then, one, of, astra, seneca"
8762,"from, #, stressrelief, it, becomes, ,, from, #, death, from, #, coronavirus, it, ', i, not, very, simple, era, i, macro, #, vaccines, #, pfizer"
8763,"pfizer, is, such, stable, stock, it, barely, moves, ever"
8764,"and, here, in, canada, we, apply, pfizer, and, modern, ..., draw, your, conclusions"
8765,"pfizer, this, pfizer, that, ,, im, modern, baby, whats, gonna, happen, me"
8766,"may, with, ,, two thousand and twenty-one, ~, today, my, sister, had, finally, received, her, est, dose, pfizer, couid, vaccine, ., partying_faceraising_handsmedium, -, light_skin_tonei, i, i, so, proud, you, getting, your, est, shot, vaccine, ,, congrats, sis, beaming_face_with_smiling_eyesclapping_handsmedium, -, light_skin_toneclapping_handsmedium, -, light_skin_tone, #, awesome, ., beaming_face_with_smiling_eyesparty_popper, #, firstdosedonepartying_facecheck_mark_button, #, pfizervaccine, ., smiling_face_with_smiling_eyessyringe, #, protectedagainstcovid, ., grinning_face_with_big_eyes, #, congratssis, grinning_face_with_smiling_eyesclapping_handsmedium, -, light_skin_toneclapping_handsmedium, -, light_skin_tone"
8767,"i, hear, bionic, ceo, wife, ,, both, do, ', i, ,, hasn, ', i, gotten, their, vaccine, yet, i, had, both, shots, which, was, made, by, them, pfizer, partnership, ., are, we, been, used, as, trial, -, and, -, error"
8768,"when, I, made, the, appointment, for, my, vaccine, I, asked, for, the, pfizer, but, they, told, me, "", you, can, ', i, choose, ,, you, get, the, one, that, ', i, available, when, you, get, vaccinated, i, thank, god, the, day, i, went, i, played, the, pfizerthumbs_upsmiling_face_with_smiling_eyes"
8769,"backhand_index_pointing_downMexicoArgentinaColombiaBrazilChile, #, whatsapp, #, covid19, #, covid_19, #, coronavirus, #, basil, #, virus, #, sarscov2, #, latham, #, oms, #, colombiaenalertaroja, #, vacunacovid19, #, pfizervaccine, #, astrazeneca, #, modern, #, marketing, #, buenosdias"
8770,"hey, google, ,, play, doin, i, fine, by, sparkles, i, for, first, time, long, time, we, i, re, doin, i, fine, i, feeling, so, blessed, after, joining, pfizer, fam, today, deeply, grateful, smooth, &, amp, ;, painless, experience, ., #, communityimmunity, #, getvaccinated, #, pfizer"
8771,"couid, -, nineteen, vaccine, pfizer, confirmed, cause, brain, damage, ,, neurodegenerative, disease"
8772,"i, got, pfizer, ., second, one, gave, me, chills, ,, headaches, ,, fatigue, ., it, started, seventeen, hours, after, second, shot, ., wasn, i, i, really, bad, ."
8773,"seventy-five, ,, zero, dead, ., thirty-five, ,, zero, who, could, have, been, vaccinated, if, they, didn, ', i, do, what, you, know, they, did, with, Pfizer, ,, coax, ,, etc, ., and, if, there, was, no, militant, vaccine, ,, cat, and, vip, ., afternoon, ., like, an, antibiotic, after, they, already, cut, off, your, leg, ., and, now, comes, #, lavacunaelectoral"
8774,"pfizer, finish, rolling_on_the_floor_laughing"
8775,"that, i, i, your, opinion, ., doctors, experts, all, said, it, was, directly, caused, by, body, reacting, pfizer, couid, shot, ., i, i, i, sorry, that, doesn, i, i, fit, your, narrative, you, want, blame, something, else, ., as, far, as, stroke, ,, call, neurologist, office, ask, abut, pfizer, strokes, ."
8776,"i, ', i, glad, we, got, pfizer, one, ,, because, y, ', know, ,, #, swag, ."
8777,"first, dose, ., pfizer"
8778,"i, was, fatigued, after, both, shots, few, days, ., i, got, pfizer, ."
8779,"which, did, you, get, i, got, pfizer, all, i, had, was, arm, soreness"
8780,"and, pfizer, vaccine, is, done, @, rite, aid, arlington, ,, wa"
8781,"bring, some, pfizer"
8782,"saw, my, doctor, today, had, my, second, dose, yesterday, was, told, if, i, still, feel, not, good, within, three, or, four, days, call, her, back, if, that, ', i, with, pfizer, i, imagine, that, would, be, with, any, them"
8783,"pfizer, &, it, i, it, i, it, i, it, ;, zany_face"
8784,"taping, ni, kuya, gabe, #, pfizer, @, rosebud, is, hospital"
8785,"all, pfizer, ', i, up, ..., time, book, all, -, inclusive, holiday, somewhere, warm, this, winter, flexed_biceps, syringe, sun, i"
8786,"#, ich, continues, administer, couid, -, nineteen, vaccine, monday, ,, wednesday, &, amp, ;, friday, am, up, ., checkmark, i, ages, twelve, seventeen, :, pfizer, vaccine, is, offered, ., students, age, twelve, fifteen, can, schedule, app, at, three hundred and three, -, four hundred and fifteen, -, seven thousand, seven hundred and seventy-seven, -, monday, through, friday, ,, am, up, ., ages, sixteen, &, amp, ;, older, ..., one, /, two"
8787,"the, pfizer, ,, husband, ."
8788,"thanks, to, god, bless, america, capitalism, and, my, husband, ', i, patriarchy, who, sponsored, my, two, trips, to, dallas, already, with, two, doses, of, pfizer, ., #, fullyvaccinated"
8789,"did, you, know, is, one, abortions, top, supporters, if, they, support, human, murder, ,, why, would, you, trust, them, inject, you, with, "", experimental, "", mixture, ."
8790,"#, vaccinepickuplines, one, :, i, i, i, valued, ., i, got, pfizer, ., what, i, didn, i, i, get, was, your, number, ., two, :, *, blank, stare, *"
8791,"pfizer, -, they, do, meet, criteria, ,, she, i, i, just, having, lots, trouble"
8792,"pfizer, chiefs, live, concert, syringeraising_hands, #, covid19, #, teampfizer"
8793,"urgent, we, need, use, our, remaining, one hundred, +, pfizer, doses, today, at, couid, -, nineteen, immunization, center, at, ., est, doses, only, ages, twelve, +, and, doses, ages, eighty, +, or, if, your, first, dose, was, or, before, march, one, ., please, share, no, line, #, ye, #, covid19sk"
8794,"check_mark_button, modprobe, pfizer, dose, =, two, penguinadhesive_bandagesparkles"
8795,"my, son, got, pfizer, last, week, at, leila, staff, told, me, different, weeks, /, days, have, pfizer, or, modern"
8796,"need, vaccine, has, two hundred and fifty, #, johnsonandjohnson, vaccines, fifty, #, pfizer, vaccines, teens, ., they, i, re, open, until, 3Happy_face_smiley0, i, ., i, ., wednesday"
8797,"so, yeah, ..., that, second, pfizer, kinda, got, kick, it, ., kinda, wanna, take, seventy-two, hour, nap, ."
8798,"thank, you, #, pfizer, chance, get, final, member, our, family, four, vaccinated, today, ., vaccination, clinic, japanese, were, great, #, vaccinated"
8799,"wifey, just, texted, me, that, she, ', i, part, #, pfizergang, now, too, ., first, round, pfizer, done, both, us, ., thumbs_up, now, ..."
8800,"got, my, pfizer, vaccine, i, ', i, feeling, great"
8801,"nice, ., welcome, team, pfizer, right, -, facing_fistleft, -, facing_fist"
8802,"i, am, fully, vaccinated, now, ...., it, ', i, time, return, normal, life, ...., hopefully, ..., very, soon, ., folded_handsmedium, -, dark_skin_tone, gonna, celebrate, little, at, icon, park, i, -, drive, orlando, ,, fly, ., #, vaccinationdonecheck_mark, i, #, vaccine, #, health, #, safety, #, life, #, lifestyle, #, medicine, #, orlando, #, return, #, pfizer, #, covid_19"
8803,"if, anyone, needs, counterfeit, couid, vaccine, card, let, me, know, i, got, pfizer, modern, anything, you, need, mobile_phone_with_arrow"
8804,"#, pfizer, ,, the, first, to, have, the, vaccine, ready, did, not, participate, in, that, program, ., They, did, it, without, help, from, the, us, government, ., other, companies, did, participate, ."
8805,"I, was, waiting, for, an, explanation, ., not, an, insult, ., According, to, the, cac, ,, the, only, vaccines, that, prevent, contagion, at, a, sufficient, level, to, avoid, new, variants, are, those, of, viral, vector, or, mRNA, ., That, includes, modern, ,, i, &, amp, ;, i, ,, Pfizer, ,, AZ, ,, and, cataleya, ., those, of, activated, viruses, do, not, ., will, that"
8806,"update, approx, thirty, hours, after, and, shot, :, shoulder, soreness, last, night, ., felt, bit, tired, ., went, sleep, ., took, two, ibuprofen, this, morning, went, gym, ., bit, weak, but, not, bad, ., twenty, minute, snooze, this, afternoon, ,, then, three, mile, walk, ., feel, great, now, ,, normal, ., #, getvaccinated"
8807,"washington, post, :, influencers, say, they, were, offered, money, discredit, pfizer, vaccine, ., france, ,, some, suspect, russia, is, behind, it, i, via"
8808,"associated, press, :, social, media, heavyweights, wooed, pfizer, smear, campaign, ., via"
8809,"thank, you, pfizer, making, them, sit, pretty"
8810,"a, ., dose, pfizer, thumbs_up, in, taipan, ...., in, twentynine, days, the, and, ."
8811,"the, Cuban, vaccine, having, had, fourteen, million, from, Pfizer, ., these, communists, who, are, in, the, government, are, fourth, class, ,, the, pocho, gets, up, and, kicks, them, in, the, ass, ,, all, of, them, with, a, capital, e, in, their, mouths"
8812,"#, askdrdevillacp24, apologies, as, this, is, second, question, ., if, my, first, pfizer, vaccine, was, at, it, ., joseph, ', i, health, center, march, twenty-six, they, have, given, me, my, second, date, july, sixteen, ,, could, i, get, my, second, dose, elsewhere, if, it, becomes, available, at, another, location"
8813,"team, pfizer, #, vaccine, dose, one, done, #, celebrate, #, covid19vaccination, #, getit, #, endthepandemic"
8814,"leila, some, days, has, modern, others, has, pfizer"
8815,"that, i, i, great, i, suspect, my, wife, will, get, her, second, pfizer, shot, mid, -, june, seven, weeks, i, might, get, my, second, az, mid, -, july, twelve, weeks"
8816,"but, cache, I, read, that, it, is, not, the, same, to, be, vaccinated, with, pfizer, than, with, siva, and, that, is, why, that, card, is, bad, #, la210pase"
8817,"#, igotvaccinatedand, this, girl, is, pfizer"
8818,"#, askdrdevilla, we, are, now, inundated, with, information, every, media, outlet, about, astra, seneca, second, doses, ,, modern, deliveries, but, nothing, about, pfizer, any, longer, ., my, first, pfizer, was, march, twenty-six, ., is, there, possibility, that, my, july, with, time, could, be, moved, forward"
8819,"thrilled, have, received, my, #, covid19, vaccine, today, syringe, thank, you, wonderful, staff, i, i, central, clinic, quick, painless, jab, #, vaccine, #, pfizer"
8820,"governor, inoculated, with, pfizer, in, the, epicenter, exhibitor, #, querétaro"
8821,"when, my, buddy, found, out, he, was, getting, pfizer, he, went, "", hooking, me, up, with, that, chronic, "", then, tried, dap, up, tech, skull"
8822,"my, pfizer, age, updated, two, days, after, i, got, az, i, boy, i, kicked, myself, ass, that, i, take, what, ', i, available, they, said, i, its, all, same, they, said, i, now, we, ', re, being, hung, out, dry, and, dose"
8823,"our, pool, guy, just, got, second, pfizer, jab, ., his, heart, swelled, ,, giving, him, minor, heart, attack, ,, permanently, damaging, his, heart, ., he, is, thirty-five, years, old, ., his, wife, called, pfizer, who, says, ,, yes, one, %, have, swollen, hearts, ., they, want, do, study, this, young, man, pfizer, is, immune"
8824,"#, firstdosedonesyringecheck_mark, i, #, vaccinationdonecheck_mark, i, #, covidvacccine, #, covid_19, #, health, #, pfizer, #, immunization, @, vancouver, convention, center"
8825,"i, ', ve, been, pfizer, ', i, ."
8826,"first, dose, pfizer, :, check_mark_button, thanks, ,, vive"
8827,"either, modern, or, pfizer, i"
8828,"okay, i, read, it, it, specifically, targets, pfizer, vaccine, ., my, question, still, wasn, ', i, answered"
8829,"second, shot, pfizer, done, your, boy, is, all, vaccinated, now, kissing_face, @, cos, pharmacy"
8830,one
8831,"got, pfizer, today, better, late, than, never, ., ready, second, dose, so, i, can, move, this, mess"
8832,"well, ,, it, ', i, a, good, thing, I, didn, ', i, make, the, plane, trip, from, chihuahua, el, paso, ,, to, yes, I, was, very, tempted, to, do, it, because, there, everyone, puts, the, modern, one, and, it, ', i, not, to, brag, but, my, president, sent, us, the, pfizer, juaritosnail_polishmedium_skin_tone, just, there, ."
8833,"I, would, have, wanted, to, get, vaccinated, with, i, &, amp, ;, i, but, when, I, arrived, they, only, had, pfizer, and, modern, available, ., I, chose, modern, ., no, side, effects, ..., except"
8834,"last, time, i, trusted, pfizer, as, medication, i, lost, four, years, my, life, grinning_face_with_sweat"
8835,"#, gallery, today, started, vaccination, against, couid, -, nineteen, for, people, between, fifty, and, fifty-nine, years, old, ,, who, have, come, to, the, bicentennial, park, -, main, entrance, and, new, charro, canvas, -, to, receive, the, pfizer, biological, ."
8836,"i, got, my, and, pfizer, shot, few, weeks, ago, ., my, superpowers, just, kicked, yesterday"
8837,"who, is, funding, this, nos, or, pfizer, because, if, it, i, i, nos, it, should, be, shot, down, immediately, it, i, i, discriminatory, nature, there, are, kids, out, there, that, can, i, i, nor, shouldn, i, i, get, valued, because, medical, conditions, why, aren, i, i, they, entitled, be, that, raffle"
8838,"got, my, two, pfizer, shots"
8839,"corporations, like, at, &, amp, ;, i, pfizer, are, lining, up, support, insurrection, after, vowing, never, do, so, again, ., what, do, our, democratic, party, leaders, have, say, about, it, crickets, ."
8840,"we, have, mobile, vaccine, clinic, here, today, until, four, :, zero, i, ., i, ., walk, -, ups, welcome, ,, vaccine, type, :, johnson, &, amp, ;, johnson, eighteen, +, pfizer, ."
8841,"sorry, the, pfizer, gang, I, ', i, at, modern"
8842,"one, /, two, #, come, check_mark_button"
8843,"so, shows, us, this, so, tells, us, this, i, i, ve, have, vaccine, syringe, four, /, twelve, /, twentynine, was, my, second, one, so, i, can, play, like, pros, all, no, mask, i, i, i, cool, i, i, i, nerves, worried_face, nervous, is, this, real"
8844,"We, continue, with, the, vaccination, days, #, pfizer, #, johnsonandjohnson"
