,0
7400,"kids, ages, six, months, up, ....., here, ', i, how, sign, up, your, child, stony, brook, ', i, pfizer, couid, vaccine, study, via"
7401,"cac, i, i, i, real, world, i, study, shows, pfizer, ,, modern, vaccines, reduce, infection, risk, by, ninety-one, i, cac, study, also, showed, that, i, few, i, fully, vaccinated, americans, who, still, contract, couid, -, nineteen, have, milder, shorter, illness, are, less, likely, spread, virus, ., #, vaccinessavelives"
7402,"eyes, -, opening, seminar, sparrow, i, patient, engagement, #, clinicaltrials, thru, #, digitalhealth, i, /, former, chief, innovation, raising_handsmedium_skin_tone, backhand_index_pointing_rightmedium_skin_tone, i, we, need, visits, catered, its, &, amp, ;, families, depending, where, they, are, their, journey, i, backhand_index_pointing_rightmedium_skin_tone, decentralized, trials"
7403,"i, think, they, put, scoop, bucked, up, my, pfizer, workout, vibes, were, immaculate, today"
7404,"one, explains, how, two, you, are, the, ones, who, didn, ', i, buy, pfizer, because, you, didn, ', i, want, to, save, money, ,, you, said, ., stop, doing, politics, ,, govern, ,, stop, doing, business, and, take, charge, #, genocidal, government"
7405,"Pfizer, CEO, Albert, boola, is, a, Sephardic, Jew, from, thessalonian, ,, Greece, ,, a, city, whose, Jewish, population, almost, completely, disappeared, during, World, War, II, ., there, is, more, to, tell, ,, but, I, think, the, answer, is, the, view, of, why, not, the, #, pfizer"
7406,"the, development, of, the, couid, nineteen, vaccine, is, jewish, ., mikael, molten, ,, chief, scientific, officer, of, pfizer, ,, is, jewish, ., He, grew, up, in, halstead, ,, Sweden, ,, the, son, of, a, Jewish, father, with, roots, in, Sweden, before, the, war, and, a, Jewish, mother, who, fled, Austria, in, the, early, days, of, World, War, II, ."
7407,"I, arrived, swept, to, the, previous, block, ..., luckily, I, got, pfizer, ..."
7408,"i, ', i, technical, guy, so, i, investigated, this, ,, nothing, metal, sticks, you, ,, doesn, ', i, affect, compass, ,, i, can, detect, no, emf, fields, or, any, i, ., i, ., signal, radiating, myself, who, had, two, shots, pfizer, ., have, these, people, lost, their, i, i, king, minds"
7409,"i, got, pfizer, shot, ., it, didn, i, i, give, me, og, or, magnetism, but, it, did, hospitalize, me, with, blood, clots, ., problem, with, antivaxxers, making, ridiculous, claims, is, it, takes, away, people, who, do, have, legitimate, issues, with, vaccine, ."
7410,"the, pfizer, ninety-nine, ., nine, %, effective, taking, as, a, reference, ten, million, vaccinated, and, one hundred and sixteen, deaths"
7411,"unlike, me, who, jumped, at, first, chance, get, shot, my, wife, was, sensible, enough, wait, bit, took, pfizerface_with_rolling_eyesperson_facepalming, i, male_sign, i, face_with_tears_of_joy, she, didn, ', i, get, fatigue, i, faced, with, az, couple, my, friends, kids, here, got, pfizer, too, ., am, gonna, get, my, kid, registered, vaccinated, really, soon, too, ."
7412,"before, the, syringe, pfizer, vaccine, because, face_with_tears_of_joyface_with_tears_of_joyface_with_tears_of_joy, doesn, ', i, work, without, a, photo, face_with_tears_of_joy, my, friend, you, ', re, fucking, nerves, grinning_face_with_sweat, in, few, cuautitlán"
7413,"i, ', i, canada, &, amp, ;, got, az, vaccine, my, est, dose, ., now, they, ', ve, stopped, that, &, amp, ;, are, saying, that, pal, who, got, az, can, take, pfizer, or, modern, their, and, dose, unreal, don, ', i, know, what, believe, anymore, i, still, need, get, my, twelve, yr, old, vaccine, ., just, watching, initial, reaction"
7414,"lmfaooooo, pfizer, or, modern, names, aint, it, face_with_tears_of_joy"
7415,"tonight, at, five, six, ,, what, perfect, way, enjoy, hot, weather, squirrel, hill, ., with, some, we, talked, this, family, about, #, covid19, vaccine, kids, under, twelve, announcing, that, it, is, expanding, testing, its, vaccine, kids, five, -, eleven, ."
7416,"i, i, i, i, &, amp, ;, i, recipient, who, has, wanted, upgrade, while, but, people, have, discouraged, me, doing, so, ., i, have, kind, resigned, myself, waiting, booster, time, ., meanwhile, ,, i, still, mask, -, up, at, indoor, public, places, but, would, probably, be, doing, same, if, i, had, received, pfizer, ."
7417,"and, dose, of, az, vaccine, tomorrow, or, pfizer, next, week, I, am, ambivalent, and, you"
7418,"i, suspect, it, will, be, pfizer, ,, but, it, could, be, modern, ."
7419,"when, did, you, get, first, az, ., got, mine, april, eight, thought, i, had, wait, out, twelve, weeks, ."
7420,"received, my, first, dose, #, pfizer, thank, you, making, whole, vaccination, process, seamless, ,, simple, ,, comfortable"
7421,"you, know, what, it, ', i, like, to, have, the, possibility, of, having, fourteen, million, #, pfizer, last, year, and, throw, it, out, the, window"
7422,"i, am, awe, those, locks, ."
7423,"big, mouth, cousin, had, couid, last, december, two, sisters, rode, her, about, it, ., just, talker, ,, other, sister, got, couid, too, ., i, ', i, about, blow, my, stack, with, anger, ., face_with_symbols_on_mouth, why, i, ', ve, been, so, good, ., i, pray, pfizer, can, beat, it, off, ."
7424,""", two, doses, pfizer, vaccine, are, eighty-eight, %, effective, against, #, deltavariant, ,, while, two, doses, astrazeneca, were, sixty, %, effective, ., faci, stressed, importance, getting, two, doses, ., nih, studies, :, just, one, dose, vaccine, provided, only, thirty-three, %, efficacy, against, deltavariant, i"
7425,"pfizer, ', i, couid, vaccine, trials, could, be, soon, be, extended, children, aged, five, -, eleven, eventually, as, young, as, six, months, ., currently, ,, people, twelve, older, are, eligible, pfizer, vaccine, under, era, fda, ."
7426,"it, is, making, your, hair, grow, even, longer"
7427,"pandemic, ed, left, ;, real, ed, ,, thanks, my, ., pfizer, first, trip, barber, sixteen, months, ., #, vaxtowin, #, vaccinate, #, vaccineswork"
7428,"okay, doc, ., Come, to, us, and, take, the, pfizer, vaccine, and, free, of, charge, and, below, it, twenty, lines, ., In, return, ,, you, will, take, a, gift, of, this, talk, seriously, ,, is, it, not, a, joke, ,, and, the, gift, is, a, surprise, i"
7429,"Thank, you, very, much, ,, my, ., President, ,, my, ., Undersecretary, ,, Doctor, ,, and, my, ., Chancellor, ,, and, all, the, staff, of, the, macro, -, vaccination, center, for, your, tireless, work, ., Today, we, and, I, received, our, first, pfizer, vaccine, ."
7430,"i, didn, i, i, know, bout, big, boob, thing, ..., i, wish, i, got, pfizer, instead, modern"
7431,"pfizer, is, ready, enroll, about, four, ,, five hundred, young, volunteers, at, more, than, ninety, sites, u, ., i, i, finland, ,, poland, spain, ., syringe"
7432,"because, they, don, ', i, have, enough, pfizer, i"
7433,"pfizer, ., color, coded, key, right, graph, hopefully, should, help, ."
7434,"pfizer, numero, victory_hand, i, consider, me, fully, vaccinated, #, vaccinesworkgb, @, davidson, center"
7435,"pfizer, both, shots, ."
7436,"pfizer, modern, are, good, gov, agencies, gov, getting, out, way, can, help"
7437,"i, got, pfizer, &, amp, ;, was, feeling, lethargy, one, one, /, two, weeks, later, ., although, at, that, time, antiwar, trumpet, my, office, came, down, with, couid, &, amp, ;, worked, one, /, two, before, leaving, ., felt, normal, week, then, after, exposure, felt, bad, day, ., it, is, possible, that, i, was, fighting, off, couid, ."
7438,"please, pay, some, attention, these, three, #, dutch, girls, ., held, against, their, will, somewhere, #, lasvegas, by, my, #, dutch, ex, wife, ., who, married, usa, citizen, money, &, amp, ;, green, card, ., #, bennet, #, amcsqueeze, #, breaking, #, cardio, #, fauciemails, #, heatwave, #, news, #, pfizer, #, reddit, #, tuesdayvibe"
7439,"we, are, hosting, second, pfizer, couid, vaccine, clinic, at, greene, is, june, twentyfive, four, -, up, ., this, is, anyone, ages, yrs, +, who, would, like, receive, first, dose, ,, or, who, did, receive, first, dose, june, four, ., please, see, attached, registration, details, ."
7440,"#, lastminute, :, pfizer, will, start, testing, its, vaccine, against, #, covid19, in, a, group, of, thousands, of, children, under, twelve, years, old, testing, a, lower, dose, ., The, study, will, recruit, four, ,, five hundred, children, from, more, than, ninety, sites, in, the, United, States, ,, Finland, ,, Poland, ,, and, Spain, ."
7441,"realize, you, asked, pfizer, ,, but, just, comparison, if, it, i, i, useful, :, my, wife, :, modern, shot, one, :, march, fifteen, ., shot, two, :, may, twentynine, my, mother, :, modern, shot, one, :, march, fifteen, ., shot, two, :, may, thirty-one"
7442,"choosing, between, modern, pfizer, is, like, being, at, town, with, only, one, gas, station, hundreds, miles, refusing, fill, up, because, it, i, i, wrong, brand, gas, ,, glad, government, isn, i, i, letting, people, waste, time, like, that, ."
7443,"pfizer, do, ., pill, ,, my, ., pillow, i, i, psychiatrist"
7444,"taking, walk, -, ups, at, #, covid19, #, vaccine, clinics, i, i, i, volunteering, at, willow, grove, site, today, open, until, up, ., both, pfizer, twelve, +, i, &, amp, ;, i, one, done, are, being, offered, ., come, say, i, hi, i, get, your, couid, shot, syringe"
7445,"i, had, pfizer, didn, ', i, have, any, issues, felt, fine, next, day"
7446,"The, result, is, a, pfizer, cutting, board, ?, It, ', i, just, tight, at, the, injection, site, a, little, with, the, body, swarming, and, the, next, day, driving, almost, asleep, while, waiting, at, the, intersection, ., It, ', i, good, to, have, a, boss, sit, with, boss, damn, it, wake, up, grinning_face_with_sweat"
7447,"attention, hospitality, industry, workers, ocher, is, partnering, with, nola, brewing, free, couid, -, nineteen, vaccine, event, june, fourteen, ,, eleven, a, ., i, i, seven, i, ., i, i, three thousand and one, tchoupitoulas, it, ., enjoy, fun, giveaways, free, doses, one, -, shot, johnson, johnson, vaccine, or, two, -, shot, pfizer, vaccine, ."
7448,"i, have, friend, who, had, positive, case, her, kid, i, i, class, she, had, i, &, amp, ;, i, ,, husband, had, pfizer, ., her, both, kids, tested, positive, couid, her, husband, never, did, ., i, know, it, i, i, only, one, anecdotal, example, ,, but, i, i, i, want, that, level, protection, if, i, was, healthcare, worker, limo"
7449,"has, my, az, shot, april, one, at, shoppers, ,, got, ext, yesterday, gov, with, attached, link, i, wish, get, pfizer, or, modern, through, gov, ,, i, booked, end, june, pfizer"
7450,"speak, as, if, saying, a, little, verse, ,, mario, ., It, ', i, not, people, from, Pfizer, USA, ., he, is, an, Argentine, who, is, paid, by, the, i, or, threatened, by, the, i, ., it, ', i, manual, ."
7451,"news, :, "", pfizer, announced, tues, that, it, was, moving, test, its, vaccine, children, aged, five, -, twelve, years, ., it, will, begin, testing, vaccine, infants, as, young, as, six, months, next, few, weeks, i, vaccines, youngest, u, ., i, ., may, arrive, this, fall"
7452,"children, twelve, -, seventeen, are, only, eligible, receive, #, pfizer, vaccine, ., register, :, use, zip, code, ninety thousand and six, search, our, clinic, :, cha, hollywood, presbyterian, medical, center, -, mobile, clinic, -, western, ave, -, pfizer, ., additional, details, flyer, ."
7453,"#, coronavirussicilia, #, chronicle, vaccines, over, twelve, ,, arrival, of, two hundred and sixty-eight, thousand, doses, pfizer, sicily"
7454,"ceo, pfizer, is, not, even, pretending, that, vaccine, is, *, necessary, *, kids, ,, but, they, are, pushing, it, anyway, ., ask, yourself, why"
7455,"relieved, is, understatement, shot, number, two, is, done, #, pfizer, #, vaccinateyourkids, #, endcovid19, #, newnormal, @, sincerest, ,, florida"
7456,"i, spent, morning, at, community, health, clinic, harvey, ,, illinois, ,, just, outside, center, chicago, ., one, patient, i, witnessed, ,, this, was, her, fourth, conversation, with, doctor, about, vaccine, ., today, she, got, her, first, pfizer, shot, ., one, person, ,, one, shot, ,, one, life, saved, ."
7457,"well, the, second, dose, of, pfizer, left, me, bedridden, ,, balled, up, ,, with, a, fever, ,, etc, woozy_facewoozy_face"
7458,"studies, have, shown, that, following, az, with, mrna, is, producing, thirty, -, six, more, antibodies, than, single, vaccine, series, az, i, it, ;, az, ,, pfizer, i, it, ;, pfizer, ., i, believe, that, ', i, been, holding, true, older, people, as, well, ,, which, is, very, good, thing, ., it, ', i, right, decision, ."
7459,"well, ,, they, already, applied, the, first, dose, of, pfizer, thumbs_upmedium, -, light_skin_tone, I, hope, the, vaccine, arrives, soon, all, the, people, from, all, the, sectors, that, are, missing"
7460,"looking, interview, parent, today, who, i, i, interested, signing, up, their, kid, under, twelve, years, old, pfizer, vaccine, trial, which, just, started, ., interview, will, be, via, zoom, will, only, last, five, minutes, or, less, ., please, let, me, know, asap, thanks"
7461,"The, four, of, us, in, this, photo, got, Pfizer, ., none, had, effects, ,, just, a, little, i, argue, i, i, but, my, dna, was, not, affected, ., I, continue, with, my, meter, fifty, and, tiptoes, for, the, photo, grinning_face_with_sweatgrinning_face_with_sweat"
7462,"#, medtwitter, i, my, with, hiv, cdo, +, nadir, two hundred, initial, he, ten, ,, zero, ,, tar, started, five, weeks, ago, ., five, days, ago, they, placed, the, first, dose, of, pfizer, roam, ., He, goes, to, your, office, because, they, told, him, that, he, should, get, vaccinated, primarily, pneumococcal, ., what, comes"
7463,"at, walgreens, ,, local, pharmacy, ,, getting, my, second, dose, pfizer, ."
7464,"and, dose, pfizer, today, upside, -, down_face, send, movie, recs"
7465,"grinning_face_with_sweatgrinning_face_with_sweatgrinning_face_with_sweatgrinning_face_with_sweatgrinning_face_with_sweat, always, pfizer, never, pfizer, just, to, follow, the, joke, ,, the, best, vaccine, is, the, one, you, get"
7466,"twentyfour, hours, ago, I, was, vaccinated, with, the, #, pfizer, and, I, have, not, had, any, adverse, reaction, or, conversation, ., rolling_on_the_floor_laughing"
7467,"got, my, first, vaccine, shot, ,, i, made, sure, get, one, beautiful, people, get, ..., pfizer, rolling_on_the_floor_laughingskull"
7468,"that, pfizer, dem, incredible, hulk, ', i, will, have, you, acting, unusual, i, be, ..., folded_handsmedium, -, dark_skin_tone"
7469,"how, do, all, the, countries, in, the, world, that, are, vaccinating, with, pfizer, ., you, think, that, gato, colorado, is, unique, in, the, world, the, only, thing, is, Kirchnerism, a, stream, of, vaccines"
7470,"you, i, re, not, gonna, get, cv19, them, ,, but, lots, females, are, having, bleeding, problems, this, is, well, stated, pfizer, i, i, documents, ..., i, haven, i, i, had, any, problems, either, living, multigenerational, home, ,, but, many, have, one, my, friends, is, having, neuropathy, two, months, later"
7471,"june, ith, two thousand and twenty-one, took, stage, &, amp, ;, got, my, first, shot, pfizer, ., wasn, i, i, too, bad, ,, no, side, effects, or, anything, ,, just, felt, like, punch, arm, next, day, ., #, covidvacccine, #, pfizervacine, @, firstontario, arts, center, milton"
7472,"so, i, i, i, hearing, top, dry, saying, you, can, go, between, pfizer, modern, as, interchangeable, but, if, you, call, appointment, they, are, making, you, stick, with, your, original, shot"
7473,"if, vaccine, made, three hundred, million, americans, weaponized, killing, machines, government, ,, to, is, thirty, million, non, vaccinated, americans, going, do, about, it, lao, ., pfizer, gang, getting, one, day, multi, vitamin, gang, to, off, this, planet, flexed_bicepslight_skin_tone, lol, ."
7474,"day, after, second, pfizer, shot, ..., i, just, wanna, sleep, ."
7475,"skipping, out, work, early, today, take, our, youngest, her, second, pfizer, shot, ., two, short, weeks, ,, we, i, all, be, enjoying, drag, brunches, again"
7476,"pfizer, says, children, younger, than, six, months, age, may, subsequently, be, evaluated, vaccine, trial, ,, once, acceptable, safety, profile, is, established"
7477,"secondary, effects, after, the, and, dose, of, pfizer, -, in, me, -, after, twelve, hours, :, muscle, pain, ,, headache, ,, fever, and, tiredness, ., the, body, creates, antibodies, from, dead, couid, dna, ., the, second, dose, is, the, most, potent, than, the, first, in, the, secondary, effects, ., sunrise, in, florida, today, if, it, hurts, ."
7478,"looking, and, dose, pfizer, downtown, toronto"
7479,"kids, five, eleven, get, pfizer, couid, vaccine, ., tests, are, planned, ninety-eight, facilities, twenty-six, states, ,, district, columbia, ,, finland, ,, poland, spain, ."
7480,"i, i, ve, had, pfizer, and, dose, since, jan, twenty-seven, it, i, i, really, amazing, how, safe, *, and, *, effective, it, is, three hundred, mil, +, doses, with, essentially, no, side, effects, ., ~, ninety-four, %, efficient, ,, even, like, eighty-eight, %, efficient, against, strains, that, didn, i, i, yet, exist, when, it, was, made, so, i, i, i, like, pfizer, boostergrinning_squinting_face"
7481,"it, i, i, pfizer, ,, moment, ,, or, others"
7482,"had, first, ,, az, ,, apr, three, &, amp, ;, booked, portal, yesterday, my, second, ,, pfizer, /, modern, ,, june, twenty-six, ., simple, process, ., let, i, i, soooo"
7483,"i, ', i, immune, compromised, ,, i, had, no, reaction, pfizer, ,, at, all, ., no, sore, arm, ,, it, hurt, less, than, my, biologic, ., hoping, dose, #, two, goes, as, well"
7484,"whew, i, got, my, second, shot, yesterday, it, i, i, no, joke, loudly_crying_face, pfizer, gonna, take, my, ass, out"
7485,"wif, is, pfizer, grinning_face_with_sweat, my, arm, has, been, stiff, sore, all, day, smiling_face_with_tear"
7486,"took, me, hour, but, i, was, able, book, my, and, shot, at, eight, am, through, provincial, booking, system, june, twenty-six, but, this, afternoon, my, doctor, emailed, offering, pfizer, and, shot, me, this, thursday, syringe, which, i, jumped, at"
7487,"day, after, pfizer, can, be, doozy, ,, which, makes, me, feel, bit, bad, that, it, was, day, before, my, older, boy, ', i, with, birthday, ., but, he, was, feeling, much, better, today, ., it, is, good, hear, about, people, getting, their, shots"
7488,"Our, hope, is, rapid, -, acting, vaccination, ."
7489,"#, cao, #, popupvaccineclinic, is, offering, second, pfizer, doses, seniors, ages, seventy, older, any, frontline, health, worker, ., est, dose, anyone, twelve, years, above, ., register, please, click, link, below, :, #, covid19, #, pfizervaccine, #, 1stdosecovid19vaccine"
7490,"pfizer, first, dose, i, heard, second, is, worse, i, i, i, treat, ,, thank, you, red_heart, i"
7491,"the, third, dose, of, pfizer, will, be, needed, if, it, is, not, effective, against, the, different, couid, variants, ., Fortunately, ,, the, vaccine, maintains, its, function, against, variants, from, the, UK, ,, Brazil, ,, and, South, Africa, ."
7492,"i, ', i, full, -, blown, pfizer, princess, after, today, ., my, arm, guest, slightly, but, that, ', i, all, ;, i, ', i, hoping, when, i, wake, up, still, good, ."
7493,"based, uk, data, pfizer"
7494,"not, going, lie, ..., fact, that, they, hand, out, stickers, at, government, clinics, is, swaying, me, get, pfizer, my, and, dose, rather, than, astrazeneca, ., i, want, sticker, ."
7495,"i, i, ve, been, getting, them, again, first, time, years, i, did, not, even, make, connection, til, you, said, it, ., i, got, pfizer, month, ago, disappointed_face"
7496,"Today, I, have, received, my, second, pfizer, vaccination, ., I, choose, to, inject, at, cos, as, usual, ,, but, this, time, it, ', i, the, Boston, branch, ., The, first, round, was, injected, at, New, York, ', i, cos, pharmacy, ., with, many, branches, Almost, every, corner, of, the, city, in, the, US, is, similar, to, a, boots, store, ,, but, has, a, zone, for, various, vaccination, services, ., &, it, i, it, ;, This, thread, will, review, the, second, injection, ."
7497,"I, saw, this, if, I, ', i, not, mistaken, in, the, fantastic, ., and, yesterday, a, former, bolsonarista, neighbor, posted, on, my, instagram, a, photo, with, a, pfizer, vaccine, card, ., he, thought, he, was, going, to, attack, me, he, said, I, ', i, clueless, kak, ."
7498,"my, arms, so, sore, thanks, pfizer, vaccine, person_facepalming, i, male_sign, i, face_with_tears_of_joy"
7499,"wondering, why, you, need, 2ndsyringe, study, by, England, oh, shows, shieldagainst, delta, #, vow, after, 1stsyringe, az, or, pfizer, ~, thirty, %, shieldagainst, delta, #, vow, after, and, dose, az, ~, sixty, %, &, amp, ;, pfizer, ~, eighty-eight, %, keycard, *, these, numbers, reflect, down_arrow, i, risk, symptomatic, infection, #, sayyestovaccines, #, scicomm"
7500,"yes, vero, ,, according, to, pfizer, the, one, that, they, are, going, to, apply"
7501,"i, got, my, az, shot, april, one, this, afternoon, i, got, text, telling, me, i, can, have, az, second, shot, through, pharmacy, or, book, app, pfizer, or, modern, ,, i, immediately, went, web, site, made, app, ,, i, ', i, june, twenty-seven, abbotsford, ,, hubby, parents, all, this, week, two, syringe, ,"
7502,"where, did, you, hear, that, nonsense, all, vaccines, that, were, approved, were, due, operation, warp, speed, ., pfizer, ,, modern, ,, i, &, amp, ;, i, ., pres, ., trump, put, order, 100million, doses, each, vaccine, summer, two thousand and twenty, before, they, were, approved, ., then, 200mil, later, stop, listening, crazy, is, ."
7503,"i, spent, around, hour, waiting, phone, book, earlier, pfizer, shots, my, wife, myself, ., fruitful, effort, as, it, turns, out, ., we, are, now, booked, same, day, next, week, ., full, five, weeks, early, me, six, my, wife, ."
7504,"further, evidence, will, likely, be, elected, tokyo, next, month, :, said, i, there, may, be, requirement, state, present, whole, olympics, committee, about, olympics, ,, i, would, ', ve, been, vaccinated, that, is, why, i, had, pfizer, i"
7505,"I, know, they, have, said, ad, nauseam, that, there, is, no, need, to, stir, vaccines, ,, but, given, today, ', i, evidence, that, the, tiresome, vaccine, is, not, very, effective, ,, for, those, who, have, been, vaccinated, with, it, ,, it, would, be, prudent, to, get, vaccinated, again, ,, either, Pfizer, or, Az, ., thinks"
7506,"i, am, confused, by, data, delta, variant, so, if, i, get, two, doses, pfizer, vaccine, it, is, more, effective, than, one, dose, so, many, conflicting, info"
7507,"shame, off, pfizer, right, now, ., word, two"
7508,"see, tomorrow, planet, fitness, unless, this, second, pfizer, dose, puts, me, out"
7509,"i, got, notification, via, waitlist, costco, ., they, had, doses, use, so, they, opened, it, up, ., got, email, that, said, sign, up, if, you, had, your, first, dose, modern, or, az, before, april, with, as, they, only, have, modern, right, now, but, he, said, they, are, expecting, pfizer, later, this, week"
7510,"is, our, case, ., end, of, the, month, we, go, i, and, dose, of, pfizer, ., We, were, already, going, to, get, it, because, of, our, age, ,, but, not, my, seventeen, -, year, -, old, son, ,, so, we, took, advantage, of, the, trip, and, vaccinated, the, three, of, us, where, we, know, that, from, a, vial, they, will, only, get, five, doses, and, not, seven, ., I, don, ', i, plan, to, trust, #, death, with, my, health, ."
7511,"got, my, second, dose, couid, vaccine, so, far, so, good, ., i, hope, im, one, few, that, experience, no, side, effects, ., but, ,, hey, ,, im, fully, vad, yeee"
7512,"not, them, is, ones, ., i, ', i, only, few, pfizer"
7513,"it, is, expected, that, cac, /, fda, will, give, emergency, approval, pfizer, van, nine, -, eleven, year, olds, early, september, ., that, will, cover, kids, down, ord, grade, ., i, hopeful, that, with, full, fda, approval, ,, van, will, be, added, list, required, school, vaccinations, ."
7514,"pfizer, brothers"
7515,"six, us, got, it, aged, twelve, -, eighty, pfizer, we, are, great, ., eight hundred and ninety-four, ,, seven hundred and three, ,, zero, people, got, it, ., you, can, return, normal, much, easier, ., if, you, catch, couid, ,, you, are, much, less, likely, end, up, hospitalized, or, dead, ."
7516,"last, monday, ,, thirty-one, may, ,, my, son, received, his, first, dose, pfizer, biotech, vaccine, ., note, use, i, fast, food, i, paper, tray, hold, needles, in, ., he, is, booked, second, dose, twelve, weeks, ., @, mcbain, community, center"
7517,"great, job, team, ., they, just, keep, rolling, at, dome, ., over, 235k, shots, &, amp, ;, more, coming, ."
7518,"negative, per, -, i, can, enter, canada, wednesday, ., nice, fish, dinner, at, mia, ., off, spend, day, with, our, son, his, wife, ., first, time, i, ', ve, seen, them, since, last, february, ., home, quarantine, wednesday, face_with_rolling_eyes, will, be, fully, vaccinated, safe, after, that, thanks, pfizer, shot, yesterday, raising_hands"
7519,"just, had, old, plug, broward, text, my, number, like, pfizer, brand, fans, deck, tap, mobile_phone_with_arrowmobile_phone_with_arrowmobile_phone_with_arrow, i, i, i, so, dead, lao"
7520,"thanks, that, ., pretty, sure, i, i, i, going, go, with, pfizer, this, time, via, menu, ."
7521,"follow, up, questions, :, one, ., recommendations, #, couid, #, immunization, mad, or, other, i, -, cell, mediated, #, kidneydisease, two, ., suggestions, preventing, post, -, immunization, relapse, #, arsenal"
7522,"recommends, ,, if, possible, ,, apply, another, dose, of, pfizer"
