,0
3741,"$, 250m, we, wouldn, ', i, have, spend, if, trump, rest, gang, didn, ', i, lie, about, pandemic, all, year, pfizer, ,, biotech, ,, modern, couid, -, nineteen, vaccine, :, will, u, ., i, ., trust, it"
3742,"around, one, ,, zero, dosages, pfizer, couid, -, nineteen, vaccine, arrived, adams, county, tuesday, ,, dec, ., twenty-two, ."
3743,"lao, pfizer, took, no, money, us, uk, had, it, before, we, did, many, other, countries, had, vaccines, before, us, saved, our, economy, who, we, have, food, lines, not, seen, almost, 100yrs, pathetic, ,, narcissistic, propaganda, #, loserinchief, #, packyourshit, #, ourhousebitch"
3744,"#, thisisourshot, honoring, #, rig, &, amp, ;, others, who, have, died, two thousand and twenty, ., #, covidvaccine, #, science, is, amazing, ., #, wearamasksavealife"
3745,"wonderful, see, our, hero, protecting, his, patients, ,, family, ,, community, himself, ., will, be, comparing, notes, with, our, receiving, pfizer, version, ."
3746,"xmas, came, day, early, wrapped_gift, received, dose, keycap_1, couid, -, nineteen, vaccine, today, ., energy, hope, line, more, palpable, than, quick, easy, shot, administered, by, #, leadersandbest, hoping, all, my, colleagues, receive, theirs, soon, too, part_alternation_mark, i, #, shotheardroundtheworld"
3747,"and, so, you, go, out, to, stand, your, neck, ., they, are, really, lost, for, how, to, deal, with, a, pandemic, ., they, are, a, bunch, of, people, ., I, ', i, not, surprised, that, the, diplomats, and, relatives, have, already, received, the, dose, of, #, pfizer, #, amloelfracasopresidential, #, covid19mx, was, too, big, for, them, ., #, teambrozo"
3748,"Costa, Rica, ,, a, country, with, five, ,, sixty-nine, ,, nine hundred and twenty-nine, inhabitants, ,, received, nine, ,, seven hundred and fifty, doses, of, vaccine, against, couid, -, nineteen, today, ,, from, the, same, Pfizer, laboratory, ., mexico, with, almost, one hundred and thirty, million, received, three, ,, zero, doses, and, put, on, a, unique, show, ,, so, our, fourth, class, government, ., and, so, you, are, proud"
3749,"based, upon, past, performance, this, govt, i, will, have, call, is, this, report, ., until, modern, pfizer, release, actual, delivery, dates, quantities, our, govt, is, all, likelihood, lying, us, again, ."
3750,"great, description, pfizer, vaccine, layperson, ., perfect, nonscientist, family, friends"
3751,"the, main, islamic, authority, of, the, use, authorizes, the, pfizer, vaccine, despite, having, pork, gelatin, via"
3752,"merry, christmas, me, #, vaccine, very, fortunate, have, received, my, first, shot, pfizer, vaccine, today, ., adios, couid, -, nineteen"
3753,"i, like, that, one, better, over, pfizer, ., i, don, i, i, know, why, ., maybe, it, i, i, storage, it, ., it, seems, more, stable"
3754,"I, hope, you, don, ', i, report, them, because, they, won, ', i, happen, like, your, initiatives"
3755,"simulation, done, only, with, placebos, ,, instead, with, this, it, is, already, calibrated, with, the, real, product, and, its, needs, and, it, is, ensured, that, the, ask, on, the, way, are, insured, and, are, in, good, condition, as, they, are, sent, by, pfizer"
3756,"comparison, pfizer, modern, vaccines, ."
3757,"ten, ,, zero, doses, in, Chile, of, Pfizer, ,, three hundred, ,, zero, in, Argentina, of, "", the, Russian, vaccine, i"
3758,"the, chinese, biological, laboratory, in, whan, is, actually, owned, by, glad, ,, who, coincidentally, owns, /, majority, shareholder, of, pfizer, the, one, with, the, miracle, vaccine, for, couid, ,, who, coincidentally, handles, the, finances, of, black, rock, ,, who, coincidentally, handles, the, finances"
3759,"i, ana, brnabić, ,, was, administered, #, covidvaccine, #, pfizer, ,, &, amp, ;, not, government, -, hyped, ,, made, masses, russian, vaccine, ., am, i, only, one, who, sees, hypocrisy, /, irony, /, what, -, is, -, the, -, word, -, i, -, am, -, looking, -, for, here"
3760,"i, want, one"
3761,"more, information, here, backhand_index_pointing_downMexicozyringeface_with_medical_mask, #, vacunacovid19, #, vacunarusa, #, vaginas, #, vaccine, #, pfizerbiontech, #, mexico, #, covid_19mx, #, covid19, #, covidー19"
3762,"here, i, i, my, receipt, #, thankfulthursday, #, christmaseve2020, pfizer, #, covidvaccine, shot, #, 1check_mark_buttoncheck_mark_button"
3763,"trade, costco, bag, of, bread, for, pfizer, or, modern, vaccine"
3764,"ah, i, meant, only, tag, op, loudly_crying_face, but, yes, that, was, my, point, i, fears, associated, i, vaccines, like, mar, i, ., e, ., contracting, mild, case, measles, are, just, not, even, relevant, pfizer, vaccine, ., so, it, seems, dangerous, joke, abt, it, considering, reluctance, those, kinds, vaccines, ."
3765,"a, fifty-nine, -, year, -, old, nurse, is, the, first, person, to, receive, the, pfizer, vaccine, against, couid, -, nineteen, in, mexico, -, it, hahaha"
3766,"my, eighty-six, -, year, -, old, mother, requests, that, i, "", pull, some, strings, "", get, her, vaccination, ., so, if, anyone, wants, put, some, that, pfizer, or, modern, goodness, my, stocking, ,, there, will, be, cookies, wee, nip, something, stronger, by, fireplace, you, ., Christmas_treesyringe"
3767,"the, vaccine, #, pfizer, #, covid_19mx, ceases, to, be, neoliberal, if, it, is, distributed"
3768,"grateful, folded_hands, revolutionary, mrna, technology, that, made, this, vaccine, possible, can, i, i, wait, day, when, all, my, family, ,, friends, patients, are, able, get, theirs, too, syringeflexed_biceps, #, notthrowingawaymyshot, #, beatcovid"
3769,"On, Tuesday, ,, fifty, ,, zero, vaccines, arrive, plus, Mexico, ., #, pfizer"
3770,"well, if, our, healthcare, worker, become, infected, with, virus, they, can, i, i, work, ,, which, means, if, your, parents, wins, up, hospital, there, may, not, be, enough, healthy, staff, save, them, ., you, seem, selfish, me, ."
3771,"Yesterday, I, received, the, Pfizer, vaccine, against, couid, -, nineteen, ., After, almost, twentyfour, hours, I, have, not, experienced, side, effects, other, than, the, typical, discomfort, in, the, arm, that, one, has, after, a, vaccine, Hispanic, brothers, the, vaccine, is, safe"
3772,"agreed, individual, side, ., i, i, i, curious, about, supply, side, ., so, if, institution, is, giving, their, workers, pfizer, instead, modern, ..., why, just, random, because, pfizer, was, first, just, curious"
3773,"damn, government, ., How, is, it, possible, that, they, cannot, force, Pfizer, to, manufacture, more, than, one hundred, million, vaccines, in, three, days, and, also, fit, them, all, on, a, single, plane, ?"
3774,"yesterday, ,, costa, rica, recorded, fourteen, deaths, and, yesterday, ,, wednesday, twenty-three, ,, received, nine, ,, seven hundred and fifty, doses, of, the, pfizer, vaccine, ;, Chile, registered, eleven, deaths, yesterday, and, today, ten, ,, zero, doses, of, the, same, vaccine, arrived, in, that, country, ;, this, ,, to, give, context, to, the, ineptitude, of, our, govt, ,, including"
3775,"I, would, only, wear, the, pfizer, or, modern, one, ."
3776,"most, important, sentence, this, article, is, ...“, spokespeople, pfizer, ,, modern, astrazeneca, have, said, that, pork, products, are, not, part, their, couid, -, nineteen, vaccines, i, this, something, we, can, all, do, ."
3777,"what, is, factor, driving, whether, some, people, get, pfizer, versus, modern, vaccine, cost, availability, no, particular, reason"
3778,"well, i, i, i, doctor, i, volunteered, be, one, pfizer, i, i, i, guinea, pigs, i, aug, ., nineteen, ,, two thousand and twenty, ., there, were, also, many, non, healthcare, workers, who, did, same, ., bow, ,, medical, research, we, call, them, brave, volunteers, ,, because, that, i, i, what, they, are, ."
3779,""", This, is, the, best, gift, i, were, the, words, of, maria, Irene, ramirez, ,, head, of, nursing, at, the, General, Hospital, of, Mexico, ,, Mexico, ., She, was, the, first, person, to, receive, the, syringe, pfizer, vaccine, against, sars, -, cov, -, two, in, Mexican, territory, ., follow, my, channel, telegram, mobile_phone_with_arrow"
3780,"Mexico, is, the, est, country, in, Latin, America, to, start, the, application, of, the, anti, #, covid19, vaccine, ., The, head, of, nursing, at, ruben, lever, Hospital, ,, maria, Irene, ramirez, ,, is, the, est, person, to, receive, the, Pfizer, vaccine, ., #, merrychristmasnight, white_heart"
3781,"second, shot, three, weeks, ., pfizer, is, series, two, injections, three, weeks, apart"
3782,"si, esos, de, del, y, pfizer, son, unos, calvados, grinning_face_with_sweatgrinning_face_with_sweatmoney_with_wingsmoney_with_wingsmoney_with_wings"
3783,"day, three, since, receiving, pfizer, couid, vaccine, :, no, acquired, superpowers, yet, ..., dammit, ., maybe, i, i, all, turn, into, werewolf, -, just, have, wait, next, full, moon, ., seriously, ,, though, -, feeling, no, side, effects, physically, ., #, getvaccinated, #, wearamask"
3784,"#, covid19, #, vacunacovid19, #, pfizer, for, the, first, time, in, Latin, America, the, vaccine, that, fights, #, sarscov2, was, applied"
3785,"pure, blowjob, a, lot, of, blah, blah, blah, ., there, are, two hundred and eleven, million, vaccines, that, will, arrive, ., via, cancion, ,, pfizer, ,, sputnik, ,, etc, ., what, it, is, to, be, stupid, ."
3786,"for, these, actions, he, does, not, send, us, more, vaccines, ."
3787,"it, is, lack, of, mother"
3788,"curious, if, you, get, pfizer, dose, first, shot, ,, does, it, have, be, pfizer, dose, as, second, shot, or, can, it, be, modern, as, second, shot, vice, versa, anyone, know, answer"
3789,"it, will, not, be, non, -, payment"
3790,"side, -, by, -, side, comparison, pfizer, /, biotech, modern, vaccines, via"
3791,"The, arrival, of, the, vaccine, is, not, a, success, ,, the, amount, sent, is, not, even, equivalent, to, zero, ., one, %, of, the, population, ,, victory, will, be, when, the, majority, of, Mexicans, are, vaccinated, ."
3792,"thinking_face, i, then, let, i, i, get, me, those, twenty, its, about, time, you, can, track, me, with, something, but, my, cellphone, grinning_squinting_face, #, covidvaccinesideeffects, microbe, #, pandemiclife"
3793,"thread, by, :, mrna, vaccines, pfizer, modern, are, kind, brilliant, at, science, level, ., i, i, ve, had, few, people, my, real, non, -, twitter, life, ask, me, explain, how, it, works, so, i, i, i, going, ..."
3794,"#, HappyChristmas, Eve, #, pfizer, -, begins, with, the, vaccine, against, #, covid19, in, #, mexico, and, will, continue, for, several, months, ., i"
3795,"well, ,, when, i, went, to, montreal, canada, leaving, chihuahua, ,, the, aircraft, that, left, cut, was, never, abroad, ., so, how, can, you, get, to, canada, only, idea, pays, aeroméxico, for, direct, flights, to, bring, chinese, things, ., pfizer, sure, uses, different, logistics, ."
3796,"i, wont, take, pfizer, vac, because, it, could, have, dropped, temp, not, be, effective, you, think, youre, covered, youre, not, take, modern, it, only, needs, be, fridge"
3797,"modern, is, ok, no, hassle, about, administration, like, pfizer, saw, massachusetts, report, ok"
3798,"a, great, day, raising_handslight_skin_tone"
3799,"the, meme, is, repeated"
3800,"three hundred, thousand, doses, sputnik, i, for, argentina, ,, mexico, receives, three, thousand, from, pfizer, ., Didn, ', i, pharmaceutical, companies, rule, Mexico, ?, Will, marcel, and, gately, continue, to, block, Sputnik, just, because, it, suits, their, business, ?, Don, ', i, turn, a, deaf, ear, and, authorize, Sputnik, ."
3801,"what, sticks, out, me, is, modern, vaccine, seems, more, promising, "", new, strain, "", pfizer, couid, -, nineteen, vaccine, causing, more, allergic, reactions, than, expected, via"
3802,"maria, Irene, ramirez, ,, the, first, Mexican, to, be, vaccinated, against, #, covid_19, with, the, vaccine, and, Mexicothumbs_upmedium, -, light_skin_toneChristmas_tree, the, best, Christmas, gift, for, doctors, ."
3803,"you, have, to, do, a, circus"
3804,"three, days, in, ..., still, no, super, powers, confused_face, wishful, thinking, at, this, point"
3805,"maria, Irene, ramirez, ,, specialist, nurse, ,, is, the, first, to, receive, the, Pfizer, couid, vaccine, in, the, universal, coverage, campaign, launched, by, the, Mexican, government"
3806,"Nurse, maria, Irene, is, the, first, #, Mexican, to, receive, Pfizer, ', i, first, authorized, vaccine, against, #, Covid19"
3807,"this, is, the, perfect, example, of, someone, whose, reasoning, is, simplistic, ,, since, it, is, a, fallacy, of, hasty, conclusion, ., The, problem, is, not, that, they, don, ', i, send, one, ,, two hundred, ,, zero, ,, zero, doses, ,, but, that, three, ,, zero, is, less, than, the, five, ,, zero, that, should, be, in, a, Pfizer, container, ."
3808,"pfizer, agreed, sell, us, government, $, one, ., ab, vaccines, ., so, ,, no, ,, they, didn, ', i, accept, money, up, front, ., but, they, were, certainly, motivated, get, vaccine, quickly, ., just, give, credit, where, it, ', i, due, ., it, ', i, not, that, hard, ."
3809,"rollout, pfizer, vaccine, has, been, underway, several, days, my, region, ., they, have, limited, it, one hundred, /, day, but, real, limiting, factor, is, limited, supply, three thousand, nine hundred, ., oh, is, considering, allowing, meds, administer, modern, their, offices, ."
3810,"david, glamour, is, genius, ., awesome, pfizer, vaccine, ."
3811,"damn, government, ., How, is, it, possible, that, they, do, not, force, Pfizer, to, manufacture, more, than, one hundred, million, vaccines, in, three, days, and, also, fit, them, all, on, a, single, plane, ?"
3812,"damn, government, ., How, is, it, possible, that, Pfizer, does, not, manufacture, more, than, one hundred, million, vaccines, in, three, days, to, fit, them, all, on, a, single, plane, ?"
3813,"With, gimmicky, information, ,, the, damage, that, ammo, and, gately, have, done, to, him, and, continue, to, do, to, the, nation, via, couid, -, nineteen, is, not, compensated, ., If, you, want, to, start, your, propaganda, with, a, view, to, the, just, ,, start, by, acknowledging, the, great, mistakes, that, ammo, has, made, in, just, two, years, of, government, ."
3814,"got, my, first, vaccine, last, friday, ,, so, i, ', i, hopeful, single, antibody, that, i, ', ve, acquired, blesses, me, keeps, me, safe, ., folded_hands"
3815,"look, marcella, says, pfizer, that, you, sent, the, leftovers, ,, that, once, you, deposited, they, send, you, more, chili, ask, doses, arrived"
3816,"It, is, a, pity, that, the, priority, that, the, pfizer, vaccine, receives, today, has, not, received, the, vaccine, to, prevent, tuberculosis, ,, or, the, one, to, prevent, measles, ,, or, the, drugs, necessary, for, chemotherapy, for, children, with, cancer, ."
3817,"let, i, i, wait, see, what, have, say, after, testing, uk, variant, ."
3818,"got, pfizer, couid, vaccine, yesterday, ., bad, headache, chills, sore, arm, ., im, happy"
3819,"i, had, it, pfizer, one, ., bad, headache, this, ming, sixteen, hours, after, getting, it, ., arms, hurt, ., chills, all, nite"
3820,"modern, sounds, like, model, which, is, my, favorite, beer, ., pfizer, sounds, like, fizzy, drink, ,, no, punch"
3821,"the, most, expensive, vaccines, are, pfizer, /, biotech, and, modern, ., According, to, what, I, have, read, ,, the, first, has, a, cost, of, twenty, dollars, and, the, second, of, twentyfive, dollars, ."
3822,"Looking, back, on, two thousand and twenty, January, i, Tech, Blog, February, i, Tech, Blog, March, i, ny, business, trip, during, corona, shock, April, i, Start, writing, stock, articles, after, too, much, time, May, i, $, fly, June, i, $, ton, July, i, $, logo, August, i, I, ', i, tired, of, self, -, restraint, September, i, Youtube, starts, October, i, $, am, $, ton, Kita, November, i, pfizer, is, murderous, ., Report, after, Friday, closing, December, i, $, ark"
3823,"mediocre, circus"
3824,"three, thousand, pinchurrientas, vaccines"
3825,"The, company, then, replied, :, ten, million, for, me, ,, ten, million, for, you, ,, six, million, to, buy, the, pfizer, product, and, the, restaurant, to, pay, the, press, ,, the, other, governors, and, judges, ., which, company, sold, i, bidding, i, is, worth, remembering, that, this, is, just, a, joke, ."
3826,"a, governor, made, a, bid, to, purchase, vaccines, ., three, companies, appeared, ., one, -, pfizer, charged, five, billion, two, -, astrazeneca, charged, six, billion, three, -, coronavac, charged, fifty, billion, the, governor, asked, the, Chinese, company, because, its, price, was, so, much, higher, than, the, others, ..."
3827,"umm, pfizer, didn, ', i, take, any, money, ,, was, made, with, german, biotech, ,, was, administered, uk, before, it, was, even, approved, here, ., quit, giving, him, credit, what, he, never, did, ."
3828,"is, depression, side, effect, or, is, it, just, me, what, heck, man, i, i, i, legit, having, episode, here, #, covidvaccine"
3829,"i, believe, they, should, be, given, pharmaceutical, companies, like, should, be, donating, these, supposed, vaccines"
3830,"all, congressmen, /, women, senators, should, be, given, vaccine, along, with, everyone, at, first, if, they, show, no, side, effect, then, population"
3831,"It, says, that, Costa, Rica, also, received, the, Pfizer, vaccine, yesterday, ,, Wednesday, the, hard, ;, nine, ,, seven hundred and fifty, doses"
3832,"says, that, costa, rica, received, yesterday, ,, wednesday, twenty-three, ,, nine, ,, seven hundred and fifty, doses, of, pfizer, vaccines"
3833,"Attention, :, another, Latin, American, government, that, received, the, Pfizer, vaccine, on, Wednesday, ,, December, twenty-three, ;, nine, ,, seven hundred and fifty, doses, backhand_index_pointing_downbackhand_index_pointing_downbackhand_index_pointing_down"
3834,"These, first, ones, were, tests, to, calibrate, the, cold, chain, that, they, require, ,, by, January, thirty-one, they, must, have, arrived, at, least, one, million, ,, anyway, daddy, Pfizer, does, not, work, maquiladora, just, for, Mexico, I, remind, you, ,, no, country, is, going, to, be, able, to, vaccinate, its, entire, population, not, even, in, a, full, year"
3835,"a, load, of, #, oncology, drugs, produced, by, #, pfizer"
3836,"five, -, canada, :, seventeen, ,, zero, immunized, since, December, fourteen, pfizer, -, biotech, ., six, -, israel, :, ten, ,, zero, vaccinated, since, december, twenty, pfizer, -, biotech, ., dizer, -, biotech, ."
3837,"two, -, united, states, :, six hundred and fifteen, ,, zero, vaccinated, since, december, fourteen, pfizer, -, biotech, ,, modern, ., three, -, united, kingdom, :, five hundred, ,, zero, inoculated, since, december, eight, pfizer, -, biotech, ., four, -, russia, :, three hundred and twenty, ,, zero, since, august, sputnik, i, ."
3838,"It, is, your, obligation, ,, not"
3839,"#, theimageoftheday, camera_with_flash, of, course, it, is, the, arrival, of, the, vaccine, syringe, pfizer, -, biotech, mexico, Mexico, only, three, ,, zero, doses, arrived, ,, but, well, ..., there, is, hope, anyway, ., follow, my, channel, telegram, mobile_phone_with_arrow"
3840,"merk, is, manufacture, ivermectin, ., they, are, also, partners, with, modern, pfizer, ., ivermectin, is, now, being, used, offlames, all, over, world, treatment, prevention, couid, -, nineteen, ., it, might, be, posible, that, merk, is, not, increasing, production, ivermectin, due, tothe, vaccine"
3841,"i, wonder, if, people, receiving, pfizer, or, modern, van, are, being, informed, there, ', i, good, chance, they, ', all, need, month, or, yr, booster, shots, i, for, life, ., i, #, covid19"
3842,"This, is, the, injection, of, pfizer, ."
3843,"are, you, seriously, i, treating, i, vaccine, recipients, i, big, sugar, caramel, bars, when, metabolic, syndrome, is, linked, covid19, death, under, is"
3844,"The, modern, vaccine, has, recently, arrived, on, the, American, market, ,, which, requires, normal, refrigeration, ., Pfizer, requires, seventy, -, ninety, degrees, Fahrenheit, ., @, boston, ,, massachusetts"
3845,"when, they, just, tweet, for, tweeting, without, knowing, the, delivery, plan, for, pfizer, or, other, pre, -, purchased, vaccines, ,, or, the, vaccination, plan, person_facepalming, i, male_sign, i, Do, you, like, to, show, off, your, ignorance, by, yourself, because, of, your, ideological, bias, ?, person_shrugging"
3846,"pfizer, lurking, ., even, batman, needs, get, boners, face_with_tears_of_joyface_with_tears_of_joy"
3847,"you, are, six, years, old"
3848,"although, there, was, no, austerity, in, the, packaging, ,, the, nine, ,, seven hundred and fifty, pfizer, vaccines, that, costa, rica, has, just, received, look, very, different"
3849,"costa, rica, just, received, nine, ,, seven hundred and fifty, doses, of, the, same, pfizer, vaccine, but, you, already, saw, the, packaging"
3850,"no, digo, que, sean, los, mes, eficientes, ..., pero, eso, lo, sabers, ., face_with_tears_of_joyface_with_tears_of_joyface_with_tears_of_joy"
3851,"pfizer, did, not, want, to, send, more, ., but, the, opposition, doesn, ', i, understand, that, ,, I, hope, the, other, metal, nitro, vaccines, hurry, up, please, ..."
3852,"I, understand, that, the, refrigerated, container, with, the, vaccines, comes, inside, the, cargo, container, and, is, specially, designed, ., and, you, don, ', i, use, a, seven hundred and thirty-seven, to, cross, the, atlantic, ., obviously, made, a, stopover, ., belgium, -, cincinnati, -, gal, -, come, ., winking_face"
3853,"clarify, ,, there, ', i, no, evidence, yet, that, mrna, vaccines, like, pfizer, ', i, or, modern, ', i, will, offer, protection, against, #, covid19, longer, than, yr, or, even, less, ., booster, shots, may, be, needed, every, three, months, ,, six, months, ,, or, year, ,, depending, age, patient, ., linkmore, :"
3854,""", the, first, batch, of, the, pfizer, /, biotech, vaccine, against, couid, -, nineteen, arrives, in, mexico, """
3855,"The, fucking, brad, thinks, he, ', i, got, sesame, seeds, ,, now, it, turns, out, that, the, vaccine, came, out, in, less, than, a, year, ,, that, takes, years, ,, my, ., pfizer, ', i, couid, -, nineteen, vaccine, arrived, in, mexico, :, that, ', i, how, it, was, -, uno, to"
3856,"too, ,, but, I, don, ', i, see, that, they, recognize, the, good, ,, you, have, to, be, objective"
3857,"no, I, did, not, forget, ,, but, it, is, also, more, than, evident, that, they, only, mark, the, bad, ,, there, is, be, to, be, objective"
3858,"super, how, they, plan, to, distribute, them, ,, who, and, when"
3859,"this, was, what, hurt, you, ,, president, ,, correct, it, ,, bring, the, vaccines, that, you, said, they, were, already, doing, in, argentina, and, the, ones, that, pfizer, bought, ,, comply, ,, stop, politicking, and, campaigning, ,, work, for, the, good, of, mexico, ,, not, just, yours"
3860,"wow, i, am, so, grateful, i, am, receiving, est, dose, vaccine, ., i, i, i, doing, my, part, keep, you, i, safe, i, hope, when, it, i, i, your, turn, you, do, same, ., #, pfizercovidvaccine, #, healthcareheroes, #, vaccinessavelives"
3861,"is, anyone, selling, pfizer, merch, yet"
3862,"Mexico, today, receives, three, ,, zero, Pfizer, vaccines, as, a, cover, to, deceive, the, population, ., However, ,, what, is, really, plotting, this, it, ,, and, they, have, already, paid, for, them, ,, are, thirty-five, million, Chinese, cancion, vaccines, because, Mexico, did, not, buy, all, the, Pfizer, vaccines"
3863,"thanks, ,, ,, pal, who, participated, trials, ..., i, got, couid, vaccine, today, ., thank, you, hard, working, staff, working, long, hours, safely, deliver, it, ., zero, side, effects, thus, far, other, than, increased, feeling, hope, excitement, two thousand and twenty-one"
3864,"pfizer, porridge"
3865,"so, we, are, going, to, get, it, in, tepid"
3866,"sixty-one, his, i, /, i, vaccination, couid, -, nineteen, by, pfizer, ., subjective, :, no, pain, at, injection, site, i, deltoid, ., i, have, been, checking, i, -, safe, ., no, swelling, ,, no, warmth, ,, no, bruising, injection, site, ., no, fever, ,, no, malaise, ., no, other, symptoms, ., so, we, are, celebrating, ., injection, 8Happy_face_smiley5am, twelve, /, twentynine, /, twenty"
3867,"one, /, it, i, i, not, official, until, there, i, i, #, covidvaccine, selfie, so, said, angel, that, gave, me, mine, syringe, one, :, microbe, #, covid19, zero"
3868,"there, are, three, thousand, since, the, and, injection, of, the, vaccine, is, twenty-eight, days, later, and, in, that, time, thousands, of, more, doses, will, have, arrived, or, according, to, pfizer, ', i, distribution, plan, we, will, approach, the, one, ., four, million, doses, that, are, estimated, for, the, end, of, January, relieved_face, ."
3869,"hahahaha, my, ardillometro, detects, that, this, vaccine, thing, is, what, has, caused, the, most, heat, in, the, opposition, ., and, from, the, note, ,, it, seems, that, you, have, never, ordered, anything, from, other, countries, ., they, wanted, a, pfizer, flight, to, mars, field, ."
3870,"#, cannoli, #, spoil, #, coronavirus, #, covid19, #, modern, #, covidvaccine, update, :, as, is, case, pfizer, vaccine, ,, modern, vaccine, also, uses, messenger, rna, not, dead, or, attenuated, virus, ., both, vaccines, are, not, capable, inadvertently, giving, you, couid, -, nineteen, ., ."
3871,"pfizer, nears, trump, deal, ;, tens, millions, more, vaccine, doses, #, newsman, via"
3872,"pfizer, vaccines, against, couid, -, nineteen, will, arrive, in, no, in, january, ., do, Manuel, de, la, O, calvados, ,, state, health, secretary, ,, stated, that, the, first, doses, of, #, pfizer, will, arrive, at, the, entity, between, January, fifteen, and, thirty-one, ,, although, it, is, a, tentative, date, ."
3873,"pfizer, seals, deal, with, u, ., i, ., one hundred, million, more, vaccine, doses, i, as, part, deal, ,, government, agreed, invoke, defense, production, act, help, pfizer, get, better, access, around, nine, specialized, products, it, needs, make, vaccine, i"
