,0
27393,"hi, i, got, first, -, dose, pfizer, scheduled, ,, but, can, i, i, find, second, -, does, appointment, in, ., will, i, lose, first, -, dose, appointment, if, i, can, i, i, schedule, second, one"
27394,"i, had, pfizer, also, same, side, effects, ., i, agree, benefits, including, peace, mind, are, worth, it, have, great, day, happy, easter, hatching_chick"
27395,"pfizer, freaks, unite, hundred_pointshundred_points"
27396,"i, had, my, first, pfizer, dose, yesterday, ., it, i, i, shot, -, mine, was, barely, noticeable, arm, started, hurting, some, hour, later, ., hurts, some, today, ., don, i, i, take, anti, -, inflammatories, before, vaccination, ."
27397,"almost, no, side, effects, either, pfizer, one, or, two, ., monroe, county, numbers, are, easy, read, ., folks, over, seventy, ,, most, whom, have, gotten, their, shots, ,, aren, i, i, getting, couid, ., please, ,, everyone, ,, get, vaccinated, as, soon, as, you, can, get, appointment"
27398,"obligatory, vaccination, photo, two, /, two, pfizer, down, looking, forward, becoming, zombie, together, with, you, all, ., face_blowing_a_kiss, @, edgar, evers, college, ,, cunt"
27399,"curled, my, hair, wore, some, makeup, my, second, dose, wednesday, #, covidvacccine, #, seconddose, #, pfizer, #, wearamask, #, purplehair, #, magentahair, #, lilacyoualotpalette"
27400,"i, got, my, first, pfizer, shot, today, super, efficient, process, at, let, i, i, beat, this, #, pfizervaccine, #, covid19, #, markup, #, cleveland, #, weareinthistogether"
27401,"that, moment, when, you, finally, get, pfizer"
27402,"pfizer, ., slept, like, log, after, first, shot, unusual, me, ., no, reaction, second, ."
27403,"doses, astrazeneca, three hundred and thirty-nine thousand, six hundred, arrive, in, quebec, modern, still, owes, us, one hundred and thirty-five thousand, one hundred, doses, from, last, week, suppose, to, arrive, weekend, week, five, at, eleven, pfizer, two hundred and thirty thousand, four hundred and ninety, modern, one hundred and seventy-six thousand, four hundred, coax, az, seventy-one thousand, six hundred"
27404,"officially, pfizer, altar, -, struck"
27405,"vaccine, needle, pfizer, i, ', i, pretty, sure, modern, as, well, is, tiny, ., i, barely, even, felt, stick, ."
27406,"i, i, i, more, microphone, licker, like, robert"
27407,"ugh, sorry, hear"
27408,"pfizer, vaccine, here, i, come"
27409,"who, ', i, team, pfizer, who, ', i, team, modern, who, ', i, team, johnson, johnson"
27410,"happy, pfizer, friday, everyone"
27411,"well, first, dose, of, pfizer, in, my, body, syringe, flexed_bicepslight_skin_tone, #, vaccinated"
27412,"this, article, by, fda, says, they, approve, pfizer, ,, modern, ,, johnson, &, amp, ;, johnson, vaccines, ."
27413,"vaccinated, xu, victory_handmedium, -, light_skin_tonesyringe, got, my, second, dose, couid, pfizer, vaccine, this, morning, ,, i, couldn, i, i, be, more, grateful, red_heart, i, #, educatedandvaccinated, #, shotofhope, #, teacherlife, #, covidvaccine"
27414,"just, got, astrazeneca, three hundred and thirty-nine thousand, six hundred, doses, modern, owes, us, about, one hundred and thirty thousand, doses, from, last, week, expect, to, arrive, tomorrow, next, week, pfizer, two hundred and thirty thousand, four hundred and ninety, modern, one hundred and seventy-six thousand, four hundred, coax, az, seventy-one thousand, six hundred"
27415,"excellent, i, got, my, first, pfizer, jab, this, morning, too"
27416,"i, am, grateful, be, able, get, appointment, pfizer, vaccine, ., it, helps, have, such, great, caring, people, community, at, this, time, ., this, group, helps, more, more, people, get, vaccinated, ., thank, you, admins, if, anyone, needs, help, around, in, i, can, help, too"
27417,"also, west, valencia, campus, is, doing, vaccines, as, well, starting, monday, ., u, don, i, i, need, app, ,, it, is, am, -, up, they, have, pfizer, +, johnson, &, amp, ;, johnson"
27418,"twentyfour, hours, into, pfizer, two, it, i, i, not, most, pleasant, i, i, ve, felt, my, life, say, least, ."
27419,"pfizer, ., but, i, may, not, feel, as, shitty, as, last, time, ."
27420,"all, this, time, i, thought, i, had, pfizer, shot, my, ass, has, modern, weary_face"
27421,"I, already, read, it, all, I, finished, thank, you, very, much, for, sharing, ,, I, know, that, my, dad, has, the, first, one, from, pfizer"
27422,"how, fuck, does, my, fop, know, i, got, pfizer"
27423,"i, have, mine, scheduled, as, well, ..., pueblo, ., hoping, some, closer, pfizer, apps, open, up, at, least, one, them, ,, but, i, i, i, willing, drive, bit, ., i"
27424,"if, person, received, their, first, pfizer, vaccine, at, location, other, than, jackson, but, that, location, has, been, unable, provide, second, dosage, can, they, get, second, dosage, at, jackson, location"
27425,"i, had, my, first, dose, pfizer, few, days, ago, ., next, day, felt, like, someone, punched, me, arm, couple, times, ., little, bit, headache, last, few, days, ., i, have, heard, second, dose, comes, with, few, days, flu, like, symptoms, ., body, aches, ect"
27426,"pfizer, has, entered, my, bodyyyyyyy, syringemicrobe"
27427,"i, got, pfizer, i, &, amp, ;, i, ., one, right, arm, other, my, mans, pubis, ., at, same, damn, time"
27428,"first, shot, done, great, work, public, health, super, efficient, process"
27429,"all, done, ., pfizer, ., #, two, four, /, twenty-three, ."
27430,"i, know, ..., i, know, ..., how, oh, so, very, pfizer, me"
27431,"i, am, already, beyond, second, dose, date, buddy, pfizer, told, me, that, efficacy, drops, fast, cancer, patients, people, with, compromised, immune, systems, ., don, ', i, brag, about, being, only, country, that, is, making, up, rules, as, it, goes, along, ., sucking, up, china, cost, lot, lives"
27432,"joining, pfizer, gang, monday, sign_of_the_hornslight_skin_tone"
27433,"one hundred, %, microchipped, by, bill, gates, pfizer, ., no, morning, after, side, effects, yet, ., but, i, feel, urge, dump, my, iphone, android, ."
27434,"my, first, vaccine, is, too, but, i, ', i, not, sure, if, it, ', i, pfizer, ."
27435,"got, vaccine, party_popperparty_popperparty_popper"
27436,"it, is, i, had, my, two, with, pfizer, &, amp, ;, little, no, reaction, but, sore, arm, day"
27437,"i, was, wondering, ., i, i, i, heard, that, pfizer, i, i, effects, were, more, often, felt, after, first, shot, modern, second, ,, but, i, i, i, sure, it, varies, person, person, ., coworker, just, texted, said, she, was, very, fatigued, after, and, pfizer, ."
27438,"oh, boy, ,, i, ', ve, hearing, stories, like, this, i, suppose, it, doesn, ', i, matter, which, type, shot, modern, ,, pfizer, ya, got, ,, it, ', i, all, still, gonna, suck, and, go, around, ., i, get, my, first, shot, this, upcoming, tuesday, ., anyhow, ,, good, luck, man, ,, i, hope, you, feel, better, real, soon"
27439,"modern, or, pfizer"
27440,"update, :, pfizer, vaccine, just, feels, like, tetanus, ,, be, not, afraid"
27441,"other, than, fatigue, ,, i, was, spared, any, major, side, effects, my, second, pfizer, dose, ., excited, see, lots, friends, getting, appointments, next, week"
27442,"yep, ., house, pfizer, here, crossed_fingersmedium_skin_tone"
27443,"you, know, how, much, i, love, my, birthday, celebrations, zany_face"
27444,"which, one, i, got, one, pfizer, so, far"
27445,"Remittance, of, eighteen, thousand, seven hundred, doses, of, Pfizer, vaccine, arrives, for, Baja, California"
27446,"not, pfizer, ., he, just, did, what, leaders, all, over, world, did, ., then, he, played, down, need, mask, up, maintain, distance, ., so, now, right, wingers, my, family, swear, that, they, won, ', i, get, vaccinated, ., five hundred and sixty, ,, zero, dead, ."
27447,"i, i, i, at, ddo, civic, center, i, getting, my, first, dose, #, pfizer, vaccination, ., everything, makeshift, clinic, is, clean, orderly, ., i, am, very, impressed, ."
27448,"got, some, that, sweet, ,, sweet, pfizer, me, thank, you, ,, science, party_popperpartying_faceclinking_glasses"
27449,"also, joined, team, pfizer, ,, and, shot, few, weeks, ., very, excited, start, seeing, people, more, regularly, soon"
27450,"boathouse, sports, proudly, made, philadelphia, ,, pa"
27451,"got, my, est, pfizer, dose, monday, will, get, my, and, with, thank, you, getting, it, out, there, us, ., can, ', i, wait, just, see, few, dear, friends, ., we, have, been, mourning, alone, too, long, ."
27452,"i, -, i, i, i, thirty, ., had, my, second, pfizer, shot, this, week, next, day, had, fever, over, one hundred, ,, was, nauseous, ,, exhausted, ,, lots, joint, pain, ., but, -, very, happy, be, vaccinated"
27453,"also, i, got, pfizer, too, thisfor, worst, part, is, how, bad, my, arm, hurts, ., it, ', i, like, pretty, deep, bone, bruise, kind, hurt, i, ', i, bit, sniffly, ., but, otherwise, not, too, shabby"
27454,"first, shot, pfizer, ,, smack, tree, life, loudly_crying_facered_heart, i, loudly_crying_facered_heart, i"
27455,"had, my, and, dose, pfizer, last, tuesday, ..., such, relief, ..., it, makes, difference, my, attitude, ...."
27456,"i, got, my, first, couid, -, nineteen, vaccine, today, huge, thank, you, staff, at, quick, ,, easy, ,, painless, #, covidvacccine, #, pontiac, #, michigan, #, pfizer, #, 1stdosedonesyringecheck_mark, i, #, vaccine, @, pontiac, ,, michigan"
27457,"just, got, pfizer, shot, #, two, ,, nine hundred and twenty-six, local, ., no, pain, at, all, ., med, tech, was, so, smooth, ."
27458,"got, second, dose, pfizer, vaccine, yesterday, afternoon, at, up, ., few, ,, here, are, my, symptoms, so, far, ..., started, getting, achy, around, hour, five, along, with, headache, ., got, little, worse, by, hour, eight, ., then, started, feel, lightheaded, foggy, by, hour, nine, ., ex"
27459,"pfizer, poke, #, two, i, i, i, vaccinated, @, nag, stadium"
27460,"i, just, scheduled, my, pfizer, i, i, i, coming, dew, tuesday"
27461,"both, my, kids, had, their, first, shot, pfizer, now, almost, there, ."
27462,"new, :, holding, student, -, run, couid, vaccination, clinic, campus, students, staff, ., they, are, vaccinating, hundreds, students, with, pfizer, vaccine, more, tonight"
27463,"does, it, seem, you, like, pfizer, i, i, ninety-five, %, efficacy, rate, means, their, vaccine, is, much, better, than, johnson, &, amp, ;, johnson, i, i, at, sixty-six, %, here, i, i, great, video, explaining, why, that, is, not, really, true, at, all, ., #, getvaccinatednow"
27464,"got, pfizer, vaccine, ., one, down, one, go, ., @, kaiser, permanent, -, south, baltimore"
27465,"good, know, ., i, ', i, waiting, pfizer, number, two, ., i, get, it, with, ., my, way, lex, week, ."
27466,"i, got, pfizer, too, wednesday, i, just, had, sore, arm, as, well, until, foolish, yesterday, ., after, that, it, was, all, good"
27467,"done, ., got, both, pfizer, shots, ., still, wearing, mask, ,, social, distancing, washing, hands, because, i, ', i, neither, stupid, nor, selfish, ."
27468,"i, pray, pfizer, now, this, easter"
27469,"can, you, see, my, smile, two, done, #, gotmyshot, #, twoanddone, #, covidvacccine, #, pfizer, #, pfizerbiontech, #, markup, #, getitdone, @, north, charleston, ,, south, carolina"
27470,"got, my, first, pfizer, jab, tuesday, ,, it, kicked, my, ass, lol"
27471,"i, was, all, excited, at, time, ., just, got, my, second, pfizer, shot, this, morning, ., woo, hoo"
27472,""", they, will, continue, have, that, long, period, time, ,, that, i, i, really, good, news, i, chief, medical, officer, touted, effectiveness, -, biotech, vaccine, ."
27473,"just, found, out, i, have, massage, two, hours, after, i, get, second, dose, pfizer, ..., am, i, world, hurt, or, will, i, be, totally, okay, asking, everybody, else, out, there, who, i, i, gotten, and, dose"
27474,"with, this, new, invincibility, i, am, basically, god, now, ., thanks"
27475,"could, you, please, report, how, you, feel, over, next, couple, days, i, get, pfizer, two, couple, weeks, thumbs_uppill"
27476,"like, news, story, last, night, touting, trials, pfizer, children, interviewed, mom, fourteen, yo, who, had, gone, through, it, ,, how, safe, it, was, how, proud, they, were, that, their, daughter, was, one, est, fully, vad, all, i, thought, though, was, why, are, they, still, wearing, masks"
27477,"pfizer, has, just, announced, that, its, vaccine, is, effective, for, one, semester, ., that, vaccine, was, applied, in, hen, ., then, in, six, months, the, process, will, be, repeated, it, will, be, a, periodic, activity, which, we, will, have, to, get, used, to, and, renew, two, times, a, year, face_with_monocle"
27478,"i, got, my, pfizer, shot, last, night, ., i, did, not, notice, that, it, was, easier, sleep, with, that, one, ., i, do, have, some, soreness, at, injection, site, ."
27479,"got, my, and, dose, pfizer, vaccine, today, feels, good, ."
27480,"syringevaccines, freezers, :, five hundred and fifty, ,, zero, syringe822, ,, six hundred and thirty, coming, next, week, :, syringepfizer, -, three hundred and ninety-six, ,, six hundred and thirty, syringemodern, -, three hundred and three, ,, one hundred, syringeastrazeneca, -, one hundred and twenty-two, ,, nine hundred, #, checkthefreezerdoug, ., let, i, i, get, sontarans, vaccinated, flexed_biceps, #, poli"
27481,"receiving, my, and, pfizer, vaccine, today, #, doingmypart, #, vaccinate"
27482,"i, hope, my, eighty-four, year, old, mother, who, survived, cancer, last, year, &, amp, ;, had, her, and, pfizer, shot, canceled, last, minute, last, week, will, be, alive, two, weeks, ., we, are, choosing, put, i, the, silent, generation, i, at, great, risk, death, political, is, ., all, our, elders, matter"
27483,"just, got, my, second, dose, pfizer, vaccine, ., ready, party, again, rolling_on_the_floor_laughing"
27484,"twenty-two, his, post, -, pfizer, dose, two, i, don, i, i, feel, great, ,, but, good, enough, be, meetings, work, some, today, ., really, thankful, live, state, doing, solid, job, with, vaccine, rollout, as, both, i, are, now, check_mark_button, ., the, all, health, pros, public, servants, ky"
27485,"and, pfizer, fix, is, in, ..., waiting, obligatory, fifteen, minutes, ."
27486,"twentyfour, his, post, pfizer, take, one, +, i, i, ve, got, bit, bruise, but, other, than, that, it, hasn, i, i, been, too, bad, ., most, pain, i, had, was, ripping, off, bandaid, tbe, ., arm, is, bit, sore, if, someone, touched, it, i, i, i, likely, jump, ,, but, i, still, have, full, mobility, use, my, arm, flexed_bicepsmedium, -, light_skin_tone"
27487,"i, i, i, mike, henson, ,, retired, professor, ,, biomed, researcher, ,, university, administrator, ., i, just, got, my, second, dose, pfizer, feel, empowered, ., #, vaccineswork, #, vaccinessavelives"
27488,"pfizer, dose, two, =, no, joke, ., #, sickbay, #, gif"
27489,"#, pfizer, #, covid19, #, vaccine, shot, number, two, is, my, arm, ...., #, letsdothis, #, getvaccinated, #, indiana, #, america"
27490,"pfizer, is, bounce, bitches, nail_polish"
27491,"pfizer, round, one, books"
27492,"this, is, what, happens, when, city, changes, age, limit, qualifications, ., i, sat, virtual, queue, with, thousands, others, book, pfizer, ., it, i, i, like, waiting, black, friday, sales, kick, off, ."
27493,"check_mark_button, jab, #, one"
27494,"not, sure, ., modern, or, pfizer"
27495,"#, covidvaccine, #, modern, #, pfizer, #, johnsonandjohnson"
27496,"if, true, ,, that, ', i, reassuring, ,, as, we, received, #, pfizer, vaccine, are, not, scheduled, our, second, dose, until, july, ., #, couid"
27497,"pfizer, vaccine, is, only, good, up, months, ...., y, ', all, know, this, wasn, ', i, accident, right, ."
27498,"free, couid, vaccinations, atl, megachurch, today, ., church, is, partnering, up, i, /, elite, medical, associates, administer, one thousand, eight hundred, pfizer, vaccinations, ,, as, part, its, easter, weekend, activities, ., you, must, register, app, #, morningrushatl, down_arrow, i"
27499,"conway, regional, hospital, arkansas, just, added, vaccination, appointments, next, week, ., many, times, available, tuesday, ,, wednesday, ,, thursday, ., pfizer, ,, so, sixteen, i, website, says, ac, ,, but, arkansas, is, phase, two, :, everyone, over, sixteen, ., #, conway"
27500,"i, am, waiting, turn, into, zombie, after, completing, my, pfizer, covid19, vaccines, ., thought, role, church, is, preach, gospel, leave, issues, like, healthcare, experts, private, &, amp, ;, public, sectors, ., it, shouldn, i, i, attempt, brainwash, members, their, healthcare, choices"
27501,"don, ', i, let, your, guard, down, days, after, your, vaccination, ., it, takes, time, your, immune, system, build, defenses, against, couid, ., you, ', re, not, fully, vaccinated, until, two, weeks, after, your, second, dose, pfizer, or, modern, ,, or, your, first, dose, i, &, amp, ;, i, ."
27502,"dude, same, ., everyone, i, know, that, got, modern, got, knocked, their, ass, days, by, and, dose, ., grimacing_face, i, ', i, getting, my, first, pfizer, monday"
27503,"does, this, mean, you, need, get, couid, -, nineteen, vaccine, ,, every, six, months"
27504,"great, ,, hope, you, are, safe, well, ., i, have, received, one, pfizer, couid, vaccine, will, get, my, and, shot, april, ith, i, ', i, excited"
27505,"generally, it, lasts, about, eighteen, -, 48hrs, pfizer, or, modern, ,, if, you, don, i, i, have, any, underlying, conditions, ., drink, something, with, electrolytes, ,, rest, up, ,, try, move, your, arm, help, with, potential, soreness, ., if, fatigue, lasts, past, week, contact, you, pop, just, be, safe, smiling_face, i"
27506,"happy, van, day, getting, my, first, dose, this, afternoon, ., #, shootmeup, #, ɢᴇᴛᴠᴀᴄᴄɪɴᴀᴛᴇᴅ, #, pfizer, @, golden, scissors, studios"
27507,"article, high, efficacy, pfizer, vaccine, elderly, i"
27508,"good, grief, -, pfizer, says, couid, -, nineteen, vaccine, lasts, six, months, ,, protects, against, variants, via"
27509,"round, one, arm, round, two, set, april, twenty, ., is, running, efficient, community, vaccination, site, get, vaccinated, ., save, lives, stop, spread, ., #, vaccinated, #, covidvaccine"
27510,"hope, you, feel, better, ., getting, my, pfizer, #, two, today, ., wish, me, luck, yay"
27511,"hah, ,, can, confirm, that, first, pfizer, shot, comes, with, nic, ., can, ', i, wait, og, upgrade, shot, two, so, we, can, get, over, -, the, -, air, firmware, updates, ., beaming_face_with_smiling_eyes"
27512,"nil, second, pfizer, shot, is, whooping, me, ."
27513,"twelve, hours, no, side, effects, except, sore, arm, after, est, couid, injection, by, pfizer"
27514,"full, day, after, dose, two, #, covid19, vaccine, no, major, side, effects, just, sore, arm, ., syringesyringesyringe, here, i, i, more, same, day, two, crossed_fingersmedium_skin_tonecrossed_fingersmedium_skin_tonecrossed_fingersmedium_skin_tone, #, igottheshot, #, fauchiouchie, #, pfizer"
27515,"all, he, did, was, pay, companies, make, it, ., pfizer, wasn, i, i, even, warp, speed, ."
27516,"twelve, -, twentyfour, hours, ., mine, was, twelve, ., house, pfizer, ."
27517,"been, laying, low, ., received, my, first, pfizer, shot, three, /, twenty-three, later, that, day, developed, couid, symptoms, which, were, confirmed, by, rapid, test, ., it, ', i, been, roug, ,, no, smell, or, taste, but, am, doing, better, got, watch, snow, snowflake, my, window, ., quarantine, ends, tomorrow"
27518,"this, could, also, be, video, barbara, status, post, pfizer, shot, #, two, lol"
27519,"Do, not, be, misinformed, ,, the, and, dose, can, be, applied, until, the, with, day, after, the, est, dose, ,, the, one, that, is, twelve, weeks, later, says, it, is, twentynine, days, later, and, it, has, already, been, applied, in, the, municipalities, that, received, this, biological, person_facepalming, i, male_sign, i, person_facepalming, i, male_sign, i"
27520,"til, pfizer, vaccine, has, brand, name, i, comirnaty, ., by, reading, wikipedia, ., didn, i, i, see, it, once, while, getting, vaccine, ., this, article, i, i, opening, line, dec, ., two thousand and twenty, turned, out, be, wrong, ,, i, think, :, i, comirnaty, ., it, i, i, name, we, i, all, all, know, soon, i"
27521,"three, hours, post, pfizer, vaccine, game, is, it, #, longcovid, or, #, covidvaccine, begins, ., symptoms, so, far, :, low, grade, fever, chills, chest, pain, slight, headache"
27522,"you, should, be, fine, ., mu, brother, ninety-two, year, old, mother, both, got, pfizer, neither, had, symptoms, ., i, got, modern, had, sore, arm, two, days, ., i, get, my, and, tomorrow, am, little, worried, because, that, ', i, one, reported, cause, most, symptoms, ."
27523,"still, upset, that, i, got, pfizer, vaccine, not, modern, ., i, felt, like, was, cheating, my, stocks, face_with_tears_of_joy, ., i, blame, ."
27524,"trump, nor, anyone, else, his, administration, developed, any, vaccine, ., scientists, who, have, no, connection, trump, developed, vaccine, ., pfizer, had, no, part, operation, warp, speed, ., then, top, it, off, trump, under, ordered, vaccine, &, amp, ;, passed, their, offer, buy, more, ."
27525,"hubby, got, his, today, -, i, &, amp, ;, i, ., i, got, both, mine, last, month, pfizer, ., both, operations, were, well, organized, efficient, ., la, has, it, together, ., your, mileage, may, vary, but, keep, at, it, ., thanks"
27526,"If, according, to, Pfizer, ,, a, single, dose, of, them, gives, an, effectiveness, of, eighty, i, then, why, not, leave, their, vaccinated, so, that, the, vaccines, yield, more, ,, if, those, who, are, going, to, receive, ,, for, example, ,, tire, of, a, single, dose, ,, their, effectiveness, is, only, sixty-five, i, it, would, not, be, convenient"
27527,"yes, but, in, use, with, proper, handling, and, from, pfizer, ,, not, chili, ,, sweet, and, butter"
27528,"hi, ., my, right, ass, cheek, hurts, ,, but, also, pfizer, just, hit, also, existential, dread, my, day, hit, ., i, i, i, fine, ., i, i, i, not"
27529,"in, a, few, days, ,, almost, one, million, vaccines, will, technically, arrive, in, Quebec, next, week, pfizer, two hundred and thirty thousand, four hundred and ninety, modern, one hundred and seventy-six thousand, four hundred, coax, seventy-one thousand, six hundred, az, three hundred and thirty-nine thousand, six hundred, modern"
27530,"we, both, got, our, second, pfizer, i, i, ., so, we, i, re, celebrating, ., wearing, my, merch, course, ., #, seconddose, #, pfizervaccine, #, vaccinegang, #, francs, #, friends, #, drinking"
27531,"all, i, hear, is, pfizer, this, pfizer, that, ., i, i, i, having, vaccine, envy, so, i, need, start, playing, that, game, haha, ., #, modernaproud"
27532,"thankful, that, pfizer, modern, mean, people, can, finally, boo, astro, ."
27533,"i, get, my, first, modern, shot, tomorrow, ., i, preferred, pfizer, ,, but, no, -, can, -, do, that, preference, san, diego, county, ., believe, me, ,, i, tried, ., i, no, longer, care, about, potential, modern, side, effects, i, let, ', i, go, ., #, covidvaccine, #, modern"
27534,"two, pfizer, here, ., no, adverse, effects, ...."
27535,"thanks, david, ., my, fiancee, got, pfizer, ;, was, great, ., my, parents, go, modern, too, i, honestly, be, able, be, safe, &, amp, ;, help, others, be, safe, ,, i, i, all, take, feeling, like, crap, bit"
27536,"don, i, i, hate, my, van, kitty, ..."
27537,"my, couid, power, rankings, post, shot, hell, :, one, ., i, &, amp, ;, i, two, ., modern, three, ., pfizer, this, is, not, scientific, but, based, folks, i, run, these, ., i, got, modern, ,, i, am, nervous, how, and, shot, is, gonna, go, few, weeks, ."
27538,"est, pfizer, couid, vaccine, didn, ', i, feel, thing, it, ', i, starting, feel, bit, sore, now, ,, but, no, worse, than, flu, shot, ., #, covidvaccine, #, pfizer, #, covid19, #, vaccine, @, north, vancouver, ,, british, columbia"
27539,"got, my, first, pfizer, shot, ., so, ready, everyone, get, vaccinated, ., heart_suit, i"
27540,"i, got, mine, yesterday, first, dose, pfizer, i, feel, good, about, it"
27541,"got, my, first, vaccination, today, because, roger, had, like, two, extra, shots, this, evening, syringe, very, good, day, #, pfizer"
27542,"i, got, my, first, dose, pfizer, vaccine, today, i, was, nervous, but, i, didn, i, i, even, feel, shot, ., my, arm, is, little, sore, but, i, feel, fine, ., hopefully, it, stays, this, way, i, don, i, i, feel, worse, later, pleading_face"
27543,"i, got, my, first, pfizer, arlington, today, too"
27544,"got, my, first, vaccine, shot, yesterday, ., my, arm, hurts, ,, i, i, i, exhausted, now, my, big, toe, hurts, ., pfizer, what, hell, you, put, that, needle, ., #, covidvaccinesideeffects"
27545,"one, thing, is, sure, about, #, couid, vaccine, ., not, only, does, it, make, you, immune, virus, ,, it, also, seems, calm, hypochondria, ,, now, i, think, i, i, i, dying, one, less, thing, thanks"
27546,"pictured, left, right, :, modern, ,, modern, ,, pfizer, one, /, two, ,, pfizer, ,, pfizer, ,, pfizer"
27547,"twelve, ., five, his, post, -, pfizer, take, one, i, have, *, some, *, arm, soreness, but, nothing, crazy, ., everyone, else, seems, have, such, bad, pain, ., did, nurse, do, it, right, grinning_face_with_sweatgrinning_face_with_sweat"
27548,"had, my, and, pfizer, yesterday, ,, no, ill, effects, ."
27549,"pfizer, #, one, done, this, asthmatic, is, very, relieved, ."
27550,"any, excuse, show, off, those, guns, ., well, done, my, friend, ."
27551,"i, enrolled, i, -, safe, after, my, final, pfizer, dose, ,, but, it, has, me, as, only, receiving, est, dose, ,, &, amp, ;, allows, edit, anything, but, that, ., that, really, bugs, me, ., can, that, be, corrected"
27552,"okay, cmon, pfizer, queens, clapping_handslight_skin_toneclapping_handslight_skin_toneface_with_tears_of_joyface_with_tears_of_joy"
27553,"i, got, pfizer, yesterday, ."
27554,"me, after, getting, my, first, dose, pfizer, vaccine, today, syringe"
