,0
1254,"bravo, ,, hand, -, lettered, sign, -, maker, ,, bravo, #, covid19vacccine, #, modern, #, dollyparton, @, pierce, college"
1255,"modern, shot, one, check_mark_button"
1256,"volunteers, medical, staff, vaccine, clinic, are, awesome, ., screening, ,, registration, ,, shot, ,, wait, ., it, took, min, that, includes, waiting, min, after, injection, ., nurse, even, said, sorry, when, she, jabbed, me, ., i, hardly, felt, it, i, have, modern, me, ., i, Ascension_Island, i"
1257,"today, i, just, took, client, -, clean, ,, quick, ,, &, amp, ;, easy, ., it, ', i, modern, vaccine, ., get, valued, ;, wear, mask, clapping_handsmedium, -, light_skin_toneflexed_bicepsmedium, -, light_skin_tone"
1258,"first, dose, down, syringe, #, modern, #, vaccine, #, covidvaccine, #, getvaccinated"
1259,"gad, segundo, dosis, de, modern, ,, ya, pronto, value, hermoso, do, woman_dancinglight_skin_tonedog_facecrowneyesperson_runninglight_skin_tone, i, male_sign, i, en, hennepin, healthcare, clinic, &, amp, ;, specialty, center"
1260,"got, faci, ouchie, syringe, flexed_bicepsmedium_skin_tone, #, modern, @, beach, channel, high, school, rockaway, park, ,, ny"
1261,"massachusetts, peeps, i, bot, is, how, i, scored, my, modern, van, #, one, today, ., it, let, me, know, that, walgreens, one, ., mi, home, had, slots, open, ., follow, it, set, up, notifications"
1262,"couid, -, nineteen, shot, #, two, books, #, modern, #, vaccine"
1263,"person_raising_handmedium, -, dark_skin_tone, i, female_sign, i, sport_utility_vehiclesyringe, |, yay, ,, ., congrats, i, i, i, riight, behind, you, ., save, syringe, me, ., #, scienceisback, #, vaccinessavelives"
1264,"vicuna, vicuna, vicuna, no, no, ., high_voltage, ., modern, can"
1265,"two, days, out, my, second, shot, i, i, i, back, feeling, normal, probably, good, last, night, but, i, was, high, too, ., one, day, feeling, i, off, i, was, one hundred, %, worth, piece, mind, that, i, now, have, ., those, wondering, ,, i, had, modern, shots"
1266,"modern, second, shot, update, :, about, eight, hours, after, my, shot, my, legs, started, feeling, little, weak, /, queasy, ,, my, stomach, felt, ok, ,, went, sleep, without, too, much, issue, through, night, i, woke, up, ,, felt, heavy, ,, had, pretty, bad, chills, ., mild, fever, i, think"
1267,"psa, :, it, i, i, like, christmas, day, me, because, one, players, are, back, atl, &, amp, ;, two, modern, #, two, complete, time, be, back, red_heart, i, blackheart, #, modernamagic, syringe, #, fullyvaccinated, soon"
1268,"anyone, getting, modern, second, dose, vaccine, gatorade, helps, lot"
1269,"modern, number, two, i, am, through, just, doing, my, little, part, get, this, crap, behind, us, ., i, i, all, let, you, know, how, og, reception, is"
1270,"ooh, y, i, all, ., miss, modern, two, ., zero, was, not, fucking, around, when, she, said"
1271,"modern, dos, kicked, my, ass, this, week, ."
1272,"captain, i, i, log, :, modern, #, two, ,, day, two, :, touch, feverish, ,, injection, site, soreness, ,, body, aches, ., still, ,, only, focusing, gratitude, ., folded_hands, #, vaccinated"
1273,"we, got, our, first, shot, this, morning, be, it, i, i, small, town, ,, nurse, that, checked, us, knew, my, husband, i, i, employer, his, parents, ,, my, favorite, vet, ,, doc, beckett, ,, was, her, mother, i, i, twin, brother, she, lives, right, down, road, us, ., #, makingfriends, #, modern, #, vaccinated"
1274,"modern, is, actually, shorthand, modern, ass, style, i, gotta, say, i, did, get, that, vaccine, ."
1275,"apparently, ,, vaccine, tourism, is, going, be, thing, ., plans, are, underway, tourists, arriving, alaska, be, provided, with, modern, vaccine, ., #, poli, #, manitou"
1276,"officially, part, #, modern, mob, ., huge, thanks, all, scientists, ,, public, health, officials, ,, military, personnel, ,, doctors, ,, nurses, ,, &, amp, ;, volunteers, &, amp, ;, out, thirty, mins, ."
1277,"modern, ii"
1278,"uh, ..., so, when, does, this, modern, rash, go, away"
1279,"day, one, after, modern, vaccine, ., i, dreamt, that, i, had, dog, that, i, i, half, inch, tall, ., i, had, give, him, up, someone, who, can, take, better, care, him, ., it, was, like, plot, mandalorian, ."
1280,"absolutely, hop, ,, so, i, i, ve, had, mine, few, months, now, ., modern, ,, no, bad, side, effects, at, all, ., my, wifi, signal, is, so, much, stronger, now, ,, though, ., partying_facewinking_face"
1281,"second, dose, modern, wednesday, i, got, fever, ,, chills, ,, aches, aka, works, twentyfour, hours, after, ..."
1282,"i, i, i, getting, over, modern, part, one, shot, arm, stiffness, now, i, really, want, tattoo"
1283,"second, shot, followed, by, breakfast, at, one, our, favorite, places, ,, we, haven, i, i, been, inside, year, ., we, love, you, missing, baconpancakes, #, modern, #, getvaccinated, @, missing, ', i, restaurant"
1284,"raised_handmedium_skin_tonei, have, been, modern, -, ized"
1285,"nope, i, lied, i, just, checked, my, email, it, i, i, modern"
1286,"second, dose, #, modern, in, ., #, thankful"
1287,"fully, vaccinated, as, three, ., five, weeks, ago, with, modern, ."
1288,"we, are, scheduled, our, second, dose, this, week, ., modern, as, well, ., i, ', i, anxious, about, side, effects, but, looking, forward, being, fully, vad, ."
1289,"got, my, and, couid, vaccine, dose, yesterday, at, am, ., here, ', i, my, wish, hour, update, ., #, covidvacccine, #, 2nddosedonesyringecheck_mark, i, #, modern"
1290,"we, are, ready, with, the, first, dose, of, the, modern, vaccine, ...., syringe"
1291,"what, happens, when, you, get, four, months, after, you, get, your, first, modern, shot, there, i, i, no, modern, vaccine, oopsy, ., another, great, medical, experiment, :, mixing, vaccines, following, the, medical, experiment, :, increasing, the, time, between, shots, ,, while, new, variants, emerge, i, ., one, ., six hundred and seventeen"
1292,"worst, thing, about, modern, second, vaccine, dose, is, flu, like, symptoms"
1293,"modern, second, dose, is, like, demon, you, get, worst, side, effects"
1294,"i, had, my, second, couid, vaccine, modern, yesterday, ., barely, noticeable, sore, arm, ., i, slept, well, feel, great, today, ., i, drank, lots, water, after, shot, didn, ', i, drink, alcohol, ., maybe, that, ', i, secret, sauce, ."
1295,"modern, second, vaccine, dose, side, effects, are, out, my, body"
1296,"i, am, supposed, start, my, period, same, day, i, get, my, second, dose, modern, vaccine, ...., i, think, i, i, i, just, going, kill, myself"
1297,"modern, number, two, yesterday, ., same"
1298,"i, i, i, finally, booked, vaccine, four, /, twentynine, ., i, i, i, one, those, people, who, signed, up, couple, weeks, later, than, roll, out, ,, had, no, prior, health, issues, or, work, reason, get, it, early, ,, so, now, do, is, vaccinating, people, lower, risk, categories, ., getting, #, modern, -, anyone, have, it, already"
1299,"brunette, ,, say, ,, modern, jefe, smiling_face_with_sunglasses"
1300,"i, woke, up, today, feeling, fine, after, getting, modern, dose, two, yesterday, so, i, called, cafe, my, off, day, asked, if, anyone, had, called, out, cause, side, effects, their, vaccine, needed, coverage, ,, but, boss, said, no, one, has, ,, so, i, ', i, going, back, to, sleep"
1301,"pfizer, vaccine, is, ninety-five, %, effective, ,, modern, ninety-four, ., one, i, astrozeneca, seventy, i, chances, surviving, couid, without, vaccine, ninety-eight, i, chances, his, friends, most, above, sixty-five, surviving, couid, +, friends, with, underlying, conditions, i, much, +/-, fifty, %, he, gets, vaccine, ,, side, effect, eats, like, pig, i"
1302,"day, two, after, modern, vaccination, ,, feeling, much, better, ., yesterday, was, rough"
1303,"face_with_rolling_eyes, do, you, really, think, people, don, i, i, read, it, is, common, knowledge, both, biotech, modern, dropped, ball, ,, didn, i, i, meet, contracts, ., modern, dropped, 500k, doses, again, today, &, amp, ;, trudeau, procured, eight, million, more, biotech, today, ., too, busy, tweeting, mistrust, notice, #, failed"
1304,"second, modern, dose, today, *, happy, dance, *, @, space"
1305,"yay, congrats, i, got, my, first, modern, vac, thursday, ,, may, thirteen, my, second, ."
1306,"modern, shot, #, two, does, not, ., fuck, ., around, ."
1307,"got, no, after, effects, my, modern, #, two, ."
1308,"just, got, my, and, shot, modern, today, ."
1309,"first, #, modern, shot, ,, day, one, review, :, had, mild, nausea, couple, hours, tums, handled, fine, ., then, came, sheer, exhaustion, ., #, quarantine, feels, like, quarantine, one thousand, five hundred, ., limbs, are, so, heavy, ., no, noticeable, fever, report, ., extra, thirsty, ."
1310,"first, night, feeling, superior, with, my, modern"
1311,"my, of, i, got, our, second, shots, at, exact, same, time, this, am, he, i, i, totally, fine, i, have, fever, cold, sweats, my, whole, body, is, jelly, so, basically, modern, is, misogynistic, ."
1312,"god, damn, and, #, modern, shot, is, worst, thing, ever, ..., did, not, cure, my, ibs, at, all, ."
1313,"so, i, got, my, first, shot, modern, van, today, ., i, feel, very, normal, ,, not, even, soreness, we, everybody, talk, bout, ..., suh, ,, data, dem, put, inna, mine, cause, i, thought, i, i, i, be, radioactive, by, now, ..."
1314,"that, ', i, good, question, given, news, modern, front, ."
1315,"keep, reading, vaccine, two, beastly, side, effects, stories, ., not, sure, how, common, anything, is, ,, but, counterpoint, ., after, my, and, modern, last, wed, morning, i, worked, out, ,, had, normal, day, ,, drinks, at, night, ,, slept, well, ., next, day, ,, sore, arm, ,, but, not, as, bad, as, est, shot, ., pretty, much, it, ."
1316,"this, almost, happened, me, grinning_face_with_sweat, i, was, supposed, go, different, location, my, and, dose, ., well, i, forgot, went, same, location, ., girl, checked, me, sticker, said, modern, face_with_monocle, i, questioned, that, shit, tho, she, told, me, i, was, at, wrong, location"
1317,"not, sure, i, trust, sourced, video, over, scientists, all, over, world, ., i, got, modern, vaccine, myself"
1318,"i, didn, i, i, have, any, reactions, at, all, either, modern, shot, i, i, i, severely, immune, compromised, laid, off, my, meds, week, hopefully, build, up, good, immunity"
1319,"getting, my, second, modern, shot, tomorrow, ., im, little, nervous"
1320,"financing, modern, shot, one, spin, at, time, #, doc, white_flag, i, rainbow"
1321,"few, hours, i, i, i, feeling, ok, ,, but, damn, my, arm, hurts, like, face_with_symbols_on_mouth"
1322,"i, imagine, modern, will, be, same, ."
1323,"i, i, i, practically, dying, my, last, modern, shot, ..., lol, ..., can, i, i, freaking, sleeeeeep, ..., if, u, need, somebody, two, go, live, ,, i, i, all, i, here, four, awhile, ..., lol, ..., thank, you, too, four, reply"
1324,"totally, elated, that, my, wife, got, her, second, modern, vaccine, today, after, long, four, -, week, wait, ., getting, it, at, our, local, sam, i, i, was, joke, both, times, -, over, hour, wait, while, one, person, gave, shots, ., got, impression, they, weren, i, i, happy, participating, effort, ., still, ,, she, got, it, smiling_face_with_smiling_eyes"
1325,"#, drfauchi, arrived, just, time, accompany, me, get, my, second, #, covidvaccine, dose, today, ., thanks, thanks, science, #, modern, #, fauchiouchie, #, getvaccinated"
1326,"modern, shot, #, two, #, fullyvacinnated, @, big, apple, walk, -, in, urgent, care"
1327,"baltimore, girls, were, outside, club, screaming, i, modern, bitch, i, face_with_tears_of_joywoozy_face"
1328,"i, modern, bitch, i"
1329,"i, got, my, and, modern, shot, this, week, ., no, side, effects, with, either, ., i, thought, woman, who, gave, me, wednesday, ', i, shot, went, little, anterior, &, amp, ;, sho, ', nuff, it, started, bleeding, &, amp, ;, is, now, bruised, ., other, than, that, ,, i, am, now, free"
1330,"hope, u, feel, better, ., i, had, modern, but, have, heard, it, had, more, side, effects, ., yeah, i, was, lucky"
1331,"this, feels, like, modern, equivalent, i, this, edible, ain, i, i, shit, i, *, one, hour, later, *"
1332,"omg, did, u, have, modern, or, pfizer, ., i, was, one, lucky, ones, ., had, no, issues, ., no, fatigue, even"
1333,"mel, felt, awful, ten, hours, after, modern, one, ,, pretty, much, fine, other, than, sore, arm, two"
1334,"me, when, i, get, my, and, modern, jab, sunday, rolling_on_the_floor_laughing"
1335,"twentyfour, hours, after, modern, my, upper, arm, is, quite, sore, ., like, ..., advil, ice, pack, sore, ., very, small, price, pay, ."
1336,"., I, modern"
1337,"thankful, my, and, dose, today, #, covid19vaccination, #, modern, #, vegashome"
1338,"reactions, are, good, ., i, had, modern, only, arm, pain, ., you, ', all, be, fine, ."
1339,"hubby, i, are, both, fully, faci, ', i, team, modern, ....., how, do, you, spell, relief"
1340,"we, can, ', i, get, it, now, even, if, we, want, it, up, here, canada, ,, modern, has, become, latest, big, pharma, profiteer, renege, delivering, our, vaccines, ., thanks, former, conservative, government, privatizing, selling, off, our, van, research, labs, ., will, joe, let, us, buy, russian, ones"
1341,"thirty-one, hours, post, modern, second, dose, ., not, gonna, lie, ,, it, i, i, been, unpleasant, ., but, i, just, kept, reminding, myself, why, i, got, van, ., so, i, can, hug, my, family, so, i, can, see, my, friends, so, i, can, go, concerts, so, i, can, go, work, so, i, can, go, movies, because, i, i, i, not, asshole"
1342,"sheesh, i, got, modern, sweats, #, vaccinenumber2baby"
1343,"got, my, and, #, fauciouchie, this, week, that, calls, #, filtersonfilters, vacuum, dose, numero, dos, was, slightly, more, intense, but, i, remain, grateful, speed, science, ., don, ', i, sleep, it, ,, friends, ., modern, ., modern, woman, ., relieved_facesyringe, #, vaxxedtothemax"
1344,"my, modern, people, both, shots, messed, y, i, all, up, or, just, one"
1345,"modern, squad, &, it, i, it, i, it, ;, sorry"
1346,"me, after, my, second, modern"
1347,"i, was, getting, vaccinated, almost, exclusively, this, ...., first, shot, was, modern, ,, second, will, now, be, buckshot, ."
1348,"i, spent, tow, days, bed, but, i, i, i, good, now"
1349,"I, got, vaccinated, today, against, the, damn, bug, ., I, put, on, the, modern, one, ., nothing, hurts, ,, the, needle, is, nothing, ., I, was, told, that, I, would, be, monitored, fifteen, minutes, after, being, vaccinated, ., Within, those, minutes, ,, I, felt, pain, in, my, wrist, ,, like, it, was, burning, inside, ,, but, nothing, exaggerated, ."
1350,"modern, #, two, twelve, hours, i, am, full, fever, /, flu, like, symptoms, ., full, body, aches, ,, shivering, uncontrollably, my, skin, is, super, sensitive, point, my, clothing, hurts, ., but, hey, ,, at, least, i, won, i, i, accidentally, kill, my, loved, ones, or, myself, by, sharing, virus, we, can, i, i, beat, ., strategy, ."
1351,"got, it, #, modern, #, vaccinessavelives, #, vaccineswork, #, kaiser"
1352,"modern, -, two, last, saturday, ., i"
1353,"#, 100daysofgratitude, pictures, earlier, this, week, i, was, bummed, find, out, i, &, amp, ;, i, vaccine, i, was, supposed, get, was, temporarily, pulled, ..., but, today, my, sister, found, some, cancellations, we, were, able, get, modern, vaccine, #, ilovescience, clapping_hands, #, vaccinated"
1354,"little, loopy, because, second, #, modern, dose, ., but, this, seven, -, one, #, reds, lead, makes, it, easier, endure, ."
1355,"i, got, my, first, modern, monday, ., exhausted, tuesday, ,, fine, since, ., let, ', i, do, this, ."
1356,"masks, required, i, it, ;, masks, recommended, ., #, babysteps, #, flahridah, #, leftnj2017, #, vaccinated"
1357,"wow, medical, team, spelled, my, name, right, ., #, vaccination, #, covid_19, #, covidvacccine, #, glenda, #, modern, #, gotitright, @, glenda, ,, california"
1358,"modern, #, one, just, sore, arm, ., tad, #, two"
1359,"i, just, got, my, and, modern, so, i, plan, to, junk, food, star, trek, torchwood"
1360,"whew, chile, auntie, modern, don, i, i, play, ."
1361,"modern, misfits"
1362,"yes, i, had, underarm, lymph, node, swelling, my, second, modern, shot, also, ., it, was, uncomfortable, lasted, about, week, ., spoke, my, do, cousin, who, said, it, i, i, normal, immune, response, ."
1363,"apparently, modern, has, begun, testing, children, ...., rip, little, lady, ...., crying_facecrying_face, unfortunate, part, vaccine, testing, is, some, folks, may, have, adverse, effects, ...., folded_handsmedium_skin_tonefolded_handsmedium_skin_tonefolded_handsmedium_skin_tone"
1364,"took, vaccine, tuesday, at, acorn, i, feel, fine, i, recommend, y, i, all, take, it, before, y, i, all, go, home, summer, take, modern, shot"
1365,"this, modern, mami, is, fully, vaccinated, star, -, struck"
1366,"modern, brings, strong, tetanus, shot, sensation, palate, ,, with, distinct, notes, typhoid, fever, vaccine, pill, ., clean, ,, freedom, -, flavored, finish, ."
1367,"modern, one, also, wasn, i, i, shit, ., getting, two, monday, i"
1368,"modern, i, i, second, shot, is, nasty, ., headache, ,, fever, ,, chills, ., weary_face, i, wish, you, better, aftermath, than, mine, ."
1369,"got, that, second, jab, today, #, modern, skull, skull_and_crossbones, i, syringe, shushing_face, #, two thousand and forty-nine, blade, person_running, i, male_sign, i, #, replicant, @, walgreens"
1370,"hubby, his, mom, got, modern, #, one, today"
1371,"i, ', ve, heard, that, and, shot, is, pretty, tough, ., i, got, my, est, modern, shot, yesterday, ., my, arm, is, swollen, @, injection, site, ., but, otherwise, i, feel, ok, ."
1372,"modern, matisses"
1373,"second, modern, dose, march, with, ., fully, vaccinated"
1374,"second, modern, syringe, ,, checkmark, i, thank, you, ,, science, ., #, vaccine, #, vaccine, #, vaccine, #, vacciiiinnnne"
1375,"first, time, eating, inside, over, year, thanks, modern, vaccine, go, nuggets, so, many"
1376,"modern, time, over, here, ohio"
1377,"modern, vaccine, dose, two, ."
1378,"you, ', re, ith, person, i, know, that, got, physically, sick, and, modern, ., i, get, and, at, end, month, ., not, looking, forward, that, ."
1379,"i, got, vaccinated, #, modern, #, vaccinated"
1380,"no, joke, ,, set, up, table, snacks, /, liquids, pain, meds, within, arms, distance, ., i, i, i, day, two, after, my, modern, and, still, recovering, ., expect, extreme, fatigue, ,, dizziness, ,, nausea, ,, body, pains, ,, it, overall, sucks, ., totally, worth, it, but, still, sucks, ., also, congrats"
1381,"getting, my, second, modern, shot, tomorrow, ...., please, reply, with, any, good, experiences, as, i, i, i, big, nervous, grinning_face_with_sweatfolded_hands"
1382,"way, go, my, pharmacy, has, switched, modern, vaccine, ;, i, go, my, first, shot, tuesday, sparkling_heart"
1383,"second, modern, effects, started, eighteen, hours, afterwards, ended, at, thirty-six, hour, point, ."
1384,"i, had, both, doses, modern, only, side, effect, was, little, sore, arm, about, twentyfour, his, ."
1385,"got, modern, vaccine, i, i, i, craving, beer, wif, ."
1386,"words, captain, ed, mercer, ,, "", go, dolly, i, theorville, #, firstdose, #, covidvaccine, #, modern"
1387,"my, vaccination, appointment, has, been, rescheduled, this, coming, tuesday, pharmacy, has, switched, modern, vaccine, ;, i, get, my, first, shot, ,, then, second, next, month, ., sparkling_heart"
1388,"modern, ., no, biggie, ., just, sore, arm, ., i, felt, tired, afternoon, day, after, my, second, shot, ."
1389,"pentagon, shipping, more, modern, doses, overseas, cover, loss, i, &, amp, ;, i, vaccine"
1390,"i, i, i, cackling, at, i, modern, art, i, though"
1391,"got, one, modern, shot, down"
1392,"off, get, my, modern, shot, est, two, wish, me, luck, :, i"
1393,"hell, yeah, modern, gang"
1394,"and, modern, shot, today"
1395,"this, is, modern, world, ., syringe, +, syringesyringe, #, vaccinationdonecheck_mark, i, @, mean, university"
1396,"modern, est, dose, check_mark_button"
1397,"team, modern, all, day, ."
1398,"i, got, my, and, dose, #, modern, #, covid19, #, vaccine, #, fauciouchie, #, getvaccinated, #, covid19vaccine, @, denver, international, airport"
1399,"did, you, see, announcement, that, modern, is, coming, with, mrna, tech, phase, two, trial, hiv, vaccine, out, forty-eight, participants, ninety-seven, %, them, developed, antibodies, ."
1400,"i, think, first, dose, made, me, sick, because, i, had, couid, ., i, got, modern, ."
1401,"bitch, ,, i, i, i, modern, #, covidvaccine"
1402,"get, dose, #, two, modern, tomorrow, high, risk, been, living, fear, somewhat, so, it, i, i, relief, ."
1403,"fellow, modern, squad, member, ."
1404,"interesting, ,, ha, ha, ,, can, be, real, kick, pants, eh, i, await, my, and, modern, shot, five, /, four"
1405,"my, and, couid, shot, modern, has, taken, me, out, ., chills, ,, body, aches, ,, lethargic, ,, off, balanced, name, few, symptoms, ., i, hope, it, ', i, only, twentyfour, he, thing, ."
1406,"i, got, modern, while, ago"
1407,"modern, #, two, arm, ., let, real, fun, begin, #, vaccinationdonecheck_mark, i, #, ᴠᴀᴄᴄɪɴᴇssᴀᴠᴇʟɪᴠᴇs, @, alexandria, ,, virginia"
1408,"and, dose, modern, kicked, my, ass, so, completely, even, my, teeth, hurt, ."
1409,"modern, modern, ., she, reminds, me, west, side, story, ."
1410,"dear, thank, you, not, only, my, second, stab, modern, today, what, well, oiled, machine, but, having, chicken, tender, pub, sub, sale, this, week, great, combination, -, #, vaccinated"
1411,"i, i, ve, never, been, this, excited, over, tiny, prick, my, life, ., one, down, ,, one, go, ., #, modern, #, rounding, #, vaxxedsyringe, @, chandler, ,, arizona"
1412,"got, vaccinated, with, modern, at, station, #, twelve, by, daniel, ,, retired, paramedic, with, prescott, -, russell, ., thanks, daniel, did, great, job, with, clinic, #, covidvaccine, #, modern, #, covid19vaccination, #, vaccinationselfie"
1413,"modern, ., had, no, issues, after, first, dose, ., just, got, and, dose, couple, hours, ago, ., no, side, effects, yet, ,, but, it, i, i, still, early, so, we, i, all, seemed"
1414,"uff, mines, next, week, i, keep, hearing, and, modern, not, too, fun, Skeptical_annoyed_undecided_uneasy_or_hesitant, but, yes, ,, much, better, than, alternative, hope, you, breeze, thru, rest"
1415,"fun, game, do, i, feel, like, i, was, hit, by, buffalo, because, :, jetlag, travel, exhaustion, i, work, stress, early, meetings, i, modern, side, effects, i, probably, all, those, things"
1416,"have, good, weekend, sweeps, second, #, modern, shot, down, -, my, appointment, was, close, so, i, could, build, up, courage, with, pulpo, gallery, albondigas, before, hand, ;"
1417,"it, i, i, modern"
1418,"i, heard, if, you, got, modern, vaccine, dolly, parton, actually, gives, you, second, shot"
1419,"hubby, just, got, his, second, modern, shot, hoping, be, able, visit, family, friends, this, summer, ."
1420,"white, girls, going, into, summer, be, like, i, oh, you, got, modern, vaccine, ,, bye, i"
1421,"same, us, -, just, this, morning, modern, out, it, ., me, county, ,, mo, ., heart_with_arrow"
1422,"double, dosed, woohoo, partying_facepartying_facepartying_facestar, i, two_hearts, #, vaccination, #, modern, #, fauchiouchie, @, pierce, college"
1423,"received, second, dose, #, vaccine, today, crossed_fingers"
1424,"you, i, re, welcome, laura, ,, my, wife, had, modern, variety, ,, with, lasting, reactions, both, times, ."
1425,"there, it, is, i, just, had, my, second, modern, vaccination, crossed_fingersmedium_skin_tone, ., #, covid_19, #, covidvacccine, #, getsome, @, tacoma, ,, washington"
1426,"modern, number, two, done, ., science, is, pretty, cool, ."
1427,"est, dolly, dose, down, check_mark_buttonsyringe, get, vaccinated, ,, ya, i, all, #, modern, #, vaccinated, #, covid19vaccination, #, uclahealth, #, covidvaccine, #, modernavaccine"
1428,"modern, ., my, second, dose, was, last, thursday, ., arm, pain, ,, severe, headache, ,, fever, fuzzy, feeling, my, head, ., i, just, rested, ,, drank, lots, water, took, tylenol, pain, fever, ."
1429,"shot, #, two, down, ., #, modern, #, dollyparton, #, vaccinated"
1430,"when, are, you, updating, your, name, modern, mose, many, mose"
1431,"just, what, doctor, ordered, ., we, need, more, this, get, through, drought, ., i, am, bit, jealous, my, dad, who, got, his, second, dose, modern, yesterday, lol, ., talk, about, great, day, be, bedridden"
1432,"modern, is, already, working, on, a, ord, dose, of, vaccine, with, the, South, African, variants"
1433,"we, already, know, reason, modern, delays, i, they, have, backlog, quality, control, testing, ., this, is, pure, performance, art, ., #, cannoli"
1434,"yes, especially, since, dolly, helped, fund, modern, vaccine"
1435,"modern, ., still, have, one, more, go, ."
1436,"modern, one, downloaded, syringe"
1437,"thank, you, got, my, second, #, modern, shot, today, ., #, grateful"
1438,"so, i, got, my, second, dose, modern, vaccine, this, morning, ,, can, bill, gates, track, me, now, or, does, he, have, wait, till, two, weeks, after, second, shot"
1439,"just, got, my, and, modern, dose, ., hopefully, i, won, i, i, feel, as, bad, as, some, others, i, saw, that, went, through, it"
1440,"my, way, get, my, and, modern, shot"
1441,"i, got, my, second, dose, modern, today"
1442,"party, in, modern"
1443,"and, syringe, books, ., ready, tongue, some, door, thanks, ,, #, vaccinessavelives, #, modernacovid19syringe, #, covidvaccine, #, covid19vaccination"
1444,"check_mark_button, and, dose, done, #, modern, #, covidvaccine"
1445,"more, than, twentyfour, hours, after, my, second, modern, dose, &, amp, ;, all, i, got, is, sore, arm, syringesyringe"
1446,"i, was, fine, first, day, but, then, had, mild, fever, symptoms, day, two, ., i, had, modern"
1447,"modern, first, shot, not, as, sick, as, my, oncologists, thought, i, would, beperson_shrugging, i, female_sign, i"
1448,"sweet, ., get, my, second, #, modern, cinco, de, mayo"
1449,"had, my, and, dose, modern, ,, two, weeks, ago, yesterday, ."
