,0
0,"i, endorse, water, recommendation, ., modern, two, was, very, mild, ., maybe, water, helped"
1,"finally, i, got, first, one, tuesday, modernagrinning_face_with_smiling_eyes"
2,"this, is, how, i, feel, after, my, first, modern, shot, -, could, be, side, effects, ,, could, just, be, good, old, fashioned, general, pandemic, exhaustion, ..."
3,"ok, ,, confirmed, modern, shot, #, two, feels, like, staying, up, all, night, bender, ,, getting, fight, then, trying, go, into, office, like, nothing, happened, ., see, ya, i, all, try, sleeping_face"
4,"and, modern, shot, does, indeed, have, hands"
5,"modern, two, ., zero, was, 10Happy_face_smiley0am, ., sore, shoulder, only, first, twentyfour, his, ., at, noon, next, day, it, knocked, me, sideways, ., uncomfortable, night, ., at, am, today, i, rapidly, felt, better, ., all, worth, it, ., get, vaccinated, please"
6,"got, my, second, dose, two, days, ago, modern, i, ', i, good, today, but, yesterday, i, was, tuckered, out, ."
7,"i, legit, had, like, three, days, migraine, symptoms, modern, but, like, ,, worth, it"
8,"happy, have, had, my, and, modern, vaccine, shot, at, lunchtime, -, just, as, smooth, well, -, run, today, as, it, was, four, weeks, ago, ., thanks"
9,"my, mom, said, modern, has, never, had, successful, vaccine, ink, about, that, either, be, i, haven, i, i, looked, into, it, ., lol, i, i, i, sure, literally, everyone, will, be, fine, tho"
10,"second, shot, has, been, received, ..., anxious, next, forty-eight, hours, ., question, -, did, you, feel, very, tired, and, /, or, sick, after, #, couid, #, modern"
11,"modern, let, ', i, you, know, where, you, ', re, at, finer, tells, every, body, else, ."
12,"no, sure, ,, but, my, modern, chip, sets, off, alarms, at, loves"
13,"', storage, handling, mistake, ', compromised, eight hundred, doses, modern, vaccine, at, fort, meade, -, error, occurred, when, vials, vaccine, were, left, out, room, temperature, longer, than, recommended, time, ., via"
14,"give, yourself, time, cope, with, modern, hangover"
15,"u, ever, meet, someone, cute, but, then, find, out, they, got, modern, nauseated_face, #, pfizergang"
16,"i, just, feel, it, my, bones, that, jerry, garcia, ,, famously, sort, lazy, about, his, health, ,, would, i, ve, gotten, i, &, amp, ;, i, vaccine, ., that, means, it, i, i, safe, ,, full, stop, ., good, enough, garcia, ,, good, enough, me, although, technically, i, got, modern, ,, which, has, major, donna, godchaux, energy, ."
17,"modern, is, easier, synch, with, your, router, ."
18,"if, you, i, re, one, those, who, get, annoyed, with, people, posting, about, their, vaccine, shots, ,, then, you, can, move, along, because, i, i, i, going, pontificate, here, ., as, i, was, receiving, my, and, modern, shot, today, ,, i, was, overwhelmed, thoughts, over, half, million, families, u, ., i, ., who"
19,"&, it, i, how, does, one, pose, when, taking, vaccine, selfie, also, ,, unintended, benefit, masks, ;, i, don, i, i, have, worry, about, my, awkward, photo, smile, i, it, ;, #, modern, @, petersen, events, center"
20,"update, #, modern, #, two, :"
21,"done, two, shots, modern"
22,"modern, vaccine, three, /, five, ,, and, four, /, eight, ., as, today, ,, i, am, fully, covered, ., #, igotmyshot, thumbs_upmedium_skin_tone, #, coronavirus, microbe, #, stanhope, #, staysail, OK_handmedium_skin_tone, #, markup, face_with_medical_mask, #, socialdistancing, left, -, right_arrow, i, #, pandemic, grimacing_face, #, washyourhands, #, covid19, sneezing_face, #, staysafestayhome, stop_sign, #, flattenthecurve, chart_increasing, #, vaccine, syringe, #, bettersaferthancovid, beaming_face_with_smiling_eyes"
23,"we, have, seven, modern, shots, looking, arm, ., please, call, nine hundred and eighteen, -, five hundred and forty-two, -, four thousand, four hundred and forty-four, asap, #, vaccinessavelives"
24,"modern, vaccination, no, ., two, is, books, my, arm, it, i, i, great, knowing, my, resistance, this, worldwide, plague, will, be, at, full, strength, within, couple, weeks, or, so, ., collisionflexed_bicepsmedium, -, light_skin_tonecollision, how, do, you, like, my, wristband, i, bought, it, knowing, i, i, i, be, taking, picture, like, this, ., smiling_face_with_sunglasses"
25,"y, i, all, pray, this, second, shot, modern, don, i, i, kick, my, ass, y, i, all"
26,"my, first, shot, modern, went, fine, i, was, bit, sore, tired, felt, slightest, bit, i, under, weather, i, like, three, days, then, i, was, fine, i, did, develop, rash, after, week, ,, but, apparently, it, i, i, called, i, couid, arm, i, normal, i, modern, after, first, shot, ."
27,"just, dropped, my, mom, off, her, second, modern, dose, yelled, i, have, fun, ,, see, you, bit, when, you, i, re, vaccinated, stay, safe, make, good, choices, i, love, you, i, out, window, ., i, i, i, embarrassing, daughter, now, ,, she, i, i, just, going, have, live, with, it"
28,"i, got, modern, i, i, i, day, two, ., felt, fine, first, ten, hours, after, getting, my, shot, but, then, i, got, headache, ,, fever, ,, chills, around, 11pm, last, night, ., woke, up, feeling, fine, though"
29,"my, wife, got, modern, ., i, can, ', i, even, look, at, her, anymore, ., loudly_crying_face"
30,"i, got, mine, and, modern, tuesday, was, down, i, out, with, fever, i, nausea, all, day, wednesday, ., ., feel, much, better, today, yet, not, one hundred, %"
31,"just, got, my, second, modern, shot, ., fully, vaccinated, go, get, vaccinated, #, vaccinated"
32,"getting, first, modern, shot, this, afternoon, ., did, anyone, have, side, effects, after, first, dose, wondering, if, i, can, still, hit, jiu, jutsu, tonight, or, should, i, plan, taking, it, easy"
33,"you, i, all, be, fine, ., it, i, i, all, your, head, ., no, effect, when, i, got, my, second, modern, ., be, like, kurt, ."
34,"immune, system, power, up, achieved, ., check_mark_buttoncheck_mark_button, done, dusted, with, both, couid, -, nineteen, vaccine, hoping, no, side, effects, ......., crossed_fingers, time, get, my, haircut, since, december, ., #, covidvaccination, #, modern"
35,"modern, super, powers, engage, ., syringe, #, igottheshot, #, covidvacccine, #, vaxxedsyringe"
36,"vaccine, walk, ins, modern, at, today, till, up, retweet, spread, word"
37,"steele, county, public, health, :, modern, vaccines, available, today, anyone, eighteen, older, -, no, appointment, needed, drive, thru, clinic, open, until, 4Happy_face_smiley0, am, at, steele, county, highway, dept, building, three hundred, hoffman, drive, past, walmart, old, fourteen, ., #, getjabbed"
38,""", play, modern, music, """
39,"this, only, helps, second, dose, #, modern, vaccine"
40,"my, second, shot, will, be, may, and, team, modern"
41,"#, modern, #, covid_19, #, vaccine, and, dose, done, syringe, @, community, hospital, monterey, peninsula"
42,"me, after, my, second, #, modern, shot, #, covid19vaccine, #, vaccinated, #, worth"
43,"modern, shot, two, fucks, you, up, ,, i, thought, everyone, was, exaggerating"
44,"my, mom, told, me, this, morning, she, wishes, i, didn, i, i, get, modern, lol, matt, i, i, entire, family, got, modern, too"
45,"modern, number, two, ,, lesser, known, lou, beg, song, ."
46,"one, down, ,, one, go, #, vaccine, #, modern, #, covid19, #, covidvacccinesyringe, #, covidvacccine, #, shot, #, altair, #, gor, #, casino, #, vaccinated, #, baxter, #, thumbs, #, yourturn, #, tagyoureit, @, grand, sierra, resort, casino"
47,"morning, after, modern, #, two, :, too, uncomfortable, sleep, last, night, ,, finally, passed, out, around, five, &, amp, ;, slept, til, eleven, ,, everything, hurts, ,, lifting, coffee, cup, is, hard, ., ordered, out, comfort, food, &, amp, ;, i, ', i, spending, my, day, couch, eating, mac, &, amp, ;, cheese, &, amp, ;, binge, -, watching, british, period, dramas, syringe"
48,"wow, ,, this, is, really, interesting, proud, modern, recipient, here, as, well"
49,"one, syringe, one, two, go, #, modern, #, covid19, #, vaccinated, #, vaccine, #, covid19vaccine"
50,"my, good, friend, i, have, been, arguing, about, her, getting, vaccine, over, month, ., it, ', i, been, difficult, ,, friends, long, time, ,, normally, respect, her, opinion, judgment, ,, hard, fight, like, this, ., received, text, her, ,, she, just, got, her, est, modern, shot, ., phew, what, relief"
51,"husband, has, also, been, knocked, out, by, his, and, modern, shot, ., came, home, work, at, up, passed, out, ."
52,"stoked, received, my, and, modern, shot, just, now, ., ready, get, out, enjoy, world, again, ., let, ', i, beat, this, pandemic, into, ground, ., #, covidvaccine, #, modernavaccine"
53,"call, me, modern, mami"
54,"round, two, so, glad, i, was, able, receive, both, doses, while, home, va, before, heading, back, la, ., thank, you, amazing, team, at, taking, care, me, both, times, #, vaccine, #, vaccination, #, covidvaccine, #, modern, #, cos, #, va, #, virginia, #, la, #, safety, #, unitedwecandefeatthis"
55,"got, my, and, modern, vaccine, today, ., planning, not, doing, much, tomorrow"
56,"just, received, my, second, modern, vaccination, shot, it, was, easier, than, first, thumbs_uplight_skin_tonethumbs_uplight_skin_tone"
57,"bigger, crowds, i, but, only, twenty, min, difference, arrival, /, shot, time, #, modern, dose, two"
58,"i, just, got, dose, dos, modern, ., how, long, do, i, have"
59,"yeah, ,, modern, takes, little, more, time, activate"
60,"thought, i, might, have, couid, so, i, got, tested, it, came, back, negative, ,, then, got, my, first, modern, couid, vaccine, ., i, i, i, lit"
61,"meet, me, nick, and, modern, shot, crushed, me, exactly, as, you, described, ., remedy, that, worked, best, me, was, alternating, ibuprofen, tylenol, ., good, luck, it, ', i, only, day"
62,"crypto, ,, silver, modern, are, holding, my, portfolio, together, today, loudly_crying_face, $, get, $, sly, $, mrna"
63,"modern, boys"
64,"various, exes, have, posted, or, messaged, me, that, they, ', ve, received, their, vaccine, ., this, is, great, who, knew, my, past, love, life, would, be, set, album, modern, ., smiling_face_with_smiling_eyes"
65,"fully, vaccinated, ready, go, #, modern"
66,":, fully, vaccinated, ., modern, ., had, no, symptoms, vaccine, ., am, diabetic, ., plus, read, obesity, may, impact, efficacy, ., should, i, be, concerned, ., do, i, need, change, my, behavior, or, level, caution"
67,"second, modern, dose, has, crippled, me, but, i, still, gotta, get, ups, before, after, work, rush"
68,"flexibility, ., agility, ., being, comfortable, with, being, uncomfortable, ., new, partners, ., new, ways, doing, business, ., this, is, #, nextnormal, ., #, covid19, #, prsahealth, #, learning"
69,"twentyfour, hours, post, modern, round, two, &, amp, ;, i, feel, great, ., only, side, effects, i, i, ve, had, were, intense, headache, about, eight, hours, afterwards, &, amp, ;, this, morning, ., ibuprofen, took, care, it, ., arm, is, not, even, fraction, how, sore, it, was, with, first, dose, ."
70,"crossed_swordshouse, modernacrossed_swords"
71,"look, ., i, i, i, definitely, not, your, typical, vaccine, getter, ., i, literally, get, really, sick, every, time, ., usually, bad, asthma, ., well, few, don, i, i, get, modern, ., day, two, est, dose, better, some, ways, but, upset, stomach, +, lot, day, one, sides, yet, +, hair, loss, ., glad, i, didn, i, i, get, cut, since, july, ."
72,"that, day, I, was, in, the, modern, neighborhood, ,, I, will, never, forget, the, sound, ..., we, went, out, on, the, roof, and, we, had, to, see, the, following, explosions, and, the, sky, burning, above, that, area, ..., with, the, effect, that, heat, creates, in, the, air, a, tragic, day, ."
73,"i, got, and, dose, modern, omg, it, i, i, really, kicking, my, ass, today, ., nauseated_face"
74,"fully, vaccinated, modern"
75,"i, got, modern, my, arm, was, sore, next, day, little, while, but, that, was, it, hope, you, both, feel, better, black_heartbonemusical_notessign_of_the_hornsmedium, -, light_skin_tonesign_of_the_hornsmedium, -, light_skin_tone"
76,"certified, modern, baddie"
77,"today, i, went, downtown, los, angeles, got, my, second, modern, vaccine, save, lives, ., trust, science, @, los, angeles, ,, california"
78,"i, got, my, second, modern, shot, it, is, kicking, my, butt, ."
79,"and, dose, modern, kicked, my, butt, ., my, boy, is, making, me, feel, better, though"
80,"thank, you, lord, ,, i, have, safer, with, my, second, shot, ,, modern, ., folded_handsmedium_skin_tonebutterfly"
81,"got, my, first, vaccine, #, modern, #, gor, #, grandsierraresort, #, vaccine, #, covid19, #, covidvaccine, #, getitdone"
82,"if, you, i, re, getting, modern, be, prepared, that, and, shot, can, be, kick, pants, starting, few, hours, after, you, get, shot, ,, then, lasting, about, eight, -, twelve, hours, ., hopefully, you, i, all, be, exception"
83,"i, i, i, fully, vaccinated, #, modern, #, thanksdolly, #, thanksfor, #, vaxholesbelike, @, clement, ,, florida"
84,"that, modern, and, shot, is, no, joke, ., i, i, i, shell, human, ."
85,"there, is, actually, clinic, today, literally, across, street, two, hours, but, might, only, be, dose, one, modern, ., if, we, strike, out, there, ,, looks, like, we, i, re, driving, out, scenic, stockton, tomorrow"
86,"fyi, :, as, twelve, :, ten, am, ,, cos, ford, play, target, express, has, few, extra, doses, modern, available, today, est, come, ,, est, served, basis, ."
87,"i, got, modern, ,, so, ink, ., that, was, like, ten, days, ago, but, i, i, ve, been, telling, my, spouse, that, my, senses, are, messed, up"
88,"this, was, sent, me, by, one, my, followers, ., she, said, she, had, first, modern, injection, april, eight, ,, two thousand and twenty-one, her, hair, began, falling, out, ., she, also, experienced, diarrhea, ,, bloating, tested, positive, high, levels, aluminum, ., feel, better, i, red_heart, i"
89,"we, are, sixty-nine, did, modern, ., only, some, next, day, fatigue, ., glad, hear, you, are, doing, well, ., slightly_smiling_facethumbs_upmusical_note"
90,"it, ', i, modern, ."
91,"this, second, modern, is, kicking, my, butt, ., hundred_points, %, worth, it, ."
92,"which, brand, /, shot, you, i, got, modern, two, next, week, am, not, ready, ."
93,"took, that, shot, like, champ, syringe, #, fullyvacinnated, #, modern"
94,"modern, fucked, me, up"
95,"just, got, my, second, dose, modern, ., very, thankful, science, ,, &, amp, ;, all, workers, at, dodger, stadium, speedy, service, ,, &, amp, ;, this, dope, new, og, upgrade, my, phone, just, got, face_with_monocleeyes"
96,"modern, ex, syringe, check_mark_button"
97,"just, got, my, modern, shot, ."
98,"modern, no, ., two, #, fullyvaccinated, #, forallofus, #, covid19, @, publix, super, market, at, arbor, square, at, connection"
99,"if, person, administering, your, vaccine, tells, corny, joke, while, doing, so, ,, are, they, doing, hokey, pokey, #, deepthoughts, #, covid19vaccine, #, fauciouchie, #, modern, #, whatitsallabout"
100,"got, my, first, dose, mark, beast, chip, implanted, ., thank, you, our, lord, savior, #, dollyparton, helping, get, this, us, ., should, be, called, #, molly, not, #, modern, red_heart, i, red_heart, i, they, already, piping, down, dover, into, my, brain, ., must, be, working, ."
101,"second, modern, vaccine, checkmark, i, &, amp, ;, tickets, checkmark, i, light, at, end, couid, tunnel, crossed_fingers"
102,"modern, second, dose, going, just, great"
103,"both, myself, my, husband, were, fine, next, day, never, had, bad, day, ., my, friends, who, got, modern, weren, ', i, so, fortunate, ., sore, arm, is, all, we, had"
104,"i, am, become, modern, man"
105,"metal, the, modern"
106,"shout, out, modern, stock"
107,"got, first, vaccine, modern, with, drive, thru"
108,"i, think, this, will, be, last, time, i, mix, modern, alcohol, ., it, i, i, hard, fall, ."
109,"got, my, first, modern, dose, today"
110,"second, dose, "", funky, cold, modern, "", #, vaccinated, #, modern, #, dollyparton"
111,"mine, is, monday, morning, ., modern, ., you, will, be, alrightred_heart, ."
112,"modern, vaccine, available, today, four, /, twenty-two, /, two thousand and twenty-one, registration, through, first, come, first, served, basis, thirty, doses, available, as, right, now, @, el, centro, de, corazon"
113,"today, i, i, i, officially, modern, mamired_exclamation_mark, i"
114,"modern, shot, #, two, done, ., yay, smiling_face_with_smiling_eyesthumbs_uplight_skin_tone"
115,"day, three, modern, hell, aka, how, long, i, had, actual, couid, symptoms, weary_face"
116,"modern, ., it, honestly, lasted, twentyfour, hours, my, fever, broke, this, morning, around, same, time, i, started, getting, it, yesterday, morning"
117,"modern, #, two, done, super, sore, arm, ,, but, that, i, i, it, ., get, yours, free, ."
118,"disappointed, i, haven, i, i, turned, into, zombie, yet, #, modern"
119,"modern, love, :, shake, that, antibody"
120,"yes, modern, ,, includes, gas, i, so, they, can, track, you, grinning_squinting_facegrinning_face_with_sweatrolling_on_the_floor_laughingrolling_on_the_floor_laughingrolling_on_the_floor_laughingrolling_on_the_floor_laughingrolling_on_the_floor_laughing"
121,"this, second, modern, dose, is, beating, my, ass, compared, first, fearful_face, i, feel, like, someone, could, flick, me, i, would, crumble"
122,"round, two, complete, ., happy, this, is, over, with, ., now, ., #, covidvacccine, #, vaccine, #, modern, #, modernamedown, syringe, @, lucas, county, rec, center"
123,"#, couid, #, covid19, #, covidvaccine, #, covidvaccine, #, covid19vaccinesideeffects, #, sideeffects, #, covidsideeffects, #, nosideeffects, #, fine, #, modern, #, modernavaccine, @, ashburn, ,, virginia"
124,"i, feel, worse, off, second, shot, modern, more, than, i, did, when, i, actually, had, couid, i"
125,"not, sound, sexist, ,, but, you, ', re, tough, broad, ., flexed_biceps, i, get, my, second, modern, tomorrow, at, noon, ., wish, me, luck, folded_hands, i, ', i, kinda, scared, ., flushed_face"
126,"en, route, get, my, modern, and, dose, ., pray, four, me, ., smiling_face_with_horns"
127,"couid, -, nineteen, vaccine, modern, at, gambrills, ,, my"
128,"forty-seven, hours, post, -, and, modern, shot, i, ', i, close, one hundred, %, -, aside, mild, arm, soreness, i, ', i, functioning, within, normal, parameters, ., :"
129,"behalf, all, your, listeners, here, canada, i, i, i, sure, there, i, i, more, than, just, one, ,, thank, you, so, much, including, us, vaccine, rap, wars, team, az, ., you, made, our, day, although, my, partner, is, now, officially, team, modern, ., ,"
130,"one, in, ,, one, go, ., feels, like, one, step, closer, freedom, that, i, ', ve, been, missing, so, much, ., it, ', i, good, feeling, ., #, modern, #, vaccine, #, pandemic"
131,"modern, round, two, @, kelley, reeves, athletic, complex, austin, ,, to"
132,"i, have, ultimately, decided, get, modern, vaccine, next, week, ., i, won, ', i, lie, ,, i, ', i, scared, nervous, but, i, want, protect, my, son, ., i, have, put, him, first, so, i, will, deal, with, any, side, effects, if, it, means, he, has, lesser, chance, getting, it"
133,"est, shot, modern, done, with, ., and, shot, due, may, with, ."
134,"this, morning, i, got, lost, down, deep, dark, rabbit, hole, that, is, i, couid, vaccine, side, effects, i, subreddit, ten, /, ten, would, not, recommend, ., few, posts, is, all, it, takes, convince, yourself, you, may, have, modern, migrainetrade_mark, i, forever, ."
135,"oh, sweet, baby, jesus, ., that, i, i, it, ., modern, is, how, i, i, i, going, die, ., i, i, i, comin, i, i, elizabeth, ."
136,"twentyfour, hours, in, ,, feeling, good, normal, after, my, second, modern, dose, ."
137,"what, turn, events, yesterday, ,, i, got, email, she, canceling, my, vaccine, appointment, due, shortage, supply, ., today, ,, i, got, sudden, vacancy, at, #, sunnybrookhospital, am, now, officially, #, modern, woman, yesterday, i, cried, coz, frustration, ,, now, it, is, happiness"
138,"just, got, my, second, shot, modern"
139,"this, runs, until, up, ., they, i, re, using, modern, hoping, do, one, ,, zero, doses, today, ."
140,"today, is, going, #, rock, #, modern, #, earthdayeveryday, #, vaccineclinic"
141,"yes, ., two, doses, complete, ., modern"
142,"i, had, my, second, modern, few, months, ago, ., should, definitely, take, off, tomorrow, ."
143,"just, got, my, and, modern, vaccine, just, time, my, birthdayversary, tomorrow, purple_heartsign_of_the_hornsvulcan_salutesmiling_face_with_sunglasses, #, vaccinated"
144,"got, my, and, modern, shot, friday"
145,"not, stupid, question, at, all, fact, pfizer, &, amp, ;, modern, are, already, working, new, iterations, beauty, mrna, tech, is, that, by, changing, few, nucleus, acids, ,, you, can, target, different, antigens, but, currently, no, vaccine, is, experiencing, alarming, immune, escape, ."
146,"ditto, me, day, after, second, modern, ,, so, i, grabbed, afternoon, nap, ., next, day, ,, everything, was, back, normal, ., congrats, arming, yourself, is, ., couid"
147,"roll, out, western, maine, has, been, is, ., my, spouse, was, scheduled, i, &, amp, ;, i, at, mobile, unit, that, was, finally, sent, out, here, ,, got, switched, modern, ,, now, no, one, can, tell, them, how, get, second, dose, ."
148,"nineteen, hours, since, and, modern, shot, -, sore, arm, ,, body, aches, tired, but, ok, ."
149,"fine, with, me, ., i, personally, think, pfizer, modern, are, better, vaccines, ."
150,"ooooooh, you, can, ', i, sit, here, then, ., this, is, modern, twitter, ."
151,"got, my, second, modern, shot, yesterday, ., today, sore, arm, sore, neck, headache, but, you, -, can, i, i, go, around, it, ,, can, i, i, go, under, it, ,, gotta, go, through, it, ,, i, i, i, i, going, live, i, that, is, all"
152,"getting, my, and, dose, modern, today, syringe"
153,"got, my, second, dose, modern, vaccine, yesterday, #, fullyvaxxed, #, fullyvaccinated, #, modernagang"
154,"getting, my, first, dose, modern, vaccine, today, kinda, nervous, anything, i, should, know"
155,"my, husband, gets, his, second, modern, dose, today, partying_face"
156,"they, could, also, bring, az, clinics, &, amp, ;, give, those, older, patients, booked, suitable, age, group, ,, &, amp, ;, open, up, pfizer, /, modern, spots, reserved, pregnant, women, ."
157,"modern, ., syringe"
158,"my, second, modern, today, ..., yay"
159,"pfizer, modern, couid, -, nineteen, vaccines, do, not, appear, pose, serious, risk, during, pregnancy, ,, research, shows"
160,"guy, my, dad, puts, to, every, morning, so, he, can, see, how, boeing, modern, are, doing, is, going, host, "", jeopardy, """
161,"tune, "", reunited, "", by, peaches, &, amp, ;, herb, :, musical_notes, "", vaccinated, it, feels, so, good, ..."", musical_notes, dose, #, two, modern, done, syringeflexed_biceps"
162,"im, really, crying, in, cause, i, haven, i, i, been, able, sleep, since, two, ., this, and, dose, modern, got, me, fucked, upexploding_head"
163,"We, were, shopping, at, Walmart, today, ., An, announcement, came, ., he, says, :, we, have, an, extra, modern, vaccine, ,, you, can, come, and, get, it, right, away, ., clapping_handslight_skin_toneclapping_handslight_skin_toneclapping_handslight_skin_tone, without, even, needing, an, appointment"
164,"three, his, sleep, second, dose, modern, got, me, feeling, like, im, faded, upside, -, down_face, lazy, af, laughing, at, stupid, shit"
165,"second, dose, modern, is, really, taking, me, out, in, ., i, feel, like, absolute, ass"
166,"same, i, participated, phase, three, testing, modern, shot, ., i, received, placebo, had, get, real, thing, last, month"
167,"yay, modern"
168,"modern, dose, two, was, same, ., thirty-six, straight, hours, sweaty, exhaustion, ."
169,"first, shot, ,, modern, ., thanks"
170,"i, got, shingles, less, than, thirty-six, hours, after, my, est, modern, shot, -, i, reported, it, my, doc, who, reported, it, cac, ., i, i, ve, been, told, i, i, i, ok, get, my, and, shot, &, amp, ;, although, i, i, ve, been, horrible, pain, ,, i, cannot, wait, be, vaccinated, one, step, closer, normalcy, smiling_face_with_smiling_eyessmiling_face_with_smiling_eyes"
171,"i, i, i, starting, get, vaccine, envy, i, wanna, join, club, pfizer, ,, az, ,, modern, ,, i, don, i, i, even, care, which, one, put, it, me"
172,"got, first, dose, modern, folded_handsmedium, -, light_skin_tone"
173,"done, ., and, dose, was, feb, ord, ., modern"
174,"got, my, and, dose, #, modern, march, with, ., #, vaccine, #, vaccinated, #, fauciouchie"
175,"hubs, got, his, and, dose, today, ., came, bed, found, him, sitting, up, bed, dark, ., ask, him, how, he, ', i, doing, ., he, told, me, his, fingernails, hurt, ., grinning_face_with_sweat, #, covid19, #, modern"
176,"got, my, and, modern, jab, 11Happy_face_smiley0, am, past, monday, ., pain, arm, jab, site, ,, really, sore, -, started, at, seven, :, zero, am, ., chills, at, night, ., tuesday, morning, :, aches, ,, pains, ,, headache, ,, exhaustion, chills, throughout, day, ., had, take, day, off, ., two, tylenol, did, not, make, dent, ."
177,"modern, mandingo, ..., more, like, modern, manmusty, wit, yo, non, social, ass, ."
178,"in, two, weeks, I, get, the, second, dose, of, the, trendy, crossed_fingersmedium, -, light_skin_tone"
179,"my, and, modern, vaccine, is, kicking, my, ass, today, ., fever, ,, chills, ,, sore, arm, no, appetite, ...., ugh, ., weary_face"
180,"my, second, shot, modern, basically, feels, like, less, fun, indica, high, ., i, feel, basically, fine, but, i, don, i, i, want, move, ., i, just, watched, unstoppable, ,, about, train, that, cannot, be, stopped, ., so, like, that, i, i, vibe, ."
181,"i, got, my, second, modern, sunday, ., like, your, dad, ,, i, had, no, adverse, reaction, ."
182,"yes, ,, february, ., modern, ., smiling_face_with_smiling_eyes"
183,"got, est, shot, modern, vaccine, today, thanks, everyone, who, made, this, possible, especially, cac, syringe, we, all, need, do, our, part, ,, so, when, you, are, offered, chance, get, vaccinated, ,, do, it, #, conquercovid, #, coronaviruspandemic"
