,0
2432,"i, the, two, health, care, workers, britain, had, experienced, anaphylaxis, past, because, food, allergies, ,, pfizer, official, said, during, i, ., i, ., a, ., meeting, thursday, ., both, carried, epipen, -, type, devices, inject, themselves, with, epinephrine, case, such, reaction, i"
2433,"military, troops, ,, imprisoned, folk, ,, healthcare, workers, ,, long, term, care, residents, ,, folks, over, eighty, ,, those, over, sixty, ,, etc, ., us, is, with, or, with, country, receive, pfizer, vaccine, ., spring, two thousand and twenty, ,, one hundred and seventy, countries, ,, under, coax, ,, not, us, ,, ,......"
2434,"pfizer, vaccine, coming, this, week, got, pal, feeling, brave, lol, hell, i, uncovered, one, nostril, face_with_tears_of_joy, #, covid19, #, pfizer"
2435,"i, didn, ', i, mention, pfizer, and, ,, you, missed, point, ., he, obviously, has, made, positive, impact, march, towards, vaccine, ., but, haters, your, self, included, i, ', i, guessing, will, never, recognize, it, ., ok, sport, u, got, it, now, or, do, i, have, explain, it, again"
2436,"why, would, pfizer, stake, their, reputation, as, global, pharma, company, you, should, learn, how, report, without, bias, which, more, imp, u, than, truth"
2437,"historic, journey, :, pfizer, prepares, deliver, six, ., four, million, doses, couid, -, nineteen, vaccines, via"
2438,"police_car_lightpolice_car_light, ., i, covidvaccine, help, is, way, i, United_States, double_exclamation_mark, i, will, you, receive, ithand_with_fingers_splayedmedium, -, dark_skin_toneexclamation_question_mark, i, i, covid19usa, i, covidiot, backhand_index_pointing_downmedium_skin_tone"
2439,"trump, had, nothing, do, with, pfizer, getting, vaccine, people, u, idiot, ., why, would, u, think, people, would, fall, that, is"
2440,"so, cool, ."
2441,"pfizer, vaccine, appointment, scheduled, ., anyone, not, taking, vaccine, if, offered"
2442,"pfizer, vaccine, is, stateside, its, way, i, could, cry, ., it, i, i, beautiful, thing, ., loudly_crying_face"
2443,"this, doesn, ', i, mean, stop, masking, other, measures, ., "", first, trucks, carrying, couid, -, nineteen, vaccine, us, have, left, pfizer, facility, """
2444,"pfizer, comes, out, this, looking, like, real, hero, ,, maybe, moreso, than, researchers, ."
2445,"plane, carrying, pfizer, i, i, couid, vaccine, has, landed, at, shipping, company, i, i, facility, memphis, to"
2446,"#, doctors, not, doctors, have, solved, #, pandemic, #, year2020, ., although, ,, latter, suffered, most, due, #, covid19, ., #, covidvaccine, #, mrna"
2447,"because, good, legal, advice"
2448,"he, doesn, ', i, deserve, thank, you, finally, doing, his, jobpouting_face"
2449,"even, tho, i, i, i, not, taking, vaccine, ., y, i, all, go, right, ahead, take, it, ., i, bought, ten, i, shares, pfizer, ., two, weeks, ago, moneybag, moneybag, moneybag"
2450,"thank, god, #, truckdriver, who, are, making, these, long, hauls, :, first, trucks, carrying, couid, -, nineteen, vaccine, us, have, left, pfizer, facility"
2451,"The, first, shipment, of, the, vaccine, against, #, couid, _, nineteen, distribution, centers, and, airports, has, already, left, the, headquarters, of, in, michigan, ., the, fifty, states, will, arrive, tomorrow, ., -, This, Monday, will, be, a, great, day, ."
2452,"i, sincerely, hope, you, are, kidding, trumps, ', delay, with, this, pandemic, i, beginning, is, reason, we, i, i, this, mess, he, should, have, taken, this, seriously, &, amp, ;, acted, sooner, &, amp, ;, i, my, eyes, ,, he, is, responsible, four, loss, life, here, i, u, ., i, ., he, is, not, owed, thanks, four, finally, doing, his, job"
2453,"with, imex, ,, immune, system, being, boosted, ,, i, feel, it, i, i, unpredictable, how, patient, i, i, immune, system, may, react, ., worse, is, better, but, it, is, no, -, brainer, that, all, clinical, trials, will, be, badly, effected"
2454,"what, team, they, ', re, getting, out, ,, they, can, read, tea, leaves, ."
2455,"good, guess, i, say, ."
2456,"trump, admin, had, nothing, do, with, pfizer, vaccine"
2457,"spite, trump, ', i, lack, leadership, ."
2458,"wwii, factories, michigan, answered, call, ., two thousand and twenty, michigan, i, i, manufacturing, answers, call, again, ., congrats, people, southwest, michigan, ., it, i, i, big, day, ."
2459,"anyone, else, feel, like, maybe, news, agencies, shouldn, i, i, be, allowed, film, trucks, leaving, pfizer, i, i, headquarters, with, vaccines, like, i, i, i, semi, concerned, about, trucks, being, hijacked, ."
2460,"#, hope"
2461,"ah, ,, got, it, ., after, tweeting, ,, i, was, wondering, if, kalamazoo, international, airport, could, handle, logistics, ., err, makes, more, sense, slightly_smiling_face"
2462,"if, they, started, the, guadalupe, -, pfizer, yesterday, or, not"
2463,"pfizer, biotech, ', i, vaccine, was, designed, hours, over, single, day, -, business, insider"
2464,"minutes, ago, ,, trucks, full, of, #, coronavirus, vaccines, left, the, facilities, in, portage, ,, michigan, ,, heading, for, distribution, centers, and, airports, ."
2465,"developing, :, leaked, cop, data, shows, us, consulates, comprised, ;, boeing, pfizer, infiltrated, too, |, election, wizard, stop, making, sense, ,, pleaaaaaseeeee, pleading_face"
2466,"feed, i, /, ann, roomer, -, today, at, five, am, -, also, ., medical, officer, health, alana, fitzgerald, -, husk, i, /, reaction, pfizer, vaccine, ., i, /, &, amp, ;, survey, about, impact, and, wave, ., plus, ,, &, amp, ;, virtual, show, featuring"
2467,"agree, but, who, ultimately, will, suffer, hospital, personnel, who, will, be, overworked, ., if, pfizer, is, right, their, vaccine, has, ninety-five, %, efficacy, that, still, leaves, five, %, vaccinated, people, still, vulnerable, ., employers, ,, schools, etc, should, require, vaccine, ."
2468,"just, in, :, announces, it, i, i, first, shipment, vaccine, should, arrive, tomorrow, be, distributed, hospitals, across, state"
2469,"thinking, all, my, frontline, friends, who, are, doctors, ,, cops, ,, firefighters, all, our, state, i, i, frontline, workers, today, ,, as, pfizer, begins, delivering, vaccine, ., thank, you, risking, everything, us, over, these, past, nine, months, ."
2470,"cac, director, accepts, advisory, committee, i, i, recommendation, ;, pfizer, biotech, i, i, couid, -, nineteen, vaccine, can, now, be, administered, us"
2471,"it, i, i, secured, facility, ."
2472,"hopefully, there, will, be, security, transport"
2473,"breaking, -, i, last, night, ,, i, was, proud, sign, advisory, committee, immunization, practices, i, recommendation, use, pfizer, i, i, couid, -, nineteen, vaccine, people, sixteen, older, i, initial, couid, -, nineteen, vaccination, is, set, start, as, early, as, monday"
2474,"according, vaccine, may, not, work, as, well, people, who, are, immune, compromised, or, receiving, immunotherapy, example, :, cancer, patients, it, comes, two, doses, given, three, weeks, apart, ., it, does, not, say, how, long, it, will, take, be, effective, ."
2475,"they, are, moved, special, cold, boxes, that, contain, sufficient, dry, ice, keep, them, cold, several, days, ."
2476,"trucks, carrying, pfizer, couid, -, nineteen, vaccine, leave, michigan, facility, via, yay, yay, yay, glory, hallelujah, heart_suit, i, heart_suit, i, syringesyringe, thank, you, thank, god"
2477,"omg, yes, ., that, realizing, your, key, reagent, is, behind, wall, freezer, racks, or, worse, unlabeled, box, ."
2478,"it, first, shipment, kalamazoo, plant, ...., pfizer, -, biotech, #, covid19, vaccine"
2479,""", pfizer, ', i, vaccine, has, already, been, approved, for, emergency, use, ., it, ', i, like, the, psi, :, everyone, wants, it, ,, nobody, can, get, it, and, if, you, ', re, rich, you, ', ve, had, it, for, a, month, ""..."
2480,"it, first, shipment, kalamazoo, plant, ., #, pfizerbiontech, #, covid19vaccine, has, not, been, approved, or, licensed, by, but, has, been, authorized, emergency, use, prevent, #, covid19, individuals, sixteen, i, see, conditions, use, :"
2481,"proud, say, is, part, this"
2482,"so, i, live, twenty, minutes, away, ., y, i, all, need, help, exchange, vaccine"
2483,"woot, first, trucks, carrying, couid, -, nineteen, vaccine, us, have, left, pfizer, facility"
2484,"question, :, how, long, until, someone, is, safe, go, out, /, get, back, i, normal, i, living, after, taking, vaccine, microbesyringe"
2485,"lan, -, edf"
2486,"ron, boys, tension, hugs, his, wife, mickey, as, they, watch, fedex, plane, loaded, with, pfizer, i, i, couid, -, nineteen, vaccine, take, off, at, grand, rapids, airport, sunday, ., #, covid_19, #, couid, #, grandrapids, #, vaccine, #, pfizer"
2487,"new, :, first, shipment, pfizer, couid, -, nineteen, vaccines, have, touched, down, at, ups, i, world, headquarters, louisville, ,, kentucky, ., ups, will, handle, shipping, vaccine, half, country, ."
2488,"i, any, person, with, history, anaphylaxis, vaccine, ,, medicine, or, food, should, not, receive, pfizer, biotech, vaccine, i, mara, chief, executive, june, raine, said, statement, ., we, have, anaphylaxis, is, our, family, ., it, i, i, no, us, ."
2489,"jake, tapper, interviewing, hahn, ;, i, you, say, him, americans, will, be, vaccinated, by, year, end, ., there, are, two, weeks, left, pfizer, shipped, two, ., am, vials, ., how, is, that, possible, i"
2490,"i, did, same, thing, swear, god, when, i, saw, #, fedex, plane, took, off, with, vaccine, as, well, ."
2491,"i, am, unnecessarily, almost, emotionally, fired, up, about, these, pictures, absolute, fleets, semis, leaving, pfizer, headquarters, michigan, with, vaccines"
2492,"let, ', i, not, forget, he, also, took, pass, enough, pfizer, vaccine, usa, ..."
2493,"about, ga, trucks, carrying, pfizer, vaccine, inject, both, doses, into, my, body, ,, one, each, arm"
2494,"oh, i, hope, pray, these, people, get, paid, lot, do, this, as, pfizer, has, money, they, are, amazing"
2495,"thinking_face, first, trucks, carrying, couid, -, nineteen, vaccine, us, have, left, pfizer, facility"
2496,"are, you, saying, i, pfizer, didn, i, i, build, that"
2497,"list, better, candidates, pay, :, one, ., do, ., faci, /, three, ceo, i, i, pfizer, ,, i, &, amp, ;, i, ,, modern, two, ., bum, /, george, floyd, /, brenna, taylor, three, ., frontline, workers, four, ., coronavirus, five, ., pat, homes, six, ., cardboard, cutouts, at, sporting, events, seven, ., xi, jinxing, eight, ., do, ., evil, aka, jeff, bozos, nine, ., donald, trump"
2498,"province, says, about, half, approximately, nine hundred, appointments, pfizer, vaccine, this, week, have, been, booked, ., initial, shots, are, only, available, select, healthcare, workers, over, fifty, ., however, vaccine, hotline, took, over, one hundred, ,, zero, calls, saturday, alone, ."
2499,"The, first, trucks, containing, couid, nineteen, vaccines, leave, ,, escorted, ,, from, the, Pfizer, laboratory, in, Kalamazoo, ,, Michigan, ,, to, be, distributed, in, all, fifty, states, ., promising, ."
2500,"if, pfizer, i, i, viagra, can, bring, life, again, dead, ,, i, i, i, certain, their, couid, -, nineteen, vaccine, will, be, just, fine, ."
2501,"hope, ahead, first, trucks, carrying, couid, -, nineteen, vaccine, us, have, left, pfizer, facility"
2502,"The, first, trucks, containing, couid, nineteen, vaccines, leave, ,, escorted, ,, from, the, Pfizer, laboratory, in, Kalamazoo, ,, Michigan, ,, to, be, distributed, in, all, fifty, states, ."
2503,"which, one, should, i, invest, in, :, blockbuster, or, pfizer"
2504,"pfizer, didn, ', i, take, any, money, trump, produce, their, vaccine, #, trumpvirus"
2505,"it, i, i, amazing, think, work, done, by, ,, two thousand and twenty, ., amount, work, ahead, ., as, citizen, ,, i, i, i, grateful, ., thank, you, #, covidvaccines, #, fda, #, covid19"
2506,"how, much, they, payed, trucker"
2507,"every, time, mentions, ultra, -, cold, storage, required, by, #, covidvaccine, ,, i, have, flashbacks, about, defrosting, my, lab, i, i, -, eighty, dec, freezer, roping, my, colleagues, help, push, frost, -, lined, door, closed, shut, ., #, sciencetwitter, #, medtwitter"
2508,"when, will, we, see, first, hijacking"
2509,"i, where, will, pfizer, i, i, couid, -, nineteen, vaccine, go, when, it, gets, south, florida, i"
2510,"this, is, exciting, #, celebrate, first, trucks, carrying, couid, -, nineteen, vaccine, us, have, left, pfizer, facility"
2511,"fda, approves, pfizer, i, i, couid, -, nineteen, vaccine, emergency, distribution, us"
2512,"#, usa, :, first, coronavirus, vaccine, delivery, trucks, leave, pfizer, ', i, michigan, warehouse, ., The, federal, drug, office, on, Friday, approved, the, use, of, the, vaccine, in, the, US, ."
2513,"it, must, be, hard, being, stupid, ., doctors, many, countries, worked, together, do, this, ., pfizer, took, zero, money, government, keep, it, nonpartisan, ,, if, you, actually, read, anything, you, would, have, seen, statement, pfizer, ceo, directly, ., but, you, probably, can, i, i, read, ."
2514,"i, &, amp, ;, operation, warp, speed, had, nothing, do, with, development, pfizer, vaccine, ., it, was, funded, germany, ., since, trump, has, few, couid, successes, ,, you, feel, need, make, them, up, ., we, expect, retraction"
2515,"go, pfizer, firecollisioncollisioncollisionOK_handmedium, -, dark_skin_tone"
2516,"emotional, moment, crying_face, thank, u, god, ., "", first, trucks, carrying, couid, -, nineteen, vaccine, us, have, left, pfizer, facility, """
2517,"santa, lucia, arrives, with, light, darkest, times, dec, ., thirteen, each, year, ., this, year, ,, first, trucks, leave, pfizer, facility, ., candlered_heart, i"
2518,"smiling_face_with_heart, -, eyes, The, first, batch, of, #, couid, -, nineteen, pandemic, vaccine, produced, by, #, pfizer, in, Kalamazoo, ,, Michigan, ., Primarily, visit, hospitals, and, nursing, homes, ."
2519,"there, ', i, going, be, merry, christmas, after, all"
2520,"pretty, wild, seeing, all, these, images, my, hometown, filling, my, feed, this, morning, i, my, dad, even, worked, at, this, facility, when, it, was, headquarters, upon, ,, before, pfizer, ., #, itsreallyportage"
2521,"i, unexpectedly, broke, down, sobbing, while, watching, images, #, covidvaccine, distribution, center, today, ., thank, you, ,, science, ."
2522,"#, two thousand and twenty, getting, little, bit, better, police_car_light, #, hope, thank, you, ,"
2523,"couid, vaccines, pfizer, are, being, shipped, right, now, distribution, hospitals, other, facilities, across, country, ,, like, president, -, elect, says, "", help, is, way, "", so, as, next, administration, come, january, with, that, will, put, this, virus, under, control, ., i, ., _Outlying_Islands, ."
2524,""", fda, approves, pfizer, i, i, couid, -, nineteen, vaccine, emergency, distribution, us, "", #, detroit, #, michigan, #, grandrapids, #, boston, #, miami, #, atlanta, #, quarantine, #, vaccine, #, covid19"
2525,"let, i, i, go, beginning, end, first, trucks, carrying, couid, -, nineteen, vaccine, us, have, left, pfizer, facility, #, covidvaccine, #, couid"
2526,"history, west, michigan, this, weekend, ., first, plane, out, with, shipment, pfizer, made, ,, couid, -, nineteen, vaccine, ."
2527,"i, shipments, pfizer, vaccine, will, set, motion, biggest, vaccination, effort, american, history, i"
2528,"pfizer, plant, near, kalamazoo, that, shipped, vaccines, today, video, going, around, is, just, enormous, ., like, ford, river, rouge, enormous, ."
2529,"i, love, you, pfizer, #, pfizer, #, kalamazoo"
2530,"First, trucks, begin, distributing, Pfizer, ', i, vaccine, in, the, US"
2531,"tribute, #, diversity, :, inventors, pfizer, couid, #, vaccine, uour, satin, &, amp, ;, oblem, tureen, -, turkish, immigrants, germany, ., inventor, modern, couid, vaccine, cougar, aryan, -, lebanese, #, immigrant, u, ., i, ., head, #, warpspeed, speed, operation, money, mohammad, slow, -, moroccan, immigrant, u, ., i, ., a, ."
2532,"great, see, my, old, college, town, ,, kalamazoo, ,, mi, ,, positive, light, reflecting, pfizer, i, i, manufacturing, shipping, couid, -, nineteen, vaccine, ., i, zoo, is, wonderful, community, with, well, -, educated, population, ., it, is, home, western, michigan, university, ."
2533,"first, trucks, with, couid, -, nineteen, vaccine, roll, out, pfizer, plant, michigan, via"
2534,"so, trucks, are, headed, out, with, #, vaccine, but, does, anyone, know, plan, has, anyone, said, who, when, how, this, all, works, #, covid19, #, pandemic, #, coronavaccine, #, pfizer, #, pfizervaccine, #, leadership, is, needed, ."
2535,"aayyy, first, trucks, carrying, couid, -, nineteen, vaccine, us, have, left, pfizer, facility"
2536,"pfizer, global, supply, plant, my, hometown, kalamazoo, ,, michigan, is, shipping, first, vaccines, sites, us, today, ."
2537,"&, amp, ;, plus, do, what, pfizer, is, doing, ., soon, ."
2538,"i, got, nine, ., seven, shares, pfizer, like, two, -, three, months, ago, ., how, much, this, shit, bout, jump"
2539,"god, bless, america"
2540,"pfizer, has, shipped, first, doses, coronavirus, vaccine, distribution, united, states, ."
2541,"i, thought, same, shit, lol, ,, that, i, i, awkward, as, hell"
2542,"they, were, talking, about, conservatives, being, violent, doing, something, trucks, with, vaccines, ."
2543,"first, u, ., i, ., shipment, coronavirus, vaccine, left, pfizer, i, i, facility, near, kalamazoo, ,, michigan, ., #, logistics, #, trucking, #, usa, #, vaccine"
2544,"clapping_handslight_skin_tone, first, trucks, carrying, couid, -, nineteen, vaccine, us, have, left, pfizer, facility"
2545,"pfizer, is, international, ., once, it, was, determined, internationally, they, other, companies, jumped, bandwagon, find, vaccine, ., we, still, do, not, know, about, long, range, effects, or, length, protection, ."
2546,"people, will, be, vaccinated, before, end, two thousand and twenty, ., this, is, remarkable, feat, accomplished, while, #, covid19, spread, across, globe, ., grateful, hope, as, we, go, into, abbreviated, holidays, ., first, doses, pfizer, -, biotech, ', i, couid, -, nineteen, vaccine, arriving, canada"
2547,"this, is, simply, first, batch, pfizer, ., nothing, more, ."
2548,"first, trucks, with, couid, vaccine, roll, out, pfizer, plant, michigan, under, guard, u, ., i, ., marshals"
2549,"trucks, departed, pfizer, plant, kalamazoo, ,, michigan, ,, sunday, morning, with, first, batches, company, i, i, long, -, awaited, couid, -, nineteen, vaccine, ,, en, route, six hundred and thirty-six, predetermined, locations, across, us, ."
2550,"not, pfizer, they, didn, ', i"
2551,"wonderful, see, first, large, shipment, pfizer, i, i, couid, -, nineteen, vaccine, leaving, manufacturing, center, portage, ,, michigan, ., december, thirteen, ,, two thousand and twenty, ."
2552,"has, approved, vaccine, covid19, ., when, it, i, i, my, turn, ,, i, plan, take, vaccine, encourage, others, take, it, as, well, ., do, you, plan, take, covid19, vaccine, help, us, get, back, normal"
2553,"because, he, bought, already, developed, vaccine, german, company, us, funds, played, no, role, developing, vaccine"
2554,"what, moment, fedex, plane, ,, carrying, millions, doses, pfizer, i, i, couid, -, nineteen, vaccine, ,, just, took, off, grand, rapids, i, gerald, i, ., ford, international, airport, ., it, i, i, heading, fedex, i, i, global, hub, memphis, nationwide, distribution, ., hang, there, ,, america"
2555,"tweet, chairman, ceo, ,, company, that, partnership, with, biotech, ,, created, first, #, couid, vaccine, authorized, emergency, use, u, ., i, ."
2556,"pfizer, -, biotech, couid, -, nineteen, vaccine, are, rolling, out, plant, ., this, first, shipment, will, be, going, all, fifty, states, ."
2557,"once, they, know, they, have, successful, vaccine, ., trump, administration, is, only, costumer, ,, us, funds, played, no, role, development, vaccine"
2558,"i, got, chicken, pox, measles, as, child, ., my, oldest, was, small, when, vaccine, came, out, i, refused, it, ., he, eventually, got, it, at, age, sixteen, be, do, said, it, would, be, hard, him, if, he, got, it, ., my, youngest, got, it, be, it, had, been, out, years, at, that, point, ."
2559,"bless, those, pilots, ."
2560,"i, new, jersey, is, set, receive, seventy-six, ,, fifty, doses, vaccine, developed, by, pfizer, german, company, biotech, ., priority, groups, initial, doses, are, front, -, line, health, care, workers, residents, long, -, term, care, i, #, hoboken, blue_heart, ambulance, hospitalclapping_handsmedium, -, light_skin_toneclapping_handsmedium, -, light_skin_toneblue_heartfolded_handslight_skin_toneUnited_States"
2561,"here, ..., we, ..., go, first, pfizer, couid, -, nineteen, vaccine, shipments, left, kalamazoo, ,, michigan, ,, this, morning, their, way, six hundred and thirty-six, distribution, sites, across, country, ., federal, officials, say, nearly, three, million, doses, will, arrive, at, their, locations, by, wednesday, ."
2562,"two, possibly, most, meaningful, freight, flights, modern, history, ., twentyfour, year, old, airbus, a300, twentynine, year, old, boeing, seven hundred and fifty-seven, are, both, air, with, first, shipments, #, couid, vaccine, ."
2563,"i, once, vaccine, ', i, ingredients, have, been, shipped, pfizer, ', i, facility, it, ., louis, ,, missouri, ,, they, arrive, at, andover, location, be, incubated, ., then, ,, doses, are, sent, kalamazoo, ,, michigan, final, touches, ,, before, being, shipped, hospitals, worldwide, i"
2564,"unbelievable, pfizer, success, clapping_hands, clapping_hands, clapping_hands"
2565,"i, i, i, sorry, them, i, i, i, not, saying, it, i, i, not, real, i, just, won, i, i, get, vaccine, if, they, make, mandatory, school, kids, ,, i, i, all, homeschool, my, son, ., im, not, anti, baxter, but, we, don, i, i, do, flu, vaccines, we, won, i, i, do, couid, ."
2566,"do, you, think, it, ', i, great, because, your, decisions, led, three thousand, deaths, today, or, because, you, turned, down, extra, million, vaccines, pfizer"
2567,"thank, each, every, one, you, being, there, ., your, work, is, so, appreciated, ."
2568,"coincident, time, we, can, store, pfizer, vaccine, hell, ."
2569,"when, first, trucks, carrying, couid, -, nineteen, vaccine, u, ., i, ., leave, pfizer, facility, ."
2570,"first, trucks, carrying, #, pfizer, #, covid19, vaccines, be, delivered, fifty, states, ., #, safetravelsfolded_handsmedium, -, light_skin_tone"
2571,"how, much, money, is, scott, gottlieb, making, being, board, pfizer, ,, which, is, profiting, vaccine, they, bought, another, company"
2572,"i, covidvaccine, i, covid19usa, ., i, michigan, i, covidrelief"
2573,"pfizer, ,, modern, ,, oxford, |, get, ready, couid, vaccine, |, do, faheen, yo, ..., via"
2574,"pfizer, ,, modern, ,, oxford, developed, vaccine, ., trump, did, nothing"
2575,"i, can, i, i, help, myself, ,, i, i, ve, got, whole, list, questions, ideas, process, improvements, main, one, is, how, quickly, can, we, get, rid, hot, glue, gun, #, gemma"
2576,"good, news, ., course, ,, it, i, i, not, mandatory, but, at, work, ,, they, will, be, giving, vaccine, free, all, associates, ., it, i, i, time, go, back, i, normal, ..., first, trucks, carrying, couid, -, nineteen, vaccine, us, have, left, pfizer, facility"
2577,"yeasts, #, van, #, covidvaccine, #, pfizer, #, thankful"
2578,"thank, you, so, much"
2579,"is, truck, able, maintain, -, of"
2580,"one hundred and eighty-nine, package, #, pfizer, vaccine, syringe, shipping, today, set, arrive, all, fifty, states, tomorrow, #, covid19, #, thesundayshow"
2581,"i, first, batches, coronavirus, vaccine, shipped, ,, launching, historic, effort, immunize, u, ., i, ., trucks, containing, one hundred and eighty-nine, boxes, vaccine, each, rolled, out, pfizer, plant, headed, fedex, ups, distribution, centers, throughout, country, i"
2582,"outside, u, ., i, ., universal, sign, #, couid, vaccine, is, way, :, carriers, are, loading, up, trucks, deliver, it, ."
2583,"where, are, army, or, policemen, protection"
2584,"andd, they, i, re, off, trucks, ,, like, this, one, ,, are, loaded, with, first, shipment, vaccine, michigan, facility, ."
2585,"pfizer, didn, i, i, i, develop, i, couid, vaccine, i, two, turkish, muslim, immigrants, germany, invented, that, vaccine, ,, then, pfizer, bought, it, took, credit, ., it, i, i, what, american, pharmaceutical, corporations, do, best, ."
2586,"science, ,, as, always, ,, will, prevail, lead, us, out, this, dark, time, ., thanks, amazing, team, unprecedented, swiftness, review, ,, trucks, are, rolling, help, is, way, ., others, soon, follow, ., #, covidvaccine"
2587,"folded_handslight_skin_tone, these, vaccines, arrive, safely, they, work, efficiently, folded_handslight_skin_tone, that, we, see, light, at, end, this, very, dark, tunnel, we, are, all, experiencing, "", first, trucks, carrying, couid, -, nineteen, vaccine, us, have, left, pfizer, facility, """
2588,"it, looks, weird, ., those, people, are, not, even, wearing, proper, clothing, -, seventy"
2589,"Fyi, ,, from, the, results, of, the, clinical, study, of, the, pfizer, vaccine, yesterday, ,, it, turned, out, that, the, endpoint, for, preventing, disease, had, not, been, included, in, the, study, protocol, ."
2590,"thumbs_upthumbs_upthumbs_up, first, trucks, carrying, couid, -, nineteen, vaccine, us, have, left, pfizer, facility"
2591,"breaking, news, :, first, shipment, delivery_truck, dashing_away, #, covidvaccine, u, ., i, ., is, being, loaded, onto, plane, michigan, ,, other, vials, test_tube, are, being, boxed, up, at, pfizer, i, i, facility, near, kalamazoo, #, news"
2592,"tears, dripping, down, as, i, watch, trucks, loaded, with, vaccine, leave, pfizer, ', i, michigan, ., dear, god, let, nobody, die, while, vaccines, speed, their, way, ., dec, ., thirteen, ,, two thousand and twenty, ."
2593,"nah, ,, just, trumplicons"
2594,"first, truck, with, pfizer, vaccines, leaving, a, while, ago, from, pfizer, headquarters, in, michigan, ., historical"
2595,"pfizer, is, going, full, ham, salami, hero, narrative, eh"
2596,"amazing, so, grateful, these, teams, efforts"
