,0
3831,"thinking_face, "", us, panel, recommends, approving, pfizer, i, i, couid, -, nineteen, vaccine, emergency, distribution, """
3832,"how, many, pfizer, modern, drag, queens, will, emerge, summer, twentynine"
3833,"fda, advisers, recommend, authorization, pfizer, /, biotech, coronavirus, vaccine"
3834,""", us, panel, recommends, approving, pfizer, i, i, couid, -, nineteen, vaccine, emergency, distribution, """
3835,"with, that, ,, fda, will, very, likely, grant, emergency, use, authorization, pfizer, /, biotech, couid, vaccine, within, days, ,, if, not, sooner, ., via"
3836,"time, phase, two, experiment, #, buckle, us, panel, recommends, approving, pfizer, i, i, couid, -, nineteen, vaccine, emergency, distribution"
3837,"fda, advisers, recommend, pfizer, -, biotech, coronavirus, vaccine, ,, with, agency, action, expected, soon, by, laurie, mckinley, carolyn, y, ., johnson"
3838,"what, i, i, wrong, with, pfizer, i, i, stock"
3839,"fda, approves, pfizer, vaccine, couid, -, nineteen, ."
3840,"i, the, fda, analyzes, the, emergency, approval, of, the, pfizer, vaccine"
3841,"not, at, all, shocking, but, big, news, here, us, panel, recommends, approving, pfizer, i, i, couid, -, nineteen, vaccine, emergency, distribution"
3842,"one hundred, million, shots, which, is, all, government, is, ordered, pfizer, is, only, enough, fifty, million, people, at, two, shots, per, person, biden, has, called, giving, shots, first, hundred, days, his, term, which, is, april, with, ."
3843,"thank, you, #, covid19vaccine"
3844,"just, in, :, fda, panel, endorses, pfizer, couid, -, nineteen, vaccine, ,, full, approval, could, come, days"
3845,"go, ,, go, ,, go, "", fda, panel, recommends, approving, pfizer, i, i, couid, -, nineteen, vaccine, emergency, distribution, """
3846,"fda, panel, recommends, approving, pfizer, i, i, couid, -, nineteen, vaccine, emergency, distribution"
3847,"advisory, panel, says, yes, ,, emergency, use, #, covid19, vaccine, ."
3848,"wonderful, news, thumbs_upthank, you, folded_hands"
3849,"breaking, news, :, fda, ', i, vaccine, committee, votes, in, favor, of, authorizing, emergency, use, of, pfizer, ', i, vaccine, ."
3850,"#, breaking, :, us, panel, endorses, widespread, use, pfizer, couid, -, nineteen, vaccine"
3851,"fda, gives, green, light, pfizer, ', i, couid, vaccine, ."
3852,"fda, just, approved, pfizer, vaccine, it, will, be, available, next, week, ."
3853,"#, fda, panel, votes, favor, #, pfizer, #, couid, -, nineteen, #, vaccine"
3854,"just, now, fda, panel, recommends, approval, pfizer, i, i, couid, vaccine, emergency, use"
3855,"us, panel, endorses, widespread, use, pfizer, couid, -, nineteen, vaccine, -"
3856,"fda, authorized, pfizer, i, i, vaccine, ., syringe"
3857,"just, in, :, fda, advisors, recommended, approval, pfizer, couid, -, nineteen, vaccine, ."
3858,"fda, authorized, pfizer, vaccine, ., so, starts, one, biggest, public, health, campaigns, living, memory, ."
3859,"thank, you, approving, pfizer, vaccine, today, now, ,, let, i, i, get, it, people, save, lives"
3860,"one, step, closer, shot, congrats, their, #, covid19vaccine, ., hopefully, #, eau, will, follow, soon"
3861,""", fda, panel, recommends, approving, pfizer, i, i, couid, -, nineteen, vaccine, emergency, distribution, """
3862,"why, did, four, say, no, one, abstentionthinking_facethinking_facethinking_face"
3863,"police_car_lightjust, in, :, panel, experts, has, voted, favor, recommending, that, authorize, #, pfizer, ', i, couid, -, nineteen, vaccine, emergency, use, ."
3864,"#, breaking, :, fda, advisory, committee, votes, recommend, pfizer, i, i, #, covid19, vaccine, approval, ., fda, still, has, grant, emergency, use, authorization, distribution, ."
3865,"right, now, who, i, i, ready, eyes, fda, panel, recommends, approving, pfizer, i, i, couid, -, nineteen, vaccine, emergency, distribution"
3866,"green, light, advisory, panel, #, covid19vaccine"
3867,"The, panel, of, twenty-two, experts, voted, in, favor, of, giving, the, Pfizer, vaccine, a, i, green, light, i, the, FDA, must, approve, this, in, the, next, few, hours, ., the, vote, was, seventeen, favor, ., four, against, and, one, abstention, ., #, covid19, United_States"
3868,"#, breaking, :, us, food, drug, administration, ', i, advisory, committee, recommended, agency, grant, emergency, use, authorization, pfizer, i, i, coronavirus, vaccine, ., #, covid19"
3869,"can, :, fda, advisory, panel, has, voted, recommend, that, agency, grant, emergency, use, authorization, pfizer, i, i, coronavirus, vaccine, ."
3870,"pfizer, ', i, vaccine, is, giving, people, bell, ', i, palsy, ., y, i, all, be, careful, out, there, ."
3871,"syringe, panel, gives, green, light, ', i, #, covid19, #, vaccine"
3872,"i, u, ., i, ., officials, plan, continue, watching, any, adverse, reactions, pfizer, i, i, vaccine, health, -, care, workers, nursing, home, residents, who, receive, it, i, they, still, aren, i, i, sure, long, term, effects, bow, ."
3873,"pfizer, ,, modern, ,, oxford, ,, inject, me, baby, ,, i, ', i, free, bitch"
3874,"breaking, news, :, us, panel, endorses, pfizer, couid, -, nineteen, shot"
3875,"last, minute, :, police_car_light, a, panel, of, experts, from, the, food, and, drug, administration, #, fda, recommended, the, approval, in, the, united, states, of, the, use, of, the, pfizer, pharmaceutical, vaccine, against, couid, -, nineteen, ."
3876,"as, we, i, re, all, reading, about, latest, pfizer, vaccine, ,, keep, this, mind, ."
3877,"breaking, :, fda, advisory, panel, recommends, u, ., i, ., approval, pfizer, i, i, couid, -, nineteen, vaccine, ., #, abc"
3878,"independent, fda, panel, recommends, approval, pfizer, i, i, couid, -, nineteen, vaccine, people, over, age, sixteen, #, breaking, #, abc7ny"
3879,"last, minute, :, the, external, committee, of, the, just, voted, by, majority, to, grant, the, authorization, of, the, vaccine, :, seventeen, votes, in, favor, and, four, against, ., the, in, the, next, few, hours, will, make, the, final, decision, on, this, recommendation, ..."
3880,"some, i, breaking, news, i, i, i, i, excited, for, ., breaking, news, :, it, i, i, approved, ., fda, panel, endorses, i, i, coronavirus, vaccine, ., it, i, i, expected, arrive, central, new, york, next, week, ."
3881,"#, breaking, :, seventeen, -, four, vote, #, fda, advisory, panel, endorses, pfizer, #, covid19, vaccine, ., final, approval, by, fda, is, expected, i, within, days, i, details, i, it, ;"
3882,"#, breaking, fda, advisory, panel, recommends, approval, couid, vaccine, ., next, full, will, decide, ,, which, could, send, ask, doses, it, by, monday"
3883,"red_exclamation_mark, i, breaking, :, fda, advisory, panel, has, recommended, emergency, authorization, pfizer, vaccine, ,, moving, nation, closer, fda, approval"
3884,"breaking, :, advisory, panel, votes, endorse, i, i, #, coronavirus, vaccine, ., vote, was, seventeen, -, four, with, one, abstention, ."
3885,"breaking, :, u, ., i, ., government, advisory, panel, has, endorsed, pfizer, i, i, coronavirus, vaccine, ., group, ,, seventeen, -, four, vote, with, one, abstention, ,, concluded, that, shot, appears, safe, effective, against, coronavirus, people, sixteen, older, ."
3886,"#, breaking, us, panel, endorses, pfizer, couid, -, nineteen, shot, -, giving, it, vote, confidence, ,, clearing, way, authorization, use, #, couid, #, vaccine"
3887,"did, they, decide, if, it, ', i, two, dozes, per, person, or, mass, single, injections"
3888,"with, live, streamed, open, meeting, ., cheers, both"
3889,"big, news, -, panel, has, endorsed, pfizer, i, i, #, covid19, vaccine, ., doctors, say, this, another, step, forward, ."
3890,"pfizer, ', i, couid, -, nineteen, vaccine, receives, key, fda, panel, recommendation, via, #, pfizervaccine, #, pfizerbiontech, #, covid19vaccine, #, fda"
3891,"us, i, ., i, ., a, institution, gave, vaccination, approval, to, pfizer, with, seventeen, to, four, votes, ., Good, luck, to, the, nation, ..., as, of, the, number, of, deaths, from, covit19, in, the, usa, today, ,, two, ,, thirty, people, may, result, in, more, than, three, ,, zero, people, in, the, evening, ."
3892,"washington, ap, -, us, panel, endorses, pfizer, couid, -, nineteen, shot, major, step, toward, epic, vaccination, campaign, against, outbreak, ."
3893,"fda, advisers, recommend, pfizer, -, biotech, couid, -, nineteen, vaccine, ,, with, agency, action, expected, ., it, would, be, i, immoral, unethical, i, not, authorize, shots, ,, testifies, clinical, trial, participant, ."
3894,"panel, recommends, pfizer, ', i, couid, -, nineteen, vaccine, first, step, toward, fda, emergency, use, authorization, via"
3895,"we, finally, have, approved, weapon, war, against, couid, -, nineteen, with, pfizer, vaccine, syringe"
3896,"ap, :, u, ., i, ., panel, endorses, pfizer, couid, -, nineteen, shot, major, step, toward, epic, vaccination, campaign, against, outbreak, ."
3897,"#, breaking, fda, committee, voted, recommend, urgent, use, pfizer, vaccine, ."
3898,"*, pfizer, i, i"
3899,"breaking, :, fda, committee, votes, recommend, urgent, use, pfizer, vaccine, ."
3900,"just, approved, pfizer, vaccine"
3901,"#, breaking, :, us, panel, endorses, pfizer, i, i, #, covid19, vaccine, ., fda, panel, votes, seventeen, -, four, with, one, abstaining, recommend, approval, pfizer, vaccine, ., i, i, all, have, more, just, minutes, news, at, six, ."
3902,"breaking, :, washington, ap, i, us, panel, endorses, pfizer, couid, -, nineteen, shot, major, step, toward, epic, vaccination, campaign, against, outbreak, ."
3903,"advisory, committee, votes, approve, i, i, #, covid19, vaccine, ., within, days, company, will, ship, six, ., four, million, doses, nationwide, ."
3904,"just, heard, joe, polka, report, that, panel, voted, recommend, emergency, use, #, covidvaccine, :"
3905,"major, announcement, step, getting, this, virus, under, control, ., it, :, just, in, :, fda, panel, recommended, emergency, authorization, pfizer, ', i, couid, -, nineteen, vaccine, ,, likely, last, step, before, decision, ship, millions, doses, ."
3906,"#, breaking, advisory, committee, vrbpac, votes, favor, emergency, use, authorization, #, covid19, vaccine"
3907,"fda, advisory, committee, has, voted, say, benefits, outweigh, risks, pfizer, vaccine, seventeen, -, four, with, one, abstention, ,, paving, way, likely, fda, approval, very, near, future, ."
3908,"fda, recommends, urgent, use, pfizer, vaccine, ."
3909,"breaking, :, fda, panel, votes, recommend, emergency, use, pfizer, ', i, couid, -, nineteen, vaccine, ."
3910,"breaking, :, vaccines, related, biological, products, advisory, committee, votes, overwhelmingly, favor, i, i, couid, -, nineteen, vaccine, ., is, now, considering, vote, before, emergency, use, authorization, is, granted, ."
3911,"fda, panel, recommends, authorization, pfizer, vaccine, folded_handsfolded_handsfolded_hands"
3912,"just, voted, recommend, authorization, pfizer, vaccine, ., folded_handsmedium, -, light_skin_tone, #, covid19, #, covidvaccine, #, wearamask"
3913,"#, breaking, panel, of, the, vote, seventeen, four, in, favor, of, the, distribution, of, the, pfizer, vaccine, ."
3914,"pfizer, vaccine, approved, use, us, ."
3915,"breaking, :, committee, votes, recommend, urgent, use, pfizer, vaccine, syringe, #, covid19"
3916,"fda, advisory, panel, has, voted, recommend, approval, pfizer, i, i, coronavirus, vaccine, emergency, use, us, ., now, waiting, official, approval, fda, ."
3917,"#, breaking, :, panel, votes, recommend, emergency, use, i, i, couid, -, nineteen, vaccine"
3918,"fda, approves, pfizer, vaccine"
3919,"., advisory, committee, recommends, fda, approval, #, covid19, vaccine"
3920,"why, did, four, members, fda, members, vote, no, against, recommending, emergency, use, authorization, pfizer, vaccine"
3921,"new, :, advisory, panel, votes, recommend, #, covid19, vaccine, #, fda, approval"
3922,"watch, live, :, fda, advisory, committee, reviews, #, pfizer, ', i, couid, -, nineteen, vaccine, i, one, ..., via"
3923,"tbe, i, are, watching, this, vaccines, related, biologics, products, advisory, committee, meeting, regarding, pfizer, #, covid19vaccine, like, election, coverage, ."
3924,"happening, now, :, vrbpac, voting, question, one, :, i, based, totality, scientific, evidence, available, ,, do, benefits, pfizer, -, biotech, coves, -, nineteen, vaccine, outweigh, its, risks, use, individuals, sixteen, years, age, older, i, committee, can, vote, yes, ,, no, or, abstain, ."
3925,"is, vaccine, safe, effective, sixteen, seventeen, -, year, -, olds, some, advisory, panelists, say, i, the, data, is, too, thin, make, that, determination, i, are, favoring, delay, their, recommendation, ., they, plan, vote, vaccine, ,, soon, ."
3926,"i, promised, to, i, means, that, pfizer, has, signed, contract, supply, those, countries, ., they, can, expect, legal, action, if, they, renege, it, ."
3927,"pfizer, vaccine, approval, with, us, i, ., i, ., a, ., They, have, been, pumping, confidence, to, people, as, if, there, will, be, no, positive, results, in, the, live, meeting, for, eight, hours, ,, they, are, making, fun, of, our, minds, victory_hand, i"
3928,"moving, toward, not, including, sixteen, -, seventeen, year, -, old, adolescents, era, pfizer, vaccine, ,, according, vrbpac, discussion"
3929,"fda, is, meeting, right, now, approve, pfizer, vaccine, ., i, want, be, vaccinated, ., so, ., badly, ."
3930,"seriously, think, #, pfizervaccine, trial, participants, lied, to, :, we, were, told, we, i, i, be, immediately, unmasked, given, vaccine, ., when, we, took, syringe, we, were, told, this, :, your, forcing, #, pfizer, lose, credibility, future, studies, ., carrot, get, volunteers, was, early, access"
3931,"so, ,, what, happened, here, ""..., trump, administration, officials, passed, up, chance, purchase, more, than, one hundred, million, doses, pfizer, ', i, vaccine, it, agreed, earlier, this, summer, i, also, ,, national, debt, has, increased, $, seven, trillion, under, trump, ., forty-one, days, left, ."
3932,"is, today, day, pfizer, ', i, couid, -, nineteen, vaccine, reaches, final, review, ."
3933,"its, all, political, with, this, couid, is, ., they, are, pushing, fear, &, amp, ;, new, vaccines, like, its, two, rappers, dropping, albums, ., pfizer, is, modern, celebs, play, important, role, this, ., i, ', i, not, saying, hes, it"
3934,"they, came, before, astonished_face, #, pfizer, #, covid19, #, vaccine"
3935,"i, volunteered, couid, -, nineteen, vaccine, pfizer, being, developed, russia, ., i, wanted, let, you, all, know, that, it, is, safe, i, ', i, ok, ,, with, and, o, side, effects, whatsoever, ,, that, i, feelsh, I, feel, a, bit, stray, ., comrade, ."
3936,"canada, approves, use, pfizer, -, biotech, couid, -, nineteen, vaccine, :, canada, has, announced, its, approval, using, pfizer, -, biotech, couid, -, nineteen, vaccine, country, ,, which, is, currently, midst, second, wave, pandemic, ., wednesday, i, i, i, #, covid19"
3937,"good, plan, pfizer, fda, move, forward, with, couid, vaccine, trial, children, &, it, ;, twelve, ,, with, possible, adjustment, dose, ., right, direction"
3938,"live, television, era, meeting, pfizer, /, biotech, #, covid19vaccine, #, bnt162b, wondering, how, those, placebo, flexed_biceps, will, be, treated, i, listen, in, i, #, pharmacists, are, you, ready"
3939,"that, makes, two, us"
3940,"i, participated, #, pfizer, syringe, &, amp, ;, might, i, ve, gotten, placebo, find, will, hurt, studies, long, term, by, forcing, companies, who, promised, then, lied, their, pal, placebo, group, telling, them, they, i, i, get, vaccinated, immediately, after, approval, #, pfizervaccine"
3941,"watching, fda, panel, discuss, pfizer, covid19, vaccine, ., watch, belowbackhand_index_pointing_down"
3942,"do, cody, messier, has, emphasized, that, more, data, higher, number, subjects, are, needed, adolescents, sixteen, -, seventeen, years, old, before, extending, era, pfizer, vaccine, that, age, group"
3943,"placebo, arm, pfizer, vaccine, trial, ., i, don, ', i, know, what, this, "", placebo, "", thing, is, ,, but, it, seems, pretty, dangerous, grimacing_face"
3944,"executives, board, directors, at, at, this, very, moment, ., money_bagmoney_bagmoney_bagmoney_bagmoney_bagmoney_bagmoney_bagmoney_bag"
3945,"committee, is, meeting, emergency, authorization, pfizer, #, vaccine, today, ,, modern, next, week, ., that, means, kentucky, could, see, its, first, vaccine, next, week, ., dec, thirteen"
3946,"clinical, trials, no, doubt, excluded, people, i, /, history, vaccine, allergies, &, amp, ;, rollout, should, be, more, cautious, ., two, est, week, ,, who, shouldn, i, i, have, gotten, van, according, product, info, ,, makes, it, greater, challenge, reassure, public, about, safety, ., #, covid19vaccine"
3947,"full, pfizer, vaccine, briefing, docs"
3948,"yes, it, i, i, not, ethical, ignore, placebo, group, ., we, never, would, i, ve, been, study, had, we, not, lived, high, risk, lives, now, our, lives, don, i, i, matter, #, pfizervaccine, #, vaccination, #, pfizercovidvaccine, #, pfizer, #, pfizerbiontech"
3949,"with, preliminary, data, indicating, increased, rate, premature, delivery, pregnant, women, immunized, with, pfizer, vaccine, as, reported, this, morning, by, fda, ,, i, am, not, sure, that, it, is, ok, include, them, among, possible, recipients, vaccine, upon, era, ., more, safety, data, needed"
3950,"breaking, news, ..., that, us, fda, foodanddrug, administration, usa, ', i, foodanddrug, agency, is, voting, to, approve, or, not, recommend, the, pfizer, vaccine, ..."
3951,"more, trump, lies, ., more, trump, corruption, ., more, trump, political, interference, with, sound, science, ., coronavirus, live, updates, :, cac, scientist, says, she, was, ordered, destroy, email, ;, pfizer, %, is, vaccine, ..., via"
3952,"laurabelle, ', i, notes, #, pfizer, #, scouts, #, hunterbiden, ,, more"
3953,"#, bridge, this, is, published, data, #, pfizer, biotech, phase, three, #, covid19vaccine, study, remarkable, results, ., this, is, game, changer, reassuring, safety, profile, :, i, will, be, getting, my, #, shot, as, soon, as, my, number, comes, up, ., #, covid19, #, covidvaccine"
3954,"no, ,, we, do, not, know, ., people, active, chemotherapy, were, excluded, #, covid19, vaccine, trials, ., &, amp, ;, did, include, i, /, he, cancer, but, not, immunosuppressive, to, their, trials, ., #, cancer, #, surving"
3955,"my, #, vaccination, is, better, than, #, pfizer, #, vaccine"
3956,"pfizer, modern, trials, tracked, only, how, many, vaccinated, people, became, sick, with, couid, -, nineteen, ., that, leaves, open, possibility, that, some, vaccinated, people, get, infected, without, developing, symptoms, ,, could, then, silently, transmit, virus, ."
3957,"happening, now, :, vaccines, related, biological, products, advisory, committee, says, benefits, pfizer, vaccine, is, reduced, risk, couid, -, nineteen, after, completing, two, -, dose, regimen, individuals, *, without, *, prior, history, couid, -, nineteen, ., watch, :"
3958,"case, you, missed, #, vrbpac, re, :, #, covid19vaccine, today, ,, here, are, summary, slides, safety, efficacy, ., generally, great, new, high, efficacy, after, two, doses"
3959,"meanwhile, the, government, ensured, the, purchase, of, ten, million, vaccines, with, and, ensured, their, free, ., under, petro, we, would, be, at, the, mercy, of, the, Russian, sputnik, vaccine, and, they, would, not, have, ensured, even, gratuity, ., luckily, they, will, never, be, government, ."
3960,"province, will, begin, implement, its, couid, -, nineteen, vaccination, plan, as, early, as, next, week, ,, once, first, doses, pfizer, vaccine, arrive, manitou, ., read, full, news, release, visit, :"
3961,"i, it, i, i, been, very, stressful, ..., tim, mayfield, owns, mayfield, medical, services, is, working, overtime, shipping, ultra, -, cold, freezers, ,, capable, storing, i, i, #, covid19, vaccine, ., one hundred, +, his, freezers, are, california, ,, ohio, ,, illinois, even, canada, face_screaming_in_fear, story, tonight"
3962,"following, live, all, the, costing, about, its, #, vaccine, against, #, covid19, in, anticipation, of, its, approval, in, the, united, states, ..., we, are, time, to, have, the, vaccine, approved, in, this, country, and, consequently, in, mexico, ..."
3963,"wait, so, this, pfizer, vaccine, apparently, caused, bell, i, i, palsy, four, participants, none, them, had, placebo"
3964,"first, three, ,, nine hundred, pfizer, vaccine, doses, will, arrive, alberta, next, week, so, starting, dec, sixteen, ,, one, ,, nine hundred and fifty, icu, doctors, ,, nurses, ,, respiratory, therapists, long, -, term, care, workers, will, be, immunized, ."
3965,"probably, people, who, said, no, are, ones, who, trust, their, immune, system"
3966,":, do, ., rayburn, says, we, i, re, entering, new, phase, this, pandemic, ., is, getting, nine hundred and fifty-one, doses, vaccine, next, ten, days, ., it, i, i, pfizer, two, dose, vaccine, ., second, dose, will, come, them, near, future, ."
3967,"vaccine, participant, feels, lied, because, wanting, delay, participants, getting, vaccine, #, pfizer, #, pfizervaccine, #, pfizerbiontech, #, pfizercovidvaccine"
3968,"live, :, us, experts, convene, decide, whether, ok, pfizer, vaccine"
3969,"hard, pass, me, ., four, volunteers, who, got, pfizer, ', i, vaccine, developed, bell, ', i, palsy, via"
3970,"pfizer, will, start, sending, vaccines, out, within, hours, fda, emergency, authorization, ., here, i, i, plan, :"
3971,"anaphylaxis, is, issue, with, pfizer, vaccine, that, i, i, ,, like, ,, very, common, ., bee, stings, ,, nut, allergies, ,, etc, i, seems, this, should, i, ve, shown, up, research, ."
3972,"United, States, reports, six, deceased, volunteers, during, clinical, trial, of, Pfizer, /, biotech, vaccine"
3973,"that, i, i, enough, me, ., when, can, i, get, my, shot, i, i, i, ready, cowboy_hat_face"
3974,"good, news, those, that, get, vaccine"
3975,"believe, me, i, am, not, trump, ', i, side, but, pfizer, ', i, is, not, made, usa, ., modern, says, they, will, make, their, ', i, here, usa, but, they, aren, ', i, obligated, share, their, formula, since, it, is, proprietary, protected, by, patent, laws, ., it, ', i, not, like, making, i, tip, go, up, your, nose, ."
3976,"this, episode, is, about, how, trump, admin, turned, down, opportunity, have, more, vaccinations, pfizer, ..., instead, having, two hundred, mil, ,, we, will, have, one hundred, ,, &, amp, ;, admin, is, now, scrambling, get, more, pfizer, ., |"
3977,"i, hadn, ', i, expected, them, have, much, stability, differences, -, but, when, biotech, /, pfizer, emphasized, -, doc, storage, ,, this, prompted, me, think, if, lipids, /, mrna, modifications, might, play, role, ;, i, agree, with, you, it, is, likely, that, this, is, simply, conservative, logistical, approach"
3978,"pfizer, plant, belgium, has, contract, supply, uk, with, vaccine, ., if, us, tries, interfere, with, that, ,, i, i, i, not, lawyer, either, but, sounds, like, violation, international, law, me, ."
3979,"fda, committee, is, making, big, decisions, today, about, whether, pfizer, vaccine, will, get, emergency, approval, u, ., i, ., i, here, i, i, what, you, should, know, ."
3980,"ontario, ', i, first, doses, pfizer, ', i, couid, -, nineteen, vaccine, be, distributed, ottawa, next, week"
3981,"how, can, we, get, modern, vaccine, not, pfizer, also, i, am, going, through, chemotherapy, ,, where, would, i, fall, getting, vaccine, thank, you"
3982,"pfizer, can, cash, me, outside, howbowdah"
3983,"sixty-nine, %, you, would, take, pfizer, vaccine, ., thirty-one, %, you, need, punched, by, debo, ."
3984,"., said, pfizer, vaccine, will, go, arkansas, hospitals, modern, vaccine, will, go, long, -, term, care, facilities, nursing, homes, ., #, news"
3985,"controversial, opinion, incompetence, trump, administration, not, pre, -, ordering, extra, pfizer, vaccines, might, not, be, bad, thing, it, means, more, countries, can, quickly, get, vaccines, frontline, workers, who, need, vaccine, most"
3986,"top, companies, telling, us, they, are, safe, have, biggest, lawsuits, against, them, fraud, including, pfizer, but, what, do, i, know, i, i, ve, just, done, years, research, corruption, pharmaceutical, industry"
3987,"if, pfizer, vaccine, costs, $, thirty-five, /, dose, ,, everyone, needs, two, doses, ,, then, +, mil, people, who, won, i, i, need, vaccinating, already, saved, federal, gov, over, billion, dollars, ., longer, it, takes, less, money, congress, has, spend, ., it, i, i, not, so, complicated, ,, it, i, i, just, capitalism, pouting_face"
3988,"nice, we, are, our, way, ., my, guess, is, at, least, one, more, year, being, locked, down, ., i, hope, we, can, make, it, #, podcasting, #, news, #, covid19, fda, advisory, panel, expected, approve, pfizer, -, biotech, couid, -, nineteen, vaccine"
3989,"#, coronavirussicilia, #, chronicle, coviTongue_sticking_out_cheeky_playful_or_blowing_a_raspberry, published, pfizer, vaccine, data, ,, ninety-five, %, effective"
3990,"i, would, love, ask, ..., but, they, i, ve, been, refusing, our, requests, interviews, months, ."
3991,"no, ,, this, wasn, ', i, available, back, august, ., they, are, just, about, roll, out, their, phase, three, trials, right, now, next, couple, weeks, ., i, did, pfizer, back, august, /, sept, ."
3992,"dropped, too, three, million, or, four, million, ,, either, way, we, haven, i, i, reached, millions, unless, our, country, is, lieing, too, us, ., regardless, learn, too, mourn, ,, it, will, all, be, over, soon, ., =, uk, well, he, i, llo, there, vaccine, ben, here"
3993,"hope, it, helped, ., pfizer, van, will, be, short, supply, maybe, modern, van, will, be, more, favorable, has, same, efficacy, ."
3994,"forty-five, didn, ', i, want, pfizer, vaccine, becuase, they, are, not, part, warp, speed, ., what, did, forty-five, do, with, his, tit, tat, ,, refused, buy, enough, ., don, ', i, give, this, murderer, credit, anything, ."
