,0
2459,"i, received, my, second, dose, pfizer, biotech, couid, nineteen, vaccine, today, ., face, masks, ,, social, distancing, hand, hygiene, ,, along, with, these, important, vaccines, are, our, best, chance, at, turning, tide, against, this, deadly, pandemic, ., #, wearamask, #, vaccinessavelives, #, trustinscience"
2460,"they, have, to, be, better, scientists, than, do, faci, usa, ,, scientific, pfizer, ,, modern, etc, ., wow, ., The, Nobel, Prize, awaits, us, ."
2461,"covid19, vaccine, check_mark_buttoncheck_mark_button, i, if, you, i, ve, seen, what, we, i, ve, seen, ,, you, i, i, know, how, crucial, this, is, stay, safe, god, bless, #, stanhope, #, markup, #, healthcareworkers, #, covid19"
2462,"i, need, help, with, that, ., i, have, robinhood, app, had, put, some, money, into, modern, pfizer, but, they, i, re, down, ., i, know, nothing, about, stocks, ."
2463,"pfizer, and, dose, check_mark_button, #, covidvaccinecomplete, #, markup, #, staysail"
2464,"that, the, #, pfizer, brand, redesign, process, or, its, couid, vaccine, began, before"
2465,"four, ,, four hundred, adverse, events, reported, after, receiving, pfizer, -, biotech, vaccine"
2466,"now, israeli, arabs, need, be, vaccinated, asap"
2467,"curious, why, tools, i, at, hand, i, don, i, i, include, wide, distribution, two, tools, that, have, been, shown, be, ninety-four, ., one, %, ninety-five, %, effective, ., one, ., /, vaccine, two, ., vaccine, california, has, vaccinated, four hundred and eighty-six, ,, eighty-seven, with, two, ,, fifty-six, ,, three hundred and seventy-five, vaccines, distributed, ., twenty-three, ., six, %"
2468,"', scuse, me, ,, i, ', i, off, get, and, dose, pfizer, but, first, i, ', i, going, do, one, ,, zero, hammer, curls, if, i, wanna, look, good, that, vaccine, selfie, ."
2469,"just, received, my, first, dose, #, covid19vaccine, so, appreciative, that, i, even, have, this, choice, make, myself, ,, my, family, members, ,, my, unborn, baby, as, pregnant, healthcare, worker, ., not, mention, choice, help, protect, all, our, society, syringe"
2470,"incredibly, pleased, receive, second, round, pfizer, couid, -, nineteen, vaccine, ., although, this, will, continue, be, long, arduous, road, ,, slight, glimpse, hope, is, greatly, appreciated, ., #, covid_19, #, pfizer, #, vaccinated"
2471,"twentyfour, his, post, and, couid, nineteen, vaccine, pfizer, ., arm, was, very, sore, difficult, move, i, /, i, pain, yesterday, evening, /, night, ., required, one, alive, which, didn, i, i, seem, help, ,, but, this, morning, pain, almost, gone, rom, almost, full, ., haven, i, i, had, any, other, symptoms, ,, at, all, ., recovery, quickerheart_suit, i"
2472,"Here, in, the, US, ,, the, cac, data, is, public, ., just, search, on, google, ., no, special, order, or, anything, ., so, everyone, had, access, to, pfizer, and, modern, reports, ., and, does, anyone, know, how, to, inform"
2473,"don, i, i, be, most, people, i, know, that, have, gotten, pfizer, ,, have, just, gotten, sore, arm, ., it, literally, takes, two, seconds, ., it, i, i, be, okay, you, got, this"
2474,"I, commented, above, that, Pfizer, ', i, ."
2475,"being, imperfect, ,, let, i, i, focus, our, own, behaviors, &, amp, ;, things, we, can, control, ., with, patience, ,, empathy, ,, rational, risk, -, mitigating, strategies, &, amp, ;, soon, i, mass, vaccination, ,, we, may, finally, see, light, at, end, this, dark, tunnel, ., #, covid19, #, womeninmedicine, #, anesthesiology, #, pfizer"
2476,"i, just, got, my, pfizer, couid, -, nineteen, vaccine, #, blue"
2477,"ammo, sends, gately, for, the, Argentine, sputnik, vaccine, ., good, for, the, president, who, breaks, board, ', i, commitments, with, pharmaceutical, companies, ., this, simple, move, will, force, pfizer, to, send, more, vaccines, ,, because, it, has, not, complied, ,, if, it, does, not, want, putin, to, flood, it, with, ., good, and, cheap, vaccine, ."
2478,"second, dose, pfizer, covid19, done, #, vaccineswork"
2479,"ty, natalie, i, i, i, looking, forward, when, vaccine, is, made, available, gen, public, i, just, want, be, very, transparent, about, my, experience, ..., i, am, a, -, ok, following, both, shots, ., if, anything, ,, i, feel, much, lighter, ..., full, hope, ., yellow_heart"
2480,"good, points, ., add, that, challenges, pfizer, vaccine, that, has, unusually, difficult, storage, requirements, ., fact, fed, libs, have, been, so, vague, quantities, &, amp, ;, when, we, can, expect, them, tells, me, news, is, not, good, cans, ."
2481,"., acting, director, do, ., echols, joint, board, health, &, amp, ;, hospitals, this, morning, :, ,, through, its, federally, qualified, health, centers, ,, expects, get, first, shipment, pfizer, vaccine, seven, -, ten, business, days, ., we, are, still, phase, a, ."
2482,"fighting, stigma, :, ireland, sees, delivery, at, least, four hundred and seventy thousand, couid, -, nineteen, vaccine, doses, qi, :, ..., health, minister, said, thursday, ., ireland, ,, which, has, population, four, ., nine, million, ,, has, confirmed, orders, three hundred and sixty, ,, zero, doses, pfizer, /, biotech, ..."
2483,"incidence, it, reportedly, three, ., three, /, 100k, ., if, this, is, only, case, it, after, five, million, vaccinations, assuming, that, #, accurate, ,, it, is, irresponsible, blame, vaccine, this, one, case, ., continuing, monitor, is, what, should, be, done, ."
2484,"#, newer, #, newsome, #, evelynperezlarin, #, canariasdowntowndoral, #, newcomer, #, werent, #, ownyourhome, #, lifestyle, #, two thousand and twenty-one, #, houseshousehouse_with_garden, #, myhouse, #, doral, #, florida, #, sunnymiami, #, vaccine, #, covid19, #, modern, #, covidvaccine, #, peace, #, pfizer"
2485,"just, time, celebrate, banner, being, hoisted"
2486,"i, gave, you, exact, titles, pfizer, ,, cac, ,, biotechnology, ,, fosanpfizer, ., yes, your, right, track, ., use, title, :, nba, news, allergic, reactions, couid, vaccine, ., go, abc, news, ., go, indent, within, these, drug, co, ., pfizer, is, only, one, example, leader, ."
2487,"fighting, stigma, :, latest, coronavirus, pandemic, vaccines, :, healthcare, worker, prepares, dose, pfizer, -, biotech, couid, -, nineteen, ..., pandemic, ,, ireland, ', i, health, executive, boss, paul, reid, said, twitter, ."
2488,"pfizer, vaccine, biotech, covid19vaccine, fosanpfizer, ., allergic, reactions, couid, vaccine, nineteen, i, o, nba, news, go, pfizer, biotechnology, couid, nineteen, vaccine, cac, ,, fda, authorized, covid19vaccine, ,, there, is, none, can, investigations, covid19, deaths, ,, miami, ,, mexico, etc, ."
2489,"after, getting, vaccinated, first, dose, pfizer, ,, went, straight, my, evening, shift, ..., right, now, i, after, this, vaccination, ,, i, could, feel, my, arms, tired_facepensive_face, ., i, could, barely, raise, it, without, feeling, sore, ., pleading_face, what, else, might, call, later, ."
2490,"got, my, sars, -, cov, -, two, vaccine, pfizer, #, vaccine, @, vic, college, pharmacy"
2491,"went, seven, mile, hike, portland, i, i, forest, park, this, morning, ., get, lamb, gyro, rosemary, food, cart, so, ith, ., proceeded, get, my, second, pfizer, vaccine, ., then, i, come, home, anarchy, has, come, roost, at, #, capitol, ., clearly, two thousand and twenty, isn, i, i, ready, let, go, just, yet"
2492,"so, how, will, your, immunity, be, measured, when, modern, or, pfizer"
2493,"got, my, and, dose, #, pfizer, #, vaccine, today, only, slight, soreness, at, injection, site, which, is, normal, ., cross_markanaphylaxis, cross_markbell, i, i, palsy, cross_markfacial, swelling, check_mark_button, protection, couid, check_mark_buttonwin, science, #, thisisourshot, #, covidvaccine, #, mycovidvax, #, nurse, #, alhamdulillah, #, bandaidgamestrong"
2494,"got, my, and, dose, #, pfizer, #, vaccine, today, only, slight, soreness, at, injection, site, which, is, normal, ., cross_markanaphylaxis, cross_markbell, i, i, palsy, cross_markfacial, swelling, check_mark_button, protection, couid, check_mark_buttonwin, science, #, thisisourshot, #, covidvaccine, #, mycovidvax, #, nursetwitter, #, nurselife, #, alhamdulillah"
2495,"like, he, lacked, dominance, and, control, of, the, area, hahaha, ,, shy, hand, hahaha, ., So, I, think, he, will, need, the, other, Pfizer, medicine, ."
2496,"i, can, do, one, better, ., i, got, vaccinated, by, virus, after, being, half, vaccinated, by, pfizer, ."
2497,"date, ,, we, have, received, about, ninety, ,, zero, doses, pfizer, vaccine, ,, fifty-three, ,, zero, modern, vaccine, ., more, than, sixty, ,, zero, have, been, administered, now, at, over, ten, ,, zero, /, day, ., at, this, rate, our, existing, supply, will, be, administered, by, end, next, week, ."
2498,"me, you, were, definitely, pfizer, haha, ., would, have, got, oxford, vaccine"
2499,"thanks, ;, my, comment, above, was, about, delivery, pfizer, vaccine, ."
2500,"i, assume, pfizer, requires, two, doses, ."
2501,"cottage, hospital, emergency, room, in, anna, bedrock, self, -, administers, dose, pfizer, couid, -, nineteen, vaccine, at, hospital, wednesday, ,, jan, ., six, ,, two thousand and twenty-one, ., hospital, employees, received, their, second, two, doses, ., steve, davis, /, for, register, -, mail, #, cottagehospital, #, covid19, #, vaccine"
2502,"that, these, gentlemen, follow, the, #, pfizer, #, vaccination, #, sanitaryprotocol, not, to, skip, doses, of, vaccines, in"
2503,"i, came, back, home, vaccinated, /, came, home, vaccinated, pfizer, dose, one, @, toronto, ,, ontario"
2504,"federal, government, is, responsible, vaccine, procurement, ., date, ,, ontario, i, province, fifteen, million, people, i, has, received, ninety, ,, zero, pfizer, doses, which, must, be, given, twice, fifty-three, ,, zero, modern, doses, ., we, i, re, administering, ten, ,, zero, +, doses, /, day, ,, but, our, freezers, will, soon, be, empty, ."
2505,"we, are, following, instructions, pfizer, -, biotech, ,, which, requires, two, doses, ,, three, weeks, apart, ., any, case, ,, our, freezers, will, soon, be, empty, ,, unless, federal, government, delivers, more, vaccines, ."
2506,"got, my, second, serving, pfizer, punch, today, slightly_smiling_faceslightly_smiling_faceslightly_smiling_face"
2507,"like, wise, i, /, i, and, pfizer, couid, vaccine"
2508,"exciting, news, :, following, their, success, with, producing, couid, vaccine, ,, pfizer, are, set, release, their, most, effective, anti, depressant, yet, ., it, works, by, simply, reminding, you, that, you, are, not"
2509,"couldn, i, i, agree, more, ,, absolutely, critical, stuff, ,, learned, so, much, ., can, i, i, imagine, more, appropriate, day, listen, than, day, pfizer, vac, two, ., thankful, or, health, alliance, &, amp, ;, coordinated, response, ., look, forward, coordinated, federal, response, time, ..."
2510,"five, hours, waiting, my, mother, father, both, have, first, round, couid, -, nineteen, pfizer, vaccine, i, tease, them, that, they, also, got, their, earmarks, deformed, that, it, ', i, funny, that, it, doesn, ', i, even, compare, some, waits, we, used, have, at, old, is"
2511,"other, news, ,, i, i, i, very, #, grateful, report, receipt, #, covidvaccine, #, two, pfizer, -, biotech, ., thanks, amazing, team, at, school, nursing, ., #, stickittocovid, #, stillwearingamasktho"
2512,"team, pfizer, who, i, i, with, me, syringesparkles"
2513,"washington, i, head, major, u, ., i, ., business, group, that, represents, fourteen, ,, zero, companies, including, exxon, mobil, corp, i, pfizer, inc, ., toyota, motor, corp, ., urged, senior, u, ., i, ., officials, consider, removing, pres, ., trump, office, after, supporters, president, stormed, capitol, ."
2514,"overwhelmingly, proud, ,, excited, ,, &, amp, ;, privileged, receive, couid, -, nineteen, vaccine, today, ., tremendous, scientific, &, amp, ;, medical, achievement, ., immune, cells, ,, get, work, microscopesyringestethoscopemicrobepetri_dish, #, covid19, #, covidvaccine, #, pfizer, #, pfizercovidvaccine, #, science, #, vaccineswork"
2515,"good, ., big, money, represents, only, power, these, deluded, complicit, republicans, will, listen, to, ."
2516,"don, ', i, worry, ,, i, already, got, both, pfizer, modern, vaccine"
2517,"american, dream, at, hands, forty, years, neoliberalism, has, no, blame, this, people, are, fed, up, with, govt, they, feel, doesn, ', i, represent, them, anymore, unless, their, name, is, pantheon, ,, goldman, sachs, or, pfizer, ."
2518,"emergency, use, authorization, pfizer, was, given, sixteen, +"
2519,"first, you, have, to, learn, how, to, write, pfizer, shame, you"
2520,"new, london, county, pelosi, communist, police, whore, after, both, one hundred, %, 401k, general, dynamic, pfizer, viagra"
2521,"ah, no, ...., liberal, gov, i, i, past, courted, enticed, generic, drug, companies, canada, ., thats, why, pfizer, other, companies, left, ...., but, hey, keep, trying, blame, harper, all, it, ', i, mistakes, ."
2522,"#, teammoderna, over, here, mostly, because, that, i, i, what, my, hospital, had, hand, give, grinning_face_with_sweat, #, vaccinated, #, covid19, syringemicrobe"
2523,"i, don, ', i, like, it, ,, never, voted, trump"
2524,"i, think, it, could, be, argued, etc, facilities, front, line, staff, they, are, light, high, death, rates, former, &, amp, ;, delayed, supply, modern, pfizer, ,, that, they, are, ;, but, good, point, ,, what, are, definitions, i, exceptional, circumstances, i, public, health, emerg"
2525,"nope, ., you, either, are, over, your, head, or, didn, i, i, read, paper, ., model, proves, pfizer, hard, data, that, twenty, -, twentynine, %, #, covid19, deaths, could, be, avoided, ,, by, dose, one, deployment, ,, even, if, dose, two, is, delayed, ."
2526,"also, ,, who, i, i, strategic, advisory, group, experts, immunization, sage, said, yesterday, under, i, exceptional, circumstances, i, second, dose, biotech, /, pfizer, coronavirus, vaccine, can, be, given, up, six, weeks, after, est, ., original, :"
2527,"pfizer, was, mine, ,, and, for, three, members, of, my, family, no, side, effects, ., modern, :, members, of, my, family, one, with, similar, side, effects, the, flu, and, the, other, ., only, pain, in, the, arm, ,, the, cac, maintains, monitoring, of, effects, via, daily, text"
2528,"#, blessed, #, vaccine, #, pfizer, #, firstdose"
2529,"they, have, to, be, vaccinated, twice, with, the, couid, vaccine, if, it, doesn, ', i, work, face_screaming_in_fearface_screaming_in_fearface_screaming_in_fearface_screaming_in_fear, a, california, nurse, tests, positive, for, couid, days, after, being, vaccinated, ., #, pfizer, says, that, twentynine, days, later, they, must, be, vaccinated, again, to, be, immune, ., just, one, won, ', i, do, ., wif, fearful_facefearful_facefearful_face"
2530,"joining, club, #, welcomemrna, #, fightcovid19, flexed_biceps, thanks, scientists, making, it, possible, #, covidvaccine"
2531,"two, #, covid19, #, vaccines, have, been, given, emergency, use, authorization, ., prevent, couid, -, nineteen, ,, authorized, pfizer, -, biotech, couid, -, nineteen, vaccine, people, aged, sixteen, +, modern, couid, -, nineteen, vaccine, people, aged, eighteen, i, learn, more, :"
2532,"want, buy, some, decent, stocks, invest, pfizer, i, hear, there, robing, people, ., good, luck, ."
2533,"nope, if, it, doesn, ', i, work, or, causes, harm, in, the, experimental, phase, ,, testing, stops, and, the, vaccine, isn, ', i, distributed, ., this, has, already, happened, with, the, australian, cal, vaccine, ., The, experimental, part, has, already, been, carried, out, with, Pfizer, and, modern, and, there, is, enough, data, to, consider, them, safe, ."
2534,"hopefully, vaccine, distribution, speeds, up"
2535,"police_car_lightveterans, police_car_lightif, you, i, re, registered, at, ,, are, seventy-five, years, &, amp, ;, older, want, receive, pfizer, #, covid19, #, vaccine, ,, contact, scheduling, team, at, one, -, eight hundred and seventy-seven, -, eight hundred and seventy-seven, -, nine thousand, two hundred and sixty-seven, make, appointment, ., please, it, pass, this, information, others, ., #, getvaccinated, #, ny"
2536,"pfizer, like, money, -, mouth_face"
2537,"as, reminder, ,, both, pfizer, modern, require, second, dose, ., county, is, currently, using, modern, brand, ,, which, requires, second, injection, twenty-eight, days, later, ."
2538,"as, #, healthcarehero, i, was, poked, with, first, dose, couid, -, nineteen, vaccine, today, ., syringesyringesyringe, ., just, bit, nervous, ., ., #, covidvacccine, #, pfizer, #, besafeoutthere, #, doyourpart"
2539,"i, have, got, tell, you, ,, my, allergy, community, is, watching, this, but, not, overly, concerned, granted, ,, we, are, used, monitoring, anaphylaxis, -, esp, after, shots, anti, -, vaccine, folks, are, picking, this, up, spread, it, with, wildfire, ."
2540,"boire, even, the, medical, staff, is, not, able, to, follow, #, vaccine, injection, protocols, it, ', i, the, end, of, the, end, ,, bring, in, #, israel, #, quebec, #, canada, they, don, ', i, content, they, dont, fucking, listen, #, pfizer"
2541,"Yesterday, I, received, the, second, dose, of, the, pfizer, vaccine, in, a, hospital, ., I, do, not, feel, any, side, effects, except, for, a, slight, pain, at, the, injection, site, ., To, date, nearly, four, ., eight, million, people, have, been, vaccinated, in, the, United_States, without, serious, side, effects, victory_handmedium, -, light_skin_tone"
2542,"my, wife, i, got, pfizer, dose, #, two, today, ., we, are, thankful, opportunity, those, who, made, this, possible, ., we, hope, everyone, decides, get, it, when, their, turn, is, up, now, ,, back, work, ., #, science, #, vaccineswork"
2543,"cac, officials, said, twenty-eight, people, who, received, coronavirus, vaccine, developed, by, pfizer, biotech, had, severe, allergic, reactions, ., they, also, noted, one, case, anaphylaxis, ,, which, can, cause, throat, swelling, breathing, difficulty, ,, after, individual, received, modern, ', i, vaccine, ."
2544,"first, dose, vaccine, #, igottheshot, amazing, testament, scientific, research, ., been, excited, this, with, months, fantastic, coverage, by, &, amp, ;, do, ., faci, ., #, medtwitter, #, sciencetwitter"
2545,"just, received, second, pfizer, vaccination, covid19, ., so, far, so, good, ., its, time, put, this, damn, virus, rest, ., disguised_face"
2546,"i, i, i, i, so, excited, i, feel, like, i, won, lotto, i, sylvia, owens, told, me, moments, after, getting, her, first, dose, pfizer, coronavirus, #, vaccine, ., nine, ,, zero, seniors, sixty-five, +, are, scheduled, receive, their, est, shots, this, week, through, distribution, ."
2547,"it, i, i, time, and, dose, trident, medical, center, begins, second, round, couid, -, nineteen, vaccination, ., hospital, system, received, one, ,, nine hundred, pfizer, doses, has, given, out, one, ,, nine hundred, its, frontline, workers, ., #, chews"
2548,"roommates, that, vaccinate, together, people_with_bunny_ears, i, female_sign, i, also, ,, huge, thank, you, &, amp, ;, even, making, this, possible, raising_handsmedium_skin_tone, #, covid19vaccine, #, medstudenttwitter, #, medtwitter"
2549,"awesome, that, i, i, wonderful, looking, forward, when, i, get, mine, ., rock, joanne"
2550,"i, thousands, i, doses, pfizer, vaccine, is, expected, arrive, #, yak, two, weeks, ."
2551,"Uruguayan, who, lives, in, the, US, asked, for, vaccines, for, poor, countries, CEO, of, Pfizer, and, modern, :, look, at, the, answer, -"
2552,"well, this, is, quite, sad, ."
2553,"teamsters, sisters, brothers, #, takecare, #, longtermcare, awaiting, their, first, dose, #, pfizer, #, couid, -, nineteen, #, vaccine, #, teamsterscanada, #, teamsters, #, frontlinehealthcareheroes, two_heartsfolded_hands"
2554,"I, hope, the, other, Colombian, journalists, limit, themselves, to, calling, people, with, a, doctorate, "", doctor, "", and, "", doctor, "", as, they, do, with, do, ., gomez, from, Pfizer, and, not, just, any, politician, ,, bureaucrat, or, businessman, who, has, not, reached, that, level, of, education, ."
2555,"was, early, ,, but, fun, ,, morning, helping, allow, viewers, see, -, &, amp, ;, hear, -, two, #, icu, docs, as, they, received, their, and, dose, recently, approved, #, pfizer_biontech, #, covid19, #, vaccine, en, route, #, immunity, ., #, coronavirus, #, pandemic, #, nba"
2556,"pfizer, vaccine, received, ..., thank, you, mount, sinai"
2557,"at, &, amp, ;, i"
2558,"also, this, is, pfizer, vaccine"
2559,"also, they, haven, i, i, gotten, anymore, pfizer, so, now, they, say, it, doesn, i, i, matter, just, take, modern, second, shot, ., where, i, i, clinical, trials, science, back, that, one, up"
2560,"got, and, dose, pfizer, vaccine, today, i, am, lookey, very, proud, this, masterpiece, i, created, ., keeping, up, with, my, younger, brother, i, i, social, media, game, isn, i, i, easy"
2561,"which, makes, it, really, hard, pfizer, own, it, reap, any, brand, benefit, changing, over, everything, their, packaging, their, letterhead, their, building, signage, something, so, ..., meh, ."
2562,"impetus, ,, yes, ., pfizer, is, focusing, vaccines, so, it, i, i, important, have, mark, that, can, stand, alone, be, legible, tube, or, syringe, but, that, reveals, weakness, mark, ., there, i, i, very, little, distinctive, about, it, ., intuitively, it, feels, like, something, we, i, ve, seen, before, ."
2563,"couid, -, nineteen, vaccine, ,, couid, -, nineteen, vaccinated, #, covid19, #, pandemic, #, frontlineworkers, #, frontlineheroes, #, pfizercovidvaccine, #, pfizer"
2564,"., is, first, roll, out, pfizer, vaccine, elderly, residents, ages, seventy-five, up, ., doors, opened, little, before, eight, curb, long, lines, ., limited, supply, vaccine, was, distributed, first, come, ,, first, served, basis, ., vaccinations, continue, tomorrow, ."
2565,"why, don, i, i, they, chain, me, treadmill, have, me, chase, pfizer, teat, fervently, suck, vaccine, out, instead"
2566,"Do, you, remember, #, sandralindsay, is, the, American, nurse, who, became, the, first, to, receive, the, #, pfizer, syringe, vaccine, well, ,, she, already, received, the, second, dose, ..., red_circle, this, is, how, vaccination, progresses, in, #, usa"
2567,"next, time, there, is, open, enrollment, healthcare, ..., so, disappointing, ."
2568,"so, far, these, companies, ,, have, not, showed, any, interest, providing, their, precious, vaccines, frontline, healthcare, workers, disaster, regions, like, #, syria, #, yemen, ."
2569,"i, received, pfizer, shot"
2570,"isn, i, i, it, ironic, that, cure, world, pandemics, couid, -, nineteen, was, delivered, by, black, african, american, at, immigrant, muslim, couple, do, ., uour, satin, at, think, about, this, ..., #, godsplan, #, blacklivesmatter, #, islam"
2571,"happy, have, received, number, two, pfizer, vaccine, this, morning"
2572,"modern, is, vaccinating, their, placebos, ,, pfizer, is, not, &, amp, ;, lot, their, participants, are, jumping, ship, ., we, have, trial, group, &, amp, ;, many, inch, i, &, amp, ;, i, &, amp, ;, astra, i, &, amp, ;, others, are, supporting, pfizer, pal, ., it, i, i, van, spot, &, amp, ;, we, stay, trial, -, it, i, i, two, yrs, ."
2573,"claims, are, entirely, meaningless, if, they, continue, support, these, un, -, american, extremists, ., american, democracy, is, not, something, one, can, take, mixed, position, on, ., any, attempt, take, middle, ground, this, matter, is, be, accessory, ."
2574,"#, update, :, staff, at, central, maine, medical, center, are, back, this, morning, receive, their, second, dose, #, pfizer, #, vaccine, ., #, with"
2575,"who, represents, #, pfizer, in, the, red, I, ask, to, see, if, I, understand, the, scientists, from, the, medical, college, ,, who, with, very, weak, arguments, ,, challenge, the, experts, from, japan, ,, holland, ,, france, ,, england, ,, canada, ,, usa, ,, etc, ."
2576,"one, my, co, -, workers, who, i, adore, just, got, her, and, pfizer, vaccine, ,, this, morning, we, all, clapped, cried, i, i, i, so, happy, her, please, do, what, i, i, right"
2577,"#, couid, vaccine, #, two, ., pfizer, bionic, vaccine, ., great, admin, -, didn, i, i, feel, thing, will, up, date, side, affects, ., still, here, my, family, ,, patients, community, #, acogfightscovid, #, covidvacccine, #, socialdistancing, #, washyourhands, #, wearamask"
2578,"goodbye, pill, ,, hello, science, :, pfizer, debuts, redesigned, logo, with, double, helix"
2579,"just, got, my, second, dose, pfizer, vaccine, ,, now, back, saving, lives, ending, this, messwinking_face_with_tongue"
2580,"my, thirteen, year, old, wants, be, your, trial, #, covidvaccine, ., i, registered, online, but, haven, i, i, heard, back, yet, ., is, their, still, availability"
2581,"twenty, corporations, ,, $, sixteen, million, ,, one hundred and thirty-eight, republicans, trying, subvert, democracy, by"
2582,"this, video, is, powerful, reminder, why, i, i, i, fan, ."
2583,"and, dose, pfizer, vaccine, acquired, ., ready, send, this, virus, hell"
2584,"In, fact, ,, the, general, features, of, the, plan, had, existed, long, before, ., In, fact, ,, they, foresee, that, some, more, vaccines, will, appear, in, the, coming, weeks, apart, from, the, modern, one, and, Pfizer, that, they, give, now, ,, and, they, will, adapt, what, is, necessary, from, the, plan, according, to, that, ., It, is, normal, and, expected, ."
2585,"maine, health, care, workers, get, their, and, couid, -, nineteen, vaccine, doses, ., #, maine, #, healthcare, #, covid19, #, vaccinecovid19, #, pfizer, #, with"
2586,"today, i, was, vaccinated, together, with, the, staff, of, the, hospital, where, i, work, they, used, pfizer, -, biotech, ,, in, twenty-three, days, we, will, have, the, other, dose, mommy, was, also, vaccinated, ., she, recovers, satisfactorily, ., her, blindness, continues, this, is, temporary, ., Thank, you, for, her, prayers, and, solidarity, ., by, :, juan, i"
