,0
1216,"i, this, is, pfizer, i, -, a, -, i, -, i, -, i, -, i, -, e, ., please, understand, these, shots, cause, harm, ., injury, is, real, not, rare, ., it, i, i, shame, these, poor, people, are, being, gaslighted, ,, social, media, giants, are, censoring, them, i"
1217,"hasp, when, they, are, asked, for, invoices, for, the, purchase, of, pfizer, vaccines, ,, he, casually, decides, to, transfer, them, to, poor, countries, ,, this, little, president, thinks, he, is, deceiving, us"
1218,"odds, also, encouraging, dumb, fop, have, pfizer, couid, vaccine, first, boost, confidence, all, trolls, up, dilawans, who, pushes, biotech, pfizer, made, vaccine"
1219,"#, pfizer, now, to, the, brainless, did, not, do, a, quick, survey, to, ask, your, opinion, increases, reduction, in, vaccine, delivery, ., all, very, murky, ,, came, everything, that, this, lout, does, ,, liar, ."
1220,"breaking, :, due, shipping, delay, ,, alamodome, vaccine, appointments, monday, one, /, eighteen, are, being, postponed, wednesday, same, times, ., san, antonio, mayor, ron, nuremberg, said, vaccine, has, not, left, manufacturer, pfizer, ., it, is, expected, arrive, twentyfour, -, forty-eight, hours, ."
1221,"what, a, liar, ."
1222,"obviously, not"
1223,"you, think, it, i, i, trump, that, i, i, stopping, it, coming, here"
1224,"honestly, y, i, all, showing, misinformation, ,, talk, about, why, blacks, are, more, likely, contract, virus, because, they, make, larger, percentage, essential, workers, than, whites, ,, or, how, trials, that, included, most, black, participants, pfizer, oxford, had, lowest, prevention, ..."
1225,"there, ya, have, it, i, i, i, good, off, vaccine, twenty-three, die, norway, after, receiving, pfizer, couid, -, nineteen, vaccine, :, officials, via"
1226,"For, me, ,, this, is, one, more, of, lopez, ', i, lies, ., I, can, ', i, find, any, note, where, Pfizer, asks, that, they, not, deliver, vaccines, according, to, their, contracts, ,, but, that, poor, countries, do, so, ., something, fat, hides, the, president, ."
1227,"Mexico, agrees, to, reduce, orders, for, a, vaccine, against, couid, -, nineteen, Pfizer, to, give, them, to, the, UN, via"
1228,"took, this, beauty, earlier, today, get, her, first, dose, pfizer, vaccine, ., she, is, nurse, assistant, at, of, main, hospital, ., proud, all, healthcare, heroes, ,, especially, this, one, #, markup, #, gettheshot, #, pfizercovidvaccine, #, washyourhands, #, covid19, #, henryfordhealthsystem"
1229,"goes, again, ,, that, ', i, not, true, ., pfizer, is, fixing, its, plants, in, europe, to, meet, the, demand, for, vaccines, hence, the, delay, ., nothing, to, do, with, poor, countries, ., see, videobackhand_index_pointing_downbackhand_index_pointing_downbackhand_index_pointing_down, #, amlopobresvacunas"
1230,"It, would, be, good, to, know, the, request, of, the, UN, Pfizer, ,, it, ', i, not, that, I, distrust, lopez, ', i, word, ,, but, "", the, donkey, was, not, an, aria, ""..., and, the, president, lies, very, easily, ..."
1231,"frontline, workers, as, well, as, long, term, care, residents, staff, have, had, opportunity, since, vaccine, began, province, about, month, ago, ., because, delay, with, pfizer, vaccine, ,, i, cannot, give, you, more, exact, timeline, ., my, apologies, ."
1232,"feel, free, keep, watching, ., everyone, should, ., meantime, ,, we, have, plenty, real, data, demonstrating, that, pfizer, ,, modern, az, vaccines, are, safe, effective, ."
1233,"who, wants, to, cheat, and, if, he, had, not, accepted, simply, and, simply, there, is, no, purchase, of, vaccines, and, pfizer, will, deliver, them, to, him, who, paid, ., this, statement, is, a, fallacy"
1234,"well, ,, it, seems, to, me, that, like, the, kes, and, family, ,, and, the, closest, elderly, people, have, already, been, vaccinated, and, whoever, believes, that, only, one, councilor, from, acapulco, was, the, only, one, who, has, been, vaccinated, they, no, longer, bought, mexico, accepts, reduction, of, pfizer, vaccines, -, via"
1235,"twenty-three, die, norway, after, receiving, pfizer, couid, -, nineteen, vaccine, :, officials, via, #, coronavirus, #, vaccine, #, pfizercovidvaccine, #, pfizer"
1236,"The, reality, is, that, Pfizer, gave, away, the, vaccines, as, part, of, its, vaccine, testing, ,, in, reality, the, government, did, not, buy, anything, and, that, is, why, it, will, now, look, for, Chinese, vaccines, ., one, more, deception, of, the, shitty, bastard, from, #, alpacas"
1237,"seems, like, government, lied, again, ,, this, time, about, vaccine, ., wednesday, ,, can, we, start, getting, truth, hear, what, pfizer, biotech, modern, say, about, vaccine, inventory, production"
1238,"by, the, way, ,, it, is, highly, recommended, to, read, this, excellent, column, that, shows, an, optics, what, to, consider, about, the, election, and, the, vaccines"
1239,"suspending, or, postponing, election, day, will, be, terrible, ,, but, even, more, so, if, health, logistics, are, not, foreseen, for, the, campaigns, and, election, day, ., For, now, ,, getting, rid, of, vaccines, by, ammo, is, a, bad, sign"
1240,"gee, my, brother, his, family, four, were, test, subject, pfizer, vaccine, ., all, alive, well, with, no, issues"
1241,"so, twenty-three, pal, norway, died, pfizer, vaccine, i, all, elderly, nursing, home, too, suh, crying_face"
1242,"I, did, not, find, any, reference, in, the, who, ', i, tweets, ,, which, mentioned, that, mexico, has, accepted, a, reduction, in, the, delivery, of, the, pfizer, vaccine, the, who, mentions, ten, countries, that, hoard, the, vaccines, and, there, is, no, mexico, ,, mexico, with, more, than, fifty, million, poor, ,, will, have, to, wait, for, the, vaccines, ."
1243,"the, viceroy, prolonged, it, ,"
1244,"The, request, fell, like, a, glove, for, this, gentleman, and, I, imagine, it, has, to, do, with, the, Russian, vaccine, for, which, there, must, be, a, purchase, commitment, ;, in, addition, to, the, vaccine, that, is, just, being, tested, -, I, don, ', i, remember, the, name, -, they, don, ', i, have, the, efficiency, of, pfizer, but, they, are, cheaper"
1245,"twenty, -, three, people, died, norway, within, days, receiving, their, first, dose, pfizer, couid, -, nineteen, vaccine, ,, with, thirteen, those, deaths, i, all, nursing, home, patients, i, apparently, related, side, effects, shots, via"
1246,"ignoring, that, pfizer, developed, first, available, vaccine, outside, usa, with, no, $$$$, trump, ', i, warp, speed, ..., thank, you, ,"
1247,"groton, spying, americans, nuke, clearance, near, pfizer, viagra, 401k, since, bush, ninety, %, popular, no, new, tax, can, ', i, keep, secrets, trying, trigger, nukes, clearances, also, spying, nukes, navy, flying, club, before, nine hundred and eleven, dirty, democratic, spying, losing, win, or, winning, lose, impeachment"
1248,"a, french, media, reveals, the, pressure, the, eu, suffered, to, approve, the, pfizer, vaccine"
1249,"It, will, be, that, he, prefers, that, the, application, of, the, vaccines, be, delayed, to, tie, it, with, the, election, ."
1250,"est, dose, pfizer, vaccine, syringe"
1251,"twentyfive, deaths, already, associated, with, pfizer, vaccine, ., wait, novavax, vaccine, ., it, ', i, safer, ."
1252,"i, can, ', i, wait, until, i, get, mine, ., i, want, pfizer, too, ."
1253,"it, ', i, lot, like, why, they, stopped, pfizer, at, time, that, they, did, it, was, elephant, room, was, that, trump, owned, stock, modern, ., another, republican, major, fuck, up, boone, wants, address, making, it, other, elephant, room, recent, times"
1254,"timing, is, everything, i, remember, outrage, by, activists, over, five, day, shutdown, delay, now, wants, us, think, it, will, do, no, harm, ,, be, ok, ,, if, there, i, i, just, small, ,, tiny, three, -, mo, ., delay, shipping, Canada, i, i, syringe, i, at, time, out, -, of, -, control, couid, -, 19microbeinfectionsexploding_headSOS_buttondouble_exclamation_mark, i"
1255,"this, was, first, belgian, patient, receive, pfizer, vaccine, ., we, need, spread, awareness, dangers, here, ."
1256,"mauro, ,, gins, ', i, friend, ,, imitating, against, the, pfizer, vaccine, face_with_rolling_eyes, ."
1257,"I, already, took, pfizer, here, in, Canada, raising_handsclapping_handsmedium, -, light_skin_toneclapping_handsmedium, -, light_skin_tone"
1258,"i, had, my, first, pfizer, vaccine, tuesday, ., my, bicep, was, sore, wednesday, but, no, other, issues, ., i, feel, like, part, weight, has, been, lifted, ., looking, forward, feb, one, when, i, i, i, scheduled, my, second, dose, ."
1259,"it, is, the, standard, in, acts, to, give, access, to, those, who, went, to, the, placebo, group, ,, if, the, agent, is, effective, ,, although, it, is, not, known, here, ., if, it, were, in, the, consent, I, do, not, know, ,, it, is, better, to, comply, ., here, those, in, the, placebo, arm, of, pfizer, received, ., maybe, there, are, other, factors"
1260,"pfizer, has, best, efficacy, rate, ,, works, new, variant, ., life, is, precious, ., focus, should, be, saving, lives, rather, than, promoting, national, brand, which, have, lower, efficacy, rate, ., totally, agree, hundred_points, with, you, that, ."
1261,"health, experts, call, suspension, pfizer, vaccination, among, elderly, after, norway, deaths"
1262,"that, ', i, not, true, pfizer, is, renovating, its, plants, in, europe, to, meet, demand, ., poor, countries, gave, him, nothing, ."
1263,"fair, warning, second, dose, pfizer, couid, vaccine, absolutely, destroyed, me, last, night, face_with_tears_of_joy, it, was, only, one, night, symptoms, but, it, knocked, me, my, ass, sure"
1264,"pfizer, has, not, tested, people, seventy-five, and, older, ,, now, seniors, are, vaccinated, and, seeing, results, now, ."
1265,"there, i, i, telltale, sign, what, problem, is, with, getting, vaccinations, out, -, volunteers, ., modern, pfizer, were, given, billion, dollars, develop, vaccines, ,, but, there, seems, be, no, money, actually, administering, can, shots, ., did, #, cos, get, contract, this"
1266,"that, sounds, right, ., unfortunately, ., does, have, ongoing, work, with, develop, new, vaccine, by, end, this, year, that, is, easier, transport, store"
1267,"get, my, and, dose, modern, one, feb, six, ., first, dose, was, breeze"
1268,"It, ', i, a, lie, ,, the, Pfizer, vaccines, have, already, passed, phase, three, and, if, they, are, not, for, sale, ,, it, is, due, to, the, state, of, emergency, due, to, the, pandemic, ,, only, the, governments, are, sending, them, ,, probably, after, the, emergency, they, are, sold, by, individuals"
1269,"i, got, pfizer, vaccine, ,, no, side, effects, either, ., just, some, soreness, at, injection, site, few, days, ,, no, worse, than, flu, shot, ."
1270,"stay, safe, my, friend, ...., message, pie, remains, setting, vaccines, but, hoping, we, get, closer, normalcy, bit, by, bit, folded_handsmedium, -, dark_skin_toneflexed_bicepsmedium, -, dark_skin_tone"
1271,"couid, -, nineteen, vaccines, most, especially, modern, &, amp, ;, pfizer, are, best, vaccines, ever, made, world, ', i, history, ., talk, about, time, ,, reactions, &, amp, ;, mortality, rates, ., lot, conspiracy, theories, flying, around, ,, but, one, thing, you, should, all, know, is, :, no, country, loves, her, citizen, more, than, usa"
1272,"fighting, stigma, :, deaths, spur, norway, concern, at, couid, vaccine, safety, vulnerable, elderly, :, norway, has, expressed, increasing, concern, about, safety, pfizer, inc, vaccine, elderly, people, with, serious, underlying, health, conditions, after, ..."
1273,"so, when, you, all, get, your, and, dose, #, pfizer, couid, #, vaccine, your, home, working, though, side, effects, ......., don, ', i, watch, "", i, am, legend, "", just, sayin, ...."
1274,"well, said, #, viagra, #, pfizer, #, pfizercovidvaccine, #, coronavirusvaccine, #, humor"
1275,"my, girlfriend, and, i, have, a, confidentiality, agreement, to, i, get, vaccinated, i, with, pfizer, or, astrazeneca, ,, not, between, the, two, of, us, ., neither, her, husband, nor, my, wife, can, find, out"
1276,"learned, a, lot, of, things, recently, including, the, effectiveness, of, the, est, vaccine, which, can, vary, between, two, to, fifty, %, after, fourteen, days, of, inoculation, ,, the, and, dose, should, be, given, in, a, maximum, of, forty-two, days, to, increase, the, effectiveness, to, ninety, %,,, ,,,, and, for, a, and, dose, at, ninety-two, days, and, that, ', i, for, pfizer, alone, i"
1277,"#, coronavirussicilia, #, coronavirus, vaccines, coviTongue_sticking_out_cheeky_playful_or_blowing_a_raspberry, pfizer, reduces, the, supply, in, Italy, ., sicily, minus, eleven, ,, seven hundred, doses"
1278,"pfizer, didn, i, i, take, any, government, money, there, is, no, anti, ;, it, i, i, myth, inside, your, heads, ., he, did, let, all, those, people, die, because, he, wanted, economy, open, before, it, was, safe, he, wouldn, i, i, tell, people, wear, masks, ."
1279,"Pfizer, refuses, to, grant, Lebanon, the, license, to, obtain, and, distribute, its, couid, vaccine, unless, Parliament, passes, an, emergency, law, protecting, Pfizer, from, legal, liability, in, the, event, of, side, effects, ."
1280,"pfizer, turns, you, gay"
1281,"Lula, has, already, saved, it, once, ,, by, paying, off, billions, of, foreign, debt, and, boosting, gap, to, the, ith, largest, in, the, world, ., today, ,, brazil, would, already, have, a, pfizer, and, modern, vaccine, ,, and, not, a, second, -, rate, vaccine, like, the, into, ., #, bolsonarotemration"
1282,"ink, but, dose, two, pfizer, knocked, me, flat, twentyfour, hours, ., so, that, tracks, ."
1283,"pfizer, me, ,, modern, me, ., get, this, shit, over, with, brotha, please"
1284,"#, covidvaccinated, ., two, /, two, got, pfizer, vaccine, -, quite, typical, experience, cold, like, symptoms, thirty-six, -, forty-eight, hours, post, vaccine, managed, with, tylenol, ,, rest, lots, hydration, ., continue, masking, ,, maintaining, distance, &, amp, ;, get, vaccine, when, you, have, chance, syringe, microbe, #, macready"
1285,"off, pfizer"
1286,"twenty-three, die, norway, after, receiving, pfizer, couid, -, nineteen, vaccine, :, officials"
1287,"heart_suit, i, follow, ., ., ., ., ., ., #, nationlovesrubina, ., #, stoptargetingrahulvaidya, #, vaccine, #, vaccination, #, thegood, #, 1yearwithblackswan, #, supremegodkabir, #, pfizer, #, norway, #, meout, #, jantawantsjasmin, #, spirituality, #, spiritualawakening, #, spiritualsunday, #, lawofattraction"
1288,"why, didn, ', i, they, buy, them, as, a, pfizer, gift"
1289,"trudeau, says, pfizer, ', i, reduction, vaccine, shipments, canada, is, ', just, temporary, '"
1290,"vaccines, still, exhibit, too, many, side, -, effects, ,, have, killed, growing, number, people, here, ,, around, world, ., i, read, that, it, was, pfizer, vaccine, that, is, at, fault, ., is, modern, vaccine, better, i, i, i, find, out, before, receiving, either, ."
1291,"pres, elect, biden, says, he, is, going, fix, botched, vaccine, rollout, ., what, do, you, think, about, your, president, elect, that, he, threw, you, under, bus, ., you, happy"
1292,"finds, this, news, worthy, but, not, that, twenty-three, pal, died, #, pfizer, #, covidvaccine, i, bet, they, suddenly, tell, us, about, importance, separating, someone, dying, "", from, "", vaccine, &, amp, ;, not, "", with, "", it, after, months, lumping, them, gether"
1293,"Vaccine, War, :, US, Media, Silent, on, Pfizer, Vaccine, Deaths, |, ruben, lungs, -, between, news, of, course, ,, it, does, not, suit, them, not, only, would, they, lose, millions, and, be, the, laughing, stock, of, the, inept, world, via"
1294,"twenty-three, people, die, with, few, days, taking, #, pfizer, #, covidvaccine, &, amp, ;, still, still, obsessing, over, trump, &, amp, ;, what, they, think, "", might, "", happen, wed, ummm, why, would, they, hide, news, who, knows, what, their, intent, is, except, "", white, man, bad, """
1295,"my, arm, is, still, little, sore, at, spot, where, i, got, first, pfizer, shot, this, past, wednesday, ., felt, tired, achy, all, over, thursday, ., not, nearly, as, bad, as, how, i, felt, when, i, had, i, mild, i, couid, though, ,, so, i, i, all, take, it, ."
1296,"i'd, twenty-two, years, ;, stellar, six, months, ., just, got, and, pfizer, vaccine, ., arm, soreness, ,, migraine, -, like, headache, fever, i, forty-eight, -, seventy-two, hours, ., so, excited, i, mounted, presumed, immune, response, #, i'd, #, covidvaccine, #, covid19, #, pfizer, #, crowns, #, stellar, #, getvaccinated"
1297,"he, refused, some, pfizer, at, one, point, ., he, totally, made, whole, pandemic, worse, americans, ."
1298,"pfizer, did, not, follow, up, people, given, second, dose, later, that, ', i, where, fda, says, misinterpretation, is, happening, ."
1299,"thank, you, &, amp, ;, but, it, is, really, teams, teams, going, extra, mile, ., red_heart, i, flexed_bicepsmedium_skin_tone, support, all, ., feeling, blessed, grateful, folded_handsmedium, -, light_skin_tone"
1300,"how, do, you, know, how, long, mrna, vaccine, pfizer, works, when, pfizer, doesn, ', i, doesn, ', i, know"
1301,"us, is, sitting, millions, doses, that, are, just, not, going, into, arms, ., can, i, i, pfizer, reroute, these, canada, since, we, ', re, not, getting, doses, we, were, promised, this, month, we, i, re, only, thirty-eight, million, people, ."
1302,"since, trump, didn, i, i, sign, dna, pfizer, /, modern, manufacture, vaccine, ensure, we, had, enough, entire, country, ., why, didnt, they, just, do, it, out, patriotism, i, know, it, i, i, about, profits, ..., but, this, seems, so, nefarious, i, /, couid, raging, ,, four hundred, ,, zero, dead, not, enough, vaccine"
1303,"not, enough, supply, pfizer, so, at, best, i, have, april, appointment, what, will, be, available, ny, ., at, my, age, lot, living, is, going, waste, ., isolation, ten, months, counting, ."
1304,"felt, nothing, she, said, product, doesn, ', i, sting, at, all, not, even, sore, arm, ., she, got, pfizer"
1305,"I, don, ', i, want, the, Pfizer, vaccine, ,, nor, the, Russian, one, ,, nor, the, Chinese, one, ., I, want, the, syringe, vaccine, #, cienfuegos, ,, that, is, immunity"
1306,"concern, is, that, nazi, has, no, idea, what, outcome, delay, vaccinating, will, mean, ., good, ,, bad, or, ugly, ., fda, said, data, misinterpretation, is, going, results, those, pfizer, gave, vaccine, beyond, twentynine, days, ."
1307,"i, am, ny, had, make, appointment, april, spots, fill, up, fast, ., you, have, fill, out, form, online, each, location, try, ., massive, shortages, now, pfizer, vaccine, ., modern, cannot, cover, all, us, ."
1308,"note, refrigeration, requirements, ., you, oughta, use, modern, ."
1309,"pfizer, couid, vaccine, :, Norway, records, twentynine, deaths, among, people, over, seventy-five"
1310,"mom, got, her, est, couid, vaccine, dose, today, pfizer, ., i, signed, her, up, this, week, drive, through, leesburg, about, one, hour, us, ., up, appointment, ,, got, there, at, one thousand, two hundred and fifteen, were, let, in, ., process, was, well, organizeTongue_sticking_out_cheeky_playful_or_blowing_a_raspberry, poke, ,, wait, fifteen, minutes, ,, scheduled, next, dose, ,, left, ., #, covidvaccine"
1311,"+/-, fourteen, days, like, why, ask, twitter, when, you, can, ask, me, i, i, i, epidemiologist, /, clinical, researcher, who, worked, all, pfizer, couid, vaccine, trials, ...."
1312,"paging, :, vice, ganda, i, face_with_medical_mask, pfizer, vaccine, is, waiting, youbackhand_index_pointing_up"
1313,"actually, he, either, six hundred, or, nine hundred, million, doses, combined, all, potential, suppliers, ., i, have, seen, both, numbers, mentioned, ., since, he, has, purchased, another, one hundred, million, pfizer, ., but, none, that, has, any, effect, supply, until, months, now, ."
1314,"est, dose, pfizer, vaccine, update, ,, my, arm, hurts, ."
1315,"so, ...., pfizer, says, they, gave, it, ..., everyone, else, says, we, don, ', i, ., we, need, get, children, out, office, ..., did, trump, confiscate, it, ,, sell, it, ..., and, get, adults, control, #, getaplan"
1316,"headphone, patti, labelle, i, stir, it, up, i, day, two, pfizer, vaccine, headache, ,, but, fresh, air, stroll, made, it, so, much, better, ., wind_face, boldface, #, transplantlife, #, vacuums, #, sleeve"
1317,"my, cup, is, ninety-five, %, full, ., major, thanks, #, pfizer, #, covid19, #, markup"
1318,"nor, two, :, interview, last, month, with, nba, i, i, lester, holt, ,, pfizer, ceo, albert, hourly, acknowledged, he, didn, i, i, know, if, bnt162b2, vaccine, would, prevent, spread, sars, -, cov, -, two, virus, ., i, i, think, this, is, something, that, needs, be, examined, ., we, are, not, certain, about, that, right, now, ."
1319,"please, consider, making, every, #, fhe, site, us, +, territories, vaccination, distributor, ., you, i, all, reach, twenty-eight, +, million, people, who, are, underserved, ,, marginalized, ,, disproportionately, impacted, by, couid, -, nineteen, ., provide, us, i, /, workforce, support, we, i, all, get, job, done"
1320,"just, check, norway, they, pfizer, vaccine, shipment, reduced, by, %, twentyfive, canada, i, i, vaccine, shipment, reduced, by, %, fifty, by, pfizer"
1321,"quebec, is, getting, nearly, ninety, ,, zero, less, pfizer, vaccines, than, expected, by, next, month, #, news, #, montreal"
1322,"times, india, :, twenty-three, die, norway, after, receiving, pfizer, couid, -, nineteen, vaccine, ,, thirteen, were, nursing, home, patients, ., via"
1323,"pfizer, ., looking, forward, it, ., once, i, i, ve, received, both, rounds, van, ,, it, i, all, make, both, air, travel, my, retail, job, lot, less, dicey, ."
1324,"fyi, ., i, had, pfizer, second, dose, was, doozy, about, thirty-five, -, forty, %, my, department, had, couple, rough, days, ., worth, it"
1325,"pregnancies, pfizer, trial, dec, ten, fda, -, prepared, #, covid19vaccine, briefing, document, :"
1326,"soldier, at, check, -, in, :, are, you, teacher, me, :, yep, him, :, oh, really, ,, what, do, you, teach, me, :, middle, &, amp, ;, high, school, ag, him, :, are, you, serious, thats, i, *, awesome, another, saw, my, ofa, vest, said, he, hoped, my, students, could, go, back, camp, o, soon, smiling_face_with_hearts, est, dose, pfizer, #, vaccine"
1327,"agreed, yet, no, response, my, questions, anyone, working, ., pretty, sure, it, i, i, fear, liability, issues, being, lawyer, ,, i, get, that, but, i, still, need, answers, my, questions"
1328,"pfizer, ., which, is, good, because, i, read, pfizer, vaccine, offers, some, protection, against, this, mutation, england, that, i, i, already, u, ., i, ."
1329,"extremely, concerned, about, slow, vaccine, roll, out, ., now, pfizer, slowing, things, down, further, ., my, husband, is, priority, vaccine, based, age, pre, existing, conditions, ., but, no, word, nor, appointment, ., so, stressed, by, lack, information, microbeface_with_medical_masktelephone_receiver"
1330,"perhaps, donations, toward, his, opposition"
1331,"pfizer, modern, should, share, any, preliminary, data, they, have, pregnancy, outcomes, among, women, who, happened, be, pregnant, when, they, received, #, covid19vaccine, ., i, suspect, data, are, reassuring, would, likely, allay, fears, ., if, it, isn, i, i, ,, women, should, know, that, too, ."
1332,"twenty-three, die, norway, after, receiving, pfizer, couid, -, nineteen, vaccine, :, officials, via"
1333,"werner, took, the, vaccine, from, modern, or, pfizer, #, upl"
1334,"i, literally, cried, car, my, team, is, getting, pfizer, today, ., relief, is, real"
1335,"pfizer, says, it, has, second, doses, couid, -, nineteen, shot, hand, ,, expects, no, u, ., i, ., supply, problems"
1336,"congrats, balloon, i, got, pfizer, ., no, side, effects, at, all, ., heard, second, dosis, is, little, bit, different, ., take, care, face_blowing_a_kiss"
1337,"there, have, been, forty, million, vaccinations, by, pfizer, modern, vaccines, ., this, is, statistically, insignificant"
1338,"breaking, :, vaccine, clinic, at, lexington, va, health, care, system, will, now, end, at, i, up, **,, not, up, ,, according, their, social, media, ., more, than, one, ,, zero, pfizer, vaccines, have, already, been, administered, since, clinic, opened, at, am, today, ."
1339,"i, i, i, still, confused, by, this, ., pfizer, modern, have, secret, sauce, ., why, does, this, take, so, long, replicate"
1340,"just, received, my, first, pfizer, vaccination, way, be, with, vicki, ., i, think, i, see, ziggy, stardust, -, that, i, i, good, thing, right"
1341,"biomedical, chemical, engineer, share, everything, you, need, know, about, how, pfizer, modern, #, couid, #, vaccines, work, ., hear, our, own, prof, ., sam, sia, ."
1342,"i, think, it, i, i, been, variable, ,, some, people, couple, days, some, people, longer, ., average, duration, pfizer, one, trials, was, ten, days, ."
1343,"excellent, thanks"
1344,"pfizer, couid, vaccine, shot, #, one, ,, day, two, -, headache, is, hanging, around, ., hopefully, stroll, this, evening, will, help, ., meantime, ,, i, i, i, ceiling, watching, i, one, night, miami, i, directed, by, ., *****, vaccination, is, how, we, get, normal, *****, #, vacuums, |, #, sleeve"
1345,"yes, already, reached, out, pfizer, but, no, response, yet, ., as, lawyer, ,, i, suspect, they, may, not, be, liability, issues, ."
1346,"got, vaccine, yesterday, ., kind, made, me, feel, weird, ., but, i, i, i, fine, today, ., injection, site, bit, sore, ,, that, i, i, it, ."
1347,"dizzyfollow, receive, more, posts, ., ., ., ., ., i, nationlovesrubina, i, stoptargetingrahulvaidya, #, vaccine, #, vaccination, #, thegood, #, 1yearwithblackswan, #, supremegodkabir, #, pfizer, #, norway, #, meout, #, jantawantsjasmin, #, spirituality"
1348,"these, doses, are, spaced, apart, ., pfizer, i, i, second, dose, is, intended, be, delivered, twentynine, days, after, first, ,, while, modern, i, i, has, twenty-eight, -, day, wait, between, doses, ., *, note, it, doesn, i, i, end, with, or, whatever, #, coli, #, covid19bc"
