,0
1124,"as, pfizer, vaccine, starts, rollout, healthcare, workers, our, region, ,, many, say, they, are, not, interested, taking, vaccine, right, now, if, they, could, ., tonight, live, report, at, eleven, -, why, some, say, i, no, i, what, medical, expert, has, say, about, fears, concerns, ."
1125,"here, i, i, vaccination, process, step, by, step, pfizer, ., frontline, workers, receiving, couid, -, nineteen, vaccine, at, downstate"
1126,"pfizer, throwing, little, extra, vaccine, like, fries, at, five, guys, seems, bit, odd, ,, but, whatever, ."
1127,"yea, this, is, pfizer, vaccine, ., modern, should, have, their, approval, soon, too"
1128,"breaking, news, says, it, i, i, acceptable, use, overfill, couid, -, nineteen, vaccine, getting, six, possibly, seven, doses, out, vial, expanding, vaccine, supply, ., #, covidvacccine, #, breakingnews, #, healthcaremediacontributor, #, thepublichealthpharmacist, #, twitter"
1129,"a, lot, of, pfizer, and, johnson, and, johnson, ,, but, when, will, the, vaccine, of, ,"
1130,"our, very, own, captain, kenny, overton, receives, dose, pfizer, -, biotech, couid, -, nineteen, vaccine, ., cut, ., overton, is, among, first, phase, frontline, health, care, providers, be, vaccinated, ., more, information, about, couid, -, nineteen, visit"
1131,"gov, ., wants, weed, stay, illegal, so, they, can, keep, fining, us, ., top, it, lot, pal, believe, it, helps, with, their, anxiety, depression, which, means, less, money, big, corporate, drug, facilities, like, pfizer, ,, who, has, right, lobby, pay, laws, that, suit, their, agenda, grinning_face_with_smiling_eyes"
1132,"really, then, i, demand, you, explain, how, front, line, medical, workers, get, zero, #, covidvaccine, until, next, year, ,, but, milwaukee, housekeeper, got, hers, today, stores, it, here, ., so, don, i, i, you, dare, blame, logistics, ."
1133,"breaking, :, reports, that, depending, type, syringe, gage, needles, ,, couid, vaccine, vials, can, provide, six, doses, rather, than, five, they, are, expected, to, ., must, implement, immediate, standards, stretch, supply, further"
1134,"kern, anticipates, receiving, five, ,, eight hundred and fifty, doses, pfizer, vaccine, by, end, week, ., we, are, working, closely, with, local, health, care, organizations, distribute, first, shipment, couid, -, nineteen, vaccine, critical, healthcare, staff, our, hospitals, ."
1135,"it, would, have, been, nice, if, he, ordered, enough, give, everybody, vaccine, when, pfizer, offered, it, us, first, moron, now, all, other, countries, scooped, up, those, vaccines, we, are, fed, once, again, ,, the, trump"
1136,"haha, I, don, ', i, trust, the, pfizer, one, very, much, ..."
1137,"it, i, i, really, happening, i, got, my, eligibility, email, receive, couid, -, nineteen, vaccine, beyond, ecstatic, so, thankful, those, who, helped, develop, this, ., science, win, #, twitter, #, twitter, who, i, i, with, me"
1138,"do, ., catalina, gonzalez, marquis, ,, our, recent, fellowship, graduate, ,, makes, history, today, being, first, get, vaccinated, at, ., #, vaccineswork, #, vaccinessavelives, #, global, #, pfizer, #, covid19"
1139,"Did, you, sign, something, ?, I, mean, ,, you, won, ', i, sue, pfizer, if, ,, God, forbid, ,, something, happened, ?"
1140,"oh, ,, i, should, have, put, this, number, :, four hundred and nine, pfizer, /, biotech, vaccine, shots"
1141,"new, :, pfizer, vials, have, more, doses, inside, than, previously, thought, ., says, given, public, health, emergency, ,, it, is, advising, it, is, acceptable, use, every, full, dose, obtainable, sixth, ,, or, possibly, even, seventh, each, vial, ,, pending, resolution, issue, ."
1142,"nothing, being, reported, network, news, ,, regarding, pfizer, vaccine, cuts, ."
1143,"seems, like, big, oversight, by, ., "", using, every, drop, overfilled, vials, could, boost, available, doses, by, up, forty, percent, """
1144,"breaking, news, :, had, serious, allergic, reaction, after, pfizer, i, i, coronavirus, vaccine"
1145,"pfizer, should, sue, this, imbecile, defamation"
1146,"pfizer, ', i, ceo, hasn, ', i, gotten, his, couid, vaccine, yet, ,, saying, he, doesn, ', i, want, cut, line"
1147,"got, zero, doses, ., why, no, transparency, how, first, doses, were, distributed, ., many, minority, healthcare, workers, here, get, nothing, why, has, #, covidvaccine, here, have, promised, much, delivered, nothing, ., i, voted, them, -, facts"
1148,"we, i, re, they, all, white, got, zero, doses, even, though, has, it, stored, here, we, have, many, front, line, workers, color, ., no, one, will, account, how, decision, was, made, how, distribute, ., nothing"
1149,"nice, see, pfizer, is, being, so, decent, ., thanks"
1150,"face_with_open_mouthsyringe, pfizer, vaccine, ampoules, or, vials, have, been, discovered, by, pharmacists, to, be, too, full, and, can, be, used, to, create, additional, doses, ,, potentially, expanding, the, us, supply, ., up, ., up, to, forty, i"
1151,"could, you, do, piece, all, information, held, until, after, election, make, look, bad, ex, include, ama, reversing, course, he, ,, pfizer, not, announcing, vaccine, until, after, election, ,, biden, story, actively, suppressed, ,, on, ."
1152,"this, they, should, all, sue, defamation, do, u, see, how, this, schizophrenic, i, member, is, defaming, u"
1153,"hour, after, getting, my, couid, vaccine, i, or, i, i, bike, boot, camp, because, i, i, i, so, excited, feeling, great, #, covidvaccine, #, pelopharmd, #, pelotonmedtwitter"
1154,"how, couid, -, nineteen, vaccines, modern, pfizer, compare, head, head, #, flipboard10fortoday, via"
1155,"#, medtwitter, :, how, are, vaccine, doses, syringe, being, prioritized, &, amp, ;, distributed, at, your, institutions, are, icu, &, amp, ;, ed, physicians, &, amp, ;, staff, receiving, them, first, or, is, it, open, all, healthcare, workers, are, there, appointments, or, is, it, walk, -, in, #, pfizer, #, covidvaccine"
1156,"am, i, only, one, concerned, that, if, pfizer, can, ', i, get, proper, amount, doses, into, their, vials, ,, there, might, be, other, issues"
1157,"hopefully, crossed_fingers, will, get, normal, living, life, back, i, United_States, #, southerncalifornia, #, orangecounty, #, california, #, covidsecondwave, #, corona, #, corona, vaccine, #, coronavirus, #, coronavirus, #, don, ', i, lose, to, corona, #, coronavaccine, #, pfizer, #, pfizercovidvaccine, #, covid19vaccine, #, livingnotlockdown, #, lifestyle"
1158,"labeling, confusion, led, wasted, doses, pfizer, couid, -, nineteen, vaccine, first, days, rollout, via"
1159,"michael, ,, registered, nurse, at, ,, was, first, person, #, orangecounty, receive, first, dose, couid, -, nineteen, vaccine, today, ., thank, you, leading, coordination, delivery, first, pfizer, manufactured, vaccine, ."
1160,"it, ', i, happening, ,, friday, morning, according, reports, current, vice, president, mike, pence, will, receive, televised, couid, vaccination, pfizer, as, early, as, next, week, former, vice, president, now, president, -, elect, joe, biden, will, get, his, own, ."
1161,"fda, says, vaccine, vials, hold, extra, doses, ,, expanding, supply, via"
1162,"pfizer, overengineered, it, ., doing, things, way, america, used, do, things, ., don, i, i, tell, mas"
1163,"pfizer, in, :"
1164,"i, have, no, hesitation, about, taking, vaccine, ., i, am, confident, ninety-five, %, effective, rate, pfizer, vaccine, ."
1165,"tuskegee, healthcare, workers, get, pfizer, vaccine, :, today, doctor, nurse, got, first, pfizer, vaccine, shots, at, saint, francis, hospital, tuskegee, ., i, i, all, have, more, at, five"
1166,"find, out, how, this, rural, hospital, vaudeville, was, among, first, twenty, hospitals, state, get, nine hundred and fifty, doses, pfizer, i, i, couid, -, nineteen, vaccine, ., story, tonight, at, ten"
1167,"you, tend, heed, warnings, ., have, you, been, able, figure, out, what, components, are, causing, these, allergic, reactions, this, vaccine, may, work, majority, world, /, country, ., but, those, us, with, allergies, we, can, i, i, take, that, risk, ., risk, isn, i, i, worth, it"
1168,"this, is, why, i, refuse, vaccine, ., when, you, live, your, adult, life, allergic, everything, or, as, my, best, friend, all, i, i, it, alaskan, has, allergic, reaction, after, getting, pfizer, ', i, couid, -, nineteen, vaccine, |, article, |, reuters"
1169,"today, i, received, my, first, pfizer, #, covid19, vaccine, -, result, rigorous, phase, three, scientific, trials, ,, decades, vaccine, research, ,, &, amp, ;, billions, dollars, numerous, governments, ,, investors, ,, &, amp, ;, humans, ., thank, you, science, ., #, vaccineswork, #, igottheshot, #, thisisourshot"
1170,"Neither, do, I, ,, I, keep, using, it, until, I, ', i, sure, it, ', i, really, going, to, work, here, it, ', i, pfizer, ', i, who, has, already, started, syringe, i, vaccine"
1171,"yes, ., plant, shipping, vaccine, is, just, few, miles, our, office, ., pfizer, refuses, make, any, available, or, even, allow, employees, talk, outside, work, ., we, have, all, same, video, you, that, ."
1172,"pfizer, updated, overfill, info, :"
1173,"alaska, health, worker, has, serious, allergic, reaction, pfizer, vaccine, :, not"
1174,"sorry, i, i, should, clarify, ..., pfizer, is, not, letting, us, do, that, won, i, i, let, employees, talk, us, even, their, own, time, ., i, i, i, little, salty, ."
1175,"this, just, in, :, tells, us, it, is, receiving, its, #, pfizer, #, covid19, #, vaccine, doses, tomorrow, -, once, delivered, -, will, immediately, begin, vaccinate, its, frontline, staff, ., we, have, more, solo, i, i, historic, vaccine, distribution, operation, coming, up, at, up, ."
1176,"did, pfizer, already, get, their, billions, us, government, so, who, cares, what, reactions, people, have, them, alright"
1177,"some, americans, believe, nurses, television, are, using, prop, syringes, administer, pfizer, i, i, couid, -, nineteen, vaccine, ., they, cite, images, needle, i, disappearing, i, after, injection, ., gif, retractable, syringe, :"
1178,"we, are, doing, case, series, ., i, one, ., will, let, you, know, results, ."
1179,"my, dad, pointed, out, this, morning, that, pfizer, makes, my, birth, control, pill, so, vaccine, should, be, safe, face_with_tears_of_joy"
1180,"pfizer, vaccine, ,, first, dose, ., #, pfizercovidvaccine, #, wearamask, #, covid19, #, science, #, werideatdawn, #, mic, #, bcuicuimc"
1181,"so, within, ten, days, first, dose, pfizer, vaccine, you, have, about, ninety, %, immunity, couid, -, nineteen, then, second, dose, booster, two, weeks, later, takes, it, up, ninety-five, %, immunity, raising_handsmedium, -, light_skin_tone"
1182,"new, :, remaining, eighty-seven, #, texas, medical, facilities, waiting, week, one, shipment, pfizer, #, covid19, vaccines, should, get, deliveries, tomorrow, ,, per, ,, including, :, i, seven, travis, co, i, two, williamson, co, i, one, hays, co, ..., bringing, total, week, 220k, doses, thirty-four, counties, syringe"
1183,"This, is, how, the, #, pfizer, are, right, now, syringesyringesyringesyringesyringesyringe"
1184,",, call, your, office, ..."
1185,"except, we, got, vaccine, after, other, countries, didn, i, i, even, buy, enough, vaccinate, everybody, which, means, are, at, back, line, again, i, wouldn, i, i, be, surprised, if, pfizer, is, headquartered, ireland, like, every, other, pharmaceutical, giant, ., don, i, i, care, enough, check, ."
1186,"i, pfizer, ,, where, you, at, i, two thousand and twenty, ,, part, couid, drawings"
1187,"i, get, my, vaccine, tomorrow, at, my, hospital, woo"
1188,"just, received, my, first, dose, #, covidvaccine, ., thank, you, vaccinating, trainees, ., science, wins, flexed_bicepsmedium_skin_tone, syringe"
1189,"#, breaking, :, nashville, surgeon, do, ., william, polk, will, be, first, known, person, tennessee, get, pfizer, couid, -, nineteen, vaccine, ., we, i, all, have, live, coverage, as, it, happens, today"
1190,"do, ., steven, rump, ,, medical, director, indiana, university, health, emergency, medicine, after, getting, pfizer, vaccine, today, ., camera, #, coronavirusvaccine"
1191,"video, :, #, santa, gets, #, pfizer, vaccine, ."
1192,"us, health, worker, suffers, a, severe, allergic, reaction, to, the, pfizer, vaccine, via"
1193,"fact, :, pfizer, /, biotech, #, vaccine, comprises, mrna, with, instructions, making, #, coronavirus, spike, i, protein, ., i, protein, antigen, protrudes, #, virus, surface, ., our, cells, use, these, instructions, make, multiple, copies, i, protein, which, triggers, immune, response, ."
1194,"got, my, est, dose, pfizer, vaccine, grinning_face_with_smiling_eyes"
1195,"sorry, ,, you, ', re, right, that, pfizer, is, us, ., biotech, is, one, that, ', i, german, ., pfizer, ', i, op, warp, speed, agree, gave, them, fast, track, designate, fda, ., it, was, also, guarantee, nearly, $, two, billion, one hundred, million, doses, before, they, had, their, phase, three, clinical, trial, us, ., that, ', i, i, &, amp, ;, i, ."
1196,"this, just, in, :, according, osh, ,, i, all, county, health, department, districts, have, access, pfizer, vaccine, hospital, workers, ., these, locations, ,, county, health, departments, will, distribute, hospitals, around, state, i"
1197,"first, dose, pfizer, covid19, vaccine, today, #, ucsdcares, #, endcovid19, #, inittogethersd"
1198,"first, dose, mrna, vaccine, is, in, ., surrounded, by, pulmonary, medicine, colleagues, protecting, our, patients, ., #, pfizer, -, biotech, #, stickittocovid, #, covidvaccines"
1199,"thank, you, ,, @, der, health"
1200,"none, not, one, dose, #, covidvaccine, here, even, though, stores, it, county, two, miles, my, house, ., very, high, number, minority, front, line, workers, zero, doses, until, next, year, at, earliest, was, all, two hundred, front, line, workers, color, if, not, ,, why, not"
1201,"we, know, this, already, ,, nos, said, sixty-eight, one thousand, people, have, some, allergy, it, ., u, ., i, ., healthcare, worker, suffered, allergic, reaction, pfizer, vaccine, via"
1202,"four, volunteers, who, got, pfizer, ', i, vaccine, developed, bell, ', i, palsy, via"
1203,"they, aren, ', i, us, company, ., they, didn, ', i, want, give, credit, us, i, ., e, ., trump, ., why, do, u, think, they, made, their, announcement, successful, vaccine, just, couple, days, after, election, pfizer, chair, had, correct, his, statements, after, saying, they, had, no, support, us, ."
1204,"alaskan, health, worker, stable, after, allergic, reaction, pfizer, ', i, couid, -, nineteen, vaccine, |, article, |, reuters"
1205,"my, of, just, texted, me, that, he, just, got, first, dose, pfizer, couid, vaccine, ., so, fucking, proud, him, literally, everything, he, does, when, it, comes, his, career, ., pleading_face"
1206,"santa, got, vaccine, he, received, recently, approved, #, pfizer, biotech, #, covid19, vaccine, without, side, effects, preparation, bringing, joy, millions, across, globe, this, holiday, season, ., #, lasvegas, Santa_Clausmedium_skin_tone"
1207,"Who, says, that, Santa, Claus, has, already, received, the, Pfizer, vaccine, ."
1208,"i, i, ve, had, ten, +, doc, ., cases, anaphylaxis, related, vaccines, /, medicine, &, amp, ;, weekly, acute, anaphylaxis, mas, &, amp, ;, food, ., i, the, head, mara, ,, do, june, raine, ,, saiTongue_sticking_out_cheeky_playful_or_blowing_a_raspberry, "", any, person, with, history, anaphylaxis, vaccine, ,, medicine, or, food, should, not, receive, pfizer, biotech, vaccine, i"
1209,"so, far, what, i, am, hearing, is, pfizer, van, is, better, four, elderly, &, amp, ;, those, us, with, health, issues, than, modern, van, ., as, more, data, is, accumulated, &, amp, ;, info, rolls, out, that, could, change, &, amp, ;, as, more, vans, come, board, ."
1210,"this, is, great, dolly, donated, modern, vaccine, not, pfizer, though, just, fyi"
1211,"couid, vaccine, :, u, ., i, ., quarantines, pfizer, shipments, california, ,, alabama, after, transit, ', anomaly, ', ..., regrettable"
1212,"follow, thread, below, little, see, link, i, posted, pfizer, ', i, website, that, was, press, release, their, agreement, under, op, warp, speed, which, was, trump, plan, ."
1213,"geez, anaphylactic, shock, is, probably, going, be, recurring, problem, with, pfizer, vaccine, ., i, wonder, if, it, ', all, happen, with, modern, vaccine"
1214,"pfizer, had, this, op, warp, speed, agreement, as, guarantee, back, their, research, ., they, did, sell, vaccines, us, recently, under, this, agreement, ."
1215,"me, ,, too, we, need, governor, that, doesn, ', i, tell, us, how, only, one, dose, pfizer, ', i, vaccine, will, be, enough, ."
1216,"please, post, links, if, you, want, make, point, ., i, posted, link, directly, pfizer, their, op, warp, speed, agreement, ."
1217,"today, ,, i, got, my, first, dose, couid, -, nineteen, mrna, vaccine, by, hugging_facehugging_facehugging_face, i, feel, great, ,, it, hurt, less, than, steroid, injection, ,, i, i, i, ready, round, two, few, weeks, thank, you, all, hard, work, planning"
1218,"and, that, or, what, is, the, fart, at, least, it, stops, ., Put, out, the, news, when, the, copilot, pregnant, ,, so, they, can, see, there, if, or, when, geraldine, acknowledgment, that, it, will, have, a, child, it, will, jajajajja, yes, pfizer, news, and, will, leave, the, nubesface_with_tears_of_joyface_with_tears_of_joyface_with_tears_of_joyface_with_tears_of_joyface_with_tears_of_joyface_with_tears_of_joyface_with_tears_of_joyface_with_tears_of_joyface_with_tears_of_joy"
1219,"is, ., lila, ,, are, you, disputing, this, statement, i, the, pfizer, /, modern, vaccines, were, found, be, ethically, uncontroversial, by, pro, -, life, policy, organization, charlotte, cozier, institute, brian, kane, ,, senior, director, ethics, catholic, health, association, u, ., i, .."
1220,"trump, had, nothing, do, with, it, so, his, &, amp, ;, dod, under, trump, that, made, agree, i, /, pfizer, under, op, warp, speed, had, nothing, do, with, trump, keep, those, hater, blinders, on, ,, lol, ."
1221,"Gentlemen, ,, the, vaccine, does, not, have, the, virus, itself, ., Imagine, that, your, body, is, a, computer, that, may, have, a, virus, ,, the, vaccine, is, a, USB, memory, that, installs, an, antivirus, capable, of, detecting, and, fighting, the, virus, that, has, just, entered, your, body, ."
1222,"some, first, #, covid19, vaccinations, mohawk, valley, were, administered, this, afternoon, at, it, ., luke, i, i, ., miss, expects, vaccinate, over, forty, employees, today, with, pfizer, i, i, vaccine, ."
1223,"since, march, ,, received, first, dose, i, i, couid, vaccine, sophia, perez, ,, medical, assistant, at, beacon, clinic, ., i, it, i, i, pretty, overwhelming, moment, i, media, said, ., i, the, things, i, would, cite, are, my, true, beliefs, efficacy, safety, this, vaccine, ..., two, /, three"
1224,"healthcare, worker, alaska, has, been, hospitalized, i, not, because, she, got, couid, -, nineteen, i, but, because, she, got, pfizer, ', i, vaccine, had, severe, allergic, reaction, ., despite, warnings, over, allergies, ,, worker, also, had, no, past, history, known, drug, allergies, ..."
1225,"grievance, is, this, what, you, asked, this, is, about, how, i, feel, about, that, washingtonian, response, pfizer, jab, ., or, warp, speed, washingtonian, administration, responding, prick, ., a, pfizer, prick, who, wants, that, read, ill, effects, jab, cac, ., i, don, ', i, need, shit, this, morning"
1226,"pending, approval, ..., anticipates, 100k, modern, couid, -, nineteen, vaccines, i, about, double, number, first, round, pfizer, vaccines, i, i, don, i, i, think, i, i, ve, ever, been, this, excited, /, hopeful, about, covering, couid, related, news, ., woozy_face"
1227,"first, half, #, covid19, vaccine, today, thanks, #, science, #, beginningoftheendofthepandemic"
1228,"i, ', all, take, vaccine, #, manhattanbeach, #, pfizer"
1229,"interesting, article, about, health, care, worker, alaska, who, had, adverse, drug, reaction, couid, vaccine, ., these, next, few, was, will, be, critical, terms, vaccine, safety, ."
1230,"calls, for, immunity, for, all, Pfizer, directors, ."
1231,"interesting, that, when, pfizer, announced, viagra, no, one, was, skeptic, or, suspicious, ."
1232,"where, did, you, get, idea, there, is, i, some, nasty, stuff, i, this, vaccine, ..., ingredients, pfizer, vaccine, are, published, totally, reasonable, ..."
1233,"congrats, i, i, i, pregnant, ,, breastfeeding, ,, will, be, getting, vaccine, as, soon, as, i, can"
1234,"great, job, ,, any, chance, you, can, mix, up, something, keep, scott, baio, at, bay"
1235,"today, says, south, carolina, has, received, at, total, forty-two, ,, nine hundred, pfizer, vaccines, -, total, state, will, get, first, allocation, ., they, say, they, anticipate, more, arrive, early, next, week, ,, antics, total, two hundred, ,, zero, -, three hundred, ,, zero, by, end, two thousand and twenty, ."
1236,"radio, traffic, point, origin, that, point, reception, my, mouth, larynx, eyes, ears, arms, face, &, amp, ;, body, ., pfizer, jab, ', i, why, do, i, need, pfizer, jab, i, don, ', i, care, about, pfizer, jab, ', i, ., i, need, get, radar, out, me, ;, out, my, eyes, ,, my, face, ,, my, mouth, ,, my, arms, ,, my, ears, ,"
1237,"share, black, storiesblack_heart, at, least, two, black, scientists, played, key, roles, developing, couid, vaccines, ., helped, lead, team, scientists, that, worked, vaccine, ., ,, one, i, i, principal, vaccine, researchers, ,, received, vaccine, this, week, ."
1238,"health, care, worker, had, serious, allergic, reaction, after, pfizer, ', i, couid, vaccine"
1239,"florida, begins, #, coronavirus, vaccinations, long, term, care, facilities, ., eighty-eight, -, year, -, old, vera, is, among, first, receive, pfizer, shot, ., #, winners"
1240,"received, my, pfizer, vaccine, today, believe, hope, ,, faith, ,, resilience, ,, strength, goodness, human, spirit, ., we, can, all, do, this, #, fightcovid, #, vaccinessavelives, #, houstonmethodistleadingmedicine"
1241,"u, ., i, ., had, nothing, do, with, pfizer, vaccine, ., nada, it, was, developed, germany, ,, funded, by, germany, ., thank, you, ,, angela, merked, ,, fuck, you, ,"
1242,"#, covid19, #, covidvaccine, #, anthrax, #, pfizer"
1243,"another, issue, i, i, i, raising, is, not, loves, being, first, out, gate, with, reporting, but, loathes, caveat, their, reporting, avoid, any, negative, implications, ., people, are, going, react, any, all, injections, medications, ;, doesn, i, i, mean, pfizer, vaccine, is, secretly, dangerous, ."
1244,"the, negligence, is, serious, ,, the, thickness, of, the, face, really, doesn, ', i, step, down, after, failing, to, submit, a, single, document, ., tapes, sit, pfizer, tried, follow, up, abt, requirement, pa, ., government, actually, kills, people, justo"
1245,"proud, happy, day, be, our, first, recipient, pfizer, vaccine, ., #, covid19"
1246,"just, got, my, confirmation, pfizer, that, i, received, real, vaccine, study"
1247,"merry, christmas, me, #, covidvaccine, #, christmasjumperday, #, in, #, mrna"
1248,"pfizer, trials, four, out, forty-three, ,, zero, developed, bells, palsy, ., modern, ,, three, out, thirty, ,, zero, ., that, means, zero, ., nine, %, patients, had, adverse, reaction, vaccine, ., so, are, same, people, who, said, two, %, patients, dying, couid, wasn, i, i, big, deal, now, saying, that, zero, ., nine, %, is, big, deal"
1249,"#, thankyou, #, healthcareheroes, #, weneedthevaccine, #, covidvaccine"
1250,"give, trump, credit, three hundred and two, ,, zero, dead, ,, calling, couid, hoax, months, &, amp, ;, still, belittling, those, who, wear, masks, ., give, trump, credit, pfizer, refusing, be, part, warp, speed, &, amp, ;, refusing, i, trump, ., give, trump, credit, dismantling, pandemic, response, team"
1251,"i, was, able, get, pfizer, couid, -, nineteen, vaccine"
1252,"good, news, um, health, :, first, doses, pfizer, vaccine, are, being, administered, our, frontline, heroes, this, morning, ., this, is, exciting, day, as, we, enter, very, hopeful, phase, defeating, this, virus, ., stay, tuned, updates, here, ., down_arrow, i"
1253,"thanks, we, have, over, three hundred and two, ,, zero, dead, americans, ,, people, who, still, think, couid, is, hoax, &, amp, ;, refuse, wear, masks, because, trump, belittles, those, who, do, ., pfizer, is, german, company, that, refused, join, warp, speed, ., o'connell, has, refused, pass, any, relief, bills, i, /, o, ..."
1254,"are, potential, production, issues, pfizer, impacting, can, men, forten, says, can, is, talks, with, company, its, still, working, two thousand and twenty-one, delivery, schedules, ., he, says, he, can, i, i, speak, detail, about, schedule, jan, just, yet, because, i, we, don, i, i, have, it, i"
1255,"i, ', i, not, sure, that, pfizer, ', i, couid, -, nineteen, vaccine, will, work, ..., but, it, ', i, worth, shot, ., sorry, ,, but, ya, i, all, knew, i, was, bound, go, there, ."
1256,"asked, about, risk, transmission, once, you, have, vaccine, ,, do, noo, says, more, studies, are, needed, know, exactly, whether, transmission, will, be, lower, people, who, have, received, vaccine, ., he, says, pfizer, study, does, show, vaccinated, pal, have, drastically, lower, risk, getting, couid"
1257,"pfizer, i, i, projected, shipment, will, not, be, happening, next, week, ., i, i, i, unsure, if, he, gave, specific, reason, why, or, how, widespread, that, is, ."
1258,"abomination, had, nothing, do, with, pfizer, i, i, work, vaccine, ., also, ,, virus, must, exist, &, amp, ;, be, discovered, before, vaccine, can, be, created, it, ., so, ,, when, abomination, said, obama, left, testing, shortages, -, that, was, impossible, as, virus, only, showed, up, usa, two thousand and twenty, ., liar, as, usual"
