,0
757,"aims, delhi, ,, director, ,, do, ., dandee, gloria, talks, about, how, vaccination, process, will, be, carried, out, ., couid, -, nineteen, vaccine, will, be, given, everyone, simultaneously, ., watch, know, more, #, indiafightscorona"
758,"we, are, very, much, excited, about, having, do, clarion, be, judge, upcoming, #, interprofessional, #, international, #, debate, between, #, healthcare, #, students, #, qatar, is, #, uk, #, covid19, #, covidvaccination, #, covidvaccine, #, covid20"
759,"breaking, :, delhi, govt, finalists, eighty-nine, hospitals, forty, govt, ,, forty-nine, private, carry, out, couid, vaccination, drive, ., around, two, ., twentyfive, lakh, healthcare, workers, &, amp, ;, govt, teachers, who, worked, as, frontline, workers, get, it, first, ., vaccines, will, start, arriving, jan, twelve, ,, vaccination, starts, with, ."
760,"eleven, /, one, /, twentynine, :, drtspr, show, live, /, couid, nineteen, ,, vaccination, :, goats, guarantee, transparency, ,, accountability, &, amp, ;, liability, issues, no, inf, public, domain, ., do, ., i, ., narsimha, reddy, -, public, policy, analyst, drtspr, channel, subscribe, monday, live7pm, ist, linkbackhand_index_pointing_down"
761,"great, modi, with, couid, -, nineteen, vaccination, set, begin, sixteen, jan, ,, am, modi, says, it, is, ', a, landmark, step, ', via, name, app"
762,"couid, -, nineteen, vaccination, :, war, against, corona, ,, vaccination, starts, across, the, country, from, january, sixteen, ,, register, like, this, ,, know, how, to, get, vaccine"
763,"#, covidvaccination, social, mobilise, will, be, responsible, during, preparation, phases, #, vaccination, #, indiafightscorona, #, unite2fightcorona"
764,"with, couid, -, nineteen, vaccination, set, begin, sixteen, jan, ,, am, says, it, is, ', a, landmark, step, ', #, covid_19, #, coronavirusvaccine, #, vaccination, #, madeinindia, #, indiafightscorona"
765,"The, couid, -, nineteen, vaccine, is, safe, and, effective, ., Remember, these, things, have, to, be, kept, in, mind, during, #, covidvaccination, ., #, indiafightscorona"
766,"prime, minister, reviews, status, couid, -, nineteen, preparedness, covid19, vaccination, via, name, app"
767,"eleven, /, one, /, twentynine, :, drtspr, show, live, /, couid, nineteen, ,, vaccination, :, goats, guarantee, efficacy, ,, safety, etc, ., no, inf, public, domain, ., /, do, ., i, ., narsimha, reddy, -, public, policy, analyst, drtspr, channel, subscribe, monday, live, ist, linkbackhand_index_pointing_down, drtspreddy, ,, nine billion, four hundred and forty million, four hundred and sixty-five thousand, three hundred and thirty-nine"
768,"*, santa, prabha, english, *, spiral_calendar, i, *, ten, january, two thousand and twenty-one, -, news, bulletin, *, backhand_index_pointing_right, *, couid, -, nineteen, vaccination, drive, begin, with, january, *, _________________________, backhand_index_pointing_right, *, case, registered, against, former, chief, minister, karnataka, siddaramaiah, hurting, religion"
769,"under, leadership, am, mahendra, modi, ,, india, is, set, decisively, defeat, #, couid, pandemic, as, nation, -, wide, vaccination, drive, begins, with, january, ., thirty, crore, healthcare, frontline, workers, ,, elderly, citizens, with, co, -, morbidities, have, been, prioritised, inoculation, ."
770,"What, is, the, importance, of, Prime, Minister, mahendra, Modi, ,, ask, Brazil, which, got, shattered, in, the, Corona, epidemic, ., India, will, help, Brazil, ,, but, only, through, Brazil, ,, one, thing, has, to, be, understood, again, that, it, is, indeed, a, matter, of, good, luck, for, the, country, to, have, mahendra, Modi, as, am, at, the, time, of, Corona, crisis, #, couid, #, vaccination"
771,"couid, vaccine, :, eight, hospitals, #, goa, part, program, initially, ., manimal, ,, healthy, ,, victor, empanelled, vaccination, ., #, couid, -, nineteen, one, /, three"
772,"#, indiafightscorona, with, couid, -, nineteen, vaccination, set, begin, sixteen, jan, ,, am, modi, ji, says, it, is, ', a, landmark, step, ', #, unite2fightcorona, via, name, app"
773,"am, i, only, one, who, thinks, maps, ', couid, positive, plot, is, all, about, prioritising, vaccination, them, #, covid19sl, #, srilanka, #, la, #, covidupdate"
774,"congrats, all, indians, ...., our, prime, minister, has, officially, announced, that, with, january, couid, -, nineteen, ', i, vaccination, campaign, would, be, started, ....., priority, will, be, given, all, healthcare, workers, all, couid, warriors, ., one, question, sonu, good, will, be, included, beaming_face_with_smiling_eyes"
775,"congratulations, am, ,, control, pandemic, ., with, couid, vaccination, set, begin, sixteen, jan, ,, am, modi, says, it, i, i, i, a, landmark, step"
776,"Hello, Honorable, India, ., Soul, dependent, India, has, shown, the, world, how, to, put, an, end, to, the, poison, spread, by, China, ., Today, whole, world, ', i, eyes, are, on, world, best, India, with, couid, -, nineteen, vaccination, set, begin, sixteen, jan, ,, am, modi, says, it, is, ', a, landmark, step, ', via, name, app"
777,"This, document, is, mandatory, for, registration, of, krona, ki, rash, tiara, #, covidvaccination"
778,"defer, polls, till, phase, one, couid, vaccination, :, anders, grades, govt, he, -, new, indian, express"
779,"union, health, minister, assessed, couid, -, nineteen, response, with, reviewed, dry, run, couid, vaccination, &, amp, ;, inspected, general, medical, store, depot, ,, integrated, vaccine, complex, chengalpattu, ., is, do, ., emanate, is, ,, dah, attended"
780,"prime, minister, reviews, status, couid, -, nineteen, preparedness, covid19, vaccination"
781,"sir, these, i, new, class, high, class, highly, resistant, couid, warriors, ..., these, people, do, not, need, any, mask, neither, vaccine, i, just, look, news, that, vaccination, has, been, denied, by, herself, likes, beaming_face_with_smiling_eyesbeaming_face_with_smiling_eyes"
782,"nagaland, gears, up, couid, -, nineteen, vaccination, ,, nineteen, ,, six hundred and ninety, health, workers, registered, ., read, -"
783,"under, leadership, am, ,, india, is, set, decisively, defeat, #, couid, pandemic, as, nation, -, wide, vaccination, drive, begins, with, january, ., thirty, crore, healthcare, frontline, workers, ,, elderly, citizens, with, co, -, morbidities, have, been, prioritised, inoculation, ."
784,"#, coronavaccine, #, modi, #, icer, #, thankyou, couid, -, nineteen, vaccination, will, be, conducted, sixteen, january, smiling_face_with_smiling_eyes, #, thanks, all, vaccine, manufacturers, india, smiling_face_with_smiling_eyes"
785,"this, is, good, know, that, there, is, no, discrimination, vaccination, ;, as, her, magistracy, queen, &, amp, ;, prince, are, aged, citizens, so, they, i, re, getting, couid, -, nineteen, vaccine, ."
786,"is, couid, vaccination, mandatory, india, how, many, doses, do, i, need"
787,"under, leadership, am, mahendra, modi, ,, india, is, set, decisively, defeat, #, couid, pandemic, as, nation, -, wide, vaccination, drive, begins, with, january, ., thirty, crore, healthcare, &, amp, ;, frontline, workers, ,, elderly, citizens, with, co, -, morbidities, have, been, prioritised, inoculation, ."
788,"dear, do, ., ashutosh, agarras, ,, your, couid, -, nineteen, vaccination, session, is, scheduled, eleven, -, one, -, two thousand and twenty-one, between, ten, :, zero, am, four, :, zero, am, at, rohilkhand, medical, college, ., please, carry, your, photo, id, proof, submitted, while, registration, ., -, coin, got, my, vaccine, notification, ., #, covid19, #, coaxing, sign_of_the_hornssign_of_the_hornssign_of_the_horns"
789,"dry, run, couid, -, nineteen, vaccination, was, carried, out, at, community, health, center, ,, sugu, watching, district, ,, manicure, ., #, indiafightscorona, #, unite2fightcorona"
790,"thumbs_upmedium, -, light_skin_tone, with, vaccination, all, over, ,, we, shall, overcome, couid, beaming_face_with_smiling_eyes"
791,"with, january, two thousand and twenty-one, will, begin, couid, -, nineteen, vaccination, ,, any, quarries, please, visit, nearest, vaccination, centre, &, amp, ;, registration"
792,"thank, you, hon, i, ble, am, shri, ji, your, efforts, ., your, declaration, sixteen, jan, as, start, date, vaccination, drive, is, great, occasion, ., under, your, leadership, ,, world, will, witness, ,, biggest, couid, nineteen, vaccination, drive, ,, making, it, revolutionary, event, ads"
793,"india, ', i, couid, -, nineteen, vaccination, drive, january, sixteen, :"
794,"with, january, india, ', i, nation, -, wide, vaccination, drive, begins, ., priorities, will, be, given, #, doctors, #, healthcare, workers, ., thankful, our, honourable, prime, minister, ji, ., #, corona, #, goodbyecorona, #, covidvaccination, #, covidvaccine"
795,"today, i, demanded, open, *, vaccination, centre, couid, nineteen, oregon, vidhansabha, *, at, topical, maternity, bac, hospital, oregon, i, *, am, shri, buddha, thackeray, ji, *, regards, *, vidya, thakur, *, oregon, mla"
796,"bank, employees, should, also, be, considered, as, front, line, workers, couid, vaccination, ."
797,"couid, vaccination, drive, india, begin, january, sixteen, -, not"
798,"india, ', i, couid, -, nineteen, vaccination, drive, begin, january, sixteen, via"
799,"breaking, :, india, i, i, couid, vaccination, starts, january, sixteen, #, vaccine"
800,"world, i, i, largest, mass, vaccination, process, under, able, leadership, prime, minister, will, begin, starting, with, january, ., whole, world, will, witness, most, successful, counter, couid, -, nineteen, ., jai, ho"
801,"india, commence, couid, -, nineteen, vaccination, drive, jan, sixteen, priority, will, be, given, healthcare, workers, frontline, workers, ,, which, is, estimated, be, around, three, crore, people, ., thanks, shri, ji, ji"
802,"couid, vaccination, begin, jan, sixteen"
803,"., reviews, preparedness, #, covidvaccination, vaccination, drive, kick, off, with, january, ,, two thousand and twenty-one, after, forthcoming, festivals, including, lori, ,, maker, sankranti, ,, pongal, ,, math, bih"
804,"am, modi, reviews, #, couid, -, nineteen, situation, ;, vaccination, drive, kick, off, jan, sixteen, #, couid, #, vaccine, #"
805,"india, start, it, is, mega, couid, vaccination, programme, saturday"
806,"health, worker, injects, volunteer, during, mock, drill, coronavirus, couid, -, nineteen, vaccination, at, primus, super, specialty, hospital, ,, as, india, gears, up, receive, first, shipment, astrazeneca, /, oxford, coronavirus, couid, -, nineteen, vaccine, ., #, covid19, #, vaccination, #, mockdrill, cameradavid"
807,"photo, :, viagra, aruna, anil, acharekar, /, livephoto, ., hospital, medical, staff, while, mock, drill, coronavirus, vaccine, dry, run, under, bac, couid, -, nineteen, vaccination, centre, at, rajawadi, hospital, ghatkopar, ., #, couid, #, vaccincovid19, #, bac, #, mumbai, #, hospital, #, hospitality, #, coronavirus, #, india"
808,"i, world, not, only, waiting, indian, vaccines, couid, -, nineteen, but, also, looking, at, how, it, rolls, out, largest, vaccination, programme, world, i, am, modi, #, covidvaccination, #, vaccination, #, indiafightscorona"
809,"weekend, message, fellow, citizens, puducherry, ., with, couid, under, check, informing, them, stay, aware, upcoming, vaccination, plan, ,, goi, scheme, digital, health, card, more, ."
810,"Report, on, #, covidvaccination, ., Anyone, who, disagrees, ,, please, do, fact, check, and, tell, ., one, /, two"
811,"we, are, honoured, have, professor, gilbert, upcoming, #, interprofessional, #, international, #, debate, between, #, healthcare, #, students, #, qatar, is, #, uk, #, covid19, #, covidvaccination, #, covidvaccine, #, covid20"
812,"up, will, be, first, state, india, conduct, three, couid, vaccination, dry, runs, dry, runs, successfully, conducted, jan, ith, &, amp, ;, jan, ith, ,, third, dry, run, jan, eleven, ."
813,"availability, couid, vaccine, choice, demand, also, private, sector, at, cost, notification, addition, public, sector, vaccination"
814,"visited, couid, -, nineteen, vaccine, dry, run, site, under, direction, hon, ', ble, am, ji, at, delhi, govt, ., hospital, my, murari, constituency, ., good, known, that, vaccination, will, start, with, jan, ., two thousand and twenty, properly, ,, healthworker, will, get, vaccinated, phase, one, ."
815,"i, would, recommend, everyone, watch, this, two, hour, long, discussion, #, covidvaccination, #, covid19india, all, difficult, questions, discussed, ., tagging, some, speakers, comments, welcome"
816,"#, repost, hospital, medical, staff, while, mock, drill, coronavirus, vaccine, dry, run, under, bac, couid, -, nineteen, vaccination, centre, at, cooper, hospital, mumbai, -, photo, by, milind, shelter, #, bac, #, mumbai, #, maharashtrian, #, coronavaccine, #, vaccinedryrun"
817,"Dry, run, took, place, at, eleven, places, of, the, district, regarding, loved, -, nineteen, vaccination, ,, the, Deputy, Commissioner, was, keeping, an, eye, on, the, activities, ., For, more, information, click, on, the, given, link, :, #, covidvaccination"
818,"couid, -, nineteen, vaccination, mock, drill, ..., angeli, ,, chhattisgarh"
819,"vaccination, couid, -, nineteen, voluntary, ;, and, dry, run, couid, -, nineteen, vaccination, conducted, #, nagaland, ., read, more, -"
820,"#, vic, visited, urban, primary, health, center, at, gora, inspected, dry, run, couid, vaccination, #, thepeopleofvadodara, #, vadodara, #, trove, @, vadodara, ,, gujaratis, ,, india"
821,"visited, dry, run, couid, -, nineteen, vaccination, at, bhandaripokhari, chi, it, ., eight, /, one, /, two thousand and twenty-one, ., The, previous, practice, of, loved, eighteen, vaccination, at, the, Bhandaripokhari, Group, Health, Center, was, visited, on, four, /, one, /, two thousand and twenty-one, by, the, health, department, ', i, alpha, few, ."
822,"hats, off, doctors, doing, fine, job, with, other, prevalent, illnesses, even, as, pandemic, takes, it, is, own, course, ., hospitals, private, nursing, homes, all, playing, their, part, ., #, doctors, #, nurses, #, couid, #, generalhospital, #, vaccination"
823,"Do, you, also, have, some, questions, related, to, #, covidvaccination, in, your, mind, ,, know, authentic, answers, to, some, frequently, asked, questions, ., Avoid, rumors, and, spread, correct, information, to, as, many, people, as, possible, ., #, indiafightscorona, #, unit2fightcorona"
824,"#, covidvaccination, #, unite2fightcorona"
825,"couid, nineteen, ,, vaccination, drive, started, through, bac, at, rajawadi, hospital, ..."
826,"#, when_we_are_safe, #, nation_safe, dry, -, run, visit, at, bac, jumbo, doctor, centre, converted, bac, jumbo, couid, -, nineteen, vaccination, centre, #, covid_19_vaccine_is_safe"
827,"starting, this, week, ,, our, #, plainfacts, couid, tracker, will, feature, world, map, vaccination, coverage, whose, data, provides, quite, efficiently, this, is, number, which, should, double, every, day, make, us, relieved, relieved_face, do, not, forget, subscribe"
828,"logistically, -, it, is, best, start, #, couid, #, vaccination, pune, couid, -, nineteen, vaccine, take, -, off, #, pune, waits, government, place, order, ., via"
829,"assay, health, sexy, explains, how, assay, forward, planned, #, covidvaccination, past, four, months, ."
830,"suprabhat, ,, vaccination, ki, ass, hai, ,, ek, hadst, bar, ke, logo, ke, mann, me, hai, _bazidpur, ke, vijay, vani, ke, malik, baa, beta, couid, se, mare, hall, me, i, bar, bazar, ke, adhunik, vastralaya, ke, malik, couid, se, mare, hall, me, ., kya, local, admin, khojkhabar, li, ., kal, hunger, me, ek, school, me, twentyfive, backache, +, ve, mile, ."
831,"someone, just, said, that, he, has, never, had, need, his, inhaler, as, asthmatic, patient, after, he, received, couid, -, nineteen, vaccination, here, use, weeks, ago, ., this, should, be, good, news, us, all"
832,"amid, discovery, new, strains, couid, uk, south, africa, ,, post, holidays, surge, new, cases, us, other, countries, around, world, ., #, covid19, #, vaccination"
833,"luckily, it, is, only, old, people, they, are, making, queue, outside, three, hours, bac, news, -, coviTongue_sticking_out_cheeky_playful_or_blowing_a_raspberry, llandudno, vaccination, centre, delay, prompts, apology"
834,"understand, rationale, behind, management, couid, -, nineteen, ,, effective, teleconsultation, practices, ,, updates, regarding, vaccination, stress, management, techniques, ., registration, is, free, api, certificate, available, upon, course, completion, fully, online"
835,"dupe, district, geared, up, couid, -, nineteen, vaccination, dry, run, january, eight"
836,"via, |, youth, media, channel, #, covid_19, #, vaccine, #, vaccination, #, bharatbiotech, #, governmentofindia, #, covidvaccine, #, coronavirus, #, indiafightscorona"
837,"deshvasiyo, ,, very, soon, we, all, will, be, safe, couid, nineteen, ., plus, to, till, vaccination, ., jai, ho, ."
838,"couid, vaccination, dry, run, at, district, ghaziabad"
839,"world, ', i, biggest, couid, -, nineteen, vaccination, programme, set, begin, india, ."
840,"last, mile, connectivity, most, india, is, still, best, accessed, foot, or, good, old, bicycles, ., do, you, think, couid, vaccination, will, scale, up, become, as, big, as, polio, vaccination, drive, india"
841,"final, round, dry, run, couid, vaccination, be, held, jan, with, across, utter, grades, ."
842,"nice, ., so, patients, can, have, couid, vaccination, at, these, centres"
843,"Prevention, is, better, than, cure, The, first, dose, of, vaccination, against, the, Corona, virus, -, couid, -, nineteen, #, couid, -, nineteen, #, vaccination, @, diaz"
844,"i, need, to, see, singapore, ,, indonesia, will, start, the, ', mass, vaccination, program, couid, -, nineteen, on, thirteen, january, ..., which, we, here, are, busy, fighting, over, rank, position, &, amp, ;, property, lagiface_with_rolling_eyesface_with_rolling_eyesface_with_rolling_eyes"
845,"trust, only, official, government, reliable, sources, any, news, related, couid, -, nineteen, vaccination, distribution, ."
846,"as, per, health, minister, ,, couid, -, nineteen, vaccine, will, be, given, free, country, first, phase, where, one, crore, health, workers, ,, two, crore, frontline, workers, twenty-seven, crore, people, ,, over, age, fifty, with, comorbidities, will, be, given, vaccine, ,, vaccination, process, will, begin, january, ith, i"
847,"central, vista, ,, got, clearance, so, ., three, ., launch, toycathon, make, india, global, hub, toy, industry, ., four, ., nsa, mud, be, applied, culprits, muradnagar, tragedy, &, amp, ;, loss, be, recovered, them, ., five, ., vaccination, couid, -, nineteen, mud, start, thirteen, jan, ., -, ve, news, one, ., cancellation, british"
848,"do, varanasi, is, threatening, do, fir, against, doctors, varanasi, ,, if, private, doctors, donot, give, staff, data, vaccination, against, couid, nineteen"
849,"bill, gates, ,, world, leaders, praise, india, ', i, "", decisive, action, "", virus, fight, world, news, :, global, leaders, have, lauded, india, ', i, leadership, scientific, innovation, decisive, action, combat, couid, -, nineteen, pandemic, ,, as, country, gets, set, begin, world, ', i, largest, vaccination, ."
850,"U, ., i, ., _Outlying_Islands, :, we, hope, they, expedite, couid, vaccination, process, India, :, go, kahuna, go"
851,"model, couid, vaccination, center, at, my, location"
852,"india, start, world, i, i, biggest, couid, -, nineteen, vaccination, programme, ,, says, am, modi, ;, thanks, scientists, via, name, app"
853,"couid, -, nineteen, vaccination, ., thanks, well, organization, reception, with, preparation, thanks, government, thanks, moh, ,, proud, be, saudi, green_heartbouquet, i, American_SamoaAmerican_SamoaAmerican_Samoa, i"
854,"now, couid, affecting, rate, drastically, reducing, ,, govt, should, not, be, hury, vaccination, drive, before, completing, all, three, stage, trials, ,, our, country, cannot, afford, ,, if, it, back, fires, ,, already, controlling, couid, we, are, stand, no, one, ,, whole, world, watching, us, ,, we, should, be, cassius, ."
855,"jail, modi, i, india, start, world, i, i, biggest, couid, -, nineteen, vaccination, programme, ,, says, am, modi, ;, thanks, scientists, via, name, app"
856,"congratulations, success, scientist, couid, vaccines, ., sir, suggestions, begin, vaccination, with, compulsory, vaccinations, all, my, ,, mla, ,, central, state, govt, employees, ., maps, parliament, ,, mla, assembly, govt, staff, their, office, be, vaccinated"
857,"need, streamline, vaccination, process, further, i, icer, advisor, delhi, couid, task, force, member, tells, me, about, key, lessons, learnt, vaccine, dry, run, how, one, can, register, this, video, into, via"
858,"#, bangladesh, track, receive, #, couid, #, vaccines, #, india, time, as, commitment, is, between, highest, levels, political, leadership, :, #, covid19vaccination, #, oxfordastrazeneca, #, vaccination, #, covid19"
859,"what, i, see, now, "", people, who, are, commenting, /, doubting, /, criticizing, vaccination, process, it, is, vaccine, ', i, efficacy, "", are, one, ', i, who, we, are, hailing, "", kerala, model, "", couid, -, nineteen, mitigation, ., it, was, bullshit, crack, nothing, more, than, that, ., sixty-five thousand, +, cases, #, vaccinepolitics, #, covid19india"
860,"#, vaccination, whether, teachers, are, considered, as, front, line, workers, administering, couid, -, nineteen, vaccination, ."
861,"india, start, world, i, i, biggest, couid, -, nineteen, vaccination, programme, ,, says, am, modi, ;, thanks, scientists"
862,"delhi, govt, ., is, well, prepared, advance, couid, vaccination, ."
863,"., it, is, soothing, hear, do, dandee, valeria, couid, vaccines, ., he, is, making, eminent, sense, this, vitiated, atmosphere, ., hope, sense, will, prevail, among, various, players, this, field, we, focus, important, task, i, vaccination, ."
864,"#, vaccination, congratulations, one hundred and thirty-five, or, indians, scientists, researching, couid, nineteen, vaccine, ., we, are, proud, our, scientists, doctors, ., govt, action, is, also, appreciable, ., thanks, am, who, only, lives, his, country, ."
865,"district, task, force, meeting, couid, vaccination, ippai, two thousand and twenty-one, at, collectorate, barak, under, chairmanship, collector, do, presence, adm, ,, ad, ,, alpha, few, ,, deo, ,, do, ,, smo, -, who, other, line, dept, ., it, ., four, /, one, /, two thousand and twenty-one, ., #, odishafightscorona, #, covid19vaccination"
866,"#, humanrights, groups, accuse, #, israel, dodging, obligations, millions, #, palestinians, occupied, territories, who, may, wait, months, #, couid, vaccination, |"
867,"request, use, vaccination, syringe, essential, travel, like, residents, stuck, outside, their, host, country, #, residentsnottourists, #, couid, #, vaccinations, #, takeusbacktochina, ., we, are, suffering, without, home, &, amp, ;, work, ,, please, help, folded_handsmedium, -, light_skin_tonefolded_handsmedium, -, light_skin_tonefolded_handsmedium, -, light_skin_tone"
868,"moving, with, like, six, sigma, tom, ,, india, is, all, about, set, world, ', i, biggest, couid, -, nineteen, vaccination, programme, ., #, vaccine, #, vaccinations"
869,"#, trustyourvaccine, i, fully, support, bharat, sarkar, vaccination, drive, couid, nineteen, ., congratulations, zee, news, reporter, pooja, marked, her, initiative, ."
870,"i, was, speaking, colleague, eu, ,, his, government, has, procured, required, vaccine, couid, ,, inoculation, /, vaccination, already, started, but, he, was, blasting, his, government, slow, pace, deployment, ,, here, i, i, no, activity, ,, no, news, availability, ,, no, timeline, &, amp, ;, no, noise, any, atr, ."
871,"there, is, old, saying, ..., vaccines, do, not, save, lives, ;, but, vaccination, programs, will, ., act, responsibly, authorities, #, covidvaccines, #, covidvaccination"
872,"couid, -, nineteen, vaccination, dish, soon, ,, says, met, director"
873,"do, yamuna, raghuraman, ,, specialist, paediatrician, ,, meteor, hospital, ,, dubai, ,, opineTongue_sticking_out_cheeky_playful_or_blowing_a_raspberry, i, the, knowledge, ,, attitude, ,, practices, prevent, spread, couid, -, nineteen, are, place, use, ., vaccination, adults, creates, immune, community, i"
874,"indian, scientists, have, developed, two, ', made, india, ', couid, -, nineteen, vaccines, ., we, will, soon, start, world, ', i, largest, vaccination, drive, :, am, #, nationalmetrologyconclave"
875,"rahul, was, accusing, government, delay, vaccination, protection, against, couid, -, nineteen, virus, sighting, example, few, other, nation, where, vaccination, commenced, now, when, scientists, approved, vaccine, &, amp, ;, vaccination, is, likely, commence, rahul, etc, ., have, take, u, turn, third, grade, politics"
876,"probably, till, vaccination, this, can, be, avoided, ., person, next, me, was, also, eating, food, removing, face, mask, ., since, couid, tests, are, not, mandatory, flying, ,, such, exposures, can, be, avoided, ."
877,"couid, -, nineteen, :, ready, vaccination, rollout, ,, says, delhi, minister, satyendar, join, |, delhi, news, -, times, india"
878,"it, is, golden, opportunity, ministers, set, example, as, great, leader, by, taking, injection, infront, media, with, live, telecast, ., it, will, be, biggest, slap, opposition, those, doing, politics, couid, vaccination, ."
879,"even, after, ,, please, wear, mask, prevent, proliferation, couid, -, nineteen, virus, which, you, might, be, immune, after, vaccination, but, you, may, continue, be, asymptomatic, carrier, ., your, responsibility, does, not, diminish, ., please, verify, what, i, have, stated, here, ."
880,"waiting, hear, this, modi, cabinet, minister, :, please, give, one, year, #, covishield, #, vaccine, ..., if, it, does, not, work, we, will, make, changes, i, #, covidvaccination, #, bharatbiotech"
