,0
1492,"ahmedabad, has, at, least, four thousand, four hundred and sixteen, new, slots, available, between, ten, -, two, -, twenty-two, &, amp, ;, seventeen, -, two, -, twenty-two, ., covishielTongue_sticking_out_cheeky_playful_or_blowing_a_raspberry, dose, -, eighteen, i, forty-five, i, seven hundred and three, /, zero, dose, -, eighteen, i, forty-five, i, seven hundred and two, /, zero, coaxing, :, dose, -, eighteen, i, forty-five, i, zero, /, zero, dose, -, eighteen, i, forty-five, i, zero, /, zero, book, one, now, at, #, vaccine, #, coin, #, couid, #, ahmedabad"
1493,"this, happened, our, family, doc, ., octogenarian, who, would, been, practising, nearly, sixty, yrs, he, had, both, doses, van, ,, got, couid, ,, recovered, infection, itself, very, well, ,, but, died, massive, heart, attack, day, he, was, be, discharged, home, ., was, it, virus, or, vaccine"
1494,"half, world, ', i, population, immunized, against, couid, -, nineteen, but, i, #, news, #, latestnews, #, todaynews, #, vaccine, #, covid19, #, safe, #, vaccinated, #, population, #, half"
1495,"as, couid, -, nineteen, pandemic, continues, ,, getting, vaccine, is, powerful, step, taking, charge, your, health, ., protect, yourself, others, couid, -, nineteen, get, vaccinated, now, #, indiafightscorona"
1496,"cops, nab, twentyfive, individuals, over, sale, fake, couid, -, nineteen, vaccine, certs, -, bernard"
1497,"forty-five, +, #, bump, #, bengaluru, #, covidvaccine, availability, ten, /, two, at, 12Happy_face_smiley0pm, free, slots, zero, paid, slots, zero"
1498,"forty-five, +, #, urban, #, bengaluru, #, covidvaccine, availability, ten, /, two, at, 12Happy_face_smiley0pm, free, slots, zero, paid, slots, zero"
1499,"forty-five, +, #, rural, #, bengaluru, #, covidvaccine, availability, ten, /, two, at, 12Happy_face_smiley0pm, free, slots, zero, paid, slots, zero"
1500,"#, leebyunghun, tested, positive, couid, despite, already, receiving, three, doses, ,, including, booster, shot, ,, vaccine, ."
1501,"syringe, about, sixteen, million, seventy-seven, %, sri, lankan, have, gotten, at, least, one, vaccine, dose, so, far, i, total, vaccinations, :, thirty-six, ,, six hundred and fifty-seven, ,, eight hundred and sixty-five, i, fully, vaccinated, :, fourteen, ,, twentynine, ,, four hundred and thirty, i, daily, vaccinations, :, one hundred and twenty-seven, ,, six hundred and six, ~, Sri_Lanka, status, id, seven hundred and ninety-seven, ~"
1502,"ten, in, adolescents, fully, vaccinated, against, couid, -, nineteen, :, masuka, mandaviya, over, five, ., four, crore, beneficiaries, age, group, fifteen, -, eighteen, years, have, been, administered, first, dose, vaccine, #, latest, news, by, #, businessstandard"
1503,"if, one, has, get, couid, anyway, ,, with, or, without, vaccine, ,, it, is, better, fight, it, with, intact, healthy, immune, system, rather, than, one, which, has, been, thrown, off, balance, by, shots, ., all, my, vaccinated, patients, are, recovering, much, faster, without, any, residual, issues, ."
1504,"health, ministry, says, more, than, one hundred and sixty-nine, crore, nineteen, lakh, vaccine, doses, provided, states, union, territories, so, far, ., over, twelve, crore, two, lakh, balance, utilized, couid, vaccine, doses, are, still, available, with, states, union, territories, be, administered, ., #, largestvaccinedrive"
1505,"i, think, you, will, make, him, happy, only, if, you, make, movie, ray, ', i, style, gangly, where, you, roles, gangly, ,, doctor, who, saves, him, scientist, who, invents, couid, vaccine, ., may, god, have, mercy, this, man, ', i, kids, ."
1506,"total, one hundred and eighteen, ., forty-nine, million, couid, vaccines, we, are, administered, between, twenty-eight, /, two, /, two thousand and twenty-one, -, nine, /, two, /, two thousand and twenty-two, ,, including, fifty-two, ., sixty-one, million, est, doses, ,, forty-nine, ., seven, million, and, doses, sixteen, ., eighty-two, million, ord, doses, twentyfour, ., two, %, population, ., five hundred and seven, ,, six hundred and two, people, we, are, vaccinated, yesterday, ., #, thailand, #, covid19, #, โคว, i, ด19"
1507,"modi, talked, about, startups, ,, record, production, ,, purchase, ,, export, agriculture, sector, ,, inflation, at, five, i, food, inflation, below, two, i, administration, couid, ,, made, india, vaccine, ., but, chacha, do, not, want, listen, ,, thats, not, modi, fault, i, yogiwillbeback"
1508,"near, future, ,, companies, would, be, asking, this, their, interviews, :, "", did, you, take, couid, -, nineteen, vaccines, boosters, "", it, is, not, medical, question, ., it, is, just, quick, way, gauge, your, intelligence, ., your, obedience, ."
1509,"did, tennis, player, collapse, due, couid, -, nineteen, vaccine, at, australian, open, find, out, here, backhand_index_pointing_right, #, hatcheck, #, factchecksg, #, tennis, #, covid19, #, covid19vaccine"
1510,"couid, vaccine, :, Vaccination, completed, one hundred and sixty-one, ., twenty-eight, crore, ,, more, than, fifteen, lakh, couid, tests, in, India, on, Wednesday, #, covidvaccine, #, covid19"
1511,"Delay, in, getting, vaccine, can, weaken, our, fight, against, #, covid19, ..., couid, #, vaccine, must, be, done, on, time, ,,,, #, largestvaccinedrive"
1512,"clashes, as, new, zealand, police, clear, protest, against, couid, vaccine"
1513,"The, Urban, Development, Department, is, trying, relentlessly, to, win, the, war, against, Corona, ., In, this, sequence, ,, fogging, and, sanitation, work, is, being, done, regularly, in, various, cities, of, the, state, ., #, indiafightscorona, #, unite2fightcorona, #, covid19, #, covidvaccine, #, covid_19, #, omicron"
1514,"vitamin, i, deficiencies, can, reduce, vaccine, efficacy, ,, increase, severity, couid, infection, :, expert, #, vitamin, #, covid19, #, coronavirusupdates"
1515,"this, is, because, all, your, couid, vaccines, are, useless, ., better, buy, indiaface_with_rolling_eyes"
1516,"eighteen, -, forty-four, #, bump, #, bengaluru, #, covidvaccine, availability, ten, /, two, at, twelve, :, 00pm, free, slots, #, covishield, -, dose, :, eleven thousand, ,, dose, :, six hundred and fifty-four, #, coaxing, -, dose, :, five hundred and nine, ,, dose, :, five hundred and five, paid, slots, #, covishield, -, dose, :, five thousand, eight hundred and fifty-five, ,, dose, :, one hundred and ninety-eight, #, coaxing, -, dose, :, one hundred, ,, dose, :, ninety-nine, #, sputnik, -, dose, :, two hundred and seventy, ,, dose, :, one thousand, one hundred and twelve"
1517,"few, glimpses, today, ', i, student, vaccination, program, at, mayor, ', i, health, clinic, ,, cheat, -, ward, eighty-two, ., #, studentvaccination, #, vaccinationdrive, #, covidvaccine, #, kmcfightscorona"
1518,"eighteen, -, forty-four, #, urban, #, bengaluru, #, covidvaccine, availability, ten, /, two, at, twelve, :, 00pm, free, slots, zero, paid, slots, #, covishield, -, dose, :, eight hundred and sixty-nine, ,, dose, :, forty-nine, #, sputnik, -, dose, :, twenty-seven, ,, dose, :, six"
1519,"santa, ,, y, camera, phones, we, are, not, allowed, couid, centres, why, fake, vaccine, shut, your, mouth, &, amp, ;, wait, four, i, hindu, storms, up, ., big, laugh, at, u, ., fact, -, check, :, two thousand and fifteen, photos, dead, bodies, floating, ganga"
1520,"eighteen, -, forty-four, #, rural, #, bengaluru, #, covidvaccine, availability, ten, /, two, at, twelve, :, 00pm, free, slots, #, covishield, -, dose, :, five, ,, dose, :, one, #, coaxing, -, dose, :, zero, ,, dose, :, one, paid, slots, zero"
1521,"couid, booster, shot, is, additional, dose, vaccine, given, after, protection, provided, by, original, shot, i, has, begun, decrease, over, time, ., booster, helps, people, maintain, strong, protection, severe, coronavirus, disease, ., #, orthopedichospital, #, germane"
1522,"so, far, us, has, donated, over, fifty-two, million, couid, -, nineteen, vaccine, doses, pakistan, pakistan, leads, among, nations, whom, us, government, has, donated, these, lifesaving, vaccines, #, 50mplusdoses"
1523,"pakistan, administers, over, 190m, doses, couid, -, nineteen, vaccines, :, islamabaTongue_sticking_out_cheeky_playful_or_blowing_a_raspberry, national, command, operation, centre, ncos, wednesday, announced, that, one hundred and ninety, million, couid, -, nineteen, vaccines, had, so, far, been, administered, country, ., separate, development, i"
1524,"EU, promotes, couid, -, nineteen, vaccination, campaign, in, Africa"
1525,"us, couid, -, nineteen, aid, pakistan, surpasses, him, vaccine, doses, ., #, pakistan"
1526,"canada, peace, lover, citizens, must, take, another, couid, -, nineteen, vaccine, dose, their, safety, i, cooperate, your, government"
1527,"ten, ., two, ., twenty-two, |, update, couid, -, nineteen, vaccine, availability, states, us, -"
1528,"trendy, are, you, health, institute, or, fashion, institute, ., that, how, your, intelligent, #, expert, recommend, #, covidvaccine, ."
1529,"preclinical, study, original, investigation, iranian, couid, -, nineteen, vaccine, had, been, published, as, editorial, journal, which, specifically, publishes, review, articles, now, ,, article, category, has, been, corrected, label, changed, editorial, review"
1530,"forty-five, +, #, bump, #, bengaluru, #, covidvaccine, availability, ten, /, two, at, 11Happy_face_smiley0am, free, slots, zero, paid, slots, zero"
1531,"forty-five, +, #, urban, #, bengaluru, #, covidvaccine, availability, ten, /, two, at, 11Happy_face_smiley0am, free, slots, zero, paid, slots, zero"
1532,"precautionary, or, booster, dose, is, advisable, six, -, nine, months, after, and, dose, boost, protection, ., more, info, visit, :, #, precautionarydose, #, boosterdose, #, covidvaccine, #, boostershot, #, kedo"
1533,"forty-five, +, #, rural, #, bengaluru, #, covidvaccine, availability, ten, /, two, at, 11Happy_face_smiley0am, free, slots, zero, paid, slots, zero"
1534,""", our, prayers, have, been, answered, form, #, covid_19, vaccine, "", mangsatabam, distant, melted, ,, student, #, shilling, says, he, feels, lucky, &, amp, ;, safe, when, going, out, public, places, like, school, ., shares, his, sincere, thanks, our, hon, am, so, it, ., #, sabkovaccinemuftvaccine"
1535,"afraid, of, the, vaccine, effect, my, kids, but, again, afraid, of, being, exposed, to, post, couid, symptoms, ., i, choose, vaccine, my, kids, ., may, god, protect, you, ."
1536,"total, sixty-two, ,, eight hundred and nine, children, aged, between, five, eleven, years, ,, or, one, ., seven, per, cent, their, population, country, ,, have, received, first, dose, couid, -, nineteen, vaccine, as, yesterday, ., #, kwiknews, #, nation"
1537,"syringe, about, sixteen, million, seventy-seven, %, sri, lankan, have, gotten, at, least, one, vaccine, dose, so, far, i, total, vaccinations, :, thirty-six, ,, six hundred and fifty-seven, ,, eight hundred and sixty-five, i, fully, vaccinated, :, fourteen, ,, twentynine, ,, four hundred and thirty, i, daily, vaccinations, :, one hundred and twenty-seven, ,, six hundred and six, ~, Sri_Lanka, status, id, seven hundred and forty-four, ~"
1538,"couid, maya, vaccine, bhi, a, gym, done, doze, bhi, ho, eye, fir, media, logo, ko, drank, ka, kama, kayo, karrithinking_facethinking_facethinking_face"
1539,"The, war, with, Corona, is, still, going, on, ,, to, prevent, it, ,, it, is, also, necessary, to, follow, the, loved, rules, with, caution, ., Take, care, ,, be, safe, ., #, covid19, #, socialdistancing, #, corona, #, omicron, #, covidvaccine"
1540,"is, that, not, ironic, that, people, still, rum, vaccines, despite, millions, death, ., this, will, increase, risk, couid, around, world, ."
1541,"someone, was, saying, they, used, hiv, proteins, couid, vaccines, ."
1542,"increase, i, &, amp, ;, i, budget, pharma, is, must, increase, current, budgetary, allocation, i, &, amp, ;, i, one, ., eight, percent, gap, two, ., fifty-three, percent, has, proven, be, effective, allocating, couid, vaccines, ,, however, ,, we, must, see, improvements, with, handling, other, diseases, as, well, #, couid"
1543,"three, new, zealand, police, clash, with, anti, -, vaccine, protesters, at, parliament, ,, over, one hundred and twenty, arrested, police, say, it, could, take, days, break, up, couid, -, linked, protest, inspired, by, i, siege, ottawa, i, parliament, grounds, wellington"
1544,"sixty-seven, ,, eighty-four, new, cases, of, corona, in, the, country, in, the, last, twentyfour, hours, i, one thousand, two hundred and forty-one, died, i, decline, in, infection, rate, ., #, coronavirus, |, #, coronapandemic, |, #, coronacurfew, |, #, coronapandemic, |, #, covid19india, |, #, covidvaccine, |"
1545,"hong, kong, vaccine, rates, spike, as, outbreak, shatters, couid, -, free, dreams"
1546,"eighteen, -, forty-four, #, bump, #, bengaluru, #, covidvaccine, availability, ten, /, two, at, eleven, :, am, free, slots, #, covishield, -, dose, :, ten thousand, nine hundred and ninety-nine, ,, dose, :, six hundred and fifty-three, #, coaxing, -, dose, :, five hundred and eight, ,, dose, :, five hundred and four, paid, slots, #, covishield, -, dose, :, five thousand, seven hundred and ninety-six, ,, dose, :, one hundred and ninety-nine, #, coaxing, -, dose, :, one hundred, ,, dose, :, one hundred, #, sputnik, -, dose, :, two hundred and seventy, ,, dose, :, one thousand, one hundred and thirteen"
1547,"eighteen, -, forty-four, #, urban, #, bengaluru, #, covidvaccine, availability, ten, /, two, at, eleven, :, am, free, slots, zero, paid, slots, #, covishield, -, dose, :, eight hundred and fifty-nine, ,, dose, :, forty-nine, #, sputnik, -, dose, :, twenty-seven, ,, dose, :, seven"
1548,"eighteen, -, forty-four, #, rural, #, bengaluru, #, covidvaccine, availability, ten, /, two, at, eleven, :, am, free, slots, #, covishield, -, dose, :, five, ,, dose, :, one, #, coaxing, -, dose, :, zero, ,, dose, :, one, paid, slots, zero"
1549,"more, than, sixty, ,, zero, children, malaysia, given, couid, -, nineteen, vaccine, #, malaysia, #, vaccine, #, pickins"
1550,"india, reports, sixty-seven, ,, eighty-four, new, couid, cases, ,, positivity, rate, drops, four, ., forty-four, pa, #, covid19, #, covidvaccine"
1551,"india, reports, sixty-seven, ,, eighty-four, new, couid, cases, ,, positivity, rate, drops, four, ., forty-four, pa, read, story, |, #, covid19, #, covidvaccine"
1552,"india, reports, sixty-seven, ,, eighty-four, couid, -, nineteen, cases, twentyfour, hours, |, indiablooms, -, first, portal, digital, news, management, #, covid19, #, india, #, vaccine"
1553,"new, zealand, police, make, arrests, as, couid, -, nineteen, vaccine, mandate, protests, enter, ord, day"
1554,"vaccines, appear, be, useful, reducing, numbers, deaths, hospitalizations, cases, with, delta, alpha, couid, ., even, omicron, there, are, larger, number, deaths, vaccinated, ., there, is, data, this, do, gupta"
1555,"vaccines, ,, biologics, :, indian, pharma, i, i, new, temptations, |, api, ,, diagnostics, ,, new, chemical, entity, i, couid, has, thrown, up, new, opportunities, ,, domestic, pharma, biggies, are, are, charging, i, #, local, indian, products"
1556,"couid, nineteen, :, sixty-seven thousand and eighty-four, new, corona, cases, have, been, registered, india, #, couid, #, covidactive, #, covidvaccine, #, omicron, #, telugu, #, telugustop"
1557,"ahmedabad, has, at, least, three thousand, eight hundred, new, slots, available, between, ten, -, two, -, twenty-two, &, amp, ;, seventeen, -, two, -, twenty-two, ., covishielTongue_sticking_out_cheeky_playful_or_blowing_a_raspberry, dose, -, eighteen, i, forty-five, i, six hundred, /, zero, dose, -, eighteen, i, forty-five, i, six hundred, /, zero, coaxing, :, dose, -, eighteen, i, forty-five, i, zero, /, zero, dose, -, eighteen, i, forty-five, i, zero, /, zero, book, one, now, at, #, vaccine, #, coin, #, couid, #, ahmedabad"
1558,"protection, is, infection, is, mediated, by, whole, orchestra, host, immune, responses, plus, survivor, advantage, ., this, explain, why, omicron, took, less, toll, south, africa, likely, india, ., zero, couid, areas, ,, we, need, booster, abd, updated, vaccine, ."
1559,"covidnow, :, more, than, sixty, ,, zero, children, malaysia, given, couid, -, nineteen, vaccine"
1560,"kudos, india, more, than, five, crore, children, age, group, fifteen, -, eighteen, have, received, first, dose, couid, -, nineteen, vaccine, ., well, done, ,, my, young, friends, ., clapping_hands, under, leadership, am, shri, ji, ,, we, are, strengthening, our, fight, against, couid, ."
1561,"us, air, force, approves, nine, religious, exemptions, couid, vaccine"
1562,"forty-five, +, #, bump, #, bengaluru, #, covidvaccine, availability, ten, /, two, at, 10Happy_face_smiley0am, free, slots, zero, paid, slots, zero"
1563,"forty-five, +, #, urban, #, bengaluru, #, covidvaccine, availability, ten, /, two, at, 10Happy_face_smiley0am, free, slots, zero, paid, slots, zero"
1564,"forty-five, +, #, rural, #, bengaluru, #, covidvaccine, availability, ten, /, two, at, 10Happy_face_smiley0am, free, slots, zero, paid, slots, zero"
1565,"ags, missouri, &, amp, ;, texas, will, probe, over, it, is, decision, take, down, page, fundraising, campaign, supporting, protesting, truck, drivers, canada, who, oppose, couid, vaccine, mandates, ., my, report, :, #, cannoli"
1566,"tora, sa, chawaliyan, kama, maria, karen, ,, stop, comparing, pakistan, with, america, ,, they, know, about, sop, ', i, but, our, people, do, not, many, doctors, have, proved, couid, vaccine, dangerous, ., so, you, better, do, some, research, if, couid, vaccines, are, saving, lives, ,, it, is, still, killing, ..., only, sop, ', i, matter, ."
1567,"syringe, about, sixteen, million, seventy-seven, %, sri, lankan, have, gotten, at, least, one, vaccine, dose, so, far, i, total, vaccinations, :, thirty-six, ,, six hundred and fifty-seven, ,, eight hundred and sixty-five, i, fully, vaccinated, :, fourteen, ,, twentynine, ,, four hundred and thirty, i, daily, vaccinations, :, one hundred and twenty-seven, ,, six hundred and six, ~, Sri_Lanka, status, id, four hundred and twelve, ~"
1568,"se, delhi, has, at, least, twenty-three thousand, three hundred and ninety-four, new, slots, available, between, ten, -, two, -, twenty-two, &, amp, ;, seventeen, -, two, -, twenty-two, ., covishielTongue_sticking_out_cheeky_playful_or_blowing_a_raspberry, dose, -, eighteen, i, forty-five, i, four thousand, seven hundred and seventy-four, /, zero, dose, -, eighteen, i, forty-five, i, four thousand, seven hundred and one, /, zero, coaxing, :, dose, -, eighteen, i, forty-five, i, zero, /, zero, dose, -, eighteen, i, forty-five, i, zero, /, zero, book, one, now, at, #, vaccine, #, coin, #, couid, #, delhi"
1569,"u, ., i, ., donations, couid, -, nineteen, vaccines, pakistan, surpassed, fifty, million, doses, this, week, ,, as, washington, continues, it, is, commitment, deliver, life, -, saving, vaccines, people, pakistan, ., #, 50mplusdoses"
1570,"couid, vaccines, :, africa, i, i, score, trails, all, major, regions, world, six, key, categories, logistics, performance, ,, including, timeliness, tracking"
1571,"mumbai, has, at, least, one hundred and ninety-three thousand, one hundred and ninety-five, new, slots, available, between, ten, -, two, -, twenty-two, &, amp, ;, seventeen, -, two, -, twenty-two, ., covishielTongue_sticking_out_cheeky_playful_or_blowing_a_raspberry, dose, -, eighteen, i, forty-five, i, forty-nine thousand, eight hundred and fifty-eight, /, zero, dose, -, eighteen, i, forty-five, i, fifty thousand, seven hundred and seven, /, zero, coaxing, :, dose, -, eighteen, i, forty-five, i, zero, /, zero, dose, -, eighteen, i, forty-five, i, zero, /, zero, book, one, now, at, #, vaccine, #, coin, #, couid, #, mumbai"
1572,"eighteen, -, forty-four, #, bump, #, bengaluru, #, covidvaccine, availability, ten, /, two, at, ten, :, am, free, slots, #, covishield, -, dose, :, eight thousand, nine hundred and one, ,, dose, :, one hundred and fifty-two, #, coaxing, -, dose, :, seven, ,, dose2Happy_face_smiley, paid, slots, #, covishield, -, dose, :, five thousand, six hundred and ninety-six, ,, dose, :, one hundred and ninety-nine, #, coaxing, -, dose, :, one hundred, ,, dose, :, one hundred, #, sputnik, -, dose, :, two hundred and seventy, ,, dose, :, one thousand, one hundred and thirteen"
1573,"eighteen, -, forty-four, #, urban, #, bengaluru, #, covidvaccine, availability, ten, /, two, at, ten, :, am, free, slots, zero, paid, slots, #, covishield, -, dose, :, eight hundred and fifty-nine, ,, dose, :, forty-nine, #, sputnik, -, dose, :, twenty-seven, ,, dose, :, eight"
1574,"notwithstanding, some, discrepancies, ,, india, seems, have, contributed, only, fifteen, -, sixteen, %, percent, world, ', i, output, couid, -, nineteen, vaccines, ., |"
1575,"eighteen, -, forty-four, #, rural, #, bengaluru, #, covidvaccine, availability, ten, /, two, at, ten, :, am, free, slots, #, covishield, -, dose, :, five, ,, dose, :, one, #, coaxing, -, dose, :, zero, ,, dose, :, one, paid, slots, zero"
1576,"oh, really, what, about, integrated, vaccine, complex, facility, vic, at, chengalpattu, they, did, not, got, couid, vaccine, tender, you, know, that"
1577,"tum, mandar, i, hi, karate, rah, yuki, jab, couid, ki, dust, later, sayi, thi, na, tab, koi, mandar, kam, nazi, maya, tab, hospital, or, doctor, kam, i, aye, iphone, ani, meant, se, vaccine, nai"
1578,"as, we, are, suffering, this, no, -, end, cycle, couid, waves, ,, why, not, recommend, vaccines, only, these, pal, first, their, routine, life, is, perfect, ., if, rules, can, be, bent, those, ,, then, it, should, be, all, ., dont, take, vaccine, ,, take, monthly, two, times, test, ,, do, whatever, we, want, three, /, three"
1579,"one, ., these, stars, travel, everywhere, ,, get, couid, ,, quarantine, themselves, ,, then, instagram, post, beating, virus, get, handful, money, goes, loop, ., two, ., but, common, people, need, be, within, home, ,, take, vaccine, dose, est, ,, and, ...&, it, ;, u, know, what, fill, &, it, i, die, without, penny, left, two, /, three"
1580,"ask, sees, sales, growth, two thousand and twenty-two, after, quarterly, beat, ,, prepares, spin, -, off, results, underscore, comeback, ask, race, help, fight, couid, -, nineteen, pandemic, after, it, failed, bring, vaccine, market, so, far, #, latest, news, by, #, businessstandard"
1581,"update, couid, -, nineteen, vaccine, availability, states, /, us, #, newsonline, #, covid19, #, omicron, #, corona_virus, #, indian, #, various, #, vaccine, #, availability, #, states, #, us"
1582,"united, states, has, donated, over, fifty, million, couid, -, nineteen, vaccines, pakistan, ., #, 50plusdoses"
1583,"faraway, has, highest, percentage, teachers, who, have, received, their, couid, -, nineteen, vaccine, booster, jabs, with, up, ninety, i, health, minister, praised, faraway, :, i, keeping, schools, safe, ., faraway, doing, everything, right, i"
1584,"Russian, politician, who, injected, eight, doses, of, couid, -, nineteen, vaccine, still, has, to, be, hospitalized"
1585,"what, has, couid, mortality, rate, what, has, life, expectancy, someone, heart, to, i, /, i, we, do, not, have, enough, data, vaccine, efficacy, immunocompromised, ., we, are, still, figuring, out, accurate, dosage, effect, immunosuppressive, vaccine, induced, immunity, ."
1586,"people, asking, me, why, i, tak, complete, amid, couid, vaccine, ., defi, yg, i, apart, dri, first, dose, buat, i, trauma, ., yg, rasa, i, ., badan, i, yg, hanging, semua, ., neutral_face, just, be, thankful, u, did, not, receive, any, defi, like, people, like, me, ."
1587,"forty-five, +, #, bump, #, bengaluru, #, covidvaccine, availability, ten, /, two, at, 09Happy_face_smiley0am, free, slots, zero, paid, slots, zero"
1588,"forty-five, +, #, urban, #, bengaluru, #, covidvaccine, availability, ten, /, two, at, 09Happy_face_smiley0am, free, slots, zero, paid, slots, zero"
1589,"forty-five, +, #, rural, #, bengaluru, #, covidvaccine, availability, ten, /, two, at, 09Happy_face_smiley0am, free, slots, zero, paid, slots, zero"
1590,"In, India, ,, sixty-seven, ,, eighty-four, people, we, are, diagnosed, with, coronavirus, in, a, single, day, ., -, Federal, Government, #, coronavirusupdates, #, indiacorona, #, covidvaccine"
1591,"pfizer, expects, $, fifty-four, billion, two thousand and twenty-two, sales, couid, vaccine, treatment, pill"
1592,"next, couid, -, nineteen, vaccine, debate, :, immunise, young, children, now, ,, or, wait, february, ten, ,, two thousand and twenty-two, eleven, :, thirteen, amore, young, children, have, been, hospitalised, during, omicron, surge, than, at, any, other, point, pandemic, ."
1593,"us, plans, roll, out, couid, -, nineteen, vaccine, children, under, five, years, february, february, ten, ,, two thousand and twenty-two, ten, :, fifty, external, advisers, are, set, meet, feb, fifteen, discuss, whether, recommend, approval, this, age, group, ."
1594,"next, couid, -, nineteen, vaccine, debate, :, immunize, young, children, now, ,, or, wait"
1595,"anti, -, vaccine, group, uses, telehealth, profit, unproven, couid, -, nineteen, treatments, :, shots"
1596,"syringe, about, sixteen, million, seventy-seven, %, sri, lankan, have, gotten, at, least, one, vaccine, dose, so, far, i, total, vaccinations, :, thirty-six, ,, six hundred and fifty-seven, ,, eight hundred and sixty-five, i, fully, vaccinated, :, fourteen, ,, twentynine, ,, four hundred and thirty, i, daily, vaccinations, :, one hundred and twenty-seven, ,, six hundred and six, ~, Sri_Lanka, status, id, five hundred and sixty-two, ~"
1597,"protests, against, couid, vaccines, everywhere, ., taking, vaccine, is, up, them, ,, but, do, not, they, care, about, other, people, who, has, concerned, about, are, these, protests, spreading, virus"
