,0
0,"thank, got, my, first, dosage, #, indiafightscorona, #, indiancovidvaccine, #, covidvaccination, thank, you, no, reaction, no, side, effect, #, fine, #, igotmyvaccination, #, worldlargestvaccinedrive, #, stayhealthy"
1,"dear, friends, ,, we, are, very, happy, inform, you, that, ,, we, got, couid, -, nineteen, vaccination, with, our, gurukrupa, vocational, junior, college, brains, alumni, who, is, serving, govt, sector, ."
2,"happy, inform, you, all, that, i, got, couid, -, nineteen, vaccination, today, with, our, gurukrupa, vocational, junior, college, alumni, ,, she, is, serving, govt, sector, i"
3,"#, dish, at, #, two, couid, vaccination, ., compliments, team, &, amp, ;, district, administration, this, commendable, achievement, ., #, vaccinationdrive"
4,"couid, vaccination, done, today, at, sums, dhanvantri, ., feeling, good, request, all, corona, warriors, come, front, complete, vaccination, ., #, getvaccinated, #, covidvaccine, #, covid19vaccination, #, covishield"
5,"au, chancellor, do, ., karim, seguir, ,, faculty, ,, staff, students, proudly, display, their, green, badge, after, their, couid, -, nineteen, vaccination, choose, vaccine, ,, not, fear, #, choosevaccine, #, vaccine, #, makeithappen, #, ajmanuniversity, #, ليكن_خيارك_التطعيم"
6,"dull, inaugurates, couid, vaccination, centre, at, ascots, jammy, ,, january, twenty-eight, :, financial, commissioner, ,, health, &, amp, ;, medical, education, ,, atal, dull, today, inaugurated, couid, -, nineteen, vaccination, center, here, at, zachary, shri, chander, college, medical, sciences, &, amp, ;, hospital, ascots, jammy, ."
7,"Medicines, and, strictness, must, also, be, fixed, when, it, is, your, turn, ., Be, careful, even, after, vaccination, ., #, staysail, #, pmayurbanmp, #, vaccinationdrive, #, covidvaccination"
8,"persons, with, #, smi, severe, mental, illness, schizophrenia, ,, bipolar, disorder, &, amp, ;, dementia, i, another, group, vulnerable, couid, infection, must, be, one, priority, groups, second, phase, india, ', i, couid, vaccination, programme"
9,"india, ', i, couid, vaccination, update, by, union, health, secretary, shri, rajesh, bushman, syringe, #, lakshadweep, is, number, one, ,, dish, is, number, two, country, as, far, as, vaccination, is, concerned, ."
10,"couid, -, nineteen, -, vaccination, done, ."
11,"team, vaccinated, syringe, got, my, est, dose, #, pfizerbiontech, couid, -, nineteen, vaccine, markham, vip, lol, ,, still, got, shuttle, bus, service, oncoming_bus, vaccination, center, my, workplace, ..., @, hong, ah, ,, singapore"
12,"dear, do, hitman, singh, aroma, ,, congratulations, you, are, successfully, administrated, with, est, dose, couid, -, nineteen, vaccine, at, gary, chi, one, at, ten, :, twentynine, am, twenty-eight, -, one, -, two thousand and twenty-one, by, vaccination, anjali, swami, nine billion, forty-five million, two hundred and twenty-seven thousand, seven hundred and eighty-eight, ., case, any, queries, post, vaccination, ,, contact, our, help, line, at, one thousand and seventy-five, -, coin"
13,"families, #, hows, health, care, workers, seem, highly, vulnerable, couid, infection, than, general, population, ., must, put, them, priority, group, phase, two, couid, vaccination, programme, india, ., just, suggestion, ."
14,"hie, I, am, #, indiaIndia, #, vaccination, done, vaccine, added, it, is, safe, together, ,, whole, world, will, defeat, couid, -, nineteen"
15,"vaccinated, ..., #, covidvaccination, #, apollohospitals, #, india"
16,"couid, nineteen, vaccination, -, do, ., hitman, singh, ."
17,"india, becomes, fastest, country, administer, two, million, doses, couid, -, nineteen, vaccine, under, largest, vaccination, drive, world, ., as, we, move, forward, decisive, phase, defeat, couid, ,, let, i, i, guard, against, rumours, propaganda, about, vaccines, ., #, indiafightscorona"
18,"The, third, phase, of, corona, vaccination, is, going, on, in, Lucknow, ', i, shama, Prasad, Mukherjee, Hospital, ., #, covidvaccination"
19,"don, i, i, blast, at, pal, who, he, reservations, abt, getting, couid, vaccination, ., there, i, pal, with, minor, allergies, or, medical, conditions, &, amp, ;, they, i, worried, abt, having, adverse, side, effects, ."
20,"received, est, dose, #, covishield, vaccine, ., give, no, second, thoughts, ,, just, take, it, when, you, can, ., vaccine, saves, lives, #, covidvaccination"
21,"congratulations, modi, government, immediately, doing, couid, vaccination, all, over, india, ., thanks, all, medical, staff, scientistsman, i, microscopeman, i, microscope, bouquettulip"
22,"couid, vaccination, started, nepal"
23,"haina, proclaims, ', historic, day, ', as, bangladesh, launches, mass, vaccination, against, couid, -, nineteen, ., via"
24,"*, sind, sets, up, fourteen, couid, vaccination, centres, ,, nine, them, karachi, *, vaccine, company, :, sinopharm, china, first, phase, :, doctors, paramedics, staff, second, phase, :, age, group, above, sixty, years"
25,"him, #, sheikhhasina, has, inaugurated, #, covid19, #, vaccination, #, shaka, ,, #, bangladesh, :, run, veronica, costa, ,, senior, staff, nurse, at, kurmitola, gen, ., hospital, ,, received, first, #, oxford, -, #, astrazeneca, #, vaccine, made, india, ., nationwide, mass, #, covidvaccination, start, feb, seven"
26,"Salute, i, ., Government, ., Among, the, least, developed, countries, ,, Nepal, is, the, first, country, to, start, vaccination, ., Do, not, spread, false, propaganda, about, vaccine, in, the, name, of, political, protest, ., Remember, that, European, countries, have, not, been, able, to, get, couid, vaccine, even, after, paying, in, advance, ."
27,"great, modi, am, interacts, with, beneficiaries, vaccinations, couid, vaccination, drive, varanasi, via, name, app"
28,"humanity, vaccinated, synopharm, couid, vaccination"
29,"repost, :, mira, toufaily, proud, be, part, of, historic, couid, vaccination, program, ,, thanks, use"
30,"him, #, sheikhhasina, has, inaugurated, #, covid19, #, vaccination, #, shaka, ,, #, bangladesh, :, run, veronica, costa, ,, senior, staff, nurse, at, kurmitola, gen, ., hospital, ,, received, first, #, oxford, -, #, astrazeneca, #, vaccine, ., nationwide, mass, #, covidvaccination, start, feb, seven"
31,"well, this, complicates, things, ..., eu, says, astrazeneca, must, supply, couid, vaccines, it, is, uk, plants, -, via, #, brexitreality, #, vaccination, #, astrazenecavaccine, #, covid19, #, covidvaccine, #, be"
32,"i, got, couid, -, nineteen, vaccination, today, folded_hands, #, coronavirusvaccine, #, covid_19, #, vaccinated, #, covidvaccine, #, covishieldvaccine"
33,"see, this, video, know, how, you, can, register, #, covidvaccination, #, bangladesh, using, #, surokkha, mobile, app, website, ., #, covid19, #, vaccine, #, vaccineswork, #, vaccinessavelives, #, affordablevaccines4all, #, coronavaccinationcampaign"
34,"him, #, sheikhhasina, has, inaugurated, #, covid19, #, vaccination, #, shaka, ,, #, bangladesh, :, run, veronica, costa, ,, senior, staff, nurse, at, kurmitola, gen, ., hospital, ,, received, first, -, #, astrazeneca, #, vaccine, ., nationwide, mass, #, covidvaccination, start, feb, seven"
35,"#, indiafightscorona, couid, -, nineteen, vaccine, is, absolutely, safe, efficacious, ., make, sure, that, you, take, vaccination, your, turn, ., if, you, experience, any, side, effects, ,, contact, your, health, provider, /, vaccination, supervising, your, vaccination, ., #, largestvaccinedrive"
36,"#, bangladesh, today, begins, mass, #, vaccination, against, #, coronavirus, #, covid19vaccination, #, covid_19"
37,"congratulations, our, frontline, workers, #, nepal, getting, first, dose, #, couid, vaccination, you, guys, are, our, #, unsunghero, purple_heartflexed_bicepsmedium_skin_tonefolded_handsmedium_skin_toneclapping_hands, forever, grateful"
38,"#, thankyoudubai, it, is, rulers, caring, about, country, it, is, residents, ., managing, couid, -, nineteen, crisis, effectively, ., entire, swift, ,, effectively, organized, free, vaccination, program, ., already, vaccinating, almost, thirty, %, population"
39,"couid, nineteen, vaccination, day, kathmandu, manage, district, -, post, do, radar, basket, do"
40,"ingot, i, un, agencies, working, closely, with, india, couid, vaccination, drive, :, india, ,, un, team, ', i, work, has, led, five, -, fold, increase, investments, address, gender, -, based, violence, ..., i, we, have, also, trained, forty-seven, ,, zero, nurses, others, address, i"
41,"what, has, it, going, take, uk, government, deal, with, couid, -, nineteen, properly, seems, like, more, half, -, arsed, measures, be, implemented, at, some, point, future, ., vaccination, program, is, admirable, but, they, need, tackle, this, all, angles, #, coronavirusuk"
42,"couid, -, nineteen, vaccine, is, now, being, made, vaccination, #, rangoon, other, cities, #, burma, ., priority, is, being, given, government, parliamentarians, ,, health, workers, volunteers, ., #, jan27_2021"
43,"how, register, online, #, couid, #, vaccination, see, this, video, know, ., website, :, post, -, note, :, kindly, wait, register, till, official, inauguration, vaccination, programme, by, prime, minister, #, sheikhhasina, twenty-seven, jan, two thousand and twenty, wednesday, after, three, ., thirty, am, but, ."
44,"adorno, modify, ,, we, chemist, fraternity, india, which, is, more, than, eight, ., five, lacs, number, is, not, feeling, safe, as, you, are, not, yet, considering, us, as, *, couid, warrior, *, not, considering, us, vaccination, ., we, are, always, with, you, ."
45,"please, vaccination, fifty, plus, vulnerable, groups, ., it, i, i, great, time, couid, rates, are, falling, ., so, offices, ,, schools, parks, can, be, open, ., vaccinate, india, first, then, send, abroad, ."
46,"everyone, are, invited, attain, vaccination, couid, -, nineteen, ., previously, infected, candidates, also, need, take, vaccine, ., active, infections, couid, ,, pregnant, ,, age, less, than, eighteen, years, breast, feeding, mothers, are, contraindicated, vaccination, ."
47,"malaysia, targets, seventy-five, ,, zero, daily, jabs, initial, couid, -, nineteen, vaccine, rollout, couid, -, nineteen, vaccination, programme, is, expected, recruit, &, it, ;, ten, ,, zero, staff, ,, such, as, gas, ,, pharmacists, ,, nurses, ,, red, crescent, ,, it, john, ambulance, ,, community, volunteers, -"
48,"fortune_cookiedotted_six, -, pointed_star, just, everest, like, empathy, reaches, this, high, ., i, laundry, ., #, trumptreason, #, trumpvirus, u, ., i, ., couid, -, nineteen, death, toll, tops, four hundred and twenty-two, ,, zero, as, biden, prepares, boost, daily, vaccination, targets, :"
49,"coin, portal, is, seamless, ,, dear, i, i, selvavinayagam, ,, congratulations, you, are, successfully, administrated, with, est, dose, couid, -, nineteen, vaccine, at, righ, one hundred and three, at, five, :, five, am, twentyfive, -, one, -, two thousand and twenty-one, by, vaccination, xxxxx, xxxxx, ., case, queries, post, vaccination, ,, contact, our, help, line, at, one thousand and seventy-five, -, coin"
50,"message, couid, vaccination"
51,"first, batch, frontline, workers, field, staff, amar, seva, sangat, we, are, inoculated, covishield, vaccine, as, part, nationwide, vaccination, program, ., amar, seva, sangat, appreciates, all, them, ., #, amarsevasangam, #, livetoserve, #, covid_19, #, corona"
52,"monkey, macaque, going, through, couid, -, nineteen, vaccination, @, rifle, range, road"
53,"indian, industry, has, critical, role, play, couid, vaccination, programme, ,, writes, i, i, narendran, ,, president, designate, ,, aii, ., #, cii4india, #, cii4health, #, covid19vaccination"
54,"#, vaccine, #, vaccination, #, vaccinationcovid, #, vaccinations, #, vaccine, #, covid_19, #, covid19, #, covidvaccine, #, coronavirus, #, malaysia"
55,"with, successful, beginning, vaccination, health, staff, front, line, warriors, against, couid, it, us, earnestly, hoped, common, man, will, also, get, this, opportunity, protection, ., coin, app, opening, needs, widespread, announcements, as, when, it, is, implemented"
56,"#, nominated, couid, nineteen, +, vaccinated, ., thanks, #, pmoindia, such, well, planned, vaccination, drive, ."
57,"when, prick, is, good, thing, grateful, privilege, ,, proud, our, frontliners, ,, while, road, is, long, -, can, i, i, wait, time, smiling, faces, ,, shaking, hands, ,, cosy, lunches, &, amp, ;, giving, hugs, ., #, igotvaccinated, #, indiafightscorona, #, covidvaccination, #, fortishealthcare, #, covid19safety"
58,"am, exhorts, youths, defeat, ', network, lies, rumours, ', couid, -, nineteen, vaccination, with, right, information, via, name, app"
59,"hon, madam, please, ensure, that, enlistment, names, couid, vaccination, above, fifty, population, can, be, done, online, instead, doing, it, physically, queuing, up, particularly, senior, citizens, elderly, frail"
60,"update, #, covid_19, vaccination, more, than, nineteen, ., five, lakh, healthcare, workers, vaccinated, across, country, three, ,, thirty-four, ,, six hundred and seventy-nine, beneficiaries, vaccinated, till, seven, ., ten, am, with, day, 25thjan, vaccination, drive, #, vaccine, #, covidvaccine"
61,"five, million, doses, #, oxfordastrazeneca, couid, -, nineteen, #, vaccine, has, arrived, #, bangladesh, ., prime, minister, #, sheikhhasina, is, scheduled, launch, pilot, #, covid19, vaccination, drive, with, january, ., #, covid19vaccine, #, coronavirusvaccine, #, bangladeshfightscorona"
62,"couid, -, nineteen, vaccines, i, how, fast, can, vaccination, against, couid, -, nineteen, make, difference"
63,"couid, app, already, launched, by, goi, ,, vaccination, also, started, ,, if, delhi, govt, is, really, bothered, you, should, come, up, with, four, zonal, hospitals, treatment, dental, accidental, cases, ."
64,"india, i, i, rollout, couid, -, nineteen, vaccine, inoculation, ,, world, ', i, largest, vaccination, drive, ,, has, shot, off, as, fastest, world, too, ., first, one, million, doses, india, took, just, six, days, ,, while, uk, usa, took, eighteen, ten, days, respectively, ., stay, alert, against, rumours, #, vaccineforall"
65,"My, India, is, great, folded_handsfolded_hands, Do, not, panic, ,, get, the, syringe, vaccinated, ,, stay, away, from, unnecessary, rumours, ., folded_hands, get, vaccinated, without, panic, i, Do, not, link, getting, the, vaccine, with, politics, ., #, covidvaccination, #, coaxing, #, covid19, #, who, #, indiafightscorona"
66,"india, extends, #, couid, vaccination, drive, foreign, missions, ,, requesting, them, respond, offer, by, with, january, ."
67,"they, have, excluded, couid, hospital, as, vaccination, center, given, vaccine, administrative, staff, hospitals, not, involved, couid, work, such, as, yous, hospital, anand, while, our, residents, who, have, slogged, months, have, not, got, their, first, dose, yet, ., shameful"
68,"am, exhorts, youths, defeat, ', network, lies, rumours, ', couid, -, nineteen, vaccination, with, right, information"
69,"seventy-two, his, since, got, covishield, -, ed, ., no, pain, ,, no, fever, ., thank, you, indian, government, giving, healthcare, workers, priority, ., #, covishieldvaccine, #, covidvaccination"
70,"finally, got, est, dose, #, covidvaccination, ., feeling, better, ., #, healthcareheroes, #, nationkavaccination, #, frontlineheroes, thanks, clearing, doubts, radio, session, ."
71,"great, modi, am, exhorts, youths, defeat, ', network, lies, rumours, ', couid, -, nineteen, vaccination, with, right, information, via, name, app"
72,"I, got, vaccinated, on, hard, January, ,, after, that, completely, completed, my, regular, routine, ., You, too, can, definitely, get, the, vaccine, when, it, is, your, turn, ., #, covidvaccination"
73,"couid, vaccination, she, bef, malkangiri, dish"
74,"india, India, begin, couid, -, nineteen, vaccine, exports, saudi, Saudi_Arabia, ,, morocco, Morocco, #, morocco, #, marco, #, المغرب, #, africa, #, india, #, i, i, रतवर, i, i, #, sa, #, saudi, #, saudiarabia, #, couid, #, covid19, #, coronavirus, #, vaccine, #, vaccination, via"
75,"majority, doctors, hesitant, get, couid, vaccine, ., online, registration, not, possible, ., spot, registration, doctors, stopped, today, ., many, turned, away, vaccination, centres, pathetic, implementation, #, covidvaccine, #, coronavirusvaccine, #, covid19vaccination, #, covid19vaccine"
76,"#, covidvaccination, The, couid, nineteen, preventive, vaccination, started, today, in, the, presence, of, at, the, Sub, -, District, Hospital, ,, dealer, in, dealer, constituency, ., The, vaccine, is, being, given, to, health, workers, in, the, first, phase, ., Accordingly, ,, the, first, vaccine, was, given, to, Nga, ., Malshetwar, ."
77,"couid, vaccination, today, bahadurgarh, civil, hospital, ."
78,"ranks, rajasthan, as, best, prepared, state, #, covidvaccination, rajasthan, arround, ninety-seven, %, #, couid, vaccine, we, are, utilised, during, first, three, days, against, target, ninety, %, leading, charge, ., flexed_biceps"
79,"connecting, national, capital, new, delhi, with, mau, district, ., mau, -, anand, vicar, terminal, special, flagged, off, after, commencement, couid, vaccination, ,, running, this, special, train, will, improve, economic, activities, district, ."
80,"india, i, i, rollout, couid, -, nineteen, vaccine, inoculation, ,, world, ', i, largest, vaccination, drive, ,, has, shot, off, as, fastest, world, too, ., first, one, million, doses, india, took, just, six, days, #, vaccineforall"
81,"Rolling_on_the_floor_laughing, #, vaccinestrategy, #, vaccine, #, covidvaccination, #, vaccinemaitri, #, covid_19"
82,"Like, #, priest, ,, #, covidvaccination, will, also, be, done, free, of, cost, to, the, private, sector, and, free, to, the, government, ."
83,"so, let, me, get, this, right, i, cannot, say, bill, gates, i, cannot, say, couid, -, nineteen, i, cannot, say, vaccination, i, cannot, say, og, just, so, I, am, clear, thinking_face"
84,"#, covidvaccination, #, covid_19, #, proudmoment, #, grateful"
85,"am, exhorts, youths, defeat, ', network, lies, rumours, ', couid, -, nineteen, vaccination, with, right, information, download, economic, times, app, stay, updated, with, business, news, -"
86,"couid, vaccination, review, ply, share, the, review, of, couid, nineteen, vaccination, please, ., syringetest_tubesyringetest_tubesyringetest_tubesyringetest_tube, #, covid19, #, covid_19, #, corona, #, coaxing, #, review, #, answer, #, share, #, latest, #, covid19vaccination, #, india, #, indians, #, narendramodi"
87,"am, modi, exhorts, youths, defeat, ', network, lies, rumours, ', couid, -, nineteen, vaccination, ., na, baba, nce, is, not, meant, this, work, better, use, ass, beats, ."
88,"i, wonder, where, is, prof, his, thought, how, india, mis, -, handled, #, covid_19, pandemic, ., maybe, how, it, is, is, running, successful, largest, vaccination, program, &, amp, ;, also, peovindinto, other, countries, while, us, us, still, struggling, becuase, politics, well, ex, pres, ., tcowboy_hat_face"
89,"aviation, ministry, urges, health, ministry, prioritise, couid, -, nineteen, vaccination, airlines, ,, airports, employees, ., #, covid_19, #, covidvaccine, i, reportbackhand_index_pointing_down"
90,"sri, lanka, &, amp, ;, bangladesh, will, begin, country, wide, vaccination, this, week, with, india, made, couid, vaccines, ."
91,"sixty-six, %, answered, it, correctly, answer, is, no, ,, vaccination, couid, -, nineteen, is, voluntary, ., however, ,, it, is, advisable, receive, complete, schedule, couid, -, nineteen, vaccine, protecting, oneself, limiting, spread, disease, ."
92,"#, vaccine, #, covid_19, #, covid19, #, covid19vaccination, #, covidvaccination"
93,"twenty-three, /, one, /, twenty, versus, twenty-three, /, one, /, twentynine, what, ., a, ., year, ., started, at, taj, mall, ended, with, shift, couid, vaccination, centre, ., @, taj, mahal"
94,"connecting, national, capital, new, delhi, with, mau, district, ,, special, train, five thousand and twenty-five, /, twenty-six, mau, anand, vicar, special, express, has, started, today, twentyfour, january, ., after, commencement, couid, vaccination, ,, running, this, special, train, will, improve, economic, activities, district, ."
95,"#, largestvaccinedrive, #, unite2fightcorona, "", healthcare, workers, should, not, fear, jabs, ,, #, covidvaccination, safe, i, -, do, ., samira, panda, ,, head, -, epidemiology, &, amp, ;, communicable, diseases, division, ,, icer, delhi, interview, with, new, indian, press"
96,"dismal, #, covid19, scenario, ,, which, country, is, standing, tall, undoubtedly, ,, #, india, ,, not, just, with, it, is, #, vaccinediplomacy, ,, but, also, with, it, is, effective, handling, domestic, spread, world, ', i, largest, vaccination, drive, against, couid, i, pharmacyoftheworld"
97,"Countries, which, had, built, big, hospitals, are, asking, for, "", vaccine, "", from, "", Hindustan, "", who, built, temples, today, ..., #, vaccinemaitri, #, covidvaccination"
98,"modi, haters, feel, like, ....., #, justkidding, #, offense, #, covid19, #, covidvaccination"
99,"agreed, ., vaccination, awareness, is, must, now, ,, as, part, post, -, couid, -, way, -, forward, -, plan, ."
100,"message, week, i, *, on, #, covidvaccination, ,, *, insurance, cover, by, am, flagship, program, #, ayushmannbharat, providing, cashless, health, cover, all, below, poverty, line, families, all, four, regions, #, puducherry, #, republican, greetings, ."
101,"message, week, ,, tamil, by, old, it, governor, ,, i, teeth, has, *, on, #, covidvaccination, ,, *, insurance, cover, by, am, flagship, program, #, ayushmannbharat, providing, cashless, health, cover, all, below, poverty, line, families, all, four, regions, #, puducherry, #, republican, greetings, ."
102,"thanks, couid, ,, most, us, are, unable, meet, our, loved, ones, ..., i, hope, with, #, vaccination, we, get, get, back, our, social, life, back, i"
103,"took, jab, yesterday, ., would, request, everyone, get, at, first, opportunity, ., nothing, worry, very, well, organized, vaccination, program, ..., #, coin, #, covidwarriors, #, covidvaccination"
104,"top, #, spanish, general, resigns, over, allegations, #, vaccination, queue, -, jumping, #, covid_19"
105,"#, covidvaccination, folded_hands"
106,"couid, -, nineteen, vaccination, quixada, ,, ba, ,, brazil, ., take, closer, look, at, empty, syringe, syringedashing_away, person_facepalmingmedium, -, dark_skin_tone, i, male_sign, i, person_gesturing_NOmedium, -, dark_skin_tone, i, male_sign, i"
107,"#, bangladesh, is, ready, start, it, is, vaccination, #, covid_19, four, stages, ."
108,"Someone, was, asking, :, Is, it, necessary, to, upload, a, photo, on, social, media, after, the, couid, vaccination, syringe, ,, is, the, thinking_face, if, it, does, not, work, ,, will, the, vaccine, work, ?, face_with_medical_maskgrinning_face_with_sweatface_with_tears_of_joy"
109,"delhi, is, doing, fantastic, job, keeping, couid, cases, low, since, past, one, month, ., can, we, accelerate, vaccination, all, soon, so, we, don, i, i, have, fourth, wave"
110,"as, we, continue, support, our, national, couid, -, nineteen, vaccination, campaign, combat, this, pandemic, safeguard, our, community, ,, we, are, pleased, announce, that, diyafah, staff, will, be, taking, their, couid, vaccine, sunday, with, january, two thousand and twenty-one, ., #, protectingthecommunity, #, covidvaccine, #, diyafah"
111,"has, am, already, taken, vaccine, even, if, he, has, ,, is, not, he, supposed, follow, all, couid, -, eighteen, protocol, such, as, wearing, mask, ,, use, sanitizer, &, amp, ;, social, distancing, even, after, vaccination, or, protocol, is, only, you, &, amp, ;, me"
112,"india, has, vaccinated, fifteen, lakh, fifteen, ,, thirty-seven, ,, one hundred and ninety, it, is, citizens, #, couid, ., today, marks, one, week, since, india, rolled, out, it, is, country, wide, vaccination, ."
113,"answer, is, no, ,, fifty, %, participant, answered, it, correctly, ,, registration, is, mandatory, couid, -, nineteen, vaccination, ., only, after, registration, ,, information, session, site, time, will, be, shared, ., thank, u, participating, ."
114,"not, both, reasons, ,, my, sister, is, front, liner, doctor, couid, ,, she, registered, my, name, too, vaccination"
115,"couid, vaccination, banal"
116,"finally, got, vaccination, done, ., clapping_handscrossed_fingers, i, wish, india, great, success, launching, world, i, i, largest, couid, vaccination, roll, out, ..."
117,"couid, -, nineteen, vaccinationcheck_box_with_check, #, covishieldvaccine"
118,"Nepal, ', i, Prime, Minister, up, Oli, thanks, am, Modi, after, getting, corona, vaccine, from, India, in, trouble, #, swadeshi, #, covidvaccination"
119,"vaccinated, syringe, #, covidvaccination, #, covidvaccine"
120,"couid, -, nineteen, vaccination, twenty-three, /, one, /, two thousand and twenty-one"
121,"shah, faecal, breaks, long, silence, ,, praises, india, ', i, couid, vaccination, program, under, am, modi"
122,"#, healthworkers, gets, #, vaccinated, at, #, bharatratna, #, drbabasahebambedkar, #, municipalgeneralhospital, ,, #, kandivali, #, mumbai, twenty-three, /, one, /, two thousand and twenty-one, ., ., videocamera, ., #, satejshinde, #, midday, #, covidvaccine, #, covidvaccination, #, covid19vaccination, #, bac"
123,"how, do, we, do, it, silent, but, efficient, ., kudos, india, effective, vaccination, within, i, exporting, other, countries, eradicate, couid, ., china, spreads, virus, ,, india, spreads, vaccines, ., #, proudindia, #, globalguru"
124,"heard, #, congress, panelist, to, boasting, about, vaccines, they, rolled, out, smoothly, &, amp, ;, questioning, #, modi, ., dear, conga, ,, biggest, opposition, bop, never, raised, silly, doubts, oor, poisoned, people, ', i, mind, scientific, work, govt, ., that, is, difference, ., smiling_face_with_smiling_eyes, #, covidvaccination"
