,0
2311,"syringe, about, sixteen, million, seventy-seven, %, sri, lankan, have, gotten, at, least, one, vaccine, dose, so, far, i, total, vaccinations, :, thirty-six, ,, five hundred and eighty-one, ,, five hundred, i, fully, vaccinated, :, fourteen, ,, fifteen, ,, one hundred and forty-five, i, daily, vaccinations, :, one hundred and twenty-two, ,, eight hundred and sixty-four, ~, Sri_Lanka, status, id, eight hundred and fifty, ~"
2312,"more, surprising, is, see, all, this, union, against, couid, -, nineteen, vaccines, but, you, did, not, see, any, this, against, low, rate, loads, ., it, is, time, truckers, establish, union, ."
2313,"couid, -, losing, ,, gujaratis, -, winning, ., Congratulations, to, the, people, and, health, workers, of, the, state, under, the, leadership, of, the, Chief, Minister, in, the, largest, and, fastest, vaccination, campaign, under, the, leadership, of, the, Prime, Minister, ., #, 10cr_vaccine_gujarat"
2314,"find, someone, who, has, new, version, give, them, hug, ., thirty-six, hours, after, you, get, little, sick, ,, your, bulletproof, all, couid, forms, is, what, i, read, ., omicron, appears, be, vaccine, while, increasingly, ,, it, looks, like, maxx, is, disease, ."
2315,"it, is, prudent, fear, wild, beast, ..., it, is, not, phobia, ..., would, we, call, people, asking, couid, vaccines, ,, masks, or, treatment, as, coronaphobes, fear, islam, is, actual, fear, based, empirical, evidence, ."
2316,"pfizer, ', i, two thousand and twenty-one, profits, doubled, us, $, twenty-two, billion, strong, couid, -, nineteen, vaccine, sales, null"
2317,"close, win, case, against, forceful, couid, guidelines, maharashtrian, govt, ., congratulations, aim, team, people, who, are, supporting, our, mission, get, freedom, mandatory, vaccine, &, amp, ;, mask, free, life, ."
2318,"do, ., fresh, rehan, ,, chairman, &, amp, ;, managing, director, ,, meant, ,, exclusive, interaction, with, shared, his, views, couid, -, nineteen, pandemic, ,, different, variants, coronavirus, ,, vaccine, efficacy, availability, booster, doses, those, under, sixty, ., #, meant"
2319,"i, i, amp, ;, i, ., pauses, creation, it, is, couid, vaccine, regardless, persistent, need"
2320,"couid, nineteen, :, over, twenty-eight, lakh, couid, vaccine, doses, have, been, administrated, pregnant, women, till, feb, two, :, govt"
2321,"why, have, not, couid, vaccines, received, full, i, ., i, ., a, ., approval, via"
2322,"couid, -, nineteen, vaccine, |, neurological, complication, via"
2323,"pfizer, vaccine, couid, nineteen, |, what, you, need, know, via"
2324,"i, received, peer, recognition, #, photography"
2325,"reuters, :, pfizer, couid, vaccine, ,, pill, forecasts, miss, estimates, ;, shares, fall, four, i, via"
2326,"couid, vaccine, gives, pfizer, sales, profits, big, boost"
2327,"#, hatcheck, :, did, nigeria, destroy, couid, -, nineteen, vaccines, find, out, at, #, health, #, misinformation, #, nigeria, #, couid, #, vaccines"
2328,"facts, are, stubborn, things, &, amp, ;, they, do, not, lie, ., antivaxxers, lie, ., jul, two thousand and twenty-one, there, are, ask, +, new, cases, over, two hundred, deaths, per, day, ., now, ask, +, new, cases, but, deaths, less, than, ten, per, day, ., vaccines, work, &, amp, ;, reduce, severity, couid, -, nineteen, ., get, your, booster, &, amp, ;, vaccinate, your, children, ."
2329,"india, crosses, landmark, achievement, administering, more, than, one hundred and seventy, crore, couid, vaccines, ., but, fight, is, not, over, yet, keep, following, couid, appropriate, behaviour, every, time, you, step, out, ., #, indiafightscorona"
2330,"couid, cases, continue, fall, gujaratis, amid, dominance, ba, ., two, lineage, omicron, ., two, ,, five hundred and two, new, cases, ., and, day, when, no, city, /, district, reported, ok, +, cases, ., after, two, -, day, hiatus, ,, deaths, up, twenty-eight, day, ., gujaratis, completes, dispersal, ten, crore, couid, vaccine, doses, ."
2331,"when, hospital, offered, free, influenza, vaccines, yearly, ,, i, did, not, take, it, because, i, thought, there, was, no, need, ., influenza, was, not, even, endemic, ., itwas, optional, ., with, couid, ,, it, is, different, ., do, not, want, die, catching, disease, while, working, ,, so, I, shall, take, any, booster, ,, be, it, ith, or, yearly, ."
2332,"pfizer, drops, after, issuing, weaker, two thousand and twenty-two, outlook, ,, dragging, couid, -, nineteen, vaccine, makers, modern, novavax, down, with, it, #, followforfollow"
2333,"over, five, or, youth, received, first, dose, couid, -, nineteen, vaccine, jabs, :, union, minister, masuka, mandaviya"
2334,"syringe, about, sixteen, million, seventy-seven, %, sri, lankan, have, gotten, at, least, one, vaccine, dose, so, far, i, total, vaccinations, :, thirty-six, ,, five hundred and eighty-one, ,, five hundred, i, fully, vaccinated, :, fourteen, ,, fifteen, ,, one hundred and forty-five, i, daily, vaccinations, :, one hundred and twenty-two, ,, eight hundred and sixty-four, ~, Sri_Lanka, status, id, seven hundred and nine, ~"
2335,"Lockdown, withdrawn, on, Sunday, ;, State, returns, to, normal, i, #, corona, #, coronavirus, #, omicron, #, couid, #, covidvaccine, #, kerala"
2336,"gujaratis, has, today, made, a, significant, achievement, in, the, fight, against, Corona, virus, ., With, ten, crore, couid, -, nineteen, vaccines, ,, gujaratis, is, going, stronger, than, ever, ., #, 10cr_vaccine_gujarat"
2337,"couid, -, nineteen, :, over, five, crore, adolescents, administered, first, dose, vaccine, ,, says, masuka, mandaviya"
2338,"pfizer, increases, two thousand and twenty-two, revenue, prediction, couid, -, nineteen, vaccine"
2339,"#, covid19, #, covid19ireland, #, covidー19, #, coviduk, #, covidbriefing, #, covid19vaccine, #, covidvaccine, #, greatest, #, vaccinepassports, final, tech, report, la, quinoa, column, detection, graphene, ovoid, vaccines, ., edf, is, italian, :"
2340,"our, teams, like, always, are, reaching, every, corner, islamabad, ., we, take, pride, at, being, forefront, making, sure, that, no, one, is, left, behind, our, battle, against, couid, -, nineteen, ., round_pushpintesting, being, held, at, ass, maria, enclave, islamabad, ., #, corona, #, vaccines, #, couid, -, nineteen, #, makeup"
2341,"if, people, insist, freedom, ,, businesses, also, should, have, freedom, refuse, them, ., it, goes, both, ways, ., do, not, want, vaccine, sign, do, not, treat, waiver, ., if, you, do, get, couid, ,, stay, home, take, ivermectin, do, not, be, burden, health, workers, who, you, hate, anyway, ."
2342,"#, gujaratis, has, done, inevitable, ten, crore, #, couid, -, nineteen, vaccine, doses, administered, ., congratulations, all, citizens, this, amazing, feat, ., #, 10cr_vaccine_gujarat, #, 100hum_bhatt"
2343,"malone, has, promoted, misinformation, about, safety, efficacy, couid, -, nineteen, vaccines"
2344,"one hundred and forty, ams, long, truckers, stir, canada, against, couid, vaccine, mandate"
2345,"canada, am, justin, trudeau, truck, drivers, protest, emergency, ottawa, against, couid, restrictions, vaccine, ann, |, canada, protest, :, am, trudeau, on, truck, drivers, protest"
2346,"getting, vaccines, into, arms, remains, huge, challenge, policymakers, public, health, experts, as, we, struggle, manage, couid, -, nineteen, prepare, next, pandemic, ., this, front, ,, brazil, i, i, experience, can, offer, some, compelling, relevant, guidance, ."
2347,"vaccines, couid, all, free, ., paid, somehow, ,, just, not, by, recipient"
2348,"passengers, age, eighteen, years, above, who, received, couid, -, nineteen, vaccine, second, dose, more, than, eight, months, ago, have, not, received, booster, /, third, dose, vaccine, will, not, be, allowed, travel, saudi, arabia, ., booster, dose, is, available, free, pakistan, passengers, going, abroad, ."
2349,"#, ass, #, hindutva, virus, is, spreading, more, rapidly, india, ., presently, daily, cases, are, increasing, karnataka, worry, some, manner, &, amp, ;, said, be, more, dangerous, than, ., only, vaccine, available, is, vote, against, #, bop, #, couid, #, omicron, #, highbrow, #, rss_terrorists"
2350,"at, sixty-seven, ,, five hundred and ninety-seven, ,, india, reports, nineteen, %, decline, new, couid, cases, -, window, news, #, newdelhi, #, india, #, covidvaccine"
2351,"gujaratis, has, done, what, seemed, impossible, ., ten, crore, couid, -, nineteen, vaccine, doses, we, are, applied, ., Congratulations, to, all, the, citizens, for, this, wonderful, achievement, ., #, 10cr_vaccine_gujarat"
2352,"if, kids, are, called, huge, numbers, ,, they, could, be, carriers, couid, ., most, students, have, younger, siblings, not, eligible, vaccine, elderly, at, home, ., the, elderly, is, vaccinated, but, still, at, high, risk, death, virus, ., #, modijihelpboardstudents"
2353,"couid, -, losing, ,, gujaratis, -, winning, ., #, 10cr_vaccine_gujarat"
2354,"#, fifty-three, corona, positive, found, in, jargon, district, today, ., #, stanhope, #, waragainstvirus, #, covidvaccine, #, breakthechain"
2355,"protests, canada, over, vaccine, mandate, couid, curbs, continue, ., parliament, holds, emergency, session, end, blockade, ., brings, you, this, report, #, wioninukraine, watch, more, :"
2356,"hospital, director, israel, says, eighty, %, serious, couid, -, nineteen, cases, had, received, at, least, three, shots, couid, vaccines, video"
2357,"appointment, ith, dose, pfizer, couid, -, nineteen, vaccine, ., syringesyringesyringesyringe, #, we, must, survive, @, Nonthaburi, Province"
2358,"what, we, are, reading, :, couid, -, nineteen, wastewater, monitoring, ;, vaccine, dose, intervals, ;, urban, air, pollution, -, managed, markets, network, #, health"
2359,"hong, kong, expands, vaccine, mandate, amid, record, couid, -, nineteen, outbreak, new, restrictions, expand, vaccine, mandate, due, be, implemented, feb, ., twentyfour, that, already, covered, venues, like, restaurants, gyms, ., #, global, by, #, thewallstreetjournal"
2360,"around, one, ., seventeen, million, sri, lankan, over, age, twenty, have, not, taken, even, single, dose, couid, -, nineteen, vaccine, ,, state, ministry, home, affairs, official, said, ."
2361,"pfizer, ', i, two thousand and twenty-one, profits, doubled, us, $, twenty-two, billion, strong, couid, -, nineteen, vaccine, sales"
2362,"#, icer, has, received, royalty, i, one hundred and seventy-one, ., seventy-four, crore, till, just, january, ,, two thousand and twenty-two, #, bharatbiotech, sales, couid, -, nineteen, vaccine, coaxing, ., council, has, spent, around, i, thirty-five, crore, research, development, #, coaxing, ,, writes"
2363,"', couid, spread, showing, sustained, decline, ,, over, five, or, youths, jabbed, with, est, dose, vaccine, i"
2364,"well, done, india, over, five, crore, children, between, age, group, fifteen, -, eighteen, get, first, dose, couid, vaccine, ., govt, under, am, ji, is, proactively, fighting, against, couid, ."
2365,"pfizer, expects, sales, $, ninety-eight, billion, i, one hundred and two, billion, two thousand and twenty-two, :, report, #, couid, #, pfizer, #, profit, #, vaccine"
2366,"pfizer, forecasts, $, fifty-four, billion, coronavirus, -, related, sales, two thousand and twenty-two, it, is, couid, vaccine, anti, -, viral, pill, ."
2367,"scientists, develop, universal, couid, vaccine, ;, may, work, against, all, future, variants, -, times, now"
2368,"pfizer, couid, vaccine, ,, pill, forecasts, miss, estimates, ,, shares, fall, four, %, #, fitness"
2369,"pfizer, ', i, two thousand and twenty-one, profits, doubled, $, ibn, strong, couid, vaccine, sales, follow, our, updates, #, coronavirus, here, :"
2370,"syringe, about, sixteen, million, seventy-seven, %, sri, lankan, have, gotten, at, least, one, vaccine, dose, so, far, i, total, vaccinations, :, thirty-six, ,, five hundred and eighty-one, ,, five hundred, i, fully, vaccinated, :, fourteen, ,, fifteen, ,, one hundred and forty-five, i, daily, vaccinations, :, one hundred and twenty-two, ,, eight hundred and sixty-four, ~, Sri_Lanka, status, id, eight hundred and sixty-eight, ~"
2371,"children, do, not, need, vaccine, first, place, ., their, physiology, protects, them, gives, them, very, mild, couid, ., same, physiology, makes, risks, vaccine, damage, higher, them, ."
2372,"ahmedabad, has, at, least, seven thousand, six hundred and ninety-six, new, slots, available, between, eight, -, two, -, twenty-two, &, amp, ;, fifteen, -, two, -, twenty-two, ., covishielTongue_sticking_out_cheeky_playful_or_blowing_a_raspberry, dose, -, eighteen, i, forty-five, i, nine hundred and ninety-nine, /, zero, dose, -, eighteen, i, forty-five, i, one thousand and three, /, zero, coaxing, :, dose, -, eighteen, i, forty-five, i, zero, /, zero, dose, -, eighteen, i, forty-five, i, zero, /, zero, book, one, now, at, #, vaccine, #, coin, #, couid, #, ahmedabad"
2373,"such, heinous, act, would, destroy, our, democratic, values, ., it, is, high, time, freedom, fight, against, facist, modi, govt, ., ass, slowly, ratifying, such, act, across, nation, ,, recently, coimbatore, ., they, are, more, deadlier, than, #, couid, we, should, also, get, anti, -, bop, vaccine, first, #, allahuakbar"
2374,"pfizer, stock, falls, after, profit, beats, but, revenue, misses, ,, even, as, couid, -, nineteen, vaccine, sales, $, twelve, ., five, billion, top, forecasts"
2375,"over, five, crore, children, aged, between, fifteen, -, eighteen, years, have, received, first, dose, vaccine, ., #, covidvaccine, #, vaccinationdrive"
2376,"pfizer, said, tuesday, it, expects, $, thirty-two, billion, revenue, couid, -, nineteen, vaccines, two thousand and twenty-two, as, it, reported, annual, profits, had, more, than, doubled, $, twenty-two, billion, ., #, pfizer, #, covid19vaccine, #, revenue, #, annualprofits"
2377,"terribly, saddening, official, government, canada, data, suggests, fully, vaccinated, are, just, weeks, away, developing, acquired, immunodeficiency, syndrome, fully, vaccinated, canadians, are, developing, full, blown, couid, -, nineteen, vaccine, induced, acquired, immunodeficiency, syndrome, aids, one, /, two"
2378,"angry, canada, truckers, block, busiest, bridge, with, u, ., i, ., demand, end, couid, vaccine, mandates, cross, -, border, traffic"
2379,"over, five, crore, adolescents, administered, first, dose, couid, vaccine, :, masuka, mandaviya, #, adolescents, #, coviddose, #, healthminister, #, mansukhmandaviya, #, pandemic"
2380,"ap, corona, cases, :, one, ,, eight hundred and ninety-one, new, corona, cases, ,, five, deaths, ap, #, couid, #, covidvaccine, #, omicron, #, telugu, #, telugustop"
2381,"india, crosses, landmark, achievement, administering, more, than, one hundred and seventy, crore, couid, vaccines, ., but, fight, is, not, over, yet, keep, following, couid, appropriate, behaviour, every, time, you, step, out, ., #, indiafightscoronavirus"
2382,"want, take, precautions, against, omicron, #, omicronvarient, #, couid, -, nineteen, #, coronavirus, #, vaccine, #, flu, #, fever, #, cough, #, cold, #, sastasundar"
2383,"long, lasting, gastro, -, intestinal, disturbances, following, couid, treatment, with, antibiotics, fully, vaccinated, people, ., is, it, vaccine, that, has, triggered, changes, gut, microbiome, ,, or, is, it, famous, antibiotic, connected, disturbances, but, those, usually, do, not, last, that, long, ..."
2384,"twenty, ,, three hundred and sixty-two, doses, couid, -, nineteen, vaccine, administereTongue_sticking_out_cheeky_playful_or_blowing_a_raspberry, mohan, #, sharjah24"
2385,"In, my, office, ,, there, is, a, group, of, people, who, are, afraid, of, not, taking, the, vaccine, because, of, side, effects, ., side, effects, couid, tak, fakir, kulak"
2386,"novavax, underdelivers, couid, vaccine, promises, follow, our, updates, #, coronavirus, here, :"
2387,"lancet, study, claim, i, this, is, something, that, protects, you, seriousness, couid, ., lancet, study, claims, that, vaccine, protects, loved, becoming, serious"
2388,"#, who, #, covid19, #, couid, #, covid_19, #, covidvaccine, #, covidtesting, #, coronavirus, #, corona, #, coronavirusupdates, mortality, rate, due, virus, is, peak, ,, ply, follow, last, two, months, no, crowd, or, death, is, fix, ., jai, hind, India"
2389,"masuka, mandaviya, :, over, five, crore, adolescents, administered, first, dose, couid, vaccine, :, masuka, mandaviya"
2390,"over, five, crore, adolescents, administered, first, dose, #, couid, vaccine, :, #, mansukhmandaviya, #, covid19, #, covid19vaccination, #, covidvaccine, #, covaxinforkids, #, covaxin4kids, #, coaxing"
2391,"teaching, ,, non, -, teaching, &, amp, ;, support, staff, must, have, been, fully, vaccinated, i, ., e, ., two, doses, couid, -, nineteen, vaccine, ., school, management, should, be, impressed, upon, take, utmost, care, small, kids, ."
2392,"today, my, facebook, wall, was, flooded, with, anti, vaccine, posts, about, children, screaming, struggling, &, amp, ;, forced, take, vaccine, ., I, am, surprised, they, we, are, more, concerned, about, this, than, with, "", long, couid, "", maybe, can, add, more, about, cardiovascular, complication, long, covidthumbs_up"
2393,"i, never, said, it, works, couid, ., he, did, all, those, monoclonal, antibodies, thing, did, different, things, right, ., I, am, not, saying, take, i'm, ., nor, did, organ, did, ., organ, did, not, even, say, do, not, take, vaccine, ."
2394,"greece, will, not, require, couid, nineteen, tests, european, vaccine, certificate, holders, read, more, :"
2395,"over, five, crore, adolescents, administered, first, dose, couid, vaccine, :, union, health, minister, #, covid19, #, covidvaccines"
2396,"over, five, crore, total, eligible, beneficiaries, fifteen, -, eighteen, age, group, have, received, their, first, dose, vaccines, against, #, covid19, ., as, per, #, coin, portal, ,, total, five, ,, ninety-three, ,, thirty-six, ,, eight hundred and sixty-one, youngsters, have, been, so, far, administered, first, dose, #, couid, vaccines, ."
2397,"over, five, crore, total, eligible, beneficiaries, fifteen, -, eighteen, age, group, have, received, their, first, dose, vaccines, against, couid, -, nineteen, ., as, per, coin, portal, ,, total, five, ,, ninety-three, ,, thirty-six, ,, eight hundred and sixty-one, youngsters, have, been, so, far, administered, #, ommcomnews"
2398,"congratulations, pakistan, administering, over, two, million, couid, -, nineteen, vaccine, doses, yesterday, ., we, pakistan, ,, do, tabitha, mahipala, commends, pakistan, this, achievement, &, amp, ;, looks, forward, when, everyone, is, vaccinated, against, couid, -, nineteen, virus, ."
2399,"In, the, early, days, of, this, new, year, ,, make, sure, you, are, getting, vaccinated, and, being, cyber, aware, ., #, couid, #, vaccines, #, being, #, cyber, #, awareness, #, biker, #, rajasthan, #, police"
2400,"is, fifteen, +, couid, vaccine, walk, basis"
2401,"Effectiveness, of, couid, -, nineteen, vaccine, strategy, in, Vietnam"
2402,"never, refused, any, vaccine, for, children, ., oilman, every, time, a, checkup, gets, vaccinated, ,, i, am, pro, vac, but, you, can, i, i, say, like, these, people, who, are, traumatized, couid, vaccine, because, there, is, a, family, member, who, is, sick, after, the, vaccine, ., My, sister, has, leukemia, ,, not, a, common, illness, ."
2403,"Today, I, came, to, work, for, questioning, due, to, a, fever, for, three, days, since, Saturday, ., doctor, take, cop, apa, ,, couid, test, pun, negative, ., good, day, je, healthy, ,, night, start, fever, back, loudly_crying_face, after, vaccine, antibody, continues, to, be, weak, to, cane, ., It, is, easy, to, have, a, fever, ."
2404,"vaccine, protection, better, maintained, against, severe, couid, -, nineteen, :, lancet, study, i, et, healthworld"
2405,"ummah, pilgrims, are, required, take, couid, -, nineteen, vaccine, booster, dose, under, new, standard, operating, procedures, sops"
2406,"maximum, amount, was, spent, procuring, sixty-six, million, couid, -, nineteen, vaccine, doses, ,, nearly, i, one, ,, three hundred and ninety-two, crores, thirty-five, per, cent, ., second, highest, was, spent, buying, domestically, manufactured, ventilators, amid, pandemic, chaos, ."
2407,"baht, sari, hai, double, engine, ki, sarkar, mare, huge, ko, bhi, couid, vaccine, taki, corona, na, file, ."
2408,"#, pfizer, said, tuesday, it, expects, $, thirty-two, billion, revenue, couid, -, nineteen, vaccines, two thousand and twenty-two, as, it, reported, annual, #, profits, had, more, than, doubled, $, twenty-two, billion, ."
2409,"first, dose, vaccination, was, given, students, successfully, ., vaccination, drive, at, #, alphaclasseshandwara, #, hardware, #, covidvaccine, #, vaccine"
2410,"pal, who, does, not, want, to, get, vaccines, protest, streets, should, be, left, their, own, ,, because, you, know, why, couid, should, fuck, up, their, life, ., i, hope, others, do, not, get, affected, by, their, stubborness, their, obsession, with, their, beliefs, ."
2411,"hiv, is, sexually, transmitted, infection, or, by, couid, vaccine"
2412,"couid, se, yada, ski, vaccine, ka, hard, fel, aha, haiclown_face"
2413,"us, pre, -, market, updatenewspaper, :, bar_chartus, futures, trading, flat, ahead, big, corporate, earnings, inflation, report, ., pill, #, pfizer, expecting, $, fifty-four, billion, revenue, two thousand and twenty-two, couid, vaccine, &, amp, ;, treatment, pill, sparrow, i, the, ten, -, year, u, ., i, ., treasury, yield, rose, one, ., ninety-four, i, as, investors, turn, focus, inflation, data, ."
2414,"i, think, people, should, adapt, this, couid, life, now, ,, all, those, vaccine, booster, shoot, is, not, just, fun, ., sure, that, is, proven, will, stop, couid, get, worse, that, is, why, we, inject, it, ., I, am, more, afraid, salary, deduction, than, couid, ., because, everything, now, is, money, ."
2415,"alhamdulillah, with, izin, allah, this, vaccine, helps, reduce, impact, couid, i, please, remeber, hide, mati, shat, skit, is, all, kuala, allah, i, bukan, alas, ten, doktor, ats, ten, vain, i, but, kita, danusia, keen, la, sara, i, i, vaccine, is, one, it"
2416,"she, created, new, couid, vaccine, i, now, she, i, i, up, nobel, peace, prize"
2417,"read, the, comment, on, fu, "", some, of, the, booster, friends, still, have, couid, i, Aunt, and, uncle, ,, we, have, been, facing, couid, for, two, years, ., amid, vaccine, &, amp, ;, The, booster, will, not, hit, directly, ., but, once, destined, for, you, +, ve, ,, the, symptoms, are, not, as, bad, as, an, vaccinated, person, ., flu, betel, nak, kai, bukannya, do, post, fu, hugging_face"
2418,"i, have, eighty, +, aged, grandmother, who, has, not, taken, couid, vaccine, because, do, has, advised, her, not, ., she, is, more, vulnerable, couid, than, me, if, i, come, contact, with, couid, carrier, who, is, going, take, responsibility, if, that, situation, arises, #, mims"
2419,"couid, third, wave, ended, telangana, i, do, srinivas, rao, ,, health, director, i, telangana, #, couid, #, covidvaccine, #, dhsrinivasrao, #, omicron, #, telaganacovid, #, telugu, #, telugustop"
2420,"yeah, ., i, scream, bike, rides, ., with, so, much, nonsense, world, like, people, thinking, couid, vaccines, are, conspiracy, etc, ., ,, one, has, let, out, steam, some, way, face_with_tears_of_joyface_with_tears_of_joyface_with_tears_of_joy"
2421,""", highest, daily, vaccine, doses, administered, yesterday, pakistan, over, two, million, "", do, ., faisal, sultan, tweet, #, coronavirusupdates, #, covid_19, #, pakistan"
2422,"twenty, ,, three hundred and sixty-two, doses, couid, -, nineteen, vaccine, administered, past, twentyfour, hours, :, mohan"
2423,"est, dose, :, sixty-eight, ., twenty-seven, %, and, dose, :, fifty-two, ., forty-three, %, vaccines, :, coaxing, ,, oxford, /, astrazeneca, ,, sputnik, i, total, est, dose, :, nine hundred and fifty-one million, two hundred and sixty-three thousand, eight hundred and sixteen, +, fifty thousand, six hundred and thirty-nine, total, and, dose, :, seven hundred and thirty million, six hundred and twenty-seven thousand, one hundred and two, +, ninety-four thousand, six hundred and two"
2424,"seriously, air, asia, can, fly, couid, also, can, fly, almost, ask, kut, ..., kegilaan, ape, yg, sedang, melinda, malaysia, ni, #, kkmgagal, #, prayformalaysia, #, covidvaccine, #, stupid, #, kitajagakita, #, awaninews, #, kerajaangagal"
2425,"i, have, received, third, dose, couid, -, nineteen, vaccine, ,, i, advise, our, dear, people, do, what, our, experts, physicians, believe, is, necessary, ., #, proudlyiranian"
2426,"$, fifty-four, billion, two thousand and twenty-two, sales, couid, vaccine, treatment, pill, ."
2427,"Health, Minister, gave, big, information, on, vaccination, of, children, up, to, fifteen, years, #, mansukhmandaviya, #, vaccinationofchildren, #, covidvaccine, #, nationalnews, #, punjabkesari"
2428,"pfizer, expects, $, fifty-four, billion, two thousand and twenty-two, sales, couid, vaccine"
2429,"forty-five, +, #, bump, #, bengaluru, #, covidvaccine, availability, eight, /, two, at, 05Happy_face_smiley0pm, free, slots, zero, paid, slots, zero"
2430,"forty-five, +, #, urban, #, bengaluru, #, covidvaccine, availability, eight, /, two, at, 05Happy_face_smiley0pm, free, slots, zero, paid, slots, zero"
2431,"forty-five, +, #, rural, #, bengaluru, #, covidvaccine, availability, eight, /, two, at, 05Happy_face_smiley0pm, free, slots, zero, paid, slots, zero"
2432,"over, five, or, youth, received, first, dose, couid, -, nineteen, vaccine, jabs, :, masuka, mandaviya, read, story, |, #, covidvaccine, #, mansukhmandaviya"
2433,"over, five, or, youth, received, first, dose, couid, -, nineteen, vaccine, jabs, :, masuka, mandaviya, #, couid, #, covid19, #, covidvaccine, #, coronavaccine, #, vaccine, #, firstdose, #, mansukhmandaviya"
