,0
10355,"male, child, up, adoption, ., age, -, five, years, ,, vaccinated, red_heart, i"
10356,"i, just, want, be, vaccinated, ., frowning_face, i, frowning_face, i, frowning_face, i"
10357,"Sitting, in, the, line, of, the, deities, ,, silently, drinking, the, nectar, ,, watch, the, auras, carefully, ., #, vaccinated"
10358,"saturday, nights, are, much, better, then, sunday, nights, ,, is, not, it, ., ., ., click, here, check, out, my, instagram, follow, amazing, content, -, #, sundayvibes, #, sundayfeels, #, weekendvibes, #, coffee, #, break, #, coffeelover, #, stanhope, #, staysail, #, covid19, #, couid, #, vaccinated"
10359,"that, i, i, good, see, ., i, think, it, dipped, ~, sixty-five, %, when, rumour, mill, was, at, it, is, peak, with, misinformation, ,, maybe, one, -, two, months, back, ., still, ,, seventy, %, willing, doesn, i, i, translate, real, world, seventy, %, actually, vaccinated, ,, given, we, don, i, i, yet, have, vaccine, approved, under, is, ."
10360,"i, guess, has, already, started, vaccinating, it, is, delivery, partners, now, while, you, order, food, app, shows, if, delivery, partner, is, vaccinated, or, not"
10361,"vaccinated, syringe, i, est, check, pointround_pushpin, #, stayhomestaysafe, #, vaccinated"
10362,"asked, wave, is, anticipating, next, six, -, was, only, option, left, all, age, groups, #, vaccineforall, or, atleast, sizeable, number, population, are, vaccinated, #, fight, against, ord, wave, saysaiims, chief, ,, now, onus, is, onthe, people, adhere, strictly, accordance, withthe, guidelines"
10363,"i, got, vaccinated, #, vaccinated, #, gotthedose, #, forme, #, formyfamily, #, formycountry"
10364,"now, ,, we, i, re, talking, by, creating, fully, -, vaccinated, guideline, ,, it, i, all, create, extra, incentives, those, vaccines, hesitancy, anthrax, group, ,, which, is, one, barriers, us, achieve, herd, immunity, ., after, one, day, releasing, this, ,, see, how, registration, vaccine, rocket"
10365,"#, shotsofsafety, ply, take, your, shot, safety, ., folded_handslight_skin_tone, vaccine, is, safe, ., go, vaccinated, ."
10366,"phew, finally, got, vaccinated, first, dose"
10367,"is, it, how, one, is, going, overcome, couid, today, ,, us, is, better, placed, because, they, vaccinated, ., china, vaccinates, ., they, are, safe, ."
10368,"saidi, high, school, ,, with, it, is, vision, #, transformationoflives, ,, requests, parents, get, vaccinated, ., our, mission, is, that, parents, family, members, saidi, high, school, should, get, vaccinated, before, mild, mubarak, sedna, taher, saifuddin, ra, #, proudtobesaifiyan"
10369,"hope, getting, rid, this, pandemic, let, us, stay, save, i, get, vaccinated, ..., #, ncocfightingfornation"
10370,"let, us, take, moment, appreciate, these, efforts, made, by, ncos, let, us, stay, safe, vaccinated, ..., #, ncocfightingfornation"
10371,"with, our, collective, &, amp, ;, efforts, we, shall, end, this, #, pandemic, ensure, everyone, follows, all, #, covid19, appropriate, behaviour, everywhere, ,, every, time, ., face_with_medical_maskgirlmedium, -, light_skin_tone, ---, manlight_skin_tonesoap, also, get, yourself, vaccinated, at, earliest, ., syringesyringe, #, patent_free_vaccine"
10372,"not, even, vaccinated, everyone, now, our, am, saab, is, getting, ready, say, cheers, third, wave, by, unlocking, everything, #, farmhouse"
10373,"kindly, get, yourselves, vaccinated, against, couid, -, nineteen, do, not, believe, any, kind, rumours"
10374,"#, vaccinated, #, covidshieldvscovaxin, india, fight, against, #, covid_19, @, mass"
10375,"day, our, vaccination, drive, seven hundred, +, people, vaccinated"
10376,"yay, #, thailandtourism, is, reopening, it, is, door, through, #, pushed, est, jul, ,, twentynine, ., thailand, has, announced, it, is, plan, reopen, phuket, july, one, ., as, experiment, they, are, reopening, pushed, under, sandbox, program, which, allows, fully, vaccinated, travellers, phuket, ."
10377,"everyone, had, return, without, getting, vaccinated, despite, having, their, slots, booked, ,, me, included, ., booking, slots, online, itself, is, difficulty, people, like, them, are, adding, up, it, ., please, take, proper, action, ,, vaccine, is, important, ."
10378,"your, highness, ,, thank, you, opening, up, safe, travel, corridor, many, countries, ,, request, you, look, into, stranded, non, vaccinated, use, residents, india, ., let, them, be, institutional, quarantine"
10379,"mam, ,, please, make, arrangments, free, vaccine, camp, various, frontline, workers, noid, -, maids, ,, guards, ,, other, workers, ., they, need, be, vaccinated, ., folded_handslight_skin_tone, #, noid, #, greaternoidawest"
10380,"let, us, get, vaccinated, break, chain, ., issued, public, interest, by, directorate, health, family, welfare, services, ,, puducherry, #, pondyfightscorona"
10381,"#, rajasthan, #, coronaupdate, :, one hundred and forty-four, #, covid19, cases, reported, out, which, thirty, #, jaipur, today, ', i, #, recoveredcheck_mark_button512, 𝐃𝐚𝐢𝐥𝐲, 𝐧𝐞𝐰, 𝐜𝐚𝐬𝐞𝐬, 𝐚𝐫𝐞, 𝐥𝐨𝐰𝐞𝐬𝐭, 𝐚𝐟𝐭𝐞𝐫, 𝐌𝐚𝐫𝐜𝐡, two, ply, keep, following, #, covidappropriatebehaviour, &, amp, ;, get, yourself, vaccinatedsyringe, #, wearamask, person_standing__person_standinglotion_bottleraising_handshouse"
10382,"encourage, others, stay, vaccinated, ..., be, responsible, as, nation, #, ncocfightingfornation"
10383,"welcome, fully, vaccinated, tribe"
10384,"get, yourself, vaccinated, ., ignore, rumours, ., it, is, our, duty, make, healthy, pakistan, together, ., #, ncocfightingfornation"
10385,"just, vaccinated, plese, do, not, miss, vaccination, your, turn"
10386,"I, am, this, pinched_fingerslight_skin_tone, close, not, get, myself, vaccinated, ..., no, update, till, ', now, i, just, kidding, cat_with_tears_of_joy, cannot, wait, my, turn, smiling_face_with_smiling_eyes"
10387,"i, i, i, vaccinated, est, dose, check_mark_button, #, cucukmyaz, #, cucukmyazpwtc, @, puta, world, trade, centre"
10388,"four, /, six, members, my, family, da, vaccinated, syringe, wuhuuuuuuu, ., this, wednesday, ., Bro, wait, for, an, appointment"
10389,"finally, vaccinated, victory_hand"
10390,"health, care, workers, have, been, at, forefront, fight, against, couid, -, nineteen, be, first, be, vaccinated, ., #, pakistanmovingforward, #, profanation, Pakistanheart_suit, i"
10391,"still, binge, watching, criminal, minds, -, I, am, only, so, ,, there, are, fifteen, satu, kali, mask, twitter, punch, certa, faraway, ., thinking_face, let, us, see, how, much, more, this, blow, up, ., meantime, ,, i, hope, everyone, gets, vaccinated, asap, ,, bukan, leaps, parliament, yuka, ."
10392,"dear, dheeraj, tiwari, ,, you, have, successfully, been, vaccinated, with, your, est, dose, ..."
10393,"when, air, travels, some, countries, are, relaxing, ,, coaxing, vaccinated, people, still, don, i, i, have, any, idea, when, would, we, allowed, travel, ., can, you, leave, provide, data, asked, by, usda, ."
10394,"i, have, been, suffering, high, fever, since, day, i, got, vaccinated, ., i, have, severe, body, aches"
10395,"#, bihar, :, over, one, ., thirty-two, crore, people, vaccinated, so, far, ., out, these, ,, thirty-three, lakh, sixty-four, thousand, are, age, group, eighteen, forty-four, years, ."
10396,"getting, #, vaccinated, is, key, step, towards, defeating, this, #, covid19, pandemic, contribute, india, ', i, fight, against, #, covid19, by, writing, blog, encourage, people, overcome, vaccine, hesitancy, ., visit, :, #, indiafightscorona"
10397,"thank, ', i, your, timely, support, ....., but, now, help, us, all, get, vaccinated, ...., most, them, do, not, know, how, register, online, ....."
10398,"first, dose, done, check_mark_button, be, vaccinated, syringe, stay, safe, everyone, folded_hands, #, covid19vaccine, #, staysail"
10399,"got, vaccinated, syringe, pleading_face"
10400,"#, takeusbacktochina, #, china, if, we, are, vaccinated, then, why, we, are, not, china, ...., if, they, are, not, allowing, foreigners, then, why, they, took, admission, ', i, two thousand and twenty, -, two thousand and twenty-one, ...., it, is, not, fair, they, are, playing, with, our, future"
10401,"you, can, see, what, i, i, happening, uk, now, ,, eighty, %, population, got, vaccinated, but, they, i, re, seeing, ten, ,, zero, cases, now, ., other, measures, need, be, place, as, well"
10402,"#, vaccinated, took, my, est, dose, ., thank, you, goes"
10403,"sir, this, govt, is, not, lenient, ,, rather, officers, operating, system, do, not, have, their, own, model, focus, reducing, cases, increase, vaccination, ., simply, make, vaccination, compulsory, only, vaccinated, people, may, get, chance, come, out, with, minimum, mask, sanitizer, ."
10404,"if, ur, not, vaccinated, u, should, not, be, allowed"
10405,"i, am, vaccinated, ., thank, you, ..."
10406,"got, vaccinated, victory_handmedium_skin_tone, ., ., ., ., ., ., ., ., ., #, vaccinated, #, shotoniphone"
10407,"my, mother, got, second, dose, @, dahsak, vaccination, centre, ., great, arrangement, ., thanks, all, process, ., folded_handsfolded_handsfolded_hands, #, vaccinationdrive, #, indiafightscorona, request, all, those, eligible, get, vaccinated, at, earliest, ."
10408,"remember, how, australia, really, should, have, had, communicated, clear, incentives, get, vaccinated, well, ,, they, really, should, have, had, some, incentives, ., like, avoiding, border, closures, ,, or, perhaps, even, lesser, quarantine, ., but, thus, far, i"
10409,"the, i, u, #, vaccinated, est, dos, check_mark_button"
10410,"first, dose, syringecheck_mark_button, got, vaccinated, under, ten, minutes, after, i, have, arrived, at, pav"
10411,"construction, site, workers, at, nagar, chandivili, vaccinated, by, builder, ., planet, yowai, newspaper, with, june, two thousand and twenty-one, ., read, full, paper, -, #, foodtherapybyavanee, i, nutritionist, #, kayshealthysweets, i, restaurant, #, rotarylakers, i, nonprofit, organization"
10412,"what, i, i, antivaxers, theory, not, getting, vaccinated, i, i, i, really, curious, ."
10413,"having, serious, think, about, heading, back, uk, till, november, ,, get, vaccinated, fully, ,, see, family, ,, do, few, odd, jobs, come, back, time, do, my, visa, extension, december, ., getting, bit, pissed, off, sitting, around, waiting, things, happen, here, ."
10414,"#, vaccinated, #, covid19vaccination"
10415,"There, is, no, vaccine, in, Bangladesh, and, in, India, a, woman, was, vaccinated, by, two, companies, in, five, minutes, ., What, a, strange, place, #, covid19, #, vaccinated, #, vaccination"
10416,"sir, my, brother, need, go, back, dubai, so, need, be, vaccinated, with, only, approved, dosage, ., sir, is, it, possible, get, any, these, vaccination, ., need, amritsar, ., sir, i, requesting, you, coz, non, these, available, amritsar, ."
10417,"home, be, vaccinated"
10418,"have, do, sahib, got, everyone, vaccinated, district, before, he, decided, do, this, risky, photo, -, op"
10419,"let, i, i, be, honest, ,, this, whole, lockdown, whatever, you, want, to, call, it, is, not, working, ., cases, aren, i, i, dropping, only, way, we, can, eradicate, this, problem, is, when, everyone, gets, vaccinated, ."
10420,"thank, you, india, indian, scientist, indian, prime, minister, feeling, proud, be, hindustani, vaccinated, today, loved, -, nineteen, vaccine, manufactured, india"
10421,"very, unfunfortunate, decision, without, any, concern, life, ., get, all, people, vaccinated, fully, ,, put, down, some, guidelines, schools, then, allow, ..., we, seem, be, racing, third, wave, i, what, is, hurry, opening, schools, bow"
10422,"i, am, vaccinated, thank, you"
10423,"one, ., five, million, fully, vaccinated, so, far, malaysia, Malaysia"
10424,"no, political, leader, ,, administrator, or, doctor, can, save, indisciplined, society, ., unfortunately, ,, we, india, are, highly, indisciplined, ., we, do, not, follow, rules, do, not, wear, mask, do, not, stop, gathering, save, yourself, &, amp, ;, your, family, ,, follow, #, couid, appropriate, behaviour, ,, get, vaccinated, ."
10425,"completely, agreed, first, get, those, who, are, yet, be, vaccinated, jab, list"
10426,"Take, the, corona, vaccine, yourself, and, make, others, aware, too, ,, with, your, efforts, ,, we, all, try, to, be, corona, free, ,, our, India, i, #, vaccinationdrive, #, vaccinated"
10427,"ord, wave, incoming, microbe, #, couid, #, vaccinated, #, covid19"
10428,"thank, you, modi, ji, i, i, am, vaccinated, i"
10429,"opposition, parties, including, upa, prevented, poor, citizens, not, get, vaccinated, ., now, advices, use, it, ."
10430,"sir, to, is, doing, great, job, controlling, couid, ,, two, prevent, more, waves, &, amp, ;, not, effect, daily, lives, biz, shud, i, allowed, as, normal, with, strict, so, rules, till, sizeable, population, is, vaccinated, ., only, by, coming, down, heavily, so, defaulters, this, be, controlled"
10431,"tamil, nada, :, salon, madurai, offers, fifty, %, discount, customers, coming, with, their, #, covid19, vaccination, certificates, salon, ', i, owner, karthikeyan, says, ,, "", we, offer, fifty, %, off, vaccinated, customers, raise, awareness, about, vaccine, ., we, should, be, vaccinated, avoid, ord, wave, """
10432,"vaccinated, pal, have, stay, phuket, fourteen, days, i, not, seven, days, i, before, they, can, travel, other, parts, thailand, ., they, also, have, get, tested, four, times, couid, before, during, trip, ., not, usual, holiday, experience, ., I, am, wondering, how, many, people, actually, come, ."
10433,"couid, -, nineteen, vaccinated"
10434,"Good, morning, indian, i, May, you, have, a, blessed, day, with, the, grace, of, Mother, bhagat, #, sundayvibes, #, covid_19, #, vaccinated, #, drug, free, family, Happy, India, #, breakingnews"
10435,"I, am, ready, be, vaccinated, next, week, at, pav, butit, jail, istvan, blah, dot, dot, kick, crying_facelol"
10436,"successfully, vaccinated, with, coaxing, and, dose, victory_hand, i, i, request, everyone, take, your, vaccine, when, your, turn, comessyringe, ., I, am, thankful, best, arrangements, ."
10437,"#, neet, one, ., conduct, neet, is, topic, that, experts, need, think, debate, come, conclusion, ., but, yes, ,, surya, ', i, comment, can, trigger, much, needed, debate, ., two, ., but, conduct, any, exam, offline, until, students, are, vaccinated, ,, be, invitation, corona, #, neet"
10438,"sir, ,, opening, schools, is, not, wise, current, situation, ,, as, kids, are, not, yet, vaccinated, ., we, want, continue, with, online, schools, ., is, it, going, be, optional, #, telangana, schools, unlock, #, schoolsreopen, #, kir"
10439,"how, many, have, been, fully, vaccinated, as, %, population, that, is, yardstick, which, all, countries, are, reporting, ."
10440,"Praise, be, to, God, ,, my, mother, and, uncle, and, aunt, have, been, vaccinated, #, vaccinated, #, vaccinemalaysia"
10441,"whole, family, vaccinated, there, ., neatly, maintained, ."
10442,"myself, my, family, got, vaccinated, ..., thank, you, ji, your, efforts, ., you, are, true, karmayogi, i, you, are, inspiration, ."
10443,"when, your, friend, gets, vaccinated, without, youperson_shrugging, i, male_sign, i"
10444,"please, restart, direct, flights, india, international, students, ,, most, students, are, fully, vaccinated, #, resumedirectflights, we, are, ready, follow, all, guidelines, canada, government, about, couid, ., please, look, this, matter, #, resumedirectflights, #, opentheborder"
10445,"still, ok, no, bad, reaction, set, last, #, vaccinated, #, pfizer, seem, ,, jer, ', i, arm, is, still, a, little, numb, ,, I, hope, you, are, always, healthy, i, when, are, you, smiling_face_with_sunglasses"
10446,"did, u, get, vaccinated, recently, face_with_tonguewinking_face_with_tongue"
10447,"vaccinated, with, team, ., thank, you"
10448,"we, i, re, vaccinated"
10449,"you, receive, your, certificate, your, linked, mobile, number, with, dear, card, once, you, have, been, vaccinated, ."
10450,"also, what, has, up, forty-five, +, yrs, age, group, people, you, all, vaccinated, already, sad, see, such, low, numbers, even, when, everybody, saw, bottleneck, effect, during, march, /, april, pensive_facepensive_face, get, vaccinated, asap, guys, plus, #, vaccineswork, #, vaccinessavelives, #, vaccinationupdate"
10451,"good, decision, end, ., before, opening, all, educational, institutions, ., make, sure, all, staff, out, there, get, vaccinated, frequent, couid, test, before, students, step, in, ., this, is, only, way, u, can, be, restricted, ., start, this, aug, est, not, july, est, ."
10452,"#, vaccinated, #, indiafightscorona"
10453,"good, hear, this, ., hope, family, staffs, too, are, vaccinated"
10454,"want, travel, use, india, then, check, below, details, ,, emirates, flights, resumes, june, twenty-three, passengers, with, only, resident, visa, two, doses, vaccinated, be, allowed, travel, dubai, ."
10455,"so, ,, i, am, being, trolled, attacked, by, anti, -, baxters, anti, -, masters, ,, left, ,, right, centre, ,, calling, out, people, throwing, caution, wind, post, -, and, wave, not, getting, vaccinated, ., well, ,, bring, it, on, ., i, shall, keep, writing, ., because, my, writing, can, save, lives, ., #, getvaccinatedasap"
10456,"vaccinated, shield, mass, vaccination, center, at, fu, park, islamabad, is, place, if, you, want, avoid, crowd, long, waiting, lines, ., hats, off, team, well, -, managed, service, ., #, covid19vaccine, #, sinovac"
10457,"thanks, tamil, nada, government, central, government, giving, me, covid19, vaccination, ,, est, dose, such, crucial, time, ., let, me, confirm, my, vaccinated, certificate, ."
10458,"#, andhrapradesh, is, conducting, mega, #, vaccination, drive, tomorrow, with, june, two thousand and twenty-one, ., all, eligible, people, yet, get, vaccinated, can, go, nearest, vaccination, centre, with, govt, ., issued, photo, id, proof, get, themselves, vaccinated, ., #, apfightscorona, #, largestvaccinedrive"
10459,"though, I, am, already, plus, fabulous, ,, i, still, got, chances, be, top, ask, person, be, vaccinated, here, ..., tazabaaaar, yeeeah, smiling_face_with_hearts"
10460,"unless, until, sixty, %, public, is, fully, vaccinated, ,, fear, waves, not, subside"
10461,"we, are, already, prepared, after, taking, #, vaccination, ,, fifty, %, people, telangana, has, been, vaccinated, ."
10462,"Freedom, from, the, hassle, of, online, slot, booking, ., #, vaccinated, #, vaccination, #, vaccineforall"
10463,"sir, as, per, ur, permission, presently, rehab, inmates, are, vaccinated, at, their, centre, only, ., today, cash, management, office, approach, me, vaccinate, their, securities, their, premises, as, they, could, ', it, go, take, vaccinate, due, their, duty, atm, replenishment, ., need, your, permission"
10464,"hi, use, government, has, announced, flights, use, vaccinated, people, ,, could, you, plus, advise, when, u, able, open, booking, ."
10465,"completely, agree, ji, ., if, you, watch, video, closely, ,, so, many, people, are, shooting, video, ,, plus, it, is, edited, ., vaccination, masses, is, basic, ,, these, videos, should, be, shared, internally, within, such, officers, encourage, others, take, similar, steps, ., #, is, #, vaccinated"
10466,"year, +, vaccine, with, day, able, organised, as, well, as, collaboration, with, health, dept, goalpara, dist, vaccination, camp, at, new, goalpara, high, school, ended, well, ., twentynine, people, have, been, vaccinated, today, ., approximately, one thousand, three hundred and twenty, persons, had, been, vaccinated, till, now, ."
10467,"vaccinated, coaxing, syringe, @, chi, govt, ., hospital"
10468,"vaccinated, i, thank, all, proper, arrangement, ., whole, process, was, quite, well, organised, we, looked, after, #, vaccinated"
10469,"we, came, today, bangalore, carrying, our, roper, tests, no, one, at, kolkata, airport, even, asked, us, it, i, why, make, people, do, it, if, you, don, i, i, check, plus, we, we, are, all, double, vaccinated, please, look, into, this"
10470,""", when, he, compliments, your, nail, polish, ,, he, has, one, "", here, we, are, ,, only, you, providing, home, services, book, your, slots, contact, :, eight billion, three hundred and thirty-four million, nine hundred and twelve thousand, seven hundred and twenty-seven, #, nailpolish, #, nailsnail_polish, #, nailtrends, #, nailsonfleek, #, nailswag, #, vaccinated"
10471,"today, i, have, taken, first, dose, vaccine, covishield, ., vaccine, is, very, safe, ., feel, free, get, yourself, vaccinated, too, ., india, win, ,, corona, lose, #, vaccinationday2021, #, covishield1stdose, #, vaccinatedandhappy, #, vaccinateeveryindian"
10472,"take, your, immunity, next, level, backhand_index_pointing_down, heart_suit, i, eat, healthy, diet, get, flu, vaccination, get, active, routine, lower, your, stress, level, get, plenty, sleep, maintain, healthy, weight, quit, smoking, spend, time, outdoors, reduce, your, on, -, screen, time, #, coronavirus, #, coronavaccine, #, vaccinated"
10473,"thailand, is, supposedly, waiting, pfizer, delivery, vaccinate, twelve, -, eighteen, age, group, ., but, if, requirement, is, province, have, seventy, %, vaccinated, before, reopening, ,, reopening, target, is, &, it, ;, one hundred and twenty, days, away, ,, they, i, all, have, use, az, or, sinovac, under, is, ,, otherwise, seventy, %, is, impossible, ."
10474,"Please, take, the, vaccine, as, soon, as, possible, and, inspire, more, and, more, people, and, help, the, country, in, fighting, this, pandemic, smiling_face_with_smiling_eyes, #, vaccinated, #, getvaccinatedasap"
10475,"boost, your, immunity, level, #, coronavaccine, #, coronavirus, #, vaccinated, #, immunity, #, doctors"
10476,"lockdown, lifted, that, means, not, end, #, covid_19, ..., now, it, is, our, hands, so, please, learn, previous, years, est, and, wave, if, we, did, not, learn, ,, then, be, prepared, ord, &, amp, ;, go, on, ...., put, face_with_medical_mask, get, vaccinated, #, getvaccinated, #, mason"
10477,"i, have, got, my, est, dose, vaccinated, ., now, I, am, feeling, happy, ., thanks, #, covishieldvaccine"
10478,"#, vaccinated, #, coaxing"
10479,"In, this, sequence, ,, seventy-five, -, year, -, old, set, ., piranha, Chaurasia, ,, resident, of, village, panna, ,, tamale, district, ,, guvnor, ,, was, made, aware, by, Collector, Panna, ,, after, which, she, found, her, protective, shield, at, the, nearest, vaccination, center, ., #, jansamparkmp, #, pannafightcorona, #, vaccinated"
10480,"indian, media, is, doing, it, is, best, encourage, people, not, get, vaccinated, pouting_face, but, good, thing, is, indians, at, large, don, i, i, pay, penny, news, ., twenty-seven, crore, already, vaccinated, &, amp, ;, vaccines, are, still, high, demand, ., fifty, crores, vaccinations, by, independence, day, India, very, much, possible, ."
10481,"necessity, get, vaccinated, cannot, be, denied, ., all, us, presently, in, ., laos, &, amp, ;, citizens, thus, beautiful, country, -, we, /, u, cannot, he, it, better, ., free, vaccination, everyone, ., make, most, if, it, ., #, stayhomestaysafe, #, getvaccinated"
10482,"good, hear, shri, ramachar, ,, yr, old, veteran, is, vaccinated, at, his, residence, is, highly, appreciable, ., very, nice, visiting, enquiring, people, at, #, vaccinationdrive, malleshwaram, ,, is, highly, laudable, ., exemplary"
10483,"#, covid19, #, vaccinated, #, covidindia, we, have, been, doubting, toms, about, how, #, indiafightscorona, we, started, eighteen, +, vaccination, may, est, ., but, eighteen, +, vaccination, is, starting, today, only, ., guys, india, deserves, some, kudos, ."
10484,"india, has, already, vaccinated, population, equivalent, whole, scandinavian, countries, ., you, call, yourself, professor, ."
10485,"vaccinated, ,, body, pains, headache, tired, ness"
10486,"Collector, inspired, people, to, get, the, vaccine, ,, as, per, the, instructions, of, Collector, Panna, Shri, Sanjay, Kumar, mithra, ,, many, innovations, are, being, done, to, make, people, aware, about, getting, the, vaccine, in, the, district, ., #, jansamparkmp, #, pannafightcorona, #, vaccinated"
10487,"i, am, vaccinated, with, two, doses, sinopharm, one, dose, pfizer, saudi, ., i, be, able, travel, inside, saudi, arabia, through, causeway, with, seventy-two, hours, per, immune, first, dose, tawakalna"
10488,"i, hope, you, have, prepared, situation, after, with, june, ,, when, forty-five, -, sixty, age, group, becomes, eligible, second, dose, ., if, your, commissioner, has, brains, ,, please, do, following, :, lifting, all, restrictions, except, masking, sanitation, fully, vaccinated, ."
10489,"mako, vaccinated, hundred_pointsOK_handlight_skin_tone"
10490,"#, bellandur, communities, should, be, taking, stock, ensure, your, every, resident, their, community, is, one hundred, %, vaccinated, &, amp, ;, do, not, let, guard, off, couid, behavior, ., better, be, prepared, #, indiafightscorona, #, covid19vaccine, #, covid19"
10491,"., when, fully, vaccinated, mumbaikars, be, able, fly, -, in, or, out, mumbai, by, showing, their, #, fullyvaccinated, certificates, i, without, i, requiring, roper, -, negative, test, last, forty-eight, /, seventy-two, hours, #, flight, #, lockdown"
10492,"i, just, unlocked, badge, honour, :, #, vaccinated"
10493,"sharing, few, glimpses, active, partakers, our, social, media, campaign, that, was, launched, wherein, people, we, are, encouraged, post, picture, with, check, their, arm, see, if, they, have, been, vaccinated, with, i, vaccinationcheckchallenge, i"
