,0
9677,"just, negligible, ,, these, slight, ups, downs, are, insignificant, -, already, forty-four, i, people, have, been, vaccinated, today, till, three, am, -, very, good, pace, vaccinations"
9678,"i, got, my, couid, -, nineteen, coaxing, vaccinated, today"
9679,"i, am, telangana, state, unlock, is, started, my, state, with, educational, institutions, interstate, transport, pubs, cinema, halls, malls, parks, everything, was, open, last, days, students, are, not, vaccinated, eighteen, above, also, no, delta, variant, +, is, arrived, take, action, it"
9680,"first, dose, vaccinated, i"
9681,"you, want, to, say, that, my, has, vaccinated, little, over, five thousand, next, day, ...."
9682,"what, sort, harassment, is, this, guys, ,, get, vaccinated, ,, you, be, safe, i, do, not, impose, it, others, ..., since, you, be, vaccinated, double, masked, ,, you, be, safe, i, chill"
9683,"no, hesitation, ,, full, vaccination, get, it, done, #, indiagetsvaccinated, #, modi_ka_vaccine_pr, #, vaccinated, #, vaccineren"
9684,"this, is, my, mom, ,, she, has, diabetic, cod, patient, have, undergo, dialysis, rest, her, life, ,, today, she, has, finally, vaccinated, ., I, am, so, proud, u, ma, ., better, days, are, coming, ,, inshallah"
9685,"rajiv, gandhi, national, university, law, is, organising, couid, -, nineteen, vaccination, camp, with, june, ., anyone, aged, eighteen, above, be, welcomed, ., registration, be, on, -, site, ., get, vaccinated, be, better, equipped, defeat, third, wave, ., #, vaccinationdrive, #, getvaccinated, #, covid19"
9686,"today, got, my, first, jab, #, vaccination, i, urged, people, not, listen, any, person, who, are, misleading, others, about, #, vaccine, spreading, fake, news, ., vaccination, is, must, every, citizen, ..., so, book, your, slot, get, yourself, vaccinated, #, besame, #, stanhope, #, modihaitomumkinhai"
9687,"thanks, government, smooth, drive, vaccination, ., please, encourage, your, neighbors, ,, relatives, friend, circle, get, vaccinated, ., jai, hindfolded_hands, #, vaccinated, #, awareness"
9688,"vaccinated, ., syringe, thank, you, sign_of_the_hornsvictory_handlove, -, you_gesture"
9689,"u, need, two, crore, vaccine, what, delhi, population, is, two, crore, you, already, must, have, vaccinated, atleast, ten, %, delhi, ,, this, two, crore, also, include, kids, ,, again, lie, expose, you, atashi"
9690,"perhaps, having, only, six, %, country, vaccinated, might, indicate, utter, complacency"
9691,"with, couid, decreasing, ,, it, is, suggested, that, who, got, fully, vaccinated, &, amp, ;, otherwise, healthy, maybe, allowed, travel, interstate, without, testing, ., people, start, travelling, which, is, good, airlines, &, amp, ;, railways, ."
9692,"got, jabbed, today, #, vaccinated"
9693,"fully, vaccinated, atthe, allowing, ah, menu"
9694,"cgteeka, website, is, advertisement, &, amp, ;, coin, website, there, is, no, any, update, who, had, vaccinated, est, dose, ., so, please, tell, us, how, schedule, and, dose, &, amp, ;, where, is, certificate"
9695,"#, MahaAbhiyan, Today, the, first, dose, of, vaccine, has, been, administered, ,, I, appeal, to, all, of, you, that, if, you, are, above, eighteen, years, of, age, ,, then, register, yourself, soon, and, get, the, vaccine, ., Make, humanity, victorious, in, this, fight, against, Corona, ., #, vaccinated"
9696,"way, go, claiming, give, discount, get, vaccinated, i, have, promo, code, validated, still, i, cannot, use, it, ..., absolutely, genius, getting, people, sentiments, i, promo, code, is, validated, but, no, way, encash, it, wow, i"
9697,"govt, has, done, nothing, ,, inspite, raising, issue, bedridden, ,, no, arrangements, done, so, far, sad, part, women, do, not, support, women, ,, my, wife, who, has, paid, taxes, forty-five, years, needs, be, vaccinated, ,, issue, was, brought, up, hem, malin, ,, sarita, iraqi, ,, all, talk, no, action, together, women"
9698,"we, are, all, this, together, ., we, got, vaccinated, our, patients, our, families, our, communities, book, appointment, today, telephone_receiver, three hundred and thirty-five, -, eight million, seven hundred and six thousand, two hundred and twelve, #, dental, #, dentist, #, dentistry, #, dentistsofinstagram, #, dentistnearme, #, bestdentist, #, igotvacinnated, #, covidvacccinedone"
9699,"when, set, ., indira, gandhi, ji, fought, small, pox, one thousand, nine hundred and seventy-four, she, gave, away, is, ., one hundred, twelve, $, per, person, who, reported, got, vaccinated, ,, instead, spending, or, like, modi, ., #, modi_ka_vaccine_pr"
9700,"#, vaccinated, thank, you, Thailand"
9701,"peacock, male, flying, towards, golconda, fort, get, vaccinated, ,, stay, safe, ,, stay, healthy, keep, smiling, #, luv4wilds, #, birdlovers, #, naturelovers, #, birding, #, indians, #, theplace, #, birdsseenin2021, #, twitternaturecommunity, #, canonm50"
9702,"Arrived, at, the, vaccination, center, today, and, took, the, first, dose, of, the, vaccine, ., Vaccine, is, safe, and, also, protects, against, corona, ,, so, get, the, vaccine, and, participate, in, the, interest, of, yourself, ,, your, family, ,, society, and, country, #, vaccinationfor18plus, #, vaccination, #, vaccinated, #, covidshield, #, vaccinationdonecheck_mark, i, #, coaxing"
9703,"my, cute, mom, is, fully, vaccinated, ,, ladies, gentlemen, smiling_face_with_heartssmiling_face_with_heartssmiling_face_with_heartssmiling_face_with_heartssmiling_face_with_hearts"
9704,"finish, vaccination, before, next, election, ., dont, allow, vote, if, not, vaccinated"
9705,"oh, highest, did, not, anders, vaccinated, ten, lakhs, day, few, days, back"
9706,"#, indiafightscorona, :, round_pushpinhum, paunch, bachayen, #, couid, sebackhand_index_pointing_down, check_box_with_check, i, wearing, maskface_with_medical_mask, check_box_with_check, i, physical, distance, check_box_with_check, i, staying, at, home, check_box_with_check, i, washing, /, sanitizing, hands, check_box_with_check, i, getting, vaccinatedsyringe, #, unite2fightcorona, #, staysail, #, stanhope"
9707,"fully, vaccinated, ready, rock, ,, multi, -, award, winning, band, boltons, are, available, bookings, general, enquiries, ,, kindly, send, do, or, email, team, at, :, management, ., com, #, music, #, livemusic, #, rock, #, pop, #, band, #, dubai, #, use, #, vaccinated, #, wednesday, #, wednesdaywisdom"
9708,"#, vaccinated, #, vaccination, thank, you, well, arranged, plan, guidelines, vaccination, i"
9709,"got, your, jab, indigo, offer, up, ten, %, discount, vaccinated, passengers"
9710,"vaccination, drive, progress, #, vaccinated, #, covid19vaccine"
9711,"what, india, needs, is, more, people, getting, vaccinated, not, modi, government, or, #, modi_ka_vaccine_pr"
9712,"why, is, tomato, cancelled, when, everyone, is, vaccinated, spain, but, spain, had, very, severe, est, wave, last, year, ,, as, it, was, reeling, under, severe, pressure, due, pandemic"
9713,"two thousand and twelve, ,, india, vaccinated, seventeen, crore, children, with, polio, vaccine, ,, single, day, ..., i, no, hoopla, i, i, no, propaganda, i, i, no, half, page, ads, i, i, no, coin, app, i, i, no, registration, i, i, no, photographs, i, i, no, certificates, i, i, no, payment, i, #, covid19"
9714,"#, modi_ka_vaccine_pr, vaccination, data, madly, grades, shows, that, six hundred and ninety-two, people, we, are, vaccinated, with, june, sixteen, ., nine, lakh, people, we, are, vaccinated, just, june, four thousand, eight hundred and forty-two, we, are, vaccinated, and, june, ., all, this, hoopla, was, created, one, day, only, make, it, event, ."
9715,"indigo, offers, discount, vaccinated, passengers, business, news, :, indigo, give, ten, per, cent, discount, wednesday, onwards, all, passengers, who, have, taken, at, least, one, dose, couid, -, nineteen, vaccine, ,, statement, said, ."
9716,"partially, vaccinated, victory_hand, The, first, dose, of, the, vaccine, was, also, taken, today, by, deli, i, I, will, upload, it, now, ., Tell, me, where, I, will, get, it, for, five, ,, zero, rupees, ., i, Lord, do, not, kick, my, poor, stomach, i, face_with_tears_of_joy"
9717,"meanwhile, ,, with, all, money, grabbing, politicians, the, ,, we, i, re, still, here, under, five, %, vaccinated, population, ….., disappointed_facedisappointed_faceface_vomiting"
9718,"vaccination, or, madly, grades, :, twenty, june, :, six hundred and ninety-two, twentynine, june, :, sixteen, ,, ninety-one, ,, nine hundred and sixty-seven, twenty-two, june, :, four, ,, eight hundred and twenty-five, bop, ', i, focus, is, clearly, using, vaccination, as, event, boost, modi, ', i, image, ., there, is, no, plan, consistency, ., #, modi_ka_vaccine_pr, #, mirqurramali, #, vaccinated, #, covid19"
9719,"whatever, is, available, you, is, best, vaccine, ., if, you, have, access, get, vaccinated, ,, please, do, so, ."
9720,"is, it, mandatory, take, it, per, test, partially, vaccinated, passenger, if, travelling, bengaluru, mumbai, passenger, be, denied, boarding"
9721,"fully, vaccinated, elderly, can, restart, activities, restricted, manner, :, govt, cautioning, general, public, ,, especially, elderly, citizens, ,, against, imminent, third, couid, -, nineteen, wave, ,, centre, said, that, ', fully, vaccinated, ', senior, citizens, can, ', restart, restricted, activities, ', #, unikarma"
9722,"I, am, perplexed, by, logic, restricting, access, red, list, countries, ., as, access, is, only, granted, those, fully, vaccinated, ,, require, couid, test, before, travel, ,, &, amp, ;, require, two, /, three, couid, tests, within, their, fourteen, day, stay, ,, why, restrict, countries, entry, they, can, still, get, couid, anytime, ."
9723,"my, parents, forty-five, +, went, get, vaccine, at, centre, but, registration, app, not, working, ., we, tried, get, vaccine, yesterday, too, but, it, was, too, crowded, ., my, grandmom, seventy-five, +, cannot, walk, ., how, do, i, get, her, vaccinated, ., no, arrogant, such, pal, ., plus, help"
9724,"why, suddenly, free, vaccination, has, been, changed, eighteen, +, thirty, +, there, are, hundreds, eighteen, +, people, standing, que, since, morning, get, vaccinated, at, sri, spoke, school, ,, ziaguda, please, look, this, matter"
9725,"finally, vaccination, done, paid, rs1410, first, dose, ., #, vaccinated, #, freevaccineforall"
9726,"disturbing, news, ardent, mongolia, ., one hundred, new, couid, cases, day, ., collegue, ', i, relative, was, fully, vaccine, but, now, has, couid, ., others, too, vaccinated, but, get, couid, ,, show, only, mild, symptoms, so, do, not, hospitalise, ,, do, not, get, traced, but, because, keep, spreading, it, ., sleepy_face"
9727,"#, vaccinationdrive, is, only, key, avert, #, covid19, please, urge, everyone, around, you, get, vaccinated, ., #, india, has, ramped, up, it, is, #, vaccine, doses, ., each, one, us, has, responsibility, ., look, around, ,, create, awareness, mobilise, ., #, individualsocialresponsibility, #, gothedistance"
9728,"thank, you, modi, ji, #, vaccinated, #, upscextraattempt, #, ugccanceluniversityexams, #, mirqurramali, #, modi_ka_vaccine_pr, backhand_index_pointing_downbackhand_index_pointing_downbackhand_index_pointing_downbackhand_index_pointing_downbackhand_index_pointing_downbackhand_index_pointing_downbackhand_index_pointing_downbackhand_index_pointing_downbackhand_index_pointing_downbackhand_index_pointing_down"
9729,"i, doubt, efficacy, vaccines, if, there, is, other, variant, too, ., people, may, still, be, infected, after, being, vaccinated, ."
9730,"we, need, your, thoughts, whether, tag, should, allow, fully, vaccinated, members, workout, i"
9731,"vaccinated, done, with, my, est, dose, #, cucukmyaz"
9732,"my, sister, is, vaccinated, twentynine, june, two thousand and twenty-one, ..., but, till, now, not, updating, coin, ., what, is, reason, please, inform, me, i"
9733,"go, concert, yes, that, is, what, i, want, do, when, I, am, vaccinated, over, this, nobis, shit, ."
9734,"I, never, told, the, kismet, that, I, was, fully, vaccinated, ., Today, in, the, future, ,, I, will, do, a, survey, for, those, who, have, registered, for, the, vaccine, ., I, am, up, la, gambol, I, have, been, vaccinated, ., there, is, la, opiate, ask, how, fast, I, can, get, it, ., I, just, want, to, answer, ,, I, am, in, heaven, while, flipping, my, hair, zany_face"
9735,"#, dubai, allow, entry, fully, vaccinated, residents, #, india, today, ., #, indiadubaiflights, #, dubaiindiaflights"
9736,"districts, which, are, showing, significant, reduction, cases, vaccinated, more, than, seventy, %, at, least, one, jab, may, open, up, more, with, couid, protocols, ., entry, those, districts, emergency, or, essential, needs, other, districts, should, be, allowed, with, antigen, tests, all, ."
9737,"got, #, vaccinated, #, besame, #, actorshaam"
9738,"eighteen, +, vaccinated, travellers, get, up, ten, percent, discount, flying, tickets, issued, today, onwards"
9739,"it, is, also, fact, that, more, than, fifty, lakhs, pal, vaccinated, twenty-two, /, six, after, record, vaccination, twentynine, /, six, ., do, not, get, fooled, by, figures, ,, rather, appreciate, i, work, health, care, warriors, against, china, virus, ., ask, ur, goats, vaccinate, more, &, amp, ;, more, so, that, pal, i, safe, vos"
9740,"partially, vaccinated, flexed_bicepssyringe, -, hug, cancer, care, centre, #, unite2fightcorona, #, fightagainstcovid, #, markup, #, staysail, #, stayhomestaysafe, #, stanhope, #, covishieldvaccine, #, notocorona"
9741,"harass, by, oct, we, reach, seventy, %, malaysian, vaccinated, palms_up_togethermedium, -, light_skin_tone"
9742,"paging, ugly, wigged, guy, this, is, how, you, motivate, people, be, vaccinated"
9743,"i, we, i, re, very, close, be, fully, vaccinated, society, i, announced, ministry, health"
9744,"is, this, lima, book, records, or, guinness, record, maharastra, is, always, i, forefront, irresponsible, administration, bow, priyanka, ,, more, than, fifty, lakhs, pal, got, vaccinated, twenty-two, /, six, despite, poor, performance, by, non, -, bop, states, ."
9745,"done, and, dose, ., fully, vaccinated, ., thanks"
9746,"beating_heart, checkmark, Increase, confidence, for, all, customers, who, come, to, receive, service, ., Employees, who, have, been, vaccinated, I, am, covid19, #, vaccinated, badge, will, be, attached, ., Click, to, read, more, &, it, i, it, ;, &, it, i, it, ;, make, an, appointment, in, advance, Before, entering, pushpin, service, ,, call, :, twenty-two million, seven hundred and ninety-three thousand and thirty, pushpin, line, :"
9747,"#, indiafightscorona, :, round_pushpinhum, paunch, bachayen, #, couid, sebackhand_index_pointing_down, check_box_with_check, i, wearing, maskface_with_medical_mask, check_box_with_check, i, physical, distance, check_box_with_check, i, staying, at, home, check_box_with_check, i, washing, /, sanitizing, hands, check_box_with_check, i, getting, vaccinatedsyringe, #, unite2fightcorona, #, staysail, #, stanhope, #, janandolan"
9748,"i, don, i, i, want, be, vaccinated, demanding, annexe, inthe, vaccine, vena, allthe, ille, inthe, vaccine, tha, venom, person_facepalmingmedium, -, light_skin_tone, i, female_sign, i"
9749,"sir, ,, i, got, vaccinated, it, is, been, ten, days, did, not, receive, message, yet, ,, how, can, i, get, certificate, now, whom, contact, vadasithur, ,, coimbatore, it"
9750,"instead, always, looking, negative, points, blaming, /, targetting, one, person, ,, opposition, should, have, comeup, with, smart, progressive, ideas, collectively, break, virus, chain, get, max, people, vaccinated, ., thanks, wastepaper, nothing, just, i, i, i, i, i, i, i, i, i, i, i, i, i, i, i, i, i, i, i, i, i, i"
9751,"taani, hotels, is, one, first, have, one hundred, %, fully, vaccinated, staff, ., all, one hundred and forty-two, staff, got, est, &, amp, ;, and, dose, ., safe, stay, continue, evolve, align, with, current, environment, guidelines, keep, travelers, hotel, employees, safe, ."
9752,"thanks, reply, ., concern, is, that, mother, is, fully, vaccinated, hence, exempted, there, is, no, vaccine, child, ., still, do, we, need, have, institutional, quarantine, kindly, help, with, revert, ,, folded_hands"
9753,"filipinos, have, three, choices, one, ., get, vaccinated, two, ., get, forcefully, injected, by, animal, vaccine, three, ., go, india, that, order, ., is, india, protesting, winking_face"
9754,"i, got, vaccinated, est, dose, complete, thumbs_upthumbs_up"
9755,"no, world, record, sir, ., china, vaccinated, twenty, million, people, day, many, days, ., please, do, not, mislead, people, ., surely, we, can, take, pride, our, efforts, without, attaching, lies, them, ."
9756,"feu, hai, juma, ka, wars, hai, day, before, it, is, national, record, ,, madly, grades, vaccinated, mere, four, ,, one hundred"
9757,"this, is, what, i, meant, by, letting, people, who, are, vaccinated, do, things, normally, ., if, they, are, vaccinated, then, they, should, be, allowed, travel, ,, see, their, father, ,, work, freely, et, al, ., i, can, understand, masks, but, this, type, behavior, by, governments, promotes, vaxxhesitancy, ."
9758,"pivotal, clause, video, :, they, are, both, vaccinated, ., if, they, are, both, vaccinated, ,, have, returned, multiple, tests, etc, i, there, has, only, one, question, left, ., why, are, they, being, denied, entry, why, did, they, have, offer, wear, hazmats, I, am, not, one, promoting, vaccine, hesitancy, here, :"
9759,"this, should, mean, that, roper, test, elderly, air, travel, should, be, waived, off, ., elderly, can, resume, normal, lives, if, fully, vaccinateTongue_sticking_out_cheeky_playful_or_blowing_a_raspberry, government, |, india, news, -, times, india"
9760,"Sinovac, needle, two, is, done, ., victory_hand, #, vaccinated, #, vaccinationdonecheck_mark, i, #, 2ndsinovacsyringeflexed_bicepsgrinning_face, @, siam, paragon"
9761,"is, it, necessary, carry, it, -, per, report, even, if, we, are, vaccinated, back, by, both, jabs, march, asymptomatic"
9762,"are, we, out, woods, or, is, it, too, early, celebrate, elderly, can, resume, normal, lives, if, fully, vaccinateTongue_sticking_out_cheeky_playful_or_blowing_a_raspberry, government, |, india, news, -, times, india"
9763,"way, used, is, too, harsh, but, intention, is, good, ., most, should, be, vaccinated, so, that, philippine, survive, ., better, way, is, set, date, that, all, be, vaccinated, otherwise, be, fined, if, caught, by, then, or, that, only, with, vaccination, can, travel, entering, premises, or, public, areas, ."
9764,"it, should, ,, all, babies, go, through, this, pain, when, primary, vaccines, are, given, ., motivate, ten, more, get, vaccinated, i"
9765,"thou, two, -, three, months, after, fully, vaccinated, paling, seaman, if, plan, no, i, sine, ., stay, safe, hair, beaming_face_with_smiling_eyes"
9766,"if, you, do, not, get, vaccinated, you, get, injected, like, pigs, or, go, india, ,, says, phillipines, president, ."
9767,"with, over, two hundred, ,, zero, vaccinated, each, day, ,, is, it, slow, or, dai, is, targeting, just, minister, charge"
9768,"request, you, get, approval, oman, govt, ., allow, indians, with, resident, card, vaccinated, with, coaxing, as, when, they, start, indians, return, oman, ."
9769,"I, have, taken, it, ., fully, vaccinated, ., slight, fever, twelve, -, 18hrs, day, two, after, est, dose, ., nothing, after, and, ."
9770,"Clean, and, disinfect, surfaces, that, people, frequently, touch, such, as, phones, ,, other, electronic, items, ,, tables, ,, counters, ,, switches, of, electrical, appliances, ,, door, handles, and, cupboard, handles, vaccinated, #, vaccinated, #, nerf"
9771,"check_box_with_check, i, total, one, ,, forty, ,, nine hundred and two, person, ', i, vaccinated, till, date, ., check_box_with_check, i, one, ,, twenty-three, ,, three hundred and nineteen, vaccinated, with, ist, dose, ., including, how, &, amp, ;, few, check_box_with_check, i, seventeen, ,, five hundred and eighty-three, vaccinated, with, ii, and, dose, check_box_with_check, i, thirty, ., eighty-three, %, population, vaccinated, till, date, ."
9772,"fact, check, :, you, can, sleep, through, this, viral, claim, saying, anaesthetics, can, kill, vaccinated, people"
9773,"am, with, cases, falling, tar, too, is, coming, down, ,, special, consideration, is, due, individuals, who, i, fully, vaccinated, ofcourse, they, need, follow, all, couid, protocols, strictly"
9774,"good, morning, ,, all, ., another, bright, morning, here, ., good, day, go, out, get, #, vaccinated, if, it, is, your, turn, today, ., do, register, #, covid19vaccine, if, you, haven, ', i, ."
9775,"i, got, vaccinated, syringe, #, covid19, #, vaccinated, note, :, ignore, background, sounds, face_with_tears_of_joy"
9776,"our, state, madly, grades, become, one, highest, vaccinated, states, day, ., great, quest, health, our, state, by, support, &, amp, ;, visionary, i, request, people, &, amp, ;, administration, participate, &, amp, ;, make, this, movement, success, ., #, madhyapradesh"
9777,"i, am, no, modi, or, bop, but, if, u, are, so, against, him, ,, than, y, is, not, i, state, governments, been, blamed, i, same, ., is, everything, i, centres, fault, ,, if, it, is, than, it, is, i, states, ,, city, i, citizens, fault, as, well, virus, spread, ., y, i, i, state, governments, not, getting, their, pal, vaccinated, free, ."
9778,"part, two, /, two, ,, went, twice, downstairs, ,, no, one, was, able, facilitate, ,, both, teams, upstairs, &, amp, ;, downstairs, statements, we, are, totally, different, ., then, went, piss, ,, they, said, you, need, wait, few, more, days, so, that, you, receive, your, message, then, come, get, vaccinated, ."
9779,"i, am, vaccinated, ."
9780,"pakistan, should, also, motivate, people, ,, by, offering, incentives, perks, get, vaccinated, ."
9781,"second, jab, done, ., now, i, am, fully, vaccinated, ., are, you, go, get, vaccinated, ;, i, -, nine, mass, vaccination, center, is, operating, twentyfour, -, hours, ., team, &, amp, ;, staff, at, i, -, nine, center, is, dedicated, &, amp, ;, professional, ;, whole, credit, goes, team, leader, do, ., #, covid19"
9782,"after, getting, vaccinated, relieved_face, #, deltaplusvariantwoozy_face, #, covishieldvaccine"
9783,"i, am, happy, that, eighty, lakh, people, got, vaccinated, ,, but, i, am, surprised, that, people, are, falling, this, one, day, image, building, exercise, central, gov, ., would, love, see, data, next, one, week, &, amp, ;, beyond, ., if, that, remains, flat, ,, shall, we, assume, vaccines, we, are, hoarded, make, record"
9784,"do, online, tuition, till, children, are, fully, vaccinated"
9785,"i, got, vaccinated, red_heart, thank, you, #, igotvaccinatedand, #, bharatthanksmodiji, face_with_tears_of_joy"
9786,"maharashtrian, today, vaccinated, five, ., six, lakhs, plus, people, ,, non, bop, state, i"
9787,"kudos, hope, everyone, get, vaccinated, asapfolded_handsIndia"
9788,"#, vaccineforall, unprecedented, huge, vaccination, conducted, with, resolution, combat, pandemic, as, desired, by, hon, ', be, am, shri, mahendra, modify, ,, total, vaccinated, is, eight million, one hundred thousand, today, ., thank, u, modify, ."
9789,"The, vaccine, has, been, taken, for, all, company, employees, to, keep, you, safe, We, are, all, responsible, #, sheeralateen, #, vaccinated, #, wellallareresponsible"
9790,"how, do, u, say, my, paused, vaccinations, create, one, day, record, plus, let, me, know, where, are, u, getting, data, from, ., map, claimed, it, did, not, get, vaccines, centre, hence, not, able, vaccinate, which, does, not, go, well, with, number, doses, available, is, vaccinated"
9791,"i, am, not, vaccinated, yet, pleading_facepleading_face"
9792,"vaccinated, #, kantabanji, #, palantir, #, maskupindia, #, maskupodisha, #, maskupbalangir"
9793,"got, my, and, dose, yesterday, feverish, body, painslightly_frowning_face, fully, vaccinated, with, #, coaxing, when, are, getting, it, approved, by, any, update"
9794,"one hundred, %, right, looking, at, density, population, mindset, people, we, have, been, incredibly, fast, ., one, fastest, &, amp, ;, highest, vaccinated, countries"
9795,"any, forty-five, +, can, be, vaccinated, spot, i"
9796,"today, sixteen, ., ninety-five, lakhs, people, got, #, vaccinated, #, madhyapradesh, ., thanks, lot, honourable, am, ji, this, #, milestone, which, is, really, speculative, aspect, ., bouquetfolded_handsmedium_skin_tone"
9797,"i, am, lakhandeb, ha, successful, taken, est, dose, vaccine, six, /, four, /, 2021but, till, now, my, certificate, vaccination, not, generated, coin, not, received, any, sums, not, showing, coin, vaccinated, ., my, dear, no, two hundred and forty-five billion, eight hundred and six million, four hundred and twenty-four thousand, five hundred and sixteen, oh, -, eight billion, four hundred and seventy-nine million, nine hundred and thirty-three thousand, two hundred and twenty-three, ., ply, watch"
9798,"many, have, been, asking, where, am, i, since, two, days, ., so, I, am, sharing, that, i, will, not, be, having, any, media, interactions, few, more, days, due, some, personal, reasons, ., i, my, family, members, are, fit, fine, all, us, are, fully, vaccinated, ., thanks, everyone, your, love, support, smiling_face_with_smiling_eyesfolded_hands"
9799,"punjab, is, assay, both, states, have, similar, populations, but, day, that, assay, vaccinated, three, ,, sixty, ,, seven hundred and seven, people, punjab, could, only, manage, ninety-four, ,, seven hundred and fourteen, doses, ."
9800,"you, think, most, them, would, have, even, got, single, dose, ,, let, alone, being, fully, vaccinated, ., once, they, go, home, spread, it, others, around, them"
