,0
9000,"it, is, suggestions, sir, increase, vaccination, center, dharam, ..., out, ten, ,, zero, ,, zero, population, only, ask, vaccinated, means, around, three, %, only, get, vaccinated, still, ninety-seven, %, remaining, i"
9001,"ok, ,, i, rest, my, case, here, ., people, see, data, different, way, ., me, him, people, gets, fully, vaccinated, is, way, better, than, one, ., him, ."
9002,"vaccinated, heart_exclamation, i"
9003,"I, have, been, vaccinated, ten, may, ,, two thousand and twenty-one, at, chctamnar, ., but, I, have, not, received, any, mug, regarding, same, ., i, contacted, local, health, officials, ,, they, said, that, they, have, shared, data, raigarh, ., but, no, update, me"
9004,"we, are, ready, serve, you, safeway, ,, because, we, are, vaccinated, ."
9005,"And, brother, "", pancho, i, #, bop, ', i, #, vaccine, is, working, or, not, or, else, making, yourself, at, home, vaccines, grinning_face_with_sweat, nevermind, ,, #, justasked, nerd_face, well, ,, get, #, vaccinated, &, amp, ;, staysail, crossed_fingerslight_skin_tonefolded_handslight_skin_toneraising_handslight_skin_tonegreen_heart, ji, smiling_face_with_halo, jifolded_handslight_skin_tonegreen_heart"
9006,"i, got, my, first, shot, syringetoday, i, who, are, not, yet, vaccinated, please, get, vaccinated, soon, hugging_facesmiling_face_with_hearts, #, freevaccineforstudents"
9007,"finally, vaccinated, i, now, i, can, live, longer, than, my, friendsface_with_tears_of_joyface_with_tears_of_joy"
9008,"self, help, groups, can, play, major, role, increase, pace, vaccination, programs, getting, people, vaccinated, due, their, hold, over, village, community, ., utilising, their, presence, i, considered, ., this, was, suggested, earlier, also, ., utilization, shes, is, welcome"
9009,"monday, joke, many, like, me, have, paid, one thousand, two hundred and fifty, indian, made, vaccine, after, playing, fingers, first, your, world, famous, coin, app, ., lying, will, not, work, anymore, ., india, has, vaccinated, double, dose, four, %, it, is, total, population, ., so, do, not, play, with, absolute, numbers"
9010,"what, has, population, #, india, &, amp, ;, #, usa, what, is, percentage, people, both, countries, vaccinated, please, stick, relevant, ."
9011,"we, are, proud, say, that, i, -, ten, is, now, one hundred, %, vaccinated, store, timings, :, nine, :, zero, am, -, seven, :, zero, am, monday, -, saturday, #, shopwithsafety, #, getvaccinated, #, earmark"
9012,"when, you, discuss, number, positive, cases, &, amp, ;, deaths, ,, you, rely, upon, absolute, numbers, ., now, ,, when, talking, vaccines, ,, you, are, considering, percentage, population, vaccinated, ., seems, like, you, need, go, back, school, &, amp, ;, finish, your, incomplete, syllabus, ., people, are, not, dumb, ."
9013,"second, dose, done, ., now, i, i, i, fully, vaccinated, partying_face, #, coax"
9014,"#, vaccinated, #, covid19vaccine, #, alhamdulillah"
9015,"update, :, had, taken, first, shot, ,, then, left, centre, after, thirty, -, minute, observation, period, potential, side, effects, ., so, far, only, feeling, slight, soreness, my, vaccinated, arm, ,, but, be, heading, back, home, rest, rest, day, ."
9016,"andd, ...., I, am, vaccinated, ., syringednaflexed_biceps, thank, you, malaysiaanchor, marine, department"
9017,"great, ., but, our, ki, or, target, must, be, percentage, population, vaccinated, ., sheer, numbers, are, keeping, momentum"
9018,"dekko, maga, yaar, se, ,, corona, data, hai, vaccine, ki, maar, se, #, vaccinated, #, coaxing, #, 2nddose"
9019,"good, day, loves, not, so, loves, baba, no, hair, at, killy, ,, dit, kasi, banal, pumas, any, establishments, ang, hindi, fully, vaccinated, ., those, that, have, not, been, infected, with, couid, -, nineteen, undergoes, mandatory, swab, weekly, &, amp, ;, you, shoulder, swab, tests, fees, too, ., how, about, that, grinning_face_with_sweatsmiling_face_with_smiling_eyessmiling_face_with_sunglasses"
9020,"sirs, problem, is, same, all, elders, senior, citizens, are, line, ., all, us, can, have, same, patience, get, ourselves, vaccinated, ., plus, help, check, this, unnecessary, hassles, #, telanganaunlock, #, vaccinationdrive, #, vaccineregistration"
9021,"finally, got, my, est, dose, &, amp, ;, vaccinated, today, by, #, bmc_mumbai_mcgm, good, arrangement, all, facilities, was, very, good, ., पहल, i, i, i, i, i, i, i, i, i, i, i, beaming_face_with_smiling_eyessmiling_face_with_smiling_eyes"
9022,"what, share, population, has, been, partly, or, fully, vaccinated, against, couid, -, nineteen, #, covid_19, #, vaccinationdrive"
9023,"hello, virus, ., you, have, been, already, vaccinated, before, corona, virus, came, ., your, certificate, is, here, backhand_index_pointing_down"
9024,"finally, vaccinatedsyringe, now, i, can, live, longerbeaming_face_with_smiling_eyeshundred_pointsred_heart, i, #, covid19ab, i, freevaccineforall, i, covide19"
9025,"krishna, ji, ,, i, am, saying, that, our, target, should, be, vaccinate, fifty, crore, by, fifteen, august, two thousand and twenty-one, ., india, has, vaccinated, thirty-two, crore, people, as, today, ., so, ,, i, am, saying, that, we, should, vaccinate, another, eighteen, crore, people, forty-nine, days, ., that, i, i, roughly, thirty-six, ., seven, lakh, daily, vaccinations, ."
9026,"i, i, i, proud, vaccinated, malaysian, citizen, ., #, cucukmyaz, #, iamvaccinated"
9027,"sir, you, may, show, whatever, picture, you, want, citizens, mislead, them, ., hope, your, sycophants, show, you, this, real, picture, ,, based, which, government, needs, prepare, further, vaccination, ., india, is, not, even, five, %, fully, vaccinated, ."
9028,"vaccinated, check_mark_buttoncheck_mark_button, #, staysail, #, stayhealthy"
9029,"he, enjoyed, his, life, ,, others, may, get, vaccinated, ,, ignore, his, call"
9030,"still, amazing, thailand, Thailand, come, let, me, introduce, you, my, smart, travel, luggage, enjoying, sunshine, sun, i, beach, beach_with_umbrella, with, low, budget, #, vaccinated, with, #, sinovac, china, China"
9031,"saw, this, one, my, fu, timeline, ., warning, i, warning, i, warning, i, please, be, aware, when, you, get, vaccinated, best, record, yourself, &, amp, ;, check, syringe, after, ., sender, video, saiTongue_sticking_out_cheeky_playful_or_blowing_a_raspberry, "", look, ,, staff, my, neighbor, got, vaccinated, but, video, showed, nurse, did, not, push, vaccine, in, ."
9032,"I, am, fully, vaccinated, ., syringe"
9033,"what, is, overall, vaccination, status, people, ladakh, ut, as, date, are, they, fully, vaccinated"
9034,"today, ,, india, has, successfully, vaccinated, thirty-two, ,, thirty-six, ,, sixty-three, ,, two hundred and ninety-seven, doses, couid, -, nineteen, vaccinations, ., at, average, nineteen, ,, eighty-five, ,, six hundred and sixty-four, person, per, day, one hundred and sixty-three, immunization, days, exceeding, united, states, ., one, /, two"
9035,"i, am, referring, fully, vaccines, given, ., if, you, are, referring, about, right, column, ,, you, are, wrong, about, it, too, ., comparison, with, in, with, thirty-nine, ., am, population, ,, one, ., him, four, ., eight, %, population, vaccinated, ., as, my, with, seven, ., him, population, ,, zero, ., him, six, ., two, %, population, vaccinated, ."
9036,"i, did, it, victory_handlight_skin_tone, #, vaccinated"
9037,""", private, security, guards, "", needs, be, vaccinated, without, slot, appointment, since, most, them, do, not, know, operate, smart, phones, ., please, allow, them, visit, any, vaccination, centers, get, themselves, vaccinated, on, -, site, ."
9038,"also, add, how, much, percent, people, vaccinated, each, country, ."
9039,"why, we, should, get, vaccinated, at, earliest, ., folded_hands"
9040,"we, need, atleast, seventy-five, %, vaccinated, achieve, herd, immunity, ."
9041,"clearly, shows, their, iq, level, logical, approach, ., please, get, vaccinated, stay, away, misconceptions, go, through, fact, yourself, if, susceptible, #, largestvaccinationdrive, #, deltavariant"
9042,"by, june, india, has, vaccinated, people, equivalent, population, america, by, december, india, vaccinate, four, times, population, america, ."
9043,"highly, appreciated, initiative, by, renowned, store, motivate, people, get, vaccinated, ., via, sums, #, vaccinationdrive"
9044,"those, above, people, one, -, five, need, be, vaccinated, top, priority, due, their, nature, job, ., homeless, poors, baggers, do, not, have, access, centers, so, door, door, step, vaccination, van, should, be, sent, vaccinate, them, ., saving, every, lives, is, important, ., four, /, six"
9045,"last, three, days, we, are, visiting, vaccination, centre, but, still, we, are, not, hope, that, we, be, vaccinated, most, people, are, going, through, recommendation, vaccinations, #, kir, #, ktramarao, #, kir, #, micr, #, telangana"
9046,"est, &, amp, ;, and, jab, done, folded_handssparkling_heart, get, yourself, vaccinated, &, amp, ;, return, back, your, normal, life, stay, safe, sparkling_hearthugging_face, #, vaccinationdonecheck_mark, i, #, covid_19, #, couid, #, coronavirus, #, corona, #, staysail, #, covaxinsyringe, @, atlas"
9047,"this, is, issue, uk, now, with, nearly, fifty, %, population, vaccinated, but, cases, still, rising, ., fully, vaccinated, are, still, catching, &, amp, ;, transmitting, couid, ."
9048,"cast, magic, to, in, nce, got, vaccinated, ., i, request, everyone, do, same, i, save, nation, #, protect, covid19, #, defence, pro, chennai, #"
9049,"am, shri, ji, says, india, ', i, vaccination, programme, can, be, case, study, world, ;, urges, people, get, themselves, vaccinated, against, #, covid19, soon, ."
9050,"got, fully, vaccinated, today, ., thank, you, ,, ,, ,, and, ,, for, providing, us, vaccines, free, ,, despite, very, many, financial, constraints, ., get, vaccinated, ,, everyone, ."
9051,"not, positive, after, speaking, sister, uk, over, weekend, ., increasing, number, fully, vaccinated, contracting, delta, variant, ., suffering, but, not, needing, be, hospitalised, good, but, so, much, more, easily, transmissible, bad, ., uk, vaccinations, ahead, most, but, rise, cases, face_with_rolling_eyes"
9052,"#, mannkibaat, ensuring, that, every, citizen, is, able, avail, safety, through, vaccine, ,, am, modi, spoke, people, dulariya, village, betel, district, madly, grades, ., he, urged, villagers, dispel, fear, getting, vaccinated, strengthen, fight, against, corona, ."
9053,"please, keep, three, places, go, road, ,, eagle, estate, thane, station, area, dedicated, and, dose, forty-five, plus, people, ,, till, all, forty-five, +, vaccinated, and, dose, ., please, ."
9054,"est, dose, vaccinated, syringeface_with_thermometer, #, sinopharm, #, can, ', i, wait, #, injection, in, case, you, go, back, to, the, gym, @, nawavej, hospital, navavej, international, hospital"
9055,"jokers, at, -, that, i, i, still, forty-five, ., nine, %, fully, vaccinated, ., whereas, india, has, only, vaccinated, four, %, why, not, compare, with, burning, fast, fiji, take, along, with, you, ., way, back, drop, him, off, new, zealand"
9056,"i, was, vaccinated, with, march, ,, my, eighty-four, days, already, completed, ,, now, i, not, getting, my, and, dose, because, i, am, not, forty-five, +, what, do, where, should, i, go"
9057,"fully, vaccinated, but, not, in, the, landscape, at, hospital, huai, hwang, ,, bangkok"
9058,"har, deshvasi, mein, map, bhi, hate, ho, incase, you, consider, yourself, as, indian, ,, tho, alone, liya, kya, vaccine, have, guts, answer, this, question, instil, faith, your, party, members, atleast, get, vaccinated, too, ."
9059,"israel, ,, fifty, %, infected, are, vaccinated, ,, base, rate, bias, ,, by, "", new, infections, are, fifty, %, vaccinated, "", does, not, mean, fifty, %, vaccinated, are, being, infected, ., good, #, epidemiology, lesson, simple, language, ."
9060,"kudos, &, amp, ;, sir, these, arrests, are, highly, significant, curb, spread, misinformation, many, people, who, avoided, getting, vaccinated, lost, their, lives, ., solo, earning, member, ,, retired, parents, ,, whole, families, ,, couples, etc, ., these, culprits, deserve, strict, punishment"
9061,"just, look, i, photo, timing, nine, am, ., totally, mismanagement, i, i, request, please, take, arrange, smoothly, way, that, everyone, can, get, vaccinated, ."
9062,"preference, because, you, are, completely, vaccinated"
9063,"everything, does, all, their, endeavours, is, dubious, irrespective, whether, it, is, ayothaya, or, timbuktu, because, that, is, their, #, dna, irrespective, who, am, is, ., this, dna, virus, is, also, creeping, into, some, like, who, do, not, prefer, be, vaccinated, ."
9064,"#, gujaratSurprisever, two, ., four, lakh, people, vaccinated, against, #, covid19, yesterday, which, include, nearly, one, ., four, lakh, beneficiaries, eighteen, -, forty-four, age, -, group, ., recovery, rate, state, stands, at, ninety-eight, ., thirty-three, per, cent, caseload, ., at, present, there, are, around, three, ,, six hundred and eighty-seven, active, cases, couid, -, nineteen, state, ."
9065,"full, vaccinatedflexed_bicepslight_skin_tonemicrobe"
9066,"who, urges, fully, vaccinated, people, continue, wear, masks, as, delta, couid, variant, spreads"
9067,"vaccinated, sharpen, ,, roamed, around, forests, escobar, ,, saw, some, magical, creatures, ., top, it, all, ,, had, explore, ligate, lacerated, radial, artery, ., thank, you, nicobarslightly_smiling_face, #, medtwitter, #, amazingandamans"
9068,"i, i, ve, still, not, got, answer, you, guys, ., even, if, i, i, i, fully, vaccinated, ,, why, do, i, need, roper, report, when, i, land, delhi"
9069,"alhamdulillah, ., i, got, vaccinated, ."
9070,"so, it, i, i, #, welcomebackdan, ,, #, thanksjamesmerlino, ,, but, lockdowns, sydney, ,, darwin, perth, ,, less, than, five, %, australians, vaccinated, ., bridget, mckenzie, is, back, cabinet, solely, because, she, supported, noted, hypocrite, ., is, hiding, ., i, despair, australia, ."
9071,"mark, request, meet, his, dying, dad, was, declined, initially, ., i, left, no, stone, unturned, &, amp, ;, i, kept, tweeting, thirty-seven, his, so, mark, can, get, access, compassionate, grounds, &, amp, ;, he, can, meet, his, dying, dad, Australia, ., i, tweeted, that, mark, ', i, fully, vaccinated, &, amp, ;, returned, multiple, -, couid, tests, ."
9072,"fully, vaccinated, plus, i, per, departure, arrival, why, fourteen, days, ..., there, is, no, medical, reason, it, is, longer, than, even, three, -, five, days, utter, maximum, ..., please, ask, do"
9073,"door, door, survey, those, not, vaccinated, needs, be, done, #, door, door, vaccination, #, drive, ins, #, should, be, started, #, at, same, time, please, spread, awareness, personal, hygiene, reason, it"
9074,"vaccinated, can, still, i, carriers, i"
9075,"expo, center, lahore, pakistan, vaccinated, victory_hand, i"
9076,"please, be, vaccinated, ,, as, soon, as, possible, ."
9077,"get, vaccinated, soon, ...., recently, ,, i, lost, two, persons, family, just, two, weeks, caused, by, couid, ..., crying_facecrying_facecrying_face"
9078,"#, vaccinationrace, state, /, ut, -, wise, -, vaccination, race, analyzed, based, data, available, as, twenty-seven, jun, ', twentynine, &, amp, ;, estimated, region, wise, population, two thousand and twenty-one, ., check, how, your, region, is, doing, ., get, yourself, vaccinated, ., do, not, miss, ., try, analyse, weekly, ."
9079,"why, do, we, need, checking, our, concern, is, make, local, train, at, -, least, private, company, employees, ., why, it, is, biased, only, govt, employees, hence, almost, all, corporate, offices, have, vaccinated, ."
9080,"absolutely, yes, ,, i, have, seen, sudden, spike, in, -, person, meetings, specially, getting, requests, client, ., social, distancing, masks, are, still, during, meetings, although, vaccinated, ."
9081,"all, fellow, indians, are, supposed, get, vaccinated, be, prevent, us, various, transmissible, virus, across, ., individuals, considering, immunity, with, physician, before, vaccination, would, be, really, appreciated, ., #, vaccination, #, deltavariant, #, covid19"
9082,"both, happy, because, i, got, vaccinated, sad, because, it, is, after, effectsloudly_crying_face"
9083,"The, sound, of, the, third, wave, is, frightening, ., #, covidthirdwave, get, #, vaccinated"
9084,"now, that, de, light, i, i, euro, is, over, i, can, someone, get, that, cunt, vaccinated, #, euro2020, #, neice"
9085,"delta, variant, &, amp, ;, delta, variant, plus, have, high, transmissibility, sir, ., this, situation, scheduling, exams, are, easy, way, out, corona, ., important, note, is, dat, even, eighteen, +, students, are, not, get, vaccinated, ."
9086,"dear, puri, ji, ,, plus, advise, what, is, government, doing, people, fully, vaccinated, who, work, use, have, been, stuck, india, due, travel, restrictions, more, than, three, months"
9087,"this, is, crying_face, typical, traditional, society, ,, has, push, my, mali, get, his, wife, vaccinated, ., finally, ,, he, confirmed, this, morning, #, womenvaccinaction, is, important"
9088,"fully, vaccinated, i, thanks, scientists, health, care, workers, who, i, ve, brought, us, this, far, ., thanks, am, ji"
9089,"vaccinated, ..., @, winner, tutorial"
9090,"These, ministers, are, all, fully, vaccinated, ,, so, -, called, frontliners, ,, but, what, is, a, difficult, problem, ?"
9091,"#, largestvaccinedrive, #, unite2fightcorona, #, coin, portal, is, now, available, twelve, languages, ensure, everyone, can, register, get, vaccinated, ."
9092,"while, travelling, back, maharashtrian, with, any, airline, ,, roper, testing, is, now, made, mandatory, even, those, who, are, already, fully, vaccinated, ., do, not, we, have, faith, our, own, vaccination, program, what, is, use, getting, vaccinated, then"
9093,"i, found, this, ironical, ., let, i, i, all, be, vaccinated, so, that, we, can, get, out, holiday, ."
9094,"kanji, :, chief, minister, do, prayed, sawant, has, said, that, state, government, ask, high, court, allow, entry, fully, vaccinated, persons, state, ., #, goa, #, goal, #, goalie, #, goanvibes, #, gannets, #, goanewsdaily, #, kevreports"
9095,"even, if, vaccinated, thinking_faceclown_face"
9096,"i, got, vaccinated, today, took, sputnik, i, ., it, is, available, delhi, many, people, took, it, ., why, media, saying, that, it, is, not, available, have, wait, two, three, weeks, ."
9097,"sri, lankan, vaccine, cocktail, ., however, hope, everyone, be, able, get, vaccinated, asap, return, back, life, as, we, knew, ., #, covid19lk, #, srilanka"
9098,"start, gyms, vaccinated, people, atl, was, atleast, no, loudly_crying_faceloudly_crying_faceloudly_crying_face"
9099,"sir, help, karnataka, with, board, sir, if, all, get, vaccinated, what, about, that, children, ply, help, that, student, ', i, #, cancelkarnataka10thboardexams2021"
9100,"should, gather, those, who, are, fully, vaccinated, start, couid, -, safe, protest"
9101,"sir, ,, how, one, register, himself, with, vaccination, certificate, his, passport, if, he, is, vaccinated, usa, during, his, visit, ."
9102,"indians, fully, vaccinated, with, coaxing, -, travel, outside, india, facing, serious, issues, ,, more, than, two hundred thousand, indians, unable, return, their, country, where, they, are, working, ., indian, government, should, push, who, issue, provisional, vaccine, certificates, allow, them, travel, ."
9103,"est, dose, vaccinated, done, victory_hand, i, victory_hand, i, flexed_bicepsflexed_biceps"
9104,"that, was, not, bloody, question, ., have, indian, population, totally, vaccinated, that, modi, sent, vaccines, other, countries, india, did, that, increase, it, is, influence, ., incidentally, parliament, building, was, built, by, cold, ., what, about, nonsensical, aid, by, modi, afghanistan"
9105,"over, thirty-one, ., five, crore, doses, administered, country, out, which, over, three, ., three, crore, doses, administered, last, five, days, ., get, vaccinated, encourage, others, strengthen, india, ', i, fight, against, couid, -, nineteen, ., #, i, i, i, i, i, i, i, i, i, i, i"
9106,"he, did, it, record, time, ., friday, he, hear, saturday, he, vaccinated, whole, family"
9107,"get, vaccinated, ..., stay, safe, ..., stop, pandemic, ., take, first, step, now, ., Let, i, i, get, vaccinated, ,, let, i, i, make, Corona, free, richer, ., #, sleevesupraichur, #, raichurrising"
9108,"Today, ', i, checkpoint, four, lanes, Traffic, jam, in, front, of, gateway, The, last, image, is, also, a, waste, road, construction, near, the, airport, #, phuket, #, phuketsandbox, #, vaccinated, #, i, i, i, i, ตรช, i, i, #, Phuket"
9109,"i, vaccinated"
9110,"i, have, not, yet, been, vaccinated, it, possible, cure, present, delta, +, virus, existing, corona, vaccine, authority, question, is, mine, ., answer, only, those, who, have, real, understanding, this, ., #, pmoindia, #, rashtrapatibhvn, #, coronavirus, #, deltaplus"
9111,"we, are, staying, with, our, grandparents, ,, who, are, almost, eighty, not, condition, step, out, house, ,, get, vaccinated, ., it, would, be, really, helpful, if, you, could, see, what, can, be, done, such, scenarios, ., we, are, subhash, colony, ,, mango, ., thank, you"
9112,"last, six, months, ,, uk, vaccinated, four, ., four, crore, people, last, six, days, ,, india, vaccinated, nearly, four, crore, people, forty-one, member, any, comments, or, still, behind, old, tricks, ."
9113,"dear, why, thirty, +, only, allowed, get, vaccinated, #, telangana, what, basis, they, are, not, allowing, below, thirty, get, vaccination, ., please, look, into, this"
9114,"rahul, gandhi, :, just, like, parrot, ,, you, go, repeating, same, thing, ., shortage, vaccines, is, being, improved, overcome, ., now, you, concentrate, as, how, whole, indian, population, is, vaccinated, till, dec, ., twentynine, ."
9115,"mihi, bhai, proud, your, initiative, many, mound, cars, are, happy, they, been, vaccinated, at, cellar, college, with, ease, ., kudos, you, entire, team, ., good, see, sara, mushi, appreciating, vaccination, drive, ."
9116,"problem, is, disease, being, contagious, i, it, spreads, loudly_crying_face, i, raise, i, agree, not, shaming, ..., but, there, should, i, advisory, i, then, pal, i, also, responsible, ,, i, vaccinated, i, only, den, venture, out, such, places, or, he, minimum, protection, cuz, yah, it, would, i, karena, koi, bharega, koi"
9117,"rather, then, state, governments, restricting, numbers, twentyfive, or, fifty, weddings, events, ,, why, not, say, only, vaccinated, folks, can, gather, groups, more, then, ten, people, public, space, ., #, vaccinateindia, #, fightagainstcovid"
9118,"factories, of, thousands, of, org, can, open, ., parliament, berate, karat, semua, vaccinated, tu, ink, bersidang, ., I, want, to, go, back, ,, languor, ., See, you, loudly_crying_faceloudly_crying_face"
9119,"with, largest, #, vaccinationdrive, all, states, should, impose, strict, fourteen, day, #, shutdown, so, that, we, finally, be, able, break, chain, i, vaccination, drive, with, lockdown, /, shutdown, again, result, spikes, till, everyone, is, vaccinated, that, take, time"
9120,"some, lighter, moments, ., rotary, club, ranch, is, vaccination, center, last, forty, days, ., daily, average, one hundred and fifty, -, four hundred, people, are, getting, vaccinated, ., #, serviceaboveselfred_heart"
9121,"close, fifty-six, million, indians, are, vaccinated, so, far, ., tremendous, change"
9122,"has, he, been, vaccinated"
9123,"ken, tunjuklahh, yg, they, all, has, been, vaccinated, rolling_on_the_floor_laughingrolling_on_the_floor_laughingface_with_hand_over_mouthface_with_hand_over_mouth, ..."
9124,"world, ', i, largest, vaccination, drive, one, ., total, vaccinated, india, thirty-one, ., five, crore, two, ., last, five, days, three, ., three, crore, vaccinated, three, ., age, eighteen, -, forty-four, total, vaccinated, ten, ., eighty-five, crore, hats, off, ji, i, am, certain, no, other, govt, mud, he, achieved, this, resulting, utter, chaos, ."
9125,"is, there, any, new, rules, vaccinated, passengers, uk"
9126,"saving, lives, is, more, important, ., there, should, be, restrictions, until, atleast, eighty, %, mumbai, is, vaccinated, ., it, take, another, three, months, ., till, then, we, all, have, manage, #, covid19"
9127,"more, that, one hundred, persons, known, me, are, fully, vaccinated, up, list, may, ., no, one, died, ., please, stop, this, nonsense, ."
9128,"add, and, dose, vaccinated, option, raise, issue, ., as, one, member, my, id, had, taken, and, dose, long, back, still, not, updated, coin, site, ., i, hope, you, do, it, ., thanking, you"
9129,"vaccinated, today, syringe, it, was, nice, walking, into, stadium, after, so, long, lol, coming, someone, who, hates, outdoor, quick, &, amp, ;, fast, progress, ., love, it, sparkles"
9130,"it, would, be, great, if, every, my, ensures, that, all, his, constituency, is, vaccinated, students, get, internet, services, which, helps, line, education, ."
9131,"he, can, just, predict, it, is, upon, us, how, much, we, are, following, rules, getting, vaccinated, asap, ."
9132,"yesterday, i, got, vaccinated, at, ., first, ever, batch, lucknow, u, ., i, ., thanks, their, help, only, one, hospital, make, this, vaccine, available, #, covid19vaccine, #, coin, #, sputnik"
9133,"we, need, official, announcement, you, ., when, are, flights, resuming, india, residents, are, stranded, there, ., why, is, plan, bring, back, vaccinated, residents, dropped, we, need, clarity"
9134,"get, vaccinated, whenever, you, get, chance, ., stay, safe, because, there, is, need, unite, fight, against, covid19, stay, protected, stay, safe, thumbs_up, #, vaccinationdone"
