,0
1514,"consideration, sudden, high, covid, infection, spike, india, during, recent, days, ,, vaccination, was, done, at, our, project, sites, as, additional, best, practices, towards, safety, good, health, ."
1515,"08, /, 01, /, 2022, vaccination, center, 15, -, 18, age, group, "", don, ', t, you, guys, think, it, too, ,, that, this, program, could, have, been, executed, by, following, social, distancing, with, some, rules, vaccination, center, i, was, afraid, that, ,, will, i, be, covid, positive, "", hot_face"
1516,"dear, fula, ,, you, are, successfully, registered, covid, vaccination, ., ref, ., iTongue_sticking_out_cheeky_playful_or_blowing_a_raspberry, 61254385590530, ., helpline, 1075"
1517,"How, does, one, make, a, certificate, without, taking, a, vaccine, ,, it, is, very, wrong, ,, do, not, know, how, many, must, have, happened, with, this, #, covidvaccination"
1518,"pm, ', s, tigers, force, duties, working, at, hospitals, quarantine, centers, pm, ', s, tigers, force, duties, working, at, covid, vaccination, centers"
1519,"covid, -, 19, vaccination, has, started, adolescents, between, age, 15, -, 18, years, many, our, blue, brigade, volunteers, have, already, received, their, first, dose, vaccination, are, also, promoting, vaccination, ., get, your, dose, vaccine, stay, safe, ., #, covidvaccine"
1520,"Japanese_symbol_for_beginner, #, covid, #, vaccine, syringe, #, covishield, precaution, #, booster, dose, available, information, ️, book, #, cowin, app, or, walk, -, in, #, vaccination, ., telephone, ️, 09810981073, /, 83, ,, 098112, 11503, ,, 011, -, 27042222, Japanese_symbol_for_beginner, naveda, healthcare, center"
1521,"i, hope, pm, is, pic, will, now, be, removed, covid, vaccination, certificate, poll, bound, states, ."
1522,"great, success, thumbs_up, administered, covid, -, 19, vaccination, our, monks, over, age, 15, 18, #, largestvaccinedrive"
1523,"#, covid, -, 19, vaccination, my, area, ,, salute, health, department, employees, wonderful, service, difficult, conditions, ⁦⁩, ⁦⁩, ⁦⁩, ⁦⁩, ⁦⁩, ⁦⁩"
1524,"*, 9013151515, *, save, this, number, as, certificate, your, contact, list, then, type, "", certificate, "", whatsapp, you, will, get, covid, vaccination, certificate, ,, what, initiative, central, government, ., please, forward, all, ., easy, way, get, it, by, whatsapp, ."
1525,"covid, vaccination, camp, by, nss, units, thiru, ., vi, ., ka, government, arts, college, thiruvarur, @, thiruvarur"
1526,"covid, care, services, :, it, ’, s, important, get, your, covid, vaccination, protect, yourself, ., with, s, j, nursing, care, you, can, always, trust, all, your, needs, details, contact, us, phone, :, +, 91, -, 7982324366, ,, 7701931446, e, -, mail, :, sjnursingcare, ., com, visit, us, at, :"
1527,"india, reports, 1, ,, 59, ,, 632, fresh, covid, cases, 327, deaths, last, 24, hours, active, cases, :, 5, ,, 90, ,, 611, death, toll, :, 4, ,, 83, ,, 790, total, vaccination, :, 151, ., 58, crore, doses, total, omicron, cases, :, 3, ,, 623, #, covid19, #, omicron"
1528,"𝘾𝙊𝙑𝙄𝘿, -, 19, 𝘽𝙍𝙀𝘼𝙆𝙄𝙉𝙂, ., india, reports, 1, ,, 59, ,, 632, fresh, covid, cases, ,, 40, ,, 863, recoveries, ,, 327, deaths, last, 24, hours, daily, positivity, rate, :, 10, ., 21, %, active, cases, :, 5, ,, 90, ,, 611, total, recoveries, :, 3, ,, 44, ,, 53, ,, 603, death, toll, :, 4, ,, 83, ,, 790, total, vaccination, :, 151, ., 58, crore, doses"
1529,"#, namastedoctor, will, answer, all, your, questions, related, to, #, omicronvariant, and, #, covidvaccination, #, drkunwarsinghrawat, Send, your, #, whatsaapno, to, get, the, link, on, #, zoom, and, #, fblive, today, evening, ., #, fightagainstcoronavirus, #, vaccinationdrive"
1530,"pm, shri, narendra, modi, congratulates, fellow, citizens, crossing, 150, crore, milestone, covid, vaccination, drive, ., #, largestvaccinedrive, #, namovolunteer, #, satyendrasuna"
1531,"covid, -, 19, third, wave, arrived, with, omicron, variant, according, experts, vaccination, have, not, effective, results, then, election, will, possible, at, cost, life, staff, electorates, due, violation, covid, guidelines, ., if, situation, is, worst, then, eci, will, responsible, all"
1532,"bro, dnt, u, see, infrastructure, development, india, dnt, u, see, defense, advancement, dnt, u, see, covid, vaccination, dnt, u, see, gdp, growth, max, world, dnt, u, see, new, education, policy, dnt, u, see, no, terror, attack, last, 7, yrs, indian, cities, if, u, cannot, then, go, eye, treatment, slightly_smiling_facewinking_face_with_tongue"
1533,"patiala, covid, vaccination, schedule, 9, januaryred_circlebackhand_index_pointing_down, @, patiala, politics"
1534,"so, happy, hear, positive, reviews, my, father, about, covid, vaccination, arrangement, booster, shot, staff, at, my, workplace, ."
1535,"so, much, covid, aust, now, it, is, time, govt, stops, pre, flight, testing, required, approved, aust, vaccination, rules, allow, entry, unvaxd, citizens, with, only, requirement, that, you, have, clear, rat, result, at, airport, arrival, fail, q, u, go, #, auspol, #, strandedaussies"
1536,"#, covidvaccination"
1537,"registeration, -, 5, mins, vaccination, -, 2, mins, observation, -, 30, mins, superb, arrangements, vaccination, 15, -, 18, year, olds, at, richardson, &, amp, ;, cruddas, jumbo, center, ,, mulund, ., well, done, #, covidvaccination, #, vaccination, #, mumbai"
1538,"today, my, twin, bro, i, received, pfizer, booster, dosesyringe, i, urge, youth, community, put, aside, myths, take, booster, dose, .#, covid19lk, let, us, win, this, covid, battle, together, flexed_biceps, thanks, everyone, who, helped, with, vaccination, process, #, srilanka"
1539,"glimpse, successful, covid, -, 19, vaccination, camp, organized, today, 08, -, 01, -, 2022, at, pragyan, school, ,, greater, noida, ."
1540,"He, has, a, notification, for, the, appointment, where, Fifi, is, in, the, "", covid, 19, vaccination, "", section"
1541,"Kovid, vaccination, work, smooth, in, Jodhpur, district, between, early, winter, and, rainy, season, ., #, largestvaccinedrive, #, unite2fightcorona, #, omicron, #, coronavirus, #, covidvaccination, #, covidappropriatebehavior"
1542,"concern, drastically, rising, covid, -, 19, cases, city, ,, hon, ’, kishoritai, pednekar, ,, mayor, -, mumbai, city, ,, visits, bkc, jumbo, covid, -, 19, facility, ., seen, diskussion, with, dr, ., rajesh, dere, ,, dean, -, bkc, jumbo, covid, -, 19, facility, ., #, covid19india, #, vaccination, #, bkccovidcenter"
1543,"#, modi4pm2024, great, feat, ., #, pminauguratescancercenter, pm, modi, highlighted, that, 90, %, eligible, population, has, been, vaccinated, with, dose, covid, -, 19, vaccination, &, amp, ;, thanked, citizens, ,, vaccine, manufacturers, &, amp, ;, health, workers, ., via, namo, app"
1544,"there, is, no, one, kailash, mansarovar, bhawan, covid, vaccination, we, are, standing, q, since, 10, am, any, body, responsible"
1545,"covid, -, 19, vaccination, has, started, age, group, 15, -, 18, years, ., our, blue, brigade, volunteer, who, successfully, received, her, first, dose, appeals, public, get, vaccinated, stay, safe, ."
1546,"everyday, we, are, collecting, sample, tracking, focusing, vaccination, at, busstand, sundargarh, municipality, .., hence, therefore, we, request, all, plz, support, us, fight, against, covid, 19, omicron, -, 3rd, wave"
1547,"this, vaccination, is, saving, us, recent, onslaught, covid, ., naman, ."
1548,""", india, crosses, 150, -, crore, covid, -, 19, vaccination, mark, """
1549,"#, pminauguratescancercenter, pm, modi, highlighted, that, 90, %, eligible, population, has, been, vaccinated, with, dose, covid, -, 19, vaccination, &, amp, ;, thanked, citizens, ,, vaccine, manufacturers, &, amp, ;, health, workers, ."
1550,"first, dose, covaxin, was, vaccinated, today, ., finally, time, had, come, ..., folded_handsmicrobesyringe, face_with_medical_mask, #, vaccination, #, 1stdose, #, covaxin, #, covid_19"
1551,"covid, vaccination, center, syringemicrobe, .."
1552,"#, pminauguratescancercenter, pm, modi, highlighted, that, 90, %, eligible, population, has, been, vaccinated, with, dose, covid, -, 19, vaccination, &, amp, ;, thanked, citizens, ,, vaccine, manufacturers, &, amp, ;, health, workers, ., via, namo, app"
1553,"#, pminauguratescancercenter, pm, modi, highlighted, that, 90, %, eligible, population, has, been, vaccinated, with, dose, covid, -, 19, vaccination, &, amp, ;, thanked, citizens, ,, vaccine, manufacturers, &, amp, ;, health, workers"
1554,"go, any, covid, vaccination, center, which, is, nearest, you, approach, concerned, person, ., he, /, she, ', ll, help, you, with, this, ., note, :, carry, aadhar, card, ."
1555,"covid, -, 19, vaccination, children, 15, 18, age, category, began, january, ., #, covid19vaccine"
1556,"#, vaccination, #, covid19vic, #, aashaherbals, #, thoughts, #, pmoindia, "", india, crosses, 150, -, crore, covid, -, 19, vaccination, mark, """
1557,"india, crosses, 150, crore, covid, -, 19, vaccination, mark, mask, up, people, folded_hands, #, 150crorevaccine, #, vaccination, #, covid_19, #, staysafestayhealthy"
1558,"some, glimpses, covid, 19, vaccination, children, at, rishra, girl, high, school, today, folded_handsfolded_handsfolded_hands"
1559,"important, :, we, at, pragyan, school, ,, gr, ., noida, with, support, goi, ,, are, organizing, free, covid, -, 19, vaccination, camp, kids, aged, 15, -, 18yrs, any, school, saturday, 08, -, 01, -, 22, 1030, 1500hrs, ., adhaar, ,, school, id, &, amp, ;, accompanying, parent, is, must, ."
1560,"If, the, salaries, of, the, testing, teams, working, in, covid, ,, vaccination, teams, ,, should, be, increased, on, time, ,, then, only, the, government, will, be, properly, appreciated, ."
1561,"covid, vaccination, &, amp, ;, it, is, effects, menstruation, ., good, thread, ., crux, :, delayed, it, half, day, two, days"
1562,"during, fifth, wave, covid, -, 19, has, made, abrupt, decision, close, mass, vaccination, center, at, f, -, 9, park, ., why"
1563,"patiala, covid, vaccination, schedule, 8, januaryred_circlebackhand_index_pointing_down, @, patiala, politics"
1564,"you, are, known, speaking, up, truth, even, if, it, hurts, prospects, parties, you, work, for, ., what, will, vaccination, do, especially, when, 90, %, those, affected, big, cities, are, those, who, have, already, been, vaccinated, word, vaccine, itself, wrt, covid, is, flawed, ."
1565,"covid, 19, vaccination, drive, was, carried, out, effectively, age, group, 15, -, 18, years, full, swing, by, bbmp, health, officials, at, ripu, reva, independent, pu, college, ganganagar, #, revaindependentpucollege, ,#, ganganagar, ,#, covid19, ,#, indiafightscorona, ,#, thehindu"
1566,"1, ⃣, 50, ⃣, crore, vaccine, doses, administered, india, India, achieved, another, milestone, under, leadership, pm, ji, tireless, efforts, war, against, against, covid, -, 19, by, front, line, warriors, ,, india, reaching, another, milestone, 150, +, crore, vaccination, #, vaccine4all"
1567,"instructions, aimim, president, br, asaduddin, owaisi, sb, aimim, general, secretary, &, amp, ;, mla, yakutpura, syed, ahmed, pasha, quadri, sahab, participated, vacination, awarness, program, at, telangana, govt, miniority, school, along, with, corporaters, covid, vaccination, center, 15, 18, years"
1568,"living, by, example, hats, off, bringing, confidence, all, parents, ...., science, ftw, #, covid19, #, covidvaccination, #, children, #, science"
1569,"i, write, this, article, how, systematic, diskrimination, against, trans, persons, healthcare, system, need, end, now, ., we, need, ensure, that, every, trans, person, has, access, covid, vaccination"
1570,"covid, -, 19, vaccination, drive, at, project, mala, school, guria, students, aged, 15, -, 18, years, ."
1571,"it, is, important, we, all, get, vaccinated, reduce, risk, hospitalization, death, covid, ., but, wearing, high, quality, n95, mask, ventilation, rooms, are, more, important, prevent, infection, ., vaccination, is, last, line, defense, ."
1572,"Chikkaballapur, district, first, place, in, covid, -, 19, vaccine, for, young, people, #, chikkaballapur, #, covid19, #, vaccination"
1573,"among, 1, ,, 228, ,, 664, persons, who, completed, primary, vaccination, during, december, 2020, –, october, 2021, ,, severe, covid, -, 19, –, associated, outcomes, 0, ., 015, %, or, death, 0, ., 0033, %, we, are, rare, ., risk, factors, severe, outcomes, included, age, ≥, 65, years, ,, immunosuppressed, ...., 1, /, 2"
1574,"hope, you, get, well, soon, ., we, need, remember, covid, is, primarily, airborne, disease, spreads, closed, indoors, ., vaccination, is, last, line, defense, ."
1575,"hi, doing, ask, me, anything, covid, ., send, your, questions, ., will, answer, them, myself, or, tag, someone, who, can, ., remember, ,, no, question, is, stupid, ., just, ask, any, doubts, ., #, covid19, #, omicron, #, vaccination"
1576,"sri, lanka, air, force, establishes, 24x7, covid, -, 19, vaccination, center, today, at, bia, administer, pfizer, vaccines, sri, lankans, arriving, abroad, if, they, have, not, been, vaccinated, with, first, ,, second, or, booster, doses, :, slaf, spokesman, #, srilanka, #, lka"
1577,"#, jodhpur, mega, covid, vaccination, campaign, 07, Jan, 2022, Vaccination, is, going, on, reach, your, nearest, vaccination, center, and, apply, your, desired, first, and, second, dose, #, largestvaccinationdrive, #, unite2fightcorona, #, covidvaccination"
1578,"sri, lanka, air, force, setup, 24x7, covid, -, 19, vaccination, center, at, bandaranaike, international, airport, bia, administer, pfizer, vaccines, sri, lankans, arriving, overseas, if, they, have, not, been, vaccinated, with, first, ,, second, or, booster, doses, -, slaf, #, lka, #, srilanka"
1579,"india, reports, 1, ,, 17, ,, 100, fresh, covid, cases, ,, 30, ,, 836, recoveries, ,, 302, deaths, last, 24, hours, daily, positivity, rate, :, 7, ., 74, %, active, cases, :, 3, ,, 71, ,, 363, total, recoveries, :, 3, ,, 43, ,, 71, ,, 845, death, toll, :, 4, ,, 83, ,, 178, total, vaccination, :, 149, ., 66, crore, doses, #, coronaupdate, #, covid_19"
1580,"covid, -, 19, vaccination, every, people, be, safe, coronavirus"
1581,"we, all, thought, it, was, over, but, it, isn, ’, t, not, yet, just, hang, on, ,, have, faith, ,, do, your, best, ,, we, all, will, win, over, it, #, socialdistancing, #, hygiene, #, mask, #, vaccination, #, covid, #, omicron"
1582,"#, covid19india, #, covid19, india, reports, 1, ,, 17, ,, 100, fresh, covid, cases, ,, 30, ,, 836, recoveries, ,, 302, deaths, last, 24, hours, daily, positivity, rate, :, 7, ., 74, %, active, cases, :, 3, ,, 71, ,, 363, total, recoveries, :, 3, ,, 43, ,, 71, ,, 845, death, toll, :, 4, ,, 83, ,, 178, total, vaccination, :, 149, ., 66, crore, doses"
1583,"govt, must, clearly, elucidate, advantage, booster, dose, covid, /, omicron, vaccination, ."
1584,"people, are, getting, covid, even, after, full, vaccination, &, amp, ;, previous, history, covid, ., vaccine, created, based, previous, strains, may, not, have, any, meaning, context, new, highly, mutated, strain, ., so, before, judging, someone, as, “, joker, ”, you, should, go, into, depth, things, ."
1585,"india, reports, 90, ,, 928, fresh, covid, cases, ,, 19, ,, 206, recoveries, ,, 325, deaths, last, 24, hours, daily, positivity, rate, :, 6, ., 43, %, active, cases, :, 2, ,, 85, ,, 401, total, recoveries, :, 3, ,, 43, ,, 41, ,, 009, death, toll, :, 4, ,, 82, ,, 876, total, vaccination, :, 148, ., 67, crore"
1586,"usa, newcovid, cases, added, as, 5th, jan, 5, ,, 85, ,, 535, usa, newcovid, deaths, added, as, 5th, jan, 1329, india, newcovid, cases, added, as, 6th, jan, 71, ,, 397, india, new, covid, deaths, added, as, 6th, jan, 325, ., total, vaccination, 148, crores, ., awesome, ., #, indiafightscovid, ., #, modigriponcovid, #, namo"
1587,"covid, vaccination, ,, gorakhpur, 6, ., 1, ., 22, booth, 325, 1st, 28197, 2nd, 11248, total, 40445, 15, --, 17, years, ---, 12386, #, gorakhpur, #, covid"
1588,"national, pg, college, ,, lucknow, organize, #, vaccination, camp, tomorrow, 7, ., 1, ., 2022, 10Happy_face_smiley0, am, 4, pm, at, auditorium, 1, college, campus, 15, +, year, students, college, ,, said, principal, devendra, kumar, singh, #, covid19, #, covid_19"
1589,"#, covid, #, gujarat, #, covid19, covid, certificate, :, 9013151515, save, this, number, type, certificate, whatsapp, you, will, get, covid, vaccination, certificate, ."
1590,"covid, vaccination, at, golden, valley, school, dharmanagar, north, tripura, under, age, group, 15, -, 18, years, ."
1591,"#, mega, #, covidvaccination, day"
1592,"#, amravati, fights, #, coronavirus, amc, is, successfully, executing, covid, -, 19, vaccination, drive, age, group, 15, -, 18, amravati, city, at, 5, specially, designated, centers, ."
1593,"#, jodhpur, mega, covid, vaccination, campaign, 07, Jan, 2022, #, largestvaccinationdrive, #, unite2fightcorona, #, covidvaccination"
1594,"#, india, ’, s, #, covid, -, 19, #, vaccination, coverage, crosses, 149, ., 57, crores, with, more, than, 85, lakh, vaccine, doses, administered, till, 7, pm, today, :, government, india, #, covid19, #, vaccine, #, breaking, #, sonusharmajournalist, #, breakingnews, #, news"
1595,"syringelet, ', s, get, vaccinated, right_arrow, ️, special, vaccination, camp, south, delhi, 7th, jan, ,, 2022, ., right_arrow, ️, age, :, 15, -, 18, years, right_arrow, ️, vaccineFrown_sad_andry_or_poutingovaxin, right_arrow, ️, time, :, 10, ., 00am, -, 3, ., 00pm, right_arrow, ️, kindly, book, slot, before, going, ., no, walk, -, ins, ., #, covid_19"
1596,"booster, shot, done, syringe, 2nd, dose, pfizer, ., 4th, dose, covid, vaccination, already, ., get, yours, soon, when, it, is, your, turn, ., keep, yourselves, safe, ., #, ว, ั, คซ, ี, นเต, ็, มแขน"
1597,"my, appeal, public, at, large, not, be, worried, follow, #, covid_appropriate_behavior, ,, including, proper, masking, ,, washing, hands, ,, avoiding, crowds, &, amp, ;, vaccination, is, crucial, ., do, not, panic, ,, it, is, mild, disease, ,, but, stay, alert, ., #, covid, #, covid19"
1598,"hi, guys, aapko, patel, nhi, he, 15, sal, ke, bacho, ka, covid, vaccination, kaise, karna, he, aur, dose, kaise, book, karte, he, mene, youtube, per, video, banaye, he, usko, jake, check, out, kijiye"
1599,"#, breaking, :, more, than, 17, %, adolescents, ,, aged, 15, -, 18, ,, have, received, their, first, shot, #, covid_19, vaccine, within, three, days, vaccination, drive, began, this, cohort, january, 3, ,, says, union, health, ministry, ., #, covidvaccination, #, covaxin4kids, #, breakingnews"
1600,"covid, vaccination, schedule, 7, januaryred_circlebackhand_index_pointing_down, @, patiala, politics"
1601,"drives, home, message, importance, #, covidvaccination, children, -, as, much, crucial, them, as, it, ’, s, us, adults, ., parents, 15, –, 18, -, year, -, old, ,, don, ’, t, hold, back, ., drop, hesitation, immediately, get, teenager, your, house, get, that, #, surakshakatika, time, is, now"
1602,"roll, up, sleeves, time, do, proud, teams, ,, ever, -, ready, go, extra, mile, this, covid, era, ,, be, it, mobilizing, relief, or, organize, vaccination, camps, ., teams, swung, into, action, as, soon, as, #, childrenvaccination, drive, kicked, off, ., up, ,, hp, ,, k, ', taka, touched, &, amp, ;, ready, "", go, places, ""..."
1603,"#, covidvaccination, till, january, 5, ,, 5, ., 30, pm, ,, total, 90, ,, 505, children, age, group, 15, -, 17, have, been, vaccinated, across, #, delhi, ., wednesday, ,, 36301, children, we, are, inoculated, ."
1604,"novak, djokovic, has, been, denied, entry, australia, by, country, ', s, border, force, faces, deportation, after, his, visa, was, canceled, amid, row, over, his, medical, exemption, covid, vaccination, rules, ."
1605,"we, have, become, like, windows, pc, ., need, vaccination, updation, as, software, covid, changes, variant, ., #, omicron, #, bhagwanbachalo, ."
1606,"Youthful, enthusiasm, for, #, jodhpur, covid, vaccination, ., We, are, determined, for, vaccination, from, morning, ., #, largestvaccinationdrive, #, unite2fightcorona, #, covidvaccination, #, coronavirus, #, omicron"
1607,"warning, ️, announcement, by, #, covaxin, makerswarning, ️, no_entry, ️, no, paracetamol, recommendation, children, after, #, vaccination, as, symptoms, resolves, within, 1, -, 2, days, man, ‍, medical_symbol, ️, health_worker, paracetamol, be, taken, only, if, physician, recommends, face_with_medical_mask, syringeleft, -, right_arrow, ️, soap, #, varanasifightscorona, #, varanasi, #, kashi, #, banaras, #, vaccinesideeffects"
1608,"semantically, ,, "", treatment, "", is, infected, patients, ., pandemics, ,, increasing, infected, patients, are, roots, unstoppable, outbreaks, ., vaccination, is, much, better, proactive, way, save, lives, ., rack, your, brains, that, rush, get, yourself, vaccinated, against, covid, now"
1609,"Adolescents, between, the, ages, of, 15, and, 18, participated, in, the, #, covidvaccination, campaign, today, in, the, ongoing, vaccination, campaign, at, Seth, RT, School, in, Vastrapal, ward, ., Children, safe, ,, future, secure, ."
1610,"#, covidkit, |, Postman, in, Bihar, will, deliver, corona, kit, #, covid19, #, corona, #, coronavirus, #, covidvaccine, #, covidvaccination, #, vaccine, #, vaccination, #, coronaupdate, #, coronavirusupdates, #, postman, #, biharcovidcases, #, biharfightscorona, #, bihar, #, covid19india, #, indiafightscorona, #, india"
1611,"việt, nam, has, injected, 90, percent, it, is, adult, population, with, two, covid, -, 19, vaccine, doses, so, far, is, among, six, countries, with, highest, vaccination, rate, worldwide, syringeflexed_bicepsmedium_skin_tone"
1612,"#, covid, -, 19, update, 148, ., 67, cr, #, vaccine, doses, have, been, administered, so, far, under, nationwide, vaccination, drive, #, india, ', s, active, caseload, currently, stands, at, 2, ,, 85, ,, 401, active, cases, account, less, than, 1, %, total, cases, ,, currently, at, 0, ., 81, %, recovery, rate, currently, at, 97, ., 81, %"
1613,"#, false, #, propaganda, against, #, covidvaccination"
1614,"covid, 19, vaccination, among, 15, -, 18, age, group, ,, sez, ,, smc, :, ,, ,, ,"
1615,"#, elections, health, secretary, rajesh, bhushan, ', s, meeting, with, eci, begins, commission, is, diskussing, covid, protocols, ,, vaccination, status, new, guidelines, upcoming, elections, with, rajesh, bhushan, ."
1616,"covid, 19, vaccination, among, 15, -, 18, year, age, group, ,, sez, ,, smc, :, ,, ,, ,"
1617,"italy, made, covid, -, 19, vaccination, mandatory, people, age, 50, ,, one, very, few, european, countries, take, similar, steps, ,, attempt, ease, pressure, it, is, health, service, reduce, fatalities"
1618,"#, vaccination, #, who, #, nwo, #, greatreset, covid, scam, will, continue, until, 2025, says, doctor, ., will, people, tolerate, it, thinking_face"
1619,"you, got, respect, rule, other, country, as, simple, as, that, ..., vaccination, is, key, fighting, against, covid, ..., if, australia, does, not, permit, they, are, absolutely, right, their, part"
1620,"back, at, vaccination, center, parent, ', s, booster, shots, ., #, boosterjab, #, covid_19, #, donttakeitlight"
1621,"do, not, know, how, much, i, agree, with, last, two, lines, .., but, first, two, lines, ..., yo, count, me, in, ..., down, with, covid, first, time, 2, yrs, best, part, is, after, double, vaccination, thinking_facewinking_face_with_tonguehugging_face"
1622,"bihar, ', s, covid, vaccination, brand, ambassador"
1623,"covid, vaccination, coverage, punjab, is, 72, %, 53, %, fully, vaccinated, ;, 19, %, partially, vaccinated, ., this, is, very, encouraging, ,, but, 5th, wave, covid, has, just, entered, pakistan, with, rapidly, spreading, omicron, variant, ., 1, /, 2"
1624,"you, are, absolutely, wrong, here, ., at, my, sons, schools, ones, who, want, vaccinations, are, specific, community, ,, they, do, not, control, screen, times, ,, or, sugar, intake, or, anything, else, ., i, do, restrict, my, sons, exposure, crap, social, media, ,, sugar, ,, covid, vaccination, ., do, not, stereotype"
1625,"take, care, .., i, guess, ,, hv, regular, covid, like, system, /, s, but, god, doctor, save, me, ., 1st, savarno, clue, .., were, work, even, during, lockdown, eat, all, goli, ,, jari, ,, water, 2nd, wave, same, than, #, vaccination, ., work, ,, mask, did, go, through, random, test, while, traveling, but, do, not, hv, confirm, report, ."
1626,"i, wonder, why, is, echs, not, providing, covid, vaccination, facility"
1627,"what, has, similarity, between, #, covid, donald, trumph, ., ., ., ., ., ., both, did, not, allow, anyone, enter, their, country, ., #, covid_19, #, covid19, #, omicron, #, thirdwave, #, vaccination, #, lockdown, #, donaldtrumph, #, stayhome, #, staysafe, #, ihuvariant, #, indiafightscorona"
1628,"What, the, heck, is, this, ,, Therla, ?, #, Corona, #, students"
1629,"#, jodhpur, 05, ., 01, ., 2022, covid, positive, status, #, coronavirus, #, omicron, #, covidappropriatebehavior, #, covidvaccination"
1630,"let, us, get, vaccinated, special, walk, -, in, vaccination, camp, south, delhi, 6th, jan, ,, 2022, ., age, :, 18, +, years, vaccineFrown_sad_andry_or_poutingovaxin, covishield, time, :, 10, ., 00, am, 4, ., 00, pm, no, need, book, slot, #, covid_19, #, covidupdate"
1631,"May, God, benefit, it, @, ngha, covid, -, 19, vaccination, center, riyadh"
1632,"#, covaxin, sessions, will, be, organized, for, the, age, group, of, 15, to, 18, years, at, the, following, sites, on, 6th, January, 2022, in, #, jodhpur, district, ., Please, reach, your, nearest, center, and, get, your, covid, vaccination, done, ., #, largestvaccinedrive, #, unite2fightcorona, #, covidvaccination, #, omicron, #, covidfreejodhpur"
1633,"I, am, at, covid, -, 19, dha, vaccination, center, dubai"
1634,"patiala, covid, vaccination, schedule, 6, januaryred_circlebackhand_index_pointing_down, @, patiala, politics"
