,0
2146,"visit, secretary, #, pwdpunjab, masood, mukhtar, various, #, covid, vaccination, centers, pindi, bhattiyan, ,, district, hafiz, abad, connection, with, #, redcampaignpunjab, #, covidvacccine, #, pwdpunjab"
2147,"hope, tests, prove, once, all, #, omnicronvariant, as, "", contagious, but, with, mild, covid, illness, effects, ."", with, malaysia, ', s, vaccination, progress, so, far, ,, it, is, advisable, continue, wear, masks, n, remain, vigilant, ., covid, teachings, :, "", live, d, present, "";, do, yr, duty, n, be, humble, ,, gratitude"
2148,"morning, covid, 19, vaccination, at, bhathena, community, hall, ,, sez, ,, smc, :, ,, ,"
2149,"Warned, not, to, be, lax, in, work, ., The, district, administration, is, continuously, working, for, cent, percent, vaccination, ,, he, instructed, the, employees, of, the, center, not, to, make, any, mistake, in, the, work, and, keep, good, behavior, from, everyone, ., #, amchobastar, #, bastar, #, chhattisgarh, #, vaccinationbastar, #, covidvaccination"
2150,"ri, ,, anc, check, up, ,, ncd, screening, ,, opd, &, amp, ;, covid, vaccination, hwc, malgaon, by, cho, reetam, singh, jaiswal, &, amp, ;, team"
2151,"arrange, vaccination, spot, besides, some, marathon, event, 1, ., event, is, making, loud, noise, ., 2, ., you, only, allow, small, space, vaccination, ., 3, ., do, not, even, have, 1, meter, distance, ., are, you, crazy, not, enough, covid, cases"
2152,"due, heavy, rainfall, impending, cyclone, ,, covid, vaccination, 4th, december, 2021, will, be, postponed, ., those, who, have, booked, online, slots, covid, vaccination, 4, /, 12, /, 2021, are, requested, avail, vaccination, 6, /, 12, /, 2021, at, same, vaccination, centers, ."
2153,"aarohan, takes, step, towards, total, vaccination, ., #, covid_19, #, covidvacccine, @, iit, delhi"
2154,"wear, mask, stay, safe, #, omicron, #, omicronvariant, #, omicronindia, #, covid19, #, india, #, covid19, #, covidvaccine, #, covidvariant, #, covid, #, cartoonistbalaji, #, coronavirus, #, coronavirusupdates, #, covid19vic, #, covid_19, #, covidvaccination"
2155,"Provincial, Minister, for, Health, and, Population, of, Sindh, Dr, ., Azra, Pechoho, ', s, important, statement, regarding, vaccination, against, Corona, in, schools, and, new, variant, of, Corona, Omi, Kroon, ., #, sindhgovernment, #, sindhhealth, #, covid19, #, drazrapechuho, #, ministerhealthsindh, #, omicronvariant, #, covidvaccination"
2156,"our, mantra, should, always, be, india, first, pm, modi, coviTongue_sticking_out_cheeky_playful_or_blowing_a_raspberry, 11, ., 7, %, rise, 2nd, dose, coverage, till, november, 30, during, har, ghar, dastak, vaccination, drive, via, namo, app"
2157,"covid, -, 19, vaccination, camp, at, best, arts, science, college, sirkali, ., ., chelliah, #, azadikaamritmahotsav, #, covidvacccine, @, sirkali"
2158,"covid, -, 19, global, vaccination, campaign, --, largest, history, --, began, year, ago, with, britain, launching, it, is, drive, 8, december, 2020, ., but, with, richer, countries, now, administering, third, booster, doses, ,, many, poorer, ones, are, still, waiting, their, first, jab, ."
2159,"morning, covid, 19, vaccination, at, community, hall, ,, sez, ,, smc, :, ,, ,"
2160,"covid, -, 19, vaccination, camp, atm, ., r, ., government, arts, college, mannargudi, 02, ., 12, ., 2021, ., ., chelliah, #, azadikaamritmahotsav, #, covidvacccine, @, mannargudi"
2161,"have, given, covid, questionnaire, ,, covidd, vaccination, certificate, ,, covid, recovery, questionnaire, ,, hospital, diskharge, summary, ,, cowin, vaccination, certificate, both, doses, still, you, want, me, prove, covid, negative, ,, please, enlighten, me, ..., I, am, still, alive, though, have, not, died, coz, covid"
2162,"#, jodhpur, adopt, these, measures, ,, drive, away, corona, ., #, indiafightscorona, #, coronavirus, #, wearamask, #, socialdistancing, #, handwash, #, covidvaccination, #, missioncoronafreejodhpur"
2163,"#, jodhpur, Adopt, diskipline, ,, defeat, Corona, ., #, indiafightscorona, #, coronavirus, #, wearamask, #, socialdistancing, #, handwash, #, covidvaccination, #, missioncoronafreejodhpur"
2164,"covid, vaccination, team, melghat, hills, maharashtra, reaching, remote, village, ,, some, can, only, be, reached, by, foot, after, some, distance"
2165,"#, covid, #, vaccination, #, second, #, dose, #, marriage, #, aniversasry"
2166,"as, 29, nov, 2021, ,, 99, countries, provided, ease, travel, fully, vaccinated, indian, citizens, based, recognition, india, ’, s, covid, -, 19, vaccination, certificates, either, through, mutual, recognition, or, through, their, universally, applicable, health, protocols, :, mea, list, :"
2167,"dear, sir, ,, what, are, requirements, enter, track, regard, covid, -, 19, al, hosn, app, with, showing, double, vaccination, suitable, enough"
2168,"vaccination, campaign, will, be, start, bastar, district, saturday, 04, december, prevent, corona, virus, ., #, bastar, #, amchobastar, #, covidvaccination"
2169,"Corona, ', s, khedto, kaje, corona, vaccine, is, very, much, needed, ., Tum, bale, corona, vaccine, lagaha, and, village, para, cho, people, ', s, corona, vaccine, was, applied, to, kaje, saga, ., #, bastar, #, amchobastar, #, covidvaccination"
2170,"', har, ghar, dastak, ', campaign, is, being, closely, monitored, ensure, no, person, is, left, behind, vaccination, exercise, ., program, aims, inoculate, those, who, are, yet, take, dose, covid, vaccine, those, whose, second, shot, is, overdue, ."
2171,"#, mentalhealthmatters, #, covidvaccination, #, mentalillness, case, filed, by, me, #, telangana, has, informed, #, supremecourt, that, they, have, given, #, covidvaccine, all, persons, with, #, mentalillness, who, are, institutionalized, mental, health, institutions, it, is, state, ."
2172,"we, crossed, 125, core, covid, -, 19, vaccination, ., it, is, unprecedented, ., thank, u, all, who, helped, achieve, this, height, serve, ailing, country, men, ."
2173,"bouquetphc, -, chitravadbouquet, village, -, moj, -, khijadiya, ta, -, jamkandorana, ., completed, hundred_points, %, 1st, 2nd, dose, -, covid, vaccination, .., target, population, -, 423, ., achievement, -, 423"
2174,"#, omicron, alert, క, ో, వ, ి, డ, ్, న, ి, య, ం, త, ్, రణక, ు, తప, ్, పక, ట, ీ, క, ా, త, ీ, స, ు, క, ోం, డ, ి, if, you, are, above, 18, years, still, not, vaccinated, against, covid, ,, please, do, so, immediately, ., do, remember, take, your, second, dose, also, time, vaccination, can, help, prevent, severe, illness, due, covid, ."
2175,"Corona, Vaccine, is, completely, safe, ,, it, will, form, ', Kavach, ', in, your, body, ,, which, will, keep, you, and, your, whole, family, safe, from, Corona, ., #, bastar, #, amchobastar, #, covidvaccination"
2176,"so, news, it, seems, like, my, life, will, disappear, soon, this, f, ******, g, covid, face_with_medical_maskmicrobeunamused_faceface_with_monocle, i, mean, till, whenslightly_frowning_facewoozy_face, covid, generation, will, be, most, disturbed, gen, ., all, ..., face_with_tears_of_joy, #, stayunited, #, covidvaccination, #, omnicronvariant, #, covidcovidcovid, #, pleaseno, #, covid19, #, delhipollution"
2177,"historic, milestone, achieved, clapping_hands, congratulations, India, administering, over, keycap_1keycap_2keycap_5, crore, covid, -, 19, vaccine, doses, ., with, collective, efforts, our, frontline, warriors, &, amp, ;, citizens, ,, india, ', s, vaccination, program, under, leadership, pm, #, narendramodi, ji, is, world, ', s, largest, ."
2178,"world, aids, day, chichli, #, health, education, given, world, aids, day, dec, 1st, along, with, covid, vaccination, #, mahabhiyan, #, covidvaccination, @"
2179,""", who, coronavirus, covid, -, 19, dashboard, |, who, coronavirus, covid, -, 19, dashboard, with, vaccination, data, """
2180,"nss, units, dlspg, college, bilaspur, c, ., g, ., celebrated, #, worldaidsday, with, reema, ganguly, ,, dmc, unicef, shruti, sharma, pro, ., manager, ashayana, found, ., sachi, maniar, ,, director, sahej, found, ., ., they, informed, all, volunteers, ,, how, take, precautions, aids, also, about, covid, vaccination"
2181,"#, covidvaccination, #, vaccine_hain_urgent, In, Neemuch, district, ,, a, vaccination, campaign, was, conducted, on, 1, -, 12, -, 21, ."
2182,"india, ', s, 2nd, wave, delta, variant, was, huge, ,, infecting, more, people, than, imagined, ., reflected, 4th, national, sero, survey, showed, indians, have, covid, antibodies, ., that, is, about, 930, -, 940, million, people, at, time, when, vaccination, levels, we, are, very, low, ,, so, it, came, mainly, infection, ."
2183,"#, newindassurance, #, coronavirus, #, covidvariant, #, covid_19, #, covid, #, corona, #, insurance, #, health, #, india, #, world, #, national, #, international, #, telangana, #, policy, #, covidvaccine, #, covidvaccination, #, vaccination"
2184,"all, those, who, are, resisting, vaccination, against, covid, ., please, do, not, avoid, ., get, vaccinated, ,, today, ."
2185,"prabhat, feri, was, taken, out, village, today, carry, out, public, awareness, campaign, under, ', azadi, ka, amrut, mahotsav, ',, majhi, vasundhara, abhiyan, ,, covid, -, 19, public, awareness, ,, 100, %, vaccination, campaign, ,, importance, hygiene, ,, water, conservation, ,, tree, planting, etc, ."
2186,"after, achieving, &, gt, ;, 60, %, vaccination, we, need, remove, all, covid, mandates, treat, covid, as, normal, endemic, ."
2187,"thank, you, shree, sai, clinic, &, amp, ;, hospital, giving, me, honorary, opprtunity, head, covid, vaccination, center, ., last, 5, months, i, have, learnt, lot, about, overall, private, &, amp, ;, public, healthcare, metro, cities, ., we, need, more, affordable, healthcare, infrastructure, ., #, masked, #, getvaccinatednow"
2188,"list, covid, vaccination, centers, under, kamrup, district, #, 01, /, 12, /, 21"
2189,"covid, -, 19, vaccination, camp, at, m, ., r, ., government, arts, college, ,, mannargudi, .., chelliah, #, azadikaamritmahotsav, #, covidvacccine, @, mannargudi"
2190,"this, courtesy, boogey, covid, first, covid, then, vaccine, then, vaccination, drive, then, booter, jab, &, amp, ;, dropped, when, not, enough, vaccine, as, exports, committed, by, manufacturer, now, cycle, restarted, by, new, strain, omricon, crazy, zany_face, winking_face_with_tongue, zany_face, winking_face_with_tongue"
2191,"3, days, e, rikshaw, awareness, &, amp, ;, covid, vaccination, drive, muzaffarnagar, #, harghardastak, #, fightsagainstcorona, #, largestvaccinationdrive, #, covid100percentvaccinationchallengecampaign"
2192,"#, justiceforcoronawarrior, vaccination, covid, testing, quarantine, #, justiceforcoronawarrior"
2193,"covid, vaccination, center, f, -, 9, park, serving, 24, hrs, citizens, ., at, night, it, ’, s, difficult, find, center, due, darkness, ., are, requested, take, positive, steps, lights, direction, signs"
2194,"another, #, covid, conspiracy, i, learned, about, is, muslims, india, afraid, get, vaccinated, as, narendra, modi, put, his, face, vaccine, certificate, ., said, smth, about, muslims, having, more, children, than, hindus, ., so, vaccination, is, plot, make, muslims, infertile, ."
2195,"covid, 19, vaccination, camp, at, avvm, sri, pushpam, college, ,, poondi, ,, thanjavur, today, 30, ., 11, ., 2021, ., ., chelliah, #, azadikaamritmahotsav, #, covidvacccine, @, pondi"
2196,"50, million, plus, fully, vaccinated, persons, up, ., first, reach, this, milestone, more, than, three, fourth, eligible, population, gets, first, dose, ;, more, than, one, third, fully, vaccinated, ., #, covid19, #, covid_19, #, vaccination"
2197,"u, ., s, ., envoy, ,, religious, leaders, join, covid, -, 19, vaccination, campaign"
2198,"#, vaccinationcovidawareness, #, mobilization, covid, vaccination, awareness, activity, pri, members, at, narharpur, block"
2199,"sangma, nagar, is, hilly, area, with, poor, road, connectivity, ., people, are, reluctant, take, covid, vaccination, ., during, "", har, ghar, dastak, "", program, our, health, workers, visited, this, hard, reach, area, motivated, people, take, vaccination, #, kamrup"
2200,"opportunity, interact, with, cso, ,, dist, administration, during, district, level, meeting, emphasis, upon, covid, vaccination, left, out, areas, urban, slums, .., chaired, by, dm, lucknow, ."
2201,"currently, at, bise, lahore, ., most, employees, patrons, are, not, wearing, masks, ., no, one, asking, vaccination, certificates, ., now, new, covid, -, 19, variant, deal, with, ."
2202,"covid, -, 19, vaccination"
2203,"first, hand, hear, case, where, vaccinated, young, adult, die, shortly, after, vaccination, people, involved, prefer, think, terms, causation, but, correlation, is, not, causation, but, did, not, argue, w, them, i, am, vax, ,, hence, protected, covid, as, i, got, covid, recently, is, fine"
2204,"covid, vaccination, session, site, 30, ., 11, ., 21"
2205,"India, has, better, #, covidvaccination, percentage, than, South_Africa, “, on, paper, ”, as, i, understand, that, people, who, have, died, have, got, second, dose, after, skull, &, amp, ;, many, others, are, getting, certificates, without, second, dose, received, 3, out, small, sample, 70, -, 80, ."
2206,"covid, 19, vaccination, ., awasye, lagwai, sabhi, des, washiyo, ."
2207,"sing, sikh, hote, h, chutya, insaan, mujhe, gyaan, pelne, wale, sale, tere, pe, hindi, bhi, dhang, se, nhi, likhi, gai, or, kia, kaha, penchar, jodne, gandgi, felane, ki, baat, ki, tha, missile, man, muslim, covid, vaccination, wo, bhi, muslim, or, kia, tere, panchar, me, ni, h, kia, karne, wale"
2208,"keycap_4keycap_5, lakh, people, are, overdue, second, dose, karnataka, but, they, are, not, coming, forward, one, dose, doesn, ’, t, protect, you, covid, ,, get, second, dose, before, it, ’, s, too, late, #, vaccination, #, omicron"
2209,"#, omicron, #, omicronvariant, #, coronavirus, #, coronavirusupdates, #, corona, #, covid19, #, covid19india, #, covid19, #, covidvaccine, #, covid_19, #, covidiots, #, vaccinemandate, #, vaccination, #, sputnikv, folded_handslight_skin_tone"
2210,"with, help, our, covid, warriors, successfully, conducted, vaccination, camp, underprivileged, ,, at, my, residence, lucknow, today, ., we, provided, vaccination, more, than, 200, people, ."
2211,"my, son, is, 6th, std, ., his, school, is, dombivli, ., schools, are, reopening, 1st, dec, 21, ., since, south, africa, returnee, tests, covid, positive, dombivli, ,, we, parents, are, worried, send, kids, school, without, vaccination, ., need, your, views, .."
2212,"covid, vaccination, awareness"
2213,"as, part, covid, vaccination, completion, campaign, prevent, third, wave, #, covid_19, #, assam, ,, all, eligible, beneficiaries, will, be, administered, vaccines, today, till, dec, 5, ensure, 100, percent, vaccination, ., 1, /, 4, #, harghardastak"
2214,"aimim, floor, leader, sahab, along, with, sahab, today, inaugurated, special, covid, vaccination, drive, masajid, collaboration, with, govt, phcs, at, masjid, -, e, -, mohammed, mustafa, ,, wadi, -, e, -, mahmood, pillar, no, ., 230, ."
2215,"aimim, floor, leader, sahab, along, with, aimim, mla, meraj, today, inaugurated, special, covid, vaccination, drive, masajid, collaboration, with, govt, phcs, at, masjid, -, e, -, mohammed, mustafa, ,, wadi, -, e, -, mahmood, pillar, no, ., 230, ."
2216,"with, new, omicron, variant, no, one, seems, be, serious, ., hyderabad, attitude, most, people, is, "", vaccination, hogya, covid, nehi, hota, ""/"", covid, chala, geya, ""., it, is, frightening, see, majority, public, not, wearing, mask, instead, many, awareness, /, fines, ."
2217,"covid, 19, vaccination, cetnre, ,, bhathena, community, hall, ,, sez, ,, smc, :, ,, ,"
2218,"how, long, countries, will, keep, their, borders, shut, covid, is, here, stay, ., vaccination, herd, immunity, are, only, viable, solutions, ."
2219,"today, morning, pm, ji, chaired, comprehensive, meeting, which, lasted, almost, 2, hours, review, public, health, preparedness, &, amp, ;, vaccination, related, situation, covid, -, 19, ."
2220,"#, covidvaccination, ,, #, moderna, “, sir, ,, me, my, wife, we, are, vaccinated, with, moderna, vaccine, 2, shots, ,, during, our, visit, usa, ,, earlier, this, year, ., i, am, unable, obtain, universal, travel, pass, ,, as, moderna, does, not, appear, as, valid, vaccine, option, ., kindly, help"
2221,"“, double, vaccination, does, not, means, that, covid, can, not, affect, you, ”, yess, ,, keep, wearing, masks"
2222,"still, #, vaccination, is, best, tool, even, new, #, omicronvariant, let, ’, s, end, #, vaccination, hesitancy, ., let, ’, s, save, world, further, new, variants, let, ’, s, end, #, vaccineapartheid, help, poor, nations, let, ’, s, united, fight, against, #, covid_19, by, helping, each, other, ."
2223,"japan, has, allowed, it, is, doctors, prescribe, ivermectin, covid, is, widely, used, control, covid, ., you, can, check, japan, ’, s, figures, worldometer, ., average, ,, figures, are, 140, daily, now, ,, far, cry, 24, ,, 000, cases, daily, august, ., it, is, certainly, not, because, vaccination, ."
2224,"There, was, a, desire, in, my, mind, to, go, to, the, theater, and, eat, #, popcorn, ..., that, is, when, this, shit, came, #, omicron, #, omicronvariant, #, covidvariant, #, covid, #, covidiots, #, vaccination"
2225,"those, who, r, not, coming, vaccination, pose, bigger, danger, u, ., vaccine, heccitancy, has, raised, concern, health, management, ., beware, such, people, as, covid, is, again, threatening"
2226,"white, house, usa, has, urged, unvaccinated, americans, get, innocukated, soon, ., there, is, rising, resistance, against, covid, -, 19, vaccination, usa, many, countries, europe, ., be, wise, be, safe"
2227,"third, water_wave, wave, covid, -, 19, is, here, -, &, amp, ;, need, prepare, accordingly, &, amp, ;, implement, preventive, measures, like, night_with_stars, night, curfew, &, amp, ;, restriction, public, gatherings, marriages, &, amp, ;, functions, as, well, as, accelerate, d, vaccination, drive"
2228,"pm, chairs, comprehensive, high, level, meeting, review, situation, relating, covid, -, 19, &, amp, ;, vaccination, via, namo, app"
2229,"true, ,, because, they, are, not, happy, with, progress, which, country, had, done, way, we, have, come, out, covid, 19, recovered, ., nobody, could, have, done, such, mass, vaccination, .."
2230,"#, omicron, #, temblor, #, news, #, newvariant, #, covid_19, #, covidvariant, #, covidvaccine, #, vaccination, #, covid21"
2231,"i, hope, government, telangana, is, watching, developments, covid, front, closely, view, #, omicron, variant, outbreak, world, ., i, request, everyone, take, instructions, healthcare, authorities, seriously, like, vaccination, ,, masks, ,, hygiene, ."
2232,"that, is, telling, that, vaccination, programs, are, not, very, effective, containing, covid, ., what, can, world, do, now"
2233,"like, trs, claimed, field, covid, vaccination, other, states, ."
2234,"covid, 19, vaccination, fifth, camp, 26, /, 11, /, 2021, at, university, phc, ., ncc, cadets, 1, p, air, sqn, fly, ncc, puducherry, group, have, volunteered, themselves, assisting, health, workers, phc, ."
2235,"#, schoolreopen, what, has, going, school, reopening, new, covid, wave, coming, #, mask, #, nomasks, #, covidvariant, #, vaccination, #, lockdown, #, omicron"
2236,"public, announcement, mosque, covid, 19, vaccination, highly, resistance, areas, :, ,, ,"
2237,"virus, will, keep, mutating, variant, will, be, there, ,, only, thing, which, can, save, us, is, vaccination, covid, appropriate, behavior, .., covid, is, still, there, guys, .., stay, safe, …, invisible, war, isn, ’, t, over, yet, .."
2238,"#, harghardastak, covid, vaccination, camp, held, at, brookshabad, village, south, andaman, district, was, organized, by, accelerate, pace, vaccination, coverage, line, with, call, hon, ', ble, pm, ji, ., #, vaccine4all"
2239,"there, is, thin, line, between, alarm, frightening, ., i, believe, only, science, can, explain, it, not, literature, alarm, is, already, have, good, covid, appropriate, behavior, vaccination, irrespective, strain, so, it, is, mere, frightening, by, name, when, you, do, not, know, details, strain"
2240,"12, vehicles, flag, -, offed, civil, hospital, arki, achieving, 100, %, covid, vaccination, #, mopupround, #, doubledose, #, covidvaccination, #, sdm"
2241,"techno, india, dama, hospital, got, awarded, carrying, out, best, covid, vaccination, drive, by, thank, you, kolkata, trusting, us, with, this, huge, responsibility, ., #, vaccination, #, covid19, #, vaccinationcovid, #, technodama"
2242,"there, is, no, stupidity, metaverse, or, all, other, multiverse, except, current, universe, you, are, in, ., #, stupidity, #, coronaviruspandemic, #, multiverse, #, cdc, #, vaccination, #, vaccinemandate, #, mandatoryvaccination, #, populationcontrollaw, #, healthy, #, covid_19"
2243,""", har, ghar, dastak, "", covid, -, 19, vaccination, at, chiching, chara, sc, -, hwc, under, masli, phc, dhalai, district, ."
2244,"glimpses, covid, -, 19, vaccination, drive, organized, at, ab, -, hwc, karhi, ,, mungeli, where, 370, candidates, vaccinated, with, covishield, ...."
2245,"our, mantra, should, always, be, india, first, pm, modi, pm, chairs, comprehensive, high, level, meeting, review, situation, relating, covid, -, 19, &, amp, ;, vaccination, via, namo, app"
2246,"pm, chairs, comprehensive, high, level, meeting, review, situation, relating, covid, -, 19, &, amp, ;, vaccination"
2247,"true, ,, but, vote, banks, opposition, ', s, does, not, agree, pm, chairs, comprehensive, high, level, meeting, review, situation, relating, covid, -, 19, &, amp, ;, vaccination, via, namo, app"
2248,"ghar, ghar, teeka, will, save, life, pm, chairs, comprehensive, high, level, meeting, review, situation, relating, covid, -, 19, &, amp, ;, vaccination, via, namo, app"
2249,"yes, sir, ,, precaution, ia, necessary, jai, hind, sriman, pm, chairs, comprehensive, high, level, meeting, review, situation, relating, covid, -, 19, &, amp, ;, vaccination, via, namo, app"
2250,"rightly, said, sriman, jai, hind, pm, chairs, comprehensive, high, level, meeting, review, situation, relating, covid, -, 19, &, amp, ;, vaccination, via, namo, app"
2251,"prevention, is, better, than, cure, jai, hind, sriman, pm, chairs, comprehensive, high, level, meeting, review, situation, relating, covid, -, 19, &, amp, ;, vaccination, via, namo, app"
2252,"yes, it, is, true, but, so, far, not, india, pm, chairs, comprehensive, high, level, meeting, review, situation, relating, covid, -, 19, &, amp, ;, vaccination, via, namo, app"
2253,"come, know, media, new, variant, pandonmic, inter, into, south, african, country, which, one, is, 35, times, stronger, than, other, corona, pm, chairs, comprehensive, high, level, meeting, review, situation, relating, covid, -, 19, &, amp, ;, vaccination, via, namo, app"
2254,"central, team, with, state, district, official, visited, safa, village, under, chc, tangi, ,, cuttack, ,, odisha, 26, ., 11, ., 2021, har, ghar, dastak, abhiyan, covid, vaccination, supported, by, superintendent, ,, bpho, ,, bpm, ,, sector, level, mphs, ,, mphw, ,, ashas, ,, anganwadi, workers, ."
2255,"covid, 19, vaccination, site, at, subhsh, community, hall, ,, sez, ,, smc, ,, ,, ,"
2256,"there, is, no, logic, anti, vaccination, .., i, am, sure, you, know, what, vaccination, is, means, .., what, i, do, not, get, it, logic, that, you, we, are, quoting, vacinated, people, getting, covid, ., they, will, will, continue, get, it, .., it, is, severity, that, matters, ."
2257,"timely, insight, by, leading, virologists, let, us, keep, adopting, #, covid, norms, keep, up, #, vaccination, #, covidvariant, #, omicron, #, mask, #, socialdistancing"
2258,"reviewed, covid, -, 19, vaccination, related, situation, ., light, new, variant, ,, we, remain, vigilant, ,, with, focus, containment, ensuring, increased, second, dose, coverage, ., would, urge, people, continue, following, social, distancing, wear, masks, ."
2259,"view, surge, covid, -, 19, cases, elsewhere, globally, detection, new, variant, concern, omicron, ,, who, today, appealed, countries, south, -, east, asia, region, scale, up, surveillance, ,, strengthen, public, health, &, amp, ;, social, measures, ,&, amp, ;, enhance, vaccination, coverage, :, #, who, #, covidvariant"
2260,"new, variant, is, serious, threat, ., high, time, goi, gets, serious, about, providing, vaccine, security, our, countrymen, ., bad, vaccination, figures, cannot, be, hidden, long, behind, one, man, ', s, photo, ., #, omicron, #, covidvariant, #, covid"
2261,"today, ncd, screening, &, amp, ;, covid, vaccination, #, azadikaamritmahotsav"
2262,"pm, modi, chairs, meeting, take, stock, covid, situation, ,, vaccination"
2263,"new, covid, variant, must, be, used, push, through, second, vaccination, hesitancy, ."
2264,"“, assam, likely, complete, 100, %, first, dose, covid, -, 19, vaccination, by, next, week, ., 2, ., 10, crore, first, doses, administered, ,, 3, ,, 00, ,, 000, people, left, be, vaccinated, with, first, dose, .”, -, cm"
2265,"public, announcement, mosque, &, amp, ;, covid, 19, vaccination, at, resistance, areas, ,, sez, ,, smc, :, ,, ,, ,"
2266,"went, phc, gudamba, ,, lko, covid, vaccination, today, morning, after, scheduling, appointment, ,, no, health, worker, available, at, vaccination, room, ., was, shocked, see, unhygienic, environment, ., used, vials, &, amp, ;, syringes, lying, floor, ,, dustbins, we, are, overflowing"
2267,"pm, narendra, modi, is, holding, high, -, level, meeting, regarding, new, variant, covid, vaccination, campaign, ."
2268,"morning, covid, 19, vaccination, at, community, halls, ,, sez, ,, smc, :, ,, ,, ,"
2269,"pm, modi, chair, important, meeting, situation, relating, covid, -, 19, &, amp, ;, vaccination, with, top, officials, at, 10Happy_face_smiley0, am, today, ,, says, indian, govt"
2270,"morning, covid, 19, vaccination, at, kumbhariya, gam, ,, sez, ,, smc, :, ,, ,, ,"
