,0
747,"performed, duty, covid, -, 19, vaccination, session, at, rah, shimla, dated, 7, -, 2, -, 22, ., total, number, beneficiaries, we, are, 45, *., session, number, 109, ., age, group, 18, +, &, amp, ;, pd, ."
748,"covid, -, 19, vaccination, :, is, aadhaar, card, mandatory, corona, vaccination, center, gave, this, answer, supreme, court"
749,"#, supremecourt, monday, directed, all, authorities, concerned, with, #, covidvaccination, should, follow, center, ', s, policy, not, insist, aadhaar, card, administering, vaccine, ., #, covid19m, #, vaccination"
750,"covid, -, 19, vaccination, coverage, 14, districts, is, higher, than, karnataka, average, |, bengaluru, news, –, times, india"
751,"there, was, national, campaign, mass, covid, vaccination, last, week, wednesday, sunday, i, didn, ’, t, see, any, advertisement, /, sensitisation, tv, ., are, we, hoping, achieve, herd, immunity, with, this"
752,"dated, ., 07, -, 02, -, 2022, ., dpec, /, evening, meeting, reg, extended, covid, -, 19, vaccination, campaign, was, held, under, chairmanship, worthy, dc, orakzai, ., officers, distt, admin, ,, line, deptts, health, team, participated, meeting, ., ac, -, l, &, amp, ;, ms, dhq, hospital, mishti, mela, joined, via, videolink, ."
753,"malaysia, covid, 7, /, 2, confirmed, :, 2, ,, 925, ,, 254, 77, imp, diskharged, :, 2, ,, 818, ,, 650, icu, :, 135, ventilator, :, 81, vaccination, 1st, dose, :, 26, ,, 108, ,, 028, +, 16, ,, 325, 2nd, dose, :, 25, ,, 720, ,, 902, +, 759, booster, :, 12, ,, 361, ,, 663, +, 52, ,, 517"
754,"aadhar, card, not, mandate, covid, vaccination, :, government, sc, #, covid19, #, cowin, #, aadhaarid, #, supremecourt, #, justicedychandrachud"
755,"covid, -, 19, :, no, adverse, side, effects, vaccination, among, kids, so, far, ,, says, khairy"
756,"aadhaar, not, mandatory, registration, cowin, portal, covid, -, 19, vaccination, :, center, informs, sc"
757,"#, breaking, |, no, covid, restriction, assam, 15th, february, ., only, mask, mandatory, ., no, curfew, ,, no, limitation, or, restriction, cinema, halls, ,, school, ,, meeting, or, assembly, double, dose, vaccinated, people, ., physical, board, exams, double, dose, vaccination, must, ."
758,"pakistan, sets, new, record, daily, covid, -, 19, vaccination, 3rd, day, rown"
759,"aadhaar, card, not, mandatory, cowin, portal, covid, vaccination, ,, center, tells, sc"
760,"#, middaynews, |, #, aadhaarcard, not, mandatory, #, cowinportal, covid, -, 19, vaccination, ,, center, tells, sc, #, covid19vaccination"
761,"𝗥𝗮𝗺, 𝗥𝗮𝗵𝗶𝗺, 𝗷𝗶, following, inspiration, *, dera, sacha, sauda, *, are, continuously, organization, vaccination, camps, prevent, this, epidemic, like, covid, -, 19, &, amp, ;, also, making, people, aware, about, it, ."
762,"aadhaar, not, mandatory, cowin, portal, covid, vaccination, :, center, tells, sc, #, covid19, #, cowin, #, vaccination, #, aadhaar"
763,"is, there, any, rule, that, one, will, be, vaccinated, only, if, there, are, 10, people, at, govt, covid, vaccination, center"
764,"after, central, government, told, supreme, court, monday, that, submitting, aadhaar, card, details, is, not, mandatory, pre, -, condition, co, -, win, portal, covid, -, 19, vaccination, #, nltv, #, aadhaar, #, covid, #, corona, #, coronavaccine, #, omicron, #, covidvaccine, #, supremecourtofindia"
765,"government, is, urging, health, officials, accelerate, covid, -, 19, inoculations, children, amid, surge, infections, among, unvaccinated, youth, ., see, more, :, #, children, #, kids, #, covid, #, covid19, #, vaccine, #, vaccination, #, sinovac, #, sinopharm, #, เด, ็, ก, #, โคว, ิ, ด, #, ว, ั, คซ, ี, น"
766,"aadhaar, cards, not, mandatory, covid, -, 19, vaccination, :, center, tells, sc, #, vaccination, #, supremecourt"
767,"aadhaar, mot, mandatory, vaccines, :, sc, #, aadhaar, card, is, not, mandatory, #, covid, vaccines, ,, sc, has, said, ., top, court, heard, pil, seeking, remove, aadhaar, as, mandatory, document, #, cowin, registration, #, covid, #, vaccination, ., reports, ."
768,"aadhaar, card, not, mandatory, cowin, portal, covid, -, 19, vaccination, ,, center, tells, sc, –, et, healthworld"
769,"Aadhaar, card, is, not, mandatory, for, corona, virus, vaccination, ;, Centre, ', s, information, in, Supreme, Court, #, covidvaccination, #, coronavirus, vaccination, #, vaccination, #, covid19, #, coronavirus, #, vaccination, #, coronavirus, #, Aadhaarcard, #, aadhaarcard, #, government"
770,"#, national, i, apex, court, took, note, submission, disposed, plea, filed, by, siddharthshankar, sharma, who, claimed, that, aadhaar, card, was, being, mandatorily, insisted, upon, administering, covid, -, 19, vaccination, cowin, portal, ."
771,"aadhar, card, is, not, necessary, covid, vaccination, -, central, government"
772,"cowin, portal, :, aadhaar, card, not, mandatory, cowin, portal, covid, -, 19, vaccination, ,, center, tells, sc"
773,"#, banegaswasthindia, |, as, february, 7, ,, india, has, administered, over, 169, crore, #, covid19, vaccine, shots, ., here, ’, s, look, at, #, coronavirus, #, vaccination, numbers, ., more, ,, log, #, covidvaccination, #, fightagainstcovid19, #, omicron"
774,"aadhaar, card, not, mandatory, cowin, portal, covid, -, 19, vaccination, ,, center, tells, sc, #, aadhaar, #, aadhaarcard, #, covid19, #, covid19vaccination, #, cowinportal, #, supremecourt"
775,"aadhaar, not, mandatory, covid, vaccination, :, supreme, court"
776,"india, ’, s, cumulative, covid, -, 19, vaccination, coverage, exceeds, 169, ., 46, cr"
777,"today, morning, i, received, call, sulikere, phc, person, if, my, mother, precautionary, covid, dose, is, taken, ., i, said, it, is, pending, ., she, asked, birth, year, then, told, come, get, vaccination, done, ., by, evening, i, got, message, that, vaccination, is, done, ., 1, /, 2"
778,"Giving, information, to, the, Supreme, Court, ,, the, Central, Government, has, told, that, Aadhaar, is, not, a, validity, for, doing, Kovid, vaccination, ., #, covidvaccination, #, aadhar, #, supremecourt"
779,"', Aadhaar, card, ', not, mandatory, for, covid, -, 19, vaccination, ,, Center, said, in, sc, -, 87, lakh, vaccinated, without, ID, #, covid19, #, vaccination, #, aadhaarcard"
780,"covid19, vaccination, update, :, india, marches, ahead, with, another, covid, vaccination, milestone, ;, 170, crore, covid, vaccine, doses, administered, country, #, largestvaccinationdrive"
781,"covid, vaccination, :, now, this, document, will, not, be, needed, on, covin, portal, ,, center, told, supreme, court, #, covid, #, vaccination, #, supremecourt, #, covinportal"
782,"In, Bhopal, ,, the, district, administration, and, Care, India, have, jointly, organized, a, prize, draw, to, encourage, 100, %, adolescents, in, the, age, group, of, 15, to, 17, years, to, take, the, second, dose, after, the, first, dose, ., The, draw, will, be, opened, in, the, first, week, of, March, and, prizes, will, be, awarded, to, the, selected, children, ., #, covidvaccination, #, bhopal"
783,"absolutely, ,, this, brings, back, feeling, hopelessness, after, all, vaccination, rounds, that, we, have, been, through, ., we, need, change, narrative, reporting, style, if, we, really, mean, covid, being, endemic, ., show, us, fruits, vaccination, labor, ., focus, cat, 4, &, amp, ;, 5, ."
784,"oh, yes, impact, third, wave, has, been, lowered, account, vaccination, ."
785,"aadhar, not, mandatory, covid, vaccination, ,, center, sc, #, aadhar, #, covid19, #, covid, #, coronaupdate, #, coronavirus, #, cowin, #, covidvaccine, #, covidvaccines"
786,"it, is, our, duty, save, our, children, covid, -, 19, ..,, vaccination, day, at, my, school, ., alhamdulillah, #, covidvaccine, smiling_face_with_smiling_eyesthumbs_upPakistan"
787,"aadhaar, card, not, mandatory, cowin, portal, covid, -, 19, vaccination, ,, center, tells, sc, |, india, news"
788,"Officials, should, follow, Centre, ', s, policy, that, Aadhar, card, is, not, mandatory, for, covid, -, 19, vaccination, :, Supreme, Court, #, covidvaccination, #, supremecourt, #, aadhaar"
789,"Aadhar, card, is, not, mandatory, for, corona, vaccination, ,, central, government, gave, information, in, Supreme, Court, #, covid19, #, covid, #, icmr, #, supremecourt, #, modigovt, #, vaccination"
790,"covid, vaccination, :, Aadhar, card, is, not, mandatory, for, corona, vaccination, ,, the, center, said, in, sc, -, 87, lakh, people, we, are, vaccinated, without, ID, Register, for, …"
791,"Center, told, sc, -, Aadhar, card, is, not, mandatory, on, cowin, portal, for, covid, -, 19, vaccination, #, center, #, aadhaar, #, vaccination"
792,"aadhaar, not, mandatory, covid, vaccination, :, center, tells, supreme, court"
793,"#, breaking, |, aadhaar, mot, mandatory, vaccines, #, aadhaar, not, mandatory, #, covidvaccines, :, sc, underlines, center, ', s, policy, ., sc, heard, pil, seeking, remove, aadhar, as, mandatory, document, #, cowin, registration, #, covid, #, vaccination, ., reports, ."
794,"The, basis, for, covid, vaccination, is, not, a, legality, ,, the, government, said, ,, so, many, lakhs, of, people, have, been, given, the, id, vaccine, without"
795,"is, aadhaar, card, mandatory, get, covid, -, 19, vaccination, india"
796,"aadhaar, card, not, mandatory, covid, -, 19, vaccination, through"
797,"could, this, mean, we, are, we, approaching, end, third, wave, microbe, covid, cases, qatar, drop, less, than, 1000, per, day, ,, thanks, high, vaccination, drive, ., authorities, are, still, urging, people, take, precautionary, measures, stay, safe, ."
798,"all, citizens, country, will, get, two, doses, vaccine, booster, dose, against, covid, -, 19, by, december, as, per, target, ,, health, minister, zahid, maleque, said, today, ., read, more, :, #, bangladesh, #, health, #, covid19, #, vaccination"
799,"aadhaar, not, mandatory, covid, -, 19, vaccination, ,, 87, lakh, people, vaccinated, without, ids, :, center, sc, #, vaccination"
800,"india, marches, ahead, with, another, covid, vaccination, milestone, ;, 170, crore, covid, vaccine, doses, administered, country, under, leadership, pm, ji, ,, the, world, largest, vaccination, campaign, is, continuously, scaling, new, heights, clapping_handsclapping_hands, #, sabkovaccinemuftvaccine"
801,"center, told, supreme, court, that, #, aadhaarcard, is, not, mandatory, registration, #, cowin, portal, #, covid, vaccination, ., #, coronavirus, #, covidvaccine, #, covid_19, #, vaccination, #, aadhaar"
802,"aadhaar, not, mandatory, covid, -, 19, vaccination, ,, 87, lakh, people, inoculated, without, ids, :, center, tells, sc, #, aadhar, #, covid19, #, vaccination"
803,"4, ., vaccination, /, booster, rate, good, but, can, improve, 52, ., 8, %, our, adult, population, has, received, covid, -, 19, booster, dose, 5, ., positive, covid, -, 19, isolation, fully, vaccinateTongue_sticking_out_cheeky_playful_or_blowing_a_raspberry, 7, days, partially, /, non, vaccinateTongue_sticking_out_cheeky_playful_or_blowing_a_raspberry, 10, days"
804,"times, like, today, where, covid, vaccination, has, become, vital, us, as, well, as, other, people, ', s, protection, ., saint, ram, rahim, ji, has, emphasized, it, is, importance, therefore, added, 2, more, welfare, works, list, 135, i, ., e, #, getvaccinated, encourage, others, do, same, ."
805,"aadhaar, not, mandatory, covid, -, 19, vaccination, ,, 87, lakh, people, inoculated, without, ids, :, center, tells, supreme, court, read, more, at, :"
806,"aadhaar, not, mandatory, covid, vaccination, :, center, tells, supreme, court, |, #, law, #, latest, #, latestlaws, #, legalnews, #, india, #, indiannews, #, news, #, legal, #, covid19"
807,"aadhaar, card, not, mandatory, cowin, portal, covid, -, 19, vaccination, ,, center, tells, sc, #, aadharcard, #, cowin"
808,"general, :, coviTongue_sticking_out_cheeky_playful_or_blowing_a_raspberry, vaccination, breeze, three, young, siblings"
809,"#, covidvaccination, |, #, aadhaar, card, not, mandatory, registration, #, cowin, portal, :, govt, informs, sc"
810,"ranchi, dc, directs, seven, blocks, improve, covid, vaccination, performance, via"
811,"covid, vaccination, |, aadhaar, card, not, mandatory, registration, cowin, portal, :, govt, informs, sc"
812,"aadhaar, not, mandatory, covid, -, 19, vaccination, ,, 87, lakh, people, inoculated, without, ids, :, center, tells, sc"
813,"positive, note, ,, our, vaccination, coverage, is, world, class, ., with, start, #, pickids, ,, 80, %, our, population, has, received, at, least, one, dose, vaccine, ., 33k, 1, %, kids, aged, 5, -, 12, have, received, first, dose, ., 52, ., 8, %, our, adult, population, has, received, covid, -, 19, booster, dose, ."
814,"aadhaar, not, mandatory, cowin, portal, covid, vaccination, :, center, tells, sc"
815,"india, ’, s, cumulative, covid, -, 19, vaccination, coverage, reaches169, ., 63, crore"
816,"aadhaar, not, mandatory, #, covid, vaccination, :, center, tells, supreme, court"
817,"adhaar, not, mandatory, covid, -, 19, vaccination, ,, 87, lakh, people, inoculated, without, ids, ,, center, tells, sc"
818,"covid, vaccination, :, Aadhar, card, is, not, mandatory, for, corona, vaccination, ,, center, said, in, sc, -, 87, lakh, people, we, are, given, vaccine, without, ID, #, covidvaccination, #, supremecourt"
819,"#, aadhaar, not, mandatory, #, covid19, #, vaccination, ,, center, tells, #, supremecourt, #, covidvaccine, #, covidvaccination, #, coronavirus, #, omicron, #, coronavirusupdates"
820,"Aadhar, is, not, required, to, pay, for, the, vaccine, #, winnews, #, aadhaar, #, covidvaccination, #, supremecourtofindia, #, centralgovt"
821,"india, ’, s, cumulative, covid, -, 19, vaccination, coverage, exceeds, 169, ., 46, cr, press, information, bureau"
822,"is, aadhaar, mandatory, covid, vaccination, here, ', s, what, center, says, #, coronavirusvaccine, #, covidvaccination, #, covid, vaccinecertificate, #, covidvaccineinindia, #, cowinportal, #, vaccinationinindia"
823,"aadhaar, card, not, mandatory, cowin, portal, covid, -, 19, vaccination, :, center, tells, sc"
824,"aadhaar, card, not, mandatory, cowin, portal, covid, -, 19, vaccination, ,, center, tells, sc, |, india, news, –, times, india"
825,"is, aadhaar, mandatory, covid, vaccination, here, ', s, what, center, says"
826,"aadhaar, card, is, not, mandatory, cowin, portal, covid, -, 19, vaccination, :, center, informs, sc"
827,"2nd, dose, covid, vaccination, being, inoculated, among, children, between, age, group, 15, -, 18, progress, #, largestvaccinedrive"
828,"To, ensure, that, 100, percent, Kovid, vaccination, can, be, done, in, Delhi, ,, the, Delhi, government, has, set, up, war, rooms, in, every, district, ., Dedicated, people, have, been, deployed, here, ,, who, will, call, people, and, tell, them, that, their, second, dose, of, vaccine, is, pending, ., #, warroom, #, vaccination, #, covid19, #, corona, #, covid"
829,"To, ensure, that, 100, percent, Kovid, vaccination, can, be, done, in, Delhi, ,, the, Delhi, government, has, set, up, war, rooms, in, every, district, ., Dedicated, people, have, been, deployed, here, ,, who, will, call, people, and, tell, them, that, their, second, dose, of, vaccine, is, pending, ., #, warroom, #, vaccination, #, covid19, #, corona, #, covid"
830,"aadhaar, card, not, mandatory, cowin, portal, covid, -, 19, vaccination, ,, center, tells, supreme, court, #, aadhaarcard, #, covid19vaccination, #, covid19vaccine, #, vaccination, #, supremecourt"
831,"aadhaar, not, mandatory, covid, -, 19, vaccination, ,, 87, lakh, people, inoculated, without, ids, :, center, tells, sc, read, story, |, #, aadhar, #, covid19, #, vaccination"
832,"vaccination, is, necessary, but, insufficient, criterion, fight, against, covid, ., equally, important, is, sop, adherence, when, going, out, :, proper, masking, ,, physical, distancing, ,, avoiding, crowds, ."
833,"covid, -, 19, vaccination, :, austria, ’, s, new, law, that, makes, vaccination, mandatory, #, covid19"
834,"#, covidvaccination, coverage, #, india, exceeds, 168, cr, #, vaccinationdrive"
835,"breaking, news, :, #, hongkong, #, riot, supporter, &, amp, ;, #, falungong, anti, -, vaxxer, doctor, arisina, ma, has, had, her, 3rd, dose, covid, vaccination, uk, vis, -, à, -, vis, her, employment, nottingham, ."
836,"vaccinated, traveler, population, adds, no, additional, risks, domestic, us, population, ., increased, immunity, levels, ,, pervasiveness, covid, -, 19, all, 50, states, ,, rising, vaccination, rates, &, amp, ;, new, therapeutics, ,, all, point, removing, testing, requirement, vaccinated, travelers, ."
837,"aadhaar, card, not, mandatory, cowin, portal, covid, -, 19, vaccination, :, center, tells, sc, #, cowin, #, aadhaarcard"
838,"aadhaar, card, not, mandatory, cowin, portal, covid, -, 19, vaccination, ,, center, tells, sc, #, covidvaccination"
839,"#, india, administers, over, 169, crore, 63, lakh, doses, #, covid, vaccines, under, nationwide, #, vaccinationdrive, #, covid19, #, vaccination, #, largestvaccinedrive, #, activecases, #, positivityrate, #, vaccinessavelives, #, indiafightscorona"
840,"aadhaar, card, not, mandatory, cowin, portal, covid, vaccination, :, center, sc"
841,"Corona, Pandemic, |, 83, thousand, 876, new, cases, with, a, decline, of, 22, percent, ,, 895, deaths, #, india, #, covidd19, #, coronavirus, #, covid, #, corona, #, vaccination"
842,"#, aadhaar, card, not, mandatory, #, cowin, portal, #, covidvaccination, ,, center, tells, #, supremecourt"
843,"covid, -, 19, vaccination, :, prevention, program, continues, regions, &, amp, ;, states"
844,""", aadhaar, card, is, not, mandatory, registration, cowin, portal, covid, -, 19, vaccination, ,"", says, center, supreme, court"
845,"umc, covid, vaccination, session, plan, dated, 08th, ,, 09th, 10th, feb, 2022, ., ., ., #, umc"
846,"grateful, god, ,, who, saved, us, second, wave, covid, ., we, we, are, infected, after, fully, vaccinated, ., that, s, y, we, are, able, come, out, when, we, we, are, infected, third, wave, ., we, lost, some, our, friends, relatives, before, vaccination, ., folded_handslight_skin_tone"
847,"putting, covid, -, 19, numbers, it, is, proper, context, ., vaccination, works, ., if, you, get, your, booster, appointment, ,, please, do, take, it, ."
848,"#, covid19, |, today, ’, s, vaccination, update, -, latest, #, covidvaccination, equation, monday, ,, february, 7, ."
849,"covid, -, 19, vaccination, has, began, age, group, 15, -, 18, years, sonal, kumar, sharma, ,, voice, -, over, artist, raipur, ,, appeals, public, get, vaccinated, combat, covid, -, 19"
850,"plan, covid, vaccination, program, at, cachar, district, 7th, ,, 8th, ,, 9th, ,, 10th, ,, 11th, &, amp, ;, 12th, 1st, /, 2nd, dose, general, cvcs, ., all, citizens, are, requested, do, their, duty, reach, out, their, nearest, center, taking, vaccine, ."
851,"earlier, this, month, ,, he, was, deported, australia, barred, playing, australian, open, not, meeting, country, ', s, strict, covid, -, 19, vaccination, rules, ., via, ##, lawyer, #, advocate"
852,"supreme, court, rules, that, authorities, must, not, insist, that, individual, produce, their, aadhaar, card, purpose, covid, vaccination, #, covid19, #, vaccinessavelives"
853,"allergic, reaction, covid, vaccination, is, not, considered, severe, should, not, prevent, individual, taking, second, dose, or, even, #, boosterdose, ."
854,"..., modern, civilizational, menace, world, by, getting, vaccinated, free, covid, 19, shots, booster, dose, ., if, you, are, 18, years, old, completed, your, second, dose, vaccination, before, six, months, you, are, eligible, get, booster, shots, free, ., you, are, requested, do, your, ...."
855,"vaccines, ., risk, post, -#, vaccination, allergy, is, very, low, according, reports, ., but, doctors, have, suggested, that, individuals, with, any, allergy, conditions, should, take, allergy, medication, before, after, getting, covid, vaccination, ., doctors, recommend, taking, covid, vaccine"
856,"#, covid, #, vaccination, sc, directs, that, authorities, will, not, insist, #, aadhaar, card, getting, vaccinated, -, justice, dy, chandrachud, &, amp, ;, justice, surya, kant"
857,"wrong, if, u, get, disease, not, taken, vaccination, it, will, be, ur, loss, ., that, is, why, we, should, all, take, vaccination, ., u, would, have, also, taken, polio, vaccination, have, not, you, have, not, u, taken, covid, vaccination, ,, if, then, why, all, students, are, teach, about, biology"
858,"aided, by, large, -, scale, #, vaccination, possibly, milder, #, omicron, variant, ,, family, doctors, ,, armed, with, paracetamol, ,, have, been, at, forefront, india, ’, s, #, covid, #, thirdwave, ., read, our, story, know, how, they, coped, with, surge, patients"
859,"cm, himanta, biswa, sarma, appeals, students, class, 10, &, amp, ;, 12, take, covid, vaccination"
860,"prime, minister, imran, khan, thanked, chinese, leadership, provision, covid, -, 19, vaccines, pakistan, which, have, been, mainstay, national, mass, vaccination, drive, ., #, pmikwinsforpakistan"
861,"chickenna, govt, arts, college, tirupur, assisted, state, govt, health, department, mega, covid, -, 19, vaccination, camp, at, tirupur, ., they, did, registration, ,, data, entry, crowd, management, ., #, covidvaccination, #, nssindia"
862,"useful, updates, *, sparkle, ️, covid, vaccination, coverage, :, 169, ., 60, crore, small_orange_diamondprecaution, doses, given, :, 1, ., 41, crore, small_orange_diamondfirst, dose, 15, -, 17, yrs, group, :, 5, ., 53, crore, small_orange_diamondpercentage, fully, vaccinateTongue_sticking_out_cheeky_playful_or_blowing_a_raspberry, 76, ., 81, %, sparkle, ️, govt, grants, emergency, use, permission, single, -, dose, sputnik, light, covid, vaccine, ."
863,"join, us, congratulating, our, team, member, ,, ,, being, recognized, by, morena, district, ', s, health, officials, behalf, mp, ', s, mission, director, -, national, health, mission, his, outstanding, support, towards, government, ’, s, covid, -, 19, vaccination, effort, #, covidvaccination"
864,"chickenna, govt, arts, college, tirupur, assisted, state, govt, health, department, mega, covid, -, 19, vaccination, camp, at, tirupur, .., they, did, registration, ,, data, entry, crowd, management, ., #, covidvaccination, #, nssindia"
865,"#, breaking, |, i, appeal, all, students, who, will, appear, class, 10th, class, 12th, examinations, take, #, covid19, vaccines, :, #, assam, cm, himanta, biswa, sarma, #, covidvaccination"
866,"covid, -, 19, vaccination, update, :, 216, ,, 538, people, yesterday"
867,"pakistan, sunday, set, highest, daily, vaccination, record, three, consecutive, days, ,, as, 1, ,, 740, ,, 554, vaccines, we, are, administered, during, last, 24, hours, nationwide, vaccination, drive, against, covid, -, 19, ., #, covid19vaccination, #, pakistan"
868,"Thailand, thai, news, reports, :, latest, updates, pushpin, top, 10, provinces, with, covid, -, 19, cases, :, bangkok, 1, ,, 391, pushpin, covid, -, 19, vaccination, update, :, 216, ,, 538, people, yesterday, pushpin, total, number, incoming, travelers, february, :, 30, ,, 218, pushpin, top, 10, inbound, air, travelers, february, :, russia, 2, ,, 573, #, thailand"
869,"h2h, surveillance, &, amp, ;, covid, 19, vaccination, :, sez, ,, smc, :, ,, ,, ,"
870,"chickenna, govt, arts, college, tirupur, assisted, state, govt, health, department, mega, covid, -, 19, vaccination, camp, at, tirupur, ., they, did, registration, ,, data, entry, crowd, management, ., #, covidvaccination, #, nssindia"
871,"under, nationwide, vaccination, campaign, ,, more, than, one, hundred, 69, crore, 63, lakh, anti, -, covid, vaccines, have, been, administered, country, so, far, ., at, present, ,, 11, lakh, 8, thousand, 938, people, are, being, treated, country, ., recovery, rate, is, 96, decimal, one, -, nine, percent, ."
872,"covid, -, 19, :, maharashtra, cumulative, vaccination, tally, crosses, 15, crore, ;, reports, #, covid19, #, maharashtra, get, epaper, daily, your, whatsapp, click, here, :"
873,"india, ’, s, covid, 19, vaccination, crosses, over, 169, crore, 46, lakh, mark"
874,"covid, -, 19, stats, india, as, 7th, feb, 2022, ,, 11, :, 00, am, active, cases, :, 1, ,, 108, ,, 907, recovereTongue_sticking_out_cheeky_playful_or_blowing_a_raspberry, 40, ,, 660, ,, 202, deaths, :, 502, ,, 905, covid, -, 19, vaccination, done, :, 1, ,, 69, ,, 60, ,, 48, ,, 044, #, covid19, #, covidstatistics, #, covidcases, #, covidcasesinindia, #, omicron, #, omicronvariant"
875,"Corona, cases, continue, to, decline, in, the, country, ,, 83, ,, 876, new, patients, surfaced, in, 24, hours, #, recoveryrate, ,, #, newcases, ,, #, coronavirus, ,, #, coronainindia, ,, #, covid19, ,, #, covidvaccination"
876,"more, than, 169, crore, 63, lakh, doses, #, covid, vaccine, have, been, administered, country, under, nationwide, vaccination, drive, so, far, ., health, ministry, says, ,, more, than, 14, lakh, 70, thousand, doses, we, are, administered, last, 24, hours, ., #, largestvaccinedrive"
877,"covid, -, 19, satus, india, :, vaccination, ,, testing, active, cases, as, 07, february, ,, 2022, ,, 8am, #, indiafightscorona"
878,"india, ’, s, cumulative, covid, -, 19, vaccination, coverage, exceeds, 169, ., 63, cr, #, newsonline, #, covid19, #, omicron, #, corona_virus, #, indian, #, major, #, cumulative, #, vaccination, #, coverage, #, exceeds"
879,"#, breaking, |, assam, ease, covid, -, 19, restrictions, february, 15, ,, chief, minister, himanta, biswa, sarma, appeals, students, class, 10, 12, take, covid, vaccination, ."
880,"#, breaking, |, assam, ease, covid, -, 19, restrictions, february, 15, ,, chief, minister, himanta, biswa, sarma, appeals, students, class, 10, 12, take, covid, vaccination, tune, watch, -"
881,"#, choosetsrtc, #, exploremedaramwithtsrtc, booster, dose, covid, vaccination, is, being, given, tsrtc, employees, ,, drafted, medaram, operations, ,, at, all, depots, nizamabad, region, ."
