,0
2171,"i, ., e, ., i, ., seventeen, ., five, ., twentynine, ,, covishield, slots, eighteen, +, beneficiaries, at, ', near, hospital, ext, nhe, ,, pig, ,, chandigarh, have, been, increased, one hundred, one hundred and fifty, ., these, can, only, be, booked, no, onsite, registration, or, walk, -, ins, will, be, possible, ., #, largestvaccinationdrive"
2172,"got, my, est, #, jab, today, #, covishield, vaccine, ., relieved, ., #, jabtakhaijaan"
2173,"grinning_face_with_big_eyesrolling_on_the_floor_laughingrolling_on_the_floor_laughingrolling_on_the_floor_laughing, vo, depend, karma, i, kensi, agai, one, ., covishield, ,, sixty, %, sardar, without, photo, reason, oxford, made, it, sit, is, indian, partner, two, ., coaxing, ,, ten, %, sardar, without, photo, reason, pure, indian, three, ., sputnik, i, ,, fifty, %, sardar, without, photo, russian, but, indian, partner, do, ., reddy, #, covid19vaccination"
2174,"respected, sirs, ,, my, mother, is, still, waiting, second, dose, covishield, ., it, has, been, more, than, one, month, after, est, dose, now, term, second, dose, is, extended, ., this, is, really, frustrating, ."
2175,"expected, this, long, while, ,, when, my, friend, not, permitted, vaccination, pic, presence, physicians, #, covishield"
2176,"that, is, because, gap, between, and, doze, covishield, has, been, changed, four, weeks, twelve, -, sixteen, weeks, ."
2177,"hi, ,, i, took, my, covishield, vaccine, first, dose, ith, april, two thousand and twenty-one, ., can, i, walk, -, in, my, nearest, vaccine, centers, monday, seventeen, ., five, ., twentynine, or, tuesday, eighteen, ., five, ., twentynine, or, wednesday, nineteen, ., five, ., twentynine, my, second, dose, covishield"
2178,"#, 1stdosecovid19vaccine, #, covishield_vaccine, #, provisional_certificate"
2179,"dear, manoj, kumar, ,, you, have, successfully, been, vaccinated, with, your, est, dose, with, covishield, sixteen, -, five, -, two thousand and twenty-one, at, 11Happy_face_smiley9, am, ., you, may, download, your, vaccination, certificate, -, -, coin"
2180,"#, update, coin, portal, has, been, updated, ., interval, twelve, weeks, must, schedule, or, receive, and, dose, covishield, now, ., #, coin, #, mysorecovidsupport, #, vaccine, #, covishield"
2181,"lasta, hai, kejriwal, ne, covishield, isi, me, mila, diya, hai, face_with_tears_of_joyface_with_tears_of_joyface_with_tears_of_joyface_with_tears_of_joyface_with_tears_of_joyface_with_tears_of_joyface_with_tears_of_joy"
2182,"there, is, only, covishield, everywhere, surgeon, except, mortis, -, is, there, vaccine, available, at, any, center, first, dose, eighteen, forty-four, ,, there, should, always, choice, citizen"
2183,"successfully, vaccinated, with, est, dose, covishield, syringe, ., thank, you, such, swift, process, ,, thanks, every, health, care, worker, folded_hands"
2184,"#, asians, pal, ., refer, this, chart, your, and, dose, #, covishieldvaccine, no, one, will, i, allowed, take, and, dose, i, covishield, prior, eighty-four, days, whether, by, appointment, or, walk, -, in, ., system, itself, has, been, set, as, per, new, time, gap, #, vaccineforall, #, vaccinated, #, vaccineregistration"
2185,"which, did, you, get, covishield"
2186,"no, choice, vaccine, only, covishield, available, eighteen, +, with, limit, center, ', i, kind, request, state, govt, buy, coaxing, sputnik, #, vaccinefor18plus, #, covidcrisis, #, covidemergencyindia, #, chhattisgarh"
2187,"me, too, ..., covishield, nine, /, three, /, two thousand and twenty-one, twenty-three, /, four, /, two thousand and twenty-one, ...., no, problem, ..."
2188,"india, government, cited, uk, experts, analysis, increase, covishield, and, dose, gap, eight, twelve, weeks, whereas, uk, decreased, gap, twelve, eight, weeks, don, i, i, know, who, is, following, whom, person_shrugginglight_skin_tone"
2189,"book, your, vaccination, given, link, ,, current, availability, slot, #, mumbai, age, group, :, forty-five, +, center, name, :, nanavati, hospital, date, :, sixteen, -, five, -, two thousand and twenty-one, pin, code, :, four hundred thousand and fifty-six, total, available, :, seventy-four, dose, available, :, zero, dose, available, :, seventy-four, fee, type, :, paid, vaccine, :, covishield"
2190,"humble, request, allow, walk, ins, thane, sixty, +, get, their, est, and, dose, covishield, or, coaxing, they, are, finding, difficult, register"
2191,"any, how, ,, serious, couid, patients, ,, need, oxygen, be, saved, ,, pneumonia, etc, ,, and, let, us, import, ,, modern, ,, sputnik, ,, pfizer, ,, sinovac, ,, i, /, o, politics, save, lives, ., coaxing, ,, covishield, produce, fewer, antibodies, against, i, ., one, ., six hundred and seventeen, but, potent, against, other, couid, -, nineteen, variants"
2192,"goi, ', i, decision, extend, gap, covishield, and, dose, twelve, /, sixteen, weeks, has, jeopardized, jobs, many, cruise, ship, crew, who, has, already, taken, est, dose, ., they, cannot, return, work, till, and, dose, is, complete, ., there, should, be, some, exemption"
2193,"Yesterday, we, also, took, the, first, dose, of, #, Covishield, ,, the, effective, vaccine, prepared, by, the, #, Serum_Institute_of_India, i, I, am, completely, healthy, i, All, of, you, are, also, requested, not, to, fall, under, any, illusions, and, get, your, vaccination, done, ..., #, unite2fightcorona"
2194,"finally, ,, got, vaccinate, thumbs_upsmiling_face_with_smiling_eyes, #, vaccinated, #, covid19, #, covishield"
2195,"I, am, waiting, for, the, second, dose, of, covishield, in, sunai, ."
2196,"#, covishield, jai, ho, i, have, completed, one, dose, fathers, completed, two, dose, #, super"
2197,"sir, ,, no, any, slot, available, corona, vaccination, surgeon, ., i, required, and, dose, covishield, ., please, suggest, ....."
2198,"face_with_tears_of_joyface_with_tears_of_joy, go, hate, somewhere, else, just, coz, he, is, saying, mix, vaccines, are, helping, world, does, not, mean, that, he, gave, it, voluntarily, ., he, had, give, it, as, part, ir, covishield, are, with, other, countries, ., but, are, you, not, proud, that, vaccines, are, mix"
2199,"can, you, advise, if, current, gap, recommended, by, govt, covishield, is, good, both, efficacy, immune, response"
2200,""", virgin, "", person, who, is, not, been, infected, with, couid, -, nineteen, ., #, covid19, #, coronavirus, #, virgin, #, coronasecondwave, #, coaxing, #, covishield"
2201,"my, parents, senior, citizens, we, are, vaccinated, and, dose, covishield, bac, i, i, clinic, yoshiwara, pin, code, four hundred thousand, one hundred and two, almost, two, weeks, back, but, we, still, have, not, received, certificates, ., can, you, please, let, us, know, how, do, we, get, access, same"
2202,"covishield, vaccine, dose, interval, :, Due, to, the, advice, of, scientists, ,, the, interval, in, covishield, dose, increased"
2203,"is, covishield, less, effective, this, is, ridiculous, ,, sit, makers, had, claimed, that, it, is, effective"
2204,"got, vaccinated, with, est, covishield, vaccine, ., #, assamfightscovid, #, gotvaccinated, #, wearmasksavelife"
2205,"People, are, floating, in, the, Ganges, as, dead, bodies, to, defame, Modi, ji, ., Har, Har, Modi, ., Dead, bodies, from, house, to, house, ., #, covidemergency, #, covishield, #, corona2ndwave"
2206,"exactly, ,, at, first, coaxing, covishield, ,, their, efficacious, raised, eyebrows, people, living, outside, bac, ,, now, meticulous, effort, being, put, only, best, carry, out, vaccination, process, has, developed, inferiority, complex, others, ., frustration, openly, surfacing, so, ."
2207,"#, vaccines, are, not, available, #, kashmir, ., govt, should, procure, vaccines, asap, maintain, that, supply, ., lockdowns, are, not, long, -, term, solution, pandemic, ,, vaccines, are, ., #, srinagar, #, covid19, #, covishield, #, coaxing, #, sputnik"
2208,"great, is, it, covishield, astra, seneca, indian, make, or, oxford, astra, seneca"
2209,"while, vaccines, are, given, center, at, is, one hundred and fifty, per, dose, ,, states, it, is, is, three hundred, per, dose, covishield, is, four hundred, per, dose, coaxing, ."
2210,"vaccine, hai, hi, toh, covishield, doses, ke, gaps, barca, rhegrinning_cat_with_smiling_eyes"
2211,"unable, two, register, portal, it, vaccinated, as, i, i, twenty-eight, ., i, #, kidneytransplant, patient, immunosuppressive, ., priority, shud, i, gun, two, pal, wid, highrisk, i, their, families, irrespective, age, #, covishield"
2212,"covishield, hi, sari, hai"
2213,"', map, chronology, smash, liaise, ', ...., folded_handsfolded_hands, #, coronavaccine, #, ssi, #, covishield, backhand_index_pointing_down"
2214,"hi, team, just, wanted, understand, what, basis, is, this, duration, changing, earlier, period, was, twenty-eight, -, fifty-six, days, covishield, then, got, changed, forty-two, days, &, amp, ;, now, eighty-four, days, ., there, are, talks, about, making, second, dose, as, more, priority, forty-five, i, your, thoughts, please, ."
2215,"chandigarh, is, vaccinating, eighteen, +, thanks, #, covishield, please, ramp, up, production, so, that, we, can, achieve, our, target, as, early, as, possible, ."
2216,"vaccinated, covishield, willing, sputnik"
2217,"sir, if, person, has, taken, covishield, then, can, he, /, she, further, take, sputnik, or, pfizer, or, any, other, vaccine, after, taking, both, doses, can, someone, take, other, vaccine, too, or, after, taking, one, dose, some, vaccine, can, other, vaccine, be, taken"
2218,"if, covishield, then, take, second, dose, ith, july"
2219,"take, care, covishield, lagwayi"
2220,"#, indiafightscorona, #, covishield, #, covid19india, #, sonusood, #, sonusoodfoundation, #, sonusoodrealhero"
2221,"pal, refer, this, chart, your, and, dose, *, covishield, *, vaccine, ., no, one, will, be, allowed, take, and, dose, covishield, prior, eighty-four, days, whether, by, appointment, or, walk, -, in, ., system, itself, has, been, set, as, per, new, time, gap, ."
2222,"immediate, needs, covishield, vaccine, at, ahemedabad, otherwise, huge, people, will, die, within, few, days, ."
2223,"sir, ,, uk, decreased, and, jab, twelve, eight, weeks, covishield, where, india, increased, twelve, weeks, based, uk, study, ., please, see, this, news, article, ., what, is, right, gap"
2224,"i, have, taken, dose, one, covishield, eight, may, two thousand and twenty-one, will, go, abroad, my, job, ,, since, time, duration, is, increased, twelve, -, sixteen, weeks, he, will, i, be, able, get, and, dose, ,, i, am, also, flows, please, revert, ..., still, no, reply, ..."
2225,"#, covishield, vaccine, first, dose, done, @, nathan, block, office"
2226,"covishield, vaccine, was, administered, by, central, government, health, department, ., vaccination, eighteen, -, forty-four, year, olds, has, been, postponed, till, further, notice, as, per, instructions, received, state, government, ve, ."
2227,"even, if, we, take, only, coaxing, ,, covishield, sputnik, alone, ..., that, is, one hundred, crore, doses, next, five, -, six, months, that, is, probably, equal, doses, rest, world, will, have"
2228,"successfully, vaccinated, without, dose, with, covishield"
2229,"i, believe, current, monthly, production, capacity, is, sixty, million, covishield, five, million, coaxing, ., so, ,, you, can, i, i, vaccinate, more, than, two, million, day, ., we, had, excess, stock, earlier, due, lower, vaccination, rate, jan, /, feb"
2230,"guys, ,, be, safe, ., early, trends, show, that, both, coaxing, covishield, have, zero, efficacy, against, radha, ., -, i, i, i, i, i, i, i, i, i, ,, i, i, i, i, घटन, i, i, i, i, i, i, i, i, i, rolling_on_the_floor_laughingface_with_tears_of_joywinking_face_with_tongue"
2231,"govt, should, not, have, start, vaccinating, eighteen, +, people, until, enough, stock, is, available, ., first, stock, enough, doses, sputnik, ,, modern, ,, coaxing, ,, covishield, etc, then, ask, people, take, it, ., one, pic, is, hardly, getting, one hundred, doses, ., what, has, use, it"
2232,"sir, ,, since, two, days, no, news, about, and, dose, covishield, vaccination, ., parents, ', and, dose, is, due, ."
2233,"#, remedisivir, covishield, best"
2234,"govt, should, review, effectiveness, approval, priority, ."
2235,"two, my, close, relatives, lost, their, life, one, need, hospitalization, even, after, taking, and, dose, ,, at, lease, fifteen, days, earlier, symptoms, ., there, is, no, system, #, pharmacovigilance, report"
2236,"inoculated, covishield, vaccine, today, at, arshad, bhavani, later, ., @, later, ,, maharashtrian, ,, india"
2237,"got, my, first, dose, covishield, vaccine, today, victory_hand, i, #, vaccinated"
2238,"inoculated, covishield, vaccine, at, aushadhi, bhavani, later, ."
2239,"#, vaccinationupdate, monday, with, may, two thousand and twenty-one, covishield, est, dose, can, be, given, people, above, sixty, yrs, ,, and, dose, covishield, can, be, given, after, eighty-four, days, est, dose, ., monday, ,, tuesday, ,, wednesday, walk, beneficiaries, will, be, allowed, maximum, one hundred, per, vaccination, center, ."
2240,"today, i, got, est, dose, vaccine, i, #, vaccinefor18plus, #, vaccinated, #, covishield, #, covid19, #, fightagainstcovid19"
2241,"#, vaccinated, #, vaccinateindia, #, vaccineforall, #, covishield"
2242,"i, have, taken, one, it, dose, covishield, vaccine, at, govt, hospital, ,, land, ., i, urge, all, people, nearby, villages, come, forward, take, vaccine, ., forty-five, +, i, thank, maintaing, sufficient, quantity, vaccine, @, hospital, ., #, karnatakafightscorona"
2243,"#, vaccinated, #, vaccinatedwarrior, #, southdistrict, #, southdelhi, #, southdelhifightscorona, #, largestvaccinationdrive, #, vaccinate, #, vaccineforall, #, covishield, #, covidsecondwave, #, staystrongindia, #, staysail, #, earmark"
2244,"All, the, members, of, the, household, took, the, first, dose, of, #, covishield, vaccine, manufactured, by, them, to, prevent, #, covid19, at, their, local, health, sub, -, center, ., Big, brother, Shri, is, requested, to, increase, the, production, of, vaccine, so, that, the, whole, of, India, can, be, #, vaccinated, ."
2245,"all, smiles, receiving, possibly, most, prized, possession, year, grinning_face_with_sweatmy, first, dose, covid19, vaccination, syringe, it, felt, overwhelming, ,, however, it, is, always, better, have, vaccination, ,, than, be, infected, by, deadly, virus, ., i, urge, everyone, get, it, as, well, ., #, covishield"
2246,"Neither, the, scientists, of, India, made, the, vaccine, of, covishield, nor, the, Indian, government, has, spent, a, single, rupee, ., #, abi, bear, fake, government, ., #, datak, #, abp_news_most_cheap_news_channel_hai"
2247,"syringe, jabbed, got, my, est, covishield, eighteen, +, vaccine, shot, today, at, rotary, community, center, tinsukia, ., no, line, up, ., clean, facility, ., mother, caring, nurses, ., charismatic, management, ., thank, you, folded_handsfolded_hands"
2248,"sir, please, do, not, wait, coaxing, get, covishield, jab, ., jo, mile, lava, lo, ."
2249,"much, thanks, i, without, this, alerts, slots, "", up, dibrugarh, "", telegram, channel, ,, slot, booking, process, would, have, been, near, impossible, ., #, covishield, #, vaccinateindia, #, vaccinationfor18plus, #, covid19india, #, cowinregistration, #, coin, #, covid19vaccine, #, covid1948"
2250,"making, each, stride, count, our, #, fightagainstcovid19, ., administered, with, covishield, at, kahalgaon, hospital, ., thanks, hosp, administration, ensuring, adequate, health, infra, #, powerwarriors, &, amp, ;, their, families, ., #, togetherwecan, #, ntpcfightscovid19, #, inthistogether"
2251,"getting, fine, with, time, grinning_face_with_smiling_eyes, ye, vaccine, hai, ya, wine, hai, gap, two, doses, increased, four, -, six, -, eight, -, twelve, weeks, face_with_open_mouth, #, covishield"
2252,"finally, ,, me, my, family, have, been, administered, first, dose, covishield, vaccine, ., it, was, well, structured, hassle, free, process, ,, right, vaccination, observation, ., much, appreciation, this, ., #, covishield, #, covid19india, #, coin"
2253,"ssi, is, more, than, fifty-five, years, old, co, ., it, must, have, made, infra, related, gradations, over, years, become, no, ., one, vaccine, manufacturer, world, ,, it, is, not, that, ssi, has, invested, millions, make, covishield, ,, infra, was, already, there, ., also, nonprofit, labors, cost, is, already, factored, in, ."
2254,"please, think, uk, ', i, decision, reduce, gap, between, two, doses, #, covishield, now, gap, between, two, doses, are, six, eight, weeks, #, uk, ., please, follow, same, as, uk, which, you, did, last, decision"
2255,"finally, vaccinated, slightly_smiling_face, step, fight, against, couid, -, nineteen, ., #, vaccinated, #, covishield, #, fightagainstcovid19"
2256,"yeah, bro, ., now, imagine, placebo, covishield, i"
2257,"today, i, got, administered, with, first, jab, covishield, vaccine, under, frontline, category, ."
2258,"yesterday, i, got, vaccinated, my, and, dose, covishield, at, tac, parking, near, jupiter, hospital, ., it, was, very, well, managed, i, came, out, within, just, sixty, mins, ,, well, maintained, vaccination, center, ., thank, you, tac, folded_handslight_skin_tonefolded_handslight_skin_tonefolded_handslight_skin_tone, ."
2259,"coaxing, ,, covishield, still, potent, against, i, ., one, ., six hundred and seventeen, strain, but, produces, fewer, antibodies, -, hindu, fifty, %, fewer, antibodies, against, indian, strain, ., this, explains, why, despite, vaccine, u, may, get, infected, ., so, markup, face_with_medical_mask"
2260,"jabbed, syringe, vaccinated, with, my, first, dose, covishield, #, letsgetvaccinated, #, markup, #, staysail, shield, #, igotmycovidvaccine"
2261,"my, mother, took, first, shot, covishield, today, ., it, took, more, than, one, month, convince, her, take, vaccine, ., #, vaccine"
2262,"got, my, first, jabsyringe, #, covishield, #, getvaccinated, #, stanhope"
2263,"At, that, moment, ,, the, covishield, became, angry, and, swollen, his, face, ,, saying, that, he, needed, more, space, between, the, first, and, the, second, ."
2264,"alot, people, are, scared, having, covishield, ,, guys, it, is, totally, safe, i, had, vaccine, days, ago, i, had, pain, ,, tiredness, fever, after, taking, vaccine, ,, i, took, cronin, advance, i, am, totally, fine, now, ., so, do, not, hesitate, go, it, ., #, covishieldvaccine, #, vaccinated"
2265,"#, largestvaccinedrive, #, sputnik, #, covishield, #, coaxing"
2266,"i, i, ve, had, my, first, vaccine, jab, covishield, today, at, thorin, sari, upvc, ., great, arrangements, we, are, done, there, ., the, atmosphere, was, clean, hygiene, ., need, thank, mam, conducting, vaccination, drives, cme, with, utmost, dedication, ."
2267,"i, had, taken, chinese, vaccine, april, after, four, weeks, i, have, taken, covishield, maybe, ., chinese, vaccine, is, activated, virus, vaccine, verywell, covishield, is, protein, based, ., is, it, advisable, get, second, dose, chinese, vaccine, principle, it, will, be, my, third, dose"
2268,"got, vaccinated, microbesyringewoozy_face, #, covishieldsyringe, #, vaccinationdonecheck_mark, i, @, kolkata"
2269,"i, got, est, dose, covishield, vaccine, check_mark_buttonrelieved_face, ., ,, ,, ,, ,, #, vaccinefor18plus, #, vaccinationdone, i, #, vaccinated, #, vaccination, #, corona_harega_India_jitega, #, covishieldvaccine"
2270,"#, 1st_dosesyringe, covishield"
2271,"got, first, dose, covishield, vaccine, at, pratapgarh, chi"
2272,"#, internationaldayoffamilies, #, salutetocoronawarriors, #, covishield, #, saturdaymotivation, #, narendramodi, #, pmoindia, #, anupamkher, #, amitabhbachchan, #, yogiadityonath"
2273,"got, est, jab, covishield, today, at, thoriasahi, upvc, ,, cutback, ., great, management, ,, clean, &, amp, ;, hygiene, environment, ., process, was, very, organized, ,, went, smoothly, everyone, was, helpful, friendly, ., dear, &, amp, ;, mam, you, did, wonderful, service, ., thank, you, slightly_smiling_face, heart_suit, i"
2274,"after, extensions, and, dose, period, ., we, hear, about, #, vaccineblending, which, are, vaccine, eligible, blending, currently, india, abroad, if, est, dose, #, covishield, or, #, coaxing, which, can, be, alternative, and, dose, #, askdoctor"
2275,"poster, design, stay, home, stay, safe, #, mask, #, corona, #, coronavirus, #, covid19, #, photography, #, prevention, #, precaution, #, health, #, protection, #, pictogram, #, graphics, #, hindi, #, hindiposter, #, coaxing, #, stayhealthy, #, stayhomestaysafe, #, vaccine, #, covishield, #, lockdown, #, poster, #, photoshop, #, jitoojadhav"
2276,"today, we, made, first, reimbursement, vaccination, cost, our, comrade, delhi, my, assessment, aipnbof, ., bulk, charged, nine hundred, covishield, we, reimbursement, half, that, amount, association, fund, ., requesting, our, other, comrades, take, private, hospital, route, early, vaccination"
2277,"first, jab, done, check_mark_buttoncheck_mark_button, #, getit, #, vaccinated, #, vaccinationdrive, #, covishield, experience, at, vaccination, center, is, very, impressive, ., registration, at, counter, check_mark_button, hygiene, check_mark_button, social, distancing, check_mark_button, overall, arrangement, check_mark_button, total, time, taken, less, than, fifteen, minutes, ., very, well, organized, ."
2278,"est, dose, covishield, vaccine, completed, successfully, todaythumbs_upOK_hand"
2279,"sorta, hoon, karin, ,, eighteen, +, vaccine, slot, hunt, hunt, forty-five, +, i, na, ho, jaayein, ..., #, covishield, #, coaxing"
2280,"book, your, vaccination, given, link, ,, current, availability, slot, #, mumbai, age, group, :, forty-five, +, center, name, :, bombay, hospital, cut, pin, code, :, four hundred thousand and twenty, date, :, fifteen, -, five, -, two thousand and twenty-one, available, capacity, :, one hundred, fee, type, :, paid, vaccine, :, covishield, #, covid19, #, coin"
2281,"finally, got, vaccinated, with, est, dose, covishield, at, upvc, impure, ., thank, you, stay, home, &, amp, ;, stay, safeclapping_hands"
2282,"some, #, whatsapp, gaan, #, covishield, #, vaccinejumla"
2283,"we, got, vaccination, as, covishield, but, certificate, got, as, co, vaccine, ."
2284,"finally, iam, vaccinatedgrinning_face_with_sweatsyringe, take, the, first, step, and, give, ., covishield, ., Folded_hands"
2285,"finally, i, got, vaccinated, with, covishield, today, thanks, making, very, smooth, process, vaccination, i, request, all, get, vaccinated, so, that, we, can, together, defeat, #, coronavirus, ....."
2286,"march, i, twentynine, :, four, weeks, been, doses, april, i, twentynine, :, six, -, eight, weeks, been, doses, may, i, twentynine, :, sixteen, weeks, been, doses, june, :, years, ., july, :, once, every, superbloodwolfmoon, august, :, when, is, halley, ', i, comet, due, september, :, say, covishield, thrice, front, mirror, you, will, immaculately, conceive, i, cure, two, couid"
2287,"got, first, dose, covishield, ., big, thanks, ,, thank, you, sir, #, indiafightscovid19, ..., we, will, win, i, indian, will, win, firefirefolded_handsfolded_hands, thanks, you, your, best, arrangement, folded_handsfolded_handsfolded_hands"
2288,"which, vaccine, u, got, ,, coaxing, or, covishield"
2289,"yes, rajesh, ., covishield, ., jadi, jadi, slot, fill, ho, jacta, i, ., was, able, book, slot, luckily, ., beaming_face_with_smiling_eyesslightly_smiling_face"
2290,"What, vaccine, do, you, need, to, get, ..., Here, are, the, prices, #, vaccinated, #, covishield, #, covishieldvaccine, #, sputnik, #, coaxing"
2291,"my, today, ', i, column, marathwada, net, later, decison, widening, gap, between, two, jabs, consideration, differing, jab, among, those, infected, with, #, covid19"
2292,"any, leads, whether, ask, is, still, doing, vaccination, forty-five, +, second, dose, or, as, per, new, guidelines, they, have, also, stopped, one, needs, wait, twelve, weeks, total, their, covishield, dose"
2293,"covishield, ,, coaxing, made, fewer, antibodies, against, i, ., one, ., six hundred and seventeen, variant, -, hindu"
2294,"covishield, ,, coaxing, made, fewer, antibodies, against, i, ., one, ., six hundred and seventeen, variant"
2295,"covishield, at, our, age, seventy-five, seventy-two, ,, time, matters, most, i, sixty, %, efficacy, or, seventy, %, efficacy, i, hardly, matters"
2296,"it, is, fallacy, that, one, develops, mild, symptoms, after, second, jab, do, away, died, couid, after, second, jab, i, covishield, #, covid19india"
2297,"Are, you, crazy, ?, By, the, time, Ungitta, spoke, ., four, may, be, talking, on, the, phone, ., Go, and, put, the, covishield, ., Cow, urine, is, not, excreted, in, the, hut"
2298,"i, have, taken, dose, one, covishield, eight, may, two thousand and twenty-one, will, go, abroad, my, job, ,, since, time, duration, is, increased, twelve, -, sixteen, weeks, he, will, i, be, able, get, and, dose, ,, i, am, also, few, please, revert, ..., its, matter, my, job"
2299,"no, we, had, both, jabs, covishield, van, but, did, not, get, any, fever, it, all, depends, individuals"
2300,"#, covishield, #, vaccines, are, not, available, fifteen, /, five, /, twentynine, at, name, sis, hospital, sec, five, ,, vashi, &, amp, ;, all, name, up, ', i, ., drive, -, in, vaccination, will, also, remain, closed, ., #, coaxing, and, dose, forty-five, +, will, be, available, at, name, hospitals, sec, a, ,, vashi, ,, nerve, &, amp, ;, aioli, nine, :, zero, am, ., #, stanhope"
2301,"It, was, the, gym, for, the, forty-five, +, people, that, even, the, eighteen, +, people, we, are, made, to, sit, while, the, puri, is, not, coming, out, ., This, is, how, raita, spreads, throughout, the, procession, ., #, vaccinationdrive, #, vaccinefor18plus, #, vaccineshortage, #, covishield, #, cocaine, #, seruminstituteofindia, #, vaccinationforall, #, covid19indiahelp"
2302,"uk, reducing, gap, between, doses, #, covishield, indian, scientists, followed, earlier, uk, increasing, gap, between, two, doses, #, vaccination"
