,0
1558,"india, has, so, far, approved, covishield, ,, coaxing, sputnik, ., any, other, vaccine, be, eligible, has, undertake, bridge, study, india, ., pfizer, ,, modern, ,, i, &, amp, ;, i, are, at, various, stages, ., mariner, singh, kejriwal, should, know, this, better, ., will, they, take, responsibility, if, things, go, wrong"
1559,"manimal, hospital, dark, informs, us, that, they, have, received, sufficient, supply, covishield, cocaine, doses, ., it, is, paid, service, ., any, one, interested, vaccination, can, approach, them, ."
1560,"i, could, be, wrong, but, this, was, could, very, well, be, naked, ...., it, is, fake, ...., they, will, take, i, nine hundred, give, fake, vaccine, ...., see, closely, name, is, covidshield, not, covishield, ....., thinking_facethinking_face"
1561,"our, small, effort, spread, awareness, about, covid19, vaccine, ., my, grandmother, mars, ., noorjahan, had, est, dose, covishield, today, ."
1562,"i, have, covishield, vaccination, slot, date, twenty-six, ., five, ., two thousand and twenty-one, at, sub, medical, campus, ,, etc, ., but, due, cyclone, warning, by, government, with, with, may, ,, it, is, not, possible, me, come, cutback, jaipur, ., so, is, it, possible, change, date, ."
1563,"covisheild, first, dose, vaccination, govt, officials, twentyfive, -, five, -, two thousand and twenty-one, may, be, public, firstdose, will, be, given, june, est, both, coaxing, &, amp, ;, covishield, now, govt, officials, plus, maintain, social, distance, use, mask, vaccination, centers, details, down, backhand_index_pointing_down, #, narasaraopet"
1564,"finally, ..., i, got, my, first, covishield, shot, ..."
1565,"#, metro, #, gotjabbedtoday, #, gotjabbed, #, tikakaran, #, covishield, russia, jana, cancel, multiply, i, cross_markmultiply, i, cross_markface_with_tears_of_joyface_with_tears_of_joyrolling_on_the_floor_laughingrolling_on_the_floor_laughing, @, government, hospital, murari"
1566,"raj, two hundred and fifty, ki, aur, kal, one thousand, ki, ., what, is, going, which, is, more, effective, two hundred and fifty, ki, ya, one thousand, ki, no, free, slots, available, eighteen, +, only, paid, are, if, we, are, lucky, get, that, ."
1567,"my, father, law, done, first, dose, covishield, at, nine, /, four, /, two thousand and twenty-one"
1568,"whether, vaccine, is, front, or, arms, ..., increases, both, age, confidence, ., Whether, the, vaccine, is, on, the, frontal, ..., or, in, the, arms, ..., Increases, both, age, and, confidence, ."
1569,"problem, is, they, are, pricing, it, twenty, times, or, more, higher, than, covishield"
1570,"bangalore, vaccine, update, ., thank, you, after, relentless, tries, website, apps, last, few, weeks, ,, me, &, amp, ;, my, wife, got, vaccinated, with, covishield, twenty-two, /, five, twentyfour, /, five, respectively, ., appreciate, your, effort, streamlining, such, tedious, online, process, clapping_handsmedium, -, light_skin_tone, #, vaccinated"
1571,"covishield, dose, 1check_mark_button, #, vaccinated"
1572,"#, vaccine, est, dose, with, #, covishielded1stdose, Today, I, have, got, my, #, covishield, vaccinated, first, ., I, request, all, the, young, brothers, and, colleagues, of, eighteen, i, you, must, also, get, the, vaccination, done, ,, Corona, will, lose, ,, India, will, win, i, #, covid19, #, covidvacccine"
1573,"what, was, medicine, your, fore, fathers, using, long, ago, ,, which, company, piss, sharath, biotech, ,, serum, institute, or, pfizer, fever, ,, cough, ,, wounds, olden, days, can, you, clarify, ,, so, accept, truth, not, logic, rev"
1574,"mars, silochana, devi, proprietor, radha, bharatgas, ,, you, have, successfully, been, vaccinated, with, your, est, dose, with, covishield, ., #, vaccinated, #, covishieldvaccine, #, covid19vaccination, #, stayhomestaysafe"
1575,"just, because, there, is, severe, shortage, covishield, coaxing, ..., now, they, should, immediately, place, orders, sputnik, ."
1576,"partially, vaccinated, syringe, ', first, dose, done, ', check_mark_button, thanks, all, our, frontline, workers, their, sacrifices, &, amp, ;, dedication, folded_handslight_skin_tone, please, do, not, hesitate, get, yourself, vaccinated, asap, ., vaccination, is, major, remedy, fight, against, this, virus, ., #, covishield, #, vaccinated, #, indiafightscorona"
1577,"#, fightagainstcovid19, #, covishield, #, stayhomestaysafe, #, campuslife, #, covid19vaccination, #, mason, #, vaccinated, "", any, army, is, as, strong, as, it, is, weakest, link, i, covishield, vaccination, camp, ssi, employees, i, families, eighteen, -, forty-five, yrs, conducted, with, cooperation, chief, medical, officer, manicure, ."
1578,"second, dose, take, five, may1021, but, not, showing, system, at, ahiyapur, begusarai, dear, shailendra, kumar, chaudhary, ,, you, have, succesfully, been, vaccinated, with, your, est, dose, with, covishield, seven, -, four, -, two thousand and twenty-one, at, eleven, :, fifty-three, am, ."
1579,"nine, /, #, valued, very, quickly, shown, you, i, re, being, given, #, covishield, vaccine, ., i, couldn, i, i, make, out, if, it, was, genuine, /, manufactured, by, sit, or, if, there, was, actual, liquid, it, ., post, -, van, ,, you, are, asked, wait, thirty, min, staging, area, four, ., no, check, if, you, leave, right, away, bow, ."
1580,"three, /, spent, good, two, +, days, tracking, slot, alerts, channels, ., high, be, loss, non, -, existent, hair, due, frustration, ., no, math, ,, but, odds, each, slot, are, somewhere, close, one, :, ten thousand, ., higher, availability, #, covishield, vis, -, a, -, vis, #, coaxing, ., got, slot"
1581,"est, dose, covishield, complete, #, 1stdosecovid19vaccine"
1582,"After, vaccinating, a, neighbor, for, is, ., one hundred and fifty, ..., now, people, will, have, to, pay, is, ."
1583,"#, task_completed, syringe, -, #, first_dose, #, covishield, #, vaccinated, #, please_get_vaccinated, #, stayhomestaysafe"
1584,"I, got, the, first, installment, of, #, GovShield, #, vaccine, ., syringe, #, kasturibai, #, to, the, hospital, karr, #, covishieldvaccine, #, vaccinefor18plus, #, vaccination, #, covishield, stay, home, stay, healthy, ., I, am, going, to, take, rest, now, ., byehand_with_fingers_splayed, i"
1585,"frontline, workers, got, covishield, ."
1586,"no, registration, app, ., nothing, ., just, walk, public, health, center, village, ., option, coaxing, or, covishield, ., good, work, nigiri, administration, ."
1587,"jabbed, syringe, vaccinated, with, my, first, dose, covishield, ., #, lets_get_vaccinated, ."
1588,"jabbed, syringe, vaccinated, with, my, first, dose, covishield, ., #, lets_get_vaccinated, ., #, makeup, ., #, stay_safe, ."
1589,"thank, ji, #, vaccinated, #, stayhomestaysafe, #, covishield, #, getvaccinated, #, indiafightscorona"
1590,"covishield, &, amp, ;, coaxing, is, available, with, private, hosp, ., but, not, with, govt, ., can, you, &, amp, ;, ur, govt, answer, that, how, can, private, hospitals, can, arrange, vaccines, with, their, limited, reach, &, amp, ;, resources, but, you, "", dill, ke, malik, "", are, helpless, &, amp, ;, keep, your, blame, game"
1591,"last, fifteen, days, i, check, eighteen, +, jab, there, is, no, slot, hyderabad, more, surprise, thing, is, that, only, paid, vaccine, are, available, is, some, fishy, there, ,, i, do, not, know, what, is, truth, behind, i, covishield, #, covid19vaccination, #, hyderabad, #, not, #, cowinapp, #, gov"
1592,"book, your, vaccination, given, link, ,, current, availability, slot, #, mumbai, age, group, :, forty-five, +, center, name, :, i, i, reliance, hosp, mumbai, one, date, :, twentyfour, -, five, -, two thousand and twenty-one, pin, code, :, four hundred thousand and four, total, :, twentyfive, dose, one, :, zero, dose, two, :, twentyfive, vaccine, :, covishield, #, covid19, #, coin"
1593,"it, phenomena, hospital, is, charging, is, ., one thousand, i, covishield, ."
1594,"all, above, eighteen, years, ,, get, vaccination, done, as, soon, as, possible, ...., god, bless, our, front, liners, our, true, heroes, all, those, working, vaccine, rollout, thank, -, you, everything, ., red_heart, i, folded_hands, ., #, markup, #, firstdose, #, firstdose, #, covishield, #, vaccinationdonecheck_mark_button"
1595,"#, gotmyshot, #, firstdosedonesyringecheck_mark, i, #, covishield, get, yourself, #, vaccinated, greatful, scientists, doctors, paramedics"
1596,"#, iamvaccinated, #, covishield, #, firstdose"
1597,"why, this, man, wants, deal, with, #, pfizer, #, modern, only, ,, why, not, tested, tried, #, coaxing, #, covishield, ,, he, is, getting, huge, cut, them, ,, #, india, is, biggest, #, pharma, market, those, companies, ,, they, are, loosing, their, ground, using, pimps, like, him, ., #, kejriwalexposed"
1598,"today, i, got, est, dose, #, covishield, #, vacation, at, #, karai, #, pic, @, karai"
1599,"today, i, got, my, #, firstshot, #, covishield, vaccine, #, covid19, ., i, had, go, #, phcdandari, 14kms, away, my, locality, ., although, #, balliamiddleschool, is, only, two, -, arms, away, ., irony, is, that, all, doses, vaccine, is, vanished, within, few, minutes, whereas, mandarin, it, is, left, unused, ."
1600,"got, vaccinated, with, est, dose, covishieldsyringe, ..., #, vaccinationdonecheck_mark, i, #, vaccination, #, covid19, #, covishield, please, stay, safe, everyone, globe_showing_Europe, -, Africared_heart, i"
1601,"Useful, information, on, Science, and, Technology, subject, for, students, preparing, for, ups, exam, writing_hand, i, elfperson_in_tuxedo, backhand_index_pointing_down, #, ups, #, scienceandtechnology, #, vaccine, #, coaxing, #, innovation, #, covishield, #, sputnik, #, pfizer, #, modern, #, sputniklight, syringehundred_pointsperson_pointsperson_pointsperson_room"
1602,"shushing_faceshushing_faceआज, i, ो..., partying_facepartying_face, dear, harish, sharma, ,, you, have, successfully, been, vaccinated, with, your, est, dose, with, covishield, twentyfour, -, five, -, two thousand and twenty-one, at, eleven, :, fifty-one, am, ."
1603,"Friends, have, got, the, vaccine, ,, now, if, you, have, put, the, photo, ,, then, it, will, also, make, an, impact, ., And, it, was, also, necessary, to, put, photos, ,, otherwise, this, society, would, not, accept, me, ., #, covid19, #, covishield, #, coronavirus, #, coronavaccine"
1604,"i, got, jabbed, posting, picture, as, well, tell, world, after, first, failed, attempt, private, hospital, ,, i, successfully, got, my, first, dose, #, covishield, government, hospital, ., #, coronavaccination, #, covishieldvaccine, #, stayhomestaysafe, #, mondaymotivation"
1605,"got, my, est, dose, #, covishield, today, ., let, us, unite, against, couid, -, nineteen, ., i, believe, one, best, ways, beat, couid, -, nineteen, is, be, vaccinated, i, syringeIndia"
1606,"sir, ,, my, first, dose, vaccination, done, by, covishield, vaccine, at, five, /, five, /, two thousand and twenty-one, outreach, camp, ., but, they, have, not, updated, my, vaccination, details, #, cowinportal"
1607,"just, got, my, est, jab, covishield, vaccine, today, ., impressively, amazing, experience, getting, vaccinated, hassle, free, at, tilak, nagar, ,, vaccination, center, ,, new, delhi, ., heartiest, thanks, &, amp, ;"
1608,"got_my_first_dose, #, covishield, Both, covishield, and, vaccine, are, safe, ,, this, is, the, most, effective, way, to, fight, corona, ,, you, should, also, get, them, installed, and, inspire, people, too, ., #, covishieldvaccine, #, vaccinated"
1609,"Today, the, first, vaccine, for, covishield, was, successfully, taken, together, with, young, colleagues, #, covishieldvaccine, #, covishield"
1610,"covishield, output, at, six, crore, ,, coaxing, output, at, two, crore, doses, /, month, ;, yet, only, five, crore, will, be, given, by, may, -, end, ., diskrepacancy, three, crore, doses, or, thirty-seven, %, needs, be, explained, ., download, toi, app, now, :"
1611,"got, vaccinated, with, est, dose, covishieldsyringe, ..., #, vaccinationdonecheck_mark, i, #, vaccination, #, covid19, #, covishield, please, stay, safe, everyone, globe_showing_Europe, -, Africared_heart, i, @, kolkata, /, calcutta, city, joy"
1612,"got, my, est, shot, covishield, today, at, govt, cac, ,, nilakantheswar, temple, ,, koelnagar, i, block, ., kudos, all, volunteers, hassle, -, free, quick, processing, inside, center, ., #, getvaccinated, #, staysail"
1613,"how, why, do, we, see, #, covishield, slots, dose, two, open, eighteen, +"
1614,"dear, jigsaw, rinche, ,, you, have, successfully, been, vaccinated, with, your, est, dose, with, covishield, twentyfour, -, five, -, two thousand and twenty-one, at, twelve, :, twenty-two, am, ."
1615,"#, covishield, #, vaccinated, smiling_face_with_sunglasses"
1616,"#, vaccinationdonecheck_mark, i, dear, ravindra, raj, ,, you, are, vaccinated, successfully, syringesyringeman, i, medical_symbol, i, man, i, medical_symbol, i, congratulations, #, covishield, #, covishieldsyringe, @, khagaria"
1617,"., hi, cme, bac, authorities, ., please, note, that, thousands, covishield, doses, lying, unused, eighteen, forty-four, age, group, rourke, ,, sundargarh, districts, while, people, cutback, bhubaneswar, are, struggling, find, slot, twin, city, are, returning"
1618,"#, coronavaccine, #, covishield, vaccine, must, be, administered, #, vaccinated, to, drive, away, #, coronavirus"
1619,"i, said, same, ,, there, is, production, supply, mismatch, above, ten, or, doses, even, at, current, level, total, doses, produced, assumed, covishield, sep, -, dec, =, five, or, jan, -, april, =, twentyfour, or, may, =, four, coaxing, =, one, +, one, +, one, +, one, +, two, =, six, totalLaughing_big_grin_or_laugh_with_glasses9, exports, =, six, net, doses, available, india, =, thirty-three, govt, supplied, =, twenty-two, crore"
1620,"coaxing, is, struggle, now, will, remain, struggle, second, dose, while, ., better, stick, covishield, now, ."
1621,"#, producerdivyeshsolanki, #, dsentertianment, #, friendsforever, #, today, i, was, taken, est, dose, #, covishield, #, vaccine, ,, all, you, ,, you, also, take, ., folded_handsfolded_handsfolded_hands"
1622,"defer, dose, two, alerts, covishield, eighteen, +, few, weeks, ., none, are, eligible, anyways, ., coin, unnecessarily, shows, those, slots, ., coaxing, can, be, deferred, till, with, may, ."
1623,"i, took, est, dose, covishield, 3rdapril, and, was, due, post, twenty-eight, days, ..., now, i, am, told, and, jab, would, be, due, post, eighty-four, days, i, from, est, jab, i, plus, suggest, about, because, change, if, you, feel, there, is, because, ..."
1624,"would, have, spoken, had, he, not, received, jab, ., he, might, have, ,, by, now, ,, got, covishield, &, amp, ;, pfizer, everyone, his, sovereign, nation"
1625,"sir, what, is, ur, opinion, aboutcovaxin, ,, if, we, compare, between, coaxing, covishield, which, is, better"
1626,"worry, mutants, partial, loss, efficacy, #, covishield, against, #, b1671, ., two, may, be, genuine, but, we, also, don, i, i, know, who, suffers, wild, is, mutant, one thousand, six hundred and seventy-one, ., one, is, mutant, one thousand, six hundred and seventy-one, ., two, india, ., good, news, is, covishield, works, well, wild, fairly, good, against, b1671, ., one"
1627,"covishield, is, eighty-four, days, ., coaxing, is, twenty-eight, forty-two, days, ., please, check, coin, which, vaccine, you, have, got, ., let, me, know, if, you, need, any, help"
1628,"*, vaccination, update, *, ., ., follow, use, #, indore_able, more, updates, ., ., ., ., ., ., ., ., ., ., #, covishield, #, largestvaccinedrive, #, indorefightscorona, #, indore, #, indorenews, #, indoreupdates, #, indoreinfo, @, indore, ,, india"
1629,"that, is, surely, excuse, ., i, have, not, taken, covishield, or, any, vaccine, ,, but, i, sleep, hours, ."
1630,"multiple, reports, said, that, over, one hundred and thirty, countries, across, globe, currently, accept, #, covishield, vaccine, enter, their, country, while, coaxing, is, accepted, only, nine, nations, also, ,, coaxing, is, not, yet, emergency, use, listing, el, ."
1631,"Tomorrow, Vaccination, is, on, twentyfour, /, five, /, two thousand and twenty-one, from, nine, am, to, two, am, at, the, following, places, ., #, nap, #, covidindia, #, covishieldvaccine, #, covishield"
1632,"no, examination, without, vaccinationdouble_exclamation_mark, i, right_arrow, i, ninety-five, %, class, twelve, students, are, above, seventeen, ., five, years, right_arrow, i, center, should, talk, health, experts, if, they, can, be, given, covishield, or, coaxing, :, dy, am, &, amp, ;, edu, minister, #, cancelexamssavestudents, #, cancelboardexams"
1633,"Oh, why, did, you, tell, the, truth, brother, ,, it, hurts, ,, is, not, it, ?, Who, explains, like, this, man, our, India, India, great, folded_handslight_skin_tone, i, #, khans, #, indian, #, vaccination, #, trending"
1634,"i, am, happy, enough, because, i, got, first, dose, covishield, vaccine, with, may, two thousand and twenty-one, at, chili, drug, chattisgarh, govt, ., primary, school, sector, seven, this, i, thank, but, at, same, time, i, feel, bad, because, i, do, not, have, any, proof, show, when, i, will, be, eligible"
1635,"est, dose, vaccination, ., ., #, vaccination, #, covishield, #, coronavaccination, #, coronafighter"
1636,"covishield, coaxing"
1637,"yes, put, hospital, hospital, vaccinations, syringe, are, available, new, available, slots, round_pushpin, pin, code, one hundred and ten thousand and seventeen, chair, dose, keycap_1, available, one hundred and forty-four, chair, dose, keycap_2, available, ten, spiral_calendar, twentyfour, -, five, -, two thousand and twenty-one, syringe, covishield, hospital, max, panchsheel, park, site, three, ,, south, round_pushpin, pin, code, one hundred and ten thousand and seventeen, chair, dose, keycap_1, available, one hundred and forty-four, chair, dose, keycap_2, available, ten"
1638,"i, i, twenty, i, got, covishield, ., no, guidelines, as, such"
1639,"got, my, shot, covishield, vaccine, ..., it, is, safe, ,, no, side, effects, seen, ..., go, got, vaccinated, soon, ..., #, delhifightscorona"
1640,"those, who, want, travel, outside, #, india, #, covishield, vaccine, is, approved, more, than, one hundred, countries, ., but, ,, #, coaxing, is, approved, only, nine, countries, ., so, choose, your, vaccine, wisely, ., source, :, #, indiatoday, #, covid19"
1641,"keeping, aside, coaxing, ,, are, people, eligible, take, and, dose, covishield, vaccine, now, even, if, it, is, available, ."
1642,"thank, u, red_heart, i, smiling_face_with_heart, -, eyes"
1643,"Waxing, rate, of, Delhi, am, Kejriwal, ji, ,, Sir, ji, why, so, ., one thousand, two hundred and fifty, i, coaxing, ., one thousand, two hundred and sixty, i, coaxing, ., nine hundred, i, covishield"
1644,"First, dose, of, Corona, Chakravyuh, -, covishieldcheck_mark_button, -, Vaccine, is, the, biggest, weapon, to, protect, against, corona, ,, you, must, also, get, the, vaccine, ,, be, safe, yourself, and, save, others, too, ."
1645,"those, who, have, taken, covishield, cannot, take, second, dose, before, eighty-four, days, ., those, with, coaxing, can, take, their, second, dose, after, twenty-eight, days"
1646,"finally, got, vaccinated, with, est, dose, covishield, ,, syringe, #, covishieldvaccine, #, vaccinated, #, vaccinefor18plus"
1647,"today, i, successfully, get, vaccinated, with, est, dose, vaccine, all, thanks, goes, great"
1648,"fifty, slots, eighteen, -, forty-four, category, -, covishield, available, with, may, at, apollo, ,, mysore, ., updated, at, five, :, 55pm, #, mysorecovidsupport, #, mysorecovid, #, mysore, #, suru, #, mysorecovid19, #, mysurucovid1, #, resources, #, covidresourcesmysuru, #, covidresources, #, mysore, #, mysorehelp, #, mysorevarthe, #, covid19"
1649,"took, my, est, covishield, dose, thanks, our, doctors, ,, scientist, ,, frontline, workers, ,, my, prime, minister, modi, ji, working, so, hard, nation"
1650,"#, covid19, #, covishield, #, vaccinated"
1651,"robin, ,, how, come, apollo, or, max, or, bulk, hospitals, have, sufficient, stocks, covishield, vaccines, with, them, ,, they, are, vaccinating, chargeable, basis, -, it, is, because, ,, they, pay, sit, advance, ,, state, governments, payment, terms, are, such, that, private, businesses, will, think, twice"
1652,"vaccination, info, #, guwahati, district, :, kamp, metropolitan, income, :, seven hundred and eighty-one thousand and eight, center, name, :, gurdwara, goliath, nagar, vaccine, :, covishield, one hundred, slots, available, twentyfour, -, five, -, twentynine"
1653,"today, me, &, amp, ;, my, parents, got, first, #, covishield, vaccine, syringe, thank, you"
1654,"vaccination, info, #, guwahati, district, :, kamp, metropolitan, income, :, seven hundred and eighty-one thousand and twenty-eight, center, name, :, raised, -, betkuchi, high, school, vaccine, :, covishield, one hundred, slots, available, twentyfour, -, five, -, twentynine"
1655,"vaccination, info, #, guwahati, district, :, kamp, metropolitan, income, :, seven hundred and eighty-one thousand and six, center, name, :, gopal, boro, is, school, vaccine, :, covishield, one hundred, slots, available, twentyfour, -, five, -, twentynine"
1656,"vaccination, info, #, guwahati, district, :, kamp, metropolitan, income, :, seven hundred and eighty-one thousand and twenty-one, center, name, :, pub, guwahati, high, school, vaccine, :, covishield, one hundred, slots, available, twentyfour, -, five, -, twentynine"
1657,"vaccination, info, #, guwahati, district, :, kamp, metropolitan, income, :, seven hundred and eighty-one thousand and twelve, center, name, :, west, guwahati, commerce, college, vaccine, :, covishield, one hundred, slots, available, twentyfour, -, five, -, twentynine"
1658,"today, i, also, took, first, dose, coronavirus, ,, working, nursarai, thank, you, so, much, health, workers, #, pic, noorsarai, #, covishield, @, noorsarai"
1659,"vaccination, info, #, guwahati, district, :, kamp, metropolitan, income, :, seven hundred and eighty-one thousand and fourteen, center, name, :, jalukbari, girls, high, school, vaccine, :, covishield, one hundred, slots, available, twentyfour, -, five, -, twentynine"
1660,"vaccination, info, #, guwahati, district, :, kamp, metropolitan, income, :, seven hundred and eighty-one thousand and twenty-five, center, name, :, ganeshpara, up, school, vaccine, :, covishield, one hundred, slots, available, twentyfour, -, five, -, two thousand and twenty-one"
1661,"vaccination, info, #, guwahati, district, :, kamp, metropolitan, income, :, seven hundred and eighty-one thousand and thirty-four, center, name, :, savitri, bharal, high, school, vaccine, :, covishield, one hundred, slots, available, twentyfour, -, five, -, twentynine"
1662,"vaccination, info, #, guwahati, district, :, kamp, metropolitan, income, :, seven hundred and eighty-one thousand and thirty-five, center, name, :, achim, boraton, up, school, vaccine, :, covishield, one hundred, slots, available, twentyfour, -, five, -, twentynine"
1663,"vaccination, info, #, guwahati, district, :, kamp, metropolitan, income, :, seven hundred and eighty-one thousand and twenty-five, center, name, :, embark, is, vaccine, :, covishield, one hundred, slots, available, twentyfour, -, five, -, twentynine"
1664,"it, shouldn, i, i, be, interpreted, this, way, ., one, dose, covishield, does, give, good, protective, antibody, nearly, eighty-seven, %, and, dose, increase, seropositivity, rate, almost, ninety-eight, %, with, boost, ab, title, two, -, three, fold, evidence, i, shall, give, smiling_face_with_smiling_eyes, ., covishield, was, originally, meant, one, dose, only"
1665,"vaccination, info, #, guwahati, district, :, kamp, metropolitan, income, :, seven hundred and eighty-one thousand and seven, center, name, :, yuubari, is, vaccine, :, covishield, one hundred, slots, available, twentyfour, -, five, -, twentynine"
1666,"vaccination, info, #, guwahati, district, :, kamp, metropolitan, income, :, seven hundred and eighty-one thousand and twenty-one, center, name, :, geetanagar, me, school, ., vaccine, :, covishield, one hundred, slots, available, twentyfour, -, five, -, twentynine"
1667,"vaccination, info, district, :, kamp, metropolitan, income, :, seven hundred and eighty-one thousand and three, center, name, :, rajah, high, school, vaccine, :, covishield, one hundred, slots, available, twentyfour, -, five, -, twentynine"
1668,"vaccination, info, district, :, kamp, metropolitan, income, :, seven hundred and eighty-one thousand and five, center, name, :, japorigog, up, school, vaccine, :, covishield, one hundred, slots, available, twentyfour, -, five, -, two thousand and twenty-one"
1669,"vaccination, info, district, :, kamp, metropolitan, income, :, seven hundred and eighty-one thousand and twenty-nine, center, name, :, barsajai, high, school, vaccine, :, covishield, one hundred, slots, available, twentyfour, -, five, -, twentynine"
1670,"#, guwahati, vaccination, info, district, :, kamp, metropolitan, income, :, seven hundred and eighty-one thousand and twenty-seven, center, name, :, satan, high, school, vaccine, :, covishield, one hundred, slots, available, twentyfour, -, five, -, twentynine"
1671,"ca, too, many, us, waiting, and, dose, #, covishield, ,, for, some, it, i, i, been, more, than, eight, weeks, ,, worried, that, our, est, dose, is, wasted, ., can, we, count, you, solution, soon, #, covishieldvaccine"
1672,"covishield, i, i, first, dose, done, check_mark_buttonsmiling_face_with_smiling_eyes, #, narendramodi, #, covishield, #, covishieldvaccine, #, covid19vaccination"
1673,"vaccinated, today, with, est, dose, covishield, #, vaccinationdonecheck_mark, i, #, covishield, #, ᴠᴀᴄᴄɪɴᴇssᴀᴠᴇʟɪᴠᴇs, @, rajapakar"
