,0
756,"called, one thousand, nine hundred and twenty-nine, got, this, information, reg, same, ., they, told, send, this, info, this, whatsapp, number, ., i, hope, people, traveling, abroad, will, help, with, this, ., covishield, will, be, arranged, will, be, given, them, as, stated, by, our, commissioner, sir, folded_handslight_skin_tone"
757,"sir, how, is, it, possible, that, private, hospital, /, diagnostics, each, state, has, different, pricing, same, vaccine, manufactured, by, same, company, how, covishield, is, getting, sold, eight hundred and fifty, i, one thousand, two hundred and fifty, i, price, range, it, is, biggest, scam, year, #, vaccinescam"
758,"warning, i, police_car_lightoptions, stay, safe, couid, -, nineteen, backhand_index_pointing_down, raising_hands, covishield, /, cocaine, /, sputnik, +, mask, +, sanitizer, +, social, distancing, offhand, mask, +, sanitizer, +, social, distancing, thumbs_up, mask, +, sanitizer, pinching_hand, mask"
759,"i, have, taken, both, doses, covishield, ., but, i, am, not, sure, whether, i, have, take, them, again, next, year, if, there, are, handful, couid, cases, still, prevalent, chennai"
760,"which, vaccine, is, necessary, come, saudi, arabia, ,, has, covishield, vaccine, been, given"
761,"sir, please, give, second, dose, covishield, two, months, at, least"
762,"good, step, ., please, vaccinate, them, with, covishield, as, cocaine, vaccine, is, not, yet, approved, by, who, ,, usa, or, european, union, i, am, told, that, usa, universities, are, asking, students, get, vaccinated, with, who, approved, vaccines, please, recheck, it"
763,"dear, ashish, singh, ,, you, have, successfully, been, vaccinated, with, your, est, dose, with, covishield, five, -, six, -, two thousand and twenty-one, at, ten, :, fifty-two, am, ., #, vaccinated, #, covid19vaccination, #, covishield, #, covishielded1stdose"
764,"ninety, days, is, long, gape, between, est, and, dose, covishield, ., seafarers, should, get, and, dose, as, earliest, as, possible, ., it, should, not, be, more, than, forty, days"
765,"coronal, could, be, dispensed, those, who, want, ayurvedic, treatment, couid, -, nineteen, ., why, should, it, be, mixed, with, allopathic, medication, after, all, coaxing, is, not, mixed, with, covishield"
766,"can, advise, what, happens, if, people, who, did, not, getting, and, dose, coaxing, -, do, i, vaccinate, again, est, dose, i, can, i, now, take, covishield, ., as, i, have, missed, date, coax, and, dose, it, i, i, bizarre, non, availability, and, dose, ."
767,"finally, #, vaccinated, syringe, #, covishieldvaccine, #, covishield"
768,"great, ..., is, it, covishield, or, coaxing"
769,"case, covishield, coaxing, yes, you, are, correct, ,, but, case, sputnik, i, both, doses, are, different, need, be, taken, specific, order"
770,"sir, ,, i, request, you, discuss, time, and, doze, covishield, students, planning, travel, studies, this, september, as, it, will, delay, travel, ,, thus, affecting, studies, as, well, ., kindly, help, ."
771,"#, covishield, #, 1stdosecovid19vaccine"
772,"just, had, #, covishield, today, #, vaccineindia"
773,"sit, has, capacity, constraints, covishield, ., now, how, will, they, augment, capacity, sputnik, i"
774,"#, Corona_K_Against_One_Step, ..., #, covishield_vaccine_1st_dosesyringe, #, vacsination_center_mohandra, #, kill_corona, face_with_medical_masklotion_bottlesyringemicrobe"
775,"course, seropositivity, nucleocapsid, antibody, is, important, whole, vision, vaccine, like, coaxing, but, it, won, i, i, be, positive, after, covishield, ,, reason, we, tested, antispike, ab, which, is, common, both, vaccines"
776,"namaste, ,, respected, canada, film, industry, technicians, ,, if, your, bangalore, city, want, get, with, with, covishield, vaccine, i, free, cost, i, location, dollar, ,, indiranagar, ,, ith, june, tuesday, onwards, ,, let, me, know, ,, my, volunteer, sanjana, gallant, foundation, will, help, ., continued"
777,"not, producing, covishield, when, you, have, capacity, ., rather, waiting, more, profitable, deal, ., this, is, actual, sedition, ."
778,"I, also, got, the, first, dose, of, #, coronavirus, vaccine, covishield, #, covid19, #, covid19india"
779,"three, -, four, months, covishield, but, he, has, taken, coaxing, which, gap, twenty-eight, forty-two, days, is, good"
780,"And, tuchman, tachi, ..., grinning_face_with_sweatsyringe, #, covishield, #, coronavaccine, #, covid19"
781,"prank, bhai, vital, teed, do, not, need, vaccines, ., jokes, apart, but, take, covishield, process, angle, capability, know, ., it, is, easy, get, second, dose, ."
782,"we, got, our, first, jab, #, covishield, earlier, today, at, indiranagar, club, as, part, #, vaccination, drive, conducted, by, federation, was, &, amp, ;, around, #, indiranagar, i, ', ship, i, /, ., it, was, extremely, well, -, organized, ., we, got, in, -, and, -, out, &, it, ;, thirty, mins, ., syringeflexed_biceps"
783,"i, got, #, covishield, now, i, grinning_face, i, #, vaccinationdrive, by, thanks, president"
784,"delighted, present, our, and, paper, that, studied, humeral, response, twentynine, -, days, after, #, covishield, #, coaxing, five hundred and fifteen, health, care, workers, ., just, came, as, reprint, ."
785,"dear, mahendra, singh, rajput, ,, you, have, successfully, been, vaccinated, with, your, est, dose, with, covishield, three, -, six, -, two thousand and twenty-one, at, twelve, :, six, am, ., you, may, download, your, vaccination, certificate, -, -, coin"
786,"sunday, ith, june, holiday, ., ith, june, two thousand and twenty-one, first, dose, covishield, vaccine, syringe, administration, at, ran, talka, ,, raised, district, ., distribution, -, first, dose, above, forty-five, +, citizens, fifty, ,, second, dose, thirty, ,, frontline, workers, ten, ,, health, workers, ten, ., #, vaccinationdrive, #, covishield, #, civildefense"
787,"vaccinated, with, your, est, dose, with, covishield, five, -, six, -, two thousand and twenty-one"
788,"if, ,, serum, institute, has, capacity, produce, more, why, not, produce, extra, covishield, rather, than, sputnik, ., don, i, i, get, it, ., please, clarify, &, amp, ;, explain, radar"
789,"praveen, kumar, ,, i, have, successfully, been, vaccinated, with, my, est, dose, with, covishield, five, -, six, -, two thousand and twenty-one, at, ten, :, fifty-six, am, ., @, jamnagar, gujrati, india"
790,"still, most, efficacious, vaccine, ., sixty, %, covishield, eighty, %, pfizer, ., if, anything, need, it, sooner"
791,"took, my, first, dose, covishield, vaccine, ., thanks, seamless, process, ., #, tcsvaccinationleague"
792,"bar, mri, covishield, nine hundred and fifty, ., zero, ,, coaxing, -, one thousand, five hundred and fifty, ., zero, ., puro, loot, er, raj, ."
793,"ur, thanksgiving, gesture, is, appreciable, not, enough, but, my, come, out, with, road, map, how, much, production, will, be, there, sit, &, amp, ;, how, much, u, will, make, available, covishield, i, with, june, onward, so, that, people, age, group, eighteen, forty-five, will, have, sigh, relief, ."
794,"got, my, first, jab, #, covishield"
795,"why, so, much, defaulters, even, %, health, care, workers, are, yet, take, and, this, due, vaccine, shortage, or, latest, prolongation, intervals, covishield, ."
796,"farmer, getting, vaccinated, #, vaccinated, #, covid19mb, #, covishield"
797,"took, my, first, dose, raksha, diagnostics, yesterday, ., #, largestvaccinationdrive, #, getyourselfvaccinated, #, indiafightscorona"
798,"As, per, the, instructions, of, Hon, ', ble, Prime, Minister, Shri, Ji, ,, Hon, ', ble, National, President, Shri, Ji, and, Hon, ', ble, my, do, ., Ji, ,, first, dose, of, #, covishield, was, administered, at, viral, Middle, School, paul, loved, Vaccination, Center, ., Register, yourself, and, get, vaccinated"
799,"got, first, shot, #, vaccinated, at, ,, surendranagar, free, eighteen, +, category, ., nice, place, supportive, staff, ., thank, you"
800,"The, vaccine, does, not, contain, covishield, vaccine"
801,"both, covishield, &, amp, ;, coaxing, ,, while, effective, at, generating, immune, response, against, coronavirus, ,, appear, generate, only, half, as, many, antibodies, against, i, ., one, ., six hundred and seventeen, strain, ,, or, indian, strain, ."
802,"serum, institute, gets, dci, ', i, nod, manufacture, sputnik, i, india, test, ,, analysis, ., will, this, affect, project, covishield, certainly, apprehensive, state, forty-five, +, population, who, have, received, first, dose, covishield"
803,"got, my, first, jab, covishield, ., #, covishieldvaccine, #, covishield, #, coronavaccination"
804,"today, i, get, vaccine, covishield, at, time, i, was, fit, afterwords, also, same, ., but, since, nine, am, i, am, unwell, fever, is, top, most, ., around, one hundred and ten, i, i, ., what, precautions, should, i, take, ., please, suggest, some, one, ."
805,"but, ghaziabad, is, getting, only, covishield"
806,"everywhere, only, covishield, only, us, available, ., coaxing, is, available, only, vip, ', i"
807,"if, someone, have, taken, est, dose, covishield, can, get, and, dose, after, twenty-eight, days, or, forty-five, days, ., as, per, government, guidelines, it, will, take, eighty-four, days, and, dose, ."
808,"small_blue_diamondcovaxins, first, dose, will, be, stopped, covishield, will, be, administered, instead, ., small_blue_diamondthe, state, govt, will, provide, loans, without, interest, three, months, private, hospitals, interested, purchasing, &, amp, ;, administering, vaccines, under, twentyfive, %, reserved, quota, ., four, /, five"
809,"dear, hem, roar, ,, you, have, successfully, been, vaccinated, with, your, est, dose, with, covishield, two, -, six, -, two thousand and twenty-one, at, one, :, four, am, I, am, getting, this, sums, and, automated, call, also, when, this, hem, there, is, no, one, in, my, house, family, please, take, cognizance"
810,"gotted, covishield, first, dose, with, family, mom, ,, brother, #, vaccinated, #, covishield, #, vaccinated_india"
811,"if, you, took, distilled, water, bharat, then, you, will, not, get, any, reaction, ., only, covishield, gets, reaction"
812,"#, chi, #, Kamalganj, District, Farrukhabad, is, being, rigged, in, applying, the, vaccine, ., A, bottle, containing, ten, people, of, #, covishield, is, being, given, the, vaccine, to, sixteen, to, seventeen, people, ., Without, registration, ,, the, vaccine, is, being, denied, ., Those, who, do, not, register, where, to, go, now"
813,"please, discuss, shorter, dose, gap, more, effective, against, delta, variant, ,, says, lancet, study, "", the, recommendation, is, at, odds, with, india, ', i, recent, decision, increase, gap, between, two, covishield, doses, twelve, sixteen, weeks, six, -, eight, weeks, i"
814,"i, took, covishield, hard, april, ,, was, tested, positive, ith, may, that, does, not, mean, i, will, not, take, and, dose, ,, so, i, know, nothing, is, effective, one hundred, %, against, couid, ,, but, pfizer, should, not, be, hyped, unnecessarily, ."
815,"no, examination, without, vaccination, right_arrow, i, ninety-five, %, class, twelve, students, are, above, seventeen, ., five, years, right_arrow, i, center, should, talk, health, experts, if, they, can, be, given, covishield, or, coaxing, right_arrow, i, center, should, also, talk, pfizer, :, dy, am, &, amp, ;, edu, minister, ., #, cancelexamssavelives"
816,"first, dose, done, check_box_with_check, i, please, do, not, hesitate, get, yourself, vaccinated, as, soon, as, possible, ., ., ., #, vaccinationdonecheck_mark, i, #, indianvacccine, #, covishield, #, atmanirbharbharat, #, vaccine, #, india, #, ɢᴇᴛᴠᴀᴄᴄɪɴᴀᴛᴇᴅ, #, gocoronago"
817,"got, my, second, dose, coaxing, today, ., zero, discomfort, both, times, ,, except, very, mild, pain, jab, area, ., daughter, took, covishield, ,, has, chills, body, ache, after, few, hours, ., consensus, is, that, covishield, results, more, visible, side, effects, ."
818,"i, got, first, dose, covishield, vaccination, successfully, ., at, pic, sukeban, shivapeth, ., #, covishieldvaccine, #, vaccinefor18plus, #, covid19vaccination"
819,"i, got, my, vaccinated, -, est, syringe, done, #, vaccinated, #, vovid_19, #, covishield, #, stayhomestaysafe, #, covid19"
820,"i, have, partially, vaccinatedcheck_mark_button, -, dose, one, covisheild, at, hundred_pointsflexed_biceps, thanks, hundred_points, red_heart, i, get, vaccinated, bonfire, #, youngandvaccinated, #, concentric, #, concentrixindia, #, covishield"
821,"est, dose, completedsyringe, #, indiafightcorona, #, tikautsav, #, covishield"
822,"#, vaccinationdrive, spells, out, vaccination, plans, dashing, canada, district, both, coaxing, &, amp, ;, covishield, recipients, method, be, followed, ."
823,"now, loading, antibodies, #, vaccinated, #, covishielded1stdose, #, covishield, thank, you"
824,"sir, ,, it, ', i, center, ', i, responsibility, have, uniform, vaccine, policy, entire, india, ., reg, aura, thakur, allegation, it, should, also, be, noted, that, indore, where, i, live, covishield, is, being, given, @, i, eight hundred and fifty, per, dose, &, amp, ;, coaxing, @, i, one thousand, two hundred and fifty, per, dose, by, private, hospitals, ., my, there, is, bop, govt"
825,"never, forgive, ,, never, forget, ., because, pathetic, system, government, we, are, not, getting, second, dose, covishield, ., if, you, wanted, make, it, eighty-four, days, than, why, you, we, are, waiting, untill, with, may, cruelty, expressionless_face, #, 2nddoseforseafarers"
826,"today, i, have, done, my, one, dose, ,, thank, you, started, eighteen, +, vaccine, ap, ,, but, paid, vaccines, eight hundred and fifty, inr, covishield, ., good, initiative, ,, where, other, states, charging, as, like, one thousand, three hundred, one thousand, five hundred, ."
827,"i, did, my, part, ., now, it, is, your, turn, ., get, vaccinated, ., #, togetherwecan, #, igotvaccinated, #, covishield"
828,"#, vaccinated, #, covishield, ., thanks, is, mla, ji, president, ji, team, organizing, super, event, where, one thousand, people, age, group, eighteen, -, forty-four, including, students, we, are, vaccinated, ., #, sevahisangathan, #, modihaitohmumkinhai"
829,"two, and, dose, covishield, taken, with, may, registered, mobile, nine billion, eight hundred and nineteen million, six hundred and five thousand, four hundred and forty, but, coin, app, shows, two, and, dose, pending, as, negligent, staff, has, forgotten, register, as, was, busy, talking, mobile, trying, ask, dockyard, rectify, but, totally, unhelpful, need, help"
830,"est, dosessyringe, #, covishield, @, railway, high, school, chagall"
831,"covishield, decline, fast, dose, complet, smiling_face_with_smiling_eyesfolded_hands, in, corona, pandemic, to, protect, yourself, and, your, family, make, sure, to, get, vaccinated, triangular_flagjay, Shri, malakal, triangular_flag, #, coronavecsinefastdose"
832,"got, my, first, dose, vaccine, syringesyringe, #, covishield, #, vaccinated"
833,"#, blossoms, gearing, up, amongst, biggest, #, raw, driven, #, vaccination, camp, #, covishield, &, amp, ;, #, coaxing, all, eligible, eighteen, i, #, gurugram, #, aryans, #, vaccinateindia, #, vaccinate, #, blossoms2forall, #, blossoms2vaxdrive, #, blossoms2vaccinate"
834,"get, first, dose, covishield, #, covishieldvaccine, #, uproot"
835,"iris, like, us, ,, i, stuck, jar, coz, inbred, gap, been, covishield, doses, ., other, states, he, help, the, state, pal, who, he, trol, abroad, urgently, coz, jobs, ,, by, reducing, gap, been, two, doses, by, thirty, days, ,, we, too, i, waiting, such, decon, raj, ., ply, help"
836,"first, dose, complete, covishield, vaccinesyringeface_with_medical_masksyringe, #, garcia, #, covishield, #, covishieldvaccine, #, stayhomestaysafe"
837,"i, got, vaccinated, with, est, dose, covishield, ., thank, you, helping, find, slot, vaccination, ., do, follow, turn, tweets, bangalores, ., i, thank, columbia, asia, sarjapur, hassle, free, safe, vaccination, process, ."
838,"covishield, charged, at, nine hundred, coaxing, at, one thousand, two hundred and fifty, bhatinda"
839,"#, vaccination, &, amp, ;, #, gatepost, #, 25thmay2021, #, covishield, #, hometown, #, gocoronago, #, thankyoumodisir"
840,"est, dose, with, covishield"
841,"Today, in, the, hearing, of, #, corona, ,, we, have, drawn, the, attention, of, the, High, Court, to, two, discrepancies, in, vaccination, -, one, /, application, of, #, coaxing, to, people, with, #, covishield, and, two, /, wrong, name, /, mention, of, vaccine, in, the, vaccine, certificate, ., Instructed, to, rectify, both, the, deficiencies, ., syringe"
842,"is, walk, -, in, sixty, +, and, dose, covishield, monday, ,, tuesday, wednesday, still"
843,"Today, the, first, dose, of, the, vaccine, was, given, ., covishield"
844,"make, this, trend, so, atleast, everyone, gets, it, done, ., man_dancinglight_skin_tone, #, vaccinationdonecheck_mark, i, ., when, are, you, taking, it, ., ., ., ., #, covishield, #, covid_19, #, gocoronago, #, starlit, #, stayhealthy"
845,"kudos, la, administration, ., other, states, are, charging, upto, is, eight hundred, -, one thousand, two hundred, covishield, &, amp, ;, rs1000, -, one thousand, five hundred, coaxing, eighteen, -, forty-five, age, group"
846,"got, my, first, dose, covishield, vaccine, #, covishield, #, vaccinationdrive, #, thankyouvaccinators"
847,"Congratulations, elder, brother, ,, yesterday, I, also, took, the, first, vaccine, dose, of, #, covishield, in, Gorakhpur, ', i, Barhalganj, block, ,, in, fact, ,, under, the, leadership, of, honorable, Chief, Minister, ,, such, a, large, population, is, being, taken, forward, very, easily, ,, it, is, commendable, ,, pleasant, feeling, ., folded_hands"
848,"covishield, yay, ., got, my, first, dose, yesterday, ."
849,"I, have, also, got, it, done, ,, it, is, not, too, late, ,, go, to, your, nearest, health, center, today, and, get, the, #, covishield, vaccine, ,, avoid, rumors, and, inspire, people, around, you, ., ,, ,, ,, #, covidemergencyindia, #, vaccination, #, staysafestayhome, #, india, #, indore, #, usain, #, agarmalwa"
850,"vaccine, toh, lagvayi, par, #, covid19, egg, antibody, test, karada, #, vaccinated, #, covishield, #, covid19vaccination"
851,"est, dose, done, check_mark_button, #, covishield, #, coronavaccination"
852,"i, he, taken, both, doses, covishield"
853,"Finally, got, est, dose, of, covishield, vaccine, today, ., thumbs_up"
854,"Getting, vaccinated, ..., Thanks, to, canada, Movie, i, #, covid_19, #, covidvacccine, #, covishield, @, bangalore, ,, india"
855,"got, myself, vaccinated, ., #, vaccinated, #, vaccine, #, covishield"
856,"four, /, six, /, two thousand and twenty-one, if, you, or, your, family, member, is, forty-five, +, wish, get, free, vaccinated, ,, we, can, help, you, today, ., covishield, one, &, amp, ;, two, dose, ., second, dose, eighty-four, days, compulsory, ., appointment, will, be, up, ,, kindly, send, your, radar, card, mobile, number, nine billion, eight hundred and ninety-two million, one hundred and seventy-nine thousand, eight hundred and ninety-two, ."
857,"got, myself, covisheild, tchan, #, coronavaccination, #, covishieldvaccine, #, covishield"
858,"co, vaccine, &, amp, ;, covishield, rolling_on_the_floor_laughinggrinning_facefolded_hands"
859,"we, have, very, few, coaxing, doses, ., we, have, more, covishield, today, whatever, we, have, ,, we, are, giving, first, second, doses, both"
860,"would, you, be, able, advise, how, two, senior, citizens, aged, eighty-three, &, amp, ;, seventy-five, can, get, and, vaccination, syringe, covishield, ., est, was, obtained, through, channelling, at, kira, road, ."
861,"plant, lady, got, vaccinated, #, covishield, #, vaccinated, #, hima, #, nagaland"
862,"acha, ,, majority, people, india, got, astra, seneca, covishield, vaccine, i, uk, it, works, ,, india, it, is, less, effective, what, logic, ..."
863,"ith, june, ,, two thousand and twenty-one, :, am, -, it, is, been, forty-four, hours, since, my, #, covishield, jab, &, amp, ;, this, morning, i, woke, up, mild, headache, &, amp, ;, low, -, grade, fever, ninety-nine, ., three, ., thank, god, ,, it, has, come, down, ;, yesterday, was, bad, as, fever, constantly, remained, between, one hundred and one, -, one hundred and two, hoping, today, would, be, good, day, smiling_face_with_heart, -, eyesred_heart, i"
864,"covishield, can, suck, my, stinky, ,, unwashed, balls"
865,"covishield, still, complete, maria"
866,"where, is, announcement, copy, &, amp, ;, tweet, can, you, please, provide, us, sa, government, statement, &, amp, ;, tweet, about, covishield, vaccine, ,, note, i, we, just, need, only, by, saudi, government, statement, copy, covisheild, vaccine, is, approved, kingdom"
867,"coaxing, covishield, sputnik, i, ., with, time, vaccination, doses, will, increase, bach, ke, rhea, kai, naam, lshaan, na, mit, jake, tumor, ."
868,"pfizer, should, be, given, private, hospitals, ..., tried, i, tested, coaxing, i, covishield, should, be, at, government, healthcare, centers, ., pfizer, pinko, lagaan, hai, jam, paise, do, ani, mardi, se, lagga, lo, i"
869,"four, /, six, /, two thousand and twenty-one, thane, municipal, corporation, vaccination, schedule, forty-five, +, /, senior, citizens, we, can, try, get, you, free, vaccinated, walk, tomorrow, covishield, one, &, amp, ;, two, dose, ., kindly, send, your, radar, card, mobile, number, nine billion, eight hundred and ninety-two million, one hundred and seventy-nine thousand, eight hundred and ninety-two, ."
870,"dats, cheap, ....., in, delhi, hospital, iz, providing, #, covishield, at, i, one thousand, eight hundred"
871,"jo, vaccine, mil, aha, hai, le, lo, ., agar, covishield, hai, baht, radhika, ., kinda, range, future, mein, vaccine, cocktail, let, rena, ..., abhi, jaan, bacha, lo, ., shoot, chalk, ho, jaya, face_with_rolling_eyes"
872,"ur, suggestion, covishield"
873,"kanpur, primary, health, center, will, have, covishield, &, amp, ;, coaxing, forty-five, +"
874,"kumarilingham, public, health, center, will, have, covishield, &, amp, ;, coaxing, forty-five, +"
875,"thanks, &, amp, ;, highly, appreciated, your, compassion, ., big, relief, senior, citizens, nepal, who, have, received, est, dose, az, /, covishield, vaccines, ., india, has, failed, us, miserably, ;, finally, rescue, is, coming, us, &, amp, ;, china, ., hope, india, joins, hand, at, earliest, ., jayaNepalfolded_hands"
876,"est, dose, done, couid, -, nineteen, vaccine, ., thanks, #, covid19vaccination, #, indiafightscovid19, #, covishield"
877,"madathukulam, has, covishield, forty-five, +"
878,"parents, ,, both, seventy, +, are, done, with, second, dose, #, covishield, ,, no, fever, at, all, ., i, i, ve, got, est, dose, #, coaxing, didn, i, i, get, any, fever, either, ., no, other, issues, as, well, ., people, shouldn, i, i, fear, come, out, get, jab, ., #, vaccinateindia"
879,"ith, june, two thousand and twenty-one, first, dose, covishield, vaccine, syringe, administration, at, ran, talka, ,, raised, district, ., distribution, -, senior, citizens, seventy, ,, frontline, workers, twenty, ,, health, workers, ten, ., token, distribution, by, civil, defense, at, nine hundred, hours, ., #, vaccinationdrive, #, covishield, #, civildefense"
880,"covishield, est, dose, complete, @, rond"
881,"i, -, two hundred and six, vaccination, done, check_mark_button, jabbed, smiling_face_with_hearts, #, covishield, #, coronavaccination, must, i, india, will, winvictory_hand, i"
882,"is, it, true, i, utter, grades, :, lucknow, man, alleges, no, antibodies, developed, after, taking, covishield, shot, ;, files, complaint, ag, ..., via"
883,"est, dose, covishield, sixteen, ., five, ., two thousand and twenty-one"
884,"sir, we, are, seeing, this, pic, since, last, one, week, ., adjacent, districts, like, dehradun, ,, sahranpur, mujaffarnagar, up, do, have, abundant, slots, ., max, dehradun, are, providing, around, ask, slots, covishield, tomorrow, but, not, single, slot, eighteen, -, forty-four, age, grip, how, which, dumb, at, such, large, sca"
885,"Received, my, first, dose, of, covishield, vaccine, today, #, covid19_vaccine, thank, you, dear, prime, minister, ji, #, get, vaccinated, i, love, -, you_gesturesmiling_face_with_sunglasseslove, -, you_gesturesmiling_face_with_sunglasses, #, vaccine, #, vaccineforall, #, covishield"
886,"five, ., pfizer, /, biotech, bnt162b2, :, approved, eighty-five, countries, twentyfour, trials, fourteen, countries, six, ., serum, institute, india, covishielTongue_sticking_out_cheeky_playful_or_blowing_a_raspberry, approved, forty, countries, two, trials, one, country, seven, ., sinopharm, beijing, bribe, -, core, approved, forty-four, countries, six, trials, seven, countries"
887,"corona, vaccination, :, ith, june, two thousand and twenty-one, #, covishield, #, vaccinationforall, #, getvaccinated, #, punevaccination, #, pune"
888,"corona, vaccination, :, ith, june, two thousand and twenty-one, #, covishield"
889,"tomorrow, four, /, six, /, two thousand and twenty-one, +, eighteen, camp, one, dose, place, please, share, #, covishield, #, vaccinationfor18plus, #, nagercoil, #, eathamozhi, #, jegannofear"
890,"dear, doctor, ,, i, have, question, that, is, there, any, medicine, prevent, infections, couid, virus, even, if, we, are, vaccinated, with, covishield, second, dose, except, mask, sanitizer, ,, which, can, be, taken, without, any, symptoms, disease"
891,"covishield, vaccination, camp, has, been, organized, at, century, rayon, school, have, been, arranged, students, #, ulhasnagar, those, traveling, abroad, study, ., all, students, must, carry, their, admission, confirmation, documents, such, as, i, -, twenty, or, any, other, alongwith, radar, card, ."
892,""", now, loading, :, antibodies, i, got, vaccinated, with, covishield, #, covishielded1stdosecheck_mark_button, #, vaccinationdonecheck_mark, i, #, covidvacccine, #, vaccination, syringesyringesyringesyringesyringesyringesyringe"
