,0
1056,"pardon, me, its, ok, terrorize, canadians, 2, years, but, it, is, not, ok, peacefully, protest, ., trudeau, only, talks, about, vaccines, even, with, 90, pc, vaccinated, ,, this, is, very, unproductive, say, least, ."
1057,"what, ’, s, wrong, this, country, they, don, ’, t, get, vaccines"
1058,"la, county, sheriff, ', s, department, could, lose, 4, ,, 000, employees, over, covid, -, 19, vaccine, mandate"
1059,"is, vaccine, endlösung, #, svpol, #, ukpolitics, #, uspolitics, #, canpoli"
1060,"i, ’, m, continually, puzzled, by, people, who, are, more, afraid, vaccine, ,, than, actual, disease, that, ’, s, killed, millions, ."
1061,"bc, ', s, vaccine, passports, are, useless, yeah, you, can, show, your, vaccine, passport, yet, you, could, still, have, asymptomatic, covid, defeats, purposeSkeptical_annoyed_undecided_uneasy_or_hesitant, /, bc, ., ctvnews, ., ca, /, lions, -, gate, -, hospital, -, er, -, doctor, -, and, -, restaurant, -, association, -, president, -, want, -, b, -, c, -, to, -, scrap, -, vaccine, -, passport, -, 1, ., 5775531"
1062,"could, certain, covid, -, 19, vaccines, leave, people, more, vulnerable, aids, virus, |, science, |, aaas"
1063,"netflix, documentary, face_vomiting, how, gates, spends, his, work, days, &, amp, ;, retreats, ., he, ’, s, portrayed, as, martyr, “, ingenious, ”, developing, ways, have, toilet, sanitation, system, africa, ., next, segment, ,, gates, his, home, office, with, vaccine, book, his, shelf, face_with_tears_of_joy"
1064,"it, ’, s, not, really, about, vaccine, per, say, ., it, ’, s, about, government, coercion, /, force, &, amp, ;, personal, liberty, ."
1065,"it, would, be, extremely, strange, if, everyone, who, had, one, dozen, or, so, currently, available, vaccines, -, which, use, different, technologies, -, all, got, same, after, -, effect, ., chance, that, happening, is, practically, zero, ."
1066,"i, don, ', t, disagree, ..., there, is, clear, distinction, between, being, against, vaccines, being, against, mandates, ., focusing, mandates, is, should, always, be, focus, ."
1067,"be, careful, i, heard, 2, lost, their, baby, after, having, vaccine, ., one, case, obgy, said, it, would, be, fine, ., you, decide"
1068,"it, ', s, crazy, &, amp, ;, i, find, it, particularly, odious, when, people, pretend, care, about, healthcare, workers, time, like, this, ,, encourage, people, ', s, vaccine, hesitancy, minimize, this, disease, that, is, hospitalizing, so, many, ., if, he, cared, ,, he, would, tell, people, vaccinated, wear, kn95, ."
1069,"i, ', m, suspecting, this, is, more, point, than, any, "", vaccine, mandate, protest, "", ever, was, ."
1070,"i, didn, ’, t, know, we, lived, world, where, so, many, people, are, too, daft, understand, difference, between, “, cure, ”, “, vaccine, ”., i, mean, wow, ,, america, ."
1071,"they, ', re, really, going, rake, it, once, new, variants, emerge, countries, that, haven, ', t, been, able, get, vaccines"
1072,"this, so, called, vaccine, side, ., is, it, transmissible"
1073,"it, is, noteworthy, that, these, kinds, of, messages, never, appeared, until, the, vaccinations, were, rolled, out, ., luckily, I, don, ', t, believe, in, conspiracy, theories, I, would, look, for, a, strategy, behind, it, ."
1074,"so, after, being, vaccinated, you, have, risk, myocarditis, virus, vaccine, ., twice, risk, ., few, blabla, ..."
1075,"delilah, hate, inform, you, that, vaccines, are, not, mandatory, schools, ., many, friends, did, not, vaccinate, fheir, kids, you, just, have, sign, statement, conscience, or, religious, beliefs"
1076,"all, this, vaccine, madness, needs, end, ,, most, dangerous, ineffective, vaccine, ever, ., seriously, ."
1077,"webmTongue_sticking_out_cheeky_playful_or_blowing_a_raspberry, johnson, &, amp, ;, johnson, shot, is, seen, as, critical, vaccine, poorer, countries, ,, but, late, last, year, company, paused, production, at, only, plant, making, usable, batches, vaccine, ."
1078,"how, bout, y, ’, all, start, interviewing, other, people, aside, all, pro, mask, /, vaccine, ppl, this, is, bullshit, how, y, ’, all, go, about, only, ever, showing, interviewing, certain, ppl, ., face_with_symbols_on_mouthmiddle_fingermedium, -, light_skin_tone"
1079,"you, are, free, not, participate, then, you, are, also, free, lose, out, some, shit, ., just, like, public, school, requires, many, vaccines, ., health, care, workers, etc, etc, etc, ."
1080,"severe, deficiencies, essential, nutrients, will, impair, immune, system, having, proper, response, —, virus, or, vaccine, ., example, people, w, /, high, #, homocysteine, b12, deficiency, are, known, have, adverse, vaccine, reactions, ., homocysteine, is, lowered, w, b, vitamin, repletion, ."
1081,"if, our, current, vaccines, really, wane, that, fast, ,, then, we, need, better, vaccine, ., more, variants, are, likely, ,, anyway, ., we, had, 3, last, year, ., why, would, that, be, about, change"
1082,"this, hyena, needs, cholera, vaccine"
1083,"we, know, pfizer, et, al, have, immunity, prosecution, but, others, giving, ,, coercing, ,, forcing, vaccines, do, not, enjoy, same, protections, ., i, would, think, large, businesses, will, be, first, be, sued, as, payout, is, most, lucrative, law, firms, ."
1084,"what, about, mandates, vaccine, passports, no, jab, no, job, medical, aparthide, ,, etc, etc"
1085,"jan, 6, ,, 2021, was, bunch, very, polite, white, guys, ., actually, ,, people, that, won, ’, t, take, simple, vaccine, or, wear, mask, protect, themselves, others, are, just, sissies, ."
1086,"i, don, ’, t, care, if, illiterate, governors, that, know, nothing, about, science, ;, taking, wrong, decisions, that, lead, increase, covid, cases, ,, again, we, won, ’, t, stop, wearing, our, mask, ;, will, maintain, our, distance, &, amp, ;, will, take, all, vaccines, maintain, our, family, free, covid, ,, until, it, disappear"
1087,"this, has, never, been, about, working, class, ., this, has, utterly, solely, been, about, your, politics, your, ego, ., the, borders, don, ’, t, need, closing, truckers, can, opt, out, vaccines, ., #, forcingthingsdownthroats, #, yourmandatesnotours"
1088,"vaccine, fetus, what, can, ’, t, wait, six, months, three, years, touch, mine, choices, between, my, doctor, me, are, sacrosanct, ., none, anyones, business, ., period, full, stop, they, had, zero, compunction, giving, us, hydroxycloroquine, against, malaria, 60s, ., missed, few, doses, got, it"
1089,"they, changed, definition, last, summer, ., why, is, this, suddenly, news, ., its, leaky, vaccine, per, cdc, ,, fda, ,, else, with, knowledge"
1090,"yikes, ., you, should, have, left, that, dumb, ass, meme, generator, ."
1091,"b, ., c, ., bringing, vaccine, mandate, all, remaining, health, -, care, workers, |, if, we, dont, stand, up, now, it, will, neber, end, you, will, lose, everything"
1092,"pfizer, announced, that, they, made, $, 32, billion, sale, vaccines, worldwide, will, make, another, $, 20, billion, sale, medication, wuhan, virus, this, year, ., you, talk, about, scamdamic, they, will, never, let, go, this, virus, it, became, their, new, goldmine"
1093,"how, come, nobody, is, speaking, about, these, #, adversereactions, #, covid19, #, vaccines, …, these, #, vaccinesideeffects, are, pretty, substantial, …"
1094,"#, australia, would, not, set, mandates, three, doses, covid, vaccine, nationally, except, aged, care, workers, —, however, states, will, have, option, set, local, mandates, if, they, choose, to, ."
1095,"no, ., lot, naturopath, ’, s, have, been, killed, too, ., like, over, 80, ., lot, them, were, making, connection, between, vaccines, cancer, ."
1096,"explain, how, vaccine, can, be, ticking, timebomb, what, ', s, trigger"
1097,"don, ’, t, postpone, mammograms, because, swollen, lymph, nodes, after, covid, -, 19, vaccine, ,, study, says"
1098,accurate
1099,"they, ask, id, restaurant, not, vote, but, not, unconstitutional, vaccines, what, corrupt, politicians"
1100,"welcome, freedumb, floriduh, don, ', t, say, gay, ,, don, ', t, teach, history, but, feel, free, spread, deadly, pandemic, ,, we, wouldn, ', t, want, infringe, your, freedom, by, requiring, life, saving, vaccine, or, mask"
1101,"i, never, said, they, all, were, ,, obviously, vaccine, mandate, won, ’, t, affect, vaccinated, naturopaths, ., original, tweet, isn, ’, t, directed, them, ."
1102,"us, navy, diskharges, 240, refusing, covid, -, 19, vaccine"
1103,"vaccine, racism, misinformation"
1104,"it, ’, s, hard, believe, that, i, have, survived, both, code, 19s, third, one, i, ’, m, yet, survive, without, vaccine, i, don, ’, t, think, i, need, it, i, ’, m, tough"
1105,"easy, remedy, would, be, comply, with, vaccine, mandates, both, sides, border, ., shift, gears, goods, all, day, long"
1106,"i, used, shazam, diskover, maybe, we, ', re, visitors, by, page, mcconnell, ."
1107,"mandate, isn, ', t, law, ., it, is, request, ., thing, is, though, ,, mandate, get, vaccine, doesn, ', t, grant, choice, because, you, can, ', t, reverse, medical, procedure, like, that, people, like, me, who, can, ', t, get, vaccine, are, lumped, with, those, that, refuse, by, choice, because"
1108,"this, cartoon, ,, this, factual, cartoon, forgot, add, oneindex_pointing_up, ️, more, thing, other, ,, bar, chart, bar_chart, stocks, elected, officials, purchased, that, are, attached, their, covid, vaccine, syringe, crap"
1109,"pfizer, made, $, 37, billion, off, its, covid, vaccine, last, year, ,, more, than, gdp, 120, countries, ., moderna, founders, made, forbes, ’, list, richest, people, ., yet, only, 10, %, people, low, -, income, countries, have, been, vaccinated, ., covax, —, the, global, dose, -, sharing, initiative, —, is, out, money, ."
1110,"my, dad, ’, s, case, he, had, double, shot, but, was, hospitalized, with, delta, 3, 1, /, 2, months, later, dead, month, after, that, ., i, don, ’, t, see, how, we, accept, this, ., it, ’, s, not, just, two, groups, unvaccinated, vaccinated, ., not, everyone, can, achieve, immunity, even, with, vaccine, ., it, ’, s, not, fair, ."
1111,"two, -, faced, politician, hours, after, speaking, out, behalf, natural, immunity, against, mandates, fox, news, ,, nancy, mace, joined, cnn, said, she, ', s, big, proponent, vaccines, 04"
1112,"covid, vaccines, open, rifts, between, parents, ,, children, ."
1113,"new, covid, -, 19, vaccine, advice, may, mean, you, ’, re, ‘, overdue, ’."
1114,"this, trucker, strike, ,, aided, by, trumpers, right, wingers, ,, canada, is, not, going, change, policy, canadian, government, vaccines, ."
1115,"then, they, should, have, gotten, vaccinated, there, wouldn, ’, t, have, be, mandates, keep, rest, us, healthy, ., it, ’, s, bunch, spoiled, people, just, raising, hell, impress, trump, ones, waiting, line, take, his, place, ., most, them, don, ’, t, even, know, what, vaccine, is"
1116,"“, researchers, found, vaccine, mrna, germinal, centers, lymph, nodes, 60, days, after, shots, as, long, as, they, checked, ”, ..., i, think, it, ’, s, longer, than, 60, days, ."
1117,"scientists, begin, trial, experimental, hiv, vaccine, via, same, mrna, technology, ., okay, cause, that, ’, s, working, well, ."
1118,"you, don, ', t, have, "", trust, pfizer, "", believe, that, vaccine, is, real, vaccine, ., there, ', s, no, evidence, it, ', s, fake, vaccine"
1119,"badass, man, ., get, that, win"
1120,"prof, ., alicia, durán, chairperson, #, iyog2022, speaking, under, roof, palais, de, nations, making, dream, year, glass, come, through, small, glass, beads, pliny, elder, containers, covid, 19, vaccines, she, beautifully, explained, importance, glass"
1121,"so, these, are, pfizer, variant, -, only, mrna, vaccines, their, commercial, vaccine, here, i, ', m, just, digging, understanding, problems, with, next, step, ,, original, sin, ,, new, studies, all, that, ."
1122,"i, didn, ', t, get, third, booster, cause, first, two, made, me, so, sick, i, ended, up, hospital, ., i, do, think, that, others, should, get, it, if, is, safe, ., maybe, they, should, do, physical, before, they, give, shot, test, see, if, there, are, problems, going, that, covid, vaccine, may"
1123,"well, hopefully, when, not, if, there, ', s, another, variant, mask, will, become, law, around, world, thing, with, covid, -, 19, mask, vaccines, should, be, law, already, that, ', s, only, way, we, protected, each, other, smallpox, we, were, told, get, vaccines, not, if, you, want"
1124,"vaccine, is, cover, recruit, white, nationals, us, canada, ., they, are, practicing, take, over, other, cities, ., russia, money, us, dark, money, is, funding, their, cause, ."
1125,"important, term, you, used, is, "", possibly, ""., not, one, person, has, died, due, side, effects, vaccine, ., yet, vaccine, has, saved, millions, lives, ."
1126,"biden, administration, is, facing, controversy, over, its, acceptance, pfizer, -, biontech, ', s, application, authorize, covid, -, 19, vaccine, children, under, 5, without, showing, completed, clinical, trial, data, ,, o, ..."
1127,"prove, there, was, massive, voter, fraud, ., prove, covid19, vaccine, is, unsafe, ., prove, that, 1st, hand, witness, testimony, is, untrue, ., prove, 1, claim, fox, is, true, ., don, ’, t, be, so, ridiculous, ., there, is, plenty, evidence, former, ‘, president, ’, is, insane, acted, like, idiot, every, day, ."
1128,"he, isn, ’, t, providing, vaccine, parts, world, he, doesn, ’, t, care, about, ., thinking_face"
1129,"jane, with, law, degree, ...., johnson, broke, law, but, he, did, get, us, vaccine, ., did, i, mention, she, has, law, degree, apparently, ."
1130,"pfizer, -, biontech, submitted, part, its, application, authorize, 3, -, microgram, -, dose, covid, -, 19, vaccine, children, under, five, ., company, had, initially, only, tested, two, -, dose, regimen, ,, causing, concern, that, fda, may, be, sacrificing, science, expediency, ."
1131,"my, verdict, is, still, out, vax, /, aids, thing, however, everything, does, seem, be, pointing, that, direction, ., if, it, does, turn, out, be, true, i, don, ’, t, one, second, believe, it, ’, s, because, we, all, have, dormant, hiv, /, aids, accidentally, triggered, by, covid, vaccine"
1132,"forced, prayer, is, what, having, your, freedoms, taken, away, looks, like, ."
1133,"vaccine, with, side, effects, like, heart, attacks, death, ., not, reported, publications, owned, by, rich, ."
1134,"dr, ., peter, mccollough, dr, ., robert, malone, ., wiki, mccollough, is, disgusting, ., it, talks, more, about, covid, than, his, actual, credibility, ., he, is, cardiologist, ., malone, holds, patents, vaccine, tech, ., they, both, had, things, say, that, didn, ', t, fit, narrative, ."
1135,"probably, ,, as, booster, or, vaccine, is, not, god"
1136,"u, ., s, ., appeals, court, will, not, block, order, barring, biden, federal, staff, vaccine, mandate, at"
1137,"who, says, that, vaccines, will, be, long, term, solution, development, anti, virals, is, moving, forward, leaps, bounds, ., i, am, comfortable, with, qld, response, ., i, am, disgusted, by, feds, aged, care, response, ., our, vax, rates, are, good, ,, now, is, time, ."
1138,"auto, immune, deficiency, syndrome, ., when, injected, falsely, called, vaccine, it, becomes, vaids, ."
1139,"jonas, salk, used, formaldehyde, inactivate, part, poliovirus, that, caused, it, replicate, ., that, is, why, his, vaccine, was, extremely, successful, ., yes, ,, there, is, inactivated, covid, vaccine, india, covaxin, but, not, as, successful"
1140,"who, :, united, states, last, year, donated, 400, million, vaccine, doses, covax, but, won, ’, t, let, covax, buy, directly, due, trump, -, era, dpa, preventing, export, vaccines, ., usa, commits, another, 2, ., 1, billion, doses, ."
1141,"it, has, absolutely, nothing, do, with, truckers, or, trucks, or, vaccines, or, anything, covid, related, ., it, has, absolutely, everything, do, with, fascist, right, wing, agenda, ."
1142,"no, vaccine, is, 100, %, effective, ,, but, covid, ones, generally, have, had, reasonable, effectiveness, against, earlier, variants, ., if, purpose, was, decrease, levels, serious, illness, hospitalization, ,, then, they, worked, ., look, at, statistics, ."
1143,"it, ’, s, all, about, pre, -, cancer, vaccines, ., crap, test, tells, them, that, health, person, may, get, cancer, then, vax, them, up, ., powers, that, be, will, never, investigate, actual, cancer, prevention, /, treatments, ,, but, they, will, arrest, anyone, who, cures, it, .#, sameoldstory"
1144,"“, piece, s, **, t, with, oth, ,, departing, ”, good, see, them, gone, ., us, navy, diskharges, 240, service, members, refusing, covid, -, 19, vaccine"
1145,"vaccine, solves, this"
1146,"every, time, i, see, these, pharma, companies, promoting, their, "", vaccines, "", all, i, think, about, is, #, dopesick"
1147,"well, that, ’, s, simply, not, true, ., kids, are, at, far, higher, risk, dying, covid, induced, myocarditis, thank, vaccine, induced, myocarditis, ., where, did, you, get, such, bad, info"
1148,"occupation, inanity, doesn, ', t, work, ., recall, all, mandated, vaccines, that, students, had, attend, school, ,, take, chance, with, polio, ,, smallpox, rest, it, ., google, iron, lung, ,, which, many, ended, up, before, polio, vaccine, came, out, ., refuse, seat, belts, ,, driver, ', s, licenses, ."
1149,"mom, ', s, new, "", home, "", is, not, home, ., it, ', s, prison, only, my, dad, can, see, her, now, ., you, can, see, how, unhappy, she, is, covid, restrictions, &, amp, ;, vaccines, have, utterly, failed, prevent, seniors, ', "", homes, "", covid, outbreaks, &, amp, ;, made, mom, ', s, life, lonely, &, amp, ;, miserable, ., shame"
1150,"if, you, haven, ', t, seen, it, yet, ..., collapsed, stage, during, bit, covid, vaccines, ., #, covidvaccines, #, heathermcdonald, #, covidbit"
1151,"so, you, mean, that, they, knew, that, covid, vaccine, was, only, going, only, last, few, months, now, this, is, going, be, narrative, you, can, go, get, your, covid, shot, every, year, ., i, won, ', t, ., i, will, have, supply, ivermectin, hand, treat, it, if, i, ever, get, it, ."
1152,"cvs, faces, its, next, challenge, :, growing, sales, as, demand, covid, vaccines, fade, as, pandemic, tailwinds, fade, ,, cvs, ', ambitions, become, more, health, -, care, destination, will, be, front, center, ., #, rohitkadimisetty, #, businessnews"
1153,""", no, worse, than, influenza, ."", we, have, studies, showing, long, term, heart, lung, damage, ., omicron, can, kill, you, waves, ,, because, it, can, reinfect, ., "", 80, +%, vaxxed, it, ', s, still, spreading, ."", because, it, can, beat, vaccine, ,, but, vaccine, reduces, hospitalizations, deaths, ."
1154,"cdc, still, needs, approve, young, kids, ', covid, shots, ,, but, first, shipments, could, arrive, by, feb, ., 21, state, local, health, officials, were, able, start, preordering, first, doses, feb, ., 7, will, begin, receiving, vaccine, shipments, presidents, day, ., #…"
1155,"economics, :, rt, :, high_voltage, protests, over, vaccine, mandates, covid, -, 19, restrictions, are, widening, across, canada, ., truck, blockades, are, halting, commercial, traffic, at, critical, border, crossings, which, threatens, hit, fragile, global, supply, chains, ."
1156,"crack, pipes, they, can, control, most, vulnerable, part, our, society, with, ., ivermectin, treats, virus, they, are, trying, use, control, entire, population, with, ., smart, /, informed, people, know, it, works, as, treatment, saves, them, toxic, vaccine, ."
1157,"economics, :, rt, :, “, we, ', re, slowly, going, back, normal, ."", no, more, vaccine, certificates, ,, no, more, gathering, limits, ., sweden, is, welcoming, end, most, its, #, covid19, restrictions"
1158,"alberta, is, scrapping, most, its, covid, -, 19, protocols, --, including, vaccine, passport, as, wednesday, ., but, protesting, truckers, say, they, ', re, here, stay, ., i, guess, canada, will, be, going, mad, max, first, after, all, ., sorry, australia, ."
1159,"sooooo, ..., you, ', re, just, going, conveniently, forget, that, whole, thing, reduced, hours, ,, deliveries, ,, curbside, pickup, ,, mask, requirements, ,, vaccine, requirements, ,, negative, test, requirements, ,, etc, ."
1160,"bastards, harassing, children, totally, negates, their, right, peaceful, assembly, ., these, are, ones, who, need, be, arrested, charged, ., parents, condemn, mask, ,, vaccine, protesters, targeting, kids, at, winnipeg, elementary, school, |, cbc, news"
1161,"it, ’, s, what, is, playing, out, many, -, particularly, “, effective, ”, with, each, boost, valuable, info, was, censored, &, amp, ;, people, are, now, living, with, vaccine, induced, immunodeficiency, ., #, crimeagainsthumanity"
1162,"another, idiot, who, thinks, joe, rogan, is, spreading, misinfo, when, he, has, certified, dr, ’, s, specialized, covid, &, amp, ;, vaccines, clearly, explain, dangers, shot, ., vaccines, work, but, not, everyone, ., only, dr, ’, s, w, /, political, agendas, leave, out, possible, side, effects, while, pushing, shot, ."
1163,"if, i, ', m, believe, many, posts, i, see, ,, heart, attacks, are, only, caused, by, vaccine, ., i, think, we, were, lied, to, ,, before"
1164,"also, tawakkalna, you, ', re, requested, have, 3, dosage, 2, +, booster, shots, otherwise, it, ', ll, show, you, incomplete, vaccine, &, amp, ;, security, won, ', t, let, you, both, harams"
1165,"why, cant, masking, vaccines, be, new, normal, if, you, break, your, leg, ,, you, have, crutches, ,, crutches, are, your, new, normal, ,, it, would, be, weird, someone, take, someones, crutches, before, it, was, safe, ., new, normal, is, ignoring, disease, bad, things, because, politicians, tell, us"
1166,"i, ', ve, had, shingles, ..., before, i, was, "", old, enough, "", get, shingles, vaccine, ..., it, is, horrible, ., it, started, with, this, feeling, dread, ., then, thinking, i, was, having, heart, attack, spending, night, er, ,, then, day, or, two, later, rash, erupting, ., even, worse, was, nerve, pain, ."
1167,"i, blocked, the, 2, ., either, they, are, trolls, or, they, are, just, very, "", inviting, "", for, dinner, on, a, wednesday, ., Either, way, ,, a, waste, of, time, ., person_shrugging, ‍, male_sign, ️"
1168,"fda, duplicity, covid, -, 19, vaccines, *, hardlyasurprise, --, duplicityiseverywherewithinourgov, ’, t"
1169,"cnn, :, marg, makins, ', family, has, been, trucking, business, generations, ., as, she, watches, crowds, truckers, protest, vaccine, mandates, across, canada, ,, she, wants, tell, them, about, her, son, who, died, covid, -, 19, ., via"
1170,"who, has, higher, population, density, who, has, higher, vaccine, take, up, two, countries, are, very, dissimilar, ,, comparisons, are, difficult, likely, inaccurate, /, misleading, ."
1171,"he, didn, ’, t, wanna, take, vaccine, ,, rona, beat, his, mf, ass, he, nigga, couldn, ’, t, work, with, no, pay, month, half, because, he, didn, ’, t, wanna, take, vaccine"
1172,"vaccine, slows, down, replication, virus, due, antibodies, we, have, ., mutations, happen, when, there, ’, s, error, replication, virus, ,, therefore, it, ’, s, much, more, likely, happen, unvaccinated, person, ., very, unlikely, happen, vaccinated, person, ."
1173,"i, have, feeling, that, candle, start, tariffs, china, other, will, try, get, virus, going, with, covid, think, about, stirred, covid, that, ’, s, come, out, weird, i, ’, m, not, sure, what, it, tails, have, bosom, adulterant, first, month, without, vaccine, but, i, was, so, fast"
1174,"nobody, should, be, “, stampeded, ”, into, anything, ., i, don, ’, t, want, mask, mandates, go, away, through, herd, mentality, because, herd, could, later, go, other, direction, ,, so, kudos, resisting, that, ., let, ’, s, lift, mandates, based, vaccines, preventing, severe, disease, ."
1175,"rogan, already, turned, trump, down, years, ago, ."
1176,"if, anti, -, vaccine, is, wanting, pharmaceutical, companies, do, right, thing, be, held, liable, their, experimental, vaccines, innocent, people, then, go, anti, -, vaxx, who, can, support, these, pharmaceutical, companies, at, this, point, what, crime, against, humanity"
1177,"meanwhile, ,, countries, with, highest, vaccine, uptake, are, seeing, highest, number, cases, ."
1178,"this, is, making, replacing, christianity, with, vaccine, worship, explicit, official, ., as, mark, beast, teaching, foreshadowed"
1179,"we, have, raised, respect, each, other, ’, s, lives, ., i, am, vaccinated, pro, vaccine, but, i, should, respect, anyone, who, is, not, vaccinated, whatever, reason, ., they, should, not, be, banned, enter, restaurants, ,, shops, or, cross, borders, as, long, as, they, are, wearing, mask, ., as, simple, as, that, ."
1180,"face_with_rolling_eyes, “, people, are, saying, ”, no, faux, news, is, saying, that, ., masks, vaccines, work, ., mandates, work, ., it, shouldn, ’, t, be, this, hard, protect, each, other, ."
1181,"bc, roll, out, new, vaccine, mandates, all, healthcare, workers, -"
1182,"cvs, health, results, beat, demand, covid, -, 19, vaccines, ,, tests, #, news, #, breakingnews, #, breaking, #, topnews"
1183,"us, appeals, court, will, not, reinstate, biden, ’, s, vaccine, mandate, federal, employees, #, news, #, breakingnews, #, breaking, #, topnews"
1184,"novavax, underdelivers, covid, -, 19, vaccine, promises, #, news, #, breakingnews, #, breaking, #, topnews"
1185,"who, should, produce, vaccines, &, amp, ;, treatments, macdonalds, or, kfc"
1186,"twisted, logic, ., cdc, gaslighting, again, ., so, now, immunity, means, no, immunity, at, all, ., basically, ,, admitting, vaccine, is, glorified, flu, shot, ."
1187,"there, you, go, again"
1188,"it, ’, s, insane, people, have, your, opinion, when, being, triple, vaccinated, exists, ., do, you, think, vaccines, work, ,, or, not"
