,0
3563,"look, at, that, cut, …., shit, kicker, up, next, …, andrew, shaw, up, tomorrow, ⁦⁩, #, blackhawks, 🇨, Australia, 🇸, trophytrophy"
3564,"it, ', s, not, wrong, tho, ;, i, don, ', t, care, who, it, is, face, face, ;, future, ,, famke, janssen, :, they, ask, if, you, got, big, dick, ,, they, answer, is, "", oh, yeah, "", "", yeah, "", if, non, -, immediate, ,, that, ', s, hesitation, it, ', s, not, did, you, not, hear, them"
3565,"but, attention, that, if, modern, or, astrazeneca, has, to, be, with, old, grogue, ,, of, s, ., ant, or, s, ., nicolau, ., with, pfizer, ,, janssen, and, others, can, be, stack, groggy"
3566,""", janssen, is, the, most, dangerous, "":, dt, del, al, jazira, ..., speak, -, no, -, evil_monkeyspeak, -, no, -, evil_monkeyspeak, -, no, -, evil_monkey"
3567,"they, are, still, ahead, blue, origin"
3568,""", janssen, is, the, most, dangerous, "":, dt, del, al, jazira, says, that, they, have, well, studied, vincent, #, mt22años, #, mediotiempo22"
3569,"I, think, Marc, Overmars, ."
3570,"all, thanks, cover, artist, ., number, 3, will, be, out, 3, /, 7, ."
3571,"again, it, will, come, out, positive, for, covid, or, another, routine, hospitalization, #, fueravasco, #, fueralopezhablador"
3572,"my, song, to, celebrate, black, history, month, :, black, man, by, stevie, wonder, ., because, the, historiography, we, also, need, colored, role, models, ., backhand_index_pointing_downmedium_skin_tone"
3573,"everyone, ages, 18, +, should, get, booster, dose, :, -, 5, months, after, your, last, dose, pfizer, -, biontech, or, moderna, vaccine, -, 2, months, after, your, johnson, &, amp, ;, johnson, ’, s, janssen, vaccine, find, provider, near, you, at, #, fcph, #, publichealth"
3574,"daily, systemwide, cody, -, 19, update, february, 7, ,, 2022, people, are, considered, fully, vaccinated, 2, weeks, after, their, second, dose, pfizer, -, biontech, or, moderna, covid, -, 19, vaccines, ,, or, 2, weeks, after, single, -, dose, johnson, &, amp, ;, johnson, ’, s, janssen, covid, -, 19, vaccine, ."
3575,"ordered, ."
3576,"perhaps, the, eating, is, because, of, the, "", picnis, "", janssen"
3577,""", tooting, horn, is, not, expression, any, great, thought, i, am, aware, of, ."""
3578,"The, fiasco, could, be, worse, if, it, is, lost, again, ,, although, I, think, that, has, been, worth, 3, hectares, of, ..., to, the, #, vascoaguirre, #, fueravasco, #, fueradavino, #, fueraornelas"
3579,"or, most, bob, dylan"
3580,"former, badass, guerillas, get, pastries, therapy, ,, novella, series, ."
3581,"so, is, ., it, is, a, horizontal, hill, ."
3582,"appreciate, all, fall, sports, coaches, taking, advantage, this, time, proactively, develop, their, leaders, fall, get, $, 5, diskount, per, book, when, you, order, 5, -, 9, copies, &, amp, ;, $, 10, diskount, per, book, when, you, order, 10, or, more, ., amazon, can, ', t, beat, this, price"
3583,"it, is, the, most, expensive, and, overvalued, squad, ,, with, saying, that, our, most, expensive, player, is, the, dead, man, of, luis, romo, ,, or, having, players, like, pizarro, ,, janssen, or, funes, ,, who, are, said, to, be, worth, 5, -, 6, million, dollars, but, have, not, played, for, 3, years, well, ."
3584,"old, white, men, ., stop, being, gross, at, gym, ,, thx, ."
3585,"everyone, 18, years, of, age, or, older, should, get, a, booster, dose, :, -, 5, months, after, their, last, dose, of, pfizer, -, biontech, or, modern, vaccines, -, 2, months, after, the, janssen, by, johnson, &, amp, ;, johnson, get, vaccinated, :"
3586,"his, daughter, learned, lie, at, daddy, ', s, knee, ."
3587,"How, much, do, you, know, about, #, rayados, ,, some, important, player, ,, they, ask, the, dt, of, al, jazira, ., "", vincent, janssen, ,, the, dutchman, ,, is, the, most, dangerous, ., we, know, he, is, a, very, good, player, ,, left, -, footed, ,, every, season, he, scores, a, lot, of, goals, ,, we, are, preparing, ,, watching, videos"
3588,"ok, gop, ..., tell, us, again, that, "", elites, "", like, actors, n, high, paid, sports, figures, should, not, have, political, or, social, voice, ."
3589,"it, ', s, yeehaw, hoedown, yahoos"
3590,"warren, knows, people, who, live, this, building, this, didn, ', t, fact, happen, as, reported, ."
3591,"didn, ', t, protesters, have, clash, with, residents, this, building, when, they, came, out, complaining, about, noise, then, all, sudden, someone, ', s, there, trying, light, it, up"
3592,"is, aren, ', t, they, lifting, restrictions, as, ic, u, ', s, allow, common, sense, says, says, that, if, you, lift, them, all, at, once, our, hospital, infrastructure, can, collapse, ., as, we, ', ve, seen, many, examples, around, world, ."
3593,"so, ..., you, only, diskussed, not, sending, unauthorized, tweets, not, content, lame"
3594,"Analyzing, Saturday, ', s, defeat, with, a, cool, head, ,, the, Basque, brought, in, newcomers, ,, obviously, jetlag, affected, them, ,, and, when, he, brought, in, players, like, Janssen, ,, of, course, they, came, in, upset, because, he, felt, he, should, start, at, least, in, that, game, ..."
3595,"how, about, nobody"
3596,"well, .., when, too, many, dumbasses, wouldn, ', t, get, vaccinated, ,, someone, had, be, adult, ."
3597,"neither, is, this, johnson, &, amp, ;, johnson, janssen, effect, ,, as, top, states, administer, those, jabs, were, by, far, ..., ca, fl, tx, ny, pa"
3598,"i, agree, ., i, ', ve, made, point, researching, judges, n, commissioners, n, supervisors, ., local, n, county, officials, have, just, as, much, impact, as, top, -, of, -, ballot"
3599,"and, some, sports, journalists, are, more, outraged, by, what, the, #, rayados, bar, does, than, what, person_shrugging, ‍, male_sign, ️, publishes, today"
3600,"It, ', s, called, congruence, ,, if, you, ', re, wrong, I, ', ll, boo, you, if, you, ', re, right, I, ', ll, chorus, you, ,, something, that, the, striped, ones, who, have, the, janssen, idol, lack, and, believe, they, are, the, last, soft, drink, in, the, desert"
3601,"the, best, thing, was, the, janssen, representative, who, gave, them, the, video, hahahaha"
3602,"She, still, can, ', t, get, over, the, fact, that, the, puppy, didn, ', t, accept, her, ,, Mrs, ., Janssen, even, seems, to, owe, her, alimony, ,, she, ', s, over, it, ..."
3603,"#, fueravascoaguirre, the, oldest, sells, smoke, as, dt, in, the, history, of, Mexican, soccer, and, the, most, inflated, by, the, friendly, press"
3604,"as, farmer, i, am, gobsmacked, that, they, ', d, allow, jerrycans, diesel, anywhere, near, downtown, let, alone, hoc, ', s, buildings, ., few, bags, nitrogen, what, do, you, have, this, is, beyond, dangerous, ridiculous, ., stupidity, cowardice, ."
3605,"famke, janssen, in, an, f355, running, away, from, james, bond, in, a, classic, aston, martin, ., at, that, time, the, cinema, was, still, breathing"
3606,"which, god"
3607,"i, hope, this, article, inspires, diskussion, experimentation, ., your, move, ,, pitmasters, ."
3608,"he, has, shown, that, since, day, he, became, pm, ., before, that, even, ., full, hair, they, don, ', t, care, ., i, ', ve, seen, inklings, that, he, is, actually, quite, covid, sick, ., any, truth, that"
3609,"Let, me, make, one, that, you, prefer, to, sell, the, stadium, ,, run, Funes, Mori, ,, run, Janssen, ,, Rayados, vs, Palmeiras"
3610,"told, ya, so, this, isn, ', t, about, truckers, ., it, ', s, about, how, white, you, are, ,, how, ', christian, ', you, are, control, ., do, actual, truckers, this, mess, know, how, bad, they, ', ve, been, had"
3611,"Are, you, talking, about, the, vincent, janssen, from, scratches, flushed_face"
3612,"noah, carried, only, few, thousand, “, proto, -, animals, ”, board, ark, ,, when, those, stepped, back, onto, dry, land, ,, they, hyper, -, speciated, into, diverse, global, eco, -, system, that, we, see, today, evolution, indeed"
3613,"the, problem, of, many, self, -, proclaimed, "", public, transport, planners, "", is, that, they, think, that, if, you, just, build, a, luxury, line, ,, the, travelers, will, come, ., but, of, course, it, doesn, ', t, work, that, way, ., there, must, be, enough, travelers, who, just, want, to, travel, that, route, ."
3614,"only, shower, musical_notesmusical_notemicrophone"
3615,"so, much, this, ."
3616,"'', vincent, janssen, ,, the, dutchman, ,, is, the, most, dangerous, ., we, know, he, is, a, very, good, player, ,, left, -, footed, ,, every, season, he, scores, a, lot, of, goals, ,, we, are, preparing, ,, watching, videos, .’’, marcel, keizer, ,, coach, of, al, jazira, ., who, tells, the, truth, rolling_on_the_floor_laughingrolling_on_the_floor_laughingrolling_on_the_floor_laughing"
3617,"hahahahahaha, the, fearsome, janssen"
3618,"Pandi, ,, we, have, to, open, our, eyes, now, ..., there, are, players, who, don, ', t, deserve, to, continue, here, ., janssen, ,, kranevitter, ,, gallardo, ,, top, the, list, ,, but, the, historic, one, is, also, on, that, list, ., I, am, not, saying, that, they, send, it, alv, now, ,, but, it, is, time, to, bank, it, and, bring, someone, who, does, not, shrink, ."
3619,"what, needs, to, be, read, as, mensitos, person_facepalmingmedium_skin_tonemale_sign, ️, person_facepalmingmedium_skin_tonemale_sign, ️, person_facepalmingmedium_skin_tonemale_sign, ️, person_facepalmingmedium_skin_tonemale_sign, ️, are, calling, on, goalkeeper, Honduras, or, El, Salvador, God, knows, who, gives, them, the, will, to, come, out, and, say, things, like, that, person_facepalmingmedium_skin_tonemale_sign, ️, person_facepalmingmedium_skin_tonemale_sign, ️, person_facepalmingmedium_skin_tonemale_sign, ️"
3620,"this, dt, from, al, berijas, sees, the, janssen, trunk, with, the, same, eyes, of, love, that, my, peers, see, him, and, that, they, continue, banking, him, ,, they, ask, for, him, in, every, game, and, other, ball, licks, ,, backed, up, they, say, his, performance, ,, great, "", wins, "", and, gushing, goals"
3621,"still, doing, it, right, way"
3622,"nominations, are, open, 2022, dr, ., paul, janssen, award, award, honors, scientists, who, have, significantly, impacted, human, health, ., submit, at, by, february, 28, #, dpjaward, #, championsofscience"
3623,"we, need, composite, all, ‘, what, is, modern, data, stack, ’, blogs, where, vendor, ’, s, logo, conspicuously, dominates, its, category"
3624,bravo
3625,"buy, red, bull, online, buy, red, bull, online, in, this, post, we, will, take, a, look, at, how, to, buy, red, bull, online, while, also, diskussing, availability, ,, shipping, ,, pricing, and, shopping, at"
3626,"ireen, wust, made, history, today, ., With, a, new, Olympic, record, in, the, 1, ,, 500, meters, ,, he, became, the, first, person, to, win, a, gold, medal, in, five, Olympic, Games, ., I, respect"
3627,"freedom, insurance, coverage, ,, apparently, ., freedom, their, personal, property, ,, too, -, if, class, action, suit, succeeds, ., enjoy, your, freedom, ,, kids, ., remember, :, actions, lead, consequences, ., this, is, how, real, world, works, ."
3628,"10, safety, tips, online, shopping"
3629,"I, had, to, read, it, 8, times, ."
3630,"justification, for, standard, city, bus, ,, minibusses, run, on, it, for, a, good, part, of, the, day, ., how, do, you, want, to, justify, that, it, is, converted, to, a, hov, connection, such, as, a, tram, metro"
3631,"courtney, billington, -, president, janssen, neuroscience, ,, #, mentalhealth, &, amp, ;, #, wellness, advocate, ,, #, veteran, -, shares, his, journey, how, his, father, ’, s, dementia, made, him, want, be, part, change, ., #, blackmentalhealth"
3632,"let, ', s, make, it, pop, dot, eu, add, dutch, show, too, smirking_face"
3633,"the, big, problem, I, have, with, designs, like, that, "", wheel, with, spokes, "", is, that, they, ', re, fantasy, plans, for, how, you, could, make, connections, that, don, ', t, match, the, required, connection, capacity, ., there, is, already, a, "", ring, line, "", and, it, can, ', t, even, take, the, bet, of, a"
3634,"public, safety, isn, ', t, built, want, ., my, grandkids, love, peanut, butter, &, amp, ;, it, would, be, so, convenient, make, peanut, butter, sandwiches, their, school, lunches, ., if, we, can, ', t, protect, vulnerable, children, school, with, simple, mask, ,, why, peanut, butter, ban"
3635,"cowboy_hat_face, |, At, a, press, conference, prior, to, facing, Rayados, ,, Marcel, Keizer, highlighted, Vincent, Janssen, ,, who, mentioned, that, he, scores, many, goals, every, season, #, abcdeportes, |, radio, 92, ., 1, fm, and, 660, am"
3636,"ndp, would, like, eventually, see, every, person, receiving, same, living, wage, no, matter, walk, life, or, how, hard, some, people, work, ., they, are, built, communist, foundations, ., don, ', t, kid, yourself, ., often, ,, there, isn, ', t, much, difference, between, them, lpoc, ."
3637,"most, childhood, vaccines, require, several, boosters, ,, then, every, so, many, years, ., covid, will, become, yearly, vaccine, just, like, flu, about, 5, years, ,, probably, not, needed, at, all, ., be, positive, ."
3638,"with, funes, mori, ,, janssen, ,, gallardos, ,, ponchitos, they, are, not, going, to, take, the, big, step, that, they, so, much, want, and, demand, ., they, are, in, dubai, and, they, already, think, about, the, “, little, town, ”, grinning_face_with_sweat, what, a, slap, ."
3639,"hahahaha, not, even, janssen, ', s, mom, says, that"
3640,"And, you, didn, ', t, celebrate, Janssen, ', s, ,, you, celebrate, for, the, team, ,, not, because, a, jerk, finds, a, ball, alone, and, without, a, goalkeeper, ."
3641,"are, these, your, under, porch, cats, have, they, moved, indoors, they, are, nice, looking, cats, seem, very, content, ."
3642,"How, much, do, you, know, about, Rayados, ,, any, important, player, “, Vincent, Janssen, is, the, most, dangerous, ., we, know, that, he, is, a, very, good, player, ,, left, -, footed, ,, every, season, he, scores, a, lot, of, goals, ,, we, are, preparing, ,, watching, videos, ”., keizer, ,, dt, al, jazira, ., football, is, debatable, ."
3643,"check, out, steven, janssen, ', s, insight, into, how, choose, right, tax, professional, maryalene, laponsie, ', s, latest, article, #, taxprofessional, #, insights"
3644,"canadian, dli, ', s, ,, take, note, ., should, weigh, into, admissions, requirements, ."
3645,"to, collect, #, fueravasco"
3646,""", humility, is, the, light, of, the, perplexities, and, dangers, of, life, ., "", arnold, janssen"
3647,"seeing, is, believing, ..., marcel, keizer, ,, dt, of, al, jazira, ,, considers, that, the, most, dangerous, thing, that, #, rayados, has, is, vincent, janssen"
3648,"take, back, what, they, gave, you, and, they, forgave, you, #, epigmenioregresaelmoney"
3649,"which, books, are, occupying, your, time, these, days, thanks, jon, janssen, 586, 453, -, 4457, jonjanssen67, ., com"
3650,"sell, professional, smoke, #, fueravasco"
3651,"Chile, so, far, ,, #, chile, has, bought, 51, ., 5, million, doses, pfizer, /, biontech, ,, modern, ,, astrazeneca, ,, sivac, ,, cansino, ,, sputnik, and, janssen, ., #, oncenoticias, has, the, full, report, ., red_triangle_pointed_down"
3652,"In, fact, ,, it, is, a, way, of, telling, us, that, Mexican, soccer, is, not, seen, in, the, world, ., janssen, sure, know, him, for, his, time, in, europe, ., the, baths, of, humility, continue, the, ligamx, in, the, world, cup, ."
3653,"very, pretty, cover, ,, too, ."
3654,"you, should, ', ve, taken, that, money, ., geez, ."
3655,"we, used, looooooooooooove, kojak, when, i, was, kid, ."
3656,"ouch, ."
3657,"send, us, that, janssen"
3658,"pre, -, registration, links, moderna, :, janssen, /, j, &, amp, ;, j, :, pfizer, 12, +, teens, /, adults, :, pfizer, 5, -, 11, pediatric, :, residents, can, call, 757, -, 514, -, 4766, more, information, ."
3659,"pre, -, registration, is, encouraged, but, it, is, not, required, ., walk, -, ins, will, be, accepted, ., western, tidewater, csb, -, 5268, godwin, boulevard, thurs, ,, feb, 10, ,, 2022, 10, am, 4, pm, vaccines, offereTongue_sticking_out_cheeky_playful_or_blowing_a_raspberry, moderna, ,, pfizer, ,, pfizer, 5, -, 11, pediatric, ,, janssen, /, j, &, amp, ;, j, doses, offereTongue_sticking_out_cheeky_playful_or_blowing_a_raspberry, 1st, ,, 2nd, ,, 3rd, ,, booster"
3660,"my, 20, minute, go, -, to, ,, stovetop, ,, is, simmering, canned, beans, with, vegetables, such, as, tomatoes, ,, canned, pumpkin, ,, corn, ,, spices, your, choice, ., lots, variations, work, ., helps, if, you, saute, garlic, or, onion, oil, before, adding, beans, veggies, ., adjust, thickness, with, water, ., eat, over, grain, ."
3661,"los, videos, de, janssen, contra, cafetaleros, en, copa, mx, sera, face_with_tears_of_joy"
3662,"How, much, do, you, know, about, #, rayados, ,, some, important, player, ,, they, ask, the, dt, of, al, jazira, ., "", vincent, janssen, ,, the, dutchman, ,, is, the, most, dangerous, ., we, know, he, is, a, very, good, player, ,, left, -, footed, ,, every, season, he, scores, a, lot, of, goals, ,, we, are, preparing, ,, watching, videos, ."""
3663,"quiet, stretch, weather, now, ,, but, one, cold, front, particular, has, our, attention, later, this, week, ., here, ', s, what, setup, looks, like, :, photo, jana, carlson, #, kswx"
3664,"forget, it, we, waste, time, ,, they, must, clean, from, the, inside, ,, let, funes, janssen, campbell, krane, go"
3665,"read, comments, twitter, that, don, ', t, just, support, what, your, dream, is, ."
3666,"if, reason, you, think, something, started, is, ', memory, ', 11, days, ,, then, something, has, gone, horribly, wrong, ., #, truckersgohome"
3667,"people, have, stop, pretending, this, protest, is, peaceful, ., pictures, reports, citizens, are, showing, us, how, unpeaceful, they, are, ., thugs, bullies, ."
3668,"biden, pardon, trump, would, be, profound, failure, ,, betrayal, any, shared, ideal, ., accountability, is, essential, credibility, ."
3669,"jubilee, willem, janssen, about, his, pension, :, ', we, will, not, reach, that, 500, anymore, `"
3670,"sure, there, is, ., line, will, keep, moving, ., bar, will, keep, getting, lower, ., lying, will, continue, ."
3671,"captain, ,, club, icon, and, last, Saturday, he, played, his, 400th, professional, football, match, ., but, now, he, sits, on, the, couch, more, often, than, he, would, like, ., willem, janssen, about, a, special, anniversary, ,, doubts, and, a, possible, early, retirement, ."
3672,"100, %, this, is, my, frustration, as, well, ., both, federal, provincial, ., stop, gd, pandering"
3673,"this, guy, is, bang, what, we, were, ., this, is, where, our, party, needs, get, back, to, ., clear, eyed, realists, who, aren, ', t, afraid, do, what, needs, be, done, ., protestors, very, few, are, actual, truckers, are, mob, trying, force, unsafe, openings, &, amp, ;, you, need, open, your, eyes, ."
3674,"bop, is, bop, is, bop, is, bop, ..., anyway"
3675,"rebel, news, is, currently, dry, humping, so, -, called, truckers, ., this, is, kind, shit, they, get, off, on, ., if, rebel, is, your, best, buddy, you, better, take, look, around, readjust, your, thinking, ., #, freedomconvoy2022"
3676,"course, it, is, ., is, this, real, question"
3677,"wordle, 233, 4, /, 6, white_large_squaregreen_squarewhite_large_squarewhite_large_squareyellow_square, white_large_squaregreen_squareyellow_squareyellow_squarewhite_large_square, white_large_squaregreen_squarewhite_large_squarewhite_large_squaregreen_square, green_squaregreen_squaregreen_squaregreen_squaregreen_square"
3678,"okay, ,, end, is, my, sentiment, 100, %, #, freedomconvoy2022"
3679,"great, meeting, yesterday, with, &, amp, ;, roger, janssen, $, dddx, hear, about, their, plan, 2022, beyond, we, were, even, given, some, unbelievable, #, 3dprinted, copper, bars, check, out, name, at, bottom, ., #, rbcapital, #, nasdaq"
3680,"oh, ya, #, neverforgetjanuary6th"
3681,"embattled, rnc, head, ronna, mcdaniel, busted, talking, point, memo, with, glaring, falsehood"
3682,"putin, believes, soviet, union, should, be, brought, back, ."
3683,"they, have, already, crossed, border, ."
3684,"it, is, hard, to, :, -, get, up, early, workout, -, push, through, last, rep, -, touch, every, line, conditioning, -, compete, every, play, -, maintain, your, poise, -, confront, teammate, but, it, is, much, harder, live, with, regret, not, reaching, your, goals, when, you, don, ', t, do, these, things, ."
3685,"ooh, ., I, was, afraid, of, a, nickelback, for, a, while"
3686,"thiiiings, ,, will, only, get, betteeeeerrr"
3687,"which, is, secretly, an, insanely, good, song, ."
3688,"maybe, police, should, stop, killing, people, ."
3689,"and, don, ', t, say, "", complicated, """
3690,"i, have, avril, lavigne, my, head, ., how, is, your, monday, so, far"
3691,"freedom, ,, huh"
3692,"studio_microphone, ️, police_car_lightnew, podcast, episode, of, ', the, academy, ', this, time, :, honor, -, related, violence, ., the, police, investigate, cases, hundreds, of, times, a, year, in, which, the, family, honor, is, at, stake, and, the, family, threatens, with, violence, ., with, lecturer, janine, janssen, ,, among, others, ., listen, along"
3693,"advice, you, receive, today, might, be, good, ,, but, it, could, also, ..., more, cancer"
3694,"he, did, not, mention, his, employer, janssen, in, the, statement, omt, ., is, not, a, conflict, of, interest, ..., still, thinking_face, all, the, members, of, the, omt, have, so, many, side, jobs, ., they, still, get, to, their, ', normal, ', work, in, addition, to, the, many, television, appearances, ...."
3695,"case, death, rates, people, fully, vaccinated, with, any, three, vaccine, types, moderna, ,, pfizer, -, biontech, ,, johnson, &, amp, ;, johnson, ’, s, janssen, were, much, lower, than, unvaccinated, people, ."
3696,"that, the, cheerleading, reporters, like, him, who, applaud, the, club, for, their, t, -, shirt, ,, hats, and, double, passes, should, also, go, ., from, the, áviles, flies, in, training, until, the, ,, janssen, scored, 30, goals, from, 30, shots, of, ., that, they, do, his, work, but, not, that, they, are, scratched, ."
3697,"I, ', m, still, waiting, for, the, janssen, bull, to, come, out, of, your, exclusive, sleepy_face"
3698,"they, put, him, in, for, 5, minutes, ,, no, mames, ,, they, put, in, more, janssen, ,, which, is, a, joke, than, him, ,, if, they, gave, him, a, chance, and, he, played, at, the, top, together, with, fm, ,, it, would, be, something, else, ,, but, they, put, him, in, for, 5, minutes, as, a, flag, bearer, who, sends, centers, ,, that, ', s, how, he, is, bastard"
3699,"little, bit, snow, starting, fall, here, nj, ., but, now, it, ’, s, 2am, ……, time, this, weeks, episode, fugitive, starting, david, janssen, ., this, is, such, good, show, tv, was, good, 1960, ’, s, ., smiling_face_with_smiling_eyes"
3700,"Wouldn, ', t, it, be, better, to, plan, the, reinforcements, for, the, next, tournament, ,, accommodate, players, like, Janssen, and, enter, into, talks, with, possible, coaches, like, Larcamón, ,, right, now, nothing, is, resolved, ."
3701,"like, with, aguirre, ,, pizarro, ,, janssen, ,, campbell, ..., first, yupi, yupi, and, now, upside, -, down_faceupside, -, down_faceupside, -, down_face"
3702,"That, old, woman, has, poop, on, her, brain, ,, surely, she, throws, funes, at, her, because, she, thought, that, because, of, him, they, don, ', t, put, janssen, hahahaha"
3703,"i, won, my, 5th, grade, spelling, bee, word, that, trips, me, up, every, time, villain, ., i, will, always, spell, it, “, villian, ”., i, do, double, -, take, every, time, still, think, i, ’, m, right, until, spellcheck, tells, me, i, ’, m, wrong, ., that, ’, s, it, -, thanks, coming, my, ted, talk, ."
3704,"watching, it, right, now, ,, holy, crap, this, opening, scene, ...., give, zendaya, all, awards"
3705,"#, motivationmonday"
3706,"you, put, together, the, salaries, of, funes, and, janssen, and, you, pay, them, and, that, ', s, it, ."
3707,"it, is, true, that, they, had, it, but, it, fractured, and, they, brought, janssen"
3708,":, v"
3709,"if, you, subtract, deaths, covid, ,, those, who, died, defending, capital, gop, -, led, insurrection, ,, those, who, were, killed, by, illegal, guns, ,, then, it, would, have, been, safest, year, cops, decades, ., #, context"
3710,"i, literally, screamed, covered, my, face, ., it, happened, so, fast, ,, i, wasn, ’, t, expecting, it, face_with_tears_of_joy"
3711,"every, zoom, happy, hour, when, i, decide, start, substack"
3712,"probably, just, need, one"
3713,"janssen, *"
3714,"skull, bakersfield, 3, member, micah, holsonbake, was, found, aug, ., 1, near, kern, river, ,, his, mother, says, ., 17, ', s, maddie, janssen, reports, ."
3715,"so, much, talent"
3716,"zendaya, is, everything"
3717,"“, hey, cassie, can, i, ask, you, question, ”, sorry, all, my, neighbors, who, heard, i, scream, this, moment"
3718,"amsterdam, -, delta, ranks, 7th, globally, cleantech, ,, 3rd, europe, ., sounds, like, great, place, grow, your, startup, we, ’, re, happy, help, ., read, more"
3719,"get, boosted, safer, 2022, everyone, 12, +, can, get, booster, 5, months, after, your, 2nd, dose, pfizer, or, moderna, ;, or, 2, months, after, your, single, dose, j, &, amp, ;, j, ’, s, janssen, ., find, free, vaccines, near, you, at, #, wecandothis"
3720,"saw, guy, get, shot, …, at, memorial, another, guy, who, got, shot"
3721,"yup, i, showed, famke, janssen, bathroom, club, at, hockey, game, ,, tony, hawk, ', s, merch, guy, introduced, me, randomly, at, boom, boom, huck, jam, ,, i, worked, autograph, signing, event, at, world, juniors, with, gordie, howe, ."
3722,"#, outornelas"
3723,"funes, has, deficiencies, ., is, clear, ., but, the, other, 9, are, for, the, dog, ., the, club, must, bring, a, better, one, than, funes, and, rumbar, janssen"
