,0
2093,"51, -, year, -, old, female, comedian, faints, during, set, anti, -, vaxxers, assume, it, ’, s, vaccine, ., google, following, ., menopause, fainting, ., whole, menopause, situation, is, multi, -, year, ordeal, ., average, age, is, 52, ., hormones, are, powerful, ."
2094,"not, saying, govt, cannot, lift, vaccine, passports, ., fact, if, pro, -, free, market, businesses, should, be, able, decide, let, market, decide, ., i, would, think, calgary, at, least, not, rural, alberta, so, much, there, would, be, market, keeping, it, at, some, not, all, ."
2095,"did, he, take, that, vaccine, already, lost, some, friends, that, death, jab, ., i, hope, not, ."
2096,"not, likely, ., even, before, vaccines, that, dont, do, much, ,, your, chance, surviving, covid, was, still, well, above, 99, %., lol"
2097,"“, some, users, have, erroneously, claimed, variant, was, “, created, ”, by, covid, -, 19, vaccines, ., this, is, false, :, while, recently, identified, ,, “, vb, variant, ”, predates, de, covid, -, 19, pandemic, patients, analyzed, paper, were, infected, between, 2000s, early, 2010, ”"
2098,"you, have, no, idea, how, happy, i, am, that, i, decided, not, get, this, garbage, scam, vaccine, ., its, not, even, vaccine, ,, it, ', s, immune, booster, ., god, knows, what, else, this, crap, does, people"
2099,"vaccine, is, not, effective, at, reducing, spread, since, omicron, ."
2100,"people, ontario, were, allergic, bees, ., plane, brazil, crashed, at, pearson, 100, ,, 000, bees, escaped, ., public, health, scrambled, inject, all, with, vaccines, against, honey, ."
2101,"so, have, we, given, up, vaccine, mandates"
2102,"did, jason, kenney, show, up, anyone, else, ’, s, house, suck, vaccine, out, their, arm, or, was, that, just, me"
2103,"anyone, using, joe, rogan, as, your, “, credible, source, ”, your, anti, -, vaccine, nonsense, *, cough, cough, *, *, cough, cough, *"
2104,"i, do, not, get, why, #, resignkorruptkenney, is, so, hell, bent, killing, off, his, own, base, ., if, they, die, ,, they, will, not, vote, him, ., i, know, math, is, hard, conservatives, ,, but, you, ’, d, think, he, would, be, bit, more, worried, about, them, they, have, no, vaccines, ,, don, ’, t, wear, masks, don, ’, t, distance"
2105,"ask, your, journalist, why, excess, deaths, are, higher, 2021, with, vaccines, than, 2020, without, vaccines, why, do, we, let, people, get, plane, with, fever, 2021, but, not, 2020, maybe, you, are, indoctrinated, one"
2106,"let, ', s, talk, about, these, issues, real, substance, when, preparing, vote, australia, ', s, next, election, 1, covid, -, 19, response, ., lack, rats, ,, lack, vaccine, supply, ,, mixed, messaging, ,, aged, care, debacle, 2, climate, ., no, new, or, meaningful, policies, combat, climate, change"
2107,"stupid, this, vaccine, has, nothing, do, with, you, getting, covid, but, keep, thinking, that, way, then, all, young, people, dying, will, be, this, trump, vaccine"
2108,"so, you, agree, with, me, like, you, said, ,, you, are, 97, times, less, likely, die, ,, without, vaccine, ."
2109,"all, i, can, think, when, i, see, people, fighting, vaccines, or, masks, is, lemmings, fighting, jump, off, cliff, first, ., unlike, lemmings, though, ,, this, crowd, wants, take, us, along, their, ride, ., humanity, is, …, tiring, ."
2110,"i, ’, m, used, mask, ., vaccine, no, big, deal, ., got, 0, %, side, effects, my, booster, ., these, assholes, i, ’, m, just, sad, ,, disgusted, fucking, furious, ."
2111,"they, did, ,, that, sucks, ., but, we, ', re, going, be, getting, close, point, where, we, ', re, just, punishing, ourselves, name, helping, people, who, refused, follow, rules, whole, time, anyway, ., vaccines, ,, especially, with, boosters, ,, limit, risk, ., they, ', re, readily, available, ., 1, /, 2"
2112,"johnson, &, amp, ;, johnson, quietly, stops, covid, -, 19, vaccine, production, –, nyt, —, rt, world, news"
2113,"i, love, how, example, provided, covid, misinformation, is, him, saying, if, you, ', re, young, healthy, you, probably, don, ', t, need, vaccine, ., this, is, 100, %, accurate, ."
2114,"well, i, presume, that, will, lead, flu, vaccine, mandate, ."
2115,"masking, is, crucial, vaccine, passport, is, fine, ., but, this, is, best, answer, ., i, hope, your, mayor, considers, it, ."
2116,"reason, is, compliance, not, anti, vaccine"
2117,"so, ,, you, must, support, right, your, fellow, americans, decide, themselves, if, want, receive, vaccine, their, body, ., their, choice, ., right"
2118,"yeah, ,, vaccine, rates, near, herd, immunity, dense, populations, post, -, omicron, have, nothing, do, with, it, ., face_with_rolling_eyes"
2119,"this, reeks, ppc, tactics, i, don, ', t, know, why, this, is, being, just, brushed, off, as, "", anti, -, vaccine, mandates, "", issue, ., it, ', s, something, else, altogether, ."
2120,"according, jacobson, v, massachusetts, they, ’, re, not, illegal, ..., also, ,, technically, speaking, flu, shots, are, influenza, vaccines"
2121,"vaccines, don, ', t, create, magical, force, field, ;, virus, still, can, get, into, your, body, ., vaccines, slowed, rate, infection, among, vaccinated, maybe, 3, fold, ., what, would, have, been, effect, health, care, system, if, rt, was, 3x, higher"
2122,"that, sucks, ., what, are, symptoms, what, ', s, ratio, this, long, covid, compared, people, with, life, changing, symptoms, vaccine, especially, now, that, its, omicron, upper, respiratory, ."
2123,"traumatic, brain, injuries, kill, 50, ,, 000, people, per, year, us, ., neither, vaccines, nor, asteroids, kill, even, handful, ."
2124,"i, think, you, may, be, misunderstanding, me, ., if, everyone, was, as, boneheaded, as, us, when, it, came, matters, like, social, distancing, example, -, people, would, have, died, ., i, ’, m, not, going, near, vaccines, issue, this, evening, ."
2125,"this, thread, was, taxing, read"
2126,"i, ’, d, rather, have, 2015, vaccine, then, 2021, ."
2127,"how, can, there, be, two, sides, this, story, there, isn, ’, t, ., getting, vaccine, is, caring, about, your, neighbor, ., unless, you, isolate, totally, ,, being, unvaccinated, may, cause, you, kill, vulnerable, person, ."
2128,"except, biden, crested, most, jobs, one, year, ,, than, history, our, country, ., it, ’, s, not, biden, ’, s, fault, that, trumpers, refused, vaccine, spread, covid, until, we, had, several, variants, ., majority, deaths, were, those, unvaccinated, more, than, likely, trumpers, ."
2129,"20220209, :, chris, selley, :, calls, rethinking, restrictions, are, coming, inside, liberal, house, ["", everything, vaccine, passports, border, measures, needs, be, “, re, -, examined, ”, recognition, that, “, this, virus, is, not, going, disappear, ,”, dr, ., theresa, tam, argued, last, week, """
2130,"musical_notes, keep, wearing, your, filthy, mask, ,, be, sure, get, your, 8th, booster, because, government, bill, gates, who, says, vaccines, are, good, way, reduce, population, told, me, to, ,, smoke, more, crack, ., "", let, ', s, go, darwin, ""., democrats, ,, chant, if, you, still, have, pulse, ., musical_notes, humanity, is, devolving, ."
2131,"fast, -, forward_button"
2132,""", anti, -, vaccine, activists, have, formed, dozens, telegram, chat, groups, each, state, ,, with, many, dedicated, specific, counties, ."""
2133,"update, :, presumably, saw, thread, above, trump, /, gop, school, board, banning, trip, dc, over, dc, vaccine, mandate, ,, &, amp, ;, posts, philadelphia, inquirer, article, same, ., #, dcstatehoodnews"
2134,"#, gohomeconvoy, #, gohometruckers, #, vaccines, way, out"
2135,"why, wouldn, ', t, you, just, because, they, don, ', t, believe, vaccines, doesn, ', t, mean, they, deserve, die, ..."
2136,"vaccine, mandates, have, always, been, thing, though, ..., also, ,, here, ’, s, this, ."
2137,"not, too, late, #, newjersey, end, all, his, unconstitutional, mask, vaccine, mandates, ., i, mean, ,, it, ', s, probably, memo, that, ', s, certainly, been, circulating, ."
2138,"no, vaccine, is, perfect, none, not, 1, not, ever, choice, between, bad, situation, &, amp, ;, worse, one, needs, be, made, that, difficult, ,, horrible, choice, is, my, 16, dec, question, you, ,, as, yet, unanswered, what, would, you, do, #, covid19, #, misinformationkills, #, dontdieofdenial"
2139,"also, ,, i, ’, m, anti, -, mandate, ,, vaccine, critical, ,, yet, i, ’, m, proud, supporter, trans, people, ., am, i, like, unicorn, or, something, because, it, seems, like, lot, us, are, transphobic, it, ’, s, really, starting, bother, me, ."
2140,"vaxd, elderly, are, also, dying, omicron, ., vaxs, never, work, as, well, them, ..., so, we, either, accept, that, we, ', re, going, kill, off, grandparents, or, we, continue, masks, until, we, have, fully, preventative, vaccines, ."
2141,"90, %, deaths, hospitalizations, reduce, long, covid, so, please, before, dec, 20, /, 21, vaccines, were, never, marketed, i, stopping, transmission, it, was, never, even, trials, at, all, then, ,, fact, check, that"
2142,"freedom, choice, kill, yourself, with, cereal, ,, but, vaccine, ..., #, poisonfda, #, poisonusda, they, should, have, non, -, nutrient, food, section, required, ."
2143,"***, stop, scrolling, ***, if, you, have, kids, or, grandkids, ,, are, confused, as, you, attempt, navigate, risks, associated, with, vaccines, ,, covid, ,, misinformation, ., you, need, read, this, article, ., here, are, many, facts, ,, without, all, attention, -, seeking, bullshit, ., read, it, ., backhand_index_pointing_downbackhand_index_pointing_downbackhand_index_pointing_down"
2144,"i, ', ve, been, able, make, it, through, few, songs, before, but, i, really, question, what, hype, is"
2145,"that, ’, s, what, onlenams, is"
2146,"end, all, immunity, drug, makers, i, will, consider, vaccine, ."
2147,"obviously, they, can, ', t, manage, *, everything, *., sewers, ,, national, defense, ,, snow, removal, ,, vaccine, procurement, ,, i, have, long, list, here, ..."
2148,"gotta, fit, that, thing, properly, or, else, you, ’, re, gonna, have, this, issue, ., properly, fitted, n95s, is, what, i, wore, into, rooms, patients, with, active, tb, ., suspected, mers, ., covid, ., but, i, ’, ve, got, vaccine, helping, out, with, that, one, never, caught, any, it, because, n95s, work, person_shruggingmedium, -, light_skin_tone, ‍, female_sign, ️"
2149,"crazy, jino, japanese, name, only, government, forces, jab, ., even, worse, shape, ,, expired, vaccines, are, extended, expiration, date, by, hand, these, vaccines, are, like, clearance, sale, vaccines, vaxxed, person, jabbed, expired, vaccine, february, 2nd, this, year, ！"
2150,"pandemic, was, always, messaged, poorly, it, caused, division, that, made, effective, long, term, response, impossible, ., instance, ,, vaccine, restrictions, their, nature, are, protective, unvaccinated, ., make, it, about, community, rather, than, othering, misinformed, people, ."
2151,"i, mean, i, live, texas, ,, so, we, never, actually, had, any, mask, or, vaccine, mandatesperson_shruggingmedium_skin_tone, ‍, female_sign, ️, but, ima, stay, masked, vaxxed, forever, though"
2152,"dating, apps, like, tinder, anti, -, covid, vaccine, mandate, protests, drawing, asio, ', s, attention, ,, according, annual, threat, assessment, via"
2153,"we, have, heard, ', coercive, ', vaccinations, years, ., military, ,, health, care, workers, ,, schools, ., take, time, read, this, ,, it, shows, what, vaccine, disinformation, leads, to, :"
2154,"seriously, fuck, them, up, one, side, down, other, ., nobody, ', s, giving, them, any, grief, getting, their, vaccines, ,, they, need, mind, their, own, damn, business, not, give, anybody, else, grief, because, they, didn, ', t, get, one, ., #, taxmandates, #, whinynewyorkers, #, covid"
2155,"one, would, hope, ., i, think, but, am, not, sure, that, it, works, better, other, way, infection, then, immunization, ., reason, :, immunization, limits, severity, infection, -&, gt, ;, decreased, viral, load, -&, gt, ;, muted, immune, response, ., oth, ,, existing, antibodies, fm, infection, have, no, effect, vaccine, response, ."
2156,"horseshit, ., covid19, jabs, don, ', t, stop, you, getting, covid19, ,, like, vaccines, are, supposed, to, ., so, they, changed, definition, make, them, fit, ., #, getbentcdc"
2157,"vaccine, ', s, just, happened, reduced, transmission, quite, bit, at, first, but, it, was, never, trials, that, was, only, thing, they, skipped, as, well, ., until, delta, ', s, data, showed, breakthrough, cases, then, omicron, has, immune, escape, capabilities, now, but, vaccine, ', s, reduce, about, 90, %, ....."
2158,"similarly, ,, there, is, spectrum, responses, measures, society, could, consider, mitigate, covid, ., let, ', s, simplify, this, too, ., responses, are, either, :, let, ', er, rip, no, limits, ,, no, mandates, ,, open, up, ,, or, shut, ', er, down, vaccine, mask, mandates, ,, limit, gatherings, ,, travel, restriction, ."
2159,"okay, ..., i, work, higher, education, ., my, campus, just, opened, in, -, person, instruction, ., people, are, back, campus, ., its, wonderful, ., my, state, is, considering, further, reductions, mask, mandates, ,, vaccine, hesitancy, is, still, thing, ., i, desperately, want, "", normal, "", again, ,, but, i, ', m, worried, ., thread"
2160,"they, should, have, said, free, backwoods, with, vaccine, face_with_tears_of_joy"
2161,"i, actually, cannot, engage, with, this, “, covid, vaccine, causes, aids, ”, nonsense, ., it, actually, triggers, anxiety, at, almost, panic, attack, level, ., why, are, people, so, fucking, stupid, how, are, people, so, fucking, stupid, please, ,, someone, ,, make, fucking, stupid, stop, ."
2162,"i, ’, m, vaxd, 3, shots, ., gave, myself, rx, shots, years, ., yesterday, arm, shot, specialist, ., another, today, different, md, tender, area, ., before, ,, spine, with, fluoroscope, ., last, week, foot, ., pneumonia, &, amp, ;, flu, vaccines, ., blood, draws, mris, ., so, what, get, used, it, ."
2163,"not, everyone, can, get, vaccine, and, ,, call, me, foolish, ,, i, don, ', t, really, want, anyone, die, needlessly, because, some, people, don, ', t, have, empathy, care, about, strangers"
2164,"so, you, saying, following, didn, ', t, come, into, play, before, with, these, vaccines, •, heart, failure, •, blood, clots, •, stroke, •, blindness, •, myocarditis, •, paralysis, •, seizures, •, shingles, •, tinnitus, •, death, ..., vaccine, sales, ., oh, business, closure, economy, dead, job, losses, ."
2165,"why, do, you, feel, that, way, you, earned, those, roles, ., i, don, ’, t, know, who, said, something, you, that, made, you, hurt, that, way, ., but, sister, ,, you, need, someone, talk, to, ., just, get, help, support, you, need, ., i, ’, ll, listen, you, ."
2166,"if, they, ', re, able, come, up, with, vaccine, that, works, at, prevention, at, measles, /, rubella, vax, level, then, masks, will, not, need, be, thing, ., too, many, vaxd, are, still, getting, covid, ., not, fluke, ,, sadly, ,, it, ', s, normal, ."
2167,"many, psychotropic, medications, can, cause, people, become, immunocompromised, ,, but, psychiatrists, never, admit, that, people, are, advised, take, vaccine, wear, masks, without, being, advised, regarding, all, potential, factors, that, can, compromise, one, ', s, immunity, ."
2168,"just, stating, facts, …, all, videos, posts, being, shared, by, vaccine, hesitants, malaysia, come, faux, news, other, conservative, /, right, wing, media, person_shrugginglight_skin_tone, ‍, female_sign, ️, person_shrugginglight_skin_tone, ‍, female_sign, ️, person_shrugginglight_skin_tone, ‍, female_sign, ️, these, people, are, reason, why, half, us, become, covid, deniers, ,, vaccine, hesitant, ,, anti, maskers"
2169,"again, ., 1000th, time, ., your, stupid, earthly, vaccines, aren, ’, t, limiting, factor, any, way, shape, form, ., whatever, needs, be, changed, can, be, changed, ., over, air, ., by, centrals, ."
2170,"save, historical, facts, "", the, revisionist, history, around, vaccines, is, getting, pretty, extreme, ., let, ’, s, be, very, clear, :"
2171,"safety, trials, showed, vaccine, be, overwhelmingly, safe, effective, ., even, with, omicron, ,, efficacy, remains, high, ., real, world, data, supports, these, findings, ., maybe, you, should, be, asking, yourself, why, you, believe, claims, disgraced, ‘, health, professionals, ’."
2172,"this, tells, me, what, was, measured, tool, used, did, not, match, remote, learning, happening, ., not, much, else, ., remember, last, year, was, full, pandemic, &, amp, ;, no, vaccines, ."
2173,"news, flash, ., breaking, news, ., i, don, ’, t, have, work, with, nor, support, folks, you, decided, bake, into, your, vaccines, ."
2174,"if, you, ’, re, simply, against, vaccine, mandates, your, not, very, bright, either, as, far, as, i, ’, m, concerned, ., anti, abortion, fanatics, who, are, pro, vaccine, mask, mandates, are, at, least, bit, more, logically, consistent, however, ,, even, through, they, ’, re, still, wrong"
2175,"money, talks, :, pfizer, ’, s, covid, vaccine, hits, record, number, sales"
2176,"i, made, up, number, ,, that, was, coincidence, ., events, reported, carm, need, be, analyzed, followed, up, etc, ., but, people, don, ’, t, do, that, ;, they, take, reports, all, as, gospel, attributed, vaccine, ., that, ’, s, not, how, it, works, ., but, that, ’, s, how, lw, vff, want, you, think, it, works, ."
2177,"three, best, decisions, i, ', ve, ever, made, ., 1, enlisting, army, 2, saving, up, money, buy, house, 3, not, getting, single, covid, vaccine"
2178,"huh, ., strange, way, say, you, mandates, worked, ., let, ', s, see, ., before, masks, =, 50, /, 100, ,, 000, ., with, mask, mandate, =, 385, /, 100, ,, 000, ., smart, call, lift, mask, /, vaccine, mandate, ., especially, if, you, want, numbers, keep, dropping, ."
2179,"you, know, what, ’, s, more, disappointing, it, ’, s, my, friends, fb, doesn, ’, t, react, post, like, this, ., no, body, talks, about, covid, or, vaccine, ."
2180,"check, out, kyne, ', s, video, #, tiktok"
2181,"look, who, ', s, talking, lol, ., covid, vaccines, don, ', t, work, like, that"
2182,"lol, it, seems, you, respect, virus, but, apparently, not, science, or, vaccine, ."
2183,"you, would, have, had, have, chicken, pox, ,, since, i, was, born, 88, vaccine, wasn, ’, t, available, until, after, i, had, been, infected, ."
2184,"brilliant, dan"
2185,"-, just, out, ..#, bc, -, provincial, health, officer, announces, new, mandatory, #, vaccine, order, regulated, health, professionals, ., apparently, more, details, next, week, ."
2186,"vaccine, works, pretty, well, ., you, may, not, need, assume, you, have, it, ., stay, masked, if, you, can"
2187,"at, extremely, high, level, case, counts, ,, ca, is, dropping, their, mask, mandate, feb, 15th, “, vaccinated, .”, we, all, know, how, that, went, last, time, —, everyone, drops, masks, regardless, vaccine, status, &, amp, ;, cases, surge, ., except, now, on, ,, no, one, is, counting, cases, or, deaths, ., magic, magic_wand"
2188,"lausd, parent, explains, his, opposition, student, vaccine, mandate"
2189,"such, horrible, ,, hurtful, comment, kenney, ., comparing, vile, illness, ignored, by, governments, not, taking, life, -, saving, vaccine, ..., where, does, he, even, see, connection"
2190,"please, donate, more, medigen, vaccines"
2191,"really, chef, neither, mask, nor, vaccine, stop, spread, ,, but, you, ', re, going, require, both, eat, your, restaurants, i, get, that, you, want, poke, at, mtg, cause, she, ', s, pathetic, ,, but, please, catch, up, with, science, rest, world, drop, those, requirements, ."
2192,"it, was, never, coherently, explained, why, we, would, /, should, /, did, keep, mitigations, place, after, vaccines, were, available, high, -, risk, adults, ., doing, so, has, sent, such, massive, mixed, messages, ., broken_heart, watch, happening, ."
2193,"speaking, which, ,, remember, get, covid, vaccine, protect, yourself, those, you, care, about, ."
2194,"some, reason, that, "", f, -, ing, vaccine, "", line, made, this, scene, dr, strangelove, pop, into, my, head"
2195,"i, suspected, ongoing, charade, focus, children, had, do, with, vaccine, sales, ,, but, this, angle, makes, even, more, sense, ."
2196,"only, reason, i, am, looking, forward, my, 50th, birthday, later, this, year, is, get, my, shingles, vaccine, ., my, mom, had, shingles, ., i, was, shocked, by, what, she, went, through, ., she, lost, partial, vision, had, horrible, nerve, pain, years, after, shingles, ., aged, her, 10, years, ."
2197,"i, wear, masks, ,, i, like, like, masks, because, they, make, unhealthy, people, feel, comfortable, enough, go, out, shop, ,, etc, ., masks, never, worked, if, they, only, work, when, current, strain, isn, ', t, vaccine, resistant, ."
2198,"born, ', 67, ,, i, don, ', t, know, if, i, had, chicken, pox, or, vaccine, ,, but, case, shingles, i, had, my, 40s, was, miserable, couple, weeks, with, heavy, pain, drugs, ., signed, right, up, vaccine, ."
2199,"novak, is, indian, wells, entry, list, …, is, he, playing, despite, vaccine, mandate, eyeseyes, #, tennis"
2200,"so, side, effects, covid, is, less, than, vaccine, you, know, fact, that, there, ’, s, no, long, term, consequences, getting, covid"
2201,"main, job, it, ’, s, meant, do, is, keep, people, severe, outcomes, ., it, does, ., polio, vaccine, 4, doses, 2, months, apart, plus, booster, 2, years, later, didn, ’, t, stop, transmission, ., it, stopped, paralysis, death"
2202,"who, is, saying, he, ’, s, “, broken, ”, i, ’, ve, not, seen, that, anywhere, ., he, ’, s, most, definitely, not, broken, but, he, shouldn, ’, t, have, put, up, with, this, anymore, ., we, ’, ve, seen, no, indication, that, he, ’, s, person, she, claims, but, loads, that, she, is, ugly, person, inside, ."
2203,"sorry, you, ’, ve, concluded, based, upon, your, screenshot, that, they, don, ’, t, check, vaccines, at, any, other, port, entry"
2204,"what, ,, you, mean, more, vaccine, disinformation, same, reason, former, dr, andrew, wakefield, is, former, doctor, not, doctor"
2205,"he, ', s, been, loop, past, 2, weeks, worst, part, is, that, everything, he, says, is, lie, "", canadians, voted, vaccines, mandates, when, they, elected, us, ""-, no, pm, many, were, coerceTongue_sticking_out_cheeky_playful_or_blowing_a_raspberry, jab, or, job, loss, this, was, not, choice, many, canadians, #, trudeaunationaldisgrace, #, trudeaumustgo"
2206,"antivaxxers, will, ,, eat, ivermectin, paste, ., inject, /, drink, bleach, ., bathing, borax, ., shove, light, up, my, ass, ., inhale, hydrogen, peroxide, ., but, i, ain, ', t, taking, no, vaccine, ., i, ain, ', t, stupid, ."
2207,"read, emergency, use, authorization, ...., there, is, no, long, term, safety, data, bcz, this, vaccine, was, rushed, you, are, guinnea, pigs"
2208,"nothing, much, see, here, ..., "", pfizer, -, biontech, vaccines, withheld, vietnamese, children, after, spate, deaths, &, amp, ;, aes, """
2209,"hiv, vaccines, wtf"
2210,"if, you, center, your, life, around, making, sure, people, don, ’, t, burn, hell, forever, ,, there, ’, s, really, no, plausible, reason, think, that, ’, s, real, danger, ,, yet, you, won, ’, t, take, vaccine, because, there, ’, s, “, not, enough, evidence, ”, that, it, helps, against, covid, ,, then, something, ’, s, little, off, ."
2211,"i, also, have, dual, w, eu, but, was, told, by, my, consulate, that, i, have, be, resident, get, vaxxed, ., please, tell, me, if, you, find, country, that, will, accept, eu, citizen, without, residency, get, vaccine, ., i, ’, m, willing, go, too, ., i, can, ’, t, work, until, i, get, vaxxed, even, tho, i, have, ni, ."
2212,"comparison, myocarditis, pericarditis, numbers, last, week, ’, s, c19, vaccine, safety, report, this, week, ’, s, ., numbers, still, rising, ., when, will, these, vax, be, halted, it, ’, s, way, past, time, recognize, these, safety, signals, ,, or, rather, unsafe, signals"
2213,"how, long, can, they, keep, denying, damage, being, done, by, this, vax, autopsy, confirms, college, student, died, “, covid, -, 19, vaccine, -, related, myocarditis, ”."
2214,"you, don, ’, t, have, get, vaccine, ,, you, can, get, covid, then, stay, away, hospital, while, sucking, air, ., don, ’, t, use, life, support, system, ., leave, it, someone, else, who, believes, medical, science"
2215,"vaccine, isn, ’, t, as, effective, against, omicron, as, delta, ,, but, still, plenty, well, enough, curb, this, return, our, health, system, equilibrium"
2216,"i, ’, ve, just, written, my, local, mp, ., it, ’, s, important, we, ensure, they, hear, what, we, think, about, vaccine, passports, ., please, write, yours, too, here, :"
2217,"there, are, some, that, will, never, believe, this, ., they, love, vaccine, all, its, boosters, ., i, know, some, ., its, like, cult, ."
2218,"i, ’, ll, probably, get, fourth, shot, ., i, ’, ve, also, had, shingles, vaccine, pneumonia, vaccine, which, i, paid, out, pocket, for, ., generally, get, regular, flu, shot, ., have, you, had, your, shingles, shot, shingles, is, wretched, ."
2219,"research, into, how, mrna, could, be, delivered, into, cells, was, developed, 1970s, ., decades, research, innovation, ,, mrna, vaccine, technology, was, ready, covid, -, 19, ., find, walk, -, in, clinic, today, at, :, vaccinenearyou, #, togetherwegetbetter"
2220,"just, say, you, ', re, vaccine, truther, that, loves, joe, rogan, ."
2221,"uw, health, adds, covid, -, 19, vaccine, mandate, -, will, require, boosters, too, -, weau, has, been, published, canada, news, media, -, #, news"
2222,"that, ’, s, what, they, ’, re, trying, do, ottawa, ., they, want, work, but, they, ’, re, being, mandated, get, vaccine, ., it, should, always, be, choice, if, you, want, get, it, or, not, ."
2223,"yes, got, 30, vaccines, as, 18, year, old, ,, got, cancer, ,, no, vaccines, since, ..."
