,0
3674,"30, hours, after, #, moderna, shot, 2, ,, i, ’, m, coming, out, aches, fever, ., sore, arm, still, ..., but, ready, feel, better, tomorrow, nite, nite, sleeping_face, #, fullyvaccinated"
3675,"when, i, got, my, moderna, shot, ,, nurse, asked, see, inside, my, arms, first, ., why"
3676,"i, got, moderna, &, amp, ;, it, made, me, immortal, plus, i, get, better, cell, reception"
3677,"second, dose, #, moderna, today, ., approx, ., 10, hours, have, slight, chill, ., stay, tuned, more, updates, ."
3678,"ya, boiiii, got, fully, vaccinated, todayyyyy, #, moderna, #, vaxxedup"
3679,"moderna, was, funded, by, us, taxpayer, dollars, decade, ."
3680,"hubby, breezed, thru, both, shots, ,, i, had, moderna, &, amp, ;, first, onee, was, breeze, ,, 2nd, one, i, had, headache, &, amp, ;, lower, backache, 3, days, &, amp, ;, felt, blah, ,, fine, now"
3681,"got, my, second, vaccination, shot, today, give, me, two, weeks, i, am, hugging, shit, out, everyone, i, know, love, ##, moderna, #, vaccinationdonecheck_mark, ️, #, ᴠᴀᴄᴄɪɴᴇssᴀᴠᴇʟɪᴠᴇs, #, vaccination, #, brooklyn, #, covid_19, @, brooklyn, ,, new, york"
3682,"awwwwh, hugs, you, my, friend, as, friday, i, will, hit, two, weeks, since, i, got, my, second, moderna, shot, i, ’, ll, be, all, vaxxed, up, hoping, this, means, seeing, friends, ,, fam, ,, team, pete, fam, this, summer"
3683,"i, thought, i, escaped, wrath, moderna, vaccination, symptoms, after, first, day, ..., i, was, wrong, ."
3684,"spent, 2, hrs, two, time, ’, s, trying, get, my, dads, 2nd, moderna, here, -, no, one, called, back, -, made, appointment, your, pharmacist, chewed, me, out, not, getting, it, time, -"
3685,"when, that, second, moderna, hits, #, wortheverysecond, #, vaxxedsyringe, #, getvaxxedbaby, #, modernawoman, @, virgil, village"
3686,"feels, great, have, had, my, second, moderna, vaccination, administered, yesterday, here, ny, state, ., hoping, canada, can, catch, soon, all, my, family, friends, back, home, ."
3687,"day, after, dose, dos, moderna, ., i, feel, 60, %, fine, 40, %, blah, —, nothing, extreme, at, all, ., dull, headache, since, last, night, ,, some, light, nausea, this, afternoon, ,, general, lethargy, lower, back, ache, ., yesterday, it, gave, me, kind, weird, ,, full, body, feeling, ,, almost, like, taking, edible, lol"
3688,"get, my, second, moderna, shot, friday, ., think, jack, daniels, will, help, don, ', t, want, miss, kentucky, derby, ."
3689,"i, would, really, like, see, moderna, stock, hit, $, 200, doge, $, 1, by, end, summer, ,, year, ..."
3690,"I, was, vaccinated, with, the, syringe, vaccine, ., modern"
3691,"been, 2, weeks, since, round, 2, #, moderna, ., time, restart, licking, all, walls, door, -, handles, rolling_on_the_floor_laughing"
3692,"it, ’, s, been, five, days, since, my, 1st, covid, -, 19, #, moderna, vaccine, syringe, —, i, still, don, ’, t, have, my, ‘, normal, ’, energy, back, ., simply, pushing, around, shopping, cart, shopping_cart, at, grocery, store, spaghettired_applecookie, left, me, out, breath, ."
3693,"if, you, ’, re, looking, shot, #, oregon, ,, here, is, #, covid19vaccination, event, happening, tommorrow, ., 4, /, 29, yamhill, county, public, health, #, moderna, clinic, ages, 18, +, evergreen, theater, snag, appointment, :"
3694,"just, moderna, girl, ,, livin, moderna, world, sparkles"
3695,"you, can, take, tylenol, but, advil, reduce, your, immune, response, that, ’, s, what, i, ’, ve, read, ., i, took, lots, tylenol, after, my, moderna, doses, but, not, before"
3696,"they, ’, ll, be, so, stoked, see, you"
3697,"np, ., you, will, be, fine, ., i, had, both, ., moderna, ., first, just, sore, arm, ."
3698,"have, gotten, moderna, ."
3699,"woohoo, my, vaccine, is, scheduled, tomorrow, #, moderna, #, covid19vaccination"
3700,"done, thanks, #, science, ,, hooking, sister, up, raising_handsmedium, -, dark_skin_tone, #, fullyvaccinated, #, onestepcloser, #, covidvaccine"
3701,"second, #, moderna, shot, smiling_face_with_sunglasses, at, pharmacy, rochester, ,, ny"
3702,"every, one, else, made, it, 12, -, 24, hours, after, moderna, #, 2, before, getting, floored, ., i, got, 3, hours, inface_with_tears_of_joy, hopefully, that, means, it, passes, faster, ., #, doitforbars"
3703,"i, got, moderna, #, 2, yesterday, ., plan, be, bed, day, with, worst, headache, ever, ."
3704,"i, would, if, it, was, moderna, face_with_tears_of_joy, but, thank, you"
3705,"syringe, syringe, #, moderna, number, 2, my, arm, oh, ,, baby, #, vaccinated, #, vaccine"
3706,"yesterday, :, got, dose, #, 2, moderna, vaccine, today, :, home, sick, with, fever, ,, chills, ,, body, aches, &, amp, ;, headache, two, weeks, now, :, i, can, safely, hug, my, grandmother, again, ., that, makes, it, worth, it, proud, be, one, 2, ., 4, million, residents, massachusetts, who, are, fully, #, vaccinated"
3707,"which, one, did, you, get, moderna, made, me, tired, next, day, 1st, round, ,, but, that, was, it, ."
3708,"second, dose, moderna, trains, got, me, feeling, check_mark_button"
3709,"not, all, bad, news, today, ., got, my, second, moderna, dose, just, now, ., 14, days, being, invincible, firefirefirefire"
3710,"yo, me, puse, moderna, person_facepalmingmedium_skin_tone, ‍, male_sign, ️"
3711,"not, gonna, lie, ., that, first, time, i, stand, couch, at, club, after, this, second, moderna, shot, is, gonna, be, glorious, ."
3712,"i, ’, ve, seen, some, have, effects, with, that, one, but, nothing, like, moderna"
3713,"moderna, woman, flexed_bicepsmedium, -, light_skin_tone, only, some, minor, symptoms, ,, like, this, absolute, dumptruck, ass, face_with_steam_from_nose, #, vaxxed, #, moderna, #, imfuckingkidding, @, burnsville, ,, north, carolina"
3714,"2nd, #, moderna, vaccination, done, yay, @, ridgewood"
3715,"nice, i, had, moderna, 2nd, shot, left, me, sleepless, that, night, with, fever, chills, face_with_thermometer, but, fine, 24hrs, later, ., hope, your, body, perks, back, up, soon, two_hearts"
3716,"that, second, moderna, dose, is, no, joke, ."
3717,"24, hours, after, #, moderna, shot, 2, ., just, up, hour, long, nap, ..., i, never, nap, ., achy, slight, fever, face_with_head, -, bandage"
3718,"isn, ', t, same, problem, with, moderna"
3719,"moderna, is, bad, bitches, smiling_face_with_sunglasses"
3720,"this, 2nd, moderna, shot, is, killing, me"
3721,"okay, ,, so, i, ’, m, little, ahead, curve, ., disguised_face"
3722,"finally, got, my, 2nd, shot, moderna, ., got, hit, w, symptoms, pretty, hard, &, amp, ;, can, ’, t, even, imagine, what, people, who, got, severely, affected, by, covid, had, go, through, ."
3723,"i, was, recently, ill, am, finishing, up, antibiotic, medication, ., problem, is, :, my, 2nd, dose, moderna, is, supposed, happen, friday, is, it, safe, still, get, it, if, i, cannot, how, long, can, you, postpone, your, 2nd, dose, #, wbz, #, askdrmallika"
3724,"woohoo, welcome, club, ."
3725,"both, doses, moderna, vaccine, coursing, through, my, system"
3726,"song, day, will, be, off, 2night, as, i, recover, moderna, dose, 2, ., see, u, soon, ., #, asad"
3727,"today, is, my, set, -, you, -, free, -, day, ., i, ', m, 2, weeks, out, my, 2nd, moderna, ., i, ', m, hoping, all, my, friends, &, amp, ;, family, will, get, vaccinated, ,, too, ."
3728,"moderna, vaccine, day, one, check, -, in, -, feeling, little, sleepy, lethargic, ., had, bit, headache, last, night, some, mild, aches, this, morning, ., feeling, out, sorts, but, still, capable, ."
3729,"i, just, got, my, first, moderna, yesterday, ., arm, little, sore, last, nite, today, ., i, ', m, little, tired, ., good, luck, i, ', m, proud, us"
3730,"i, am, very, model, moderna, major, -, vaccinate, i, ', ve, information, virulence, ,, efficacy, ,, contagion, i, know, strains, mutation, ,, i, quote, jabs, historical, pfeizer, j, &, amp, ;, j, ,, order, categorical, ;"
3731,"well, ,, we, are, vaccinated, covid, -, 19, now, via, moderna, ones, ., so, that, ’, s, pretty, cool, ,, lol, ., celebratory, milkshakes, are, order, whoop, ., #, selfie, #, family, #, covid_19, #, moderna, #, covid, #, vaccinated, #, wedidit, raising_handslight_skin_toneupside, -, down_facevictory_handlight_skin_tone"
3732,"so, if, i, had, got, j, &, amp, ;, j, like, i, ’, d, planned, i, would, have, been, fully, vaccinated, by, friday, this, week, ., instead, i, got, moderna, ., my, 2nd, shot, isn, ’, t, until, may, 18th, i, won, ’, t, be, fully, vaccinated, until, june, 1st, ., bye, -, bye, maskless, may, ., i, ’, m, so, salty, lol, tired_face, still, grateful, tho"
3733,"its, my, birthday, today, if, this, tweet, gets, 500, retweets, i, ’, ll, get, 3rd, moderna, shot, woozy_face"
3734,"fully, vaxd, ready, rock, ....., in, few, weeks, that, is, #, moderna, #, billyfullyvaxd, #, covid_19, #, covidvacccine, #, rocknroll, @, university, city, ,, missouri"
3735,"which, one, got, my, second, moderna, hour, ago"
3736,"#, covid19vaccine, #, moderna, #, shot2, #, doingmypart, #, vaccinated, #, igotmyshot, #, vaccine, #, vaccinessavelifes, #, trustscience, #, pandemic, #, coronavirus, #, imvaccinated"
3737,"i, ’, m, bouta, just, gone, head, schedule, vaccy, but, i, ’, m, specifically, asking, that, moderna, jont, ., nigs, not, bouta, just, give, me, what, they, got"
3738,"i, got, my, first, moderna, shot, 5, weeks, ago, ., i, hope, i, don, ’, t, have, wait, until, mid, -, july, my, second, ., i, ’, m, not, entirely, convinced, that, waiting, 4, months, instead, one, ,, is, great, strategy, ."
3739,"got, second, dose, moderna, yesterday, ., don, ’, t, think, i, ’, ve, been, this, sick, years, ."
3740,"22, hours, since, #, moderna, shot, 2, ..., waves, muscle, aches, chills, ., slight, headache, ., arm, is, sore, af, still, worth, it, #, fullyvaccinated"
3741,"your, girl, just, got, her, 2nd, dose, #, moderna, is, fully, vaccinated, syringeface_with_medical_mask, even, though, i, ’, m, fully, vaccinated, ,, i, will, still, wear, my, mask, public, places, victory_handmedium_skin_toneskull, #, covidvacccinesyringe, #, fullyvacinnated, @, shrine, airline"
3742,"thank, you, growing_heart, i, got, moderna, def, gonna, make, sure, i, stay, hydrated, stick, my, ass, couch, next, day, or, two, haha"
3743,"yes, right, outside, headquarters"
3744,"moderna, vaccinated, friends, :, how, long, after, second, shot, did, side, effects, kick, just, found, out, i, can, take, off, work, anticipation, that, ,, so, ima, be, that, like, butter, biscuit, ."
3745,"this, second, moderna, dose, has, my, whole, body, feeling, like, tv, static"
3746,"second, dose, received, ., fully, vaccinated, ., syringe, two, more, weeks, until, better, immunity, against, covid, #, covid, #, moderna"
3747,"makes, me, wonder, ., i, caught, covid, january, ., mild, symptoms, lasted, about, 5, days, ., first, moderna, shot, did, same, ,, 99, ., 9, °, fever, day, ., could, this, be, similar, 1st, shot, /, chaser, reaction, second, moderna, is, calendar, ."
3748,"got, my, second, shot, #, moderna, #, getvaccinated, #, vaccinated, #, vaccinatelasvegas"
3749,"moderna, ., still, alive, so, far, ."
3750,"second, dose, moderna, got, me, like"
3751,"i, finally, have, my, vaccine, dates, ., may, 1st, may, 29, at, cvs, up, street, ..., not, 100, miles, away, ..., lol, its, moderna, vaccine, ., i, ', m, just, giddy, ..."
3752,"i, got, moderna, ., i, would, take, whatever, i, needed, be, safe, ."
3753,"i, got, moderna, but, i, wish, i, had, that, lmfao"
3754,"moderna, ,, second, shot, done, 6, weeks, ago"
3755,"i, had, no, problem, with, my, 2nd, moderna"
3756,"ya, boy, is, fully, vaxxed, repping, legendary, house, moderna, sparkles"
3757,"moderna, shot, #, 2, check_mark, ️, #, stopthespread"
3758,"evviva, second, moderna, vaccination, shot, today"
3759,"got, my, 2nd, moderna, vaccine, shot"
3760,"i, recieved, moderna, vaccine, ,, so, this, tells, me, ,, get, vaccine, but, still, keep, your, distance, others, ., hey, i, can, do, that, because, i, am, not, people, person, who, hangs, around, big, crowds, anyway, ."
3761,"got, my, second, moderna, saturday, i, ', m, feeling, good, ,, hope, it, goes, okay, ,, buddy"
3762,"i, had, mild, side, effects, with, moderna, :, sore, arm, cold, compress, helped, ;, headache, slight, fever, tylenol, relieved, that, ,, mild, body, aches, fatigue, which, lessened, with, each, passing, hour, ., two, days, return, my, normal, ."
3763,"sure, -, definitely, heard, moderna, hits, harder, ., i, was, mentally, prepared, worst, was, pleasantly, surprised, so, figured, i, ’, d, share"
3764,"trying, distinguish, "", week, half, left, classes, "", tiredness, "", i, got, my, second, moderna, shot, yesterday, "", tiredness"
3765,"post, moderna, #, 2, today, me, i, ’, d, say, similar, hangover, feel, ., also, inability, sit, still, ., must, move"
3766,"i, just, saw, this, congrats, ., i, ’, m, week, tomorrow, ,, number, 2, moderna, ., can, ’, t, wait, ."
3767,"good, news, 300k, johnson, &, amp, ;, johnson, vaccines, are, set, arrive, canada, today, ., 650k, doses, moderna, is, officially, route, ."
3768,"just, got, mine, hr, ago, moderna, freeeeeee"
3769,"2nd, vaccine, done, ., celebrating, with, pipes, cafe, #, moderna, #, pipescafe, #, breakfastburrito, @, pipes, cafe"
3770,"reporting, that, i, got, vax, ., #, moderna"
3771,"my, wife, i, get, our, second, moderna, tomorrow, ."
3772,"masks, are, dead, dude, ., also, ,, norwood, company, ., just, another, day, norwood, saving, world, ."
3773,"just, got, my, first, moderna, so, happy, see, sooooo, many, young, people, showing, up"
3774,"i, ’, m, good, ., i, got, my, first, moderna, vaccine, shot, i, get, my, second, one, next, month, ."
3775,"second, moderna, shot, down, ., hope, that, chip, doesn, ’, t, interfere, with, wifi, connection"
3776,"just, got, jabbed, ,, round, 2, have, you, gotten, vaccinated, yet, good, people, are, doing, so, much, great, work, ,, i, am, very, thankful, this, #, getvaccinated, #, moderna, #, modernavaccine, #, getvaccinatedasap"
3777,"there, you, go, ., i, am, same, way, ., i, had, my, second, moderna, monday, so, may, 10th, will, be, fully, vaccinated, ."
3778,"o, o, your, not, supposed, eat, poppyseeds, or, sesame, seeds, after, moderna, jab, -"
3779,"moderna, vax, has, me, sufficiently, beaten, down, that, i, ’, m, skipping, my, birdwalk, today, ,, so, course, i, ’, m, convinced, whooping, crane, is, hanging, out, my, local, spot, ."
3780,"demonstrators, marching, moderna, headquarters, calling, global, equity, #, covid19vaccines, they, want, waiver, vaccine, intellectual, property, ."
3781,"only, wear, buildings, requiring, wearing, ., don, ', t, wear, street, ., i, ', m, vaccinated, ., moderna"
3782,"second, moderna, shot, done, syringe, waiting, area, next, 15, minutes, ,, feeling, ok, right, now, ., assuming, next, 24, hours, is, going, beat, me, up, pretty, bad, tho, ."
3783,"emailing, urban, chestnut, figure, out, when, i, need, show, up, get, my, second, dose, moderna"
3784,"it, does, help, most, states, are, aggressively, rolling, out, vaccine, ., i, will, get, my, second, shot, 15, may, 2021, ., syringesmiling_face_with_sunglassesthumbs_upmedium, -, light_skin_tone"
3785,"ee, after, he, has, made, a, mantra, with, the, orders, of, the, vaccines, and, if, he, wants, to, focus, on, mrna, vaccines, ,, he, must, also, get, from, moderna, that, there, is, available, ., this, is, what, common, sense, requires, if, they, have, of, course, ., they, have, to, explain, it, to, the, states, and, to, the, world, ."
3786,"got, my, first, #, moderna, #, covid19, shot"
3787,"2nd, dose, moderna, done, so, course, i, had, get, selfies, with, &, amp, ;, ., fauci, bahaha, #, fullyvacinnated, #, shots, #, fauciouchie, thank, you, all, volunteers, red_heart, ️#, thanksvolunteers"
3788,"got, my, second, moderna, monday, ., was, totally, down, yesterday, ., since, you, ’, re, not, my, radio, ,, i, ’, m, guessing, you, might, not, feel, your, best, ., good, luck"
3789,"second, dose, moderna, is, really, kicking, my, ass, rn, ., 99, ., 5, fever, ,, not, great, sleep, ,, not, lot, appetite, ,, whole, body, feels, lukewarm, ."
3790,"same, ., my, moderna, arm, was, aching"
3791,"is, that, moderna, vaccine, i, ', m, checking, when, i, get, vaccine, ."
3792,"day, two, moderna, shot, 2, :, way, less, bad, ,, no, more, fever, ,, whole, body, aches, still, ,, meh, headache, ."
3793,"my, brother, is, double, transplant, recipient, ., he, was, very, hesitant, reasons, i, fully, respect, ., there, was, ,, he, felt, ,, big, lack, info, transplant, folks, ., his, doctor, gave, him, as, much, data, as, he, could, find, ., he, ended, up, getting, moderna, ., so, far, ,, so, good, ."
3794,""", sorry, ,, i, ', m, just, ..., it, ', s, starting, hit, me, like, um, ..., um, ..., two, ton, ..., heavy, thing, ."", that, second, moderna, shot, isn, ', t, fun, ."
3795,"2nd, done, can, ', t, wait, hug, some, y, ', all, 2, weeks, thank, you, #, moderna, #, 2ndshot"
3796,"i, got, my, butt, kicked, by, first, round, moderna, ., just, got, my, second, today, ., don, ', t, be, afraid, ,, alternative, is, worse, ."
3797,"i, just, received, 200, doses, moderna, vaccine, ., you, can, call, us, at, 469, -, 298, -, 1216, or, come, into, our, clinic, ,, clinicas, mi, doctor, ,, 1120, east, parker, rd, ,, #, 195, ., plano, ,, 75074, ., @, clinicas, mi, doctor"
3798,"getting, my, second, moderna, saturday, ., couldn, ', t, be, happier"
3799,"second, dose, moderna, covid, -, 19, vaccine, ., thank, you, ,, ,, ,, community, partners, ,, &, amp, ;, all, personnel, making, this, happen, ., easy, ,, convenient, drive, -, through, service, ., glad, do, our, part, public, health, ."
3800,"i, got, 1, 2, that, moderna, ."
3801,"yesterday, i, got, moderna, shot, #, 2, ."
3802,"ugh, ., second, moderna, is, today, &, amp, ;, i, don, ', t, want, get, it, ., my, friend, got, really, sick, it, so, did, my, son, ., but, they, both, have, pre, -, existing, conditions, ., i, think, 2nd, shot, regardless, health, makes, people, sick, ., getting, covid, is, worse, so, i, guess, i, have, no, choice, ."
3803,"it, ’, s, been, 16, days, since, my, second, moderna, shot, i, ’, ve, had, no, ill, effects, at, all, ., sorry, you, ’, re, feeling, poorly, after, yours, ."
3804,"we, ’, re, vaccinating, if, you, ’, re, northwest, philadelphia, haven, ’, t, been, vaccinated, yet, ,, come, down, pelham, pharmacy, mt, ., airy, #, covid19vaccine, #, moderna, #, gomtairy, #, mtairy, #, germantown, #, chestnuthill, #, nwphilly"
3805,"it, ’, s, kept, me, getting, flu, or, when, i, did, mild, symptoms, ., pneumonia, vaccine, i, believe, saved, my, life, ."
3806,"well, ,, tomorrow, is, day, i, finally, get, vaccinated, moderna, vaccine, #, 1, ,, so, fingers, crossed, everything, works, out, just, fine, i, can, go, about, my, day, without, side, effects"
3807,"any, advice, self, -, care, post, -, moderna, shot, second, one, besides, hydrating, crying, car, joy"
3808,"2021, moderna, ,, exceptional, vintage, ,, pairs, well, with, in, -, person, conversation, ,, anxiety, -, free, laughter, ,, chips, ."
3809,"bottom, line, :, even, though, flu, shots, most, often, aren, ’, t, nearly, 100, %, effective, ,, they, may, make, your, flu, case, much, milder, than, it, would, have, been, otherwise, ., always, worth, getting, one, ., getting, moderna, #, 2, this, friday, ."
3810,"invested, moderna, way, back, when, ., thank, you, your, support, ., ;"
3811,"18, hours, into, #, moderna, shot, 2, ..., no, side, effects, except, sore, arm, slight, headache, crossed_fingersmedium_skin_tone"
3812,"moderna, walk, up, first, dose, covid, vaccinations, available, until, 1pm, today, wednesday, april, 28, at, shiloh, baptist, church, ,, 1004, church, street, ., no, appointment, necessary, ., #, covidvaccine, #, liveconnectedlivewell"
3813,"second, time, volunteering, vaccinate, ohio, medical, reserve, corp, ., 2000, second, doses, be, given, today, ., i, love, every, minute, this, ., #, vaccineswork, #, pfizervaccine, #, pleasegetvaccinated, #, moderna"
3814,"felt, like, doodoo, last, night, so, i, had, end, early, ., will, try, do, another, stream, tonight, make, up, it, :, assuming, 2nd, moderna, shot, won, ', t, kick, my, ass"
3815,"vacinations, are, still, 39k, below, promise, 150k, day, ., ando, also, below, last, week, ', s, pace, 134k, day, ., ontario, now, has, 730, ,, 752, doses, freezer, with, moderna, jansen, due, coming, days, ."
3816,"first, day, back, gym, ,, now, that, i, ’, m, full, moderna, daddy"
3817,"not, problem, me, ., i, ’, ll, look, at, it, being, like, my, yearly, flu, shot, ."
3818,"just, got, my, first, moderna, shot, ., i, hope, 5g, reception, is, as, good, as, i, ’, ve, been, led, believe"
3819,"“, Modern, ..., time, ”"
3820,"i, mean, ,, y, ', all, ,, i, felt, like, absolute, shit, with, my, moderna, 2, ., but, i, am, alive, i, won, ', t, kill, others, ..., sooooo, wtf, ., grow, up, ,, people, ."
3821,"this, moderna, pt, 2, shot, is, licking, my, butt, ....., and, im, about, get, plane, kc, ......, fml"
3822,"The, administration, offered, to, send, #, pitzer, and, #, modern, vaccines, to, help, South, America, and, #, Argentina, stop, the, wave, of, infections, ., The, Argentine, media, spoke, of, leftover, vaccines, ,, erroneous, information, ,, they, are, not, leftover, vaccines, ."
3823,"anything, bradford, ontario, yet, looking, moderna, or, phizer"
3824,"husband, had, moderna, ,, sore, arm, with, 1st, ,, felt, crappy, day, with, 2nd, ., rest, us, had, j, &, amp, ;, j, abt, 6, weeks, ago, ., 24, yr, old, dau, :, no, symptoms, ,, 35, yr, old, dil, :, sore, arm, ,, felt, tired, ,, 62, me, :, flu, -, ish, day, ,, 40, yr, old, son, :, fever, /, chills, 3, days, ."
3825,"wow, second, moderna, kicked, my, ass"
3826,"They, made, me, modern, ., the, first, dose, was, milder"
3827,"finally, got, dose, #, 1, #, moderna, #, wednesdayfeeling"
3828,"moderna, vaccination, hasn, ', t, killed, me, yet, ., what, ', s, shame, about, moderna, its, not, making, my, ass, bigger, ., lmao, but, it, ', s, made, my, arm, is, bigger, ., rolling_on_the_floor_laughingrolling_on_the_floor_laughingrolling_on_the_floor_laughing, syringe, #, moderna"
3829,"not, me, crying, kroger, because, i, just, got, my, second, moderna, shot, end, is, sight, i, ’, m, so, exhausted, relieved"
3830,"does, moderna, cure, covid, -, 19, or, does, it, cause, it, small, dose, virus, body, build, "", immunity, "", what, is, longest, someone, has, lived, with, "", disease, "", why, name, "", moderna, "", why, name, "", covid, -, 19, """
3831,"day, 4, after, moderna, vaccine, :, body, aches, ,, fever, ,, chills, fatigue, it, ’, s, karma, me, saying, i, was, fine, had, no, side, effects, face_with_tears_of_joygrinning_face_with_sweat, i, am, not, someone, who, ever, calls, out, work, but, i, ’, m, so, physically, tired, ., anyone, else, experience, this"
3832,"got, my, second, moderna, vaccine, i, ’, m, celebrating, everything, with, this, bagel"
3833,"I, lie, down, but, chimbo, the, modern"
3834,"so, i, ’, m, moderna, mama, grinning_squinting_face"
3835,"both, my, brother, &, amp, ;, sil, recently, got, covid, after, getting, their, 1st, dose, moderna, ., it, does, happen, ., they, weren, ', t, fully, vaccinated, ., they, both, went, yesterday, get, their, 2nd, shot, ., why, bc, you, can, contract, covid, again, usually, different, strain, virus"
3836,"doing, much, better, today, ., after, my, second, vax, moderna, oh, my, god, ., you, talk, about, fever, ,, headache, body, aches, ., 48, hours, ., but, happy, i, did, it, ., so, i, should, be, fully, vaccinated, may, 10th"
3837,"hmmm, feeling, v, skinny, today, ,, did, not, know, about, this, moderna, side, effect"
3838,"I, put, on, the, second, modern, one, yesterday, and, I, thought, it, wouldn, ', t, dawn, ,, I, ', m, devastated, ,, terribly, bad, fever, ,, chills, and, muscle, pain, and, look, ,, I, haven, ', t, had, a, flu, since, February, 2020"
3839,"good, morning, sun, ️, hope, you, are, or, will, soon, be, musical_notes, pffffizer, musical_notes, or, moderna, ,, or, j, &, amp, ;, j, winking_face, #, covidvaccine"
3840,"i, only, had, moderna, option, but, i, would, ', ve, taken, whatever, was, available, ., hubby, got, j, &, amp, ;, j, few, weeks, after, i, got, my, first, so, he, was, fully, vaccinated, before, i, was, ."
3841,"lmao, i, totally, misread, dudes, tweet, thought, it, said, he, was, switching, fanduel, ..., moderna, ..., my, mom, ...., super, bowl, week, danno, ."
3842,"&, gt, ;, 90, %, similar, moderna, biontech, ."
3843,"i, have, moderna, #, fullyvaccinated"
3844,"fuck, ...., i, ', m, shaking, ,, i, ', m, cold, my, body, really, hurts, ., here, ', s, side, effects, 2nd, moderna, shot"
3845,"my, 2nd, is, may, 6th, smiling_face_with_smiling_eyes, husband, just, got, done, last, tuesday, ., hit, him, harder, than, 1st, ,, but, he, felt, better, after, 48, hours, ., kid, gets, #, 2, thursday, ., all, moderna, ."
3846,"it, has, all, horror, stories, i, ’, ve, heard, about, second, dose, moderna, ,, all, i, got, was, boo, boo, shoulder, face_with_tears_of_joy"
3847,"moderna, ., 1st, :, sore, arm, day, ., 2nTongue_sticking_out_cheeky_playful_or_blowing_a_raspberry, sore, arm, &, amp, ;, fatigued, feeling, couple, days, ."
3848,"alexa, ,, play, ', this, moderna, age, ', by, strokes"
3849,"i, ’, ve, officially, cleared, two, weeks, since, my, second, dose, moderna, ., take, that, ,, covid, -, 19"
3850,"hi, jackie, ., i, ’, m, sorry, hear, about, you, being, under, weather, ...., but, glad, you, got, vaccinated, ., my, sister, got, moderna, shot, she, felt, malaise, after, her, 2nd, shot, ., i, get, my, 2nd, may, 15th, ., i, hope, you, feel, better, soon, ., sending, you, hugs, &, amp, ;, get, well, vibes, ."
3851,"you, are, welcome, ., moderna, thought, it, could, win, ,, but, you, are, kicking, butt, ,, taking, names, ., flexed_biceps"
