,0
1109,"what, is, reckless, about, driving, deaf, i, don, ’, t, think, she, ’, s, funny, either, but, hearing, is, not, requirement, drive, ., take, note, they, give, you, eye, test, drive, ,, not, hearing, test, ,, why, because, legally, you, don, ’, t, have, hear, drive, ."
1110,"i, got, moderna, vaccine, here, ’, s, my, experience, ."
1111,"humbled, grateful, have, received, my, second, dose, #, moderna, vaccine, today, ., creator, ahéhee, '."
1112,"no, light, in, modern, colony, ,, mty, new, lion, ,, from, 2, pm"
1113,"modern, gang, where, ya, at"
1114,"This, step, I, will, reach, Lima, with, only, one, arm, ,, thanks, for, so, much, modern"
1115,"yes, ., literature, moderna, states, when, your, vaccinated, it, could, be, 4, 6, mos, until, your, fully, covered, ., i, ', m, vaxxed, masked, ."
1116,"i, got, fully, vaccinated, last, friday, two, doses, moderna, ., so, blessed, grateful"
1117,"is, that, the, modern, young, people, or, chavarucas, like, you, will, understand, gives, them, a, lot, of, inconvenience, ., but, nothing, good, you, survived, grinning_face_with_sweat"
1118,"when, i, was, young, we, used, say, does, blowing, make, u, deaf, or, just, talk, funny"
1119,"jake, said, he, scheduled, his, first, covid, vaccine, friday, at, some, sketchy, trailer, that, pulls, into, parking, lot, told, me, he, was, getting, moderna, so, i, peer, pressured, him, cancel, it, schedule, it, where, i, got, mine, done, instead, because, moderna, is, lameface_with_tears_of_joy"
1120,"when, do, my, powers, kick, big, bro"
1121,"it, ’, s, legal, operate, vehicle, totally, deaf, both, ears, so, answer, your, question, is, yes, you, can, operate, motor, vehicle, while, deaf, one, ear, ."
1122,"my, experience, with, moderna, was, sore, arm, three, days, ., no, side, effects, ., second, shot, didn, ’, t, even, feel, shot, ., did, have, sore, arm, after, about, three, hours, ., side, effects, about, 28, hours, later, ., fever, ,, nausea, but, only, lasted, 4, hours, ., then, was, fine, ., fully, vaccinated, now"
1123,"yo, solo, tengo, la, 1a, dosis, ., moderna, person_shruggingmedium, -, light_skin_tone, ‍, female_sign, ️"
1124,"my, bf, got, moderna, vaccine, everyone, point, laugh, call, him, loser"
1125,"that, second, dose, moderna, really, got, me, like"
1126,"Modern, #, meritocracy, tells, us, that, we, must, pay, homage, to, people, with, acquired, merits, ,, not, earned, ."
1127,"also, ,, got, this, done, today, ., we, love, multitasking, queen, crown, #, getvaccienatedsyringe, #, 2of2, #, moderna, @, chandler, ,, arizona"
1128,"got, my, second, moderna, shot, red_heart, so, grateful, all, scientists, doctors, making, this, possible, ., @, camarillo, ,, california"
1129,"man, ,, second, moderna, shot, really, hit, me, hard, ."
1130,"got, my, first, moderna, shot, raising_handsmedium_skin_tonesyringe"
1131,"feeling, moderna, body, high, rn"
1132,"moderna, ., side, effects, ..., sore, arm, not, dying, ."
1133,"the, most, Maderista, president, in, the, country, ', s, modern, history, ,, asking, forgiveness, for, the, Maderistas, ', grievances, more, than, a, hundred, years, after, the, events, ;, and, the, victims, of, line, 12, of, the, #, alcarajo, ."
1134,"got, my, second, dose, moderna, just, filed, my, taxs, all, one, day, ,, time, me, sleep, next, 2, weeks, woozy_face"
1135,"/, homebound, resting, /, #, moderna, #, cvs, #, sandimas, @, cvs, pharmacy"
1136,"holy, fuck, second, moderna, vax, hit, me, like, bus, ., might, need, take, tonight, off, ..."
1137,"you, likely, will, be, deaf, both, ears, by, weeks, end, lose, ability, speak, ., should, be, back, normal, 12, 18, months"
1138,"just, realized, what, day, it, is, that, i, missed, very, important, webinar, i, was, supposed, be, because, i, ’, ve, spent, hours, trying, get, appointment, my, second, moderna, vaccine, ..., still, nothing, ."
1139,"it, ’, s, officially, been, 2, weeks, since, my, second, shot, moderna, ..., i, ’, m, ready, streets, ..."
1140,"…,, de, saint, -, exupéry, ,, santa, ana, ,, saramago, ,, saramago, ,, savoy, ,, schaer, ,, scherer, garcía, ,, 𝐒𝐞𝐤𝐬𝐢𝐤, ,, modern, history, seminar, ,, shafak, ,, shakespeare, ,, sharpe, ,, sharpe, ,, shotwell, ,, simmel, …"
1141,"moderna, vaccine, appointments, available, tuesday, wednesday, ., 18, +, albertans, we, are, doing, only, 1st, now, ., please, call, 403, -, 982, -, 0029, book, appointment, ., @, ida, crystalridge, pharmacy, -, okotoks"
1142,"ok, so, that, ’, s, done, ., where, my, moderna, peeps, at, @, il, centro, italian, cultural, center"
1143,"at, work, they, asked, him, for, several, weeks, if, he, wanted, an, appointment, for, the, vaccine, with, the, modern, m, ,, that, from, the, beginning, of, March, ,, and, always, better, for, later, ."
1144,"mega, sites, first, does, moderna, vaccine, are, available, at, two, drive, thru, mega, sites, ,, located, at, :, •, delmar, stadium, ,, 2020, mangum, rd, ., ◦, saturday, :, 10, a, ., m, .-, 3, p, ., m, ., ◦, moderna, •, rodeo, reed, parking, lot, ,, 2098, reed, rd, ., ◦, saturday, :, 10, a, ., m, .-, 2, p, ., m, ., ◦, moderna"
1145,"peavy, senior, center, ,, 3814, market, street, ◦, min, -, fri, :, 8Happy_face_smiley0, a, ., m, .-, 4, :, 20, p, ., m, ., second, doses, moderna, vaccine, are, also, available, at, department, ’, s, four, health, centers, ."
1146,"second, moderna, dose, scheduled, ., i, ’, m, really, really, gon, be, outside, me, face_with_steam_from_nose, ."
1147,"i, had, moderna, experienced, full, gauntlet, side, effects, --, high, fever, ,, body, aches, ,, fatigue, ,, etc, ., they, kicked, almost, exactly, 24, hours, after, second, shot, were, gone, within, 24, hours, after, that, ., it, sucked, but, was, obvs, worth, it, ., stock, up, gatorade, just, case, hot_face"
1148,"syringe, 1st, dose, /, 1re, dose, :, check_mark_button, booked, it, thanks, folded_hands, merci, #, moderna"
1149,"since, they, infected, me, with, moderna, i, ’, ve, been, seeing, stars, constant, diarrhea, i, don, ’, t, know, what, ’, s, going, on, ."
1150,"moderna, please, respond, my, email, -, ignaciopmoreno, ., com, -, i, am, having, strong, side, effects, after, first, dose, i, am, very, worried, ., i, just, ruined, mattress, because, it, ., please, call, me, urgently, 305, -, 965, -, 8102"
1151,"phizer, moderna, are, brand, new, technology, that, send, blueprint, virus, is, instructed, how, fight, it, ., that, ’, s, done, at, rna, level, genetics, ., jj, vaxx, is, old, immunology, where, this, vaxx, as, walnut, ,, they, put, part, shell, into, you, ., nothing, alive"
1152,"i, ', ll, finally, be, getting, my, first, moderna, vaccine, today, at, cvs, raising_handsmedium_skin_tonesyringe"
1153,"i, was, supposed, get, my, 2nd, dose, this, is, 3rd, attempt, cause, they, keep, running, out, moderna, shots, upside, -, down_face"
1154,"beaming_face_with_smiling_eyesbeaming_face_with_smiling_eyesbeaming_face_with_smiling_eyesbeaming_face_with_smiling_eyesbeaming_face_with_smiling_eyesbeaming_face_with_smiling_eyesbeaming_face_with_smiling_eyes, no, me, he, vuelto, un, demonio, ,, si, están, con, la, preocupación, jajaja, ,, porque, me, tocó, moderna, en, nyc, Statue_of_Liberty"
1155,"moderna, #, 2, update, sparkles"
1156,"yes, ., moderna, ., completed, second, dose, last, week, ."
1157,"While, we, were, having, a, picnic, in, the, park, yesterday, ,, a, health, worker, approached, us, and, asked, if, you, would, like, to, be, vaccinated, ., like, a, joke, ..., they, set, up, chairs, etc, ., from, the, mobile, vaccine, vehicle, and, started, to, vaccinate, the, nation, ., the, vaccine, has, arrived, ma, ', ammmbeaming_face_with_smiling_eyes, #, toronto, #, covid_19, #, moderna, #, vaccine, #, coronavirus"
1158,"weed, =, soma"
1159,"2nd, moderna, 6, weeks, ago"
1160,"imagine, having, silent, consonant, name, your, vaccineface_with_hand_over_mouthgrimacing_face, i, got, moderna, just, make, this, joke"
1161,"pop, up, #, vaccine, clinic, at, sellers, library, till, 11Happy_face_smiley0, ., free, freeze, pop, those, getting, them, ., j, &, amp, ;, j, or, moderna, at, 69th, st, rec, at, 1, -, 3"
1162,"got, my, 2d, dose, moderna, vaccine, friday, ,, it, was, rough, weekend, ,, but, i, ', m, good, now, ."
1163,"got, my, second, moderna, shot, been, about, half, hour, or, so, ,, no, nausea, or, side, effects, ,, nothing, like, i, experienced, after, first, shot, so, far, ."
1164,"looks, like, moderna, round, 2, let, me, off, easy, side, effects, -, wise, ., sore, arm, i, ', m, worn, tf, out, ., took, day, off, just, case, it, turns, out, it, ', s, sorely, needed, ."
1165,"thanks, i, ', ll, try, work, drinking, more, water, ,, try, that, medicine, suggestion, i, ', d, been, so, good, headaches, since, starting, new, allergy, med, few, months, ago, ,, then, covid, moderna, #, 2, did, me"
1166,"i, think, there, might, be, super, soldier, serum, this, second, dose, ., having, best, deadlift, day, ever, #, moderna"
1167,"2, days, go, vaccine, doze, #, toronto, #, pfizervaccine, #, moderna"
1168,"getting, moderna, vaccine, ., thanks, all, medical, staff, there"
1169,"moderna, weekenTongue_sticking_out_cheeky_playful_or_blowing_a_raspberry"
1170,"tuesday, marked, 2, weeks, since, moderna, #, 2, ,, so, i, ', m, fully, vaccinated, now"
1171,"two, children, under, 25, with, the, full, modern, guideline, ., In, U, ., S, ., A, ."
1172,"it, ’, s, time, syringe, #, covid, #, covid19, #, vaccine, #, getvaccinated, #, dose2, #, moderna, #, florida, #, coronavirus, #, vaccination"
1173,"moderna, shot, number, 2, middle_fingermedium, -, light_skin_tone, .., what, absolutely, miserable, night"
1174,"interesting, observation, ., neighbor, had, phisor, vaccine, ,, the, magnet, did, not, stick, his, vaccine, shot, stab, location, ., his, girlfriend, had, moderna, shot, ,, her, arm, magnet, did, stick, ., my, wife, miderna, shot, hers, magnet, did, stick, ., so, ,, my, personal, testing, so, farmoderna, tests, positive"
1175,"number, 2, moderna, vax, coming, up, this, afternoon, thumbs_upthumbs_upthumbs_up"
1176,"this, moderna, vaccine, has, me, feeling, like, i, got, beaten, with, bat, ."
1177,"my, president, ,, without, a, doubt, you, are, the, one, who, has, a, more, modern, vision, to, make, #, hermosillo, the, dynamic, and, developed, capital, that, makes, our, state, proud, ., in, we, will, have, to, work, in, unity, for, #, sanarasonora, ., congratulations"
1178,"my, second, vaccine, dose, moderna, three, apps, ..."
1179,"friday, ,, i, received, my, second, moderna, vaccine, against, covid, 19, ., with, so, many, stories, about, reactionary, symptoms, expected, next, few, days, ,, i, ', ve, been, very, lucky, say, i, haven, ', t, had, any, ., upon, telling, friend, i, was, fine, ,, he, said, ,, "", wow, ,, maybe, they, injected, you, with, saline, ."""
1180,"that, 2nd, moderna, jab, is, no, joke, ., 12, hours, after, i, had, it, ,, 24, hours, misery, began, ."
1181,"second, shot, moderna, tomorrow"
1182,"2, shots, moderna, ,, haircut, ,, finally, some, nice, weather, can, ’, t, tell, me, nothin, ."
1183,"moderna, submitted, data, dart, study, rats, fda, december, 4, ,, 2020, that, concluded, there, were, no, adverse, effects, standard, mrna, vaccine, dose, female, reproduction, ,, fetal, development, or, postnatal, development, ."
1184,"i, suspect, so, too, ., but, it, ’, s, nice, hearing, about, research, coming, moderna, which, i, got"
1185,"i, feel, bad, all, my, homies, that, suffered, through, vaccine, process, ., i, ’, ve, had, positive, experience, throughout, entire, pandemic, /, vaccine, process, ., despite, being, at, high, exposure, risk, ,, never, caught, it, ,, never, needed, testing, ,, no, reactions, 1st, &, amp, ;, 2nd, dose, moderna, ., lucky, ig"
1186,"what, vaccine, moderna, #, 2, knocked, me, down, hard, 102, ., 3f, temp, chills, ~, 20, hours, followed, by, mild, fever, 99ish, another, 12, ."
1187,"me, my, dad, had, solid, talk, about, moderna, vs, modelo"
1188,"interestingly, enough, company, i, work, is, distributing, moderna, vaccine, with, fedex, as, we, ’, re, handling, items, at, this, temperature, even, colder, all, time, ., as, well, ,, pharmacies, are, now, administering, mrna, vaccines"
1189,"after, 24, hours, with, #, moderna, #, 1, ,, i, ’, ve, experienced, nothing, but, sore, arm, reassurance, that, i, made, right, decision, ., #, getvaccinated"
1190,"got, vaccinated, today, ., moderna, ."
1191,"ermahgerd, i, got, moderna, beaming_face_with_smiling_eyessyringemusical_notes, #, vaccinated, #, vaxbear, #, moderna"
1192,"will, also, be, mine, tuesday, after, number, two, ., which, one, did, you, get, i, ’, m, moderna, plan, ."
1193,"ok, ,, although, this, poll, result, contradicts, my, own, personal, #, vaccinesynesthesia, #, moderna, is, chocolate, me, ,, i, accept, wisdom, #, twitterati, that, #, pfizervaccine, is, chocolate, most, folks, ."
1194,"getting, first, dose, moderna, vaccine, tomorrow, after, work, ,, thankfully, i, ’, m, off, next, day, ., smiling_face_with_sunglassessmiling_face_with_smiling_eyesthumbs_uplight_skin_tone"
1195,"I, did, not, have, that, contraindication, here, in, Texas, ., and, in, fact, ..., on, the, second, day, tropical_drinktropical_drink, ., I, put, on, j, &, amp, ;, j, and, my, husband, modern, and, it, was, the, same, ., he, did, ask, specifically, and, was, told, that, he, could, drink, if, he, didn, ', t, feel, bad, and, felt, like, it, ."
1196,"second, moderna, vaccine, kicked, after, 4, hours, ., kicked, my, butt, 24, hours, ., glad, that, is, over"
1197,"i, get, it, ., i, had, moderna, shots, ,, i, felt, lousy, day, after, both, ., i, ', m, trying, schedule, friday, appointments, so, we, can, lay, low, ."
1198,"best, luck, man, moderna, shot, #, 2, laid, me, out, flat"
1199,"moderna, vaccine, knocked, me, my, ass, like, 2, days, ."
1200,"experiencing, some, hangover, /, moderna, synergies, today, ., absolutely, gutted, i, ’, m, missing, sunday, dinner, w, boys"
1201,"no, issue, ., just, making, point, that, providing, funding, single, company, produce, vaccine, they, moderna, would, have, developed, without, taxpayer, money, is, about, as, impressive, as, gore, thinking, he, created, internet"
1202,"my, partner, did, ., moderna, ., lasted, about, 3, days, ."
1203,"channel, surfing, quil, dream, moderna, 2nd, dose, side, effects"
1204,"what, ’, s, up, moderna, fam"
1205,"thank, you, &, amp, ;, #, raceforthevaccine, ., film, really, helps, understand, journey, create, covid, -, 19, vaccines, ., it, makes, me, proud, be, fully, vaccinated, ,, especially, with, moderna, ., thank, you, all, involved, with, making, vaccines, distributing, them, ."
1206,"I, ', m, getting, my, second, dose, of, the, modern, vaccine, tuesday, sparkling_heartsparkling_heartsparkling_heartsparkling_heartsparkling_heartsparkling_heartsparkling_heartsparkling_heartsparkling_heartsparkling_heartsparkling_heartsparkling_heartsparkling_heartsparkling_heartsparkling_hearthugging_face"
1207,"finally, ,, got, my, first, covid, -, 19, moderna, vaccine, today, ."
1208,"i, ', d, been, much, better, headaches, past, few, months, as, well, as, sinus, pressure, /, pain, since, getting, my, current, allergy, medication, ., then, got, horrible, headache, shortly, after, 2nd, moderna, vaccine, dose, may, 5th, ,, can, ', t, fully, not, have, headache, since, that, ., Skeptical_annoyed_undecided_uneasy_or_hesitant"
1209,"100, years, now, 2119, teachers, will, be, praising, #, drfauci, all, scientists, at, #, phizer, #, moderna, #, johnsonjohnson, ending, #, covid19, pandemic, #, donaldtrump, will, be, credited, as, killing, over, 500, ., 000, americans, #, coronataskforce"
1210,"got, my, moderna, vaccine, friday, 5, /, 14, /, 2021, ., get, second, one, june, 11, ., other, than, sore, arm, &, amp, ;, feeling, little, achy, 4, one, day, i, feel, fine, ., #, covidvaccination, #, getvaccinated, p, ., s, ., just, imagine, not, having, constantly, wear, maskface_with_medical_mask, ., use, that, as, inspiration, hugging_facerolling_on_the_floor_laughingbeaming_face_with_smiling_eyesgrinning_face_with_big_eyes, #, thankyoujoe"
1211,"postboxi, gather, that, i, ’, m, minority, here, ,, but, i, ’, m, extremely, dismayed, at, people, just, willing, forego, masks, ,, seemingly, at, drop, hat, ., •, i, ’, m, keeping, my, mask, long, time, ,, maybe, rest, my, life, •, my, second, moderna, shot, is, scheduled, thursday, ,, may, 27"
1212,"fully, vaccinated, #, fullyvaccinated, #, moderna"
1213,"coffee, ice, cream, vaccinate, thank, you, #, gotmine, #, covidvaccine, #, moderna, #, local, #, coffee, #, icecream, #, vaccinated, #, salem, @, salem, ,, massachusetts"
1214,"i, got, cherry, moderna, ,, but, i, ', ve, heard, tutti, frutti, phizer, is, good, too, ."
1215,"i, felt, little, off, few, days, after, my, 2nd, moderna, ., other, than, that, life, continues, lol"
1216,"i, did, my, part, -, #, moderna, #, 1, back, 3, /, 31, ,, #, 2, 4, /, 28, smiling_face_with_sunglasses, #, walgreens, it, actually, feels, weird, now, ,, having, couple, out, -, of, -, state, road, trips, shows, my, calendar, flushed_facesmiling_face_with_sunglasses"
1217,"moderna, ’, d, grinning_face"
1218,"finally, second, modern, dose"
1219,"told, doc, i, was, afraid, needles, as, pulled, up, my, sleeve, reveal, tattooperson_facepalming, ‍, female_sign, ️., still, ,, #, vaccinated, with, first, dose, #, moderna, syringe, against, violinist, playing, "", my, heart, will, go, on, ""., they, didn, ', t, give, me, bandaid, ., person_shruggingmedium_skin_tone, ‍, female_sign, ️, #, ontariovaccine, #, popupclinic"
1220,"joining, millions, across, globe_showing_Americas, bring, end, #, covid19, #, seconddose, #, moderna, #, covidvaccine, heading, back, my, apartment, continue, what, i, hope, will, be, final, 14, days, minimized, person, activities, ."
1221,"day, after, my, second, moderna, shot, ..."
1222,"got, my, microchip, today, ., moderna, course, so, i, can, feel, closer, two_heartscowboy_hat_face"
1223,"moderna, gay, here"
1224,"i, ', m, finally, fully, vaccinated, against, covid, -, 19, #, vaccinated, #, getvaccinated, #, moderna, #, vaccineswork"
1225,"won, ', t, know, until, august, ,, but, moderna, data, after, 6, months, shows, high, level, ., my, understanding, is, that, this, is, predictive, at, least, 1, year, ., i, also, suspect, will, be, &, gt, ;, one, year, ."
1226,"well, ,, my, skeptical, friend, ., i, have, anecdotal, experience, myself, ., you, dont, have, believe, me, ., my, wife, had, moderna, vaccine, ., only, site, her, arm, where, she, was, stabbed, will, hold, rare, rarth, magnet, ., other, arm, no, ., me, no, vax, ,, no, magnet, sticky, wicky, me, ., i, believe, ,, amen, brotha"
1227,"It, depends, ., sometimes, there, is, a, reaction, on, the, second, dose, ., My, sister, took, her, first, dose, on, Monday, only, in, July, ., I, took, a, modern, one, here, and, had, a, reaction, on, the, second, dose"
1228,"dose, dos, yesterday, ., woke, up, feeling, crappy, this, morning, with, headache, ,, chills, body, aches, ., advil, ,, oatmeal, ,, 3, cups, coffee, 3, miles, treadmill, got, me, feeling, much, better, ., #, moderna, #, vaccinated, #, finally"
1229,"yay, #, getthevaccine"
1230,"moderna, ., i, have, my, 2nd, dose, today, i, hope, it, doesn, ’, t, kick, me, like, 1st, one, did, grinning_face_with_sweat"
1231,"got, my, second, barrel, moderna, ., #, doyourbit"
1232,"one, shot, closer, normal, #, moderna, #, whynostickershere, face_with_tears_of_joy"
1233,"moderna, 5g, booster, at, stanford, medical, let, ', s, gooooo"
1234,"confirmed, with, pharmacy, :, it, ’, s, #, moderna"
1235,"miss, moderna, &, amp, ;, heartbreak, prince"
1236,"tuesday, ..., 2nd, moderna, shot"
1237,"moderna, dose, #, 2, arm, blocked, off, my, calendar, tomorrow, just, case, lol, ."
1238,"i, got, moderna, ., first, one, i, was, sore, with, mild, fatigue, but, this, one, i, ’, ve, got, that, plus, im, achy, like, i, ’, m, about, have, flu, or, something, ., more, than, “, mild, fatigue, ”"
1239,"got, my, second, dose, moderna, yesterday, afternoon, ., planned, binge, netflix, bed, all, day, today, but, am, feeling, good, so, far, -, if, it, weren, ', t, feeling, like, someone, punched, me, i, ', d, be, denial, that, i, got, it, ., #, vaccinated, #, teamvaccine"
1240,"french, toast, cooked, waffle, iron, ., i, ’, m, team, moderna, ., smiling_face_with_sunglasses"
1241,"got, moderna, #, 2, yesterday, at, 11am, ., just, sore, arm, ., didn, ’, t, hit, cass, until, 23, hours, after, her, 2nd, shot, ., we, ’, ll, see, ., so, far, ,, so, good, ..."
1242,"side, effects, 2nd, moderna, dose, are, amazing, said, no, one, ever, syringemicrobesyringe"
1243,"imagine, people, gave, you, at, least, 6, feet, spacing, .., got, my, moderna, this, week, also, .., second, not, till, aug, 20"
1244,"team, kyle, ,, ready, help, get, you, vaccinated, ., no, appts, needed, at, this, drive, thru, event, ., available, until, 5pm, at, lehman, high, school, ., #, moderna, #, kyletx, #, covid19"
1245,"thanks, to, ms, ., guylaine, who, injected, me, with, my, first, dose, of, moderna, the, second, is, for, september, 5, ..., and, i, didn, ', t, pass, out, thanks, to, our, people, in, the, health, network, who, do, an, exceptional, job, ., #, vaccine, #, moderna"
1246,"true, blue, #, communityhealth, nurses, out, here, at, us, -, 1, flea, market, giving, out, moderna, j, &, amp, ;, j, #, covidvaccine, ., we, love, see, it, i, super, love, my, job, today, ., red_heart, ️, red_heart, ️, red_heart, ️"
1247,"you, blew, my, cover, this, was, “, moderna, ”, shot, i, took, pensive_face"
1248,"71, hours, post, moderna, :"
1249,"this, week, mon, -, wed, moderna, drive, -, thru, vaccines, tell, friend, ,, bring, friend, 11, am, -, 4, pm, #, getvaxxex, #, gettested, #, beatcovid, #, winning, @, fellowship, chapel, ,, united, church, christ"
1250,"my, second, shot, moderna, wiped, me, out, -, got, it, at, 10am, by, 10pm, i, felt, worse, than, i, ’, d, ever, felt, my, life, -, lasted, about, 36, hours"
1251,"i, had, covid, jan, ., got, both, moderna, shots, ., it, ', s, been, 2, weeks, ., so, far, ,, i, feel, great"
1252,"the, first, 50, people, to, receive, a, vaccine, ., the, moderna, is, offered, at, the, convention, center, ., mostly, 18, -, 24, year, olds, ., people, with, coupon, will, receive, their, dose, around, 9, -, 10, am, ."
1253,"it, starts, and, these, are, doses, of, moderna"
1254,"i, got, moderna, ,, i, m, fully, vaccinated, but, my, boss, who, is, 68, yr, old, doesn, ', t, believe, getting, vaccinated, ."
1255,"it, ’, s, vax, day, ,, people, gonna, get, me, some, moderna, love, two_hearts, today, i, literally, feel, like, i, just, got, called, up, ., #, bringit, #, bigleague, #, moderna, #, covidvaccination"
1256,"hugged, some, great, friends, today, who, i, haven, ’, t, seen, more, than, year, ., we, ’, re, all, fully, vaccinated, ., thanks, #, moderna"
1257,"bro, this, moderna, is, killing, me"
1258,"earls, happy, hour, my, second, shot, moderna, smiling_face_with_heart, -, eyessmiling_face_with_heart, -, eyes"
1259,"i, had, something, similar, your, wife, ’, s, reaction, two, weeks, after, ,, muscle, where, moderna, was, injected, became, little, tender, can, ’, t, wait, second, yippee"
1260,"i, missed, cnn, casting, call, ,, but, i, ', m, 9, months, into, moderna, trial, ., early, january, i, was, unblinded, &, amp, ;, surprised, learn, that, i, had, been, vaccinated, september, 2nd, dose, ., ironically, ,, at, time, ,, i, was, recovering, cold, ., probably, caught, it, hockey, change, room, ."
1261,"anecdote, ., my, son, is, 31, ,, got, his, first, vaccine, day, after, he, was, eligible, ., he, will, not, be, “, fully, vaccinated, “, until, may21, ., millions, others, same, situation, -, longer, if, they, got, moderna, ., why, not, wait, few, more, weeks, have, bigger, pool, ., why, rush"
1262,"me, my, wife, both, had, moderna, her, arm, was, sore, it, itched, but, it, went, away, 1, -, 2, days, ., try, ice, pack, tylenol, ."
1263,"second, shot, made, me, sleepy, had, sore, arm, few, days, …, moderna"
1264,"this, modern, youth, love, -, you_gesture"
1265,"please, join, me, thanking, ian, volunteering, earliest, human, trials, #, covidvaccine, ., his, side, effects, allowed, moderna, scientists, adjust, dosage, ., purple_heart, #, raceforthevaccine"
1266,"2nd, dose, moderna, is, kicking, my, ass"
1267,"fml, ,, got, moderna, ., looks, like, i, ’, m, putting, it, out, ."
1268,"having, hard, time, finding, #, 2, shot, moderna, muskegon"
1269,"got, my, part, 1, 2, covid, vaccine, today, so, pumped, ., is, societal, normality, only, few, more, months, away, #, moderna, @, kelowna, ,, british, columbia"
1270,"...., getting, my, second, moderna, vaccine, this, thursday, ..., 5, /, 20, flexed_bicepshundred_pointsthumbs_up"
1271,"10, months, making, #, thankyou, #, moderna, #, ᴠᴀᴄᴄɪɴᴇssᴀᴠᴇʟɪᴠᴇs, @, marion, ,, iowa"
1272,"leila, is, moving, moderna, ."
1273,"totalno, si, moderna, sad, beaming_face_with_smiling_eyes"
1274,"yes, after, the, pharmacies, may, have, less, basic, doses, ., I, heard, they, only, offer, moderna"
1275,"hey, anyone, wanting, covid, shot, near, cvs, scott, ’, s, valley, mt, hermon, rd, they, have, bunch, moderna, good, next, hour, ., please, retweet, reach, quickly"
1276,"They, only, know, about, morning, rolls, ., of, the, pathetic, speech, against, calderón, and, the, past, ., violent, deaths, continue, to, break, historical, records, ., there, is, no, strategy, ,, there, is, nothing, ., GDP, at, the, lowest, level, in, the, country, ', s, modern, era"
1277,"so, excited, join, team, moderna, #, vaccinationdonecheck_mark, ️, @, niagara, lake, community, center"
1278,"monday, i, get, moderna, #, 2"
