,0
2271,"moderna, zwei, godspeed, raised_fist, please, dont, make, me, feel, toooooooo, bad, ., get, vaxxed, yall, ., black_heart, @, kaiser, sunset, hollywood"
2272,"i, was, "", stuck, "", with, moderna, ."
2273,"walgreens, at, 14th, st, nw, has, extra, moderna, right, now, ., it, ’, s, happy, hour, somewhere, —, not, too, early, get, shot, in, ."
2274,"day, 2, initially, kicked, my, butt, but, advil, +, tylenol, kicked, moderna, symptoms, butt, ."
2275,"slept, through, lot, it, ,, but, moderna, ii, smoked, me, —, i, ’, m, not, answering, 10, -, count, today, ., thankfully, …, snkrs, ’, random, number, generator, chose, today, all, days, not, kick, me, while, i, ’, m, down"
2276,"exactly, ., i, had, 1st, moderna, vax, had, severe, adverse, reactions, so, that, my, dr, advised, against, getting, 2nd, ., i, have, no, protection, am, no, better, iff, than, last, year, except, never, got, sick, felt, fine, ., now, everyday, i, feel, crummy, rotten, vax, infeb"
2277,"moderna, dose, two, has, been, kicking, my, butt, ever, since, it, woke, me, up, with, migraine, at, 5am, ., so, tired, ., sore, head, feet, ."
2278,"second, dose, #, moderna, let, ’, s, end, this, pandemic, get, our, lives, back, syringe, microbe, face_with_medical_mask, #, covid19, #, vaccinated"
2279,"my, incredibly, liberal, upbringing, massachusetts, my, imbedded, moderna, chip, are, my, protective, cloak, ., knowing, my, time, fl, will, eventually, come, end, i, will, continue, volunteer, fl, dems, tho, ,, even, if, it, ’, s, only, remain, thorn, side, dumbassery"
2280,"2nd, shot, moderna, :, im, okay, ., just, little, nauseous, but, man, has, it, slowed, me, down, ."
2281,"there, ’, s, rumor, face_with_rolling_eyeswinking_face, that, if, you, don, ’, t, tweet, pic, your, sticker, ,, vaccine, won, ’, t, be, effective, .., #, 2, syringe, books, ., countdown, face_with_head, -, bandageface_with_thermometer, .., #, moderna"
2282,"i, appreciate, this, gentleman, ', s, advice, ., i, attempted, get, vaccinated, had, adverse, reactions, 1st, moderna, vax, ., i, have, no, antibodies, therefore, have, no, protection, ,, no, fault, my, own, ."
2283,"okay, last, moderna, shot, 2, update, :, woke, up, day, 3, i, feel, totally, back, normal, after, good, nights, sleep, ., no, fever, ,, body, aches, or, headaches, ,, no, fatigue, ,, just, vibes"
2284,"person_facepalminglight_skin_tone, ‍, female_sign, ️, whoopsies, ., moderna, girl, over, here, person_tipping_handlight_skin_tone, ‍, female_sign, ️, let, ’, s, hang"
2285,"hope, you, feel, good, ., my, second, moderna, i, got, real, pain, my, arm, 3, days, ., first, shot, didn, ’, t, feel, anything"
2286,"this, second, dose, moderna, is, making, me, it, ’, s, bitch, lmao"
2287,"early, birthday, gift, myself, ,, moderna, #, 2"
2288,"first, dose, only, modern, vaccine, first, dose, only, modern, vaccine"
2289,"starting, vaccination, Friday, supporting, community, health, in, south, #, florida, today, all, free, doses, vs, #, covid19, of, #, moderna, and, #, johnsonandjohnson, ., no, appointment, required, #, walkin, everyone, welcomeglobe_showing_Europe, -, Africa, globe_showing_Americas"
2290,"I, put, on, 2, modern, ones, and, I, continue, with, all, the, protocols, ., I, wear, gloves, ., I, wash, my, hands, ., I, keep, distance, ., I, bathe, twice, a, day, ., I, take, vitamins, ., I, drink, water, ., I, exercise, ., like, fruit, ., He, avoided, public, places, ., even, with, the, vaccine, ,, precautions, should, be, taken"
2291,"i, had, phizer, ,, mark, had, moderna, neither, us, had, single, symptom, winking_face, your, good"
2292,"day, after, my, 2nd, dose, #, moderna, i, ’, m, feeling, fine, sore, arm, is, my, only, real, complaint, ., #, getvaccinated"
2293,"so, moderna, was, effed, up, company, financially, till, covid, -, 19, came, rescue"
2294,"at, last, i, am, reborn, purifying, fires, moderna, dose, 2, powerful, ready, smite, my, enemies, rule, earth, which, is, rightfully, mine, also, i, am, finally, feeling, better, ."
2295,"feeling, little, woozy, this, morning, after, getting, my, second, moderna, shot, yesterday, ,, but, not, too, bad, compared, some, stories, i, ’, ve, heard, ."
2296,"correction, be, made, ., that, was, not, moderna, ’, s, ceo, ., that, was, stephen, hoge, ,, president, ., stephane, bancel, is, ceo"
2297,"re, see, saw, -, ing, moderna, &, amp, ;, other, vaccines, etc, after, us, proposed, backing, patentwaivers, :-, me, it, ', s, just, institutionized, mass, /, mob, reaction, ., but, as, as, ip, is, concerned, ,, heck, they, take, my, ideas, &, amp, ;, stick, me, w, +, short, end, stick, all, timehear, -, no, -, evil_monkeyhear, -, no, -, evil_monkeyhear, -, no, -, evil_monkeygrinning_facegrinning_facegrimacing_facegrimacing_facegrimacing_face"
2298,"moderna, ceo, expects, more, covid, variants, :, ', this, virus, is, not, going, away, '"
2299,"i, may, have, toxic, ,, love, /, hate, relationship, with, planes, ...., but, so, thankful, be, able, do, this, again"
2300,"since, moderna, shots, are, given, 28, days, apart, ,, both, my, shots, coincided, with, two, menstrual, periods, ., both, periods, were, completely, normal, every, way, ., i, know, that, ', s, anecdotal, ,, but, just, putting, that, out, there, ., this, is, nonsense, ."
2301,"i, ', m, happy, with, my, super, powered, moderna, ..., it, has, electrolytes, ..."
2302,"dear, i, lied, my, v, -, safe, check, in, .., i, am, not, ok, ., everything, hurts, ,, i, have, chills, ,, headache, ,, abdominal, pain, ,, fatigue, ,, etc, #, covidvaccine, #, covid19, #, moderna, #, fullyvaccinated"
2303,"not, feeling, sick, anymore, my, second, moderna, shot, ., just, feeling, hella, tired, ., sleeping_face"
2304,"that, page, is, new, ,, i, have, as, much, experience, navigating, it, as, you, -, i, just, found, it, today, ., but, clicking, moderna, link, ,, i, found, this, ."
2305,"lmao, this, was, me, couple, days, ago, with, my, prozac, ,, tremfya, ,, moderna, ,, tylenol, ., it, was, rager, ., love, -, you_gesture"
2306,"my, husband, got, j, &, amp, ;, j, i, got, moderna, ., we, both, felt, poorly, about, 36, hours, afterwards, but, are, fine, now, ,, except, our, microchips, are, not, communicating, ., winking_face"
2307,"i, like, living, edge, ., that, ', s, why, i, am, moderna, man"
2308,"We, received, the, 2nd, dose, of, moderna, vaccine, today, ..., good, luck, :"
2309,"my, whole, family, did, moderna, ., old, ,, young, ,, sick, ,, healthy, ,, males, &, amp, ;, females, &, amp, ;, we, had, zero, problems, thanks, joe, best, all, ,, we, got, our, lives, back, ., i, see, my, grandkids, &, amp, ;, summer, is, ours, enjoy, as, we, wish"
2310,"first, moderna, shot, kicked, my, ass, ., had, sleep, 2, days, &, amp, ;, still, have, fever, &, amp, ;, flu, -, like, symptoms, day, 4, ., glad, i, got, it, ,, but, would, have, planned, differently, if, i, knew, how, it, would, hit, me, ., rest, my, family, just, had, sore, arm, ., anyone, else, get, side, effects, 1st, shot"
2311,"shit, ,, dolly, looks, good, after, that, #, moderna, #, girls5eva"
2312,"when, that, second, moderna, shot, hits"
2313,"day, 416, ,, my, quarantine, ended, ., #, moderna, #, thankyouscience, #, grateful"
2314,"i, also, got, moderna, ., so, excited, that, i, ’, m, fully, vaccinated, now, ."
2315,"learning, be, less, neurotic, about, being, indoors, now, that, i, ’, m, fully, moderna, ’, d, ."
2316,"2, weeks, after, getting, my, 2nd, moderna, shot, i, ', m, voting, ted, nugent, own, libs"
2317,"anyone, else, notice, that, after, your, second, moderna, shot, ,, your, inner, monolog, is, now, entirely, bill, gates, ’, voice"
2318,"modern, and, johnson, &, amp, ;, Johnson, are, the, ones, that, have, had, the, biggest, problems, in, terms, of, "", side, effects, ""., I, don, ', t, think, it, ', s, anything, significant, ., for, example, that, of, j, &, amp, ;, j, of, 8, million, ,, only, 6, dead, ., the, other, only, has, 2, or, 3, people, with, serious, side, effects, ."
2319,"so, ,, i, didn, ’, t, get, any, adverse, reactions, either, my, moderna, vaccine, doses, ..., but, most, my, friends, got, some, gnarly, ones, either, first, or, second, dose, ., is, that, good, or, bad, thing, or, does, anyone, even, know"
2320,"face_with_medical_maskface_with_medical_maskface_with_medical_maskOK_handmedium, -, dark_skin_toneeyeshundred_pointsorange_heart"
2321,"i, went, cvs, pick, up, actual, photos, ,, they, announced, openings, vaccines, ., i, received, my, 1st, moderna, minutes, ., yaya"
2322,"also, ..., go, tream, moderna"
2323,"2nd, day, with, moderna, vaccine, ., everything, is, fine"
2324,"afternoon, in, the, modern, sun_with_face"
2325,"this, 2nd, #, moderna, shot, may, rock, my, world, tomorrow, ,, but, at, least, i, ’, ll, have, new, rock, with, me, #, vanweezer, #, getvaccinated, #, vaccinated, #, modernagang, photo, credit, :, i, can, ’, t, wait, rest, album, /, promo, shots"
2326,"I, arrived, at, 4, :, 25, p, ., m, ., for, my, 4, :, 30, p, ., m, ., appointment, but, did, not, receive, my, dose, until, shortly, before, 6, :, 00, p, ., m, ., and, left, the, convention, center, around, 6, :, 15, p, ., m, ., three, times, ,, during, the, wait, ,, a, proposed, one, told, us, to, follow, him, if, the, moderna, wanted, because, the, line, was, shorter, ..."
2327,"one, shot, ,, two, shot, syringe, got, moderna, shot, check_box_with_check, ️, almost, fully, vaccinated, now, face_with_medical_mask, hopefully, fun, starts, smiling_face_with_sunglasses"
2328,"i, got, my, second, shot, moderna, yesterday, ,, bought, tickets, today, ,, preordered, butter, 7, ”, cassette, …, i, feel, so, powerful, right, now"
2329,"damn, moderna, has, got, me, sleepy, today, ., i, called, two, nights, ., playing, sade, put, me, sleep, right, now"
2330,"i, got, my, second, moderna, ., do, not, feel, well, ., at, all, ., sleep, beckons, ."
2331,"I, didn, ', t, want, to, put, the, Johnson, on, because, I, have, 3, delicate, conditions, ,, which, are, diabetes, ,, cholesterol, and, high, blood, pressure, ., yesterday, in, the, place, where, they, place, the, vaccine, ,, there, was, no, one, neither, in, the, part, where, they, placed, the, j, &, amp, ;, j, one, nor, where, they, placed, the, modern, one, ., those, 2, were, empty"
2332,"hurt, sell, some, moderna, today, downcast_face_with_sweat, but, opportunity, cost, $, mrna"
2333,"really, looking, forward, tomorrow, when, i, deeply, hope, moderna, #, 2, reaction, will, finally, wear, off, ., this, "", you, have, flu, lol, "", thing, my, immune, system, is, doing, is, already, old, at, least, i, never, got, nauseous"
2334,"syringemicrobe, 2nd, vax, moderna, didn, ’, t, quite, kick, my, butt, like, i, was, expecting, ,, but, i, think, i, slept, thru, worst, it, ., some, mild, aches, &, amp, ;, headache, ,, mostly, feel, wiped, out, /, meh, today, shot, was, yesterday, ., but, overall, no, big, deal, ., totally, worth, swearing, fealty, beast, &, amp, ;, boosting, 5g, satellite_antenna"
2335,"today, ,, i, just, received, my, final, dose, moderna, covid, vaccine, ., beaming_face_with_smiling_eyessyringei, am, now, fully, vaccinated, against, covid, ,, yay, partying_faceraising_handsmedium, -, light_skin_tonethank, you, getting, me, vaccinated, my, 2nd, dose, ., beaming_face_with_smiling_eyeshappy, national, nurse, day, all, healthcare, workers, out, there, beaming_face_with_smiling_eyesmanlight_skin_tone, ‍, medical_symbol, ️, womanlight_skin_tone, ‍, medical_symbol, ️"
2336,"if, you, ’, re, got, any, spare, moderna, ,, i, ’, ll, take, it, here, ."
2337,"this, response, by, ⁦⁦⁩’, s, ceo, is, beautiful, ., yes, ,, ip, rights, are, foundation, biotech, but, we, are, amidst, global, crisis, ., true, innovators, also, invest, deep, technical, expertise, +, workforce, skills, +, culture, that, cannot, be, copied, ., ⁦⁩"
2338,"okay, ,, so, i, learned, my, lesson, hard, way, today, :, do, not, under, any, circumstances, drink, beer, first, 24, hours, after, your, 2nd, moderna, shot, ., i, legit, felt, like, i, was, going, die, today, until, stopped, by, with, some, pepper, ginger, garlic, soup, revive, me, tired_face"
2339,"modern, -, 2, veteran"
2340,"friend, mine, just, got, her, second, …, first, was, az, ,, second, was, moderna, ., was, also, ab, ,, though, ."
2341,"i, got, moderna, ., matt, didn, ’, t, feel, anything, his, second, shot, but, i, felt, like, death, warmed, over, ."
2342,"#, nationalnursesday, i, received, my, second, moderna, shot, nurse, sherley, ., she, was, so, pleasant, ., #, gratitude, ., #, vaccinated"
2343,"vaxxed, max, moderna, baby, ."
2344,"correct, ,, it, is, us, intellectual, property, ,, not, phizer, ,, not, moderna, ', s, ., this, is, great, way, gain, some, soft, power, world, vizaviz, china"
2345,"after, 4, weeks, ,, finally, the, big, day, of, the, second, dose, of, the, modern, vaccine, arrived, ., syringe"
2346,"just, had, them, shoot, me, up, with, that, moderna, pack"
2347,"i, ’, m, done, now, ., two, moderna, shots, ., feeling, great, ., thanks, spreading, word, ,, sarah, ."
2348,"another, photo, celebrating, christian, ’, s, 50th, ., best, partner, kitchen, barn, red_heart, ️, we, are, getting, our, 2nd, moderna, shot, today, ., party_popper"
2349,"my, tetanus, booster, hurt, more, than, this, moderna, if, we, ', re, being, real"
2350,"bam, fully, vaxxed, i, think, nurse, poked, him, eye, this, time, ., lol, ., #, moderna, #, fullyvacinnated, #, vaccine, #, getbehindmecovid, @, santa, clarita, ,, california"
2351,"yesterday, I, took, the, first, modern, and, only, a, little, headache, and, arm"
2352,"today, ,, i, got, my, 1st, vaccine, shot, today, is, moderna, ., thank, you, lord, this, thursday, morning, /, midday, ., god, is, good, ., 1, done, check_mark_button, 1, more, go, ."
2353,"2nd, dose, moderna, done, .., what, sign, says, .., get, vaxxed, ya, jagoff, .., #, moderna, #, vaccinated, #, jagoff"
2354,"well, i, got, my, first, shot, form, moderna, today, at, cvs, near, where, i, received, my, speech, services, ., i, stopped, going, there, first, week, march, 2020, ."
2355,"here, ’, s, episode, you, …, mapapamura, ka, kay, bossface_with_symbols_on_mouth, +, marvel, phase, 4, superheromedium, -, light_skin_tone, +, ph, oks, moderna, OK_hand, episode, mad, manila"
2356,"i, literally, felt, like, i, got, ran, over, by, car, with, second, moderna"
2357,"have, you, heard, anyone, with, neurological, disease, with, improved, symptoms, since, having, covid, vaccine, i, have, als, ., it, may, be, coincidence, ,, but, 3, weeks, after, my, first, shot, ,, i, had, improvement, function, ,, ie, almost, impossible, turn, bed, able, turn, w, /, ease, ."
2358,"had, two, moderna, shots, ,, i, ’, m, finesmiling_face_with_smiling_eyes"
2359,"that, second, moderna, shot, got, me, draggin, ., feel, like, i, could, sleep, all, day, sleeping_face"
2360,"why, vaccinate, your, kids, who, have, 99, ., 999, %, chance, recovery, thinking_faceface_with_medical_maskmoderna, ', s, covid, shot, is, 96, %, effective, teens, ages, 12, -, 17, trials, via"
2361,"i, ’, m, getting, my, first, dose, moderna, tomorrow, ,, i, ’, m, really, not, happy, about, it, ."
2362,"day, 2, moderna, chills, ain, ’, t, nothin, fuck, with, ., but, please, fuck, with, it, ."
2363,"did, anyone, else, have, this, much, pain, when, they, got, their, moderna, microchip, #, covidvaccine"
2364,"moderna, x2, arm, definitely, hurts, more, this, time, ,, but, as, nurse, said, ,, “, it, ’, s, better, than, ventilator, ”"
2365,"which, one, did, you, get, moderna, they, told, me, come, back, month, ."
2366,"that, ’, s, moderna, number, 2, -, so, easy, so, well, done, thanks, all, scientists, doing, r, &, amp, ;, d, thanks, all, logistics, folks, making, this, easy, ., special, thanks, all, front, line, folks"
2367,"second, moderna, shot, is, no, joke, lol"
2368,"#, hugwatch, may, yep, ., officially, two, weeks, past, my, second, moderna, shot, ., hugs, gonna, be, like, ..."
2369,"#, moderna, #, 2ndjab, prep, ."
2370,"second, moderna, is, done, syringe, i, ', m, chugging, 33, ., 8, oz, ., smartwater, lol, ."
2371,"getting, people, vaxxed, im, south, ozone, park, ,, queens, today, #, vaccine, #, getvaccinated, #, moderna"
2372,"modern, coffee"
2373,"hand_with_fingers_splayedhand_with_fingers_splayed, moderna"
2374,"just, got, moderna, #, 2, 2, weeks, baby"
2375,"unckie, moderna, can, you, pls, stop, making, me, feel, like, absolute, shit, pleading_face"
2376,"moderna, shares, booster, shot, data, variant, efficacy, |, today, via"
2377,"over, 24, hours, after, my, second, moderna, shot, ;, my, arm, is, sore, as, hell, ,, i, have, bit, headache, ., asides, that, nothing, else, ., felt, literally, nothing, first, time, ,, just, built, different, ."
2378,"intellectually, i, realize, i, am, not, dying, but, this, second, moderna, sure, makes, me, feel, so"
2379,"fully, vaxxed, cautiously, leaving, my, social, distancing, cocoon, after, 14, months, indoors, ., butterfly, syringe, #, proceedwithcaution, #, moderna, #, ᴠᴀᴄᴄɪɴᴇssᴀᴠᴇʟɪᴠᴇs, #, vaccine, #, beatthevirus, #, ɢᴇᴛᴠᴀᴄᴄɪɴᴀᴛᴇᴅ"
2380,"don, ', t, miss, out, great, lunch, stop, by, volunteer, park, ,, friday, ,, may, 7, ,, 11am, -, 1pm, lunch, go, ., benton, -, franklin, health, district, &, amp, ;, city, pasco, fire, department, will, also, be, at, parks, ’, s, pavilion, ,, administering, free, covid, vaccines, moderna, j, &, amp, ;, j, ages, 18, +., #, pascoproud"
2381,"one, week, after, my, 2nd, cv, -, 19, ., one, week, go, 2nd, shot, be, fully, effective, #, moderna, #, getvaccinated"
2382,"moderna, is, best, one"
2383,"broad, shoulders, mr, michigan, avenue, before, after, moderna"
2384,"#, covid19, #, moderna, #, vaccinationdonecheck_mark, ️, @, woodland, ,, alabama"
2385,"i, just, had, my, first, moderna, yesterday, was, able, have, 3, margaritas, cinco, de, mayo, like, it, was, not, even, thing, ., i, have, same, slight, arm, -, soreness, ,, but, thats, been, it, ."
2386,"#, 2nddose, #, vaxd, #, moderna, grateful, #, healthcareheroes, #, nyc, together, we, can, end, this, global, pandemic, through, #, vaccinequity, &, amp, ;, #, equitablevaccinedistribution, throughout, world, ., no, one, is, safe, until, everyone, is, safe, #, inthistogether, #, oneworld, #, onefamily, #, onered_heart"
2387,"right, you, are, europeans, are, worried, about, this, i, really, don, ', t, think, this, was, well, thought, through, ., i, am, telling, world, that, u, ., s, ., we, consider, business, part, solution, ., this, undercuts, argument, please, be, careful"
2388,"it, ’, s, not, moderna"
2389,"i, can, not, make, this, up, ., cvs, just, called, me, lady, other, side, said, “, i, ’, m, calling, see, if, you, got, your, shot, yet, ,, we, have, moderna, today, ”, like, it, was, fucking, soup, day, or, happy, hour, special, ., i, got, mine, there, ., face_with_tears_of_joy, coronavirus, is, bringing, back, telemarketers, ."
2390,"when, he, has, the, opportunity, to, be, the, largest, in, mexico, looking, for, better, options, for, coaches, that, forge, a, modern, era, ,, I, hope, they, do, not, decide, for, the, business, of, some, ."
2391,"yeah, ,, that, explains, that, ., moderna, was, made, make, us, suffer"
2392,"moderna, did, this, to, me, for, 5, days"
2393,"musical_notes, i, ', m, moderna, girl, ,, covid, world, ,, i, got, vaccine, ,, i, feel, like, queen, crownmusical_notes, #, moderna, #, fullyvaxxed, #, vaxwars"
2394,"i, have, been, bested, by, moderna, vaccine"
2395,"pop, -, up, vaccine, clinic, at, galleria, dallas, this, weekenTongue_sticking_out_cheeky_playful_or_blowing_a_raspberry, doses, moderna, covid, -, 19, vaccine, ., no, appointment, necessary, may, 7, -, 8, :, galleria, dallas, ice, rink, level, ,, 13350, dallas, pkwy, ,, 10, a, ., m, .-, 7, p, ., m, ., home, vaccination, ,, residents, can, email, mobilevaccine"
2396,"first, dose, done, ., #, moderna, #, firstdosedonesyringecheck_mark, ️, #, ɢᴇᴛᴠᴀᴄᴄɪɴᴀᴛᴇᴅ, #, nofilter, #, waitingforthebus, @, pittsburgh, ,, pennsylvania"
2397,"yeah, ,, my, arm, hurt, too, couple, days, after, first, one, ., but, otherwise, ,, i, was, ok, ., i, ', ve, heard, second, moderna, can, kick, some, ass, though, lol, ., grimacing_face"
2398,"people, are, making, big, money, off, these, vaccines, face_with_medical_maskmoney_bagmoney_bag, moderna, inc, ., brought, $, 1, ., 7, billion, sales, its, covid, -, 19, vaccine, first, quarter, 2021, ,, marking, company, ', s, first, significant, billion, -, dollar, reve, ..."
2399,"moderna, is, kicking, my, ass"
2400,"i, ', ve, noticed, i, ', m, getting, lot, backlash, my, vaccine, tweets, ,, i, ', d, be, upset, if, i, settled, moderna, eyesnauseated_face"
2401,"day, after, shot, 2, #, moderna, ., was, up, all, night, with, headache, ., no, body, chills, or, fever, ., just, lethargic, feeling, ., great, day, rain, ., gonna, snooze, ."
2402,"booster, shots, rev, up, immune, response, coronavirus, variants, ,, moderna, says, -, cnn"
2403,"yes, ,, moderna, both, shots, this, marks, one, week, ."
2404,"behold, phenomenon, sapiens, defeating, most, vicious, killer, our, lifetime, #, 2ndshot, #, moderna, #, bringontheroaring20s"
2405,"astrazeneca, force, meets, moderna, object"
2406,"yo, …, where, ’, s, my, moderna, squad, at"
2407,"moderna, back, down, $, 150, Skeptical_annoyed_undecided_uneasy_or_hesitant, fuck, biden, dude"
2408,"moderna, says, its, covid, vaccine, booster, works, well, against, variants, via"
2409,"sue, allor, is, testifying, her, bill, ban, nonexistent, vaccine, passports, by, talking, about, cyber, security, data, breaches, ., if, hackers, want, target, walgreens, find, out, whether, i, received, moderna, vaccine, there, ..., this, would, obviously, not, be, prevented, by, this, bill"
2410,"done, done, second, shot, syringesyringe, #, moderna, #, dollyshot, #, inthistogether, #, ourshothoosiers"
2411,"at, campus, community, can, use, graham, health, center, portal, log, book, moderna, vaccination, series, ., note, my, #, covid19, antibody, study, campus, we, detect, antibodies, #, moderna, vaccinated, persons, ., book, here, :"
2412,"que, familia, tan, moderna, rolling_on_the_floor_laughing"
2413,"congratulations, getting, moderna, vaccine"
2414,"second, moderna, shot, can, kick, your, butt, so, make, sure, you, are, ready, rest, few, days, ., if, you, haven, ’, t, already, be, prepared, just, case, ."
2415,"moderna, at, kaiser, socal, ., quick, easy, point, ., still, different, feeling, radiating, injection, site, occasionally, but, nothing, much, ., thats, shot, one, ., shot, 2, coming, soon, arm, yet, be, determined, ."
2416,"⁦⁩, ceo, expects, more, #, covidvariants, emerge, coming, months, :, ‘, this, virus, is, not, going, away, ’, double_exclamation_mark, ️., reopening, indoors, facilities, at, 100, %, capacity, is, ill, -, advised, ."
2417,"onsite, vaccination, clinic, today, 10am, -, 4pm, ., walk, -, ins, are, welcome, team, is, all, set, up, will, be, administering, moderna, vaccine, ., second, dose, appointments, are, scheduled, thursday, ,, june, 3, ."
2418,"i, got, my, second, moderna, shot, yesterday, afternoon, ,, since, few, hours, afterwards, ,, i, ', ve, had, horrible, headache, that, even, 1000, mg, tylenol, didn, ', t, make, difference, ., so, i, just, went, bed, early, ,, thankful, i, took, today, off, ., body, is, hurting, lot, ."
2419,"those, are, same, exact, side, effects, that, i, had, after, receiving, my, second, moderna, vaccine, ..., but, i, was, extremely, exhausted, ,, had, chills, all, day, had, absolutely, zero, appetite, ..., face_with_rolling_eyes"
2420,"uh, oh, ,, sounds, like, you, got, post, -, moderna, shot, by, mistake"
2421,"1, /, i, know, i, have, some, friends, here, who, are, vaccine, -, hesitant, ., sharing, my, experience, case, that, helps, inform, you, :, i, got, moderna, vaccine, ,, after, first, shot, my, arm, was, bit, sore, ,, but, otherwise, i, felt, fine, ."
2422,"got, my, 2nd, dose, moderna, had, fever, 104, ., 7, ,, slept, about, 24, hours, now, my, neck, is, swollen, ., upside, -, down_faceupside, -, down_face, #, moderna, #, fullyvaxxed"
2423,"i, received, moderna, vaccine, february, ., had, routine, physical, after, vax, doc, said, i, was, loaded, with, covid, antibodies, ., everyone, my, family, has, now, had, vaccine, ,, there, ’, s, lot, us, ., do, whatever, you, want, but, we, found, vaccine, exceedingly, liberating, ., us, ,, covid, is, old, news, ."
2424,"was, fine, after, my, first, moderna, dose, ., second, one, had, all, my, muscles, joints, sore, as, could, be, ., felt, normal, again, about, 30, hours, after, second, dose, ., no, other, side, effects, here, ."
2425,"2nd, moderna, syringeface_with_thermometertired_facenauseated_face"
2426,"moderna, mamis, stand, up, princessmedium_skin_tonesyringe"
2427,"had, both, shots, ..., moderna"
2428,"reports, $, 1, ., 7, billion, covid, -, 19, vaccine, sales, ,, posts, first, profit, ever, ."
2429,"got, my, second, dose, moderna, yesterday, ,, all, is, well, here, no, side, effects, partying_facepartying_face, #, moderna, #, covidvaccine"
2430,"offices, city, council, president, darrell, l, ., clarke, congressman, dwight, evans, are, partnering, with, rite, aid, ,, strawberry, mansion, nac, brewerytown, sharswood, civic, association, bring, moderna, covid, -, 19, vaccinations, community, saturday, ,, may, 8, ,, 2021, 9am, 1, /, 2"
2431,"2nd, moderna, shot, yesterday, ., no, side, effects, other, than, sore, arm, ., get, your, covid, shot, loser"
2432,"said, thursday, that, initial, data, study, evaluating, its, covid, -, 19, vaccine, teens, between, ages, 12, 17, years, old, showed, efficacy, rate, 96, %,, with, no, serious, safety, concerns, .."
