,Text
0,"So.... Conservative Anti-Abortion Anti-Vaccination people.... thoughts?

And prayers, can't forget the prayers... https://t.co/gPydNIjV9T"
1,"@saletan @theabstoddard As you might know, the less you know about a topic, the more you believe in it e.g. anti-vaccination Republican supporters!"
2,"The ""regime spokespeople"" (MSM) keep referring to the ""anti-vaccination sentiment"" of the protests. Are they totally clueless or just trying to create a false narrative? The protests reflect an ANTI-MANDATE sentiment. They must know this since 90% of truckers are vaccinated. https://t.co/lpyiBL61Yk"
3,"@maureviv The doctors who were outraged that other doctors were honestly discussing sided effects etc. and saying it would stop people vaccinating… are mostly the same doctors insisting kids don’t need vaccinations, and using the language of the anti vaccination crusaders."
4,"Manchin voted for Sen. Mike Lee’s anti-vaccination amendment which SCOTUS referenced in its stay to block lifesaving OSHA requirements. 

Only 55% of West Virginians are vaccinated. 

1 in 300 residents of West Virginia have died from COVID-19. https://t.co/IOF6ibJYbT"
5,@tekstone @BustTheNotes @Fiorella_im If anti-mandate conservatives are successful in this anti-vaccination campaign the end result of this will be the poor and uneducated greatly harmed by diseases that are preventable while the elite is vaccinated and protected.
6,"@JF_Pinto @JoshforGeorgia Tweets the party of anti-democracy, anti-education and anti-vaccination"
7,"@mercurialskept1 There are always some — see this Toronto anti-vaccination-mandate protest 103 years ago. Luckily, nobody of any persuasion payed them any attention, as nobody will now. So that 1919 vaccination mandate worked. As have all the many of the last 100 years, including 7 current ones https://t.co/ptVTrJhipl"
8,@NconspicuousApu @Trumplicanchic1 @Dogwalker2019 @StephHoover8 Are you anti vaccination or anti covid vaccination?
9,@B52Malmet Been watching coverage of this insanity of Anti vaccination of trucker protests.Their is a threat of trucker protest at the Super Bowl.This would annoy 1% Privilege class &amp; other wealthy people. That only people who could afford tickets.Range of tickets prices 1 M -10m
10,"And while work during the pandemic has successfully overcome some hesitancy about covid vaccines, Fell said that real anti-vaccination messages had not been properly tackled. “Historically, 
 https://t.co/uaOYdhXh7k"
11,Kyrie has hurt the @BrooklynNets a lot this season. His anti vaccination stance limits his playing time but also forced Harden to want out as he didn’t come to Brooklyn to not be a contender for a title.
12,"James Bopp 🤡

Attempts to overturn 2020 presidential election results
Representation of Republicans in unsuccessful lawsuits claiming voter fraud
Anti-vaccination lawsuit
Campaign finance and election-law suits
FATCA challenge
Activism against same-sex marriage and LGBT rights"
13,"@ianfroese Teachers, parents and, students being terrorized by anti mask/anti vaccination covidiots is against the Charter of Rights and Freedoms. 

You cannot make people terrified to go out because you are unhappy. I hope every single one of them get arrested."
14,Kendrick Perkins is under the assumption that everybody wants out of Brooklyn because of Kyrie and his anti-vaccination antics. I mean I wouldn’t put it past them lol
15,"@e_considine @rorynotsorry @Noahpinion The vaccination data linked is pre-COVID, so it still remains to be seen whether the COVID anti-vaccination movement has reduced acceptance of non-COVID vaccines."
16,"@SocialistMMA Are you flipping many right wingers to free universal healthcare, guaranteed income, climate action, billionaire taxation, police reform/abolition? Or are they flipping you to anti-vaccination, public health skepticism, privileging privilege over safety, etc.?"
17,"@TorontoStar Im pretty confident she was infected at the antivaccination rallie...Covid supposed to last up to 14 days and can ""travel"" 6 feet/2 meters....haha #covididiots"
18,"History repeating itself. 

Left: #Rally of the Anti-Vaccination League of Canada, Old City Hall, Toronto, November 13, 1919.

Right: Protestors gather at Queens Park and Bloor Street West during a demonstration in Toronto Feb. 5, 2022

#antivaxxers
#protesters 
#WindsorBlockade https://t.co/wGSxP1TVux"
19,"Wonder how many went to this antivaccination rally are still alive??? any smart person (not even educated person) would understand definitions of causality, and probability and even your mom was said to be BRAINWASHED...sound like she was healthy right?? #news #torontostar #covid"
20,"'After a “Freedom Convoy” demanding an end to all public health measures against COVID-19 occupied downtown Ottawa, the Canadian capital, a network of far-right and anti-vaccination activists are planning similar actions across Europe.' 

https://t.co/r8f7Vnq5A6"
21,Thanks to @univision34ATL for interviewing Dr. Rodriguez and the opportunity to speak against anti-vaccination in state legislature https://t.co/0qli71D3MP
22,"U.S. truckers planning protest convoy, perhaps starting in L.A. for Super Bowl, DHS warns: https://t.co/YKT6b1VIfa

A massive anti-vaccination protest in Canada, being held by truckers, is starting to have a serious impact on businesses in the United States. https://t.co/HQmm6JuNry"
23,"@CathyNotToday @ADL @ADL_Florida How can we, his constituents, stand for this any longer. Our Governor is playing to racists, white nationalist, Nazis, anti vaccination fools, and hate. Anything to build a base of the ignorant. 
He has to go !"
24,"@YourGFLani I just don't understand the hypocrisy when rn, pharmacist, doctors choose to advocate antivaccination ... Yet they've made a living off of administering pill and injections to others."
25,"@Morning_Joe  

I thought u were going to mention t monstrous external cost re anti-vaccination w/u led w t smoking comment 

Did you purposely back off?

Absolutely none of u news people across all stations ever mention t huge $ these #QTrumplican cultists have cost t nation"
26,"@DianneCallaha16 @TomiLahren It’s not anti vaccination the @FreedomConvoy22 are protesting. It’s the freedom to make your own vaccination choice without penalties and restrictions if you choose not to, the removal of vaccination mandates, and the lifting of lockdowns and restrictions."
27,My Turn: Exposing an old legislative anti-vaccination trick https://t.co/tx1a4NO1Ys
28,@giwedinokwe @allopinionsopen @TorontoStar enefit of the vaccine outweighs immensely the anti vaccination and non-science believers just don't get it.
29,"@PhillyInquirer @maddiehanna article on Trump/GOP aligned Central Bucks School District @CBSDSchools elected School Board engineering pro genocidal pandemic mismanagement anti vaccination campaign, &amp; so cancellation of 9th grade trip to DC, eg @HolocaustMuseum.
#DCstatehoodNews https://t.co/O6woKrqdyl"
30,"HIV Edmonton would like to address the comment made by Premier Jason Kennedy during his announcement of the removal of COVID-19 restrictions in the province, where he drew parallels between what some might refer to as anti-vaccination stigma and HIV stigma, which has since been"
31,"20220209: Don Braid: Kenney fast-tracks removal of health restrictions, as threat of COVID remains [""The premier is under a special kind of political pressure, forced to court the anti-vaccination segment of his base and his caucus"" https://t.co/owJDXjMNQT"
32,Anti-vaccination protesters march through Civic https://t.co/dm521aF51o via @canberratimes https://t.co/NIpcErtTTM
33,"@dananessel It’s anti-mandate NOT anti-vaccination, Dana."
34,"Maddening to see Michigan’s economy impacted from Canadian anti-vaccination protest mayhem with U.S Republicans cajoling from the sidelines. 

Let’s pursue all diplomatic channels to get the border functioning again.   https://t.co/HOguATrdF3"
35,"SYDNEY — Lawmakers expressed fear Tuesday that anti-vaccination protests in Australia’s capital, inspired by the trucker-led demonstrations in Canada, could escalate. https://t.co/0reiob4HYz"
36,"In Australia…anti vaccination, mandates and any number of fringe and far right groups. This is a global, anarchical, violent, far right push with ties to US #extremism. #Fascism #Neonazis #TrumpCoupAttempt #Canada #auspol https://t.co/4UWnmip4kf"
37,"Auto plants start halting production following border protests: The anti-vaccination trucker protest that has paralyzed the Canadian capital, Ottawa, has spread to Michigan's border and threatens to create chaos in an auto https://t.co/cpzjH6cKoO"
38,@NBCNews Not anti vaccination they just want mandates dropped and life to return to normal over 90% are fully vaccinated . I see MSM in the states is also misleading just like here in Canada
39,"@NBCNews Anti-vaccination “mandate” truckers….
They are fine with the vaccine for those who want it."
40,"@NBCNews Anti-mandate, not anti-vaccination. At least, for once, tell the Fkn truth."
41,"The anti-vaccination trucker protest that has paralyzed the Canadian capital has spread to Michigan’s border, threatening to create chaos in an auto industry already struggling to cope with what industry experts have describe as a “fragile supply chain.” https://t.co/uIcYRidzbH"
42,"@lesuperburp Oh yeah. Just hard to calculate and 200k as a low estimate is enough to make bold claims so I tend to stick to it personally as well (e.g., antivaccination is worse than the entire drone war)"
43,"Trucks, crowds at Canada anti-vaccination protests exaggerated https://t.co/M6SDUCt0nQ"
44,"Just got an email about expecting delays tomorrow at PMH on my way to chemo. #TruckersGoHome 
I would like the ""freedom"" to seek hospital treatment without running into selfish, anti vaccination, racist and anti -science ""Canadians."" I am so done with these people. #EHE"
45,"@TorontoStar Okay..  That is a crappy thing to deal with, but the rallies aren't anti vaccination....  They are about ending the lockdowns, and gaining our freedom..   Stop the lies and fear (not saying the story is a lie, I wish no one dead!)  This media narrative is just disgusting though"
46,@HillaryClinton What kind of religion allows parents to sacrifice their children on the altar of anti-vaccination?
47,"@DrKimSue I knew it wouldn't be long before the anti-vaccination, anti-mask, anti-science folks would amp up their demonization of people struggling with substance use issues. There is a pattern here."
48,"The Dazed and Confused: 
“I’m not Anti-Vaxx, I’m Pro-choice” 

*checks timeline and newsfeed*

- Anti-vaccination
- Anti- LGBTQI+
- Anti-Abortion/Womens Productive Rights
- Anti-Feminist
- Anti-Marijuana
- Anti-Euthanasia
- Anti-Immigration
- QAnon etc

🙄🤦🏽‍♀️🙄🤦🏽‍♀️"
49,@Jim_Jordan Why argue with anti-mask or anti-vaccination people when you can just wait?
50,"The most interesting part was they all thought i was anti vaccination because i want them to continue to mask in public. 

I blame the @cdc @CDCDirector and all the coverage for leaving us out of their vernacular. 

They never lead with the fact that we are still dying, daily."
51,"Public health then &amp; now: 
The discourse of freedom and rights has a long history in the context of #antivaccination activism and has proven influential in courts, legislatures, and public opinion

https://t.co/iowr1OE4z9 https://t.co/AxTyv7P2AF"
52,"@GonzGovConsult Yes, they will. I have no doubt including maybe some nasal therapies or vaccines. I think the anti-vaccination crowd will get behind some of these treatments too. I hope so I work for many rural hospitals and while my specialty is diet, nutrition &amp; wellness I am motivated to help"
53,"@spooder2562 @RedSquirrelFtw https://t.co/rfqVugHJfA  The ""follow the money"" component of the organizers not only doesn't represent Canadians: it scarcely even includes Canadians.  The US Consfederacy has mobilized anti-vaccination truckers as a proxy force intending to damage or destroy liberal democracy."
54,@KellDA It means she is anti vaccination in trump-speak.
55,Well here we go. The COVID will return because of the cry babies who don't like masks and are probably the people who are anti-vaccination. Those same people probably didn't mind 1000s of fellow Americans dieing. We're never going to get over this shit.
56,"@Nick_Ashdown So are you saying ""alien powers"" (dış güçler)? 😄🤔
Those anti-vaccination groups need to have psychiatric treatment. Responsible and sane parents do not involve their children into such stupidities. And the guy in the video is total gubshite. No offence :))"
57,"He had done so because of views Djokovic had expressed two years earlier, before vaccines became available, views that were nuanced and explicitly not of a proselytising nature, as a result of which just his presence in Australia would be a symbol of the anti-vaccination cause..."
58,"But Kenney is under a special kind of political pressure, forced to court the anti-vaccination segment of his base and his caucus. #Opinion  https://t.co/BWI0ePnFzt"
59,"This is a rushed decision from a Premier facing ""a special kind of political pressure, forced to court the anti-vaccination segment of his base and his caucus.""

And Albertans will be left to pay the price.

https://t.co/vm3CrmMQUF #ableg"
60,"Surprise surprise surprise:
The anti-vaccination fad is pushing a false narrative of old-fashioned homophobia.

For those paying attention, this literally shouldn't be surprising, given the anti-vax movement's original ideas pushed disproven ideas about vaccines giving autism https://t.co/4u3HoW5Zbv"
61,@InCytometry @GoodDataMatters @EdwardArthur5 Exactly. Also the HIV variant being talked about in Denmark didn’t JUST appear. The article on it states it’s been circulating for decades now. It’s just the fact it’s actually been identified officially that it’s popped up in the news. This is anti-vaccination stirring up mess.
62,"@VictorFedeli @CME_Ont @ontario_made Why are you not speaking out against the illegal occupation of Parliament Hill by anti-vaccination terrorists?

Resign!"
63,"@AliciaSmith987 Me either! I guess all these anti vaccination crowd would be gone by now if the Black Plague, Cholera, pertussis or polio was to reemerge.
#FreshWords 
#FreshResists"
64,"Enough is enough with this outrageous, truly deplorable,irresponsible, uncaring, selfishness based Antivaccination trucker convoy protest. All THEY care about is THEMSELVES and THEIR rights but THEY don't give a damn about THEIR fellow Canadians' precious lives during pandemic!!"
65,@JustinRosenth11 ...let alone how big the business of anti-vaccination has become...
66,"From the bottom of WSJ morning email

Yesterday's Open Newsletter incorrectly referred to the Canadian truck drivers' protest as being anti-vaccination. The protest is about pandemic-related restrictions."
67,"@JarkkoHelenius @akheriaty A few credentialed people — almost every single one politically far right or a lifelong anti-vaccination advocate — have said this, Yes, but literally millions more experts disagree."
68,"@OnlinePhysios No

Not heavily promoting vaccination is not the same as intentionally spreading misinformation about vaccines and advocating against based on pseudoscience, belief and bull 💩 ?

Your government is pro choice not anti vaccination in younger individuals.

Masks are not connected https://t.co/Z6HKN5GDhz"
69,"Thread on Central Bucks County School District Pennsylvania US @CBSDSchools being stupidly anti vaccination (#COVID19), &amp; anti class trip to DC for their 9th graders, anti @HolocaustMuseum in DC,

to prove @CBSDSchools opposes DC restrictions against genocidal pandemic spread."
70,"Obvious examples are the violent incidents at COVID-related protests fuelled by anti-vaccination, anti-lockdown and anti-government agendas. We assess that these tensions and the associated possibility of violence will persist."
71,"Bio on Lisa Sciscio, Central Bucks County Pennsylvania elected School Board Member, Region 4, Warrington PA &amp; Warrick PA, by @PatchTweet @PeterBlanchard,

now reportedly pro Trump anti vaccination (#COVID19) SB member who blocked her kid's class trip to DC
https://t.co/MEXoBvBsmf https://t.co/s0hhfSacx9"
72,"But the Central Bucks County Pennsylvania School Board is reportedly stacked ""6-3 Trumplican"", allowing the SB to join in vetoing the entire annual 9th grade trip to DC to suit the anti vaccination (#COVID19) SB member, reportedly Lisa Sciscio &amp; her unvaxxed kid. https://t.co/XRIXXa0pqS"
73,"Teacher Dina Ley @dinachka82 tweets a likely Philadelphia PA region anti-vaccination (#COVID19) school board member not only didn't vaccinate her kid,

but just cancelled a big class trip, with her kid, to DC (eg @HolocaustMuseum) because her 1 kid isn't vaxxed.
#DCstatehoodNews https://t.co/OZUaoaKSDZ"
74,"@JustinTrudeau Dear Justin, everyone is fed up and your vaccination mandate madness 
Both pro and anti vaccination views are based on scientific facts and research 
Vaccination is a personal choice. Please let Canadians decide what to good for them"
75,"Before you go after me for the analogy, the US has lost about 300k people to covid since vaccines were widely available, that's probably about 230k entirely preventable deaths from antivaccination. That's a similar order of magnitude to deaths attributable to isis"
76,"Once struggling, anti-vaccination groups have enjoyed a pandemic windfall https://t.co/aKnSzolEif via @nbcnews"
77,"@CynicalMother Good old Shannon Joy, the lifelong anti-vaccination nut job who brings right-wing extremists like the #NYWatchmen to her hospital rallies. https://t.co/OU16byhpRq"
78,"@darylcognito That is really unfair. Businesses have had to put up with a lot, including harassment from anti-vaccination and anti-maskers. You can't blame them for doing what they can to stay open and keep their staff safe."
79,"Reached the point where the SK Premier is openly anti-vaccination and rolling out eugenics all the while telling us we can't get angry about it.

Nothing but despair at this point. Not even sure we can lock down, or if trying would help. We certainly can't go anywhere."
80,"@peterdaou It’s conservatives who want an open border between white countries (but in the U.S., not the southern border) and a few people who confuse sovereign rules for a voluntary border crossing with a “mandate”.

Anti-vaccination, autonomy to infect &amp; harm others, is the uniting desire. https://t.co/eWWzTEG56X"
81,"@Kerpaint @elektrotal @DoctorSleep237 Ignoring the context of him defending anti-vaccination views and, again, a group that included open neo-Nazis doesn't reflect well on you either."
82,"@slopar2 @sychodefender @chrisbizarre2 @JuliaHB1 Tom Renz isn’t just an attorney, he’s been an anti-vaccination crusader for decades"
83,"@kathygriffin omg
so scary 
anti-vaccination in this trucker movement is just a beard for white supremacy"
84,"@HeatherMoAndCo @masterofn01 @Justin_Ling Selfish anti-vaccination, right-wing extremists throwing a tantrum is kind of a mouthful, though!

What’s a good alternative?"
85,@CathyYoung63 Define COVID anti-vaccination lunacy?  Who are you referencing?
86,@MMandryk @leaderpost No all the anti vaxxers are back mouthing off just like before.  Vaccers hurted me feelings.  Now I am vindicated.  Supporting anti vaccination movement is nuts.  Guess we will have all the preventable diseases circulating in Saskatchewan in the future.  That will be on him.
87,"@QuestionMarc4 @FeltedAgain @Zndrsplt @SebMcKinnon That’s fair to consider genocide and racism as bad, anti-vaccination has nothing to do with racism or genocide. It does have a bare bones similarity that they are fringe groups, and that is enough to create a comparison. If someone doesn’t want the vaccine that’s not a nazi"
88,@KennethGoetz5 @Junkybuns @DevanCosta So what were you arguing ? The right to feel free to use the n word or were you the anti vaccination ivermectin?
89,"@FoxNews Fox News is anti-American. 

@FoxNews spreads lies.

Fox News spreads hate and division, anger and resentment, White Supremacy and anti-vaccination disinformation. 

How could anyone be proud of working at @FoxNews ?"
90,@HowitzerDon @AJkapcrypto @DevanCosta Whoopi do and so ducking what. That is a hell of a lot different than selling ivermectin or flat out being anti vaccination that some of hoes guests have advocated. He shouldn’t be so stupid and Spotify should have standards
91,"Such ignorant GOP spreaders of death &amp; disease &amp; with measles non vaccinated see birth defects, miscarriages, actual fetal death  yet these  fools legislate against abortion then cause fetal toxicity with anti vaccination legislation 🤬🤬🤬🤬 https://t.co/xIxtDI65ij"
92,"Though nearly all states had adopted mandatory vaccination statutes by abt 1900, initially as a condition of the ""privilege"" of school attendance &amp; uniformly deemed constitutional on that basis, Montréal's 1885-86 anti-vax riots spurred formation of the ""Anti-Vaccination League."" https://t.co/iV37YTl8dU"
93,"#AbLeg How many deaths are expected if they open up our society to unvaccinated people who aren't required to mask? Will it mean there will be less casualties or more? 

That's all Liberal nonsense, Kenney's anti-Trudeau truck drivers are anti-vaccination and careless with lives. https://t.co/eW5uqfXYOd"
94,"#AbLeg This anti-vaccination protest movement is something Kenney promoted behind the scenes. He stated repeatedly he is opposed to Trudeau's mandates. USA prohibits un-vaccinated non-American citizens from entering their country. 
If Kenney can't control the rebels, who will? https://t.co/vxjRr8z3Sb"
95,@rewegreatyet What’s up twitch the State GOP in Georgia trying to pass anti vaccination mandates on standard vaxxes like mumps. Rubella. Measles. When I was a kid there in the 80’s we got shots. IN SCHOOL.
96,"@plaidula @Jewbacchus @parasocialyte The next variant is going to be a rude awakening for all of you truthers who preached that omicron was mild. Treating vaccines like a cure without proper administration is as anti-science as anti-vaccination. Get your shot, keep your mask on, and buckle down. It's gonna get worse"
97,"""When Lawson's board started to crack down last year on doctors spreading misinformation about the coronavirus vaccines, she began getting threats. Anti-vaccination protesters accosted her at a parking lot and flew a drone over her house, she has said.""

https://t.co/ZvHBcWxwdF"
98,"@TeaPainUSA Don’t forget to disbar them, please! Professional organizations have a responsibility, too. Same goes for lousy, anti-vaccination “doctors.”"
99,"GoFundMe pulls donations from anti-vaccination protesters traveling through Canada ""GoFundMe pulls donations from anti-vaccination protesters traveling through Canada"" https://t.co/el21uZoNFq I wish I saw this before staring WeareKC's gofundme not sure it has had an effect on us."
100,Keep in mind that when anti-mask people and anti-vaccination people scream about their rights and refuse the mandates they are claiming the right to make you sick too.
101,"@1oldgypsysoul @soberlogan My auntie passed yesterday in the early morning hours. She was anti-vaccination, and her lungs couldn’t withstand COVID. My heart is broken for my family. I encourage everyone to read this &amp; take what I say into consideration. I’m fully vacc’ed myself. Prayers. This is life now."
102,@gracelover712 So are you anti vaccination?
103,"I wouldn’t call Krystal left wing id call her a grifter. Also Joe does have left wing ppl then turn around and do anti vaccination, anti mask misinformation campaign which is really where all this started https://t.co/wkjUG2Odw8"
104,"@MillerGabrielle Indeed. 

I’ve always looked up to my eldest brother and then the pandemic happened and I found out that he is a Maga hat wearing anti-vaccination idiot."
105,"@CPC_HQ ,
Tell the Anti-Vaccination supporters who you support to listen and understand this 👇 https://t.co/dIZys08msd"
106,"GoFundMe’s move to take down a campaign aimed at raising money for an anti-vaccination mandate protest in Canada quickly became politicized, and the controversy highlights an increasingly thorny issue for organizations in America: free speech.

https://t.co/8Wgqx5UV7B"
107,Then you are anti-vaccination. https://t.co/7zz2EHbBbu
108,@GBNEWS Mob of anti vaccination protesters………so why?
109,"@RichardNewby3 What’s unforgivable are liars.

The protesters were anti vaccination."
110,@GBNEWS Did you get the story correct? According to some reports these people were anti vaccination and Piers Corbyn was present.
111,"I remember when I was told that doctors are lying when they say you need fiber in your diet because your body can’t digest it. 

This is what anti vaccination sounds like to me."
112,"@zlurie We don't any further discourse on:

- Holocaust denial
- White Nationalism or Genetic Superiority BS
- Mass School Shooting denial
- Anti-Vaccination conspiracies

We DO need to talk about:

- False trickle down economics and its destruction of the middle class
- Propaganda"
113,"@WRiverLockhart Doesn't appear to be a trucker convoy at all. Rather, a cross-border coordinated move by the far right to further their cause(s) by co-opting anti-vaccination/anti-Covid measures sentiment."
114,"A group of anti-vaccination protesters have been let into Parliament House, negotiated by United Australia MP and vocal anti-vaccine advocate Craig Kelly.
#covid19 #covid #covidiots #antivaxxers #antivax #getvaccinated #FreeDUMB #UnitedAustraliaParty

https://t.co/DwiT6dI9GT"
