,Text
649,"If the people who choose to remain unvaccinated and are anti-vaccination,  anti science and anti doctor, not to mention anti common sense, then if they get Corona, they can suffer alone without medical attention and deal with it.

 Play stupid games, win stupid prizes.

Just STFU"
650,"Anti-vaccination movements always existed here in the US, sadly:
https://t.co/FSIV7s7FTE"
651,"I am tired of the anti vaccination people.  Vaccinations is what has helped generations be void of measles, mumps &amp; rubella.  There is the chicken pox vaccine. One for meningitis.  Stop the bullshit &amp; do what is necessary to protect all.  This what is in it for me bullshit. https://t.co/f3dlkw2WjP"
652,"How can you be anti vaccination and against masks?
Make it make sense https://t.co/rvPL1bK0tA"
653,Who knew @fordnation would be afraid of his anti-vaccination daughters? https://t.co/hcnTB2KV4O
654,Praying for all citizens residing in states run by anti-vaccination Governors.
655,"Rand Paul reveals in late financial disclosure that his wife bought stock in company behind remdesivir in February 2020
Explains why he so is angry at Fauci and is so anti-vaccination. 
Frankly this is outrageous and ought to lead to his removal.

https://t.co/XewSu9RBFt"
656,How are there nurses and healthcare employees who are anti vaccination? I don’t understand. Isn’t caring about public health part of being a healthcare employee?
657,"Finding out rand paul bought stocks in covid treatment makes sense in context of his anti vaccination and anti mask stance, he wants his constituents sick so he can make a quick buck on stocks"
658,"I’m getting savage re: anti-vaccination. 

Gloves: off

Line in the sand: crossed 

Manners: irrelevant 

I will rhetorically rip you to shreds because this ignorance is killing people."
659,"@Jim_Jordan Jordon has already killed hundreds of thousands w no masks, anti vaccination and public gatherings!
  Now he wants parents to decide over Fauci! Ludicrous"
660,The church of vaccination and the church of anti vaccination 🤣 https://t.co/xgonKWnbNr
661,"Being polite has not worked for pro vaccine/mask advocates, the anti mask, anti vaccination people have monopolized the discussion in the media and and on the Hill https://t.co/txZBftsltt"
662,"I should know better than to interact with people pushing religious and pseudo-scientific info to justify their anti-vaccination agenda. It makes my blood boil. I blocked 2, and would appreciate any reminders not to engage in the future. Poop."
663,"The division in our country is displayed in the Republican leadership in Florida. Anti mask laws anti vaccination propaganda, voter suppression support, disinformation, Qanon and conspiracy beliefs encouraged. Fear of socialism spread through immigrants etc."
664,Chet Hanks ought to be ashamed of himself.  Promoting anti-vaccination when BOTH his parents had COVID!?!  #WTDTA #GetVaccinatedNow
665,"JESUS!!!!!  😳😮🥺Makes sense though:

SW Airlines HQ - Dallas, TX
American Airlines HQ - Ft. Worth, TX
Delta Airlines HQ - Atlanta, GA

The above HQs are located in states run by anti-vaccination governors!  

United Airlines HQ - Chicago, IL 

IL gov’t supports vaccination 💪🏾💯 https://t.co/ixQjBOgPR8"
666,Must’ve ran out of anti vaccination propaganda to run https://t.co/ssTVuh3KjB
667,"“By going public with his anti-vaccination position, [Joseph Arthur] has aligned himself with a small group of like-minded musicians, including Eric Clapton, Morrissey, M.I.A. and Van Morrison.”

M.I.A., what??? https://t.co/SrdlhRMSHp"
668,"@CincinnatiPhil Smoking and anti vaccination, the supreme don’t care about health combo. Not only does she not care about her own health by smoking and not getting vaccinated, she enjoys sharing her unhealthy second hand smoke and her potential for getting and sharing the virus"
669,"🤬“Students have brought federal lawsuits challenging COVID-19 vaccination mandates at major public university systems. The students, many of whom are backed by anti-vaccination groups, are stating that they have a constitutional right to go to school in person and unvaccinated.”"
670,"It’s most fascinating to me that the anti-mask and anti-vaccination policies of Republican leaders like Gov DeSantis will primarily impact their base of supporters who believe the same as them, ultimately reducing their numbers."
671,"@IIHRUIowa I appreciate RFK’s tireless advocacy for clean water. His anti-vaccination stance? Not so much. Thanks, Larry, and everyone at @IIHRUIowa ."
672,"@jesus_jimz Wow! This is a shocker! Why would Texas have a “Houston we have a problem” #COVID19 moment? Oh, lackadaisical mask policy and anti-vaccination. Got it."
673,"So let’s make that the news headline, instead of giving anti vaccination politicians so much coverage. https://t.co/sxLF6G6GIH"
674,@Laurie_Garrett Maybe you could ask why so many Republican politicians and leaders are still anti-mask and anti-vaccination and passing laws against anti-COVID requirements.
675,@Myrmecos I wish we saw more of that in the media. Seems like we see a lot of the anti mask and anti vaccination parent protests.
676,@newtgingrich wasn't it the classical (white) Americans who ignored the rule of law on Jan 6? Who are still promoting Trump’s big voter fraud lie and anti-vaccination propaganda? Just asking for a divided America.
677,"@duty2warn ANTIVA, is in fact real

It stands for anti-vaccination"
678,"Texas Republican leader dies of COVID-19 five days after anti-vaccination post-https://t.co/2v5ag1SY8l
Please, take Covid seriously! People are fading &amp; no one deserves to not see their kids grow up.
Download Now
https://t.co/pAVj3z0Qre"
679,"I have no use for the anti-vaccination, anti-mask crowd. If you don’t want to accept responsibility for your behavior, stock up on provisions and stay home until the pandemic is over. That includes if you get sick. #GetVaccinatedNow #SaveOurKids https://t.co/HbakFnhfX1"
680,"Texas Republican leader dies of COVID-19 five days after anti-vaccination post
https://t.co/insv1F3nrB"
681,@DebbieO15943734 @halloweenpicnic @tedcruz So Obama is anti-vaccination?
682,A true story and the very definition of anti vaccination and Trumpism. Looks like the honorable Darwin is blue. https://t.co/UJI2ymlrLT
683,"I love how all these people that are saying “my body, my choice” for anti-vaccination are the first ones to support limitations on access to birth control and abortions. So I guess “my body, my choice” only applies when convenient"
684,"Asking for a friend, how many anti-vaccination  Supporters refuse  required rabies vaccine for their beloved pets 👀 https://t.co/mc1fmf3ri4"
685,My wife’s cousin in Mississippi posted on FB today about his experience over the last 2+ weeks of hell with his pregnant wife in the hospital with Covid and felt the need to put a disclaimer on his post that it was not a pro or anti vaccination post 😞
686,"Why a gofund me page for this? No health insurance?
So how did this guys life improve under trump..
Texas Republican leader dies of COVID-19 five days after anti-vaccination post https://t.co/neRjNUkMOG"
687,"Keep your PRO- and ANTI- vaccination views to yourself na
 Allyuh overdoing it now you believe what you want and leave people alone"
688,"@findlayassholes @cheezhash Dude. I’ve worked though Covid. I see multiple people coming in with vaccine reactions. I’m not anti vaccination by any means. But this one does not have enough studies to mandate. There are no mandates on any other vaccine, so why do they have the right to push this one?"
689,Salina Regional healthcare has reached capacity and these idiotic pro Trump anti Vaccination People filed a petition for Both Salina BOE and the city of Salina to limit emergency powers and unmasking our schools. I hate it here 🙃😒
690,@BuddyCarterAlt @RepBuddyCarter @MariaBartiromo @MorningsMaria @FoxBusiness Our Covid numbers are spiking. What are you doing to help increase vaccinations by dispelling anti-vaccination lies by your GQP pals? You literally can make a difference in your district and you don’t even try. https://t.co/BdCvZkP3QP
691,It's been made apparent that the people who use the word segregation when it comes to being anti-vaccination doesn't actually know what segregation means.
692,UES in Manhattan: These fliers where taped up on buildings by anti-#vaccination #activists that are drawing a false equivalency between proof-of-vaccination requirements to the yellow #StarOfDavid used by the #Nazi’s to identify #Jews during the #Holocaust by @uppereastsiteny https://t.co/kdtAUlxiag
693,"@NIAIDNews
Dear #DrFauci
Please understand that some of us who have had hesitation on this are not anti-vaccination. We're just looking for a better, less painful way of delivery. Vaccinations via pill or patch are being developed right now...
https://t.co/ZyJA7Rgkry"
694,"@PrayWithMe6 @amysayswtf I’m a Christian nurse and I am an anti-vaccination person. I will not get the corona vaccination because it is a farce, people are still getting corona after they get the vaccination plus so many terrible side effects."
695,Have there been any stories on whether the ground gained in anti-vaccination conspiracy theories has spread to parents refusing MMR etc to enroll kids in school? Is Covid just the harbinger for some new form of pertussis to emerge
696,@EvanJBergeron not a anti vaccination in fact 100  percent oppositeI urge everyone unless their doctor advises against it to get the shot. But Holmes is a mix bag and we need to recognize some of these precedents come with baggage and avoid those mistakes. This discussion is not all binary
697,‘Qui?’ #Antisemitic #Propaganda Floods #AntiVaccination Movement in #France as Jewish Doctors Report Harassment by Activists - #antivaxxers  https://t.co/6ZRpyjXs5y
698,"@EINS_Institute @holden Look at thread with the actors involved in anti mask 😷,  anti vaccination activity. Someone is paying them"
699,Y’all use the dumbest videos to support anti-vaccination.  🤦🏽‍♀️ https://t.co/eQYoxhTc9D
700,@intelligencer Are anti-vaccination Republican Senators actually not vaccinated?
701,"The QOP lost the White House, Senate and House, mostly due to their poor handling of the pandemic. What makes this major screw up with the anti-vaccination messaging and surge of cases different for the 2022 midterms?"
702,"@PeterMcCormack Similarly I wonder🤔how many anti-vaccination folks are littered with vaccines 💉😳??? 

What a time to be alive!"
703,"@misplacedsouthy @steventhobrien Yes it is chocked full of them and that was planned just like the antivaccination was. This has been going on in front of our faces for decades now, slowly but surely."
704,Anti-vaccination protesters rally at Capitol in Phoenix https://t.co/chn2551yqc via @azcentral
705,COVIDIOTS IN PHOENIX. Do us all a favor and stay home when you get Covid!! Anti-vaccination protesters rally at Capitol in Phoenix https://t.co/chn2551yqc via @azcentral
706,@wfrolik @magi_jay Vaccine hesitancy and anti- vaccination sentiments for both people and pets have been around for years on social media - often in liberal mom’s groups. This was a problem way before Fox News.
707,@_mermaidbarbie Facts girl! I’m not one of these weirdo anti vaccination but the covid vaccine not full proof n no one knows long term effects of it it’s global pandemic n ppl r just doing/trying to make best decisions for their family! Love u use ur platform for good sis! #uramazing
708,"@RachelBitecofer @mattyglesias “Except for being anti-vaccination, he’s actually pro-vaccination” is an odd leap of logic"
709,"From the Bloomberg Opinion piece: “In the end, demonization of the pharma industry and anti-vaccination falsehoods essentially took away a perfectly good vaccine. It is amazing that the same playbook is being used against Covid-19 vaccines.”"
710,"@SenTedCruz Lyin Ted
Stunning? You/gop killing hundreds of thousands needlessly AND causing. This surge with anti vaccination rhetoric?!"
711,@mercedesschlapp How about a trial for trump/ gop for killing hundreds of thousands needlessly and now with anti vaccination rhetoric fueling pandemic!
712,"@DoctorHenryCT @davidstevens111 I would withhold from any individual, government funding, to those who refuse to vaccinate. Biden should declare a National Emergency.  It jeopardizes the health of the entire nation. Influencers that tout anti-vaccination should be removed from all media platforms. Same as Trump"
713,@TomiLahren Vaccinated people propagating anti-vaccination propaganda are criminals
714,funny I heard a group of anti-VAX or’s say that what they really were was “anti-pro” I’m not sure what that means the girl said it basically means we are pro an anti-vaccination- If your “pro Dash anti-“ then it cancels out to zero
715,I believe the decision to get vaccinated is a personal choice. But I have let my anti-vaccination friends know that I reserve the right to not attend their funeral if I have previously scheduled plans on the funeral date.
716,Did you know that anti-vaccination propagandist @RonDeSantisFL is personally vaccinated? But he doesn’t want you to get vaccinated. Because he hates you. And your kids. #RonDeathSantis
717,@TheJimCornette @aewbotches It's not his anti-vaccination stand that makes him a bad person
718,"@RubinReport And at the time that was true. But since infection rates have risen over the past month things have changed. Blame the anti vaccination idiots. And btw, what is the “impeachable” offense?"
719,"@GOPLeader McCarthy thinks he knows better but …..
GOP killed hundreds of thousands w no mask, public gatherings
GOP allows virus to mutate by anti vaccination movement!
I saw immunization cards!!"
720,@GOPLeader Kevin please feel free to go maskless.    There are no better examples than the anti-maskers and anti-Vaccination people who get Covid and die.
721,"@mceg1965 @FridaGhitis It’s not hard to be sympathetic. A lot of monied enterprises &amp; foreign interests—monies, foisted this deceit onto this woman &amp; the larger anti vaccination crowd. Where is this money coming from? Who is profiting from disinformation on the virus.. that’s who we fix our ire."
722,"@ryancrist86 I’m not an anti vaccination person, I am just not comfortable moving forward with getting a rushed vaccine that has shown to harm especially younger adults and children, now I’m not in that spectrum but I have constantly researched and it’s a personal choice for everyone"
723,"@gojomo Boo.

Just say, ""Some are assigning 90% of the responsibility or higher to anti-vaccination activists, but it's really more like 20%."""
724,It’s just gonna be a thing now so anti  vaccination or can’t vaccinate people just start preparing. Yes your being inconvenienced but that was your choice. Make the steps and do your part https://t.co/7ktfc9D5BS
725,"I, for one, think there is a distinction between ""unvaccinated"" and ""anti-vaccination""."
726,"@IngrahamAngle These people are beyond reproach!
Lies, insurrection , death!
 We have never had such depth of depravity!
  Killing hundreds of thousands needlessly, election lies, insurrection, anti vaccination!
  Unbelievable"
727,"@Jim_Jordan Jordon killed hundreds of thousands w his “ freedom bs”
1. Freedom ok for sex predator to sexually abuse his wrestlers?
2. Freedom to not wear masks, public gatherings and anti vaccination to kill hundreds of thousands?
3. Freedom to lie about election fraud and cause an insurrec"
728,"@TaraSetmayer No, you’re not at all. Political anti vaccination is intellectual bottom feeding. The emotional reaction is necessary"
729,"@BossWard43 Wow… it’s not just the insensitivity of how you talked about Cancer or someone else’s medical history, but the fact you’re setting another bad example that anti-vaccination followers will point to as more justification to not help their follow man by getting the shot!"
730,"@curtprice @BobBuilders37 @sampagetyranny @ZaraBarkertv @FOX2now @DrSamPage @GovParsonMO @Eric_Schmitt @ernietrakas @ChiefTimFitch I had COVID in April of 2020 and finished my second Pfizer dose in April of 2021. I’m not anti vaccination, but I am for freedom of choice."
731,@JakeCoonfare The owner is supporting an anti-vaccination festival.
732,@ryancrist86 I’m not anti vaccination anyone who wants it research it &amp; more power to them. Personally I’m unvaccinated thus far as I want to continue to analyze more adverse effects &amp; more long term proof of safety &amp; effectiveness. Nor do I consider those thinking like @tigerdan151 negligent
733,Thanks to all the anti-vaccination people we have allowed the delta variant to spread and now we are back to mask wearing. I got vaccinated as soon as I could! Please get vaccinated or we will be under COVID indefinitely.
734,"Vaccination card or anti-vaccination card, your choice. #PandemicOfTheUnvaccinated #GetVaccinatedNow https://t.co/tXpljEWtWq"
735,@jalopy86 @qu_na_ms @SammualM @chrispyslice Why the hell not? The US preaches about being a world leader yet they are playing politics and are pandering to the pathetic anti vaccination crew. They need to get a grip
736,Seems catching Covid put me over the line with my irritation with my mom's anti vaccination views that boiled over on a call last night. Nothing changed either in her perspective. Frustrated.
737,@Wehms2 @TheRichardLewis Not anti vaccination…just more sacred of the cure than the sickness
738,Stumbled upon a Clubhouse room about anti-vaccination and girl really said people getting the vaccine are harming the unvaccinated by getting it 😭😭
739,I guess I better go ahead and add that I truly don’t care if you choose to get a vaccine or not. I am by no means anti-vaccination even if I have reservations about the covid vaccine. Let’s practice not making assumptions and our discourse will improve greatly.
740,"The antivaccination protests are happening in Europe, not here. Some European countries have tougher laws than we do. https://t.co/HMPatGBGvs"
741,"@KathrynTewson @AkivaMCohen Also, wouldn’t the sheer volume of anti-vaccination messaging on Fox be prima facie evidence that they didn’t want people to vaccinate?"
742,"@SteveSchmidtSES @POTUS Silly Me Steve, this entire time I thought ALL Healthcare Workers Were already Vaccinated🤯🤯🤯If the Mindset of Healthcare Workers is in the wrong  Place, what example are they setting for the Anti Vaccination Group?☹️😔🥲💔"
743,"Was excited to come upon a protest in NYC, so we walked toward the big crowd to find out what they were protesting. Turned out to be an anti-vaccination protest 🤦🏻‍♀️"
744,"That's  why I've been saying  that instead of giving airtime to Tucker to amplify his anti vaccination message, CNN, MSNBC  and other outlets should focus on individual stories highlighting the struggle of those who refused the vaccine and got Covid. https://t.co/YK3HHHtN6i"
745,So it’s true @Facebook is restricting Accounts which #Advicate for #COVID19 #Vaccines. I have been posting this all day and now Restricted for 30 Days. @selenagomez was right. Facebook is encouraging #AntiVaccination &amp; #Misinformation intentionally https://t.co/A53YKSy4P8
746,Trump &amp; Tucker anti vaccination messages have surely caused more Republican deaths and fewer voters. #DNC #RNC #GOP
747,@funder Smh wasn’t Ala. one of the states that was promoting anti vaccination
748,"It’s very hard to convince my non believing friends that Christians are pro life when we often seem to be:
Pro war, 
anti vaccination, 
pro death penalty, 
pro gun, 
anti medical for all 
and we seem to be unwilling to confront our own racism."
749,"The 1990–91 Philadelphia measles outbreak occurred in an anti-vaccination faith healing community, causing nine children to die. Court orders were obtained for healthy children to be vaccinated without parental consent. https://t.co/iI63BBes2h"
750,"Seriously? After a year+ of enabling anti-vaccination bs, banning mask mandates,   and more. She should be in prison for multiple counts of criminally negligent homicide… https://t.co/7YlkPjQSCE"
751,"My work has now made the covid vaccine mandatory, let the anti vaccination speeches commence…🙄"
752,"Agreed. Sadly, this pandemic is showing us just who the assholes really are. I didn’t know Eric was anti-vaccination. I thought he was one of the smart progressive ones. https://t.co/qh5SzNuItw"
753,Some of the @GOP seems to have magically realized their anti-vaccination dangerous idiocy is killing off chunks of their voting base since their flock of fools are often as ignorant as a rock. Pathetic this is the ONLY reason some of them are suddenly changing their tune.
754,Jesus. This anti-vaccination followed by desperate dying is “so South African” (look it up). https://t.co/gKWRkn2kVH
755,"@Independent I'm OK with politician's eating steak, drinking alcohol and riding in a limo. Its inserection denial, addvicating for assault rifle ownership and anti vaccination redirect that bothers me."
756,"@harvestlifer @thegarance @MorganJerkins I don’t agree. I’m guessing you are an anti-vaxxer and feel scared, perhaps attacked, by her observations. Feel free to correct me if you are not anti-vaccination."
757,"@DanRather Betcha every antivaccination public personality is vaccinated.

The level of hypocracy has an Olympian dimension.

The sickness pervading American society is so pervasive, I despair it can be reversed.

Seeing my country in this state is painful."
758,"I’ve seen a lot of news stories questioning why anti-vaccination Republicans are now urging constituents to get the shots. The answer is simple. They know their actions are killing their voters.

https://t.co/TWHlFPRkao"
759,It's almost August you POS!! where have you been is your horrible Party leaders are controlling The Narrative of conspiracy theories and anti-vaccination!! https://t.co/0rVpBs1XGn
760,I expressed exactly the same . The news is  too sanitized. We don't  see the tragedies unfolding day in and day out. We need to scare people straight! Instead the MSM gives more time to Tucker and Laura to repeat their anti vaccination conspiracy theories. https://t.co/09UgSXK01I
761,"@SenatorBraun Absolutely not! GOP killed hundreds of thousands needlessly w no mask , public gatherings and anti vaccination! You all should be in jail! Just evil!"
762,"Why are black people so susceptible to this anti-vaccination conspiracy nonsense? 

It is not just about the Tuskegee syphilis stuff. There’s more going on."
763,Hard to root for your favorite team when they kind of suck and have a bunch of stupid antivaccination idiots on their roster
764,You can’t help those who are anti vaccination https://t.co/YGXidIu35l
765,"@OlingerSusan @TomDogfish @JasonIsbell It’s absolutely 100% the point, just stop 🛑 with any type of anti vaccination argument. It just doesn’t hold water. https://t.co/fKS7j93SbX"
766,Emperor Joe Biden has identified 13 Facebook users that continually post anti vaccination information and Joe wants it censored. When should we start being concerned with this fascist government we have
767,Are there anti-vaccination people who have spent 12 hours a day listening to Fox News and conservative YouTube pundits? Yes! Are there people working exhausting jobs and raising kids and getting their info from friends and social media in their limited spare time? Also yes
768,Too bad the anti-vaccination fools weren’t all billionaires with rockets - they’d go to space and we just could just not let them come back. https://t.co/m7h7JvqEd1
769,Brian Broome with quite a good analysis of the anti-vaccination “mentality”: https://t.co/l5D2KyLUXw
770,"Remember when the white left tried to convince us that white trump voters really cared about economic policies? 

Lol 

Meanwhile the biggest issues among white conservatives are critical race theory, 1619 project, and anti vaccination lies and conspiracies."
771,"This broad made a case for anti-vaccination, and is too dumb to realize it. https://t.co/BSehnWt0tV"
772,"""There are about 12 people that produce about 65% of the misinformation about anti-vaccination on social media."" @PressSec ""We hurl truth at falsehood until it knocks out its brains."" Holy Qur'an https://t.co/hufAX6c07D"
773,Unvaccinated and anti-vaccination are two different things. We can do better. We can do more. https://t.co/YhVD2QPEMG
774,It’s time for a class action lawsuit against Fox and all their anti vaccination lying pieces of shit. They are inciting anti nurse and doctor and teacher vitriol. Sue the bastards.
775,Nope. I'd buy it on the advice of an expert. The anti-vaccination stories are ludicrous. Warranties have nothing to do with medicine. What a stupid argument. https://t.co/Rc3JG1XAxj
776,"@ZaleskiLuke It’s just a doubt factory. Trying to portray some major investigation is in the works. At the end they will come up with some bullshit, which will be fully debunked. But as with their anti-vaccination propaganda the cult will be even further radicalized."
777,I’ve read a lot about the Republican led anti-vaccination movement. And I see that their message is being heard and followed by supporters. But I simply don’t understand what political gain this strategy might achieve. What am I missing? #VaccinesWork
778,Meanwhile the VACCINATED @RonDeSantisFL is too busy selling dangerous hateful childish anti-vaccination garbage to raise money for himself on his website. #GOPHypocrisy #RemoveRon #DeathSantis https://t.co/nk1BMVN96j https://t.co/wNNNHw8WBH
779,The right wing is secretly getting vaccinated so they can stay healthy enough to continue preaching anti-vaccination.
