,0
1373,"instacart, shopper, being, hailed, as, hero, likely, saving, elderly, customer, ', s, life"
1374,"#, 5, -, 11, yo, vaccinateTongue_sticking_out_cheeky_playful_or_blowing_a_raspberry, 60224, #, 12, -, 17, yo, vaccinateTongue_sticking_out_cheeky_playful_or_blowing_a_raspberry, 117967, #, 18, -, 64, yo, vaccinateTongue_sticking_out_cheeky_playful_or_blowing_a_raspberry, 1227481, #, 65, +, yo, vaccinateTongue_sticking_out_cheeky_playful_or_blowing_a_raspberry, 508086, #, 12, -, 17, yo, boosteTongue_sticking_out_cheeky_playful_or_blowing_a_raspberry, 22221, #, 18, -, 49, yo, boosteTongue_sticking_out_cheeky_playful_or_blowing_a_raspberry, 291972, #, 50, -, 64, yo, boosteTongue_sticking_out_cheeky_playful_or_blowing_a_raspberry, 264842, #, 65, +, yo, boosteTongue_sticking_out_cheeky_playful_or_blowing_a_raspberry, 392816, cdc, data, as, 2, /, 9, /, 22"
1375,"keith, lee"
1376,"narrative, that, israel, is, most, vaccinated, earth, is, simply, false, ., it, was, certainly, one, fastest, out, gate, ,, fastest, issue, booster, ,, but, as, far, as, percentage, population, that, ', s, currently, vaccinated, ,, lags, behind, many, ."
1377,"they, are, all, vaccinated, ., they, did, right, thing, now, can, go, back, normal, ., all, people, u, ., s, needed, do, was, mask, up, get, vaccinated, stop, being, selfish, ., we, would, be, back, normal, also, ."
1378,"you, mean, guy, who, wanted, be, secretary, army, loudly_crying_face"
1379,"what, ’, s, penalty, missing, biggest, game, season, because, personal, choice, bills, wide, receiver, cole, beasley, --, who, said, he, ', d, rather, die, than, get, vaccinated, --, tested, positive, covid, -, 19, &, amp, ;, will, be, away, team, 10, days, ., 03"
1380,"i, one, cannot, wait, day, whatever, they, have, ted, cruz, comes, light, ., it, has, be, huge, him, behave, like, he, has, ."
1381,"i, made, myself, watch, but, not, word"
1382,"they, think, because, 90, %, are, vaccinated, ,, they, are, speaking, majority, by, “, doubling, down, ”., but, so, many, are, vaccinated, rolling, their, eyes, at, this, ., they, stand, lose, substantial, votes, ."
1383,"i, don, ’, t, care, ., these, people, deserve, ridicule, ., trust, me, …, if, it, was, up, her, ,, she, ’, d, have, babies, vaccinated, ,, one, year, olds, mask, ,, just, so, her, neurotic, ass, could, feel, better, at, all, you, can, eat, buffet, ."
1384,"if, she, asked, there, is, almost, no, doubt, he, would, …, they, are, all, vaccinated, .., they, are, all, choosing, take, their, own, chances, …"
1385,"no, one, delays, gratification, quite, like, astronomers, ., 15, yrs, build, deep, space, probe, ,, 7, years, find, out, if, it, works, ., do, your, degrees, say, ', we, appreciate, your, patience, ', them"
1386,"0, ., 001, %, canadians, are, now, attempting, stop, 100, %, our, trade, because, 10, %, canadians, refuse, get, vaccinated, ., this, is, not, about, freedom, or, democracy, ;, it, is, about, selfishness, ignorance, ."
1387,"crash, ontario, auto, sector, ,, that, ’, ll, win, you, friends, influence, ., this, is, madness, ., also, ,, get, vaccinated, ."
1388,yeah
1389,"this, is, my, #, grandpa, ., called, him, evo, ., he, #, died, 3, days, ago, ., he, was, #, vaccinated, ., #, vaccine, didn, ’, t, work, ., died, #, pneumonia, catching, #, covid19, ., his, #, body, couldn, ’, t, fight, it, off, ., joe, biden, said, he, was, going, be, ok, ., he, #, lied, #, joebiden, what, happened, i, miss, him, ., red_heart, ️"
1390,"it, ', s, not, going, away, because, trump, gop, politicized, covid, -, 19, ., half, country, won, ', t, wear, mask, ,, get, vaccinated, or, social, distance, ., these, idiots, that, don, ', t, care, about, anyone, but, themselves, are, why, covid, -, 19, is, still, deadly, threat, ."
1391,"i, loved, when, they, did, this, ,, my, kids, i, got, huge, kick, out, it"
1392,"maybe, that, will, change, once, students, can, get, vaccinated, boostered, ,, but, unless, school, or, state, mandates, it, all, students, visitors, i, don, ', t, know, that, it, would, be, safe, allow, it, ."
1393,"canadian, truck, driver, who, is, not, fully, vaccinated, can, ', t, be, denied, entry, into, canada, —, canadian, citizens, ,, persons, registered, as, indians, under, indian, act, permanent, residents, may, enter, canada, by, right, ."
1394,"visit, with, 6, year, olTongue_sticking_out_cheeky_playful_or_blowing_a_raspberry, 6, :, i, ', ve, had, my, #, covidvaccine, me, :, that, ', s, awesome, ., that, means, you, ', re, as, safe, covid, as, you, can, be, ., 6, :, yep, ., i, know, what, it, feels, like, be, fully, vaccinated, ., it, feels, good, #, tweetiatrician"
1395,"arrogance, him, ,, still, demanding, they, get, vaccinated, even, have, conversation, ., if, they, comply, they, will, demonstrate, him, &, amp, ;, themselves, that, he, still, has, power, over, them, ., hopefully, they, will, see, through, this, &, amp, ;, refuse, ."
1396,"throw, back, some, great, chemistry, diskussions, 2016, #, chemistry"
1397,"you, are, correct, ,, canadians, have, spoken, ., 90, %, vaccinated, ."
1398,"thinks, this, is, borscht, belt, lol"
1399,"did, virus, go, away, are, vaccinated, being, infected"
1400,"go, get, ', em, ,, tiger"
1401,"let, me, hazard, guess, ,, get, vaccinated, ."
1402,"acting, fla, surgeon, general, ladapo, ,, member, quack, medical, group, “, america, ’, s, frontline, drs, ”, refuses, tell, fla, dems, whether, or, not, he, ’, s, vaccinated, ,, they, ,, turn, ,, should, diskontinue, his, huge, salary, &, amp, ;, refuse, confirm, him, ."
1403,"depending, if, most, population, your, state, is, vaccinated, ., your, infections, are, low, ., but, as, parent, my, kid, will, be, wearing, mask, at, school, ., as, i, do, when, i, go, shopping, ., your, preference, ."
1404,"have, as, many, guns, as, you, want, but, you, need, have, back, ground, check, insurance, mental, checkup, training, registration, your, gun, not, that, hard, or, too, much, work, #, guns"
1405,"if, you, ’, re, fully, vaccinated, wear, mask, all, time, which, you, ’, re, free, do, so, ,, why, do, you, care, what, anyone, else, does"
1406,"yes, their, dogs, need, be, vaccinated, cross, border, ."
1407,"did, y, ', all, hear, spontaneously, combust, too, #, aewdynamite"
1408,"i, qt, person, if, my, mutuals, are, following, them, just, let, them, know, ."
1409,"thanks, support, OK_handmedium, -, dark_skin_tone"
1410,"get, vaccinated, ,, cheer, up"
1411,"isn, ', t, afraid, her"
1412,"best, part, is, most, them, are, already, vaccinated, because, they, were, deemed, essential, first, time, around, ., now, they, have, changed, their, tune, ., government, that, is"
1413,"his, kid, couldn, ’, t, go, swimming, because, he, chose, not, get, vaccinated, ., choices, have, consequences, ., #, ableg, #, abpoli, #, albertan, #, covid19ab, #, coutts, #, couttscrisis"
1414,"i, guarantee, all, staff, has, be, vaccinated, tested, though, ., cool"
1415,"bless, his, heart, ."
1416,"they, ', re, not, joking, ., this, women, has, spent, last, two, years, stalking, me, ., she, posted, revenge, porn, me, ,, stalked, doxxed, me, my, work, threatened, out, me, at, work, ., can, you, please, report, her, i, have, her, blocked, as, well, ."
1417,"i, want, purple, emojis, ."
1418,"90, %, 120, ,, 000, truck, drivers, canada, are, vaccinated, ., i, ’, d, say, mandates, were, very, successful, ., it, appears, there, is, minority, truck, drivers, involved, this, protest, accompanied, by, wannabe, truck, drivers, their, p, /, u, ’, s, displaying, nazi, confederate, flags, ."
1419,"i, ', d, make, damn, sure, she, is, vaccinated, before, you, invite, her"
1420,"only, people, catching, bug, at, my, work, place, are, vaccinated, as, well, ."
1421,"how, spectacularly, meaningless, ."
1422,"two, things, can, be, true, ., fact, ,, case, they, are, ."
1423,"i, ', m, starting, recover, omicron, but, like, last, time, i, caught, covid, ,, my, body, is, incredibly, weak, ., it, took, me, months, before, i, was, back, "", normal, "", with, my, health, ., i, don, ', t, know, what, this, is, going, look, like, moving, forward, but, i, appreciate, love, ., get, vaccinated, ., wear, mask, ."
1424,"his, kid, couldn, ’, t, go, swimming, because, he, chose, not, get, vaccinated, ., choices, have, consequences, ."
1425,"i, expect, people, like, that, at, walmart, ,, but, trader, joe, ’, s"
1426,"actually, ,, naturopaths, interns, i, deal, with, at, college, are, vaccinated, ."
1427,face_with_tears_of_joyrolling_on_the_floor_laughinggrinning_face_with_sweatgrinning_squinting_facebeaming_face_with_smiling_eyesgrinning_face_with_smiling_eyes
1428,"city, providence, human, resources, sent, email, this, afternoon, employees, saying, they, have, until, march, 1, get, vaccinated, or, be, "", subject, suspension, ."", original, deadline, was, jan, ., 14, ., city, workers, "", out, compliance, "", are, receiving, written, warnings, this, week, ."
1429,"you, really, believe, that, i, wore, masks, religiously, since, this, all, started, i, ', m, vaccinated, i, still, caught, covid, this, year, person_shruggingdark_skin_tone, ‍, male_sign, ️"
1430,"next, ,, this, genre, generally, ignores, people, who, *, can, ', t, *, get, vaccinated, ,, kids, under, age, 5, ., mounk, mentions, this, age, limit, passing, ,, hopefully, next, week, it, will, be, dropped, 6, months, ."
1431,"i, have, no, idea, how, i, as, teacher, can, enforce, this, ., i, have, no, idea, who, is, vaccinated, ., oh, man, ."
1432,"freedom, or, freedumb, it, is, time, people, get, vaccinated, so, we, can, lower, spread, covid, get, back, something, resembling, 2019, ."
1433,"more, interested, see, who, thr, is, referring, when, reporting, that, at, least, one, last, year, ', s, acting, winners, still, isn, ', t, vaccinated, it, ', s, not, hopkins, it, ', s, not, youn, ,, it, ', s, very, likely, not, mcdormand, given, she, attended, nyff, that, had, vaccine, requirement, ."
1434,if
1435,"this, would, be, so, awesome"
1436,"i, ', m, maserati, person, like, it, not, sorry"
1437,"yeah, its, guns, ak15, really, you, need, be, trained, insurance, background, checks, mental, check, its, not, that, hard, or, is, it, too, much, work"
1438,"it, thrives, vaccinated, people, ."
1439,"jay, white"
1440,"let, ’, s, see, …, for, one, :, there, is, data, support, that, whether, you, are, vaccinated, or, not, you, can, still, get, spread, covid, ., so, ,, passports, are, pointless, ."
1441,"1st, time, i, ', ve, heard, about, this, grift, ., if, it, had, been, biden, or, obama, staffer, ,, we, ', d, never, have, heard, end, it, conspired, with, paul, manafort, trade, risky, bank, loans, post, trump, administration, ."
1442,"“, so, ”, lol, great, answer, pcr, tests, ain, ’, t, cheap, having, quarantine, after, vacation, missing, more, work, isn, ’, t, viable, lot, people, ., 90, %, canadians, are, vaccinated, you, ’, re, making, no, sense"
1443,"thing, is, …, nothing, *, is, *, closed, only, thing, ppl, are, being, asked, do, is, wear, masks, &, amp, ;, get, vaccinated, ., &, amp, ;, even, that, ’, s, being, done, pretty, half, -, heartedly, ."
1444,"currently, binge, youtube, videos, about, people, who, go, missing, national, parks, ., i, don, ', t, know, how, describe, how, i, feel, about, it, ."
1445,"it, will, cost, just, under, $, 14, ,, 000, month, rapid, test, any, employees, that, cannot, or, will, not, get, vaccinated, against, covid, -, 19, ., #, kamloops"
1446,"you, support, #, flutruxclan, your, probably, no, vaccinated, ., sooo, every, doctor, scientist, can, tell, you, until, their, blue, face, that, vaccine, works, you, still, wouldn, ’, t, get, vaccinated, oh, wait, you, aren, ’, t, vaccinated, there, stands, my, point, ."
1447,"probably, only, 2, %, them, aren, ', t, vaccinated, ."
1448,"miso, -, stupid, ...."
1449,"interestingly, neither, them, have, any, ethics, ."
1450,"yes, i, was, vaccinated, but, it, was, bad, i, was, just, tired, that, ’, s, all"
1451,"why, don, ’, t, you, take, this, opportunity, ask, your, constituents, ,, bc, liberals, generally, ,, go, get, vaccinated, so, they, can, avoid, hospital, if, they, test, positive, i, hope, you, ’, re, well, soon, ."
1452,"i, am, retired, senior, 3x, vaccinated, ., i, am, grown, up, that, has, seen, world, over, 6, decades, ., i, don, ’, t, need, anyone, including, ndp, &, amp, ;, unions, telling, me, what, i, need, do, live, stay, safe, ., why, do, you, think, you, have, right, tell, me, what, do, i, will, wait, your, reply, ."
1453,"cdc, recommends, even, vaccinated, people, wear, masks, indoors, areas, high, community, transmission, ,, which, at, moment, is, basically, entire, us, ., only, at, such, time, as, that, changes, will, it, be, necessary, grapple, with, number, flat, -, out, -, bare, -, faced, liars, this, country, ."
1454,"well, tell, that, your, american, masters, ., you, still, need, be, vaccinated, cross, usa, border, ., go, protest, washington, ."
1455,"jericho, said, attitude, adjustment, ., it, ', s, john, cena, #, aew"
1456,"omicron, pushes, up, australia, ’, s, overall, death, rate, first, time, pandemic, ..., and, 80, %, are, fully, vaccinated, thinking_face"
1457,"ngl, as, soon, as, earthbound, popped, up, i, thought, you, how, happy, you, would, be"
1458,"i, prefer, that, my, doctor, is, vaccinated, ,, which, she, is, ."
1459,"nope, he, was"
1460,"i, think, politicians, many, people, are, surrendering, covid, antieverythings, ., at, this, point, willing, write, off, unvaxxed, vaccinated, vulnerables, peace, ., at, least, until, next, deadly, mutation, we, start, over, again, step, one, ."
1461,"all, vaccinations, ,, fact, as, kid, vaccinated, polio, ,, guess, what, i, never, fuckking, ever, got, polio, ., covid19, jab, doesn, ’, t, work, ha, #, suckers"
1462,"i, keep, wanting, call, him, lukas, brioschi, ., #, winterolympics"
1463,"fox, news, is, getting, crushed, by, there, ignorance, about, covid, ., they, are, mandating, people, be, vaccinated, before, they, can, enter, fox, host, show, ., they, are, spewing, out, false, information, about, covid, while, telling, there, listen, not, take, covid, vaccine, ."
1464,"any, parent, who, makes, decision, get, vaccinated, because, i, governors, pushing, mask, is, nutcase, ., if, you, want, your, kids, vaccinated, make, decision, about, vaccine, nothing, do, with, mask, ., make, informed, decision, not, one, that, is, pressured, stop, masks"
1465,"is, this, cheap, though, two, years, ago, ., i, ', ve, been, comparing, prices, new, hvac, including, duct, work, ., my, buddy, out, ca, paid, less, his, duct, work, than, i, ', m, getting, bids, mine, fl, my, house, is, way, smaller, ."
1466,"you, have, be, fully, vaccinated, take, test, when, you, get, there, ."
1467,"it, was, reported, they, were, set, ,, with, along, with, jamie, fox, &, amp, ;, alfred, molina, ., if, i, remember, that, ', s, when, director, mentioned, multiverse, ., not, confirming, or, denying, who, may, or, may, not, be, movie, ."
1468,"lol, this, tesla, /, boring, tweet, makes, simpsons, ', "", monorail, "", episode, look, like, masterpiece, urban, planning"
1469,"why, not, give, our, kids, another, month, get, vaccinated, before, removing, masking, requirements, ., is, it, too, much, ask, ."
1470,"it, ’, s, good, question, ., i, guess, red, grange, wasn, ’, t, red, head"
1471,"right, ,, fox, news, requires, their, employees, get, vaccinated, but, they, don, ’, t, seem, be, complaining, about, or, even, mentioning, that, person_shrugginglight_skin_tone, ‍, male_sign, ️, fact, ,, live, tapknfs, greg, gutfeld, ’, s, fox, news, show, will, require, proof, vaccine, or, negative, test, :"
1472,"it, ', s, so, insane, ., there, ', s, not, enough, sound, world, contain, rage, scream, i, have, how, this, country, has, "", moved, on, "", &, amp, ;, forgotten, parents, -, especially, those, young, kids, who, cannot, get, vaccinated, yet, ."
1473,"that, ’, s, not, why, they, ’, re, removing, passports, ., it, ’, s, because, they, ’, re, completely, unnecessary, ., i, am, vaccinated, but, never, wanted, be, ., i, was, compelled, by, my, employer, coerced, by, my, government, ., that, ’, s, not, freedom, choice, which, is, all, i, truly, want, advocate, for, ."
1474,"we, begin, with, lukas, britschgi, --, is, that, how, he, spells, it, --, skating, song, whose, lyrics, include, phrase, "", ain, ', t, got, shit, me, ."", at, 8, :, 40, pm, et, #, winterolympics"
1475,"but, when, he, was, president, is, president, he, gets, choose, what, ’, s, classified, or, not"
1476,"probably, similar, vaccinated, members, congress, telling, their, constituents, not, get, vaccinated, ., people, are, stupid, ."
1477,"ohhh, that, ., i, ’, ve, only, been, served, by, vaccinated, health, pros, …, so, didn, ’, t, even, realize, it, ’, s, issue, ."
1478,"i, know, it, conflicts, with, your, pose, as, immunologist, that, you, don, ', t, know, how, viruses, vaccines, work, why, it, ', s, important, as, many, people, as, possible, be, vaccinated, ."
1479,"2, /, 3, kids, boone, are, vaccinated, that, ', s, honestly, incredible, when, under, 50, %, adults, are"
1480,"snoop, is, magical"
1481,"james, baldwin, was, strong, influence, me, when, i, was, college, 1963, -, 1967, ., he, opened, my, eyes, ideas, that, i, would, never, have, learned, milieu, which, i, was, raised, ., i, just, wish, he, had, given, up, smoking, those, damn, chesterfield, cigarettes, sooner, he, might, have, lived, longer, ."
1482,"science, don, ’, t, care, about, her, feelings, ., facts, are, everyone, can, catch, virus, vaccinated, or, not, ., passport, was, initially, used, stop, transmission, ., there, is, no, reason, keep, it, ."
1483,"terrian170, novak, djokovic, enters, indian, wells, tournament, indication, he, may, be, fully, vaccinated, he, has, lied, before, ,, maybe, he, will, again, ."
1484,"keeping, my, mask, face_with_medical_mask, my, face, because, i, no, play, politics, my, health, my, life, those, love, red_heart, ️, human, no, human, those, my, community, care, about, especially, because, those, people, ’, s, no, care, themself, others, no, we, ’, re, mask, face_with_medical_mask, no, vaccinated, syringe, keep, my, mask, face_with_medical_mask, all, kinds, virus, microbe"
1485,"donald, jared, sold, classified, info, whoever, would, buy, it, ."
1486,"as, long, as, you, still, need, e, vaccinated, fly, ,, they, can, drop, rest, this, ., i, just, traveled, no, one, even, asked, our, pre, arrival, test, ., waste, time, airports, etc"
1487,"“, as, country, deals, with, shortage, truckers, high, demand, movement, goods, ,, trudeau, is, using, issue, get, average, canadians, angry, at, truck, drivers, who, won, ’, t, get, vaccinated, those, who, support, them, .”"
1488,"australia, has, announced, reopening, its, borders, vaccinated, tourists, other, visa, holders, first, #, breakingnews, #, coronaviruslockdownmeasures"
1489,"my, young, adult, son, was, diagnosed, with, #, functionalneurologicaldisorder, 4, +, years, ago, told, his, daily, seizures, paralysis, his, legs, would, go, away, with, cbt, if, he, just, trys, hard, enough, ., nope, ,, still, has, symptoms, ., daily, ., #, fndisabullshitdiagnosis"
1490,"let, ', s, take, nyc, ,, place, with, one, more, aggressive, vaccine, mandates, ,, mask, mandates, ,, other, things, that, mounk, seems, oppose, ., only, 76, %, eligible, population, has, been, fully, vaccinated, ., other, words, ,, 1, 4, eligible, new, yorkers, is, not, fully, vaccinated"
1491,"yeah, ,, right, ., i, bet, it, ', s, same, study, that, called, this, hoax, ,, vaccine, ., while, people, are, still, getting, covid, ,, even, after, being, fully, vaccinated, ., #, endallmandates, #, freedomconvoycanada2022, #, truckersforfreedomconvoy2022, #, trudeauextremist"
1492,"all, people, jumping, joy, at, what, they, call, mass, exodus, people, blue, states, their, red, state, have, rude, awakening, when, everything, they, pay, goes, up, because, demand, it, goes, up, because, there, ', s, more, people, living, there, ."
1493,"speaking, as, someone, who, only, finished, earthbound, first, time, like, year, or, two, ago, myself, ,, i, strongly, second, this, ., ebb, /, mother, 1, has, not, aged, nearly, as, well, as, earthbound, with, it, ', s, insanely, high, encounter, rate, haphazardly, designed, world, /, area, layout, ., total, clusterfudge, ."
1494,"bless, her, red_heart, ️"
1495,"what, about, safety, these, kids, who, might, have, not, been, vaccinated, do, they, not, matter"
1496,"course, ,, it, may, even, be, man, -, made, ., but, definitely, real, ., lost, few, friends, ,, almost, lost, few, more, ,, few, family, too, ., this, is, close, worst, we, ', ve, ever, seen, u, ., s, ., is, 60th, vaccinated, rate, so, it, won, ', t, end, anytime, soon, sadly, ., i, actually, think, our, gov, ', t, downplaying, it, markets"
1497,"yes, ., we, got, both, state, federal, test, kits, ."
1498,"i, learned, that, donovan, carrillo, is, originally, another, mexican, city, he, only, moved, leon, train, ,, but, i, thought, how, much, town, like, painesville, could, get, behind, him, representing, leon, ,, i, said, myself, "", oh, no, ,, guadalajara, won, ', t, do, ."", #, winterolympics"
1499,"my, kids, wear, kf95s, didn, ’, t, return, person, until, they, were, vaccinated, ., i, kept, them, home, ., i, have, read, lots, studies, ,, got, best, quality, mask, available, their, size, ."
1500,"no, ,, vaccines, work, those, who, need, it, ., if, you, ', re, old, ,, fat, or, immune, -, comprimised, then, you, definitely, should, have, gotten, vaccinated, ."
1501,"there, are, tropical, birds, with, higher, iqs, ., how, does, one, ignore, that, 90, %, adults, are, vaccinated, ,, while, troglodytes, hijack, nation"
1502,"here, ', s, case, data, bc, ., omicron, clearly, spreading, same, if, not, faster, among, vaccinated, with, sharper, increase, higher, peak, ., how, did, vaccines, stop, spread, last, wave"
1503,"lunatics, have, escaped, asylum, ."
1504,"are, you, gonna, tell, chuck, norris, he, isn, ’, t, winking_facewinking_face"
1505,"i, think, they, might, regret, it, because, what, ’, s, difference, ., this, is, same, as, before, we, had, vaccines, …, except, now, if, you, ’, re, vaccinated, you, ’, re, protected, ., i, ’, m, vaccinated, by, way"
1506,"no, ,, i, trust, my, dr, ,, i, listen, people, my, community, who, know, more, about, science, than, i, do, ,, i, respect, my, neighbors, &, amp, ;, family, mem, who, are, at, risk, ., i, got, vaccinated, ,, along, with, millions, others, help, us, prevent, this, virus, mutating, destroying, more, lives, ."
1507,deaders
1508,"where, face_with_tears_of_joy"
1509,"are, people, vaccinated, i, still, only, have, one, dosedowncast_face_with_sweat"
1510,"again, ,, thats, not, happening, ., maybe, march, 2021, before, they, could, be, vaccinated, there, was, avoiding, touch, ,, but, not, now, ."
1511,"james, ', dad, should, be, elequis, but, it, ', s, $, 650, /, mo, ., that, ', s, with, insurance, ., no, generic, out, yet, ., face_with_symbols_on_mouth"
1512,"#, mytwitteranniversary"
1513,"translation, :, he, is, fully, vaccinated, but, he, has, politics, play, ."
1514,"wearing, mask, ,, getting, vaccinated, is, nowhere, near, imposition, as, what, non, -, essential, truckers, ,, supporters, ,, have, been, putting, fellow, canadians, through, ."
1515,"indictment, education, system, this, country, ., makes, me, cringe, watch, them, ."
1516,"some, you, really, have, follow, black, people, know, which, actors, are, or, aren, ', t, vaccinated, ."
1517,"i, don, ', t, believe, any, accounts, pretending, be, vaxxed, but, against, mandates, mandates, do, not, affect, any, vaccinated, person"
1518,"it, was, t, ***, p, who, locked, down, country, after, he, ignored, trump, virus, ., i, have, health, issues, related, agent, orange, exposure, &, amp, ;, am, thrice, vaccinated, ., is, it, your, basic, right, infect, me, with, communicable, disease, being, responsible, citizen, during, health, crisis, is, tyranny"
1519,"it, ’, s, time, heal, move, covid, ., repair, those, relationships, with, family, friends, start, living, again, ., we, will, not, be, divided, anymore, vaccinated, or, not, ., it, ’, s, over, ., #, endthemandates, #, truckersforfreedom2022"
1520,"becker, is, good, call"
1521,"right, …., more, than, 6, billion, doses, ,, 4, billion, people, worldwide, vaccinated, ., btw, ,, when, was, last, time, you, had, polio, .."
1522,"my, first, thought, was, “, oh, ,, this, music, was, tales, vesperia, ., this, is, game, that, music, was, ”"
1523,"unfortunately, ,, there, are, doctors, who, are, too, busy, or, just, don, ', t, care, enough, learn, much, after, medical, school, ., ask, anyone, medicaid, since, they, ', ve, probably, been, forced, see, them, ., thankfully, ,, many, doctors, do, care, make, effort, post, -, graduation, ., thanks, all, who, do, :"
1524,"no, they, can, ', t, &, amp, ;, they, won, ', t, even, entertain, such, utter, nonsensical, thought, ., science, says, only, thing, that, anybody, ever, has, do, is, get, vaccinated, ,, with, no, debate, ."
1525,"it, does, encourage, many, get, fully, vaccinated, ., sadly, ,, some, are, misguided, refuse, due, large, disinformation, efforts, funded, by, enemies, west, ."
1526,"i, ’, m, fully, vaccinated"
1527,"i, ', m, really, tired, all, his, rediculous, criminal, actions, ., this, guy, is, time, bomb, ."
1528,"wearing, mask, ,, getting, vaccinated, showing, little, piece, paper, that, you, have, been, ,, keeping, two, meters, away, each, other, remember, glory, holes, what, is, so, freedom, constricting, about, that"
1529,"#, marjorietaylorgreene, is, just, trying, prove, she, ’, s, dumber, than, #, laurenboebert, #, louisgohmert, ."
1530,"#, teddygoebbels"
