,0
3613,"yes, ., i, ', ve, had, covid, twice, ., first, time, was, pre, -, vaccine, ., it, was, horrible, ., thought, i, was, going, die, ., seriously, ill, over, two, months, ., second, time, was, post, vaccine, ., slight, flu, like, symptoms, ,, over, with, few, days, ., get, vaccinated"
3614,"carrots, wtf"
3615,"no, ,, that, ’, s, what, october, 2020, definition, vaccines, do, ,, it, amazes, me, that, people, seem, forget, original, reason, lockdowns, as, mitigate, spread, until, vaccine, can, be, made, ., do, you, not, remember, how, they, originally, touted, that, vaccinated, can, ’, t, spread, covid"
3616,"#, nomoremandates, #, bcpoli, anyone, know, why, minister, dix, no, longer, provides, these, reports, how, are, those, fully, vaccinated, folks, doing, #, defundthecbc"
3617,"lol, person, heading, up, press, conference, today, is, vaccinated, ., atleastyoutried, ., gif"
3618,"estimates, say, 85, %+, canadian, truckers, are, fully, vaccinated, ., american, truckers, ,, by, contrast, ,, are, only, about, 50, -, 60, %, vaccinated, ., every, actual, rigs, that, turns, out, you, multiply, physical, impact, any, protest, /, occupation, significantly, —, doubly, so, if, they, have, trailers, ."
3619,"thank, you, putting, face, damage, #, longcovid, can, do, someone, ., hopefully, your, suffering, will, go, long, way, convince, others, get, vaccinated, ., #, gazpachopolice"
3620,"oh, that, ’, s, hard, question, ,, vicki, ., i, ’, m, 3x, vaccinated, i, wear, my, mask, ."
3621,"why, do, we, allow, americans, who, aren, ’, t, vaccinated, utilize, socialist, healthcare"
3622,"it, is, not, coincidence, that, rep, is, ending, people, decide, they, don, ', t, need, be, vaccinated, anymore, #, thankskenney"
3623,"you, mean, like, radical, right, wing, gop"
3624,"i, ', ve, had, several, friends, pass, it, ., it, ', s, difficult, get, closure, with, "", celebrations, life, "", after, fact, ."
3625,"what, ', s, blocking, canada, exiting, pandemic, is, partisan, politics, ,, not, covid, -, recovered, persons, with, medical, exemptions, who, cannot, be, vaccinated"
3626,"wednesday, ,, statewide, hospitalizations, were, reported, down, at, 1234, ., 642, fully, vaccinated, sars, -, cov, -, 2, +, persons, were, hospitalized, ., #, westernma, ,, non, -, icu, bed, availability, was, essentially, flat, at, 13, %., icu, bed, availability, rose, just, over, 42, %, 41, %."
3627,"oh, no, ,, sending, best, wishes, your, way, ., folded_handsmedium, -, light_skin_tonefolded_handsmedium, -, light_skin_tonefolded_handsmedium, -, light_skin_tone"
3628,"well, duh, course, he, did, ., scoundrel, ."
3629,"i, ', m, triple, vaccinated, ., i, wear, mask, everywhere, ., i, don, ', t, care, if, you, vaccinate, or, mask, or, die, ., literally, no, effect, me, ."
3630,"thank, god, madness, needs, stop, ., it, is, really, ,, truly, too, much, ., we, are, 90, %, vaccinated, ., leave, is, our, kids, alone"
3631,"i, ’, m, 70, ., i, don, ’, t, have, any, choice, ., i, thought, vax, would, take, care, my, having, mask, ,, but, after, lowlifes, that, wouldn, ’, t, get, vaccinated, ,, i, ’, m, still, at, higher, risk, probably, will, have, mask, foreseeable, future, ., freedom, i, lost, mine, ."
3632,"no, ., annoying, but, not, funny"
3633,"looks, like, colbeck, ’, s, supporters, couldn, ’, t, make, bail, ,, or, their, mom, couldn, ’, t, drive, them, capitol, yesterday, ."
3634,"i, believe, that, children, who, are, vaccinated, should, still, social, distance, not, wear, mask, inside, classroom"
3635,"i, ', ll, believe, that, when, i, see, /, hear, it, ., but, ,, we, know, that, will, change, at, drop, hat"
3636,"thank, you, everyone, #, saanich, across, #, bc, who, has, done, their, part, protect, their, loved, ones, our, communities, by, getting, vaccinated, ."
3637,"not, until, vaccine, percentage, goes, up, ,, get, vaccinated, people"
3638,"while, i, would, have, preferred, they, not, try, go, out, ..., asking, cat, not, be, curious, is, folly, ,, i, was, intensely, proud, that, they, all, actually, listened, ."
3639,"im, tuck, driver, is, not, vaccinated, without, trucks, you, have, nothing"
3640,"i, started, getting, vaccinated, childhood, so, i, ', m, used, that, ., mask, keeps, me, warm, cold, /, flu, free, winter, keeps, allergies, at, bay, summer, ., neither, bother, me, ., privileged, entitled, idiots, are, far, more, aggravating, ."
3641,"astonished, at, some, who, first, ,, signed, originally, and, ., second, ,, didn, ’, t, remove, ., you, are, right, predators, are, generally, known, ,, particularly, by, female, faculty, ."
3642,"his, very, own, "", daddy, "",, play, with, all, time, ..."
3643,"no, ,, actually, that, ', s, not, what, cdc, said, ., see, this, is, huge, part, problem, ., cdc, may, 2021, :, fully, vaccinated, people, can, go, without, masks, most, situations, ., there, are, exceptions, :, crowded, outdoor, spaces, ,, indoor, spaces, where, not, everyone, is, vaccinated, ,, etc, ."
3644,"with, sky, hook"
3645,"one, dearest, people, my, life, has, sever, auto, immune, disease, thus, can, not, be, vaccinated, ., i, worry, her, all, time, ."
3646,"i, saw, clip, earlier, ."
3647,"as, more, get, #, vaccinated, ,, will, it, change, how, people, save, money, ,, fear, job, loss, ,, stockpile, food, will, opinions, change, about, how, long, #, covid19, outbreak, will, last, find, out, our, consumer, survey, weekly, updates, ."
3648,"everyone, who, attends, our, rehearsals, ,, whether, they, are, singing, member, ,, non, -, singing, volunteer, ,, bgmc, staff, member, ,, musician, ,, or, sound, technician, needs, be, fully, vaccinated, &, amp, ;, boosted, covid, -, 19, ."
3649,"my, uncle, is, still, dead, too, ., he, had, freedom, choice, not, get, vaccinated, ., death, covid, was, his, consequence, that, choice, ., disappointed_face"
3650,"we, begged, family, members, nc, get, vaccinated, no, avail, now, one, has, been, hospitalized, with, covid, face_with_symbols_on_mouth, ., play, stupid, games, ……., you, get, covid"
3651,"vaccines, help, keep, you, getting, spreading, virus, that, causes, covid, -, 19, ., they, also, help, keep, you, getting, seriously, ill, ., even, if, you, do, get, covid, -, 19, ,, data, shows, that, those, who, aren, ’, t, fully, vaccinated, are, 12x, more, likely, end, up, hospital, ."
3652,"Even, the, treatment, of, the, same, human, tooth, tooth, is, deep, !"
3653,"some, folks, have, already, incorporated, it, their, twitter, name, &, amp, ;, biogrinning_squinting_face"
3654,"be, better, at, reading, ., vaccinated, with, covid, have, same, likelihood, long, covid, symptoms, as, people, without, covid, infection, essentially, ,, control, group, ."
3655,"we, invite, you, join, us, february, 23, ,, get, vaccinated, against, covid, -, 19, at, ., appointments, are, not, necessary, ,, vaccines, will, be, available, first, come, ,, first, served, basis, 2, p, ., m, ., 5, p, ., m, ., ⠀"
3656,"not, sure, why, they, would, not, want, their, loved, one, memorialized, and, /, or, remembered, ."
3657,"but, course, ,, let, ’, s, drop, masks, school, children, too, young, get, vaccinated, exploding_head"
3658,"implicit, disinformation, this, letter, ., fails, acknowledge, that, most, against, mandates, are, vaccinated, ., though, many, aren, ', t, happy, about, being, coerced, into, doing, so"
3659,"couldn, ', t, have, been, because, being, freshly, vaccinated, pro, athlete, doing, his, thing, ,, is, bad, idea, begin, with"
3660,"finger, crossed, more, lifting, travel, exemptionscrossed_fingerslight_skin_tone, australia, reopens, fully, vaccinated, tourists, quarantine, free, entry, ., alberta, has, ended, vaccine, passport, program, #, letsgotravel, #, westartravel, #, travelexemption, #, westaradvisor"
3661,"2, /, 5, oct, 20, -, if, 95, %, people, wore, masks, ,, 100, ,, 000, lives, would, be, saved, jan, 20, ,, 2021, -, biden, signs, exec, order, wear, masks, fed, prop, jan, 21, -, biden, signs, 10, exec, orders, regarding, masks, jan, 30, -, cdc, follows, biden, ’, s, orders, mar, 8, -, cdc, -, fully, vaccinated, can, go, maskless, indoors, ,, not, outdoors"
3662,"if, you, ', re, going, try, be, leader, pinocchio, party, ,, you, need, tell, some, real, whoppers, overcome, #, 1, liar, ."
3663,"wrote, mp, scott, aitchison, about, convoy, ., his, take, is, canada, has, never, been, so, divided, ,, trudeau, ’, s, fault, ., i, reminded, him, ,, canada, is, not, divided, ., more, vaccinated, &, amp, ;, most, following, mandates, ., #, truckersgohome"
3664,"living, different, world, ., more, people, are, vaccinated, won, ’, t, get, seriously, ill, ., i, know, you, like, taking, shots, but, come"
3665,"they, should, have, gotten, vaccinated, then, ."
3666,"raising_hands, it, always, has, been"
3667,"when, are, people, going, catch, that, this, thing, is, not, going, away, ., we, are, too, spoiled, bratty, make, sacrifices, eliminate, it, ., having, fun, dying, is, more, fun, than, getting, vaccinated, ,, wearing, masks, staying, home, ."
3668,aaa
3669,"yes, ,, if, i, ’, m, indoors, where, people, are, not, verified, vaccinated, ., example, ;, grocery, store, ."
3670,"folded_handsmedium, -, dark_skin_toneblue_heartbeating_heart, nicolle, ,, so, very, sorry, hear, this, ., thankful, you, are, vaccinated, &, amp, ;, we, hope, you, only, have, endure, minor, ills, ., sending, you, extra, lpurple_heartve, &, amp, ;, hpeople_hugginggs, courtesy, leslie, your, swift, &, amp, ;, full, recovery, ., be, well, soon, ., xoxo"
3671,"what, do, you, want, talk, about, it, here, there, has, been, 300, %, increase, miscarriages, cancer, ,, 1000, %, increase, neurological, issues, eg, ,, pilots, ,, 71, %, new, cases, are, vaccinated, &, amp, ;, 60, %, hospitalized, are, vaccinated, also, ."
3672,"remember, this, :, every, single, person, who, got, vaccinated, is, og, member, *, real, *, freedom, convoy, ."
3673,"cdn, truck, protests, are, not, about, vaccine, mandates, -, that, is, nothing, more, than, convenient, pretext, as, cdn, truckers, are, vaccinated, at, ~, 90, %., blockades, are, about, undermining, federal, provincial, governments, particular, &, amp, ;, western, democracy, general, ."
3674,"rt, :, it, ', s, more, important, now, than, ever, get, vaccinated, ., it, ', s, about, more, than, just, protecting, yourself, virus, ., it, ', s, about, protecting, your, kids, ,, your, neighbors, ,, your, parents, ,, your, friends, &, amp, ;, your, elders, ., contact, your, local, health, unit, appt, booking, details, ."
3675,"oh, ,, thank, you, so, much"
3676,"minute, levity, during, occupation, ..."
3677,"85, %, freedom, truckers, are, vaccinated, ,, 90, %, canadian, people, protesting, mandates, are, too, ,, so, your, point, is, actually, just, go, practice, your, algebra, winking_face_with_tongue"
3678,"every, dr, ., i, know, except, 1, is, fully, vaccinated, ., this, includes, immunologist, ,, infectious, disease, specialist, ,, cardiologist, ,, few, virologist, ., maybe, you, ', re, right, they, are, all, wrong, weirder, things, have, happened, i, guess, person_shrugging, ‍, male_sign, ️"
3679,"everyone, else, is, doing, well, ,, thankfully, ., i, cannot, stress, this, enough, ., wear, your, masks, ,, especially, if, you, won, ’, t, get, vaccinated, ., but, love, all, things, new, girl, ,, if, you, can, ,, get, vaccinated, ., 3, /, 4"
3680,"How, do, you, answer, one, Chinese, character, ?, rolling_on_the_floor_laughing, rolling_on_the_floor_laughing, rolling_on_the_floor_laughing"
3681,"body, autonomy, does, not, including, being, goddamn, plague, bearer, ., im, truck, driver, ,, i, got, vaccinated, asap, ,, because, i, literally, travel, thousands, miles, week, ,, could, potentially, both, get, exposed, all, over, damn, place, ,, or, spread, it, all, over, ., neither, is, acceptable, ."
3682,"what, about, polio, ,, smallpox, ,, mmr, ,, even, flu, ask, him, about, those, ., ask, if, his, kids, are, vaccinated, against, anything"
3683,"very, wrong, interpretation, ., vaccinated, are, not, ', out, empathy, ',, they, are, wise, enough, know, those, who, want, be, vaccinated, are, those, who, believe, they, are, strong, enough, not, be, are, not, ., this, does, not, stop, virus, ., follow, science, ., -, via"
3684,"i, posted, this, august, 27th, it, almost, has, 70, likes, .., i, only, have, one, question, ., why"
3685,"super, ironic, you, think, that, ,, since, it, ’, s, not, little, group, and, ,, like, you, said, ,, most, them, are, vaccinated, ., because, issue, they, have, is, with, mandates, ."
3686,"yes, ., not, enough, people, are, vaccinated, boosted, ., wearing, mask, has, meant, no, allergies, two, years, ."
3687,"i, ', m, thinking, how, much, time, some, residents, aged, care, have, given, up, due, lnp, ., vote, morrison, out, ."
3688,"your, clueless, ., many, nations, ,, brazil, one, ,, countries, asia, africa, ,, require, you, get, vaccinated, many, things, ,, like, yellow, fever, one, ,, you, don, ’, t, get, your, shots, your, not, getting"
3689,"apology, ain, ', t, gonna, cut, it, ,, hal, ., you, put, your, hands, congresswoman, ,, black, woman, ,, because, she, asked, you, adhere, rules, ., you, told, your, equal, though, you, probably, don, ', t, see, it, that, way, "", kiss, my, ass, ."", how, professional, ., it, ', s, disgusting, ,, you, should, be, removed, ."
3690,rolling_on_the_floor_laughingface_with_tears_of_joyrolling_on_the_floor_laughing
3691,"there, are, many, perfectly, healthy, workers, out, work, ,, families, struggling, pay, bills, buy, food, ,, who, chose, not, be, vaccinated, as, it, ’, s, their, legal, right, ., please, respect, that, ."
3692,"verified, member, gazpacho"
3693,"probably, not, grinning_face_with_smiling_eyes, they, do, have, taste, their, own, ., i, grew, up, eating, them, so, .., old, habit, /, old, friend, ., just, mashed, with, carrot, add, little, sweetness, with, pork, knuckle, or, some, like, it, ., face_savoring_food"
3694,"ick, ,, amazon, ., definitely, last, resort, ."
3695,"document, her, symptoms, detail, let, your, vet, know, ,, as, he, can, write, you, letter, excusing, your, cat, any, further, vaccines, if, there, is, concern, ., i, had, one, cat, almost, die, vaccine, two, that, vomited, had, diarrhea, full, day, ;, none, them, were, vaccinated, again, ."
3696,"so, ..., naloxone, opioid, overdose, problem, marsha, helped, create, with, her, craptacular, 2016, bill, weakening, dea, opioid, enforcement, now, she, doesn, ', t, want, this, accessible, vending, machines, ,, so, addicts, she, created, can, just, die, #, republicansareprodeath"
3697,"would, i, want, medical, professional, who, knew, they, were, sick, still, decided, go, work, treating, me, ,, no, ., but, that, has, nothing, do, with, being, vaccinated, if, they, are, vaccinated, they, can, still, catch, spread, covid, ., if, anything, you, are, less, likely, realize, you, have, it, ."
3698,"at, least, until, numbers, come, down, below, 5, %, case, rate, maybe, longer, ., we, haven, ’, t, had, mask, mandates, florida, while, ., i, ’, m, three, times, vaccinated, still, wearing, my, mask, everywhere, not, eating, inside, restaurants, ."
3699,"gop, :, illegals, are, coming, across, border, not, vaccinated, ., biden, doesn, ', t, care, also, gop, :, we, support, truckers, not, vaccinated, coming, across, border, ."
3700,"i, ’, m, beginning, really, ‘, dislike, ’, #, davechappelle"
3701,"we, ', d, have, just, gotten, different, figurehead, they, could, guide, around, if, not, him, ."
3702,"see, ,, first, you, have, ice, fishing, ., which, obviously, leads, ice, shanties, ,, then, obvious, conclusion, is, therefore, prostitution, ."
3703,"nah, still, gotta, be, vaccinated, barclays, center"
3704,"could, just, stop, treating, anti, -, vaxxers, ,, or, at, least, make, announcements, telling, them, they, will, not, be, prioritized, at, hospital, if, they, ', re, sick, with, covid, refused, get, vaccinated, deter, them, coming, ."
3705,"lol, so, decades, ,, you, couldn, ’, t, “, leave, canada, ”, go, say, ,, brazil, without, getting, vaccinated, certain, things, ,, so, your, “, freedom, ”, was, infringed, ppl, like, you, don, ’, t, even, know, what, that, means"
3706,"my, daughters, furby, did, same"
3707,"next, generations, are, far, more, emotionally, attached, aware, ., it, ', s, good, thing, may, actually, drive, changed, future, ., don, ', t, have, capacity, compartmentalize, emotion, cast, it, off, ., they, deal, with, it, head, on, ., it, ', s, far, healthier, ."
3708,"i, ', ve, never, understood, this, mentality, getting, rid, things, that, lowered, infection, ..., before, infections, are, close, gone, ., but, as, transplant, recipient, with, no, immune, system, ,, thank, you, all, hcw, those, who, got, vaccinated, wore, their, masks, ., you, are, our, best, defense, ."
3709,"sure, you, wife, works, hospital, my, husband, is, doctor, ., you, want, go, maskless, go, ahead, ., no, skin, off, my, back, i, won, ', t, get, covid, because, i, wear, mask, am, vaccinated, ., i, have, be, careful, what, i, wish, because, i, don, ', t, want, get, suspended, ., so, enough, said, ."
3710,"canada, is, very, much, experiencing, pandemic, fully, vaccinated, fully, vaxxed, are, just, weeks, away, developing, acquired, immunodeficiency, syndrome"
3711,"my, way, get, vaccinated, ."
3712,"o, -, o, ò, -, ó"
3713,"i, was, ok, couple, weeks, ,, or, until, they, were, vaccinated, ."
3714,"vaccinated, or, unvax, ,, work, healthy, immune, system, healthy, weight, ., covid, is, still, deadly, ,, 4th, person, i, knew, who, died, covid, this, last, weekend, ."
3715,"amazing, ,, pat, kkkings, kids, got, vaccinated, ., face_with_tears_of_joy, #, freedomconvoycanada2022, #, freedomconvoy, #, trudeaumustresign, #, truckersconvoy2022, #, truckersconvoy2022"
3716,"imagine, .."
3717,"this, is, so, disturbing"
3718,winner
3719,"like, you, know, sure, i, mean, so, many, these, studies, are, turning, out, inaccurate, ., let, ’, s, give, it, some, time, see, how, it, pans, out, ., i, do, know, they, want, us, all, vaccinated, have, lied, get, us, vaccinated, ., remember, when, they, said, you, couldn, ’, t, pass, it, if, you, were, vaccinated"
3720,"oh, isn, ’, t, that, nice, ., not, only, is, he, fan, punching, down, at, trans, folks, ,, he, ’, s, grown, up, be, rich, nimby, fuckhead, too, ., if, you, can, ’, t, afford, $, 300k, +, house, ,, you, ’, re, not, good, enough, be, his, neighbor, ."
3721,"latest, update, covid, -, 19, :, 131, ,, 363, alexandrians, with, at, least, 1, dose, 85, ., 4, %, 5, +, pop, ., 118, ,, 247, fully, vaccinated, 76, ., 8, %, 5, +, pop, ., 54, ,, 924, boosters, positive, tests, up, 61, 28, ,, 942, 413, last, week, 7, -, day, positivity, rate, up, 11, ., 6, %, 1, new, hospitalizations"
3722,"when, littlest, ones, can, be, vaccinated, ,, we, can, read, revisit, this, biased, article, ."
3723,"there, is, no, treatment, hpv, ,, but, vaccine, can, prevent, more, than, 90, %, hpv, -, related, cancers, ever, developing, ., learn, more, about, hpv, why, it, ', s, important, preteens, get, vaccinated, ., #, hpvfreeco"
3724,"cracker, barrel, ,, once, ., enough, salt, put, one, straight, into, renal, failure"
3725,"if, you, don, ’, t, want, avoid, hospitalization, ,, sure, ., most, who, are, vaccinated, recover, at, home, few, days, ,, if, they, ever, have, any, symptoms, ., i, ’, m, happily, triple, -, vaccinated, at, will, get, any, boosters, needed, ., i, also, get, boosters, vaccinations, we, got, as, kids, ., makes, sense, ."
3726,"what, ', s, absurd, is, gop, does, not, care, how, many, kids, bring, coronavirus, home, only, have, one, their, parents, die, ., parents, they, actively, diskouraged, getting, vaccinated, ."
3727,"carly, :, but, jason, wasn, ’, t, vaccinated, #, gh, rolling_on_the_floor_laughingrolling_on_the_floor_laughingrolling_on_the_floor_laughingrolling_on_the_floor_laughingeyeseyeseyeseyes"
3728,"i, am, almost, 80, never, had, flu, shots, ,, don, ’, t, take, meds, not, vaccinated, ., i, go, out, am, fine, ., but, i, imagine, if, you, do, take, all, big, pharma, poison, you, might, have, be, careful, ., obviously, some, us, have, great, immune, systems, because, we, believe, natural, immunity, eat, healthy"
3729,"mr, ., singh, ji, ,, i, hope, you, ', re, reading, disappointment, disgust, people, that, read, your, controlled, spew, daily, ;, no, different, than, that, trudeau, controlled, media, ., what, ', s, your, message, get, vaccinated, ,, keep, your, job, &, amp, ;, stay, silent, well, we, all, know, that, doesn, ', t, work"
3730,"was, amazing, event, last, year, so, many, talented, musicians, so, many, styles, music, ., come, hear, why, is, best, all, #, austinfc, #, verde, #, listos, #, vhlm"
3731,"if, there, are, so, many, people, that, are, experiencing, headaches, other, health, concerns, after, being, vaccinated, ., there, are, also, some, who, are, having, issues, after, getting, covid, 19, ., unfortunately, ,, we, won, ', t, know, some, time, when, all, this, rolls, out, ,, will, we"
3732,"now, she, ’, s, ruined, gazpacho, ."
3733,"what, she, ’, s, disqualified, poor, kid, ."
3734,"thank, you, catching, my, error, ., face_screaming_in_fearflushed_face, .., i, meant, right, ..., i, ', ll, delete, that, before, everyone, calls, me, every, name, book, face_with_rolling_eyesflushed_faceunamused_facethat, will, teach, me, remember, edit, before, i, tweet, smiling_face_with_smiling_eyes"
3735,"if, child, ', s, pediatrician, feels, that, that, particular, kid, should, be, vaccinated, ,, sure, ., that, you, think, parents, who, you, don, ', t, know, &, amp, ;, will, never, meet, are, required, give, their, kid, new, drug, that, doesn, ', t, prevent, spread, disease, nope, ., that, ', s, parent, ', s, job, manage, ,, not, you, ."
3736,"going, be, hard, coming, months, as, restrictions, being, lifted, ,, stupidly, imho, ., what, ’, s, few, hundred, thousand, more, deaths, or, lifetime, disabilities, here, or, there"
3737,"taught, exercise, class, 50yr, old, hockey, player, had, covid, 2, months, ago, ., vaccinated, ., long, covid, now, ., shortness, breath, ., confusion, ., no, strength, or, endurance, ., lasted, 20, minutes, ., that, ', s, why, we, need, be, diligent, about, vaccines, masks, ., don, ', t, listen"
3738,"oh, gosh, ., really, hope, she, hasn, ', t, been, vaccinated, ., wouldn, ', t, want, lose, another, pilot, f35, ."
3739,"now, clelsea, handler, is, embarking, "", vaccinated, very, sick, "", hospital, tour, instead, ., her, sickness, ,, course, ,, has, nothing, do, with, three, covid, vax, shots, she, received, ., move, along, ,, nothing, see, here, ."
3740,"i, have, or, else, clean, up, my, vomit, ."
3741,"just, vaccinated, ones, ,, right"
3742,""", i, ', ll, have, jan, ., 3, -, 7, note, sandwich, please, """
3743,"i, canceled, attending, my, nephew, ’, s, dec, /, 21, wedding, ., result, -, all, guests, were, vaccinated, ,, many, got, covid, ., under, circumstances, ,, you, are, not, obligated, attend, ., health, is, first"
3744,"here, ', s, our, advice"
3745,"republicans, still, find, way, turn, something, into, shit, ., not, 1, happy, republican, about, these, precautions, ending, ., numbers, vaccinated, is, high, as, it, will, be, no, sense, continuing, these, precautions, ., april, will, be, real, test, ,, hopefully, we, can, have, independence, day, ."
3746,"then, i, had, minor, palpations, about, fact, that, they, *, were, *, out, there, ,, both, times, ., we, have, coyotes, locally, ., foxes, ., yes, ,, we, fixed, door, ."
3747,"have, you, looked, at, grocery, store, lately, they, ’, re, full, ., no, person, ,, despite, their, occupation, ,, is, above, law, ., protest, is, one, thing, —, but, making, it, impossible, travel, violating, noise, by, laws, days, days, end, is, quite, another, ., also, most, truckers, are, vaccinated, ."
3748,"if, i, broke, bone, my, finger, would, i, definitely, know"
3749,"i, ', m, confused, are, you, suggesting, that, we, shouldn, ', t, be, making, people, get, vaccinated"
3750,"this, is, my, advice, for, Friday, ', s, consultation, committee"
3751,"hey, chris, peyerk, you, are, real, piece, shit, ..., fcku, ."
3752,"been, huge, bengals, fan, since, 1972, ., seen, good, bad, ., would, love, attend, ,, been, vaccinated, boosted, ,, if, that, helps, ."
3753,"yeah, ., if, your, date, is, man, ,, he, has, be, vaccinated, ."
3754,"other, words, ,, wear, mask, ,, get, vaccinated, ,, social, distance, like, you, ', re, supposed, infections, will, go, down, so, restrictions, can, ease, ., keep, gathering, big, groups, without, masks, distancing, or, vaccines, will, increase, infections, more, restrictions, will, be, nesesary, ."
3755,"blah, ,, blah, ,, i, didn, ’, t, get, vaccinated, ,, i, lost, my, job, ,, dog, ran, away, ,, kids, are, crying, ,, blah, blah, …, should, have, got, vaccinated"
3756,"tests, are, not, free, you, have, spend, $, at, pharmacy, or, grocery, store, get, test, at, no, cost, so, another, words, you, pay, test, with, extra, money, that, they, charge, groceries, stop, thinking, that, we, ’, re, stupid, you, ignorant, irrelevant, man"
3757,"no, child, should, be, vaccinated, ., convid, ., scamdemic"
3758,"shit, ,, maddy, ,, i, hear, they, ', re, hiring, ., now, go, fetch, my, over, -, salted, mashed, taters, sweet, tea, ."
3759,"how, are, we, know, who, is, not, vaccinated, ., hum, san, francisco, we, have, problem, ."
3760,"not, yet, ., when, littlest, ones, can, be, vaccinated, ,, then, we, ’, ll, revisit, your, tweet, ."
3761,"you, mean, triple, vaccinated, mask, wearing, ,, most, paid, canada, teachers, those, ones, cool, cool, ."
3762,"just, watching, loki, now, ..., writing, is, not, as, good, as, hawkeye, ., some, interesting, bits, pieces, nice, production, design, ,, but, overall, story, isn, ', t, as, compelling, ., it, ', s, more, nerdy, no, "", gravitas, ."""
