,0
2517,"we, are, asking, person, participants, not, sing, now, ., our, service, leaders, ,, who, are, all, fully, vaccinated, ,, will, unmask, speak, sing, front, sanctuary, ."
2518,"then, explain, how, covid, is, more, prevalent, uae, everyone, who, is, physically, capable, being, vaccinated, is, than, pakistan, 40, %, why, hasn, ', t, covid, ended, uae, it, ', s, hilarious, you, make, all, these, claims, with, literally, zero, evidence, lmfao"
2519,"just, ordered, my, mocha, mousepad, i, know, my, daughter, ,, who, ', s, gonna, graduate, george, washington, law, ,, will, love, it, ., thanks"
2520,"don, ', t, cave"
2521,"revenge, is, soup, best, served, gazpacho"
2522,"sounds, like, officials, are, looking, guidance, masks, general, schools, last, thing, i, heard, was, 31, %, children, aren, ', t, vaccinated, other, words, 69, %, are, vaccinated, i, ', d, tell, them, when, 80, 85, %, your, children, are, vaccinated, school, masks, can, be, eliminated"
2523,"local, children, ', s, hospital, reports, that, all, three, #, nicus, are, full, infant, patients, w, /, cardiac, problems, whose, moms, got, #, vaccinated, when, pregnant, ., how, will, #, cdc, &, amp, ;, #, whitehouse, whitewash, infants, w, /, cardiac, issues, #, covid"
2524,"just, as, kids, return, february, break, …, and, before, under, 5s, can, get, vaccinated, ."
2525,"i, have, next, 4, days, off, ., what, am, i, gonna, do, ."
2526,"marco, rubio, ,, ladies, &, amp, ;, gentleman, ., face_with_tears_of_joyface_with_tears_of_joyface_with_tears_of_joy"
2527,"or, capitulation, aiding, abetting, might, be, more, accurate, though"
2528,"already, cant, go, us, if, they, aren, ’, t, vaccinated, though, but, vaccinated, ones, could, be, trouble"
2529,"over, past, 7, days, :, play_button, ︎, 272, new, vaccinations, ~, 38, ., 9, /, day, play_button, ︎, 388, now, fully, vaccinated, ~, 55, ., 4, /, day, play_button, ︎, 1, ,, 107, now, boosted, ~, 158, ., 1, /, day, this, time, last, week, :, play_button, ︎, 457, new, vaccinations, ~, 65, ., 3, /, day, play_button, ︎, 465, now, fully, vaccinated, ~, 66, ., 4, /, day, play_button, ︎, 1, ,, 768, now, boosted, ~, 252, ., 6, /, day"
2530,"syringe, vaccines, 56, ., 78, %, total, county, population, had, at, least, 1, dose, 124, ,, 449, people, —, up, 69, ., those, :, play_button, ︎, 4, ., 92, %, are, partially, vaccinated, 10, ,, 774, people, —, down, 8, play_button, ︎, 51, ., 86, %, are, fully, vaccinated, 113, ,, 675, people, —, up, 77, play_button, ︎, 24, ., 92, %, are, boosted, 54, ,, 615, people, —, up, 220"
2531,"lot, us, have, children, who, are, too, young, be, vaccinated, ,, even, if, their, risk, getting, severely, ill, is, very, low, ,, it, is, logistical, nightmare, when, they, have, quarantine, /, their, class, shuts, down, ,, etc, ., so, i, ’, m, good, with, masks, awhile"
2532,"i, also, wear, mine, when, out, most, time, ., sometimes, i, still, forget, grab, one, ., but, we, also, haven, ', t, dropped, below, high, transmission, rates, /, the, county, is, only, about, 50, %, vaccinated, ., if, i, lived, somewhere, better, about, covid, i, ', d, be, less, likely, to, ."
2533,"who, has, go, get, vaccinated, clip, i, miss, it"
2534,"can, you, shed, some, more, light, situation, ,, what, did, she, do, ,, what, was, done, her, why, can, ', t, grievance, be, filed, ., if, you, ', re, going, post, your, support, ,, it, might, be, nice, if, you, weren, ', t, so, vague, ."
2535,"hello, 5, waves, ,, last, caused, by, vaccinated, ,, country, divided, ,, justin, hiding, over, “, mean, ”, truckers, ,, working, class, blockading, borders, ,, teachers, afraid, kids, ,, politicians, fighting, their, jobs, ,, etc, ., it, ’, s, mess, ., more, people, should, be, asking, questions, imo"
2536,"early, treatments, ,, or, monoclonal, antibodies, ,, are, extremely, expensive, ,, time, consuming, administer, iv, form, ., they, also, cone, with, their, own, set, side, effects, ., just, get, vaccinated, ."
2537,"if, i, ', m, petty, mood, i, might, ,, otherwise, i, ', ll, let, things, slide, by"
2538,"vaccine, doesn, ', t, kill, anyone, unless, they, ', re, allergic, something, it, which, hasn, ', t, happened, yet, i, ', m, vaccinated, boosted, i, ', m, fine"
2539,"never, thought, myself, as, roman, catholic, ,, just, along, ride, until, i, was, old, enough, make, my, own, idea, ,, seeing, cosmos, sometimes, 80, ', s, made, my, mind, really, ,, that, all, matter, making, us, had, be, fabricated, star, was, nail, gawd, ', s, coffin"
2540,hand_with_fingers_splayedhand_with_fingers_splayedhand_with_fingers_splayedhand_with_fingers_splayed
2541,"don, ', t, be, canadian, trucker, idiot, get, vaccinated, or, get, packing, #, getvaccinated, or, get, packing"
2542,"#, gazpachopolice, …, because, revenge, is, dish, best, served, cold, ., face_with_rolling_eyesseriously, ,, how, could, anyone, ,, besides, possibly, her, next, kin, ,, vote, her, next, election, person_facepalminglight_skin_tone, ‍, male_sign, ️"
2543,"i, ’, m, #, vaxxed, i, ’, m, #, boosted, i, ’, m, #, nyc, i, ’, m, still, gonna, wear, my, #, mask, when, i, got, out, ,, get, #, mtabus, go, indoors, trader, joe, ’, s, ."
2544,"look, at, fat, pink, puppy, bellies, look, at, them"
2545,"i, cut, recipe, half, one, time, but, it, still, makes, just, ridiculous, amount, it, doesn, ', t, heat, up, well, my, humble, opinion, one, day, i, think, i, shall, just, have, half, recipe, green, bean, casserole, my, supper, :-"
2546,"not, even, three, minutes, &, amp, ;, i, have, positive, covid, test, ., 15mins, later, ,, still, very, positive, ., i, know, exactly, where, it, came, from, ., #, covid19, #, positiveforcovid"
2547,"i, ', m, vaccinated, they, are, criminals, ."
2548,"but, it, was, such, good, book, ."
2549,"you, kenney, keep, saying, how, grateful, you, are, 80, %, us, that, have, gotten, vaccinated, but, you, keep, making, rules, that, allow, other, 20, %, not, do, their, part, ., don, ’, t, demonize, them, but, at, least, have, courage, tell, them, they, need, do, more, us, all, benefit, ."
2550,"uneducated, racist, con, -, gresswoman, is, more, dangerous, our, democracy, than, dog, with, rabis, ., i, want, apologize, dogs, with, rabies, because, they, haven, ', t, been, vaccinated, ."
2551,"wait, he, ', s, already, done, that, this, channel"
2552,"i, think, all, employees, should, be, vaccinated, especially, if, they, work, with, public, i, think, nothing, is, wrong, with, that, they, don, ’, t, want, people, workplace, getting, sick, face_with_thermometer"
2553,"actually, if, i, was, trudeau, i, would, welcome, it, be, open, his, argument, ., because, repeating, message, about, getting, vaccinated, isn, ’, t, getting, through, ., new, approach, is, required, ."
2554,"i, voted, perfect, timing, this, reason, ., maybe, we, can, get, more, people, vaccinated, by, then, especially, kids, ."
2555,"that, argument, makes, absolutely, no, sense, since, bonnie, henry, ndp, barred, fully, vaccinated, theaters, gyms, but, kept, casino, ', s, open, ., so, your, pass, can, be, revoked, at, henry, ', s, diskretion, ., its, medical, coercion, ., pass, did, its, job, ,, time, move, #, endthemandates"
2556,"are, you, kidding, there, are, fewer, teachers, getting, covid, because, their, vaccinated, ., students, are, getting, covid, because, they, are, spreading, it, each, other, they, are, under, -, vaccinated, ,, they, don, ’, t, complain, about, wearing, masks, help, us, keep, them, safe"
2557,"over, 90, %, population, bc, is, vaccinated, yet, restrictions, are, still, not, place, ., people, have, been, asked, keep, covering, their, face, shame, as, these, vaccines, may, not, be, useful, ,, as, govt, says"
2558,"90, %, did, not, get, vaccinated, ., if, that, ’, s, true, then, why, is, everything, so, dead, person_facepalminglight_skin_tone, ‍, female_sign, ️, person_facepalminglight_skin_tone, ‍, female_sign, ️, person_facepalminglight_skin_tone, ‍, female_sign, ️, backhand_index_pointing_downmedium_skin_tonebackhand_index_pointing_downmedium_skin_tone, he, ’, s, idiot, ., nice, purple, tie, btw"
2559,"90, percent, canada, is, vaccinated, why, is, there, still, damn, mandate"
2560,"oh, they, ', re, driving, me, crazy, we, ', re, at, least, settling, into, somewhat, night, schedule, i, ', m, grateful, that, they, only, wake, me, up, about, 1, tonight, instead, three, times, now, ."
2561,"thank, you, ., kinda, got, bits, pieces, today, wanted, know, whole, story, ."
2562,"it, is, stupid, assume, some, -, possibly, many, -, those, vaccinated, are, not, sympathetic, those, opposed, mandates, ."
2563,"judge, higginson, ', s, dissent, is, persuasive, ., he, notes, that, anyone, fired, not, being, vaccinated, can, seek, back, pay, get, it, if, her, claim, has, merit, so, why, nationwide, injunction"
2564,"this, is, same, group, that, claims, that, kids, shouldn, ’, t, pause, body, changes, puberty, because, they, ’, ve, not, yet, had, “, lover, ’, s, touch, ”, or, something, like, that, ,, is, it"
2565,"you, asked, if, he, was, vaccinated, everyone, ', s, been, politicizing, covid, thanks, trump"
2566,"he, ', s, big, fan, pascal, ', s, wager, game, theory"
2567,"yes, ,, dear, ., i, know, your, script, ., tell, your, handler, write, new, one, ., get, vaccinated, wear, kn95, ."
2568,"it, ’, s, awesome, ., green_heart"
2569,"exactly, what, ', s, wrong, with, darren, one, best, sportswriters, seattle, sports, scene, has, ever, seen, ., please, explain, what, your, problem, is"
2570,"eva, brown"
2571,"gosh, you, ', re, pretty, flushed_face"
2572,"denmark, is, actually, endemic, with, 1, %, more, vaccinated, 19, %, more, boostered, ., death, rate, similar, flu, now, ,, hospitals, aren, ’, t, overwhelmed, ., opened, up, feb, 1, ."
2573,"well, she, ', s, vaccinated, if, she, got, into, country"
2574,"i, didn, ', t, need, test, take, precaution, getting, vaccinated, ., i, ', ll, take, 97, times, more, likely, survive, possible, illness, ., that, ', s, better, survival, rate, than, seatbelts, severe, accidents, ."
2575,"again, ,, again, i, will, say, it, ,, if, it, really, is, confirmed, that, she, failed, roc, gets, stripped, its, olympic, gold, ,, it, is, not, kamila, who, is, blame, ,, it, ', s, eteri, russian, federation, ."
2576,"even, as, covid, -, 19, cases, drop, washington, state, ,, it, ', s, as, important, as, ever, get, vaccinated, boosted, if, you, haven, ’, t, already, ."
2577,"has, he, confirmed, if, he, ', s, real, doctor, yet, he, would, not, disklose, if, he, has, been, vaccinated, ,, saying, that, is, private, medical, information, ., via"
2578,"yes, even, when, i, ’, m, double, vaccinated"
2579,"i, ', m, sure, he, was, fully, vaccinated, ....., vaxxed, people, are, dropping, like, flies, ..., relieved_face"
2580,"just, google, it, many, ,, many, pieces, this, history, ."
2581,"when, pandemic, is, really, really, more, over, ,, everybody, ’, s, little, kids, have, been, vaccinated, ,, i, swear, i, ’, m, gonna, throw, big, old, pot, -, smoking, whore, party, at, my, house, ,, invite, every, whore, i, know, town, who, likes, weed, ."
2582,"oh, just, get, vaccinated"
2583,"stupidest, thing, he, ', s, said, his, whole, career, ., he, seems, forget, that, his, friends, coworkers, at, tnt, are, all, vaccinated, as, company, policy, ,, they, do, so, his, protection, ."
2584,"once, we, have, 99, %, world, population, fully, vaccinated, boosted, global, case, rate, hovering, around, zero, couple, months, ,, then, we, can, ease, up, slowly, ., anything, less, it, will, just, come, back, again, keep, mutating, killing, ."
2585,"government, :, you, can, ', t, work, unless, you, ', re, vaccinated, ., you, ', re, fired, ., truckers, :, ok, government, :, no, ,, not, like, that, ., #, truckerconvoy2022, #, honkhonk"
2586,"i, no, joke, think, woman, is, intellectually, disabled, ."
2587,"you, forgot, about, fourth, group, :, people, too, stupid, get, vaccine, who, have, now, died, covid, -, 19, ., with, over, 900, ,, 000, dead, this, virus, ,, there, ', s, significant, number, "", former, people, "", that, fourth, group"
2588,"his, whole, identity, is, dependent, upon, signaling, --, through, his, profile, picture, --, that, he, is, both, vaccinated, masked, ."
2589,"if, you, ', re, healthy, or, not, you, should, still, get, vaccine, ., if, you, have, comorbidity, like, obesity, then, yeah, you, need, get, vaccine, ., if, you, have, comorbidity, refuse, get, vaccinated, then, your, chances, death, increase, ."
2590,"implying, liberals, want, perpetual, masking, is, just, another, fox, distortion, ., liberals, want, pandemic, end, ,, which, it, would, if, everyone, got, vaccinated, ."
2591,"those, kids, were, not, preschool, so, were, old, enough, get, vaccinated, ., 5, up, ."
2592,"are, you, totally, ignorant, that, kids, under, 12, are, under, -, vaccinated, as, population, ,, kids, under, 5, can, ’, t, be, vaccinated, yet, ,, all, those, magical, antivirals, you, are, touting, aren, ’, t, approved, kids, are, you, aware, exponential, rise, pediatric, covid, morbidity, this, =, dangerous, ."
2593,"how, are, people, here, canada, more, mad, about, wearing, masks, getting, vaccinated, than, about, fact, that, we, ’, re, still, finding, unmarked, graves"
2594,"whoa, i, ’, m, overwhelmed, with, responses, so, i, ’, m, gonna, mute, this, ,, but, clearly, this, hits, soft, spot, many, people, mask, ,, vaccinate, ,, wait, until, our, young, kids, can, be, vaccinated, please, victory_hand, ️"
2595,"man, i, know, church, passed, away, covid, last, night, ., he, had, been, ventilator, about, 2, weeks, ., i, don, ', t, know, if, he, was, vaccinated, but, he, was, strongly, opposed, masks, ., unfortunately, ,, he, is, no, longer, with, us, ., sad, situation, ."
2596,"british, invasion, ."
2597,"boo, hoo"
2598,"nah, deer, park, island, ., i, only, just, got, vaccinated, so, i, ’, ll, be, prolly, working, hospital, city, few, months"
2599,"what, are, odds, seeing, aurora, scotland, late, may, or, early, june"
2600,"i, have, covid, right, now, ., whole, family, has, it, ., all, fully, vaccinated, ., this, whole, protocol, is, joke, about, money, control, ., these, vaccines, are, garbage, ., how, can, entire, house, that, is, vaccinated, get, covid, like, prarie, fire, rapid, test, showed, negative, 2, days, with, symptoms"
2601,"if, she, doesn, ’, t, get, vaccinated, catches, covid, that, ’, s, consequences, ., right, if, she, gets, vaccinated, catches, covid, that, ’, s, consequence, or, if, she, gets, side, effect, that, ’, s, also, consequence, too, right, ., consequences, are, just, saying, that, future, shit, will, happen, ."
2602,"california, ', s, mask, mandate, expires, next, week, vaccinated, residents, while, statewide, mask, mandate, will, end, vaccinated, residents, ,, that, doesn, ', t, mean, everyone, state, will, be, able, remove, their, masks, indoors, —, even, if, they, ', ve, gotten, shots, ."
2603,"knew, man, that, had, procedure, done, ., saw, him, 2, weeks, later, &, amp, ;, he, was, very, happy, with, his, outcome, ., we, care, -, please, keep, us, apprised"
2604,"barack, /, michelle, obama"
2605,"yes, myself, ,, caught, family, who, was, also, vaccinated, had, got, it, ."
2606,"okay, ,, people, 14th, congressional, district, georgia, ., aren, ’, t, you, embarrassed, by, being, represented, by, marjorie, taylor, greene, i, mean, come, on, ., come, on, ."
2607,"hand_with_fingers_splayed, ️"
2608,"well, well, #, freedomconvoy, your, hero, fvcker, #, tuckercarlson, happens, be, vaccinated, #, traitor"
2609,"tuberville, is, robot, we, ', re, already, there"
2610,"where, can, i, buy, masks, that, have, “, yes, ,, i, am, vaccinated, “, printed, them"
2611,"if, you, can, still, catch, covid, after, you, been, vaccinated, then, it, ’, s, not, vaccine, if, you, can, still, pass, it, somebody, that, is, not, vaccine, so, what, hell, are, you, taking"
2612,"ten, ,, man"
2613,"so, glad, i, ', m, not, only, one"
2614,"rbg, even, listed, pauli, as, co, -, author, because, her, analysis, comes, pauli, ."
2615,"enough, with, political, bs, man, is, gone, his, family, is, devastated, there, ', s, no, need, wonder, if, he, was, vaccinated, or, not, it, doesn, ', t, even, matter"
2616,"no, thé, federal, government, is, gonna, budge, ,, they, don, ’, t, rule, both, borders, ,, majority, truckers, are, vaccinated, ,, this, is, such, bs, waste, time, ."
2617,"kids, getting, more, vaccinated"
2618,"vaccinated, rockford, students, receive, $, 50, gift, cards"
2619,"there, is, group, mentioned, wapo, liberal, moms, trying, fight, back, ., where, i, am, only, 11, %, 5, -, 11, yr, olds, are, vaccinated, so, i, assume, parents, are, overwhelmingly, rw, extremists, and, /, or, they, don, ', t, care, about, their, kids, ., so, not, sure, how, it, would, play, sc, ."
2620,"my, brother, -, in, -, law, was, immunosuppressants, degenerative, bone, disease, before, contracting, delta, last, fall, ., he, had, been, vaccinated, ., he, was, just, diagnosed, with, diabetes, with, no, history, blood, sugar, issues, ., doctors, nurses, said, it, was, covid, related, ."
2621,"we, are, 81, %, vaccinated, with, 2, doses, across, this, country, just, under, 50, %, boosted, across, country, we, are, 3rd, highest, country, world, ., it, ’, s, time, end, restrictions, get, back, normal, ., don, ’, t, be, obtuse, ."
2622,"most, infectious, phase, covid, no, ice, trucks, ., thank, goodness, donald, trump, everybody, got, vaccinated, .., amirite"
2623,"trudeau, himself, stated, 90, %, canadians, are, vaccinated, science, has, shown, that, we, should, be, amaizing, now, if, 90, %, are, vaccinated, so, are, we, really, following, science, anymorethinking_face"
2624,"must, watch, again, ..., but, be, careful, ..., don, ', t, let, #, gazpachopolice, hear, this, you, might, get, tomato, ', d"
2625,"their, metrics, are, outdated, purposely, obstinate, ,, especially, adding, 8, -, week, window, 0, -, 5, getting, vaccinated, ., i, don, ’, t, think, masking, is, going, away, schools, anytime, soon, ,, but, la, will, look, stupid, having, mandate, when, infection, curve, is, same, with, states, w, /, o, them"
2626,"awful, lot, young, athletes, former, athletes, dying, …, one, thing, common, :, they, ’, re, vaccinated"
2627,rolling_on_the_floor_laughingrolling_on_the_floor_laughingrolling_on_the_floor_laughingrolling_on_the_floor_laughingrolling_on_the_floor_laughingrolling_on_the_floor_laughing
2628,slightly_smiling_facehugging_facedog_facegrinning_catcat_with_wry_smile
2629,yesterday
2630,"i, don, ', t, know, rate, ottawa, ,, but, it, is, not, mandatory, which, is, point, contention, ., majority, truckers, are, vaccinated, ."
2631,"just, found, out, my, 49, year, old, friend, spent, 4, days, hospital, with, covid, ., she, was, vaccinated, +, booster, ."
2632,"please, do, share, what, science, you, have, support, your, conclusion, that, vaccines, have, failed, ., peer, reviewed, science, ., most, studies, i, ’, ve, seen, have, unequivocally, demonstrated, that, vaccinated, folk, are, significantly, less, likely, get, covid, ,, have, lower, viral, load, if, they, do, get, it, …"
2633,"i, am, sorry, pensive_face, ., i, hope, you, are, vaccinated, four_leaf_cloverred_heart, ️"
2634,"covid, loves, vaxxed, &, amp, ;, boosted, people, with, no, pre, -, existing, conditions, people, who, have, followed, cdc, guidelines, &, amp, ;, local, mandates, 2, years, &, amp, ;, whose, entire, family, has, stayed, healthy, why, get, vaccinated, at, all, if, you, think, i, should, live, fear, forever, anyway, ,, why, bother"
2635,"every, other, problem, you, named, is, pandemic, related, biden, ', s, policies, did, not, make, them, worse, ., people, who, refuse, get, vaccinated, fight, masks, at, every, possible, turn, are, what, is, making, them, worse, ."
2636,"when, washington, lifted, mask, mandate, ,, i, still, was, required, wear, mask, at, work, ,, but, i, did, enjoy, not, having, wear, one, ,, because, at, this, point, ,, vaccinated, ,, boosted, ., you, want, get, covid, that, ', s, your, problem, ,, but, i, would, keep, mask, handy, upon, request, others, ."
2637,"tell, him, ask, professor, if, they, ’, re, vaccinated, face_with_raised_eyebrow"
2638,"he, thinks, it, ', s, hippa, violation, rolling_on_the_floor_laughingrolling_on_the_floor_laughing"
2639,"imagine, thinking, truckers, who, spend, 99, %, their, time, alone, cab, their, truck, need, be, vaccinated, ., cc, :"
2640,"family, doctors, ,, dentists, ,, massage, therapists, ,, physiotherapists, all, other, regulated, health, care, workers, b, ., c, ., must, be, vaccinated, against, covid, -, 19, by, march, 24, ."
2641,"i, do, but, it, pisses, me, off, that, we, are, this, situation, which, i, believe, would, have, had, better, outcome, if, more, people, got, vaccinated, wore, masks, ."
2642,"sc, passed, open, carry, ., someone, @, local, walmart, pulled, out, his, gun, &, amp, ;, waved, it, around, ., pass, open, carry, &, amp, ;, that, ', s, gonna, happen, ., not, sure, where, this, is, all, going, lead, ."
2643,"there, are, better, ways, handle, this, ., i, don, ', t, think, any, government, should, bargain, with, these, road, hogs, ."
2644,"i, also, blame, advertisement, fortune, you, got, your, fortune, cookie, several, weeks, ago, ., it, was, catching, up, you, ."
2645,"dolly, parton, is, angel, heaven"
2646,"i, think, you, ’, re, probably, asking, question, about, your, conspiracy, theory, ., what, do, you, mean, by, “, woke, ”, what, do, you, mean, by, “, limiting, principle, ”"
2647,"you, know, what, is, violence, against, women, stripping, away, child, tax, credit, because, you, believe, women, use, that, money, their, drugs, ., pathetic, ."
2648,"calling, #, reggaegirlz, fans, government, has, given, jff, approval, up, 2, ,, 500, fully, vaccinated, fans, support, team, their, crucial, world, cup, qualifier, against, bermuda, next, thursday, february, 17, at, 7pm, at, national, stadium"
2649,"you, seriously, that, gullible, just, think, they, develop, vaccine, virus, that, ’, s, 3, months, old, then, roll, out, biggest, trial, ever, with, no, safety, data, or, animal, testing, that, ’, s, not, smart, at, all, get, hiv, test, vaccinated, people, are, testing, positive"
2650,"im, fully, vaccinated, understand, peoples, frustration, ., as, long, as, protest, is, peaceful, i, don, ’, t, care, neither, nor, ."
2651,"exactly, ., wish, they, would, learn, cases, always, spike, around, holidays, big, events, ., we, ', ll, see, cases, spike, after, super, bowl, ,, &, amp, ;, during, spring, break, where, lot, young, people, ,, who, still, aren, ', t, vaccinated, will, be, traveling, abroad, ., more, super, spreaders, events, are, coming"
2652,"sorry, hear, that, ., i, am, guessing, it, is, due, covid, they, were, not, careful, or, vaccinated"
2653,"you, realize, vaccinated, people, spread, virus, right"
2654,"you, can, read, it, while, eating, some, gazpacho, soup, ."
2655,"unpopular, opinion, give, people, who, are, double, vaccinated, tax, break, doing, what, they, ', ve, been, asked, doing, their, best, end, pandemic, ., people, don, ', t, want, be, vaccinated, alright, they, don, ', t, have, be, ,, they, ', re, only, ones, at, risk, after, all, ."
2656,"why, are, so, many, fully, “, vaccinated, ”, canadians, afraid, lifting, restrictions, #, covid19ab, #, covid19, #, cdnpoli, #, canada, #, omicron"
2657,"firm, believer, bible, &, amp, ;, book, revelations, ,, mark, beast, every, living, person, will, be, required, be, marked, they, ', re, already, denying, surgeries, etc, not, being, vaccinated, when, its, ur, choice, ., my, opinion, but, if, u, dont, see, what, ', s, happening, our, planet, ur, f, ***, blind"
2658,"matte, would, make, it, more, obvious, that, it, ’, s, brand, new, book, not, something, still, shelves, decades, ago, …"
2659,"only, if, there, ', s, soup, ., will, there, be, soup"
2660,"not, be, confused, with, bouillabaisse, state, troopers, …"
2661,"seriously, did, anyone, expect, dr, death, reveal, anything, related, vaccines, or, covid, -, 19"
2662,"ok, why, has, this, knuckedragger, suddenly, become, imfamous"
2663,"i, hope, this, does, not, happen, ., if, valieva, is, indeed, found, have, been, doping, ,, it, is, eteri, her, system, yes, ,, russian, federation, who, need, pay, --, not, 15, -, year, -, old, girl, who, may, be, taking, pills, she, was, told, were, "", vitamins, "", all, we, know, ."
2664,"rant, :, i, think, anyone, who, doesn, ', t, get, vaccinated, is, fucking, idiot, ., why, wouldn, ', t, you, willingly, want, protect, yourself, more, importantly, loved, ones, ., i, also, feel, that, nothing, should, be, forced, ., i, feel, anti, vaxrs, should, be, able, live, their, flat, earth, ..., fuck"
2665,"this, is, sick, ., compliance, is, at, 90, %, they, are, still, kicking, out, remaining, 10, %., it, ’, s, not, about, health, people, ,, they, won, ’, t, stop, until, they, have, every, kid, vaccinated, ."
2666,"it, ’, s, absurd, that, kids, ca, still, have, mask, all, day, at, schools, even, though, they, are, at, lower, risk, than, adults, over, 95, %, students, are, vaccinated, at, our, local, high, school, ., newsom, should, follow, nj, governor, ’, s, lead, make, masking, optional, schools, beginning, march, ."
2667,"only, police, marco, know, is, gazpacho, police, ."
2668,"this, is, only, 12, +,, so, far, la, county, only, has, ~, 20, %, 5, -, 11, yos, fully, vaccinated, ., where, will, those, tens, thousands, students, go, if, pan, ’, s, bill, is, passed"
2669,"yeah, ,, that, was, done, during, his, surgery, because, at, time, it, was, unknown, if, he, could, be, socialized, or, would, need, be, rereleased, ., if, latter, ear, tip, ,, which, is, painless, cat, ,, is, best, way, indicate, others, he, has, been, neutered, &, amp, ;, vaccinated, ."
